index,url,valid,domain,title,description,image,published,archive,content,quote,language,keyword
https://www.zeit.de/news/2024-11/08/selenskyj-kein-waffenstillstand-ohne-sicherheitsgarantien,https://www.zeit.de/news/2024-11/08/selenskyj-kein-waffenstillstand-ohne-sicherheitsgarantien,0,www.zeit.de,Die Lage im Überblick: Selenskyj: Kein Waffenstillstand ohne Sicherheitsgarantien,Hier finden Sie Informationen zu dem Thema „Die Lage im Überblick“. Lesen Sie jetzt „Selenskyj: Kein Waffenstillstand ohne Sicherheitsgarantien“.,https://img.zeit.de/news/2024-11/08/selenskyj-kein-waffenstillstand-ohne-sicherheitsgarantien-image-group/wide__1300x731,2024-11-08T04:00:38Z,,"Ein Waffenstillstand im Krieg mit Russland kommt für den ukrainischen Präsidenten Wolodymyr Selenskyj ohne Sicherheitsgarantien für die Ukraine nicht infrage. «Ein Waffenstillstand wird dann kommen, … [+6446 chars]",,de,'Waffen'
https://www.tagesspiegel.de/internationales/die-lage-im-uberblick-selenskyj-kein-waffenstillstand-ohne-sicherheitsgarantien-12669446.html,https://www.tagesspiegel.de/internationales/die-lage-im-uberblick-selenskyj-kein-waffenstillstand-ohne-sicherheitsgarantien-12669446.html,0,www.tagesspiegel.de,Die Lage im Überblick: Selenskyj: Kein Waffenstillstand ohne Sicherheitsgarantien,Im Abwehrkampf gegen die russische Armee lehnt der ukrainische Präsident einen bedingungslosen Waffenstillstand ab. Und für neue Waffenkäufe hat er eine Idee.,https://www.tagesspiegel.de/images/12669437/alternates/BASE_16_9_W1400/1731038538000/treffen-der-europaischen-politischen-gemeinschaft.jpeg,2024-11-08T04:02:18Z,,"Ein Waffenstillstand im Krieg mit Russland kommt für den ukrainischen Präsidenten Wolodymyr Selenskyj ohne Sicherheitsgarantien für die Ukraine nicht infrage. Ein Waffenstillstand wird dann kommen, w… [+5654 chars]",,de,'Waffen'
https://www.diepresse.com/18963347/putin-will-mit-trump-sprechen-fed-senkt-die-zinsen-schoenbrunn-im-neuen-adventkleid,https://www.diepresse.com/18963347/putin-will-mit-trump-sprechen-fed-senkt-die-zinsen-schoenbrunn-im-neuen-adventkleid,0,www.diepresse.com,Putin will mit Trump sprechen – Fed senkt die Zinsen –Schönbrunn im neuen Adventkleid,Wir starten mit Ihnen in den Nachrichtentag und geben Ihnen einen schnellen Überblick über die wichtigsten Themen des Morgens.,https://www.diepresse.com/assets_v2/images/diepresse_nachrichten.png,2024-11-08T04:04:50Z,,"Wir starten mit Ihnen in den Nachrichtentag und geben Ihnen einen schnellen Überblick über die wichtigsten Themen des Morgens. 
Putin will mit Trump sprechen: Nach dem Wahlsieg von Donald Trump zeig… [+2713 chars]",,de,'Putin'
https://www.nzz.ch/pro/militaerhilfe-fuer-ukraine-warum-deutschland-nicht-liefern-kann-ld.1856239,https://www.nzz.ch/pro/militaerhilfe-fuer-ukraine-warum-deutschland-nicht-liefern-kann-ld.1856239,0,www.nzz.ch,Mehr deutsche Waffen für die Ukraine? Wenn die Bundeswehr doch nur welche hätte,"Deutschland rüstet wie zu Friedenszeiten. Was sich ändern muss, damit das Land seiner Verantwortung für den Kontinent gerecht werden kann.","https://img.nzz.ch/2024/11/06/128a7946-db2f-4e0a-a10b-28abe51a0bb5.jpeg?width=1200&height=675&fit=bounds&quality=75&auto=webp&crop=4512,2538,x0,y235&wmark=nzz",2024-11-08T04:30:00Z,http://archive.md/20241108062941/https://www.nzz.ch/pro/militaerhilfe-fuer-ukraine-warum-deutschland-nicht-liefern-kann-ld.1856239,"Viele Männer für wenig Gerät: Ukrainische Soldaten trainieren auf einer deutschen Militärbasis in Klietz im Februar 2024 den Umgang mit einem Leopard-Panzer.
Es sieht nicht gut aus für die Ukraine. … [+6627 chars]",,de,'Waffen'
https://www.zeit.de/politik/2024-11/gipfel-budapest-europa-nachrichtenpodcast,https://www.zeit.de/politik/2024-11/gipfel-budapest-europa-nachrichtenpodcast,0,www.zeit.de,Gipfel in Budapest: Europa zwischen Trump und Putin,Staats- und Regierungschefs aus ganz Europa beraten in Budapest. Was bedeuten die Wahl Trumps und das Ampel-Aus für die EU? Und: Russland freut sich über Trumps Sieg.,https://img.zeit.de/politik/2017-09/illu-podcast-news/wide__8ed8a6__1300x731,2024-11-08T04:57:38Z,,"Aus ganz Europa kamen am Donnerstag Staats- und Regierungschefs in der ungarischen Hauptstadt Budapest zusammen, um am Gipfel der Europäischen Politischen Gemeinschaft (EPG) teilzunehmen. Das Ergebni… [+2767 chars]",,de,'Russland'
https://www.diepresse.com/18963347/putin-will-mit-trump-sprechen-usa-bekommen-erste-stabschefin-drohen-in-berlin-oesterreichische-zustaende,https://www.diepresse.com/18963347/putin-will-mit-trump-sprechen-usa-bekommen-erste-stabschefin-drohen-in-berlin-oesterreichische-zustaende,0,www.diepresse.com,Putin will mit Trump sprechen – USA bekommen erste Stabschefin – Drohen in Berlin „österreichische Zustände“?,Wir starten mit Ihnen in den Nachrichtentag und geben Ihnen einen schnellen Überblick über die wichtigsten Themen des Morgens.,https://www.diepresse.com/assets_v2/images/diepresse_nachrichten.png,2024-11-08T05:25:52Z,,"Wir starten mit Ihnen in den Nachrichtentag und geben Ihnen einen schnellen Überblick über die wichtigsten Themen des Morgens. 
Putin will mit Trump sprechen: Nach dem Wahlsieg von Donald Trump zeig… [+2753 chars]",,de,'Putin'
https://www.zeit.de/news/2024-11/08/explosion-vor-einfamilienhaus-im-koelner-stadtteil-meschenich,https://www.zeit.de/news/2024-11/08/explosion-vor-einfamilienhaus-im-koelner-stadtteil-meschenich,0,www.zeit.de,53-Jährige leicht verletzt: Explosion vor Einfamilienhaus im Kölner Stadtteil Meschenich,Hier finden Sie Informationen zu dem Thema „53-Jährige leicht verletzt“. Lesen Sie jetzt „Explosion vor Einfamilienhaus im Kölner Stadtteil Meschenich“.,https://img.zeit.de/news/2024-11/08/explosion-vor-einfamilienhaus-im-koelner-stadtteil-meschenich-image-group/wide__1300x731,2024-11-08T05:44:38Z,https://web.archive.org/web/20241109080433/https://www.zeit.de/news/2024-11/08/explosion-vor-einfamilienhaus-im-koelner-stadtteil-meschenich,"Im Kölner Stadtteil Meschenich ist es an einem Einfamilienhaus zu einer Explosion gekommen. Gemeldet worden sei die Detonation an der Treppe zu dem Haus in der Nacht zum Freitag von einer Bewohnerin,… [+521 chars]",,de,'Explosion'
https://www.stern.de/wirtschaft/fenster-abdichten--so-reduzieren-sie-den-energie--und-waermeverlust-9434330.html,https://www.stern.de/wirtschaft/fenster-abdichten--so-reduzieren-sie-den-energie--und-waermeverlust-9434330.html,0,www.stern.de,Energie sparen: Fenster abdichten: So bleibt die Kälte draußen – und die Wärme drinnen,"Wenn es draußen kälter wird, startet in vielen Haushalten die Heizsaison. Doch trotz der künstlich erzeugten Wärme kann es in manchen Räumen ziehen, insbesondere in Fensternähe.",https://image.stern.de/9434980/t/yj/v3/w1440/r1.7778/-/gummidichtung-neu.jpg,2024-11-08T06:29:00Z,,"Kopiere den aktuellen Link
Wenn es draußen kälter wird, startet in vielen Haushalten die Heizsaison. Doch trotz der künstlich erzeugten Wärme kann es in manchen Räumen ziehen, insbesondere in Fenste… [+6413 chars]",,de,'Kälte'
https://www.basicthinking.de/blog/2024/11/08/automatisierung-im-it-service-management/,https://www.basicthinking.de/blog/2024/11/08/automatisierung-im-it-service-management/,0,www.basicthinking.de,Effizienz steigern & Kosten senken: Automatisierung im IT-Service-Management,"Wenig andere Branchen verhelfen Unternehmen zu so viel Automatisierung und Digitalisierung wie das IT Service Management. Klar ist, dass entsprechende Dienstleister selbst so viel wie möglich ihres eigenen Betriebs automatisieren wollen. Alles andere stünde i…",https://www.basicthinking.de/blog/wp-content/uploads/2024/11/service-3274892_1280.jpg,2024-11-08T08:30:06Z,,"Wenig andere Branchen verhelfen Unternehmen zu so viel Automatisierung und Digitalisierung wie das IT Service Management. Klar ist, dass entsprechende Dienstleister selbst so viel wie möglich ihres e… [+4520 chars]",,de,'Kosten'
https://www.focus.de/panorama/polizei-warnt-suedkalifornier-affen-entkommen-aus-forschungseinrichtung_id_260462993.html,https://www.focus.de/panorama/polizei-warnt-suedkalifornier-affen-entkommen-aus-forschungseinrichtung_id_260462993.html,0,www.focus.de,Tierische Flucht - Affen entkommen aus Forschungseinrichtung in Kalifornien,"In Yemassee, South Carolina, sind 40 Affen aus einer großen Forschungseinrichtung ausgebrochen.",https://p6.focus.de/img/fotos/id_260462967/gettyimages-2166994765.jpg?im=Crop%3D%280%2C289%2C3463%2C1731%29%3BResize%3D%281200%2C627%29&impolicy=perceptual&quality=mediumHigh&hash=358a004bf1970766c3b6ce18272a0eb9db450cc156a000b349fe1f582dcf0f2d,2024-11-08T09:59:39Z,,"In Yemassee, South Carolina, sind 40 Affen aus einer großen Forschungseinrichtung ausgebrochen.In Yemassee, South Carolina, sind 40 Affen aus der Forschungseinrichtung Alpha Genesis entflohen. Die Be… [+1513 chars]",,de,'Flucht'
https://www.tagesspiegel.de/politik/pflegeversicherung-teure-pflege-beitragssatz-steigt-um-02-prozentpunkte-12672785.html,https://www.tagesspiegel.de/politik/pflegeversicherung-teure-pflege-beitragssatz-steigt-um-02-prozentpunkte-12672785.html,0,www.tagesspiegel.de,"Pflegeversicherung: Teure Pflege: Beitragssatz steigt um 0,2 Prozentpunkte",Die Kosten für die Pflege steigen immer weiter. Versicherte und Arbeitgeber müssen deshalb im kommenden Jahr draufzahlen.,https://www.tagesspiegel.de/images/12674117/alternates/BASE_16_9_W1400/1731076091000/bundesgesundheitsminister-lauterbach-zum-pflegebeitragssatz.jpeg,2024-11-08T12:34:33Z,,"Versicherte und Arbeitgeber werden im neuen Jahr nicht nur spürbar mehr Geld für die Krankenkasse, sondern auch mehr für die Pflegeversicherung bezahlen müssen. Der Beitragssatz soll nach Angaben von… [+3701 chars]",,de,'Kosten'
https://www.diepresse.com/19047291/spengler-bangen-wegen-gesetzesbeschluss-um-ihre-existenz,https://www.diepresse.com/19047291/spengler-bangen-wegen-gesetzesbeschluss-um-ihre-existenz,0,www.diepresse.com,Spengler bangen wegen Gesetzesbeschluss um ihre Existenz,"Durch einen Gesetzesbeschluss werden Spenglereien größtenteils dem Bau zugerechnet und sollen auch dessen Regelungen zu Urlaub, Abfertigung und Überbrückungsgeldern übernehmen. Dadurch entstehen enorme Kosten.",https://img.diepresse.com/public/incoming/zg6wdx-231654596.jpg/alternates/DPR_SOCIAL_NACHRICHTEN/231654596.jpg,2024-11-08T12:46:08Z,,"Durch einen Gesetzesbeschluss werden Spenglereien größtenteils dem Bau zugerechnet und sollen auch dessen Regelungen zu Urlaub, Abfertigung und Überbrückungsgeldern übernehmen. Dadurch entstehen enor… [+5980 chars]",,de,'Kosten'
https://www.macerkopf.de/2024/11/08/exklusiv-apple-music-stieber-twins/,https://www.macerkopf.de/2024/11/08/exklusiv-apple-music-stieber-twins/,0,www.macerkopf.de,Exklusiv auf Apple Music: Stieber Twins „Fenster zum Hof“,"Solltet ihr bei der Überschrift gehofft haben, dass die Stieber Twins ein neues Album herausgebracht haben, so müssen wir euch leider enttäuschen. Fans der Hip Hop Kombi kommen ab sofort bei Aple Music trotzdem auf ihre Kosten. Das wegweisende Hip-Hop-Album d…",https://www.macerkopf.de/wp-content/uploads/2024/11/apple_music_stieber_twins_fenster_zum_hof.jpg,2024-11-08T14:00:18Z,,"Solltet ihr bei der Überschrift gehofft haben, dass die Stieber Twins ein neues Album herausgebracht haben, so müssen wir euch leider enttäuschen. Fans der Hip Hop Kombi kommen ab sofort bei Aple Mus… [+2002 chars]",,de,'Kosten'
https://www.faz.net/aktuell/politik/us-wahl/liveticker-us-wahl-2024-usa-iran-hat-mordanschlag-auf-trump-in-auftrag-gegeben-19444916.html,https://www.faz.net/aktuell/politik/us-wahl/liveticker-us-wahl-2024-usa-iran-hat-mordanschlag-auf-trump-in-auftrag-gegeben-19444916.html,0,www.faz.net,Liveblog zur US-Wahl 2024: USA: Iran hat Mordanschlag auf Trump in Auftrag gegeben,Trump gewinnt auch im „Swing State“ Nevada +++ Trump und Putin zeigen Bereitschaft zu Gespräch +++ Scholz: Europa muss weiter eng mit den USA kooperieren +++ Alle Neuigkeiten im Liveblog,https://media1.faz.net/ppmedia/aktuell/1224727332/1.10100457/facebook_teaser/donald-trump-haette-laut-us.jpg,2024-11-08T20:01:27Z,,"Die iranische Regierung soll kurz vor der Wahl einen Mordanschlag auf Donald Trump in Auftrag gegeben haben. Wie die Staatsanwaltschaft in Manhattan am Freitag bekanntgab, wurde ein Mann wegen Auftra… [+1530 chars]",,de,'Putin'
https://www.faz.net/aktuell/politik/us-wahl/liveticker-us-wahl-2024-bericht-trump-bereitet-ausstieg-aus-pariser-klimaschutzabkommen-vor-19444916.html,https://www.faz.net/aktuell/politik/us-wahl/liveticker-us-wahl-2024-bericht-trump-bereitet-ausstieg-aus-pariser-klimaschutzabkommen-vor-19444916.html,0,www.faz.net,Liveblog zur US-Wahl 2024: Bericht: Trump bereitet Ausstieg aus Pariser Klimaschutzabkommen vor,Iran soll Mordanschlag auf Trump in Auftrag gegeben haben +++ Trump gewinnt auch im „Swing State“ Nevada +++ Trump und Putin zeigen Bereitschaft zu Gespräch +++ Alle Neuigkeiten im Liveblog,https://media1.faz.net/ppmedia/aktuell/politik/us-wahl/963720217/1.10100757/facebook_teaser/der-damalige-us-praesident.jpg,2024-11-08T20:01:27Z,,"Die iranische Regierung soll kurz vor der Wahl einen Mordanschlag auf Donald Trump in Auftrag gegeben haben. Wie die Staatsanwaltschaft in Manhattan am Freitag bekanntgab, wurde ein Mann wegen Auftra… [+1530 chars]",,de,'Putin'
https://www.bild.de/politik/ausland-und-internationales/ukraine-krieg-dreier-telefonat-zwischen-trump-musk-und-selenskyj-672e6f0eebdb8724738eca32,https://www.bild.de/politik/ausland-und-internationales/ukraine-krieg-dreier-telefonat-zwischen-trump-musk-und-selenskyj-672e6f0eebdb8724738eca32,0,www.bild.de,"Ukraine bekam Versprechen - Dreier-Telefonat von Trump, Musk und Selenskyj","Plötzlich reichte Trump den Hörer weiter, nachdem ihm Selenskyj zum Wahlsieg gratuliert hatte.","https://images.bild.de/672e6f0eebdb8724738eca32/3c1058183508acb07264efbd7e85944c,3f2c6ff8?w=1280",2024-11-08T21:17:58Z,,Plötzlich reichte er den Hörer weiter: Donald Trump (78) hat kurz nach seinem Wahlsieg mit Ukraine-Präsident Wolodymyr Selenskyj (46) telefoniert. Jetzt kommt raus: Auch Tesla-Boss Elon Musk (53) war… [+2376 chars],,de,'Ukraine'
https://www.telepolis.de/features/US-Think-Tank-Ukraine-dem-Untergang-geweiht-10009527.html,https://www.telepolis.de/features/US-Think-Tank-Ukraine-dem-Untergang-geweiht-10009527.html,0,www.telepolis.de,US-Think-Tank: Ukraine dem Untergang geweiht,Der wichtigste konservative US-Think-Tank sieht die Ukraine vor dem Aus. Die Gründe sind dramatisch. Was das für die künftige Trump-Regierung und den Krieg bedeutet.,https://heise.cloudimg.io/bound/1200x1200/q85.png-lossy-85.webp-lossy-85.foil1/_www-heise-de_/imgs/18/4/7/0/4/1/6/4/f767445b4d7eb16c.jpg,2024-11-08T23:00:00Z,https://web.archive.org/web/20241109103943/https://www.telepolis.de/features/US-Think-Tank-Ukraine-dem-Untergang-geweiht-10009527.html,"Der wichtigste konservative US-Think-Tank sieht die Ukraine vor dem Aus. Die Gründe sind dramatisch. Was das für die künftige Trump-Regierung und den Krieg bedeutet.
Das ""America First Policy Instit… [+6421 chars]",,de,'Putin'
https://www.n-tv.de/politik/18-04-Ukrainische-Ermittler-untersuchen-Absturz-von-F-16-Kampfjet--article23143824.html,https://www.n-tv.de/politik/18-04-Ukrainische-Ermittler-untersuchen-Absturz-von-F-16-Kampfjet--article23143824.html,0,www.n-tv.de,Ukraine-Krieg im Liveticker: +++ 17:37 Kiew will Treffen Selenskyjs mit Trump vorbereiten +++,Lesen Sie alle aktuellen Entwicklungen und Nachrichten über den russischen Angriffskrieg auf die Ukraine im Liveticker von ntv.de.,https://bilder3.n-tv.de/img/incoming/crop25117070/4231326595-cImg_16_9-w1200/Ukraine-Liveticker.jpg,2024-11-08T23:05:00Z,,"Ukrainische Ermittler führen eine Untersuchung zu den Umständen des Absturzes des F-16-Kampfjets durch, bei dem ein ukrainischer Pilot ums Leben kam. Insgesamt wurden elf forensische Sachverständige … [+24700 chars]",,de,'Putin'
https://www.n-tv.de/politik/15-45-Vizeaussenminister-Russland-offen-fuer-Trumps-Vorschlaege-zur-Ukraine--article23143824.html,https://www.n-tv.de/politik/15-45-Vizeaussenminister-Russland-offen-fuer-Trumps-Vorschlaege-zur-Ukraine--article23143824.html,0,www.n-tv.de,Ukraine-Krieg im Liveticker: +++ 15:45 Vizeaußenminister: Russland offen für Trumps Vorschläge zur Ukraine +++,Lesen Sie alle aktuellen Entwicklungen und Nachrichten über den russischen Angriffskrieg auf die Ukraine im Liveticker von ntv.de.,https://bilder3.n-tv.de/img/incoming/crop25117070/4231326595-cImg_16_9-w1200/Ukraine-Liveticker.jpg,2024-11-08T23:05:00Z,,"Russland hat nach dem Wahlsieg von Donald Trump Gesprächsbereitschaft mit dem designierten US-Präsidenten in Sachen Ukraine signalisiert. Die Regierung in Moskau sei bereit, sich Trumps Vorschläge zu… [+21595 chars]",,de,'Putin'
https://www.n-tv.de/politik/22-16-Oktober-war-wohl-toedlichster-Monat-fuer-russische-Armee--article23143824.html,https://www.n-tv.de/politik/22-16-Oktober-war-wohl-toedlichster-Monat-fuer-russische-Armee--article23143824.html,0,www.n-tv.de,Ukraine-Krieg im Liveticker: +++ 22:16 Oktober war wohl tödlichster Monat für russische Armee +++,Lesen Sie alle aktuellen Entwicklungen und Nachrichten über den russischen Angriffskrieg auf die Ukraine im Liveticker von ntv.de.,https://bilder3.n-tv.de/img/incoming/crop25117070/4231326595-cImg_16_9-w1200/Ukraine-Liveticker.jpg,2024-11-08T23:05:00Z,,"Wie der britische Verteidigungsminister in einem Interview berichtet, hatten die russischen Streitkräfte in der Ukraine den tödlichsten Monat seit Beginn des Kriegs zu verzeichnen. In einem Gespräch … [+28837 chars]",,de,'Ukraine'
https://www.n-tv.de/politik/16-58-Ukraine-berichtet-von-erfolgreichen-Drohnenangriffen--article23143824.html,https://www.n-tv.de/politik/16-58-Ukraine-berichtet-von-erfolgreichen-Drohnenangriffen--article23143824.html,0,www.n-tv.de,Ukraine-Krieg im Liveticker: +++ 16:58 Ukraine berichtet von erfolgreichen Drohnenangriffen +++,Lesen Sie alle aktuellen Entwicklungen und Nachrichten über den russischen Angriffskrieg auf die Ukraine im Liveticker von ntv.de.,https://bilder3.n-tv.de/img/incoming/crop25117070/4231326595-cImg_16_9-w1200/Ukraine-Liveticker.jpg,2024-11-08T23:05:00Z,,Der ukrainische Armeechef Olexander Syrskyj hat von erfolgreichen Einsätzen seiner Drohnentruppe im Oktober gesprochen. Bei einem Treffen mit den Kommandeuren der Drohnentruppen seien die Ergebnisse … [+23077 chars],,de,'Ukraine'
https://www.n-tv.de/politik/14-32-Moskau-will-massiven-Ol-Konzern-schmieden-und-damit-die-Kriegswirtschaft-ankurbeln--article23143824.html,https://www.n-tv.de/politik/14-32-Moskau-will-massiven-Ol-Konzern-schmieden-und-damit-die-Kriegswirtschaft-ankurbeln--article23143824.html,0,www.n-tv.de,Ukraine-Krieg im Liveticker: +++ 14:32 Moskau will massiven Öl-Konzern schmieden und damit die Kriegswirtschaft ankurbeln +++,Lesen Sie alle aktuellen Entwicklungen und Nachrichten über den russischen Angriffskrieg auf die Ukraine im Liveticker von ntv.de.,https://bilder3.n-tv.de/img/incoming/crop25117070/4231326595-cImg_16_9-w1200/Ukraine-Liveticker.jpg,2024-11-08T23:05:00Z,,Moskau arbeitet an einer Fusion seiner größten Ölgesellschaften und will so einen nationalen Champion schaffen. Das würde den Einfluss von Präsident Wladimir Putin auf die globalen Energiemärkte und … [+19966 chars],,de,'Ukraine'
https://www.n-tv.de/politik/19-36-Ukraine-Russland-intensiviert-Rekrutierungsbemuehungen-in-Afrika--article23143824.html,https://www.n-tv.de/politik/19-36-Ukraine-Russland-intensiviert-Rekrutierungsbemuehungen-in-Afrika--article23143824.html,0,www.n-tv.de,"Ukraine-Krieg im Liveticker: +++ 18:44 Ukraines Außenminister: Trump-Sieg bringt ""Hoffnung und eine Chance"" +++",Lesen Sie alle aktuellen Entwicklungen und Nachrichten über den russischen Angriffskrieg auf die Ukraine im Liveticker von ntv.de.,https://bilder3.n-tv.de/img/incoming/crop25117070/4231326595-cImg_16_9-w1200/Ukraine-Liveticker.jpg,2024-11-08T23:05:00Z,,"Ukrainischen Geheimdiensten zufolge soll Russland immer intensiver versuchen, Soldaten aus anderen Ländern zu rekrutieren. In einem Videobeitrag auf X gibt das britische Verteidigungsministerium an, … [+26026 chars]",,de,'Putin'
https://www.n-tv.de/politik/23-27-Russlands-Innenministerium-soll-noch-haerter-gegen-Extremismus-vorgehen--article23143824.html,https://www.n-tv.de/politik/23-27-Russlands-Innenministerium-soll-noch-haerter-gegen-Extremismus-vorgehen--article23143824.html,0,www.n-tv.de,"Ukraine-Krieg im Liveticker: +++ 23:27 Russlands Innenministerium soll noch härter gegen ""Extremismus"" vorgehen +++",Lesen Sie alle aktuellen Entwicklungen und Nachrichten über den russischen Angriffskrieg auf die Ukraine im Liveticker von ntv.de.,https://bilder3.n-tv.de/img/incoming/crop25117070/4231326595-cImg_16_9-w1200/Ukraine-Liveticker.jpg,2024-11-08T23:05:00Z,,"Russlands Präsident Putin weist sein Innenministerium an, die Anstrengungen zur Bekämpfung des ""Extremismus"" im Land zu verstärken. ""Heute erwarten die russischen Bürger von Ihnen mehr Engagement und… [+29461 chars]",,de,'Ukraine'
https://www.morgenpost.de/politik/article407645471/selenskyj-findet-anschluss-an-trump-clan-dank-elon-musk.html,https://www.morgenpost.de/politik/article407645471/selenskyj-findet-anschluss-an-trump-clan-dank-elon-musk.html,0,www.morgenpost.de,Selenskyj findet Anschluss an Trump-Clan – dank Elon Musk?,"Die Ukraine ist auf zwei Männer angewiesen, die gerade die USA rocken: Donald Trump und Elon Musk. Selenskyj findet Anschluss, buchstäblich.",https://img.sparknews.funkemedien.de/407645516/407645516_1731107352_v16_9_1600.jpeg,2024-11-09T00:27:55Z,,"San Francisco. Die Ukraine ist auf zwei Männer angewiesen, die gerade die USA rocken: Trump und Musk. Selenskyj findet Anschluss, buchstäblich.
Wolodymyr Selenskyj gerät ins Schwärmen, wenn er über … [+5237 chars]",,de,'Putin'
https://www.stern.de/politik/ausland/lage-im-ueberblick--nach-trumps-wahlsieg--selenskyj-mahnt-europaeer-zur-einheit-35213738.html,https://www.stern.de/politik/ausland/lage-im-ueberblick--nach-trumps-wahlsieg--selenskyj-mahnt-europaeer-zur-einheit-35213738.html,0,www.stern.de,Lage im Überblick: Nach Trumps Wahlsieg: Selenskyj mahnt Europäer zur Einheit,"Die Ukraine steckt in einer Zwickmühle: Die USA könnten die Hilfe für Kiew bald einstellen, die Unterstützung europäischer Verbündeter wirkt oft unentschlossen und halbherzig. Daraus folgt ein Appell.",https://image.stern.de/35213740/t/yT/v1/w1440/r1.7778/-/09--ljutxamdgtv7axw800h600jpeg---0b4176cbd515bc94.jpg,2024-11-09T04:00:38Z,,"Kopiere den aktuellen Link
Die Ukraine steckt in einer Zwickmühle: Die USA könnten die Hilfe für Kiew bald einstellen, die Unterstützung europäischer Verbündeter wirkt oft unentschlossen und halbher… [+6559 chars]",,de,'Ukraine'
https://www.tagesspiegel.de/internationales/lage-im-uberblick-nach-trumps-wahlsieg-selenskyj-mahnt-europaer-zur-einheit-12676511.html,https://www.tagesspiegel.de/internationales/lage-im-uberblick-nach-trumps-wahlsieg-selenskyj-mahnt-europaer-zur-einheit-12676511.html,0,www.tagesspiegel.de,Lage im Überblick: Nach Trumps Wahlsieg: Selenskyj mahnt Europäer zur Einheit,"Die Ukraine steckt in einer Zwickmühle: Die USA könnten die Hilfe für Kiew bald einstellen, die Unterstützung europäischer Verbündeter wirkt oft unentschlossen und halbherzig. Daraus folgt ein Appell.",https://www.tagesspiegel.de/images/12676508/alternates/BASE_16_9_W1400/1731124947000/ukraine-krieg-kiew.jpeg,2024-11-09T04:02:27Z,,"Machtwechsel in den USA, Ampel-Koalition geplatzt und Meinungsverschiedenheiten in den Hauptstädten der EU: Angesichts der ungewissen Zukunft im Krieg mit Russland hat die Ukraine einen Appell an ihr… [+6403 chars]",,de,'Putin'
https://www.sueddeutsche.de/politik/ukraine-krieg-newsblog-russland-trump-musk-lux.TQFLv4Up8sTUJCYHzgYVqN,https://www.sueddeutsche.de/politik/ukraine-krieg-newsblog-russland-trump-musk-lux.TQFLv4Up8sTUJCYHzgYVqN,0,www.sueddeutsche.de,Krieg in der Ukraine: Musk bei Telefonat Trumps mit Selenskij anwesend,"Dies könnte ein Hinweis darauf sein, welchen Einfluss der Milliardär auf die zukünftige Regierung der USA haben könnte. Der ukrainische Präsident mahnt die Europäer zur Einigkeit. In der Ostukraine wird schwer gekämpft.",https://www.sueddeutsche.de/2024/11/08/fe20bba6-5bac-41d9-b933-947512e83182.jpeg?q=60&fm=webp&width=1200&rect=0%2C24%2C1389%2C781,2024-11-09T05:43:25Z,http://archive.md/20241109113930/https://www.sueddeutsche.de/politik/ukraine-krieg-newsblog-russland-trump-musk-lux.TQFLv4Up8sTUJCYHzgYVqN,Nach der Wahl Donald Trumps zum nächsten US-Präsidenten stehen Europa und die Ukraine vor der Ungewissheit wie es weitergehen soll mit der Unterstützung für die Ukraine. Auf dem Gipfeltreffen der Eur… [+1876 chars],,de,'Putin'
https://www.n-tv.de/panorama/Sind-die-irre-oder-bin-ich-es-article25348286.html,https://www.n-tv.de/panorama/Sind-die-irre-oder-bin-ich-es-article25348286.html,0,www.n-tv.de,Aus der Schmoll-Ecke: Sind die irre oder bin ich es?,"Versteht noch irgendwer, was auf er Welt vor sich geht? Das Irrationale, das Schizophrene bricht sich Bahn. Viele in Deutschland fürchten eine Diktatur und huldigen Putin, einen (einem?) Diktator. Unser Kolumnist kommt da nicht mehr mit und macht sich Gedanke…",https://bilder2.n-tv.de/img/incoming/crop25348389/2641323024-cImg_16_9-w1200/epi-223520881-REUTERSFOTO-2024-11-08T130216Z-517409377-RC2IZAAXTXZ5-RTRMADP-3-USA-ELECTION-PICTURES.jpg,2024-11-09T09:01:15Z,,"Versteht noch irgendwer, was auf er Welt vor sich geht? Das Irrationale, das Schizophrene bricht sich Bahn. Viele in Deutschland fürchten eine Diktatur und huldigen Putin, einen (einem?) Diktator. Un… [+6730 chars]",,de,'Putin'
