index,url,valid,domain,title,description,image,published,archive,content,quote,language,keyword
https://www.tagesschau.de/ausland/europa/ukraine-gespraeche-abu-dhabi-100.html,https://www.tagesschau.de/ausland/europa/ukraine-gespraeche-abu-dhabi-100.html,0,www.tagesschau.de,Ukraine-Friedensgespräche verschieben sich womöglich,Die Ukraine und Russland wollten ihre Friedensgespräche heute fortsetzen. Laut Präsident Selenskyj könnten die Verhandlungen aber verschoben werden. Unterdessen verlagert Russland seine Angriffe offenbar auf die ukrainische Verkehrsinfrastruktur.,https://images.tagesschau.de/image/23884002-94d6-4e01-bd95-19a10a1826d3/AAABnBZyViI/AAABmyZE0EA/16x9-big/selenskyj-1054.jpg?width=1280,2026-02-01T02:28:27Z,,"Stand: 01.02.2026 03:28 Uhr
Die Ukraine und Russland wollten ihre Friedensgespräche heute fortsetzen. Laut Präsident Selenskyj könnten die Verhandlungen aber verschoben werden. Unterdessen verlagert… [+1852 chars]",,de,'Russland'
https://www.zeit.de/news/2026-02/01/ukrainer-und-russen-setzen-gespraeche-in-abu-dhabi-fort,https://www.zeit.de/news/2026-02/01/ukrainer-und-russen-setzen-gespraeche-in-abu-dhabi-fort,0,www.zeit.de,Die Lage im Überblick: Ukrainer und Russen setzen Gespräche in Abu Dhabi fort,Hier finden Sie Informationen zu dem Thema „Die Lage im Überblick“. Lesen Sie jetzt „Ukrainer und Russen setzen Gespräche in Abu Dhabi fort“.,https://img.zeit.de/news/2026-02/01/ukrainer-und-russen-setzen-gespraeche-in-abu-dhabi-fort-image-group/wide__1300x731,2026-02-01T02:58:04Z,,Ukrainer und Russen wollen heute in den Vereinigten Arabischen Emiraten ihre vor einer Woche begonnenen direkten Verhandlungen über eine Beendigung des Krieges wieder aufnehmen. Der Kreml in Moskau u… [+4276 chars],,de,'Ukraine'
https://www.nzz.ch/nzz-am-sonntag/report-und-debatte/woher-ruehrt-deutschlands-naehe-zu-russland-ein-ostdeutscher-historiker-erklaert-ld.1922284,https://www.nzz.ch/nzz-am-sonntag/report-und-debatte/woher-ruehrt-deutschlands-naehe-zu-russland-ein-ostdeutscher-historiker-erklaert-ld.1922284,0,www.nzz.ch,"INTERVIEW - Mehr als bloss ignorant: «Deutschland hat die imperialistische Politik des Kremls mehrheitlich unterstützt», sagt ein Historiker","Deutschland fällt es bis heute schwer, Russland als Aggressor zu begreifen. Der Historiker Ilko-Sascha Kowalczuk erklärt, wie die Verklärung von Gorbatschow, Schuldgefühle und ein grundlegendes Unverständnis Russlands zu einer fatalen Realitätsverweigerung ge…","https://img.nzz.ch/2026/01/28/d090457c-2526-40f1-a37f-b010bfa55468.jpg?width=1200&height=675&fit=bounds&quality=75&auto=webp&crop=5877,3306,x0,y285&wmark=nzz",2026-02-01T04:30:00Z,,"Deutschland fällt es bis heute schwer, Russland als Aggressor zu begreifen. Der Historiker Ilko-Sascha Kowalczuk erklärt, wie die Verklärung von Gorbatschow, Schuldgefühle und ein grundlegendes Unver… [+9592 chars]",,de,'Russland'
https://www.zeit.de/politik/2026-01/stromausfall-kyjiw-heizungsausfall-ukrainekrieg-nachrichtenpodcast,https://www.zeit.de/politik/2026-01/stromausfall-kyjiw-heizungsausfall-ukrainekrieg-nachrichtenpodcast,0,www.zeit.de,Stromausfälle in Kyjiw: Wenn der Winter zur Waffe wird,Inmitten von russischen Angriffen und Strom- und Heizungsausfällen in Kyjiw beginnen neue Ukraineverhandlungen in Abu Dhabi. Und: Deutschland im Finale der Handball-EM,https://img.zeit.de/politik/2017-09/illu-podcast-news/wide__8ed8a6__1300x731,2026-02-01T05:02:27Z,,"Nach russischen Angriffen auf die Energieinfrastruktur kommt es in Kyjiw seit Wochen zu weitreichenden Strom-, Heizungs- und Wasserausfällen. Hunderttausende Menschen sind zeitweise ohne grundlegende… [+2142 chars]",,de,'Ukraine'
https://www.zeit.de/2026/05/kyjiw-stromausfaelle-ukraine-russland-infrastruktur,https://www.zeit.de/2026/05/kyjiw-stromausfaelle-ukraine-russland-infrastruktur,0,www.zeit.de,Stromausfälle in Kyjiw: Frieren für die Freiheit,"Viele Ukrainer versuchen, in der Eiseskälte zu überleben. Sie wollen dafür nicht bewundert, sondern unterstützt werden. Ein Hilferuf unserer Korrespondentin aus Kyjiw",https://img.zeit.de/2026/05/fuer-freiheit-frieren-bild-2/wide__1300x731,2026-02-01T05:33:34Z,,"Ich bin in Kyjiw, und mir wird bang. Ich meine damit nicht nur die Angst vor den Explosionen nachts, die Wände erzittern lassen, die den Menschen alles nehmen, ihr Leben, das ihrer Liebsten. Oder die… [+446 chars]",,de,'Frieren'
https://netzpolitik.org/2026/trugbild-altersvorsorge-mit-amazon/,https://netzpolitik.org/2026/trugbild-altersvorsorge-mit-amazon/,0,netzpolitik.org,Trugbild: Altersvorsorge mit Amazon,"Können wir uns bereichern am Reicherwerden der Reichen? – Gemeinfrei-ähnlich freigegeben durch unsplash.com Annie Spratt
Deutschlands Bürger müssen ihre Altersvorsorge selbst in die Hand nehmen. Viele entscheiden sich deshalb für das Sparen mit ETFs. Damit s…",https://cdn.netzpolitik.org/wp-upload/2026/01/annie-spratt-0cPSKUEANqU-unsplash_kolumne-1200x675.jpg,2026-02-01T07:37:36Z,,"Nach etwa einem Jahr Bedenkzeit, dutzenden Gesprächen über „ethisches Investieren“ und einer albtraumgeplagten Nacht ist der erste Schritt zur Altersvorsorge vollbracht: Der ETF-Sparplan steht. Erst … [+6033 chars]",,de,'Sparen'
https://www.focus.de/finanzen/kaeltewelle-frisst-unsere-gasvorraete-das-hat-folgen-fuer-den-winter-2026_f988c737-2a28-4fd1-92b2-08eac72fb056.html,https://www.focus.de/finanzen/kaeltewelle-frisst-unsere-gasvorraete-das-hat-folgen-fuer-den-winter-2026_f988c737-2a28-4fd1-92b2-08eac72fb056.html,0,www.focus.de,Kältewelle frisst unsere Gasvorräte – das hat Folgen für den Winter 2026,Eine Kältewelle zwingt Deutschland zum Heizen. Die Bundesnetzagentur sieht noch alles im Rahmen. Allerdings finden schon Preissteigerungen statt.,https://quadro.burda-forward.de/ctf/5c7d3365-04a0-458a-a469-720ed44160ec.ea0a62aa-7fa2-43cb-9833-a69a5e2ce7e4.jpg?im=RegionOfInterestCrop%3D%281200%2C630%29%2CregionOfInterest%3D%282388%2C1411%29&hash=28b8a0618ceab02291e077889f3f507f430bcb072fadc50cd741b8670ffb7928,2026-02-01T11:25:00Z,,Der Winter hat Deutschland fest im Griff. Neue Stimmen warnen vor steigenden Gaspreisen und gleichzeitig sinken die Füllstände in Deutschlands Gasspeichern. Jüngst erhobene Daten zeigen einen drastis… [+4477 chars],,de,'Kälte'
https://www.stern.de/gesellschaft/regional/hamburg-schleswig-holstein/wetter-im-norden--sturmboeen-und-schnee-im-norden-37096208.html,https://www.stern.de/gesellschaft/regional/hamburg-schleswig-holstein/wetter-im-norden--sturmboeen-und-schnee-im-norden-37096208.html,0,www.stern.de,Wetter im Norden: Sturmböen und Schnee im Norden,"Hamburg/Schwerin/Kiel - Die neue Woche startet im Norden mit dauerhaften Minusgraden, Frost, vereinzeltem Schneefall und der damit einhergehenden Gefahr",https://image.stern.de/37096210/t/TY/v1/w1440/r1.7778/-/01--sojjz2npqev1axs2048jpeg---28e7bc457298b718.jpg,2026-02-01T12:02:37Z,,"Kopiere den aktuellen Link
Zur Merkliste hinzufügen
Minus 14 Grad, Sturmböen und gefrierender Regen: Diese Woche bleibt es im Norden ungemütlich und vereinzelt glatt auf den Straßen.
Die neue Woch… [+1952 chars]",,de,'Schnee'
https://www.stern.de/news/schneestuerme-und-eiseskaelte-haben-weite-teile-der-usa-im-griff-37095020.html,https://www.stern.de/news/schneestuerme-und-eiseskaelte-haben-weite-teile-der-usa-im-griff-37095020.html,0,www.stern.de,Schneestürme und Eiseskälte haben weite Teile der USA im Griff,"Große Teile der USA befinden sich weiterhin im Griff einer extremen Kältewelle. Für die Bundesstaaten North und South Carolina sowie Teile von Georgia, Kentucky, Tennessee und Virginia in der Osthälfte des Landes galt am Wochenende eine Sturmwarnung, Schnee u…",https://image.stern.de/37096282/t/Ii/v1/w1440/r1.7778/-/01--glimpflicher-zugunfall-in-north-carolina---9a4b1ffd6bacd004.jpg,2026-02-01T12:34:36Z,,"Kopiere den aktuellen Link
Zur Merkliste hinzufügen
Große Teile der USA befinden sich weiterhin im Griff einer extremen Kältewelle. Für die Bundesstaaten North und South Carolina sowie Teile von Ge… [+2523 chars]",,de,'Kälte'
https://www.n-tv.de/panorama/Im-Osten-wird-s-noch-frostiger-im-Westen-fruehlingshaft-id30311223.html,https://www.n-tv.de/panorama/Im-Osten-wird-s-noch-frostiger-im-Westen-fruehlingshaft-id30311223.html,0,www.n-tv.de,Wetterwoche im Schnellcheck: Im Osten wird's noch frostiger - im Westen frühlingshaft,"Minusgrade, Schnee und Glätte: Der Winter hat den Nordosten Deutschlands auch in der kommenden Woche fest im Griff. Wer genug vom Frost hat, braucht nicht weit zu reisen - im Südwesten steigen die Temperaturen auf bis zu zehn Grad.",https://www.n-tv.de/img/30311305/1769947047/Img_16_9/1200/Deutschland-Muenchen-29.jpg,2026-02-01T12:35:40Z,,"Noch sollten die Schneeschippen griffbereit bleiben. (Foto: picture alliance / Wolfgang Maria Weber)
Minusgrade, Schnee und Glätte: Der Winter hat den Nordosten Deutschlands auch in der kommenden Wo… [+4016 chars]",,de,'Schnee'
https://www.n-tv.de/wirtschaft/Reiche-wischt-Bedenken-ueber-Gasvorraete-weg-id30311495.html,https://www.n-tv.de/wirtschaft/Reiche-wischt-Bedenken-ueber-Gasvorraete-weg-id30311495.html,0,www.n-tv.de,"""Sorgen sind nicht angebracht"": Reiche wischt Bedenken über Gasvorräte weg","Der Füllstand der deutschen Gasspeicher liegt bei weniger als 35 Prozent. Grund zur Sorge? Nicht in der Bundesregierung: Wirtschaftsministerin Reiche ist überzeugt, dass Deutschland gut durch den Winter kommt.",https://www.n-tv.de/img/30311531/1769952102/Img_16_9/1200/Katherina-Reiche-CDU-Bundesministerin-fuer-Wirtschaft-und-Energie-reist-mit-einer-Wirtschaftsdelegation-nach-Saudi-Arabien-Hier-bei-einem-Pressestatement-nach-dem-Saudi-German-Business-Council-01-02.jpg,2026-02-01T12:49:33Z,,"""Sorgen sind nicht angebracht""Reiche wischt Bedenken über Gasvorräte weg 
Katherina Reiche ist überzeugt: Die Versorgung ist abgesichert. (Foto: picture alliance / BMWE/photothek.de)
Der Füllstand … [+2645 chars]",,de,'Gasspeicher'
https://orf.at/stories/3418880/,https://orf.at/stories/3418880/,0,orf.at,Kältewelle hat USA weiter fest im Griff,,https://orf.at/mojo/1_4_1/storyserver//news/common/images/og-fallback-news.png,2026-02-01T13:00:37Z,,"Große Teile der USA befinden sich weiterhin im Griff einer extremen Kältewelle. Für die Bundesstaaten North und South Carolina sowie Teile von Georgia, Kentucky, Tennessee und Virginia in der Osthälf… [+1155 chars]",,de,'Schnee'
https://www.tagesspiegel.de/potsdam/brandenburg/warnstreiks-im-nahverkehr-chaos-bei-bus-und-tram-droht-warnstreiks-in-brandenburg-15206211.html,https://www.tagesspiegel.de/potsdam/brandenburg/warnstreiks-im-nahverkehr-chaos-bei-bus-und-tram-droht-warnstreiks-in-brandenburg-15206211.html,0,www.tagesspiegel.de,Chaos bei Bus und Tram droht: Warnstreiks legen Nahverkehr in Brandenburg lahm – auch in Potsdam,Schnee und Eis und gleich zwei Warnstreiks: In Brandenburg beginnt die Arbeitswoche turbulent. Nicht nur der Nahverkehr ist betroffen. Was geht noch?,https://www.tagesspiegel.de/images/11283391/alternates/BASE_16_9_W1400/1709116937000/vip-verkehrsbetrieb-potsdam.jpeg,2026-02-01T13:09:11Z,,Gleich zwei Warnstreiks machen den Wochenstart für zigtausende Pendler und andere Fahrgäste am Montag in Brandenburg zur großen Geduldsprobe. Im öffentlichen Nahverkehr sind voraussichtlich zahlreich… [+4627 chars],,de,'Schnee'
https://www.bild.de/news/ausland/virales-schneeleopard-selfie-aus-china-entpuppt-sich-als-moegliche-ki-faelschung-697eee9a9d671fe828bb1d39,https://www.bild.de/news/ausland/virales-schneeleopard-selfie-aus-china-entpuppt-sich-als-moegliche-ki-faelschung-697eee9a9d671fe828bb1d39,0,www.bild.de,Foto ging viral - Schneeleopard-Selfie ist KI-Montage,Ein Selfie mit Schneeleopard ging weltweit viral. Nun zeigen Details und Videoaufnahmen: Das dramatische Bild ist vermutlich eine KI-Montage.,"https://images.bild.de/697eee9a9d671fe828bb1d39/671d803f97148af421b92a754d9ffd31,cc163d27?w=1280",2026-02-01T13:45:33Z,,"TTS-Player überspringenArtikel weiterlesenKoktokay (China) Dieses Foto ging um die Welt. Eine junge Skifahrerin lächelt in die Kamera, direkt hinter ihr ein Schneeleopard. Sekunden vor einer Attacke,… [+2258 chars]",,de,'Schnee'
https://www.stern.de/panorama/winterwetter--historischer-wintereinbruch--bombenzyklon-trifft-usa-37096440.html,https://www.stern.de/panorama/winterwetter--historischer-wintereinbruch--bombenzyklon-trifft-usa-37096440.html,0,www.stern.de,Winterwetter: Historischer Wintereinbruch: Bombenzyklon trifft USA,"Washington - Ein schwerer Wintersturm hat Schnee, Orkanböen, Sturmfluten und gefährliche Kälte in den Südosten der USA gebracht. Ein Tiefdruckgebiet vor",https://image.stern.de/37096442/t/3Z/v1/w1440/r1.7778/-/01--nktjh7g2a4v5axs2048jpeg---bf2751655913949f.jpg,2026-02-01T14:26:48Z,,"Kopiere den aktuellen Link
Zur Merkliste hinzufügen
Ein explosiv erstarkender Wintersturm zieht durch Teile der USA: Hunderttausende Haushalte sind ohne Strom, der Flugverkehr ist eingeschränkt.
E… [+2062 chars]",,de,'Schnee'
https://www.zeit.de/politik/deutschland/2026-02/gasspeicher-fuellstaende-gasversorgung-katherina-reiche,https://www.zeit.de/politik/deutschland/2026-02/gasspeicher-fuellstaende-gasversorgung-katherina-reiche,0,www.zeit.de,Gasspeicher: Katherina Reiche befürchtet keine Knappheit bei der Gasversorgung,In deutschen Gasspeichern sind die Füllstände auf 35 Prozent gesunken. Laut Bundeswirtschaftsministerin Katherina Reiche ist das aber kein Grund zur Beunruhigung.,https://img.zeit.de/politik/deutschland/2026-02/erdgas-speicher-reiche-bild/wide__1300x731,2026-02-01T14:28:59Z,,"Nach Einschätzung von Bundeswirtschaftsministerin
 Katherina Reiche (CDU) sind die relativ niedrigen Füllstände in deutschen 
Gasspeichern kein Grund zur Beunruhigung. Man beobachte die Lage 
tägl… [+830 chars]",,de,'Knappheit'
https://www.welt.de/politik/ausland/article69770856707d4aa207581470/ukraine-krieg-friedensgespraeche-verschoben-russland-soll-bus-und-geburtsklinik-bombardiert-haben-liveticker.html,https://www.welt.de/politik/ausland/article69770856707d4aa207581470/ukraine-krieg-friedensgespraeche-verschoben-russland-soll-bus-und-geburtsklinik-bombardiert-haben-liveticker.html,0,www.welt.de,Friedensgespräche verschoben – Russland soll Bus und Geburtsklinik bombardiert haben,"Die nächste Runde direkter Gespräche zwischen Kiew, Moskau und Washington ist kurzfristig verschoben worden. Womöglich finden diese nun Mitte kommender Woche in Abu Dhabi statt. Und: Russland soll am Wochenende mehrere Drohnenangriffe auf zivile Ziele gefloge…",https://images.welt.de/69770856707d4aa207581470/12924ac971843216fd59109f3ed2e33b/ci16x9-w1200/dpa-com-20090101-260201-99-352212-jpg,2026-02-01T16:33:00Z,,"Die nächste Runde direkter Gespräche zwischen Kiew, Moskau und Washington ist kurzfristig verschoben worden. Womöglich finden diese nun Mitte kommender Woche in Abu Dhabi statt. Und: Russland soll am… [+23618 chars]",,de,'Heizen'
https://www.faz.net/aktuell/gesellschaft/bombenzyklon-trifft-usa-north-carolina-versinkt-im-schnee-accg-200495220.html,https://www.faz.net/aktuell/gesellschaft/bombenzyklon-trifft-usa-north-carolina-versinkt-im-schnee-accg-200495220.html,0,www.faz.net,"Schnee, Orkanböen, Sturmfluten: Bombenzyklon trifft USA","Eine gefährliche Kältewelle erfasst den Süden der USA. In North Carolina fallen örtlich Schneemengen, die zu den höchsten seit Beginn der Aufzeichnungen zählen.",https://media0.faz.net/image/w1200h627/91131d3cd1e5/w4000h2090x0y169o/202602/43601.0.1725169934/streugut-ist-dieser-tage-in.webp,2026-02-01T17:03:26Z,,"Ein schwerer Wintersturm hat Schnee, Orkanböen, Sturmfluten und gefährliche Kälte in den Südosten der USA gebracht. Ein Tiefdruckgebiet vor der Küste entwickelte sich in der Nacht zum Sonntag nach An… [+1799 chars]",,de,'Kälte'
https://www.n-tv.de/politik/Russland-attackiert-Bus-mit-Bergleuten-mindestens-12-Tote-id30312234.html,https://www.n-tv.de/politik/Russland-attackiert-Bus-mit-Bergleuten-mindestens-12-Tote-id30312234.html,0,www.n-tv.de,Drohnenbeschuss in der Ukraine: Russland attackiert Bus mit Bergleuten - mindestens 12 Tote,"Unter der Woche treffen sich Vertreter aus dem Kreml, Kiew und Washington, um einen Weg zum Frieden in der Ukraine zu finden. Das hält Russland aber nicht von Angriffen ab: diesmal auf einen Bus und eine Klinik. Es gibt mehr als ein Dutzend Tote.",https://www.n-tv.de/img/30312248/1769971051/Img_16_9/1200/Auf-diesem-vom-ukrainischen-Katastrophenschutz-zur-Verfuegung-gestellten-Foto-loeschen-Feuerwehrleute-das-Feuer-nachdem-eine-russische-Kampfdrohne-einen-mit-Grubenarbeitern-besetzten-Bus-getroffen-hatte-Mindestens-15-Menschen-wurden-getoetet.jpg,2026-02-01T17:57:38Z,,"Die Bergleute waren gerade auf dem Heimweg nach dem Schichtwechsel. (Foto: picture alliance/dpa/Ukrainian Emergency Service via AP)
Unter der Woche treffen sich Vertreter aus dem Kreml, Kiew und Was… [+2369 chars]",,de,'Russland'
https://www.diepresse.com/20539214/japans-industrie-waechst-so-stark-wie-seit-dreieinhalb-jahren-nicht,https://www.diepresse.com/20539214/japans-industrie-waechst-so-stark-wie-seit-dreieinhalb-jahren-nicht,0,www.diepresse.com,Japans Industrie wächst so stark wie seit dreieinhalb Jahren nicht,"Die neuen Exportaufträge legen erstmals seit Februar 2022 zu, gestützt durch eine starke Nachfrage aus Schlüsselmärkten wie den USA und Taiwan. Allerdings: Der Inflationsdruck bleibt.",https://img.diepresse.com/public/incoming/ob4xgw-imago-images-0441635034/alternates/DPR_SOCIAL_NACHRICHTEN/imago%20images%200441635034,2026-02-02T04:12:50Z,,"Die neuen Exportaufträge legen erstmals seit Februar 2022 zu, gestützt durch eine starke Nachfrage aus Schlüsselmärkten wie den USA und Taiwan. Allerdings: Der Inflationsdruck bleibt. 
Die Stimmung … [+1276 chars]",,de,'Inflation'
https://www.zeit.de/news/2026-02/02/glatte-strassen-am-warnstreiktag-in-nrw,https://www.zeit.de/news/2026-02/02/glatte-strassen-am-warnstreiktag-in-nrw,0,www.zeit.de,Regen und Schnee: Glatte Straßen am Warnstreiktag in NRW,Hier finden Sie Informationen zu dem Thema „Regen und Schnee“. Lesen Sie jetzt „Glatte Straßen am Warnstreiktag in NRW“.,https://img.zeit.de/news/2026-02/02/glatte-strassen-am-warnstreiktag-in-nrw-image-group/wide__1300x731,2026-02-02T05:19:46Z,,Am Morgen des Warnstreiks kann es auf den Straßen in Nordrhein-Westfalen weiterhin glatt werden. Dies teilt der Deutsche Wetterdienst (DWD) mit. Vor allem im Norden und Nordosten ist bis in den Vormi… [+1229 chars],,de,'Schnee'
https://www.zeit.de/wirtschaft/2026-02/russland-festnahmen-lieferungen-embargo,https://www.zeit.de/wirtschaft/2026-02/russland-festnahmen-lieferungen-embargo,0,www.zeit.de,Embargo gegen Russland: Fünf Männer wegen tausender Lieferungen nach Russland festgenommen,"Weil sie das Russland-Embargo in großem Maßstab umgangen haben sollen, hat die Bundesanwaltschaft fünf Männer festnehmen lassen. In mehreren Bundesländern gab es Razzien.",https://img.zeit.de/administratives/sharing/fallback-image-die-zeit/wide__1300x731,2026-02-02T09:24:58Z,,"Wegen tausender verbotener Lieferungen nach Russland sind in Schleswig-Holstein fünf Männer festgenommen worden. ""Nach dem jetzigen Stand der Ermittlungen haben die Beschuldigten rund 16.000 Lieferun… [+919 chars]",,de,'Russland'
https://www.telepolis.de/article/Mehrwertsteuer-Erhoehung-Russlands-kleine-Unternehmen-in-der-Zwickmuehle-11162030.html,https://www.telepolis.de/article/Mehrwertsteuer-Erhoehung-Russlands-kleine-Unternehmen-in-der-Zwickmuehle-11162030.html,0,www.telepolis.de,Mehrwertsteuer-Erhöhung: Russlands kleine Unternehmen in der Zwickmühle,Russland erhöht die Mehrwertsteuer auf 22 Prozent. Kleine Unternehmen sind besonders betroffen. Droht dem Land eine Rezession?,https://heise.cloudimg.io/bound/1200x1200/q85.png-lossy-85.webp-lossy-85.foil1/_www-heise-de_/imgs/18/5/0/2/0/4/0/2/shutterstock_2590592071-d41f446b7a1f98b1.jpg,2026-02-02T09:30:00Z,,"Seit dem Jahreswechsel gilt in Russland eine höhere Mehrwertsteuer
(Bild: Legran48D/Shutterstock.com)
Russland erhöht die Mehrwertsteuer auf 22 Prozent. Kleine Unternehmen sind besonders betroffen.… [+6616 chars]",,de,'Russland'
https://www.tagesschau.de/inland/innenpolitik/festnahmen-verstoesse-embargo-russland-100.html,https://www.tagesschau.de/inland/innenpolitik/festnahmen-verstoesse-embargo-russland-100.html,0,www.tagesschau.de,Festnahmen nach Verstoß gegen Russland-Sanktionen,"Im Auftrag der Bundesanwaltschaft sind fünf Männer festgenommen worden, die gegen Russland-Sanktionen verstoßen haben sollen. Über Scheinfirmen sollen seit 2022 Tausende Lieferungen nach Russland gegangen sein - unter anderem aus Lübeck.",https://images.tagesschau.de/image/ef234382-60e4-4c9e-8b3a-5fb1c59407ff/AAABmjSc92k/AAABmyZE0EA/16x9-big/bundesanwaltschaft-142.jpg?width=1280,2026-02-02T09:32:21Z,,"Stand: 02.02.2026 10:32 Uhr
Im Auftrag der Bundesanwaltschaft sind fünf Männer festgenommen worden, die gegen Russland-Sanktionen verstoßen haben sollen. Über Scheinfirmen sollen seit 2022 Tausende … [+2275 chars]",,de,'Russland'
https://www.diepresse.com/20539518/minus-20-grad-new-yorker-frieren-bei-eisigen-temperaturen,https://www.diepresse.com/20539518/minus-20-grad-new-yorker-frieren-bei-eisigen-temperaturen,0,www.diepresse.com,Minus 20 Grad: New Yorker frieren bei eisigen Temperaturen [premium],"Eis am Hudson River, 25 Zentimeter Schnee in South Carolina, Tausende abgesagte Flüge: Die Kälte sucht die US-Ostküste heim, ein Ende ist vorerst in weiten Teilen nicht in Sicht.",https://img.diepresse.com/public/incoming/pckcil-us-frigid-temperatures-chill-new-york-city/alternates/DPR_SOCIAL_NACHRICHTEN/US-FRIGID-TEMPERATURES-CHILL-NEW-YORK-CITY,2026-02-02T10:08:28Z,,"New York. Es hat schon einen guten Grund, warum die Wetter-Apps für New York City nicht nur die tatsächliche Temperatur, sondern stets auch die gefühlte Kälte anzeigen. Ein Spaziergang am Ufer des Hu… [+4350 chars]",,de,'Schnee'
https://www.zeit.de/news/2026-02/02/kreml-bestaetigt-naechste-ukraine-gespraeche-in-abu-dhabi,https://www.zeit.de/news/2026-02/02/kreml-bestaetigt-naechste-ukraine-gespraeche-in-abu-dhabi,0,www.zeit.de,Ukraine-Krieg: Kreml bestätigt nächste Ukraine-Gespräche in Abu Dhabi,Hier finden Sie Informationen zu dem Thema „Ukraine-Krieg“. Lesen Sie jetzt „Kreml bestätigt nächste Ukraine-Gespräche in Abu Dhabi“.,https://img.zeit.de/news/2026-02/02/kreml-bestaetigt-naechste-ukraine-gespraeche-in-abu-dhabi-image-group/wide__1300x731,2026-02-02T10:47:57Z,,Der Kreml hat die nächste Gesprächsrunde mit der Ukraine und den USA über ein mögliches Kriegsende für Mitte dieser Woche bestätigt. Eigentlich sei das Treffen in den Vereinigten Arabischen Emiraten … [+802 chars],,de,'Ukraine'
https://www.sueddeutsche.de/wirtschaft/gasspeicher-deutschland-fuellstand-versorgungssicherheit-li.3379826,https://www.sueddeutsche.de/wirtschaft/gasspeicher-deutschland-fuellstand-versorgungssicherheit-li.3379826,0,www.sueddeutsche.de,Energieversorgung: Die Gasspeicher sind ziemlich leer. Ist das ein Problem?,"Der Füllstand der Speicher liegt bei 32 Prozent, vor einem Jahr waren es noch fast 56 Prozent. „Sorgen sind nicht angebracht“, beschwichtigt die Bundeswirtschaftsministerin. Experten geben ihr recht, sehen aber ein anderes Phänomen.",https://www.sueddeutsche.de/2026/02/02/f5ff9979-cbdb-4e9e-b6b1-19f81696bdc8.jpg?q=60&fm=webp&width=1200&rect=0%2C208%2C4000%2C2250,2026-02-02T16:00:15Z,,"Es gab Zeiten, da war der Füllstand der Gasspeicher eine Art Stimmungsbarometer für Deutschland. Schließlich waren die Vorräte kurz nach dem russischen Angriff auf die Ukraine so gut wie aufgebraucht… [+480 chars]",,de,'Gasspeicher'
https://www.diepresse.com/20539519/sie-verrotten-wie-ein-fauler-fisch-sagt-ein-reicher-russe-ueber-die-im,https://www.diepresse.com/20539519/sie-verrotten-wie-ein-fauler-fisch-sagt-ein-reicher-russe-ueber-die-im,0,www.diepresse.com,"„Sie verrotten wie ein fauler Fisch“, sagt ein reicher Russe über die Unternehmen im Land [premium]","Besitz ist in Russland relativ. Vor allem seit dem Ukraine-Krieg enteignet der Staat die Privatunternehmer immer mehr. Aber auch so gehen sie zunehmend pleite, weil sie bei dem extrem hohen Leitzins die Kredite nicht mehr stemmen können. Eine Recherche über R…",https://img.diepresse.com/public/incoming/vsjrnf-imago837767756jpg/alternates/DPR_SOCIAL_NACHRICHTEN/imago837767756.jpg,2026-02-02T16:14:35Z,,"Nun ist es also geschafft. Die Causa ist über die Bühne. Ende voriger Woche wurde der Moskauer Flughafen Domodedowo, vormals der größte und modernste im Land, endlich verkauft. Konkret wurde er verst… [+7711 chars]",,de,'Ukraine'
https://www.morgenpost.de/politik/article411096104/extreme-kaelte-in-teilen-europas-wie-lange-fuellt-trump-noch-unsere-gasspeicher.html,https://www.morgenpost.de/politik/article411096104/extreme-kaelte-in-teilen-europas-wie-lange-fuellt-trump-noch-unsere-gasspeicher.html,0,www.morgenpost.de,Extreme Kälte in Teilen Europas: Wie lange füllt Trump noch unsere Gasspeicher?,Einst machte Russland Europa von Energie-Lieferungen abhängig. Nun füllen die USA die Lücke. Politiker und Experten sind alarmiert.,https://img.sparknews.funkemedien.de/411096284/411096284_1770050522_v16_9_1600.jpeg,2026-02-02T16:42:02Z,,"Die eisige Kälte hat weite Teile Deutschlands und Europas weiterhin im Griff. Wer kann, bleibt in den betroffenen Gebieten zu Hause im Warmen. Niemand muss sich Sorgen machen, dass Häuser und Wohnung… [+7102 chars]",,de,'Gasspeicher'
