index,url,valid,domain,title,description,image,published,archive,content,quote,language,keyword
https://www.zeit.de/news/2023-12/03/schnee-und-leicht-steigende-temperaturen-in-sicht,https://www.zeit.de/news/2023-12/03/schnee-und-leicht-steigende-temperaturen-in-sicht,0,www.zeit.de,Wetter: Schnee und leicht steigende Temperaturen in Sicht,Hier finden Sie Informationen zu dem Thema „Wetter“. Lesen Sie jetzt „Schnee und leicht steigende Temperaturen in Sicht“.,https://img.zeit.de/news/2023-12/03/schnee-und-leicht-steigende-temperaturen-in-sicht-image-group/wide__1300x731,2023-12-03T15:53:34Z,https://web.archive.org/web/20231204055500/https://www.zeit.de/news/2023-12/03/schnee-und-leicht-steigende-temperaturen-in-sicht,Die neue Woche bringt stellenweise Schnee und Regen sowie leicht steigende Temperaturen nach Rheinland-Pfalz und ins Saarland. Das teilte der Deutsche Wetterdienst (DWD) am Sonntag in Offenbach mit. … [+590 chars],,de,'Schnee'
https://www.focus.de/finanzen/karriere/winterchaos-in-deutschland-darf-man-wegen-schnee-und-glatteis-zu-spaet-ins-buero-kommen_id_5218641.html,https://www.focus.de/finanzen/karriere/winterchaos-in-deutschland-darf-man-wegen-schnee-und-glatteis-zu-spaet-ins-buero-kommen_id_5218641.html,0,www.focus.de,Schneechaos in Deutschland - Darf ich wegen Glatteis zu spät ins Büro kommen?,"Der Winter ist da und sorgte am Wochenende in Bayern für Verkehrschaos. Bei Schnee und Eis ist Stau auf dem Arbeitsweg geradezu vorprogrammiert. Doch was, wenn Arbeitnehmer wegen des Wetters zu spät ins Büro kommen? Muss der Chef Verständnis zeigen?",https://p6.focus.de/img/fotos/id_257591666/schnee-eis-glaette-arbeitsweg-was-gilt.jpg?im=Crop%3D%280%2C217%2C3589%2C1794%29%3BResize%3D%281200%2C627%29&impolicy=perceptual&quality=mediumHigh&hash=d865c40c34bfa04953de5f976f052e9f10e007ba9be9cbe37dcc9647012c4819,2023-12-04T05:50:15Z,,"Der Winter ist da und sorgte am Wochenende in Bayern für Verkehrschaos. Bei Schnee und Eis ist Stau auf dem Arbeitsweg geradezu vorprogrammiert. Doch was, wenn Arbeitnehmer wegen des Wetters zu spät … [+3513 chars]",,de,'Schnee'
https://www.welt.de/kmpkt/article204371888/Weihnachten-2023-Schnee-Quiz-Rette-die-Weisse-Weihnacht.html,https://www.welt.de/kmpkt/article204371888/Weihnachten-2023-Schnee-Quiz-Rette-die-Weisse-Weihnacht.html,0,www.welt.de,10 Fragen rund um Schnee – was weißt du über die weiße Pracht?,"Dürfen wir uns dieses Jahr zum Fest der Liebe über Schnee freuen? Vielleicht! Um die Chancen auf eine Weiße Weihnacht zu erhöhen, kannst du dem Wettergott einen deutlichen Ruck geben. Dafür musst du nur dein Wissen über Schnee unter Beweis stellen.",https://img.welt.de/img/kmpkt/mobile221565064/0591350807-ci16x9-w1200/Woman-holding-snow-in-hands.jpg,2023-12-04T05:51:00Z,,"Die WELT als ePaper: Die vollständige Ausgabe steht Ihnen bereits am Vorabend zur Verfügung so sind Sie immer hochaktuell informiert. Weitere Informationen: http://epaper.welt.de 
 Der Kurz-Link die… [+49 chars]",,de,'Schnee'
https://www.stern.de/gesellschaft/regional/bayern/wetter--nur-noch-etwas-schnee-oder-regen-in-bayern-erwartet-34255648.html,https://www.stern.de/gesellschaft/regional/bayern/wetter--nur-noch-etwas-schnee-oder-regen-in-bayern-erwartet-34255648.html,0,www.stern.de,Wetter: Nur noch etwas Schnee oder Regen in Bayern erwartet,Nach dem heftigen Schneefall am Wochenende können sich die Menschen in Bayern auf etwas weniger weiße Flocken einstellen. Am Montag erwartete der Deutsche Wetterdienst (DWD) noch strengen Frost. In der Nacht zum Dienstag ist auch noch Vorsicht angesagt: Gebie…,https://image.stern.de/34255650/t/oy/v1/w1440/r1.7778/-/04--urnnewsmldpacom2009010123120499172791v3w800h600l143t0r2416b1707jpeg---fc4dd7cbdb89b523.jpg,2023-12-04T05:58:12Z,https://web.archive.org/web/20231205105129/https://www.stern.de/gesellschaft/regional/bayern/wetter--nur-noch-etwas-schnee-oder-regen-in-bayern-erwartet-34255648.html,Nach dem heftigen Schneefall am Wochenende können sich die Menschen in Bayern auf etwas weniger weiße Flocken einstellen. Am Montag erwartete der Deutsche Wetterdienst (DWD) noch strengen Frost. In d… [+851 chars],,de,'Schnee'
https://www.zeit.de/news/2023-12/04/nur-noch-etwas-schnee-oder-regen-in-bayern-erwartet,https://www.zeit.de/news/2023-12/04/nur-noch-etwas-schnee-oder-regen-in-bayern-erwartet,0,www.zeit.de,Wetter: Nur noch etwas Schnee oder Regen in Bayern erwartet,Hier finden Sie Informationen zu dem Thema „Wetter“. Lesen Sie jetzt „Nur noch etwas Schnee oder Regen in Bayern erwartet“.,https://img.zeit.de/news/2023-12/04/nur-noch-etwas-schnee-oder-regen-in-bayern-erwartet-image-group/wide__1300x731,2023-12-04T05:58:12Z,,Nach dem heftigen Schneefall am Wochenende können sich die Menschen in Bayern auf etwas weniger weiße Flocken einstellen. Am Montag erwartete der Deutsche Wetterdienst (DWD) noch strengen Frost. In d… [+483 chars],,de,'Schnee'
https://www.n-tv.de/ratgeber/Betriebskosten-Steuerersparnis-gilt-auch-nachtraeglich-article24572830.html,https://www.n-tv.de/ratgeber/Betriebskosten-Steuerersparnis-gilt-auch-nachtraeglich-article24572830.html,0,www.n-tv.de,Abrechnungsfrist endet: Betriebskosten: Steuerersparnis gilt auch nachträglich,"Viele Positionen, wenig Durchblick: Wer sich mit der Nebenkostenabrechnung befasst, kann mitunter verzweifeln. Wir klären, welche Kosten wann und wie von der Steuer abgesetzt werden können.",https://bilder3.n-tv.de/img/incoming/crop24572590/7591325685-cImg_16_9-w1200/Nebenkosten-die-fur-eine-handwerkliche-Tatigkeit-oder-eine-haushaltsnahe-Dienstleistung-angefallen-sind-konnen-von-der-Steuer-abgesetzt-werden.jpg,2023-12-04T06:11:58Z,,"Viele Positionen, wenig Durchblick: Wer sich mit der Nebenkostenabrechnung befasst, kann mitunter verzweifeln. Wir klären, welche Kosten wann und wie von der Steuer abgesetzt werden können. 
Zum Jah… [+3028 chars]",,de,'Kosten'
https://www.focus.de/panorama/wetter-in-deutschland-auf-schneechaos-folgt-gefrierender-regen-hier-droht-heute-blitzeis_id_54933749.html,https://www.focus.de/panorama/wetter-in-deutschland-auf-schneechaos-folgt-gefrierender-regen-hier-droht-heute-blitzeis_id_54933749.html,0,www.focus.de,Wetter im Ticker - Bahnchaos hält an: Pendler in Bayern müssen auch am Montag mit Einschränkungen rechnen,Deutschland steckt mitten im Winter-Chaos. Heftiger Schneefall sorgt auf Schiene und Straße für Ausfälle und Stau. Und auch in der kommenden Woche wird es nicht besser. Lesen Sie alles zur Lage in Deutschland nach dem Schnee-Wochenende im Ticker.,https://p6.focus.de/img/regional/bayern/id_257635238/ein-mit-schnee-bedeckter-regionalzug-steht-im-hauptbahnhof..jpg?im=Crop%3D%280%2C81%2C2048%2C1024%29%3BResize%3D%281200%2C627%29&impolicy=perceptual&quality=mediumHigh&hash=cf13743a599631a1deb7372666ac76b4d02349c0d58b305a5139c46e8a580595,2023-12-04T06:16:10Z,,Deutschland steckt mitten im Winter-Chaos. Heftiger Schneefall sorgt auf Schiene und Straße für Ausfälle und Stau. Und auch in der kommenden Woche wird es nicht besser. Lesen Sie alles zur Lage in De… [+9563 chars],,de,'Schnee'
https://www.sueddeutsche.de/bayern/schnee-chaos-bayern-liveblog-schulausfaelle-muenchen-s-bahn-fernverkehr-1.6313039,https://www.sueddeutsche.de/bayern/schnee-chaos-bayern-liveblog-schulausfaelle-muenchen-s-bahn-fernverkehr-1.6313039,0,www.sueddeutsche.de,Liveblog: Nahverkehr im Raum München auch am Montag eingeschränkt,"Busse und U-Bahnen fahren wieder, doch bei Tram, S-Bahn und im Regionalverkehr sorgt der Schnee weiter für Probleme. In einigen Landkreisen und in Augsburg bleiben viele Schulen geschlossen.",https://www.sueddeutsche.de/image/sz.1.6313617/1200x675?v=1701673868,2023-12-04T06:20:48Z,https://web.archive.org/web/20231205104634/https://www.sueddeutsche.de/bayern/schnee-chaos-bayern-liveblog-schulausfaelle-muenchen-s-bahn-fernverkehr-1.6313039,Noch nie seit Aufzeichnung der Wetterdaten ist in München Anfang Dezember fast ein halber Meter Schnee in so kurzer Zeit gefallen. Auch andere Regionen in Europa kämpfen mit dem Wintereinbruch. Ist d… [+43 chars],,de,'Schnee'
https://www.bild.de/regional/muenchen/muenchen-aktuell/muenchen-schnee-chaos-legt-hauptbahnhof-weiterhin-lahm-86315470.bild.html,https://www.bild.de/regional/muenchen/muenchen-aktuell/muenchen-schnee-chaos-legt-hauptbahnhof-weiterhin-lahm-86315470.bild.html,0,www.bild.de,München - Schnee-Chaos legt Hauptbahnhof lahm,"Nach dem Wintereinbruch läuft der Betrieb weiterhin nur stark eingeschränkt. Die Deutsche Bahn rät dazu, Reisen von und nach München zu verschieben.","https://images.bild.de/656d6fdd5ff6d74bd591e44e/0da46c2f5ba2445dae62253a06bb1c6f,6526753e?w=1280",2023-12-04T06:39:34Z,https://web.archive.org/web/20231205104544/https://www.bild.de/regional/muenchen/muenchen-aktuell/muenchen-schnee-chaos-legt-hauptbahnhof-weiterhin-lahm-86315470.bild.html,"München Schnee-Chaos im Münchner Hauptbahnhof!
Nach dem heftigen Wintereinbruch läuft der Betrieb weiterhin nur stark eingeschränkt. Die 
Deutsche Bahn (DB) erwartete am Montagmorgen eine hohe Ausl… [+859 chars]",,de,'Schnee'
https://www.stern.de/gesellschaft/regional/thueringen/wetter--truebes-winterwetter-in-thueringen--34255694.html,https://www.stern.de/gesellschaft/regional/thueringen/wetter--truebes-winterwetter-in-thueringen--34255694.html,0,www.stern.de,Wetter: Trübes Winterwetter in Thüringen,"Zum Beginn der Woche erwarten die Menschen in Thüringen frostige Temperaturen und Niederschläge. Der Montag startet laut Deutschem Wetterdienst (DWD) stark bewölkt. Ab dem Nachmittag kann es im Westen zu Schneefall kommen, örtlich kann es auch regnen. Die Höc…",https://image.stern.de/34255696/t/ZX/v1/w1440/r1.7778/-/04--urnnewsmldpacom2009010123120499173070v3w800h600l640t425r1920b1275jpeg---c8f9cb9320cbdec2.jpg,2023-12-04T06:47:55Z,,Zum Beginn der Woche erwarten die Menschen in Thüringen frostige Temperaturen und Niederschläge. Der Montag startet laut Deutschem Wetterdienst (DWD) stark bewölkt. Ab dem Nachmittag kann es im Weste… [+1205 chars],,de,'Schnee'
https://www.zeit.de/news/2023-12/04/neue-woche-startet-mit-schnee-und-glaettegefahr,https://www.zeit.de/news/2023-12/04/neue-woche-startet-mit-schnee-und-glaettegefahr,0,www.zeit.de,Wetter: Neue Woche startet mit Schnee und Glättegefahr,Hier finden Sie Informationen zu dem Thema „Wetter“. Lesen Sie jetzt „Neue Woche startet mit Schnee und Glättegefahr“.,https://img.zeit.de/news/2023-12/04/neue-woche-startet-mit-schnee-und-glaettegefahr-image-group/wide__1300x731,2023-12-04T06:53:12Z,,Der Deutsche Wetterdienst (DWD) warnt zum Start der Woche vor glatten Straßen in Hessen. Im Bergland kann es zudem stürmische Böen geben. Ab dem späteren Vormittag ziehe von Westen her Schneefall auf… [+1225 chars],,de,'Schnee'
https://www.stern.de/gesellschaft/regional/hessen/wetter--neue-woche-startet-mit-schnee-und-glaettegefahr-34255720.html,https://www.stern.de/gesellschaft/regional/hessen/wetter--neue-woche-startet-mit-schnee-und-glaettegefahr-34255720.html,0,www.stern.de,Wetter: Neue Woche startet mit Schnee und Glättegefahr,"Der Deutsche Wetterdienst (DWD) warnt zum Start der Woche vor glatten Straßen in Hessen. Im Bergland kann es zudem stürmische Böen geben. Ab dem späteren Vormittag ziehe von Westen her Schneefall auf, teilte der DWD am Montag mit. In tieferen Lagen könnten da…",https://image.stern.de/34255722/t/GF/v1/w1440/r1.7778/-/04--urnnewsmldpacom2009010123120499173112v3w800h600l639t434r1917b1303jpeg---db757fcfdf5576e5.jpg,2023-12-04T06:53:12Z,,Der Deutsche Wetterdienst (DWD) warnt zum Start der Woche vor glatten Straßen in Hessen. Im Bergland kann es zudem stürmische Böen geben. Ab dem späteren Vormittag ziehe von Westen her Schneefall auf… [+1176 chars],,de,'Schnee'
https://www.zeit.de/news/2023-12/04/schneefall-frost-und-glaette-in-berlin-und-brandenburg,https://www.zeit.de/news/2023-12/04/schneefall-frost-und-glaette-in-berlin-und-brandenburg,0,www.zeit.de,"Wetter: Schneefall, Frost und Glätte in Berlin und Brandenburg","Hier finden Sie Informationen zu dem Thema „Wetter“. Lesen Sie jetzt „Schneefall, Frost und Glätte in Berlin und Brandenburg“.",https://img.zeit.de/news/2023-12/04/schneefall-frost-und-glaette-in-berlin-und-brandenburg-image-group/wide__1300x731,2023-12-04T06:54:16Z,,Zum Beginn der neuen Woche müssen sich die Menschen in Berlin und Brandenburg weiter warm anziehen. Der Deutsche Wetterdienst (DWD) warnt vor frostigen Temperaturen zwischen minus drei und minus sech… [+833 chars],,de,'Schnee'
https://www.welt.de/politik/ausland/video248864564/Soeldner-in-russischer-Armee-In-Zukunft-kann-es-sein-dass-man-auch-auf-Iraker-Syrer-und-Afghanen-zurueckgreift.html,https://www.welt.de/politik/ausland/video248864564/Soeldner-in-russischer-Armee-In-Zukunft-kann-es-sein-dass-man-auch-auf-Iraker-Syrer-und-Afghanen-zurueckgreift.html,0,www.welt.de,"„In Zukunft kann es sein, dass man auch auf Iraker, Syrer und Afghanen zurückgreift“","Die russische Armee wird jetzt auch offiziell mit ausländischen Söldnern aufgestockt. „Putin hat angeordnet, dass die Armee um 170.000 Man erweitert wird“, berichtet WELT-Korrespondent Christoph Wanner aus Moskau.",https://img.welt.de/img/politik/ausland/mobile248864604/1261356367-ci16x9-w1200/christoph-wanner-0412-01-jpg.jpg,2023-12-04T08:03:42Z,,"Die WELT als ePaper: Die vollständige Ausgabe steht Ihnen bereits am Vorabend zur Verfügung so sind Sie immer hochaktuell informiert. Weitere Informationen: http://epaper.welt.de 
 Der Kurz-Link die… [+49 chars]",,de,'Putin'
https://www.welt.de/finanzen/immobilien/plus248858950/Wohnungskrise-Subvention-nach-Beduerftigkeit-So-wollen-Oekonomen-Mieter-zum-Umzug-bewegen.html,https://www.welt.de/finanzen/immobilien/plus248858950/Wohnungskrise-Subvention-nach-Beduerftigkeit-So-wollen-Oekonomen-Mieter-zum-Umzug-bewegen.html,0,www.welt.de,So wollen Ökonomen Mieter zum Umzug bewegen,Eine Umfrage zeigt die Misere am Wohnungsmarkt: Die zunehmende Knappheit macht viele Haushalte quasi bewegungsunfähig. Vor allem Geringverdiener sind betroffen. Unter Vermietern und Ökonomen wächst nun die Sympathie für einen heiklen Vorschlag.,https://img.welt.de/img/finanzen/immobilien/mobile248859232/4911351807-ci16x9-w1200-fnov-fpotl-fpi157750653/Silhouette-by-city-view.jpg,2023-12-04T10:47:24Z,,"Die WELT als ePaper: Die vollständige Ausgabe steht Ihnen bereits am Vorabend zur Verfügung so sind Sie immer hochaktuell informiert. Weitere Informationen: http://epaper.welt.de 
 Der Kurz-Link die… [+49 chars]",,de,'Knappheit'
https://www.bild.de/regional/berlin/berlin-aktuell/berlin-fluechtlingszentrum-kostet-1-17-millionen-euro-jeden-tag-86319710.bild.html,https://www.bild.de/regional/berlin/berlin-aktuell/berlin-fluechtlingszentrum-kostet-1-17-millionen-euro-jeden-tag-86319710.bild.html,0,www.bild.de,"In Berlin - Flüchtlingszentrum kostet jeden Tag 1,17 Mio. Euro",Mit den Ankunftszahlen der Flüchtlinge steigen die Kosten fürs Land Berlin.Foto: Sebastian Gollnow/dpa,"https://images.bild.de/656dbc07834e2f74ccd206a2/cffee7d7dbc995bc066ccb661ca1ccce,8cd60637?w=1280",2023-12-04T11:56:44Z,,"Berlin Kosten-Explosion in der Hauptstadt!
Ganz Deutschland versucht die Flüchtlingskrise zu meistern trotz Wohnungsnot und überforderten Behörden. Jetzt wird erstmals deutlich, wie viel die Unterbr… [+2275 chars]",,de,'Explosion'
https://www.zeit.de/news/2023-12/04/einbrecher-durch-schuhspuren-im-schnee-ueberfuehrt,https://www.zeit.de/news/2023-12/04/einbrecher-durch-schuhspuren-im-schnee-ueberfuehrt,0,www.zeit.de,Ermittlungen: Einbrecher durch Schuhspuren im Schnee überführt,Hier finden Sie Informationen zu dem Thema „Ermittlungen“. Lesen Sie jetzt „Einbrecher durch Schuhspuren im Schnee überführt“.,https://img.zeit.de/news/2023-12/04/einbrecher-durch-schuhspuren-im-schnee-ueberfuehrt-image-group/wide__1300x731,2023-12-04T13:52:20Z,https://web.archive.org/web/20231204163641/https://www.zeit.de/news/2023-12/04/einbrecher-durch-schuhspuren-im-schnee-ueberfuehrt,"Durch Schuhspuren im Schnee sind mutmaßliche Einbrecher in der Oberpfalz überführt worden. Ein Mann hatte am Sonntag verdächtige Spuren, die rund um mehrere Häuser in Birgland (Landkreis Amberg-Sulzb… [+587 chars]",,de,'Schnee'
https://www.zeit.de/news/2023-12/04/schnee-und-frost-spielbetrieb-im-amateurfussball-ruht-weiter,https://www.zeit.de/news/2023-12/04/schnee-und-frost-spielbetrieb-im-amateurfussball-ruht-weiter,0,www.zeit.de,Fußball: Schnee und Frost: Spielbetrieb im Amateurfußball ruht weiter,Hier finden Sie Informationen zu dem Thema „Fußball“. Lesen Sie jetzt „Schnee und Frost: Spielbetrieb im Amateurfußball ruht weiter“.,https://img.zeit.de/news/2023-12/04/schnee-und-frost-spielbetrieb-im-amateurfussball-ruht-weiter-image-group/wide__1300x731,2023-12-04T15:37:28Z,https://web.archive.org/web/20231204163041/https://www.zeit.de/news/2023-12/04/schnee-und-frost-spielbetrieb-im-amateurfussball-ruht-weiter,"Wegen der anhaltend frostigen Witterungsverhältnisse ruht der Spielbetrieb im Berliner Amateur-Fußball weiter. Alle Partien bis einschließlich Donnerstag seien abgesagt worden, teilte der Berliner Fu… [+360 chars]",,de,'Schnee'
https://www.zeit.de/news/2023-12/04/weihnachtsmaerkte-protestieren-gegen-gema-kosten,https://www.zeit.de/news/2023-12/04/weihnachtsmaerkte-protestieren-gegen-gema-kosten,0,www.zeit.de,Musik: Weihnachtsmärkte protestieren gegen Gema-Kosten,Hier finden Sie Informationen zu dem Thema „Musik“. Lesen Sie jetzt „Weihnachtsmärkte protestieren gegen Gema-Kosten“.,https://img.zeit.de/news/2023-12/04/weihnachtsmaerkte-protestieren-gegen-gema-kosten-image-group/wide__1300x731,2023-12-04T16:05:24Z,,Als Protest gegen die aus ihrer Sicht hohen Musiklizenz-Kosten der Gema spielen am Montag deutschlandweit viele Weihnachtsmärkte keine Musik. An dem sogenannten «Tag der Stille» beteiligen sich neben… [+2137 chars],,de,'Kosten'
https://www.zeit.de/news/2023-12/04/armut-und-ungleichheit-europarat-mahnt-deutschland,https://www.zeit.de/news/2023-12/04/armut-und-ungleichheit-europarat-mahnt-deutschland,0,www.zeit.de,Gesellschaft : Armut und Ungleichheit: Europarat mahnt Deutschland,Hier finden Sie Informationen zu dem Thema „Gesellschaft “. Lesen Sie jetzt „Armut und Ungleichheit: Europarat mahnt Deutschland“.,https://img.zeit.de/news/2023-12/04/armut-und-ungleichheit-europarat-mahnt-deutschland-image-group/wide__1300x731,2023-12-04T16:24:58Z,https://web.archive.org/web/20231205011909/https://www.zeit.de/news/2023-12/04/armut-und-ungleichheit-europarat-mahnt-deutschland,Der Europarat sieht in Deutschland Lücken bei der Bekämpfung von Armut und sozialer Ungleichheit. In der Bundesrepublik führten «anhaltende Probleme beim Zugang zu sozialen Rechten zu einem besorgnis… [+2356 chars],,de,'Armut'
https://www.zeit.de/news/2023-12/04/lula-justiz-entscheidet-ueber-putin-verhaftung-bei-g20,https://www.zeit.de/news/2023-12/04/lula-justiz-entscheidet-ueber-putin-verhaftung-bei-g20,0,www.zeit.de,Haftbefehl gegen Kremlchef: Lula: Justiz entscheidet über Putin-Verhaftung bei G20,Hier finden Sie Informationen zu dem Thema „Haftbefehl gegen Kremlchef“. Lesen Sie jetzt „Lula: Justiz entscheidet über Putin-Verhaftung bei G20“.,https://img.zeit.de/news/2023-12/04/lula-justiz-entscheidet-ueber-putin-verhaftung-bei-g20-image-group/wide__1300x731,2023-12-04T16:46:17Z,,"Der brasilianische Präsident Luiz Inácio Lula da Silva will Russlands Staatschef Wladimir Putin für den G20-Gipfel im kommenden Jahr in Rio de Janeiro keine Sicherheitsgarantie geben.
Mehr Schlagzei… [+1144 chars]",,de,'Putin'
https://www.faz.net/aktuell/rhein-main/frankfurt/diese-vorschriften-wuerde-die-bauwirtschaft-gern-streichen-19359725.html,https://www.faz.net/aktuell/rhein-main/frankfurt/diese-vorschriften-wuerde-die-bauwirtschaft-gern-streichen-19359725.html,0,www.faz.net,Krise auf dem Bau: Diese Vorschriften würde die Bauwirtschaft gern streichen,"Durch Inflation und Zinsen ist das Bauen von Wohnhäusern nicht länger rentabel. Die Unternehmer in Hessen haben den Koalitionsverhandlern von CDU und SPD in Wiesbaden nun einen Katalog vorgelegt, was sich ändern müsste.",https://media0.faz.net/ppmedia/aktuell/sport/446234795/1.9360794/facebook_teaser/immer-aerger-auf-dem-bau-die.jpg,2023-12-04T17:00:37Z,https://web.archive.org/web/20231204192452/https://www.faz.net/aktuell/rhein-main/frankfurt/diese-vorschriften-wuerde-die-bauwirtschaft-gern-streichen-19359725.html,Die hessische Verwaltungsvorschrift Technische Baubestimmungen umfasst 538 Seiten. Das Deutsche Institut für Bautechnik benötige für seine Muster-Verwaltungsvorschrift aber nur 352 Seiten. Die Bauwir… [+4979 chars],,de,'Knappheit'
https://www.stern.de/politik/ausland/staatsoberhaupt--putin--gute-beziehungen-zwischen-moskau-und-berlin-gesprengt-34257808.html,https://www.stern.de/politik/ausland/staatsoberhaupt--putin--gute-beziehungen-zwischen-moskau-und-berlin-gesprengt-34257808.html,0,www.stern.de,Staatsoberhaupt: Putin: Gute Beziehungen zwischen Moskau und Berlin gesprengt,"In seiner Rede zur Amtseinführung neuer Botschafter in Moskau kritisiert Kremlchef Putin die ""Sabotage an Nord Stream"" und gibt der Bundesregierung die Schuld an der aktuellen Eiszeit.",https://image.stern.de/34257810/t/pb/v1/w1440/r1.7778/-/04--urnnewsmldpacom2009010123120499180148v3w800h600l1026t102r1942b1206jpeg---8efe0a4ae1dcfbe1.jpg,2023-12-04T17:06:56Z,,"In seiner Rede zur Amtseinführung neuer Botschafter in Moskau kritisiert Kremlchef Putin die ""Sabotage an Nord Stream"" und gibt der Bundesregierung die Schuld an der aktuellen Eiszeit.
Russlands Prä… [+1854 chars]",,de,'Explosion'
https://www.zeit.de/news/2023-12/04/putin-gute-beziehungen-zwischen-moskau-und-berlin-gesprengt,https://www.zeit.de/news/2023-12/04/putin-gute-beziehungen-zwischen-moskau-und-berlin-gesprengt,0,www.zeit.de,Staatsoberhaupt: Putin: Gute Beziehungen zwischen Moskau und Berlin gesprengt,Hier finden Sie Informationen zu dem Thema „Staatsoberhaupt“. Lesen Sie jetzt „Putin: Gute Beziehungen zwischen Moskau und Berlin gesprengt“.,https://img.zeit.de/news/2023-12/04/putin-gute-beziehungen-zwischen-moskau-und-berlin-gesprengt-image-group/wide__1300x731,2023-12-04T17:06:56Z,https://web.archive.org/web/20231205022248/https://www.zeit.de/news/2023-12/04/putin-gute-beziehungen-zwischen-moskau-und-berlin-gesprengt,Russlands Präsident Wladimir Putin hat bei der Amtseinführung neuer Botschafter in Moskau das Ende der langen Wirtschaftskooperation mit Deutschland nach Beginn des russischen Angriffskriegs gegen di… [+2332 chars],,de,'Putin'
https://www.zeit.de/news/2023-12/04/behinderungen-und-unfaelle-durch-schnee-und-glaette-in-hessen,https://www.zeit.de/news/2023-12/04/behinderungen-und-unfaelle-durch-schnee-und-glaette-in-hessen,0,www.zeit.de,Wetter: Behinderungen und Unfälle durch Schnee und Glätte in Hessen,Hier finden Sie Informationen zu dem Thema „Wetter“. Lesen Sie jetzt „Behinderungen und Unfälle durch Schnee und Glätte in Hessen“.,https://img.zeit.de/news/2023-12/04/behinderungen-und-unfaelle-durch-schnee-und-glaette-in-hessen-image-group/wide__1300x731,2023-12-04T18:22:33Z,https://web.archive.org/web/20231205023146/https://www.zeit.de/news/2023-12/04/behinderungen-und-unfaelle-durch-schnee-und-glaette-in-hessen,Schneefälle und Temperaturen um den Gefrierpunkt haben den Autofahrern am Montag im abendlichen Berufsverkehr zu schaffen gemacht. Ein Sprecher des Polizeipräsidiums Mittelhessen sprach von zahlreich… [+1692 chars],,de,'Schnee'
https://www.faz.net/aktuell/politik/ukraine-liveticker-ukraine-russland-verstaerkt-beschuss-auf-awdijiwka-faz-19030454.html,https://www.faz.net/aktuell/politik/ukraine-liveticker-ukraine-russland-verstaerkt-beschuss-auf-awdijiwka-faz-19030454.html,0,www.faz.net,Ukraine-Liveblog: Ukraine: Russland verstärkt Beschuss auf Awdijiwka,Putin bedauert Deutschlands Abkehr von russischem Gas +++ Keine Sicherheitsgarantie für Putin +++ Etwa 70.000 Russen im Krieg getötet +++ Kiew: Mehr als 20 russische Drohnenangriffe in der Nacht +++ Alle Entwicklungen im Liveblog.,https://media0.faz.net/ppmedia/aktuell/politik/3448432117/1.9361286/facebook_teaser/ein-ukrainischer-soldat.jpg,2023-12-05T02:07:36Z,https://web.archive.org/web/20231205050829/https://www.faz.net/aktuell/politik/ukraine-liveticker-ukraine-russland-verstaerkt-beschuss-auf-awdijiwka-faz-19030454.html,"Der ukrainische Präsident Wolodymyr Selenskyj will sich nach Angaben aus Washington persönlich an den US-Senat wenden, um die Dringlichkeit weiterer US-Hilfen für sein Land deutlich zu machen. Selens… [+836 chars]",,de,'Putin'
https://www.zeit.de/news/2023-12/05/ukraine-hilfen-selenskyj-soll-zu-us-senatoren-sprechen,https://www.zeit.de/news/2023-12/05/ukraine-hilfen-selenskyj-soll-zu-us-senatoren-sprechen,0,www.zeit.de,Russische Invasion: Ukraine-Hilfen: Selenskyj soll zu US-Senatoren sprechen,Hier finden Sie Informationen zu dem Thema „Russische Invasion“. Lesen Sie jetzt „Ukraine-Hilfen: Selenskyj soll zu US-Senatoren sprechen“.,https://img.zeit.de/news/2023-12/05/ukraine-hilfen-selenskyj-soll-zu-us-senatoren-sprechen-image-group/wide__1300x731,2023-12-05T02:07:52Z,https://web.archive.org/web/20231205071910/https://www.zeit.de/news/2023-12/05/ukraine-hilfen-selenskyj-soll-zu-us-senatoren-sprechen,"Der ukrainische Präsident Wolodymyr Selenskyj will sich nach Angaben aus Washington persönlich an den US-Senat wenden, um die Dringlichkeit weiterer US-Hilfen für sein Land deutlich zu machen. 
Mehr… [+2757 chars]",,de,'Waffen'
