index,url,valid,domain,title,description,image,published,archive,content,quote,language,keyword
https://www.welt.de/wirtschaft/article243017169/Twitter-bleibt-Mietzahlungen-fuer-Bueros-in-San-Francisco-schuldig.html,https://www.welt.de/wirtschaft/article243017169/Twitter-bleibt-Mietzahlungen-fuer-Bueros-in-San-Francisco-schuldig.html,0,www.welt.de,Twitter bleibt Mietzahlungen für Büros in San Francisco schuldig,"Twitter-Chef Elon Musk will beim Kurznachrichtendienst Kosten sparen. Das Unternehmen ist nun mit seinen Mietzahlungen in Rückstand, ein Vermieter reichte eine Klage ein. Twitter gibt unterdessen bekannt, seine Richtlinien für politische Werbung zu lockern.",https://img.welt.de/img/bildergalerien/mobile243017167/7161358077-ci16x9-w1200/FILE-PHOTO-Twitter-corporate-headquarters-building-in-San-Franci.jpg,2023-01-04T09:29:42Z,https://web.archive.org/web/20230104094619/http://www.welt.de/wirtschaft/article243017169/Twitter-bleibt-Mietzahlungen-fuer-Bueros-in-San-Francisco-schuldig.html,Im Bemühen um Ausgabenkürzungen beim Kurznachrichtendienst Twitter spart dessen neuer Besitzer Elon Musk offenbar auch an der Miete. Laut einer vom Vermieter eingereichten Klage schuldet Twitter für … [+2156 chars],,de,'Kosten'
https://www.tagesschau.de/wirtschaft/streiks-grossbritannien-101.html,https://www.tagesschau.de/wirtschaft/streiks-grossbritannien-101.html,0,www.tagesschau.de,Großbritannien steht vor neuer Streikwelle in vielen Branchen,"Die hohe Inflation in Großbritannien treibt die Menschen zu Demonstrationen auf die Straßen - doch es geht nicht nur ums Geld. Viele sind ausgebrannt, Pflegekräfte bemängeln die katastrophale Krankenversorgung. <em>Von Imke Köhler.</em>",https://www.tagesschau.de/multimedia/bilder/london-streik-109~_v-original.jpg,2023-01-04T09:44:49Z,,"Die hohe Inflation in Großbritannien treibt die Menschen zu Demonstrationen auf die Straßen - doch es geht nicht nur ums Geld. Viele sind ausgebrannt, Pflegekräfte bemängeln die katastrophale Kranken… [+2823 chars]",,de,'Inflation'
https://www.golem.de/sonstiges/zustimmung/auswahl.html?from=https://www.golem.de/news/energiewende-energieerzeugung-im-land-der-ideenlosigkeit-2301-170643.html&referer=https://t.co/33d80cc4b7,https://www.golem.de/sonstiges/zustimmung/auswahl.html?from=https://www.golem.de/news/energiewende-energieerzeugung-im-land-der-ideenlosigkeit-2301-170643.html&referer=https://t.co/33d80cc4b7,0,www.golem.de,Energiewende: Energieerzeugung im Land der Ideenlosigkeit,"Deutschland war vor einigen Jahren führend in der Solar- und Windenergie. Politische Fehlentscheidungen haben dazu geführt, dass das Geld mit erneuerbaren Energien anderswo verdient wird. Eine Analyse von Werner Pluta (Erneuerbare Energien, Solarenergie)",,2023-01-04T11:37:01Z,,"Besuchen Sie Golem.de wie gewohnt mit Werbung und Tracking,
 indem Sie der Nutzung aller Cookies zustimmen.
 Details zum Tracking finden Sie im Privacy Center.
Skript wurde nicht geladen. Informat… [+607 chars]",,de,'Erneuerbare Energien'
https://www.morgenpost.de/bezirke/tempelhof-schoeneberg/article237286921/Green-Buddy-Award-2023-wird-in-neuer-Kategorie-verliehen.html,https://www.morgenpost.de/bezirke/tempelhof-schoeneberg/article237286921/Green-Buddy-Award-2023-wird-in-neuer-Kategorie-verliehen.html,0,www.morgenpost.de,Erneuerbare Energien: Green Buddy Award 2023 wird in neuer Kategorie verliehen,Der Umweltpreis wird 2023 erstmals in der Kategorie Erneuerbare Energien verliehen. Bewerbungen sind jetzt möglich.,https://img.morgenpost.de/img/tempelhof-schoeneberg/crop237286919/3222603008-w820-cv16_9-q85/a767691a-8c1f-11ed-a2fa-924a4de641ea.jpg,2023-01-04T12:35:40Z,,Berlin.  Der Umweltpreis Green Buddy Award wird 2023 erstmals in einer neuen Kategorie verliehen. Ein Sieger wird nun auch im Bereich Erneuerbare Energien gekürt. Bis zum 24. April können sich Untern… [+1952 chars],,de,'Erneuerbare Energien'
https://www.wiwo.de/my/unternehmen/energie/erneuerbare-energien-windkraftausbau-im-gegenwind-der-inflation/28893830.html,https://www.wiwo.de/my/unternehmen/energie/erneuerbare-energien-windkraftausbau-im-gegenwind-der-inflation/28893830.html,0,www.wiwo.de,Erneuerbare Energien: Windkraftausbau im Gegenwind der Inflation,Sogar Bayern erkennt plötzlich seine Potenziale und will Nummer 1 bei Windkraft werden. Doch die explodierenden Kosten verschrecken Projektentwickler.,https://www.wiwo.de/images/windraeder-hinter-stromleitungen/28893850/2-format11240.jpg,2023-01-04T12:46:17Z,,Für Nachrichtenseiten wie WirtschaftsWoche Online sind Anzeigen eine wichtige Einnahmequelle. Mit den Werbeerlösen können wir die Arbeit unserer Redaktion bezahlen und Qualitätsartikel kostenfrei ver… [+173 chars],,de,'Erneuerbare Energien'
https://www.handelsblatt.com/unternehmen/energie/erneuerbare-energien-deutschland-muss-bis-ende-2029-taeglich-sechs-windraeder-bauen/28881822.html,https://www.handelsblatt.com/unternehmen/energie/erneuerbare-energien-deutschland-muss-bis-ende-2029-taeglich-sechs-windraeder-bauen/28881822.html,0,www.handelsblatt.com,Erneuerbare Energien: Deutschland muss bis Ende 2029 täglich sechs Windräder bauen,Die Ziele der Bundesregierung für erneuerbare Energien bis 2030 sind kaum zu schaffen. Es werden vor allem viel zu wenig Windräder in Deutschland gebaut.,https://www.handelsblatt.com/images/windraeder-in-baden-wuerttemberg/28892188/2-format2003.jpg,2023-01-04T12:51:29Z,,"Windräder in Baden-WürttembergOhne ausreichend Ökostrom wird Deutschland laut Expertinnen und Experten nicht nur die Klimaziele verfehlen auch die Industrie könnte abwandern.
(Foto: dpa)
Berlin, Dü… [+1292 chars]",,de,'Erneuerbare Energien'
https://www.tagesschau.de/inland/lotto-millionaere-bilanz-2022-101.html,https://www.tagesschau.de/inland/lotto-millionaere-bilanz-2022-101.html,0,www.tagesschau.de,Lotto-Bilanz 2022: Wer wird Millionär?,Trotz Inflation und Energiekrise haben die Menschen in Deutschland 2022 etwas mehr Geld fürs Lottospielen ausgegeben als im Vorjahr. Das führte im November zu einem Rekordgewinn von 120 Millionen Euro - ein höchst unwahrscheinlicher Fall.,https://www.tagesschau.de/ardimport/regional/sachsenanhalt/mdr-image-45233~_v-original.jpg,2023-01-04T12:59:40Z,,Trotz Inflation und Energiekrise haben die Menschen in Deutschland 2022 etwas mehr Geld fürs Lottospielen ausgegeben als im Vorjahr. Das führte im November zu einem Rekordgewinn von 120 Millionen Eur… [+2731 chars],,de,'Inflation'
https://www.faz.net/aktuell/wirtschaft/strombilanz-2022-mehr-produziert-weniger-verbraucht-18578360.html,https://www.faz.net/aktuell/wirtschaft/strombilanz-2022-mehr-produziert-weniger-verbraucht-18578360.html,0,www.faz.net,"Strombilanz 2022: Mehr produziert, weniger verbraucht",Der Stromverbrauch ist im vergangenen Jahr deutlich zurückgegangen. Gleichzeitig produzierte Deutschland mehr Strom als im Vorjahr. Besonders erneuerbare Energien legten zu – aber auch die Erzeugung durch Kohle.,https://media1.faz.net/ppmedia/aktuell/wirtschaft/3222967826/1.8578367/facebook_teaser/windkraftanlagen-steigerten.jpg,2023-01-04T13:27:11Z,,"Im vergangenen Jahr ist der Stromverbrauch in Deutschland spürbar gesunken. Die Stromproduktion nahm dagegen zu, wie die Bundesnetzagentur am Mittwoch mitteilte. Insgesamt seien in der Bundesrepublik… [+1364 chars]",,de,'Erneuerbare Energien'
https://www.faz.net/aktuell/politik/ukraine-liveticker-putin-stellt-hyperschallraketen-auf-kriegsschiff-in-dienst-18495964.html,https://www.faz.net/aktuell/politik/ukraine-liveticker-putin-stellt-hyperschallraketen-auf-kriegsschiff-in-dienst-18495964.html,0,www.faz.net,Ukraine-Liveblog: Putin stellt Hyperschallraketen auf Kriegsschiff in Dienst,Russen berichten von abgewehrtem Drohnenangriff auf die Krim +++ Caritas rechnet mit Flüchtlingswelle aus Ukraine +++ Ukraine will auf Erneuerbare Energien setzen +++ alle Entwicklungen im Liveblog.,https://media0.faz.net/ppmedia/aktuell/4276426104/1.8578548/facebook_teaser/dieses-foto-das-die-staatliche.jpg,2023-01-04T14:27:42Z,,Nach den ukrainischen Angriffen auf eine russische Militärunterkunft in Makijiwka im Gebiet Donezk hat das Verteidigungsministerium in Moskau mehr Details zum Geschehen bekanntgegeben und Fehler eing… [+1954 chars],,de,'Erneuerbare Energien'
https://www.focus.de/finanzen/energiekrise-in-deutschland-der-gaspreis-sinkt-aber-verbraucher-warten-weiter-auf-entlastung_id_182126287.html,https://www.focus.de/finanzen/energiekrise-in-deutschland-der-gaspreis-sinkt-aber-verbraucher-warten-weiter-auf-entlastung_id_182126287.html,0,www.focus.de,"Energiekrise in Deutschland - Der Gaspreis sinkt, aber Verbraucher warten weiter auf Entlastung","Nicht nur für Strom müssen Verbraucherinnen und Verbraucher in Deutschland seit Jahresbeginn tiefer in die Tasche greifen, auch Gas wurde mit dem Beginn des Krieges in der Ukraine immer teuer. Am Gasmarkt fällt der Preis nun auf einen Tiefstand. Private Haush…",https://p6.focus.de/img/fotos/id_182124987/europaeischer-gaspre-76473797.jpg?im=Crop%3D%280%2C411%2C3464%2C1732%29%3BResize%3D%281200%2C627%29&impolicy=perceptual&quality=medium&hash=56e6636e93c99ab6614835eaf7d4eeafa6468fc0f2f76ac31758cfa5ed90e2d0,2023-01-04T14:38:35Z,https://web.archive.org/web/20230104152446/https://www.focus.de/finanzen/energiekrise-in-deutschland-der-gaspreis-sinkt-aber-verbraucher-warten-weiter-auf-entlastung_id_182126287.html,"Nicht nur für Strom müssen Verbraucherinnen und Verbraucher in Deutschland seit Jahresbeginn tiefer in die Tasche greifen, auch Gas wurde mit dem Beginn des Krieges in der Ukraine immer teuer. Am Gas… [+5997 chars]",,de,'Gasspeicher'
https://www.faz.net/aktuell/politik/ausland/bulgariens-gasversorgung-ohne-russland-putins-plan-ging-nicht-auf-18576429.html,https://www.faz.net/aktuell/politik/ausland/bulgariens-gasversorgung-ohne-russland-putins-plan-ging-nicht-auf-18576429.html,0,www.faz.net,Gasversorgung in Bulgarien: Es geht auch ohne Russland,"Im April hat Putin Bulgarien das Gas abgedreht. Sein Machtspiel aber ging nicht auf. Dafür sorgten die EU, die USA, ein türkischer Autokrat, ein kaukasischer Diktator und internationale Energiekonzerne.",https://media0.faz.net/ppmedia/aktuell/2226125807/1.8576470/facebook_teaser/hoechste-prioritaet-im-oktober.jpg,2023-01-04T14:51:05Z,http://archive.md/20230111060929/https://www.faz.net/aktuell/politik/ausland/bulgariens-gasversorgung-ohne-russland-putins-plan-ging-nicht-auf-18576429.html,"Höchste Priorität: Im Oktober ging der Interkonnektor zwischen Griechenland und Bulgarien in Betrieb (hier eine Baustelle im griechischen Komotini im März) Bild: Bloomberg
Im April hat Putin Bulgari… [+2964 chars]",,de,'Putin'
https://www.tagesschau.de/inland/aerzteverband-vier-tage-woche-101.html,https://www.tagesschau.de/inland/aerzteverband-vier-tage-woche-101.html,0,www.tagesschau.de,Ärzteverband ruft Vier-Tage-Woche auf,"Der Ärzteverband Virchowbund schlägt eine Vier-Tage-Woche für Arztpraxen vor. Gründe dafür seien wirtschaftliche Überlegungen, zum Beispiel steigende Kosten durch die Inflation. Es soll aber auch ein Zeichen sein.",https://www.tagesschau.de/multimedia/bilder/arztpraxis-aerztin-101~_v-original.jpg,2023-01-04T15:02:20Z,,"Der Ärzteverband Virchowbund schlägt eine Vier-Tage-Woche für Arztpraxen vor. Gründe dafür seien wirtschaftliche Überlegungen, zum Beispiel steigende Kosten durch die Inflation. Es soll aber auch ein… [+1695 chars]",,de,'Inflation'
https://www.handelsblatt.com/unternehmen/energie/fuellstand-in-deutschland-gasspeicher-wieder-zu-90-prozent-gefuellt-/28819652.html,https://www.handelsblatt.com/unternehmen/energie/fuellstand-in-deutschland-gasspeicher-wieder-zu-90-prozent-gefuellt-/28819652.html,0,www.handelsblatt.com,Füllstand in Deutschland: Gasspeicher wieder zu 90 Prozent gefüllt,Ein hoher Gasspeicher-Füllstand ist für Deutschlands Gasversorgung in der Energiekrise essenziell. Wie steht es aktuell um die Gasreserven? Ein Überblick.,https://www.handelsblatt.com/images/gasspeicher-in-sachsen-anhalt/28877480/2-format2003.jpg,2023-01-04T15:06:20Z,https://web.archive.org/web/20230104155321/https://www.handelsblatt.com/unternehmen/energie/fuellstand-in-deutschland-gasspeicher-wieder-zu-90-prozent-gefuellt-/28819652.html,"Gasspeicher in Sachsen-AnhaltDer Gasspeicher-Füllstand in Deutschland ist in der Energiekrise zum wichtigen Faktor geworden.
(Foto: dpa)
Düsseldorf Ein stabiler Füllstand der deutschen Gasspeicher … [+8111 chars]",,de,'Gasspeicher'
https://www.tagesschau.de/wirtschaft/konjunktur/stromverbrauch-energiequellen-klimabilanz-101.html,https://www.tagesschau.de/wirtschaft/konjunktur/stromverbrauch-energiequellen-klimabilanz-101.html,0,www.tagesschau.de,"Mehr Erneuerbare, aber auch mehr Kohle bei Stromerzeugung",Der Anteil erneuerbarer Energien an der Stromerzeugung ist im vergangenen Jahr gestiegen. Doch der vermehrte Einsatz von Kohle als Gas-Ersatz und hoher CO2-Ausstoß in anderen Sektoren machen die Klimabilanz Deutschlands zunichte.,https://www.tagesschau.de/multimedia/bilder/strom-145~_v-original.jpg,2023-01-04T15:32:24Z,,Der Anteil erneuerbarer Energien an der Stromerzeugung ist im vergangenen Jahr gestiegen. Doch der vermehrte Einsatz von Kohle als Gas-Ersatz und hoher CO2-Ausstoß in anderen Sektoren machen die Klim… [+2871 chars],,de,'Erneuerbare Energien'
https://www.handelsblatt.com/unternehmen/energie/erdgas-europas-lng-kaeufe-reissen-weltweit-luecken/28902424.html,https://www.handelsblatt.com/unternehmen/energie/erdgas-europas-lng-kaeufe-reissen-weltweit-luecken/28902424.html,0,www.handelsblatt.com,Erdgas: Europas LNG-Käufe reißen weltweit Lücken,Russland exportiert kaum noch Erdgas – so fehlen dem Weltmarkt riesige Gasmengen. Deutschland kauft für viel Geld Ersatz. Aber ärmere Länder haben ein Problem.,https://www.handelsblatt.com/images/deutschlands-erstes-lng-tterminal-in-wilhelmshaven/28902546/2-format2003.jpg,2023-01-04T16:25:31Z,http://archive.md/20230105005209/https://www.handelsblatt.com/unternehmen/energie/erdgas-europas-lng-kaeufe-reissen-weltweit-luecken/28902424.html,"Deutschlands erstes LNG-Tterminal in WilhelmshavenEs zeichnet sich ab, dass einige Länder in diesem Jahr wieder deutlich mehr LNG kaufen wollen und der Kampf um Gas auf dem Weltmarkt noch größer wird… [+1072 chars]",,de,'Gasspeicher'
https://taz.de/Energieversorgung-in-Deutschland/!5903925/,https://taz.de/Energieversorgung-in-Deutschland/!5903925/,0,taz.de,Energieversorgung in Deutschland: Norwegen wichtigster Gaslieferant,Die Skandinavier lösen Russland als Gasimporteur Nummer 1 ab. Auch dank des milden Wetters bleibt die Energieversorgung stabil.,https://taz.de/picture/6013125/948/31868176-1.jpeg,2023-01-04T17:00:00Z,https://web.archive.org/web/20230104170526/https://taz.de/Energieversorgung-in-Deutschland/!5903925/,"Die Skandinavier lösen Russland als Gasimporteur Nummer 1 ab. Auch dank des milden Wetters bleibt die Energieversorgung stabil.
Spezialschiff Höegh Esperanza für neues LNG-Terminal Foto: Spezialschi… [+3961 chars]",,de,'Russland'
https://www.faz.net/aktuell/politik/ukraine-liveticker-frankreich-will-der-ukraine-leichte-kampfpanzer-liefern-18495964.html,https://www.faz.net/aktuell/politik/ukraine-liveticker-frankreich-will-der-ukraine-leichte-kampfpanzer-liefern-18495964.html,0,www.faz.net,Ukraine-Liveblog: Frankreich will der Ukraine „leichte Kampfpanzer“ liefern,Putin stellt Hyperschallraketen auf Kriegsschiff in Dienst +++ Russen berichten von abgewehrtem Drohnenangriff auf die Krim +++ Caritas rechnet mit Flüchtlingswelle aus Ukraine +++ alle Entwicklungen im Liveblog.,https://media0.faz.net/ppmedia/aktuell/politik/2490150470/1.8579408/facebook_teaser/emmanuel-macron-hat-der.jpg,2023-01-04T17:21:48Z,https://web.archive.org/web/20230104175903/https://www.faz.net/aktuell/politik/ukraine-liveticker-frankreich-will-der-ukraine-leichte-kampfpanzer-liefern-18495964.html,In seinem täglichen Lagebericht zum Ukrainekrieg schreibt das britische Verteidigungsministerium:Am 31. Dezember 2022 beschoss die Ukraine in der russisch kontrollierten Stadt Makijiwka in der Nähe v… [+759 chars],,de,'Ukraine'
https://www.focus.de/politik/deutschland/klarer-widerspruch-zu-den-klimazielen-denkfabrik-agora-energiewende-deutsche-emissionsziele-2022-erneut-verfehlt_id_182147858.html,https://www.focus.de/politik/deutschland/klarer-widerspruch-zu-den-klimazielen-denkfabrik-agora-energiewende-deutsche-emissionsziele-2022-erneut-verfehlt_id_182147858.html,0,www.focus.de,Emissionsziele laut Bericht erneut verfehlt - Deutscher CO2-Ausstoß steht im „klaren Widerspruch zu den Klimazielen“,Das Thinktank Agora Energiewende veröffentlichte am Mittwoch eine Auswertung der deutschen Treibhausgasemissionen im Jahr 2022. Demnach wurden die Ziele zur Senkung erneut verfehlt. Grund dafür sei unter anderem die gestiegene Kohleverstromung. Auch in den Be…,https://p6.focus.de/img/regional/bayern/id_181952046/pkw-und-reisebusse-stehen-auf-der-a8-richtung-norden-im-stau..jpg?im=Crop%3D%280%2C222%2C2048%2C1024%29%3BResize%3D%281200%2C627%29&hash=b76f64b412128e3f73d11ef8068090bf1c743c9bd10628439b710872f2eb12b2,2023-01-04T17:25:13Z,https://web.archive.org/web/20230104180433/https://www.focus.de/politik/deutschland/klarer-widerspruch-zu-den-klimazielen-denkfabrik-agora-energiewende-deutsche-emissionsziele-2022-erneut-verfehlt_id_182147858.html,Trotz eines gesunkenen Energieverbrauchs und eines hohen Anteils der Erneuerbaren Energien hat Deutschland 2022 die Ziele zur Senkung der Treibhausgasemissionen erneut verfehlt. Grund dafür ist maßge… [+4072 chars],,de,'Kohle'
https://www.zeit.de/news/2023-01/04/frankreich-will-ukraine-leichte-kampfpanzer-liefern,https://www.zeit.de/news/2023-01/04/frankreich-will-ukraine-leichte-kampfpanzer-liefern,0,www.zeit.de,Waffen: Frankreich will Ukraine «leichte Kampfpanzer» liefern,,,2023-01-04T17:30:49Z,https://web.archive.org/web/20230104175427/https://www.zeit.de/news/2023-01/04/frankreich-will-ukraine-leichte-kampfpanzer-liefern,"When browsing with ads:
We collect personal data and also transmit it to third-party providers
 that help us improve and finance our digital content. Some of the information stored on your device, … [+732 chars]",,de,'Ukraine'
https://www.n-tv.de/politik/Geheimdienstchef-Ukraine-plant-Grossoffensive-im-Fruehjahr-article23822841.html,https://www.n-tv.de/politik/Geheimdienstchef-Ukraine-plant-Grossoffensive-im-Fruehjahr-article23822841.html,0,www.n-tv.de,Kiew hofft auf US-Schützenpanzer: Geheimdienstchef: Ukraine plant Großoffensive im Frühjahr,Nach den erfolgreichen Gegenoffensiven in den Regionen Charkiw und Cherson arbeitet Kiew laut Geheimdienstleiter Budanow an einer neuen Militäroperation. Intensive Kämpfe erwartet der 37-Jährige im kommenden März. Auch mit weiteren Angriffen auf russisches Te…,https://bilder4.n-tv.de/img/incoming/crop23822879/5491322524-cImg_16_9-w1200/AP22358704757269.jpg,2023-01-04T21:02:31Z,,Nach den erfolgreichen Gegenoffensiven in den Regionen Charkiw und Cherson arbeitet Kiew laut Geheimdienstleiter Budanow an einer neuen Militäroperation. Intensive Kämpfe erwartet der 37-Jährige im k… [+2037 chars],,de,'Explosion'
https://www.zeit.de/news/2023-01/05/usa-erwaegen-lieferung-von-schuetzenpanzern-an-die-ukraine,https://www.zeit.de/news/2023-01/05/usa-erwaegen-lieferung-von-schuetzenpanzern-an-die-ukraine,0,www.zeit.de,Waffen: USA erwägen Lieferung von Schützenpanzern an die Ukraine,,,2023-01-05T01:16:32Z,,"When browsing with ads:
We collect personal data and also transmit it to third-party providers
 that help us improve and finance our digital content. Some of the information stored on your device, … [+732 chars]",,de,'Ukraine'
https://www.nzz.ch/feuilleton/sergei-gerasimow-kriegstagebuch-aus-charkiw-teil-377-ld.1718631,https://www.nzz.ch/feuilleton/sergei-gerasimow-kriegstagebuch-aus-charkiw-teil-377-ld.1718631,0,www.nzz.ch,"SERIE - «Russland ist ein Terrorstaat», steht in grossen roten und blauen Buchstaben auf Ukrainisch auf dem Lieferwagen geschrieben. Ich kann dem wirklich nur zustimmen","Sergei Gerasimow harrt in Charkiw aus. In seinem Kriegstagebuch berichtet der ukrainische Schriftsteller über den schrecklichen, auch absurden Alltag in einer Stadt, die noch immer beschossen wird.","https://img.nzz.ch/2022/12/30/d0f39444-118c-40f5-94e9-6dfe9fcaef02.jpeg?width=1200&height=675&fit=bound&quality=75&auto=webp&crop=4000,2250,x0,y288&wmark=nzz",2023-01-05T04:30:00Z,,"Eine ältere Frau unterwegs zu einer der Stellen, an der humanitäre Hilfe für Notleidende verteilt wird. 
4. Dezember 2022
Bei der Beschiessung von Charkiw haben die Russen immer aus dem Norden oder… [+4366 chars]",,de,'Explosion'
https://www.faz.net/aktuell/politik/ukraine-liveticker-csu-fordert-lieferung-von-leopard-2-panzer-18495964.html,https://www.faz.net/aktuell/politik/ukraine-liveticker-csu-fordert-lieferung-von-leopard-2-panzer-18495964.html,0,www.faz.net,Ukraine-Liveblog: CSU fordert Lieferung von Leopard-2-Panzern,Frankreich will der Ukraine „leichte Kampfpanzer“ liefern +++ Putin stellt Hyperschallraketen auf Kriegsschiff in Dienst +++ Russen berichten von abgewehrtem Drohnenangriff auf die Krim +++ alle Entwicklungen im Liveblog.,https://media1.faz.net/ppmedia/aktuell/politik/1365323189/1.8579779/facebook_teaser/ein-kampfpanzer-leopard-2.jpg,2023-01-05T04:44:21Z,https://web.archive.org/web/20230105051737/https://www.faz.net/aktuell/politik/ukraine-liveticker-csu-fordert-lieferung-von-leopard-2-panzer-18495964.html,In seinem täglichen Lagebericht zum Ukrainekrieg schreibt das britische Verteidigungsministerium:Am 31. Dezember 2022 beschoss die Ukraine in der russisch kontrollierten Stadt Makijiwka in der Nähe v… [+759 chars],,de,'Putin'
https://stadt-bremerhaven.de/sony-playstation-5-knappheit-soll-beendet-sein/,https://stadt-bremerhaven.de/sony-playstation-5-knappheit-soll-beendet-sein/,0,stadt-bremerhaven.de,Sony PlayStation 5: Knappheit soll beendet sein,"Ihr gehört immer noch zu den Menschen, die eine Sony PlayStation 5 wollen, aber bisher keine bekamen? Dann dürfte es gute Nachrichten geben. Auf Sonys Pressekonferenz in Las Vegas gab das Unternehmen nicht nur bekannt, dass man mehr 30 Millionen...Zum Beitrag…",https://stadt-bremerhaven.de/wp-content/uploads/2022/03/PlayStation-5-hello-i-m-nik-wmY7gKdYSmI-unsplash_.jpg,2023-01-05T05:56:13Z,,"Photo by Hello I’m Nik on Unsplash
Ihr gehört immer noch zu den Menschen, die eine Sony PlayStation 5 wollen, aber bisher keine bekamen? Dann dürfte es gute Nachrichten geben. Auf Sonys Pressekonfer… [+1164 chars]",,de,'Knappheit'
https://www.stern.de/gesellschaft/regional/hessen/explosion--geldautomat-im-frankfurter-stadtteil-griesheim-gesprengt-33070074.html,https://www.stern.de/gesellschaft/regional/hessen/explosion--geldautomat-im-frankfurter-stadtteil-griesheim-gesprengt-33070074.html,0,www.stern.de,Explosion: Geldautomat im Frankfurter Stadtteil Griesheim gesprengt,"Unbekannte haben einen Geldautomaten im Frankfurter Stadtteil Griesheim gesprengt. Am frühen Donnerstagmorgen sei die Explosion in einer Bankfiliale gemeldet worden, teilte die Polizei mit. Ob die Täter Geld erbeuten konnten, war zunächst unklar. Ein Gebäudes…",https://image.stern.de/33070076/t/gp/v1/w1440/r1.7778/-/05--urnnewsmldpacom2009010123010599109893v3w800h600l581t0r1692b1247jpeg---7837d6f76371bcb8.jpg,2023-01-05T06:47:58Z,https://web.archive.org/web/20230105070911/https://www.stern.de/gesellschaft/regional/hessen/explosion--geldautomat-im-frankfurter-stadtteil-griesheim-gesprengt-33070074.html,"Unbekannte haben einen Geldautomaten im Frankfurter Stadtteil Griesheim gesprengt. Am frühen Donnerstagmorgen sei die Explosion in einer Bankfiliale gemeldet worden, teilte die Polizei mit. Ob die Tä… [+401 chars]",,de,'Explosion'
https://www.faz.net/aktuell/politik/ukraine-liveticker-russland-hat-wohl-seine-luftwaffe-verlagert-18495964.html,https://www.faz.net/aktuell/politik/ukraine-liveticker-russland-hat-wohl-seine-luftwaffe-verlagert-18495964.html,0,www.faz.net,Ukraine-Liveblog: Erdogan ruft Putin zu „einseitiger Waffenruhe“ auf,CSU fordert Lieferung von Leopard-2-Panzer +++ Frankreich will der Ukraine „leichte Kampfpanzer“ liefern +++ Putin stellt Hyperschallraketen auf Kriegsschiff in Dienst +++ alle Entwicklungen im Liveblog.,https://media0.faz.net/ppmedia/aktuell/politik/1746139479/1.8580350/facebook_teaser/der-tuerkische-praesident.jpg,2023-01-05T07:12:47Z,https://web.archive.org/web/20230105111957/https://www.faz.net/aktuell/politik/ukraine-liveticker-russland-hat-wohl-seine-luftwaffe-verlagert-18495964.html,"Der türkische Präsident Recep Tayyip Erdogan hat den russischen Staatschef Wladimir Putin am Donnerstag aufgerufen, eine einseitige Waffenruhe"" in der Ukraine zu erklären. Während eines Telefongesprä… [+877 chars]",,de,'Putin'
https://www.bild.de/regional/frankfurt/frankfurt-aktuell/wiesbaden-defekte-gasleitung-zwei-verletzte-bei-explosion-in-garage-82449614.bild.html,https://www.bild.de/regional/frankfurt/frankfurt-aktuell/wiesbaden-defekte-gasleitung-zwei-verletzte-bei-explosion-in-garage-82449614.bild.html,0,www.bild.de,Defekte Gasleitung - Zwei Verletzte bei Explosion in Garage,Wiesbaden – Explosion in Hessens Landeshauptstadt: Im Wiesbadener Ortsbezirk Nordenstadt rummste es am Donnerstagmorgen in einer Garage eines Bungalows.,"https://images.bild.de/63b68680261468542f73963c/245df285f3b4e346cef6aa6dbc999ae1,1ba66177?w=1280",2023-01-05T08:24:15Z,https://web.archive.org/web/20230105085118/https://www.bild.de/regional/frankfurt/frankfurt-aktuell/wiesbaden-defekte-gasleitung-zwei-verletzte-bei-explosion-in-garage-82449614.bild.html,"Wiesbaden Explosion in Hessens Landeshauptstadt: Im Wiesbadener Ortsbezirk Nordenstadt rummste es am Donnerstagmorgen in einer Garage eines Bungalows.
Eine Frau (56) wurde offenbar schwer, ein Mann … [+1587 chars]",,de,'Explosion'
