index,url,valid,domain,title,description,image,published,archive,content,quote,language,keyword
https://www.tagesspiegel.de/wirtschaft/neues-gutachten-abschaffung-der-65-prozent-vorgabe-beim-heizen-wohl-verfassungswidrig-15215035.html,https://www.tagesspiegel.de/wirtschaft/neues-gutachten-abschaffung-der-65-prozent-vorgabe-beim-heizen-wohl-verfassungswidrig-15215035.html,0,www.tagesspiegel.de,Neues Gutachten: Abschaffung der 65-Prozent-Vorgabe beim Heizen wohl verfassungswidrig,Union und SPD haben sich in der Debatte über die Erneuerbaren-Vorgabe beim Heizen festgefahren. Ein weiteres juristisches Gutachten warnt vor einer Aufweichung.,https://www.tagesspiegel.de/images/12493064/alternates/BASE_16_9_W1400/1728300723000/blick-am-freitag-01-12-2023-in-neukalen-landkreis-mecklenburgische-seenplatte-auf-einen-rauchenden-schornstein-auf-e.jpeg,2026-02-04T08:46:10Z,,"Der Sprecher des Zentralverbands Sanitär Heizung Klima, Frank Ebisch, kann mit Blick auf die Debatte um die Zukunft des Gebäudeenergiegesetzes (GEG) nur noch den Kopf schütteln. Die Betriebe wissen g… [+232 chars]",,de,'Heizen'
https://www.zeit.de/2026/06/atomwaffen-new-start-vertrag-usa-russland-aufruestung,https://www.zeit.de/2026/06/atomwaffen-new-start-vertrag-usa-russland-aufruestung,0,www.zeit.de,Atomwaffen: Schlicht kriminell,Auf zum Wettrüsten: Die USA und Russland lassen den letzten Vertrag zur Begrenzung von Atomwaffen auslaufen. Nach mehr als 50 Jahren endet die Ära der Rüstungskontrolle.,https://img.zeit.de/2026/06/atomwaffen-new-start-vertrag-usa-russland-aufruestung-bild/wide__1300x731,2026-02-04T10:34:39Z,,"Es ist ein tiefer, ein bedrohlicher Einschnitt. An diesem Donnerstag läuft der New-Start-Vertrag aus, das letzte verbliebene Atomabkommen zwischen den USA und Russland. Nach mehr als einem halben Jah… [+467 chars]",,de,'Russland'
https://ooe.orf.at/stories/3340635/,https://ooe.orf.at/stories/3340635/,0,ooe.orf.at,Preise für Holz-Pellets stark gestiegen,Das Heizen mit Holz-Pellets ist deutlich teurer geworden. Im Jänner mussten Kunden für lose Pellets um bis zu 28 Prozent mehr bezahlen als noch vor einem halben Jahr. In Oberösterreich müssen Verbraucher nach Tirol und Vorarlberg am tiefsten in die Geldtasche…,https://ibs.orf.at/ooe?image=https%3A%2F%2Foekastatic.orf.at%2Fmims%2F2022%2F20%2F39%2Fcrops%2Fw%3D1200%2Ch%3D627%2Cq%3D75%2F1347186_master_482839_downloadmedium.ashx.jpg%3Fs%3Dcc91c6f688a5839e948aa3e798487d7f12fa11d9,2026-02-04T14:27:23Z,,"Während Gas, Öl und Strom zuletzt günstiger wurden, zahlen Pellets-Heizer im Jänner statt rund 308 Euro jetzt knapp 400 Euro pro Tonne. Das sind bis zu 28 Prozent mehr als noch vor einem halben Jahr.… [+1555 chars]",,de,'Heizen'
https://www.zeit.de/news/2026-02/04/russische-polizei-erschiesst-entfuehrer-nach-doppelmord,https://www.zeit.de/news/2026-02/04/russische-polizei-erschiesst-entfuehrer-nach-doppelmord,0,www.zeit.de,Kriminalität in Russland: Russische Polizei erschießt Entführer nach Doppelmord,Hier finden Sie Informationen zu dem Thema „Kriminalität in Russland“. Lesen Sie jetzt „Russische Polizei erschießt Entführer nach Doppelmord“.,https://img.zeit.de/news/2026-02/04/russische-polizei-erschiesst-entfuehrer-nach-doppelmord-image-group/wide__1300x731,2026-02-04T15:00:53Z,,"Bei der versuchten Festnahme zweier Geiselnehmer in Moskau hat die Polizei am Dienstagabend einen Verdächtigen erschossen. Der zweite mutmaßliche Täter habe inzwischen ein Geständnis abgelegt, teilte… [+1225 chars]",,de,'Russland'
https://noe.orf.at/stories/3340638/,https://noe.orf.at/stories/3340638/,0,noe.orf.at,Preise für Pellets deutlich gestiegen,"Die Preise für Pellets sind in den vergangenen Monaten deutlich gestiegen – auch im Vergleichszeitraum zum Jahr 2024. Grund dafür war der relativ milde Winter 2024 und viele „Frühkäufe“ wegen des Ukrainekrieges, heißt es bei proPellets Austria.",https://ibs.orf.at/noe?image=https%3A%2F%2Foekastatic.orf.at%2Fmims%2F2021%2F21%2F39%2Fcrops%2Fw%3D1200%2Ch%3D627%2Cq%3D75%2F948537_master_333139_holz.jpg%3Fs%3Da263cfa5df30da2b43215ea39fa46cbf0aabe213,2026-02-04T15:20:59Z,,"Kaufen wenns heiß ist, heizen wenns weiß ist, so beschreibt Doris Stiksl, Geschäftsführerin von proPellets Austria den richtigen Zeitpunkt, um Pellets einzulagern. Denn in der warmen Jahreszeit sind … [+1983 chars]",,de,'Ukraine'
https://www.sueddeutsche.de/wirtschaft/waermepumpen-waermewende-mainburg-wolf-li.3376729,https://www.sueddeutsche.de/wirtschaft/waermepumpen-waermewende-mainburg-wolf-li.3376729,0,www.sueddeutsche.de,Heizen: „Wir haben ein Desaster hinter uns“,"Die Regierung will das Heizungsgesetz „abschaffen“, passiert ist bislang nichts. Unter der Unsicherheit leiden Handwerk und Industrie, die in entscheidenden Punkten längst weiter sind als die Politik.",https://www.sueddeutsche.de/2026/02/04/b4d14cfb-3262-4b5f-a9d0-7a59400debe9.jpg?q=60&fm=webp&width=1200&rect=0%2C123%2C2362%2C1329,2026-02-04T15:51:52Z,,"Wenn die Zeiten schwierig sind, fallen die Partys oft besonders groß aus. Es wirkt daher beinahe wie eine trotzige Geste, als der Lüftungs- und Heizungshersteller Wolf an einem Vormittag Ende Januar … [+718 chars]",,de,'Heizen'
https://br.ign.com/frieren-e-a-jornada-para-o-alem/150583/news/nunca-desenhei-algo-assim-antes-ilustradora-de-frieren-quebra-o-silencio-e-revela-qual-personagem-e,https://br.ign.com/frieren-e-a-jornada-para-o-alem/150583/news/nunca-desenhei-algo-assim-antes-ilustradora-de-frieren-quebra-o-silencio-e-revela-qual-personagem-e,0,br.ign.com,"""Nunca desenhei algo assim antes"": ilustradora de Frieren quebra o silêncio e revela qual personagem é seu verdadeiro favorito","Nem Fern, nem Himmel",https://sm.ign.com/t/ign_br/screenshot/default/frieren-beyond-journeys-end-epis_bm5c.1200.jpg,2026-02-04T16:59:42Z,,"Em um mundo tão mágico quanto o de Frieren e a Jornada para o Além é inevitável não ter um personagem favorito com tantas figuras carismáticas. Seja o jeito pragmático de Frieren, a benevolência de H… [+1067 chars]",,de,'Frieren'
https://www.zeit.de/politik/ausland/2026-02/new-start-vertrag-atomwaffen-abkommen-usa-russland,https://www.zeit.de/politik/ausland/2026-02/new-start-vertrag-atomwaffen-abkommen-usa-russland,0,www.zeit.de,New-Start-Vertrag: Russland wirft USA bewussten Verzicht auf Abrüstungsvertrag vor,"Der New-Start-Vertrag zwischen Russland und den USA läuft aus, eine Verlängerung wird nicht mehr erwartet. Die Verantwortung sieht Russland bei der US-Regierung.",https://img.zeit.de/politik/ausland/2026-02/new-start-vertrag-atomwaffen-abkommen/wide__1300x731,2026-02-04T18:41:14Z,,"Einen Tag vor dem Auslaufen des atomaren Rüstungskontrollvertrags New Start zwischen Russland und den USA geht Russland nicht mehr davon aus, dass es zu einer Verlängerung kommen wird. Russland habe … [+4518 chars]",,de,'Russland'
https://www.stern.de/politik/ausland/ukraine-erwartet-austausch-kriegsgefangener-mit-russland-37107920.html,https://www.stern.de/politik/ausland/ukraine-erwartet-austausch-kriegsgefangener-mit-russland-37107920.html,0,www.stern.de,Gespräche in Abu Dhabi: Ukraine erwartet Austausch Kriegsgefangener,In Abu Dhabi verhandeln erneut Teams aus Russland und der Ukraine unter US-Vermittlung. Der ukrainische Präsident Wolodymyr Selenskyj spricht von einem wichtigen Schritt.,https://image.stern.de/37107930/t/dT/v1/w1440/r1.7778/-/selenskyj-ukraine.jpg,2026-02-04T22:05:00Z,,"Kopiere den aktuellen Link
Zur Merkliste hinzufügen
In Abu Dhabi verhandeln erneut Teams aus Russland und der Ukraine unter US-Vermittlung. Der ukrainische Präsident Wolodymyr Selenskyj spricht von… [+1420 chars]",,de,'Ukraine'
https://www.faz.net/aktuell/politik/ukraine/ukraine-liveticker-selenskyj-55-000-ukrainische-soldaten-gefallen-faz-110683325.html,https://www.faz.net/aktuell/politik/ukraine/ukraine-liveticker-selenskyj-55-000-ukrainische-soldaten-gefallen-faz-110683325.html,0,www.faz.net,Krieg in der Ukraine: Selenskyj: 55.000 ukrainische Soldaten gefallen,"Erste offizielle Zahl der Ukraine zu Toten +++ EU-Staaten finden Kompromiss bei Milliardenkredit an Kiew +++ Gespräche zwischen ukrainischen, russischen und amerikanischen Unterhändlern in Abu Dhabi +++ alle Neuigkeiten im Liveblog",https://media0.faz.net/image/w1200h627/5c3b22867329/w3000h1567x0y216o/202512/43601.0.1596774468/eine-reihe-mit-graebern.webp,2026-02-04T22:20:48Z,,"Der ukrainische Präsident Wolodymyr Selenskyj beziffert die Zahl der im Krieg gegen Russland getöteten Soldaten auf 55.000. Dies sei die offizielle Zahl der Gefallenen, sagt Selenskyj in einem Interv… [+593 chars]",,de,'Ukraine'
https://www.tagesspiegel.de/internationales/55000-gefallene-grosse-zahl-vermisster-selenskyj-beziffert-verluste--und-warnt-vor-jahren-weiterer-kampfe-15220546.html,https://www.tagesspiegel.de/internationales/55000-gefallene-grosse-zahl-vermisster-selenskyj-beziffert-verluste--und-warnt-vor-jahren-weiterer-kampfe-15220546.html,0,www.tagesspiegel.de,"55.000 Gefallene, große Zahl Vermisster: Selenskyj beziffert Verluste – und warnt vor Jahren weiterer Kämpfe",Der ukrainische Präsident nennt die Zahl der getöteten Soldaten und prognostiziert: Russland werde für die Eroberung des Donbass nicht durchhalten. Unterdessen bekräftigt Moskau bei den Verhandlungen seine Maximalforderung.,https://www.tagesspiegel.de/images/15212262/alternates/BASE_16_9_W1400/1770244794000/volodymyr-zelenskyy-and-mark-rutte-honor-the-memory-of-fallen-ukrainian-soldiers-at-maidan-nezalezhnosti.jpeg,2026-02-04T22:44:50Z,,Rund 55.000 ukrainische Soldaten sind nach den Worten von Präsident Wolodymyr Selenskyj seit dem Beginn des russischen Angriffskrieges vor fast vier Jahren getötet worden. In der Ukraine beträgt die … [+1850 chars],,de,'Ukraine'
https://www.stern.de/politik/ausland/im-krieg-gefallene-soldaten--selenskyj-spricht-von-55-000-getoeteten-ukrainischen-soldaten-37108040.html,https://www.stern.de/politik/ausland/im-krieg-gefallene-soldaten--selenskyj-spricht-von-55-000-getoeteten-ukrainischen-soldaten-37108040.html,0,www.stern.de,Im Krieg gefallene Soldaten: Selenskyj spricht von 55.000 getöteten ukrainischen Soldaten,Jeden Tag sterben zig Soldaten im Ukraine-Krieg - und das schon seit vier Jahren. Der ukrainische Präsident nennt jetzt neue Zahlen zu eigenen Verlusten. Andere Schätzungen liegen weit darüber.,https://image.stern.de/37108042/t/Sr/v1/w1440/r1.7778/-/05--3qh3jw4dttv5axs2048jpeg---9a82fd9a58c03e1e.jpg,2026-02-05T00:52:28Z,,"Kopiere den aktuellen Link
Zur Merkliste hinzufügen
Jeden Tag sterben zig Soldaten im Ukraine-Krieg - und das schon seit vier Jahren. Der ukrainische Präsident nennt jetzt neue Zahlen zu eigenen Ve… [+2687 chars]",,de,'Ukraine'
https://www.tagesspiegel.de/internationales/diplomatie-ukraine-krieg-zweiter-verhandlungstag-hat-begonnen-15220571.html,https://www.tagesspiegel.de/internationales/diplomatie-ukraine-krieg-zweiter-verhandlungstag-hat-begonnen-15220571.html,0,www.tagesspiegel.de,Diplomatie: Ukraine-Krieg: Zweiter Verhandlungstag hat begonnen,Weitgehend im Stillen verlaufen die Gespräche am Persischen Golf über ein Ende des russischen Kriegs in der Ukraine. Allerdings nähren alle Seiten die Hoffnung über eine Annäherung in dem Konflikt.,https://www.tagesspiegel.de/images/15220935/alternates/BASE_16_9_W1400/1770279126000/rustem-umjerow.jpeg,2026-02-05T00:53:49Z,,In den Vereinigten Arabischen Emiraten hat der zweite Tag der von den USA vermittelten Verhandlungen zwischen Russen und Ukrainern über ein Ende des Kriegs begonnen. Wir arbeiten im gleichen Format w… [+1150 chars],,de,'Ukraine'
https://www.tagesspiegel.de/internationales/ukraine-krieg-selenskyj-erwartet-nachste-gesprachsrunde-in-den-usa-15220571.html,https://www.tagesspiegel.de/internationales/ukraine-krieg-selenskyj-erwartet-nachste-gesprachsrunde-in-den-usa-15220571.html,0,www.tagesspiegel.de,Ukraine-Krieg: Selenskyj erwartet nächste Gesprächsrunde in den USA,Zweimal hat Russland die Ukraine mit einer gefährlichen neuen Rakete bombardiert. Nun will Kiew die russische Abschussbasis getroffen haben. Selenskyj äußert sich aber auch zu weiteren Verhandlungen.,https://www.tagesspiegel.de/images/15224974/alternates/BASE_16_9_W1400/1770320405000/ukraine-krieg-selenskyj.jpeg,2026-02-05T00:53:49Z,,Die nächsten Verhandlungen über ein Ende des Ukraine-Krieges werden nach Angaben von Präsident Wolodymyr Selenskyj wahrscheinlich in den USA stattfinden. Die Ukraine sei bereit zu allen Gesprächsform… [+1207 chars],,de,'Ukraine'
https://www.faz.net/aktuell/politik/ausland/usa-und-russland-ende-des-new-start-abkommens-accg-200508187.html,https://www.faz.net/aktuell/politik/ausland/usa-und-russland-ende-des-new-start-abkommens-accg-200508187.html,0,www.faz.net,New Start: Letzter Atomwaffen-Abrüstungsvertrag zwischen USA und Russland ausgelaufen,Es ist das Ende eines Zeitalters: Als letztes großes Abkommen zur nuklearen Abrüstung ist der New-Start-Vertrag ausgelaufen. Nun wächst auch in Deutschland die Sorge vor einem neuen Wettrüsten.,https://media0.faz.net/image/w1200h627/0ee458fa6052/w2523h1318x0y65o/202602/43601.0.1735365729/bei-einer-militaerparade-auf.webp,2026-02-05T03:10:46Z,,"Der letzte Atomwaffen-Abrüstungsvertrag zwischen den USA und Russland, das New Start-Abkommen, ist an diesem Donnerstag ausgelaufen. Es sei ein schwerwiegender Moment für den internationalen Frieden … [+2143 chars]",,de,'Russland'
https://wien.orf.at/stories/3340636/,https://wien.orf.at/stories/3340636/,0,wien.orf.at,Bauwirtschaft leidet unter Kälte,Die Kälte im Jänner hatte in der Stadt auch Auswirkungen auf Baustellen. Immerhin ist es zu den Frostzeiten so kalt wie schon seit neun Jahren nicht mehr gewesen. Das hat laut Wirtschaftskammer zu Störungen im Bauablauf geführt.,https://ibs.orf.at/wie?image=https%3A%2F%2Foekastatic.orf.at%2Fmims%2F2026%2F06%2F38%2Fcrops%2Fw%3D1200%2Ch%3D627%2Cq%3D75%2F2922039_master_1129538_korneuburg_baustelle_1_hev.jpg%3Fs%3D6033ecfacf3cdb44a413bc18ceec1f3a66ded02f,2026-02-05T04:00:00Z,,Insbesondere bei Rohbauphasen und im Straßenbau hat die Kälte zu verzögerten Abläufen geführt. Denn bei Beton und Mörtel verlangsamen sich die Abbinde- und Erhärtungsprozesse und auch Asphalt lässt s… [+911 chars],,de,'Heizen'
https://www.faz.net/aktuell/politik/usa-unter-trump/nukleare-ruestungskontrolle-was-das-ende-von-new-start-bedeutet-accg-110831233.html,https://www.faz.net/aktuell/politik/usa-unter-trump/nukleare-ruestungskontrolle-was-das-ende-von-new-start-bedeutet-accg-110831233.html,0,www.faz.net,atomare Rüstungskontrolle: Was das Ende von New Start bedeutet,"Die USA wollen China am Tisch, Russland will Trumps Raketenabwehr bremsen – und Peking will nicht mitmachen. Seit heute gibt es keine nuklearen Obergrenzen mehr für Washington und Moskau.",https://media0.faz.net/image/w1200h627/dfe323284734/w3000h1567x0y215o/022026/1.10831231/obama-und-medwedjew.webp,2026-02-05T05:42:33Z,,"Das letzte große nukleare Rüstungskontrollabkommen zwischen Russland und den Vereinigten Staaten, New Start, ist ausgelaufen. Ohne eine Einigung in letzter Minute stehen die beiden größten Nuklearmäc… [+10707 chars]",,de,'Putin'
https://www.zeit.de/news/2026-02/05/zugausfaelle-und-verspaetungen-zwischen-hannover-und-berlin,https://www.zeit.de/news/2026-02/05/zugausfaelle-und-verspaetungen-zwischen-hannover-und-berlin,0,www.zeit.de,"Schnee, Eis, Kälte: Zugausfälle und Verspätungen zwischen Hannover und Berlin","Hier finden Sie Informationen zu dem Thema „Schnee, Eis, Kälte“. Lesen Sie jetzt „Zugausfälle und Verspätungen zwischen Hannover und Berlin“.",https://img.zeit.de/news/2026-02/05/zugausfaelle-und-verspaetungen-zwischen-hannover-und-berlin-image-group/wide__1300x731,2026-02-05T07:23:42Z,,"Das Winterwetter sorgt zwischen Hannover und Berlin für Zugausfälle und Verspätungen im Fernverkehr der Deutschen Bahn. Das Ausmaß sei allerdings geringer als am Mittwoch, sagte eine Bahnsprecherin. … [+504 chars]",,de,'Schnee'
https://orf.at/stories/3419271/,https://orf.at/stories/3419271/,0,orf.at,Gasspeicher noch zu rund 45 Prozent gefüllt,,https://orf.at/mojo/1_4_1/storyserver//news/common/images/og-fallback-news.png,2026-02-05T07:59:23Z,,"Trotz eines deutlich kälteren Winters sind die Gasspeicher Anfang Februar noch fast zur Hälfte gefüllt. Der Füllstand liegt derzeit bei rund 45 Prozent, wie die Regulierungsbehörde E-Control und das … [+1424 chars]",,de,'Gasspeicher'
https://www.tagesschau.de/ausland/europa/russland-ausweisung-diplomat-100.html,https://www.tagesschau.de/ausland/europa/russland-ausweisung-diplomat-100.html,0,www.tagesschau.de,Diplomatische Spannungen: Russland weist deutschen Diplomaten aus,Erst hatte Deutschland einen Mitarbeiter der russischen Botschaft in Berlin wegen Spionagevorwürfen ausgewiesen. Nun reagiert Russland - und erklärt einen deutschen Diplomaten zur unerwünschten Person.,https://images.tagesschau.de/image/78869550-a004-4ee4-b305-23ff5731ab92/AAABnC2Uf7c/AAABmyZE0EA/16x9-big/deutsche-botschaft-moskau-106.jpg?width=1280,2026-02-05T11:33:52Z,,"Stand: 05.02.2026 12:33 Uhr
Erst hatte Deutschland einen Mitarbeiter der russischen Botschaft in Berlin wegen Spionagevorwürfen ausgewiesen. Nun reagiert Russland - und erklärt einen deutschen Diplo… [+1901 chars]",,de,'Russland'
https://www.tagesspiegel.de/internationales/neue-mittel-fur-die-nato-ostflanke-russlands-militarausgaben-liegen-wohl-weit-uber-den-offiziellen-angaben-15221509.html,https://www.tagesspiegel.de/internationales/neue-mittel-fur-die-nato-ostflanke-russlands-militarausgaben-liegen-wohl-weit-uber-den-offiziellen-angaben-15221509.html,0,www.tagesspiegel.de,Neue Mittel für die Nato-Ostflanke: Russlands Militärausgaben liegen wohl weit über den offiziellen Angaben,Einer Analyse des Bundesnachrichtendienstes zufolge sind Russlands Militärausgaben deutlich höher als offiziell angegeben. Schätzungsweise über 240 Milliarden Euro soll Moskau zuletzt ausgegeben haben.,https://www.tagesspiegel.de/images/12888859/alternates/BASE_16_9_W1400/1770291063000/a-russian-military-convoy-heads-towards-hmeimim-air-base-in-latakia.jpeg,2026-02-05T11:42:56Z,,"Die Militärausgaben Russlands sind nach einer Analyse des Bundesnachrichtendienstes (BND) deutlich höher als offiziell angegeben. Würden versteckte Ausgaben einbezogen, habe Russland im vergangenen J… [+3415 chars]",,de,'Russland'
https://www.tagesspiegel.de/internationales/geheimdienst-analyse-russland-gibt-240-milliarden-euro-fur-militar-aus--in-nur-einem-jahr-15221509.html,https://www.tagesspiegel.de/internationales/geheimdienst-analyse-russland-gibt-240-milliarden-euro-fur-militar-aus--in-nur-einem-jahr-15221509.html,0,www.tagesspiegel.de,Geheimdienst-Analyse: Russland gibt 240 Milliarden Euro für Militär aus – in nur einem Jahr,Einer neuen BND-Analyse zufolge sind Russlands Militärausgaben deutlich höher als offiziell angegeben. Die Mittel sollen vor allem in neue Kapazitäten an der Nato-Ostflanke eingesetzt werden.,https://www.tagesspiegel.de/images/12888859/alternates/BASE_16_9_W1400/1770291063000/a-russian-military-convoy-heads-towards-hmeimim-air-base-in-latakia.jpeg,2026-02-05T11:42:56Z,,"Die Militärausgaben Russlands sind nach einer Analyse des Bundesnachrichtendienstes (BND) deutlich höher als offiziell angegeben. Würden versteckte Ausgaben einbezogen, habe Russland im vergangenen J… [+3484 chars]",,de,'Ukraine'
https://www.golem.de/sonstiges/zustimmung/auswahl.html?from=https://www.golem.de/news/investitionen-in-ki-google-chef-hat-angst-geld-zu-langsam-auszugeben-2602-205044.html&referer=https://t.co/1e5a0c0302,https://www.golem.de/sonstiges/zustimmung/auswahl.html?from=https://www.golem.de/news/investitionen-in-ki-google-chef-hat-angst-geld-zu-langsam-auszugeben-2602-205044.html&referer=https://t.co/1e5a0c0302,0,www.golem.de,"Investitionen in KI: Google Chef hat Angst, Geld zu langsam auszugeben","Die Knappheit an Halbleitern und Rechenkapazität sowie Energieengpässe könnten die KI-Investitionspläne von Alphabet scheitern lassen. (Alphabet, Google)",,2026-02-05T12:05:02Z,,"Besuchen Sie Golem.de wie gewohnt mit Werbung und Tracking,
 indem Sie der Nutzung aller Cookies zustimmen.
 Details zum Tracking finden Sie im Privacy Center.
Skript wurde nicht geladen. Informat… [+607 chars]",,de,'Knappheit'
https://www.zeit.de/news/2026-02/05/usa-und-russland-wollen-militaerdialog-wieder-aufnehmen,https://www.zeit.de/news/2026-02/05/usa-und-russland-wollen-militaerdialog-wieder-aufnehmen,0,www.zeit.de,Diplomatie: USA und Russland wollen Militärdialog wieder aufnehmen,Hier finden Sie Informationen zu dem Thema „Diplomatie“. Lesen Sie jetzt „USA und Russland wollen Militärdialog wieder aufnehmen“.,https://img.zeit.de/news/2026-02/05/usa-und-russland-wollen-militaerdialog-wieder-aufnehmen-image-group/wide__1300x731,2026-02-05T14:00:59Z,,Die USA und Russland haben die Wiederaufnahme ihres seit 2021 unterbrochenen Dialogs hochrangiger Militärs vereinbart. Das teilte das Kommando der US-Streitkräfte in Europa nach Verhandlungen zwische… [+2414 chars],,de,'Russland'
https://www.n-tv.de/wirtschaft/Bayern-wird-zum-Sorgenfall-bei-der-Gasversorgung-id30329326.html,https://www.n-tv.de/wirtschaft/Bayern-wird-zum-Sorgenfall-bei-der-Gasversorgung-id30329326.html,0,www.n-tv.de,Speicher leeren sich : Bayern wird zum Sorgenfall bei der Gasversorgung,"Im Süden sind die Füllstände der Gasspeicher niedriger als in anderen Teilen Deutschlands. Die Behörden beruhigen, doch in der Gasbranche nehmen die Sorgen zu: Das System sei an der Belastungsgrenze.",https://www.n-tv.de/img/30329382/1770306282/Img_16_9/1200/Markus-SOEDER-Ministerpraesident-Bayern-und-CSU-Vorsitzender-mit-Schutzhelm-im-Pumpenhaus-Pumpen-Gaspumpen-Ministerpraesident-Dr-Markus-Soeder-und-Wirtschaftsminister-Hubert-Aiwanger-besichtigen-den-Erdgas-Untergrundgasspeicher-in-Wolfersberg-Oberpframmern-am-23-06.jpg,2026-02-05T15:34:07Z,,"Bayerns Ministerpräsident Markus Söder im Untergrundgasspeicher in Wolfersberg-Oberpframmern. (Foto: picture alliance / SVEN SIMON)
Im Süden sind die Füllstände der Gasspeicher niedriger als in ande… [+15418 chars]",,de,'Gasspeicher'
https://www.zeit.de/politik/2026-02/friedrich-merz-saudi-arabien-nachrichtenpodcast,https://www.zeit.de/politik/2026-02/friedrich-merz-saudi-arabien-nachrichtenpodcast,0,www.zeit.de,Friedrich Merz in Saudi-Arabien: Merz sucht neue Allianzen in der Golfregion,Friedrich Merz sucht neue strategische Partner am Golf. Welche Rolle spielen dabei die Menschenrechte? Und: Russland und die USA nehmen militärischen Dialog wieder auf.,https://img.zeit.de/politik/2017-09/illu-podcast-news/wide__8ed8a6__1300x731,2026-02-05T16:18:49Z,,Bundeskanzler Friedrich Merz ist erstmals nach Saudi-Arabien gereist. In der Hauptstadt Riad hat er sich am Mittwochabend mit Kronprinz Mohammed bin Salman getroffen. Das mehrstündige Gespräch ist la… [+2735 chars],,de,'Russland'
https://www.zeit.de/2026/06/zahnbehandlungen-gesetzliche-krankenversicherung-cdu-wirtschaftsrat-krankenhaeuser,https://www.zeit.de/2026/06/zahnbehandlungen-gesetzliche-krankenversicherung-cdu-wirtschaftsrat-krankenhaeuser,0,www.zeit.de,Zahnbehandlungen: Sparen ja. Aber nicht an den Zähnen,"Die Zahnarztbehandlung künftig selbst versichern? Das wäre sozial hart. An zwei anderen Stellen aber gäbe es deutlich mehr Spielraum, um Kosten im System zu senken.",https://img.zeit.de/2026/06/sparen-ja-aber-nicht-an-den-zaehnen-bild-1/wide__1300x731,2026-02-05T19:32:28Z,,"Schließen
Artikelzusammenfassung
Bundeskanzler Friedrich Merz plant, den Sozialstaat zu reformieren, doch die Vorschläge seiner Partei stoßen auf Kritik. Ideen wie das Streichen von Zahnbehandlunge… [+831 chars]",,de,'Sparen'
https://www.zeit.de/news/2026-02/06/ukraine-erwartet-rasch-naechste-verhandlungen-in-den-usa,https://www.zeit.de/news/2026-02/06/ukraine-erwartet-rasch-naechste-verhandlungen-in-den-usa,0,www.zeit.de,Die Lage im Überblick: Ukraine erwartet rasch nächste Verhandlungen in den USA,Hier finden Sie Informationen zu dem Thema „Die Lage im Überblick“. Lesen Sie jetzt „Ukraine erwartet rasch nächste Verhandlungen in den USA“.,https://img.zeit.de/news/2026-02/06/ukraine-erwartet-rasch-naechste-verhandlungen-in-den-usa-image-group/wide__1300x731,2026-02-06T03:15:05Z,,"Nach Verhandlungen der Ukraine, Russlands und der USA in Abu Dhabi erwartet der ukrainische Präsident Wolodymyr Selenskyj eine Fortsetzung der Gespräche «in allernächster Zeit». Die nächste Verhandlu… [+4944 chars]",,de,'Ukraine'
https://www.autobild.de/artikel/autofahren-bei-kaelte-28527011.html,https://www.autobild.de/artikel/autofahren-bei-kaelte-28527011.html,0,www.autobild.de,Macht Kälte Autofahrer aggressiv?,"Bei der aktuellen Frostwelle merken viele Autofahrer: Kälte stresst nicht nur Auto und Technik, sondern auch den Menschen am Steuer. Studien zeigen, dass Autofahrer am Steuer ganz unterschiedlich auf die Kälte reagieren. Umso wichtiger ist es, sich auf anstre…",https://i.auto-bild.de/ir_img/4/0/3/9/1/9/9/Autobahn-im-Winter-2869-1200x675-e8b23f0200e012b9.jpg?impolicy=og_images,2026-02-06T05:00:00Z,,"Viele wollten endlich wieder einen echten Winter. Nach Wochen mit Frost, Glätte, Verkehrschaos und erhöhter Unfallgefahr haben vor allem die Autofahrer im Norden inzwischen allerdings die Nase voll. … [+3996 chars]",,de,'Kälte'
