index,url,valid,domain,title,description,image,published,archive,content,quote,language,keyword
https://www.tagesschau.de/ausland/ukraine-silvester-101.html,https://www.tagesschau.de/ausland/ukraine-silvester-101.html,0,www.tagesschau.de,Silvester in der Ukraine: Siegessicher trotz Sirenen,"Die Ukraine erlebt ihren ersten Jahreswechsel unter Kriegsrecht. Die Menschen im Land versuchen trotzdem, im Rahmen des Möglichen zu feiern. Ihr Präsident sprach ihnen Mut zu. <em>Von Andrea Beer.</em>",https://www.tagesschau.de/multimedia/bilder/ukraine-silvester-103~_v-original.jpg,2023-01-01T03:10:43Z,,"Die Ukraine erlebt ihren ersten Jahreswechsel unter Kriegsrecht. Die Menschen im Land versuchen trotzdem, im Rahmen des Möglichen zu feiern. Ihr Präsident sprach ihnen Mut zu.
Das neue Jahr begann i… [+3409 chars]",,de,'Ukraine'
https://www.handelsblatt.com/politik/konjunktur/nachrichten/hri-konjunkturprognose-deutschland-steckt-in-der-stagflation-fest/28893586.html,https://www.handelsblatt.com/politik/konjunktur/nachrichten/hri-konjunkturprognose-deutschland-steckt-in-der-stagflation-fest/28893586.html,0,www.handelsblatt.com,HRI-Konjunkturprognose: Deutschland steckt in der Stagflation fest – Ökonomen prognostizieren Mini-Wachstum für 2023,"Die Wirtschaft spürt die Folgen von Corona, Krieg und Knappheit. Die Krise wird zwar weniger heftig als erwartet, dauert aber wohl länger als erhofft.",https://www.handelsblatt.com/images/maschinenbauer-in-chemnitz/28893758/2-format2003.jpg,2023-01-01T08:14:08Z,https://web.archive.org/web/20230101082636/https://www.handelsblatt.com/politik/konjunktur/nachrichten/hri-konjunkturprognose-deutschland-steckt-in-der-stagflation-fest/28893586.html,"Maschinenbauer in ChemnitzIm Frühjahr 2024 wird das Bruttoinlandsprodukt real kaum höher sein als vor dem Pandemieausbruch Anfang 2020.
(Foto: dpa)
DüsseldorfDeutschland dürfte der noch vor einigen… [+1278 chars]",,de,'Knappheit'
https://www.welt.de/kultur/literarischewelt/article242913053/Sachbuecher-des-Monats-WELT-Bestenliste-fuer-Januar-2023.html,https://www.welt.de/kultur/literarischewelt/article242913053/Sachbuecher-des-Monats-WELT-Bestenliste-fuer-Januar-2023.html,0,www.welt.de,Das sind die besten Sachbücher im Januar,"Hier kommen Großkaliber für lange Winterabende: Es gibt neue, aufregende Biografien zu Goethe und Thomas Mann. Und Geschichtsbücher zu Indonesien und zur Ukraine. Außerdem auf der Bestenliste: eine deutsche Revolution, die immer noch unterschätzt wird.",https://img.welt.de/img/kultur/literarischewelt/mobile242922435/4381357287-ci16x9-w1200/DWO-Teaser-Beste-Buecher-eps.jpg,2023-01-01T12:05:09Z,,"An dieser Stelle erscheint monatlich die Empfehlungsliste mit der größten Verbreitung im deutschsprachigen Raum. Medienpartner sind Literarische Welt, RBB Kultur, NZZ und Radio Österreich 1. Experten… [+5676 chars]",,de,'Ukraine'
https://www.faz.net/aktuell/stil/mode-design/alpaka-wolle-waermt-im-winter-besonders-gut-18522306.html,https://www.faz.net/aktuell/stil/mode-design/alpaka-wolle-waermt-im-winter-besonders-gut-18522306.html,0,www.faz.net,Alpaka-Wolle wärmt im Winter besonders gut,Importiert aus Peru: Jannik Weich vertreibt Produkte aus Alpaka-Wolle in Europa. Bei extremer Kälte wärmt die Wolle und das Fell der Lasttiere besonders gut. Auch ökologisch punkten die Alpakas.,https://media1.faz.net/ppmedia/aktuell/gesellschaft/837713081/1.8522303/facebook_teaser/ideale-thermoeigenschaften-das.jpg,2023-01-01T13:15:57Z,https://web.archive.org/web/20230101131702/http://www.faz.net/aktuell/stil/mode-design/alpaka-wolle-waermt-im-winter-besonders-gut-18522306.html,"Viele verbinden Alpaka-Wolle mit den bunten Mützen, wie sie die Bauern in den peruanischen Anden tragen; die traten in Europa in den Siebzigerjahren ihren Siegeszug an, weil sie an den Ohren so schön… [+4327 chars]",,de,'Kälte'
https://www.sueddeutsche.de/wirtschaft/lula-da-silva-suedamerika-rohstoffe-1.5724941,https://www.sueddeutsche.de/wirtschaft/lula-da-silva-suedamerika-rohstoffe-1.5724941,0,www.sueddeutsche.de,Brasilien: Der neue Präsident Lula will Hunger und Armut bekämpfen,"Als die linke Arbeiterpartei vor zwei Jahrzehnten zum ersten Mal die Macht in Brasilien übernahm, war die Wirtschaftslage prekär. Heute ist sie katastrophal. Was der neue Präsident Lula dagegen unternehmen will.",https://www.sueddeutsche.de/image/sz.1.5725062/1200x675?v=1672580084,2023-01-01T13:35:10Z,,"Als die linke Arbeiterpartei vor zwei Jahrzehnten zum ersten Mal die Macht in Brasilien übernahm, war die Wirtschaftslage prekär. Heute ist sie katastrophal. Was der neue Präsident Lula dagegen unter… [+741 chars]",,de,'Armut'
https://www.n-tv.de/panorama/Tief-Magdalene-holt-den-Winter-zurueck-article23815903.html,https://www.n-tv.de/panorama/Tief-Magdalene-holt-den-Winter-zurueck-article23815903.html,0,www.n-tv.de,"Die Wetterwoche im Schnellcheck: Tief ""Magdalene"" holt den Winter zurück","Mit Rekordwärme und Regen startet Deutschland ins Neue Jahr. Bleiben wird das milde Wetter aber nicht mehr lange, denn Tief ""Magdalene"" sorgt für eine Abkühlung mit Schnee, Frost und Glätte. Schon am Wochenende ist ein Winter-Comeback möglich.",https://bilder3.n-tv.de/img/incoming/crop23815950/6711323430-cImg_16_9-w1200/389212475.jpg,2023-01-01T14:14:27Z,https://web.archive.org/web/20230101141931/https://www.n-tv.de/panorama/Tief-Magdalene-holt-den-Winter-zurueck-article23815903.html,"Mit Rekordwärme und Regen startet Deutschland ins Neue Jahr. Bleiben wird das milde Wetter aber nicht mehr lange, denn Tief ""Magdalene"" sorgt für eine Abkühlung mit Schnee, Frost und Glätte. Schon am… [+4055 chars]",,de,'Schnee'
https://www.faz.net/aktuell/wirtschaft/kampf-gegen-die-inflation-galbraith-redivivus-18571782.html,https://www.faz.net/aktuell/wirtschaft/kampf-gegen-die-inflation-galbraith-redivivus-18571782.html,0,www.faz.net,Kampf gegen die Inflation: Galbraith redivivus,Linke Ökonomen greifen wieder auf Ideen von John Kenneth Galbraith zurück. Galbraith war zwar ein sehr erfolgreicher Autor und ein kluger Kopf. Aber seine Ideen waren auch aus guten Gründen gescheitert,https://media1.faz.net/ppmedia/aktuell/63614946/1.8571837/facebook_teaser/olivier-blanchard-im-jahr-2015.jpg,2023-01-01T14:22:38Z,,Kaum ein Ökonom dürfte in den vergangenen Jahrzehnten als Sachbuchautor erfolgreicher gewesen sein als der langjährige Harvard-Professor John Kenneth Galbraith (1908 bis 2006). In der Mitte des 20. J… [+1908 chars],,de,'Inflation'
https://www.diepresse.com/6233416/wintersport-ohne-schnee,https://www.diepresse.com/6233416/wintersport-ohne-schnee,0,www.diepresse.com,Wintersport ohne Schnee [premium],"Plusgrade und Seitenwind irritierten Halvor Granerud beim Gewinn des Neujahrsspringens nicht. Andere aber, wie Stefan Kraft, haderten schwer mit Wind und Wetter. Manuel Fettner wure Vierter, Jan Hörl Fünfter.",https://media.diepresse.com/social_diepresse_nachrichten_paid/images/uploads_1200/d/4/8/6233416/55BA911A-5D98-46D5-86C9-7C43FA343CA2_v0_l.jpg,2023-01-01T14:57:00Z,,"Plusgrade und Seitenwind irritierten Halvor Granerud beim Gewinn des Neujahrsspringens nicht. Andere aber, wie Stefan Kraft, haderten schwer mit Wind und Wetter. Manuel Fettner wure Vierter, Jan Hörl… [+954 chars]",,de,'Schnee'
https://www.bild.de/regional/sachsen-anhalt/sachsen-anhalt-news/brockencoaster-betreiber-borkenkaefer-zerfressen-meine-existenz-82412532.bild.html,https://www.bild.de/regional/sachsen-anhalt/sachsen-anhalt-news/brockencoaster-betreiber-borkenkaefer-zerfressen-meine-existenz-82412532.bild.html,0,www.bild.de,„Brockencoaster“-Betreiber - Borkenkäfer zerfressen meine Existenz,"Egal, ob Schnee oder Wärme – auf der Allwetterbahn „Brockencoaster“ kann immer gerodelt werden.Foto: Steffen Schellhorn","https://images.bild.de/63b1cb74997b1b14b40a7d39/46cef913fb6f4e8dad5bfeffef05751f,3b4a15b8?w=1280",2023-01-01T18:11:07Z,https://web.archive.org/web/20230102015820/https://www.bild.de/regional/sachsen-anhalt/sachsen-anhalt-news/brockencoaster-betreiber-borkenkaefer-zerfressen-meine-existenz-82412532.bild.html,"Schierke Egal, ob Schnee oder Wärme, Winter oder Sommer auf der Allwetterbahn Brockencoaster kann immer gerodelt werden.
Doch jetzt bedroht ein gefräßiges Insekt die beliebte Touristenattraktion: de… [+1501 chars]",,de,'Schnee'
https://www.jungewelt.de/artikel/441932.folgen-der-krise-dekret-gegen-inflation.html,https://www.jungewelt.de/artikel/441932.folgen-der-krise-dekret-gegen-inflation.html,0,www.jungewelt.de,Folgen der Krise: Dekret gegen Inflation,Spanische Regierung kündigt neue »Entlastungsmaßnahmen« an. Kinderarmut nimmt derweil weiter zu • Foto: Violeta Santos Moura/REUTERS,https://www.jungewelt.de/img/1100/175677.jpg,2023-01-01T18:40:47Z,,"Kurz vor dem Jahreswechsel hat die spanische Koalitionsregierung neue Maßnahmen angekündigt, »um die Inflation einzudämmen und um die Schwächsten zu schützen«. Ministerpräsident Pedro Sánchez von der… [+3569 chars]",,de,'Inflation'
https://www.faz.net/aktuell/politik/ukraine-liveticker-neuer-russischer-drohnenangriff-in-der-ukraine-18495964.html,https://www.faz.net/aktuell/politik/ukraine-liveticker-neuer-russischer-drohnenangriff-in-der-ukraine-18495964.html,0,www.faz.net,Ukraine-Liveblog: Neuer russischer Drohnenangriff in der Ukraine,Schwere Kämpfe bei ostukrainischer Stadt Bachmut +++ Klitschko: Müssen jederzeit mit neuem Angriff auf Kiew rechnen +++ Russland greift Ukraine abermals mit Raketen an +++ alle Entwicklungen im Liveblog.,https://media0.faz.net/ppmedia/aktuell/politik/261110949/1.8572606/facebook_teaser/rettungskraefte-arbeiten-in.jpg,2023-01-01T20:55:10Z,https://web.archive.org/web/20230101211944/https://www.faz.net/aktuell/politik/ukraine-liveticker-neuer-russischer-drohnenangriff-in-der-ukraine-18495964.html,"Rettungskräfte arbeiten in einem stark beschädigten Wohngebiet, das nach ukrainischen Angaben bei einem russischen Raketenangriff beschädigt wurden. Bild: dpa
Schwere Kämpfe bei ostukrainischer Stad… [+163 chars]",,de,'Ukraine'
https://www.faz.net/aktuell/politik/ukraine-liveticker-ukraine-meldet-neuen-beschuss-in-kiew-18495964.html,https://www.faz.net/aktuell/politik/ukraine-liveticker-ukraine-meldet-neuen-beschuss-in-kiew-18495964.html,0,www.faz.net,Ukraine-Liveblog: Explosion in Kiew: Ukraine meldet neuen Beschuss,Neuer russischer Drohnenangriff +++ Schwere Kämpfe bei ostukrainischer Stadt Bachmut +++ Klitschko: Müssen jederzeit mit neuem Angriff auf Kiew rechnen +++ alle Entwicklungen im Liveblog.,https://media0.faz.net/ppmedia/aktuell/2372361209/1.8572648/facebook_teaser/feuerwehrleute-loeschen-am.jpg,2023-01-01T20:55:10Z,,"Der frühere NATO-General Hans-Lothar Domröse erwartet im Laufe des neuen Jahres einen Waffenstillstand in der Ukraine. ""Wir werden im Verlauf des Jahres 2023 einen Waffenstillstand haben"", sagte Domr… [+928 chars]",,de,'Explosion'
https://www.morgenpost.de/politik/article237267689/ukraine-krieg-ende-2023-nato-general-domroese-interview.html,https://www.morgenpost.de/politik/article237267689/ukraine-krieg-ende-2023-nato-general-domroese-interview.html,0,www.morgenpost.de,Interview: Ukraine-Krieg: „Wir werden 2023 Waffenstillstand haben“,"Endet der Ukraine-Krieg 2023? Ex-Nato-General Domröse erklärt, welche Optionen Russland und die Ukraine haben – und was Deutschland tun muss.",https://img.morgenpost.de/img/politik/crop237267687/9602602220-w820-cv16_9-q85/b49ac89a-8128-11ed-b341-b7b3a29e629b.jpg,2023-01-01T21:02:00Z,,"Berlin. Er ist einer der gefragtesten Militärexperten in Deutschland, er beobachtet den Ukraine-Krieg seit Beginn mit den Augen eines erfahrenen Befehlshabers: Der frühere Bundeswehr- und Nato-Genera… [+7753 chars]",,de,'Ukraine'
https://www.focus.de/politik/ausland/ukraine-update-am-1-januar-kiew-russland-fuehrt-jetzt-krieg-des-toetens-wegen_id_72885571.html,https://www.focus.de/politik/ausland/ukraine-update-am-1-januar-kiew-russland-fuehrt-jetzt-krieg-des-toetens-wegen_id_72885571.html,0,www.focus.de,Das Ukraine-Update am Abend - Kiew: Russland führt jetzt „Krieg des Tötens wegen“,"Ein Dekret von Russlands Präsident Wladimir Putin , das 137.000 zusätzliche Soldaten bringt, ist in Kraft getreten. Während es weiter schwere Kämpfe um Bachmut in der Ostukraine gibt, prangert Kiew an, dass Russland einen „Krieg des Tötens wegen“ führt. Das U…",https://p6.focus.de/img/fotos/id_180399451/truemmer-im-ukraine-krieg..jpg?im=Crop%3D%280%2C288%2C3464%2C1732%29%3BResize%3D%281200%2C627%29&hash=de6e20398d2e39628c54719249aaef7bf18ffe98a1c7cd293953af96a8d48258,2023-01-01T21:30:00Z,,"Ein Dekret von Russlands Präsident Wladimir Putin , das 137.000 zusätzliche Soldaten bringt, ist in Kraft getreten. Während es weiter schwere Kämpfe um Bachmut in der Ostukraine gibt, prangert Kiew a… [+11480 chars]",,de,'Putin'
https://www.n-tv.de/politik/04-07-Ukraine-Erneut-Infrastruktur-um-Kiew-im-Visier-Moskaus--article23143824.html,https://www.n-tv.de/politik/04-07-Ukraine-Erneut-Infrastruktur-um-Kiew-im-Visier-Moskaus--article23143824.html,0,www.n-tv.de,Ukraine-Krieg im Liveticker: +++ 04:07 Ukraine: Erneut Infrastruktur um Kiew im Visier Moskaus +++,"Berlin, Washington, Br\u00fcssel - \u00fcberall. n-tv berichtet von allen wichtigen Schaupl\u00e4tzen der Innen- und Au\u00dfenpolitik.",https://bilder2.n-tv.de/img/incoming/crop23332537/9041326157-cImg_16_9-w1200/Liveticker1-grau-1-Kopie.jpg,2023-01-01T23:27:00Z,https://web.archive.org/web/20230102032145/https://www.n-tv.de/politik/04-07-Ukraine-Erneut-Infrastruktur-um-Kiew-im-Visier-Moskaus--article23143824.html,"Die russischen Drohnenangriffe vom frühen Morgen zielen ukrainischen Angaben zufolge erneut auf kritische Infrastrukturen in Kiew und der umliegenden Region ab. ""Es ist laut in der Region und in der … [+2938 chars]",,de,'Ukraine'
https://www.n-tv.de/politik/02-21-Moskau-Ukraine-trifft-Militaerquartier-in-Donezk--article23143824.html,https://www.n-tv.de/politik/02-21-Moskau-Ukraine-trifft-Militaerquartier-in-Donezk--article23143824.html,0,www.n-tv.de,Ukraine-Krieg im Liveticker: +++ 02:21 Moskau: Ukraine trifft Militärquartier in Donezk +++,"Berlin, Washington, Br\u00fcssel - \u00fcberall. n-tv berichtet von allen wichtigen Schaupl\u00e4tzen der Innen- und Au\u00dfenpolitik.",https://bilder2.n-tv.de/img/incoming/crop23332537/9041326157-cImg_16_9-w1200/Liveticker1-grau-1-Kopie.jpg,2023-01-01T23:27:00Z,,In der Silvesternacht haben ukrainischen Streitkräfte russischen Angaben zufolge die Stadt Makijiwka und andere Orte in den von Moskau kontrollierten Teilen der Region Donezk beschossen. Den Berichte… [+2415 chars],,de,'Explosion'
https://www.n-tv.de/politik/05-58-Klitschko-Strom-und-Heizungsausfaelle-nach-Angriffen-auf-Kiew--article23143824.html,https://www.n-tv.de/politik/05-58-Klitschko-Strom-und-Heizungsausfaelle-nach-Angriffen-auf-Kiew--article23143824.html,0,www.n-tv.de,Ukraine-Krieg im Liveticker: +++ 05:58 Klitschko: Strom- und Heizungsausfälle nach Angriffen auf Kiew +++,"Berlin, Washington, Br\u00fcssel - \u00fcberall. n-tv berichtet von allen wichtigen Schaupl\u00e4tzen der Innen- und Au\u00dfenpolitik.",https://bilder2.n-tv.de/img/incoming/crop23332537/9041326157-cImg_16_9-w1200/Liveticker1-grau-1-Kopie.jpg,2023-01-01T23:27:00Z,,"Infolge der nächtlichen Angriffe auf Kiew ist die Energieinfrastruktur der ukrainischen Hauptstadt beschädigt, was zu Strom- und Heizungsausfällen führt, teilt Bürgermeister Vitali Klitschko mit.
++… [+4072 chars]",,de,'Explosion'
https://www.n-tv.de/politik/05-06-Japanischer-Comic-Geist-von-Kiew-sorgt-fuer-Furore--article23143824.html,https://www.n-tv.de/politik/05-06-Japanischer-Comic-Geist-von-Kiew-sorgt-fuer-Furore--article23143824.html,0,www.n-tv.de,"Ukraine-Krieg im Liveticker: +++ 05:06 Japanischer Comic ""Geist von Kiew"" sorgt für Furore +++","Berlin, Washington, Br\u00fcssel - \u00fcberall. n-tv berichtet von allen wichtigen Schaupl\u00e4tzen der Innen- und Au\u00dfenpolitik.",https://bilder2.n-tv.de/img/incoming/crop23332537/9041326157-cImg_16_9-w1200/Liveticker1-grau-1-Kopie.jpg,2023-01-01T23:27:00Z,,Ein Manga-Comic über einen fiktiven ukrainischen Kampfpiloten sorgt laut japanischen Medien in dem vom Krieg zerrütteten Land für Furore. Der Held des vom japanischen Hobby-Karikaturisten Juko Matsud… [+3810 chars],,de,'Explosion'
https://www.n-tv.de/politik/Ex-NATO-General-Selenskyj-koennte-Deal-mit-Putin-machen-article23816165.html,https://www.n-tv.de/politik/Ex-NATO-General-Selenskyj-koennte-Deal-mit-Putin-machen-article23816165.html,0,www.n-tv.de,Waffenstillstand 2023 erwartet: Ex-NATO-General: Selenskyj könnte Deal mit Putin machen,"Sicherheitsexperten rechnen mit einem Waffenstillstand im Ukraine-Krieg im neuen Jahr. Im Frühsommer 2023 könnte es laut Ex-NATO-General Domröse soweit sein. Eine Verhandlungslösung werde dann gesucht - und Domröse hat auch eine Idee, wie diese aussehen könnt…",https://bilder3.n-tv.de/img/incoming/crop23816170/0601327785-cImg_16_9-w1200/389073077.jpg,2023-01-02T00:03:07Z,,Sicherheitsexperten rechnen mit einem Waffenstillstand im Ukraine-Krieg im neuen Jahr. Im Frühsommer 2023 könnte es laut Ex-NATO-General Domröse soweit sein. Eine Verhandlungslösung werde dann gesuch… [+2435 chars],,de,'Putin'
https://www.dw.com/de/ukraine-aktuell-kreml-r%C3%A4umt-hohe-verluste-nach-ukrainischem-angriff-ein/a-64259197,https://www.dw.com/de/ukraine-aktuell-kreml-r%C3%A4umt-hohe-verluste-nach-ukrainischem-angriff-ein/a-64259197,0,www.dw.com,Ukraine aktuell: Kreml räumt hohe Verluste nach ukrainischem Angriff ein,Eigentlich nennt Moskau kaum Opferzahlen. Aber nach einem ukrainischen Angriff auf eine Militärunterkunft im Donbass spricht der Kreml von mindestens 63 getöteten russischen Soldaten. Aktuelle Nachrichten im Überblick.,https://static.dw.com/image/64264580_6.jpg,2023-01-02T01:24:00Z,,"Das Wichtigste in Kürze:
<ul><li>Moskau: 63 russische Soldaten sterben nach ukrainischem Angriff</li><li>Erneut Strom und Heizungsausfälle in Kiew nach Angriffen</li><li>Selenskyj-Berater: Russland … [+8380 chars]",,de,'Putin'
https://www.tagesschau.de/newsticker/liveblog-ukraine-montag-217.html,https://www.tagesschau.de/newsticker/liveblog-ukraine-montag-217.html,0,www.tagesschau.de,Liveblog: ++ Kiew meldet Angriffe auf Infrastruktur ++,Erneut greift Russland Kiew und Umgebung mit Kampfdrohnen an - insbesondere kritische Infrastruktur wird dabei zum Ziel genommen. Die Ukraine beschießt russische Truppen in der Donezk-Region. Alle Entwicklungen im Liveblog.,https://www.tagesschau.de/multimedia/bilder/luftschutz-kiew-101~_v-original.jpg,2023-01-02T03:00:41Z,https://web.archive.org/web/20230102030124/http://www.tagesschau.de/newsticker/liveblog-ukraine-montag-217.html,Erneut greift Russland Kiew und Umgebung mit Kampfdrohnen an - insbesondere kritische Infrastruktur wird dabei zum Ziel genommen. Die Ukraine beschießt russische Truppen in der Donezk-Region. Alle En… [+1421 chars],,de,'Explosion'
https://www.stern.de/news/kinderschutzbund-fordert-hundert-euro-sofortzuschlag-fuer-jedes-kind-in-armut-33059552.html,https://www.stern.de/news/kinderschutzbund-fordert-hundert-euro-sofortzuschlag-fuer-jedes-kind-in-armut-33059552.html,0,www.stern.de,Kinderschutzbund fordert hundert Euro Sofortzuschlag für jedes Kind in Armut,"Der Präsident des Deutschen Kinderschutzbunds, Heinz Hilgers, fordert einen höheren Sofortzuschlag für Kinder in Armut. ""Für jedes anspruchsberechtigte Kind schlage ich einen Sofortzuschlag von hundert Euro vor"", sagte Hilgers der Düsseldorfer ""Rheinischen Po…",https://image.stern.de/33059554/t/yV/v1/w1440/r1.7778/-/02--kitakinder---a16e84a0d9c60ec1.jpg,2023-01-02T04:28:18Z,,"Der Präsident des Deutschen Kinderschutzbunds, Heinz Hilgers, fordert einen höheren Sofortzuschlag für Kinder in Armut. ""Für jedes anspruchsberechtigte Kind schlage ich einen Sofortzuschlag von hunde… [+715 chars]",,de,'Armut'
https://www.morgenpost.de/politik/article237267769/ukraine-krieg-russland-waffenstillstand-putin-wahl.html,https://www.morgenpost.de/politik/article237267769/ukraine-krieg-russland-waffenstillstand-putin-wahl.html,0,www.morgenpost.de,Konflikt: Ukraine-Krieg: Darum könnte Wladimir Putin 2023 einlenken,"Gibt es im Ukraine-Krieg 2023 Entspannung? Experten setzen auf Putins Verhandlungsbereitschaft, denn: Er hat zuhause ein Terminproblem.",https://img.morgenpost.de/img/politik/crop237267767/2642601740-w820-cv16_9-q85/4ef4db8a-8866-11ed-983e-6559b488cf40.jpg,2023-01-02T05:14:09Z,,"Berlin. Im Ukraine-Krieg zeigte sich der russische Präsident Wladimir Putin zuletzt stur. Ich denke, dass wir uns in die richtige Richtung bewegen, wir schützen unsere nationalen Interessen, die Inte… [+3982 chars]",,de,'Putin'
https://www.welt.de/politik/ausland/article242979933/Ukraine-News-Stromausfall-in-russischer-Region-nach-Beschuss-durch-Ukraine.html,https://www.welt.de/politik/ausland/article242979933/Ukraine-News-Stromausfall-in-russischer-Region-nach-Beschuss-durch-Ukraine.html,0,www.welt.de,Ukraine trifft Stromversorgung in Russland,"„Es gibt keinen Strom“, heißt es in der russischen Region Brjansk nach einem Angriff aus der Ukraine. Auch in Kiew und Umgebung war die kritische Infrastruktur nachts im Visier. Hier griff Russland an. Aus dem Iran stammenden Shahed-Drohnen sollen im Einsatz …",https://img.welt.de/img/politik/ausland/mobile242979979/4111354337-ci16x9-w1200/TOPSHOT-UKRAINE-RUSSIA-CONFLICT-WAR-NEW-YEAR.jpg,2023-01-02T05:31:02Z,,In der russischen Region Brjansk nahe der Grenze zur Ukraine ist russischen Angaben zufolge nach einem ukrainischen Drohnenangriff teilweise der Strom ausgefallen. Ein ukrainischer Drohnenangriff wur… [+5127 chars],,de,'Russland'
https://www.stern.de/gesellschaft/regional/niedersachsen-bremen/migration--weil--lage-bei-unterbringung-von-gefluechteten-angespannt-33059818.html,https://www.stern.de/gesellschaft/regional/niedersachsen-bremen/migration--weil--lage-bei-unterbringung-von-gefluechteten-angespannt-33059818.html,0,www.stern.de,Migration: Weil: Lage bei Unterbringung von Geflüchteten angespannt,Bis Mitte Dezember wurden in Niedersachsen rund 110.000 Ukraine-Vertriebene registriert. Ministerpräsident Weil will die Anstrengungen bei der Unterbringung erhöhen - appelliert zeitgleich auch an die EU.,https://image.stern.de/33059820/t/I1/v1/w1440/r1.7778/-/02--urnnewsmldpacom200901012301029976236v2w800h600l447t465r1729b1322jpeg---72ffe99db90e2791.jpg,2023-01-02T06:22:21Z,,Bis Mitte Dezember wurden in Niedersachsen rund 110.000 Ukraine-Vertriebene registriert. Ministerpräsident Weil will die Anstrengungen bei der Unterbringung erhöhen - appelliert zeitgleich auch an di… [+2365 chars],,de,'Putin'
https://www.stern.de/politik/ausland/krieg-gegen-die-ukraine--klitschko-berichtet-von-schaeden-in-kiew-nach-drohnenangriff-33059892.html,https://www.stern.de/politik/ausland/krieg-gegen-die-ukraine--klitschko-berichtet-von-schaeden-in-kiew-nach-drohnenangriff-33059892.html,0,www.stern.de,Krieg gegen die Ukraine: Klitschko berichtet von Schäden in Kiew nach Drohnenangriff,Seit einigen Tagen greift Russland die Ukraine nachts verstärkt mit Drohnen an. In Kiew wird dabei erneut die Energie-Infrastruktur beschädigt. Der Morgen beginnt mit Stromausfällen.,https://image.stern.de/33059894/t/fZ/v1/w1440/r1.7778/-/02--urnnewsmldpacom200901012301029976331v2w800h600l1030t429r3011b1819jpeg---1639169851da460d.jpg,2023-01-02T06:37:53Z,,"Seit einigen Tagen greift Russland die Ukraine nachts verstärkt mit Drohnen an. In Kiew wird dabei erneut die Energie-Infrastruktur beschädigt. Der Morgen beginnt mit Stromausfällen.
Russland hat in… [+1319 chars]",,de,'Russland'
https://www.morgenpost.de/politik/ausland/article237269459/Klitschko-berichtet-von-Schaeden-in-Kiew-nach-Drohnenangriff.html,https://www.morgenpost.de/politik/ausland/article237269459/Klitschko-berichtet-von-Schaeden-in-Kiew-nach-Drohnenangriff.html,0,www.morgenpost.de,Krieg gegen die Ukraine: Klitschko berichtet von Schäden in Kiew nach Drohnenangriff,Seit einigen Tagen greift Russland die Ukraine nachts verstärkt mit Drohnen an. In Kiew wird dabei erneut die Energie-Infrastruktur beschädigt. Der Morgen beginnt mit Stromausfällen.,https://img.morgenpost.de/img/ausland/crop237269457/1222601940-w820-cv16_9-q85/Ukraine-Krieg.jpg,2023-01-02T06:37:53Z,,"Kiew . Russland hat in der fünften Nacht in Folge die Ukraine mit Kampfdrohnen angegriffen. In der Hauptstadt Kiew teilte Bürgermeister Vitali Klitschko am Montagmorgen mit, dass Energie-Infrastruktu… [+1261 chars]",,de,'Explosion'
https://www.focus.de/kultur/vermischtes/marvel-star-jeremy-renner-liegt-nach-schneesturm-unfall-im-krankenhaus_id_181934677.html,https://www.focus.de/kultur/vermischtes/marvel-star-jeremy-renner-liegt-nach-schneesturm-unfall-im-krankenhaus_id_181934677.html,0,www.focus.de,"„Kritischer, aber stabiler Zustand“ - Marvel-Star Jeremy Renner liegt nach Unfall im Krankenhaus","Hollywood-Star Jeremy Renner liegt nach einem Unfall im Schnee im Krankenhaus. Sein Sprecher sagte, dass es „hervorragend versorgt“ werde.",https://p6.focus.de/img/kultur/vermischtes/id_181934676/jeremy-renner-muss-derzeit-im-krankenhaus-behandelt-werden..jpg?im=Crop%3D%280%2C0%2C1000%2C500%29%3BResize%3D%281200%2C627%29&impolicy=perceptual&quality=medium&hash=622aa0545bbe63f069e1784809fd6fe02f6b634da4b09d8e9d4c7465df0a79fe,2023-01-02T06:55:08Z,https://web.archive.org/web/20230102113611/https://www.focus.de/kultur/vermischtes/marvel-star-jeremy-renner-liegt-nach-schneesturm-unfall-im-krankenhaus_id_181934677.html,"Jeremy Renner (51) liegt nach einem Unfall im Krankenhaus. Der Zustand des Schauspielers sei kritisch, aber stabil, zitiert das US-Branchenportal Deadline einen Sprecher des Hollywood-Stars. Renner h… [+1698 chars]",,de,'Schnee'
