index,url,valid,domain,title,description,image,published,archive,content,quote,language,keyword
https://www.focus.de/panorama/welt/21-jaehriger-in-lebensgefahr-ex-lets-dance-star-trainierte-noch-kurz-vor-messerangriff-in-fitnessstudio_id_191465753.html,https://www.focus.de/panorama/welt/21-jaehriger-in-lebensgefahr-ex-lets-dance-star-trainierte-noch-kurz-vor-messerangriff-in-fitnessstudio_id_191465753.html,0,www.focus.de,Bluttat in Duisburg - Ex-„Let's Dance“-Star trainierte noch kurz vor Messerangriff in Fitnessstudio,"In einem Fitnessstudio in Duisburg hat es am Dienstagabend einen Messerangriff gegeben. Ein Angreifer soll wortlos auf sie eingestochen haben, so die Opfer. Es gibt mehrere Schwerverletzte. Der Täter ist weiterhin auf der Flucht.",https://p6.focus.de/img/fotos/id_11672303/urn-newsml-dpa-com-20090101-200217-99-945109-large-4-3.jpg?im=Crop%3D%280%2C100%2C800%2C400%29%3BResize%3D%281200%2C627%29&hash=33d0423141e82ed5c093ee8c4557eb220ec30e7c32b78202d19d4b67cc5b0f3a,2023-04-20T06:30:05Z,https://web.archive.org/web/20230420072027/https://www.focus.de/panorama/welt/21-jaehriger-in-lebensgefahr-ex-lets-dance-star-trainierte-noch-kurz-vor-messerangriff-in-fitnessstudio_id_191465753.html,"Comedian Abdelkarim trainierte noch kurz vor Messerangriff in Duisburger Fitnessstudio
20.21 Uhr: Vier Menschen wurden am Dienstagabend bei einer Messerattacke in einem Duisburger Fitnessstudio schw… [+7259 chars]",,de,'Flucht'
https://www.zeit.de/wirtschaft/2023-04/deutsche-exporte-maerz-sinken-handel-drittstaaten-russland-china,https://www.zeit.de/wirtschaft/2023-04/deutsche-exporte-maerz-sinken-handel-drittstaaten-russland-china,0,www.zeit.de,Internationaler Handel: Deutschland exportiert weniger Waren außerhalb der EU,"Weniger nach China, mehr nach Großbritannien und wieder mehr nach Russland: Im März ging der Überseehandel deutscher Unternehmen zurück. Insgesamt aber wird es besser.",,2023-04-20T07:53:49Z,https://web.archive.org/web/20230420084105/https://www.zeit.de/wirtschaft/2023-04/deutsche-exporte-maerz-sinken-handel-drittstaaten-russland-china,"When browsing with ads:
We collect personal data and also transmit it to third-party providers
 that help us improve and finance our digital content. Some of the information stored on your device, … [+732 chars]",,de,'Russland'
https://consent.google.com/ml?continue=https://news.google.com/rss/articles/CBMiXmh0dHBzOi8vd3d3LnJldXRlcnMuY29tL3dvcmxkL2V1cm9wZS9uYXRvLWNoaWVmLXN0b2x0ZW5iZXJnLXZpc2l0cy13YXJ0aW1lLXVrcmFpbmUtMjAyMy0wNC0yMC_SAQA?oc%3D5&gl=FR&hl=en-US&cm=2&pc=n&src=1,https://consent.google.com/ml?continue=https://news.google.com/rss/articles/CBMiXmh0dHBzOi8vd3d3LnJldXRlcnMuY29tL3dvcmxkL2V1cm9wZS9uYXRvLWNoaWVmLXN0b2x0ZW5iZXJnLXZpc2l0cy13YXJ0aW1lLXVrcmFpbmUtMjAyMy0wNC0yMC_SAQA?oc%3D5&gl=FR&hl=en-US&cm=2&pc=n&src=1,0,consent.google.com,NATO chief Stoltenberg visits wartime Ukraine - Reuters,NATO chief Stoltenberg visits wartime Ukraine  Reuters,,2023-04-20T08:24:00Z,https://web.archive.org/web/20230424103532/https://consent.google.com/ml?continue=https:%2F%2Fnews.google.com%2Frss%2Farticles%2FCBMiXmh0dHBzOi8vd3d3LnJldXRlcnMuY29tL3dvcmxkL2V1cm9wZS9uYXRvLWNoaWVmLXN0b2x0ZW5iZXJnLXZpc2l0cy13YXJ0aW1lLXVrcmFpbmUtMjAyMy0wNC0yMC_SAQA%3Foc%3D5&gl=FR&hl=en-US&cm=2&pc=n&src=1,"We use cookies and data to<ul><li>Deliver and maintain Google services</li><li>Track outages and protect against spam, fraud, and abuse</li><li>Measure audience engagement and site statistics to unde… [+1131 chars]",,de,'Ukraine'
https://www.n-tv.de/wirtschaft/Europa-schwimmt-in-LNG-article24065013.html,https://www.n-tv.de/wirtschaft/Europa-schwimmt-in-LNG-article24065013.html,0,www.n-tv.de,Europa schwimmt in LNG: EU hofft auf Gas-Unabhängigkeit vom Kreml,"Die Zeitenwende kommt voran: Trotz Russlands Lieferstopp herrscht in Europa nicht Gasflaute, sondern Überfluss. Doch Grund zum Aufatmen gibt es nicht. Denn vor allem China könnte noch einen Strich durch die Rechnung machen.",https://bilder3.n-tv.de/img/incoming/crop24065022/9871325586-cImg_16_9-w1200/402847879.jpg,2023-04-20T08:50:25Z,,"Die Zeitenwende kommt voran: Trotz Russlands Lieferstopp herrscht in Europa nicht Gasflaute, sondern Überfluss. Doch Grund zum Aufatmen gibt es nicht. Denn vor allem China könnte noch einen Strich du… [+4540 chars]",,de,'Russland'
https://www.focus.de/finanzen/anzeichen-fuer-abnehmende-inflation-anstieg-der-erzeugerpreise-schwaechst-sich-deutlich-ab_id_191616009.html,https://www.focus.de/finanzen/anzeichen-fuer-abnehmende-inflation-anstieg-der-erzeugerpreise-schwaechst-sich-deutlich-ab_id_191616009.html,0,www.focus.de,Anzeichen für abnehmende Inflation - Anstieg der Erzeugerpreise schwächst sich deutlich ab,Kunden dürfen auf eine weiter abnehmende Inflation hoffen: Die Erzeugerpreise in Deutschland stiegen im März so schwach wie zuletzt im Sommer 2021. Das sollte auch die Teuerung an den Kassen weiter ausbremsen.,https://p6.focus.de/img/fotos/id_191618305/gettyimages-1186092191.jpg?im=Crop%3D%280%2C177%2C2121%2C1060%29%3BResize%3D%281200%2C627%29&hash=fa6683e2847067502fda50c8dc43b17651c889a1d6c1d27d5bf8a59f2705c744,2023-04-20T10:31:55Z,https://web.archive.org/web/20230429014243/https://www.focus.de/finanzen/anzeichen-fuer-abnehmende-inflation-anstieg-der-erzeugerpreise-schwaechst-sich-deutlich-ab_id_191616009.html,Kunden dürfen auf eine weiter abnehmende Inflation hoffen: Die Erzeugerpreise in Deutschland stiegen im März so schwach wie zuletzt im Sommer 2021. Das sollte auch die Teuerung an den Kassen weiter a… [+2043 chars],,de,'Teuer'
https://www.faz.net/aktuell/politik/ukraine-liveticker-zukunft-der-ukraine-ist-in-der-nato-laut-stoltenberg-faz-18495964.html,https://www.faz.net/aktuell/politik/ukraine-liveticker-zukunft-der-ukraine-ist-in-der-nato-laut-stoltenberg-faz-18495964.html,0,www.faz.net,Ukraine-Liveblog: Stoltenberg: „Die Zukunft der Ukraine ist in der NATO“,NATO-Generalsekretär Stoltenberg überraschend in Kiew +++ ISW: Geheimdienst-Razzia bei der Moskauer Polizei +++ Lichtschweif über Kiew – Meteorit wahrscheinlich +++ alle Entwicklungen im Liveblog,https://media0.faz.net/ppmedia/aktuell/politik/1929401295/1.8835146/facebook_teaser/nato-generalsekretaer-jens.jpg,2023-04-20T12:16:19Z,https://web.archive.org/web/20230420123655/https://www.faz.net/aktuell/politik/ukraine-liveticker-zukunft-der-ukraine-ist-in-der-nato-laut-stoltenberg-faz-18495964.html,Der russische Inlandsgeheimdienst FSB und die Hauptdirektion des Sicherheitsdienstes des Innenministeriums (MVD) haben in den vergangenen Wochen Razzien in der Moskauer Bezirksdirektion für innere An… [+918 chars],,de,'Ukraine'
https://www.tagesschau.de/ausland/europa/putin-behauptung-doppelgaenger-101.html,https://www.tagesschau.de/ausland/europa/putin-behauptung-doppelgaenger-101.html,0,www.tagesschau.de,"Kreml: Spekulationen über Putin-Double ""merkwürdig""","Aus Kiew kommt der Vorwurf, statt Russlands Präsident Putin habe ein Doppelgänger zuletzt die Kriegsgebiete in Cherson besucht. Der Kreml wies diese Spekulationen zurück und nannte sie ""merkwürdig"".",https://www.tagesschau.de/multimedia/bilder/putin-1119~_v-original.jpg,2023-04-20T12:46:10Z,https://web.archive.org/web/20230420175818/https://www.tagesschau.de/ausland/europa/putin-behauptung-doppelgaenger-101.html,"Aus Kiew kommt der Vorwurf, statt Russlands Präsident Putin habe ein Doppelgänger zuletzt die Kriegsgebiete in Cherson besucht. Der Kreml wies diese Spekulationen zurück und nannte sie ""merkwürdig"".… [+1881 chars]",,de,'Putin'
https://www.welt.de/vermischtes/kriminalitaet/article244905104/Duisburg-Attacke-in-Fitnessstudio-laut-Ermittlern-gezielt-gegen-21-jaehriges-Opfer.html,https://www.welt.de/vermischtes/kriminalitaet/article244905104/Duisburg-Attacke-in-Fitnessstudio-laut-Ermittlern-gezielt-gegen-21-jaehriges-Opfer.html,0,www.welt.de,Attacke in Fitnessstudio laut Ermittlern „gezielt“ gegen 21-jähriges Opfer,"Nach dem Angriff in einem Duisburger Fitnessstudio ist der Täter weiter auf der Flucht. Die Polizei wertet Videoaufnahmen aus der Umgebung aus. Klar ist inzwischen, dass sich die Attacke gezielt gegen eines der vier Opfer richtete.",https://img.welt.de/img/vermischtes/kriminalitaet/mobile244905210/3991355357-ci16x9-w1200/Nach-der-Attacke-in-einem-Duisburger-Fitnessstudio.jpg,2023-04-20T12:55:10Z,,"Die Attacke in einem Duisburger Fitnessstudio vom Dienstagabend richtete sich nach Erkenntnissen der Ermittler gezielt gegen eines der Opfer, einen 21-jährigen Mann. Diesen aktuellen Ermittlungsstand… [+1932 chars]",,de,'Flucht'
https://www.tagesschau.de/inland/innenpolitik/pistorius-wehretat-bundeswehr-101.html,https://www.tagesschau.de/inland/innenpolitik/pistorius-wehretat-bundeswehr-101.html,0,www.tagesschau.de,"Verteidigungsminister Pistorius: ""Wir müssen besser werden""","Verteidigungsminister Pistorius will viel erneuern in seinem Ministerium. Im Bundestag nannte er die Stärkung der Bundeswehr, die Ukraine-Hilfe, die Sicherheitspolitik und den Verteidigungshaushalt.",https://www.tagesschau.de/multimedia/bilder/pistorius-297~_v-original.jpg,2023-04-20T14:02:49Z,,"Verteidigungsminister Pistorius will viel erneuern in seinem Ministerium. Im Bundestag nannte er die Stärkung der Bundeswehr, die Ukraine-Hilfe, die Sicherheitspolitik und den Verteidigungshaushalt. … [+3435 chars]",,de,'Ukraine'
https://www.tagesschau.de/ausland/europa/ukraine-kiew-lichtblitz-101.html,https://www.tagesschau.de/ausland/europa/ukraine-kiew-lichtblitz-101.html,0,www.tagesschau.de,Verwirrung nach Lichtblitz über Kiew,"Ein ungewöhnlicher Lichtschweif am Himmel über Kiew hat in der Ukraine für Luftalarm und stundenlange Spekulationen über die Ursache gesorgt. Die Raumfahrtbehörde geht inzwischen davon aus, dass es ein Naturphänomen war.",https://www.tagesschau.de/multimedia/bilder/meteorit-kiew-101~_v-original.jpg,2023-04-20T14:24:23Z,,"Ein ungewöhnlicher Lichtschweif am Himmel über Kiew hat in der Ukraine für Luftalarm und stundenlange Spekulationen über die Ursache gesorgt. Die Raumfahrtbehörde geht inzwischen davon aus, dass es e… [+2077 chars]",,de,'Ukraine'
https://www.faz.net/aktuell/politik/ukraine-liveticker-nasa-lichtschweif-ueber-kiew-wahrscheinlich-meteorit-faz-18495964.html,https://www.faz.net/aktuell/politik/ukraine-liveticker-nasa-lichtschweif-ueber-kiew-wahrscheinlich-meteorit-faz-18495964.html,0,www.faz.net,Ukraine-Liveblog: NASA: Lichtschweif über Kiew wahrscheinlich ein Meteorit,NATO-Generalsekretär Stoltenberg in Kiew +++ Dänemark und Niederlande wollen Ukraine 14 Leopard-Panzer spenden +++ ISW: Geheimdienst-Razzia bei der Moskauer Polizei +++ alle Entwicklungen im Liveblog,https://media0.faz.net/ppmedia/aktuell/2044278643/1.8835736/facebook_teaser/bilder-einer.jpg,2023-04-20T14:33:41Z,,"Selenskyj bat die Nato zudem, Kiew dabei zu helfen, den Widerwillen einiger Mitgliedsstaaten zu überwinden, bestimmte Waffen an die Ukraine zu liefern. Dabei gehe es um Langstreckenwaffen, moderne Fl… [+1052 chars]",,de,'Ukraine'
https://www.tagesschau.de/ausland/amerika/starship-testflug-explosion-101.html,https://www.tagesschau.de/ausland/amerika/starship-testflug-explosion-101.html,0,www.tagesschau.de,"""Starship""-Riesenrakete von SpaceX explodiert bei erstem Testflug","Der erste Testflug des bisher längsten jemals gebauten Raketensystems ""Starship"" ist wenige Minuten nach dem Start mit einer ungeplanten Explosion zu Ende gegangen. Das Raumfahrtunternehmen SpaceX bewertete den Test trotzdem als Erfolg.",https://www.tagesschau.de/multimedia/bilder/starship-rakete-101~_v-original.jpg,2023-04-20T14:42:47Z,,"Der erste Testflug des bisher längsten jemals gebauten Raketensystems ""Starship"" ist wenige Minuten nach dem Start mit einer ungeplanten Explosion zu Ende gegangen. Das Raumfahrtunternehmen SpaceX be… [+3111 chars]",,de,'Explosion'
https://www.welt.de/wirtschaft/plus244910368/Starship-Absturz-Explosion-nach-4-Minuten-ist-trotzdem-ein-historischer-Erfolg.html,https://www.welt.de/wirtschaft/plus244910368/Starship-Absturz-Explosion-nach-4-Minuten-ist-trotzdem-ein-historischer-Erfolg.html,0,www.welt.de,Nach der Explosion der Monsterrakete setzt der Kampf um die Deutungshoheit ein,Elon Musks Weltrekord-Rakete Starship scheitert am Donnerstag spektakulär beim ersten Flugversuch. Triebwerksprobleme führten nach wenigen Minuten zur Explosion. Musk und sein Team verbuchen das Desaster trotzdem als Erfolg – die Finanzierung weiterer Mission…,https://img.welt.de/img/wirtschaft/mobile244911062/7941357097-ci16x9-w1200-fnov-fpotl-fpi157750653/Teststart-des-Starship.jpg,2023-04-20T15:57:02Z,,"Abgehoben ist sie, die größte Rakete der Welt. Trotzdem endete der Flug von Starship in einem Desaster. Der Milliardär und Technikunternehmer Elon Musk hatte schon im Vorfeld gewarnt, dass der Premie… [+161 chars]",,de,'Explosion'
https://www.zeit.de/arbeit/2023-04/armut-sasa-zatata-jens-teutrine-politik,https://www.zeit.de/arbeit/2023-04/armut-sasa-zatata-jens-teutrine-politik,0,www.zeit.de,"Armut: ""Leistung lohnt sich eben nicht immer""","Beide waren arm, beide gingen in die Politik. Nun ist Sasa Zatata wieder arm und Jens Teutrine Bundestagsabgeordneter. Ein Gespräch über Gerechtigkeit und Glück.",,2023-04-20T16:13:15Z,,"When browsing with ads:
We collect personal data and also transmit it to third-party providers
 that help us improve and finance our digital content. Some of the information stored on your device, … [+732 chars]",,de,'Armut'
https://www.zeit.de/news/2023-04/20/wunsch-nach-partnerschaft-mit-ukrainischer-region,https://www.zeit.de/news/2023-04/20/wunsch-nach-partnerschaft-mit-ukrainischer-region,0,www.zeit.de,Ukraine-Krieg: Wunsch nach Partnerschaft mit ukrainischer Region,,,2023-04-20T16:38:20Z,,"When browsing with ads:
We collect personal data and also transmit it to third-party providers
 that help us improve and finance our digital content. Some of the information stored on your device, … [+732 chars]",,de,'Ukraine'
https://www.faz.net/aktuell/wirtschaft/wohnen/von-den-400-000-spricht-keiner-mehr-18835894.html,https://www.faz.net/aktuell/wirtschaft/wohnen/von-den-400-000-spricht-keiner-mehr-18835894.html,0,www.faz.net,Wohnungsbautag: Von 400.000 neuen Wohnungen im Jahr ist keine Rede mehr,"Die Neubauziele der Bundesregierung rücken in weite Ferne. Die Baubranche kritisiert die vielen Auflagen, die die Kosten treiben. Unter 17,50 Euro Kaltmiete gehe inzwischen nichts mehr.",https://media1.faz.net/ppmedia/aktuell/wirtschaft/407391600/1.8836015/facebook_teaser/stein-auf-stein-baustelle-in.jpg,2023-04-20T17:03:05Z,,"In den vergangenen Wochen wurde unter Wohnungspolitikern vor allem über eines diskutiert: die Vorgaben zum Heizen mit erneuerbaren Energien, die ab 2024 gelten sollen. Am Donnerstag versuchte ein Bün… [+4271 chars]",,de,'Kosten'
https://www.zeit.de/wissen/2023-04/spacex-rakete-starship-explosion,https://www.zeit.de/wissen/2023-04/spacex-rakete-starship-explosion,0,www.zeit.de,SpaceX-Rakete: Bis zur Explosion lief doch alles super,"Starship, die größte Rakete der Welt, startete zum ersten Mal – wenigstens ein bisschen. Ihre Explosion ist kein Drama, eher typisch SpaceX.",,2023-04-20T17:33:07Z,,"When browsing with ads:
We collect personal data and also transmit it to third-party providers
 that help us improve and finance our digital content. Some of the information stored on your device, … [+732 chars]",,de,'Explosion'
https://www.faz.net/aktuell/politik/ukraine-liveticker-estland-kuendigt-weitere-militaerhilfe-fuer-ukraine-an-i-faz-18495964.html,https://www.faz.net/aktuell/politik/ukraine-liveticker-estland-kuendigt-weitere-militaerhilfe-fuer-ukraine-an-i-faz-18495964.html,0,www.faz.net,Ukraine-Liveblog: Estland kündigt weitere Militärhilfe an,Lichtschweif über Kiew wahrscheinlich ein Meteorit +++ NATO-Generalsekretär Stoltenberg in Kiew +++ Dänemark und Niederlande wollen Ukraine 14 Leopard-Panzer spenden +++ alle Entwicklungen im Liveblog,https://media1.faz.net/ppmedia/aktuell/politik/991309075/1.8836623/facebook_teaser/artilleriemunition-der.jpg,2023-04-20T17:38:24Z,,"Selenskyj bat die NATO zudem, Kiew dabei zu helfen, den Widerwillen einiger Mitgliedsstaaten zu überwinden, bestimmte Waffen an die Ukraine zu liefern. Dabei gehe es um Langstreckenwaffen, moderne Fl… [+1052 chars]",,de,'Ukraine'
https://www.zeit.de/news/2023-04/20/henkel-verkauft-russland-geschaeft-fuer-600-millionen-euro,https://www.zeit.de/news/2023-04/20/henkel-verkauft-russland-geschaeft-fuer-600-millionen-euro,0,www.zeit.de,Konsumgüter: Henkel verkauft Russland-Geschäft für 600 Millionen Euro,,,2023-04-20T17:46:03Z,,"When browsing with ads:
We collect personal data and also transmit it to third-party providers
 that help us improve and finance our digital content. Some of the information stored on your device, … [+732 chars]",,de,'Russland'
https://www.focus.de/kultur/kino_tv/illner-im-liveticker-pistorius-widerspricht-habeck-den-schuh-zieh-ich-mir-nicht-an_id_191651659.html,https://www.focus.de/kultur/kino_tv/illner-im-liveticker-pistorius-widerspricht-habeck-den-schuh-zieh-ich-mir-nicht-an_id_191651659.html,0,www.focus.de,„Maybrit Illner“ im Liveticker - Pistorius widerspricht Habeck bei Waffen: „Den Schuh zieh ich mir nicht an“,Wird der Westen liefern oder wieder zögern? Vor einem erneuten Treffen in Ramstein diskutiert Maybrit Illner am Donnerstag unter anderem mit Verteidigungsminister Boris Pistorius (SPD) über die bevorstehende Gegenoffensive der Ukraine. FOCUS online begleitet …,https://p6.focus.de/img/fotos/id_191656536/bundesverteidigungsminister-boris-pistorius-bei-maybrit-illner..jpg?im=Crop%3D%280%2C14%2C863%2C431%29%3BResize%3D%281200%2C627%29&hash=57bae0bf078877b6ff18ea83f8e8213c78b94b831e59ebc1e7bc976630aa96a8,2023-04-20T19:14:53Z,,Wird der Westen liefern oder wieder zögern? Vor einem erneuten Treffen in Ramstein diskutiert Maybrit Illner am Donnerstag unter anderem mit Verteidigungsminister Boris Pistorius (SPD) über die bevor… [+5755 chars],,de,'Waffen'
https://www.faz.net/aktuell/politik/ukraine-liveticker-russisches-flugzeug-beschiesst-versehentlich-russische-grenzstadt-faz-18495964.html,https://www.faz.net/aktuell/politik/ukraine-liveticker-russisches-flugzeug-beschiesst-versehentlich-russische-grenzstadt-faz-18495964.html,0,www.faz.net,Ukraine-Liveblog: Russisches Flugzeug beschießt versehentlich russische Grenzstadt,Estland kündigt weitere Militärhilfe für Ukraine an +++ Lichtschweif über Kiew wahrscheinlich ein Meteorit +++ NATO-Generalsekretär Stoltenberg in Kiew +++ alle Entwicklungen im Liveblog,https://media1.faz.net/ppmedia/aktuell/1749174360/1.8836915/facebook_teaser/dieses-am-20-april-2023-auf.jpg,2023-04-20T21:37:41Z,,Eine von einem russischen Kampfjet versehentlich ausgelöste schwere Explosion hat die Großstadt Belgorod unweit der Grenze zur Ukraine erschüttert. Auf der Kreuzung einer der Hauptstraßen hat sich ei… [+1321 chars],,de,'Ukraine'
https://www.faz.net/aktuell/politik/ukraine-liveticker-laut-gouverneur-schwere-explosion-in-russischer-grenzstadt-belgorod-i-faz-18495964.html,https://www.faz.net/aktuell/politik/ukraine-liveticker-laut-gouverneur-schwere-explosion-in-russischer-grenzstadt-belgorod-i-faz-18495964.html,0,www.faz.net,Ukraine-Liveblog: Laut Gouverneur schwere Explosion in russischer Grenzstadt Belgorod,Estland kündigt weitere Militärhilfe für Ukraine an +++ Lichtschweif über Kiew wahrscheinlich ein Meteorit +++ NATO-Generalsekretär Stoltenberg in Kiew +++ alle Entwicklungen im Liveblog,https://media1.faz.net/ppmedia/aktuell/1749174360/1.8836915/facebook_teaser/dieses-am-20-april-2023-auf.jpg,2023-04-20T21:37:41Z,,Möglichst zeitnah will Niedersachsen eine Partnerschaft mit einer ukrainischen Region eingehen. Das bekräftigte Ministerpräsident Stephan Weil (SPD) am Donnerstag nach einem Gespräch mit dem ukrainis… [+658 chars],,de,'Explosion'
https://www.zeit.de/politik/ausland/2023-04/ukraine-russland-belgorod-bombe-wolodymyr-selenskyj-nato-jens-stoltenberg-gipfel-juli,https://www.zeit.de/politik/ausland/2023-04/ukraine-russland-belgorod-bombe-wolodymyr-selenskyj-nato-jens-stoltenberg-gipfel-juli,0,www.zeit.de,"Ukraine-Überblick: Russland bombardiert unbeabsichtigt Belgorod, Selenskyj drängt Nato",Das russische Verteidigungsministerium hat die versehentliche Bombardierung der Grenzstadt bestätigt. Wolodymyr Selenskyj pocht weiter auf den Nato-Beitritt. Die Nacht,,2023-04-21T03:27:42Z,,"When browsing with ads:
We collect personal data and also transmit it to third-party providers
 that help us improve and finance our digital content. Some of the information stored on your device, … [+732 chars]",,de,'Russland'
https://www.faz.net/aktuell/politik/ukraine-liveticker-pistorius-verteidigt-moegliches-vordringen-der-ukraine-auf-russisches-gebiet-faz-18495964.html,https://www.faz.net/aktuell/politik/ukraine-liveticker-pistorius-verteidigt-moegliches-vordringen-der-ukraine-auf-russisches-gebiet-faz-18495964.html,0,www.faz.net,Ukraine-Liveblog: Pistorius verteidigt mögliches Vordringen der Ukraine auf russisches Gebiet,Russisches Flugzeug beschießt versehentlich russische Grenzstadt +++ Estland kündigt weitere Militärhilfe für Ukraine an +++ Lichtschweif über Kiew wahrscheinlich ein Meteorit +++ alle Entwicklungen im Liveblog,https://media1.faz.net/ppmedia/aktuell/politik/2917475748/1.8837119/facebook_teaser/boris-pistorius-spd.jpg,2023-04-21T03:49:41Z,,Eine von einem russischen Kampfjet versehentlich ausgelöste schwere Explosion hat die Großstadt Belgorod unweit der Grenze zur Ukraine erschüttert. Auf der Kreuzung einer der Hauptstraßen hat sich ei… [+1321 chars],,de,'Explosion'
https://www.welt.de/politik/ausland/article244914226/Ukraine-News-Bundeswehr-will-Patriot-Einsatz-in-Polen-und-Slowakei-beenden.html,https://www.welt.de/politik/ausland/article244914226/Ukraine-News-Bundeswehr-will-Patriot-Einsatz-in-Polen-und-Slowakei-beenden.html,0,www.welt.de,Bundeswehr will Patriot-Einsatz in Polen und Slowakei noch in diesem Jahr beenden,"Nach dem russischen Angriff auf die Ukraine hatte die Bundeswehr Patriot-Systeme in der Slowakei und in Polen stationiert. Nun sollen die Flugabwehrraketensysteme zurückgeholt werden. Man stehe mit den Nato-Partnern „im engen Austausch“, heißt es. Mehr im Liv…",https://img.welt.de/img/politik/ausland/mobile244914228/2261357757-ci16x9-w1200/Luft-und-Raketenabwehrtraining-in-Polen.jpg,2023-04-21T04:20:51Z,,"Die Bundeswehr will ihre Stationierung des Flugabwehrraketensystems Patriot in Polen und der Slowakei noch in diesem Jahr beenden. Beide Nato-Partner seien über diese Planungen informiert, sagte ein … [+5992 chars]",,de,'Ukraine'
https://www.faz.net/aktuell/politik/ausland/ukraine-krieg-russisches-kampfflugzeug-bombardiert-russische-stadt-18837075.html,https://www.faz.net/aktuell/politik/ausland/ukraine-krieg-russisches-kampfflugzeug-bombardiert-russische-stadt-18837075.html,0,www.faz.net,Russisches Kampfflugzeug bombardiert versehentlich russische Stadt,Russland hat nach eigenen Angaben versehentlich eine russische Grenzstadt beschossen. Selenskyj hat NATO-Generalsekretär Stoltenberg getroffen und fordert einen schnellen Beitritt seines Landes zur Militärallianz. Der Überblick,https://media0.faz.net/ppmedia/aktuell/3475241265/1.8837146/facebook_teaser/die-strassenkreuzung-in.jpg,2023-04-21T04:22:27Z,,Eine von einem russischen Kampfjet versehentlich ausgelöste schwere Explosion hat die Großstadt Belgorod unweit der Grenze zur Ukraine erschüttert. Auf der Kreuzung einer der Hauptstraßen hat sich ei… [+3005 chars],,de,'Explosion'
https://www.zeit.de/news/2023-04/21/potsdamer-rathauschef-reist-in-ukraine,https://www.zeit.de/news/2023-04/21/potsdamer-rathauschef-reist-in-ukraine,0,www.zeit.de,Städtepartnerschaft: Potsdamer Rathauschef reist in Ukraine,,,2023-04-21T04:22:34Z,,"When browsing with ads:
We collect personal data and also transmit it to third-party providers
 that help us improve and finance our digital content. Some of the information stored on your device, … [+732 chars]",,de,'Ukraine'
https://www.faz.net/aktuell/feuilleton/medien/maybrit-illner-in-der-tv-kritik-schafft-die-ukraine-die-wende-18836944.html,https://www.faz.net/aktuell/feuilleton/medien/maybrit-illner-in-der-tv-kritik-schafft-die-ukraine-die-wende-18836944.html,0,www.faz.net,„Maybrit Illner“ in der TV-Kritik: Schafft die Ukraine im Krieg die Wende?,"Maybrit Illner diskutiert mit ihren Gästen über die geplante Frühjahrsoffensive der Ukraine und die Bedeutung deutscher Munitionslieferungen. Auffällig dabei ist, was alles unbeantwortet bleibt oder Spekulationen auslöst.",https://media1.faz.net/ppmedia/aktuell/3752037111/1.8836943/facebook_teaser/wissen-so-manches-und-vermuten.jpg,2023-04-21T04:31:28Z,https://web.archive.org/web/20230421081508/https://www.faz.net/aktuell/feuilleton/medien/maybrit-illner-in-der-tv-kritik-schafft-die-ukraine-die-wende-18836944.html,"Es ist ein wenig, als beobachte man eloquente und zugleich spürbar unsichere Prüflinge beim mündlichen Examen. Dass der Stoff nicht hundertprozentig sitzt, wird man ihnen allerdings nicht vorwerfen k… [+3032 chars]",,de,'Putin'
