index,url,valid,domain,title,description,image,published,archive,content,quote,language,keyword
https://www.dw.com/de/friedenspreis-f%C3%BCr-menschenrechtler-aus-russland-und-israel/a-66684774,https://www.dw.com/de/friedenspreis-f%C3%BCr-menschenrechtler-aus-russland-und-israel/a-66684774,0,www.dw.com,Friedenspreis für Menschenrechtler aus Russland und Israel,Der Aachener Friedenspreis 2023 geht an ein Netzwerk russischer Aktivistinnen und an eine Gruppe von Menschenrechtlern in Israel und den besetzten Gebieten. Die DW stellt die Preisträger vor.,,2023-09-01T00:01:00Z,https://web.archive.org/web/20230901124748/https://www.dw.com/de/friedenspreis-f%C3%BCr-menschenrechtler-aus-russland-und-israel/a-66684774,Wenige Monate nach der Verleihung des Karlspreises an den ukrainischen Präsidenten Wolodymyr Selenskyj und das ukrainische Volk geht es in Aachen wieder um den russischen Angriffskrieg. Der Aachener … [+6881 chars],,de,'Ukraine'
https://www.zeit.de/news/2023-09/01/london-russland-schuetzt-krimbruecke-mit-unterwasserbarriere,https://www.zeit.de/news/2023-09/01/london-russland-schuetzt-krimbruecke-mit-unterwasserbarriere,0,www.zeit.de,Ukraine-Krieg: London: Russland schützt Krimbrücke mit Unterwasserbarriere,,,2023-09-01T08:25:49Z,,"When browsing with ads:
We collect personal data and also transmit it to third-party providers
 that help us improve and finance our digital content. Some of the information stored on your device, … [+821 chars]",,de,'Russland'
https://www.dw.com/de/ukraine-krieg-welche-waffen-kommen-aus-deutschland/a-63470186,https://www.dw.com/de/ukraine-krieg-welche-waffen-kommen-aus-deutschland/a-63470186,0,www.dw.com,Ukraine-Krieg: Welche Waffen kommen aus Deutschland?,Vom Kampfpanzer bis zur Flugabwehr: Berlin hat sich nach anfänglichem Zögern zu einem der wichtigsten Waffenlieferanten der Ukraine gemausert.,https://static.dw.com/image/62926319_6.jpg,2023-09-01T08:40:00Z,,"Lange zögerte Deutschland mit der Lieferung wichtiger Waffensysteme wie Kampfpanzer. Doch die schickt Deutschland jetzt ebenso wie anderes Kriegsgerät, das sich die Ukraine wünscht. Was fehlt, sind w… [+9684 chars]",,de,'Ukraine'
https://www.focus.de/experts/waffenexpertin-franke-ukraines-drohnenattacken-setzen-russland-zunehmend-unter-druck_id_203411400.html,https://www.focus.de/experts/waffenexpertin-franke-ukraines-drohnenattacken-setzen-russland-zunehmend-unter-druck_id_203411400.html,0,www.focus.de,"Ukrainekrieg - Expertin erklärt, was hinter Kiews neuer Drohnen-Stärke steckt","Die Ukraine greift Russland immer wieder mit Drohnen an, selbst in der russischen Hauptstadt werden Explosionen gemeldet. Verteidigungsexpertin Ulrike Franke erklärt, wie die Ukraine es geschafft hat, diese Fähigkeit aufzubauen.Von FOCUS-online-Expertin Ulrik…",https://p6.focus.de/img/fotos/id_203411661/drohnen-russland.png?im=Crop%3D%280%2C60%2C1920%2C960%29%3BResize%3D%281200%2C627%29&impolicy=perceptual&quality=mediumHigh&hash=4600341a0300d75e4e811fc5b6418a60c0eed198a860ee9a578f164779918a09,2023-09-01T08:45:27Z,,"Die Ukraine greift Russland immer wieder mit Drohnen an, selbst in der russischen Hauptstadt werden Explosionen gemeldet. Verteidigungsexpertin Ulrike Franke erklärt, wie die Ukraine es geschafft hat… [+5649 chars]",,de,'Ukraine'
https://www.focus.de/politik/ausland/beitrag-unseres-partnerportals-economist-einblicke-in-den-drohnenkrieg-der-ukraine-gegen-putin_id_203409743.html,https://www.focus.de/politik/ausland/beitrag-unseres-partnerportals-economist-einblicke-in-den-drohnenkrieg-der-ukraine-gegen-putin_id_203409743.html,0,www.focus.de,Beitrag unseres Partnerportals „Economist“ - Neue Angriffsfähigkeit der Ukraine: „Eine vor Monaten ausgebrachte Saat“,"Neue Drohnentypen sind im Inneren Russlands im Einsatz, das zeigt ein Angriff auf einen Militärstützpunkt vor wenigen Tagen. Ein Insider sagt, die neue Luftangriffsfähigkeit der Ukraine sei das Ergebnis einer „vor vielen Monaten ausgebrachten Saat“.",https://p6.focus.de/img/fotos/id_203307039/der-flughafen-pskow-wurde-zum-ziel-ukrainischer-drohnenangriffe..jpg?im=Crop%3D%280%2C384%2C2200%2C1098%29%3BResize%3D%281200%2C627%29&impolicy=perceptual&quality=mediumHigh&hash=d25ab4b297b536eed02b7685687c176af3880d95a82de91905f253206f34e128,2023-09-01T08:51:11Z,,"Neue Drohnentypen sind im Inneren Russlands im Einsatz, das zeigt ein Angriff auf einen Militärstützpunkt vor wenigen Tagen. Ein Insider sagt, die neue Luftangriffsfähigkeit der Ukraine sei das Ergeb… [+8938 chars]",,de,'Waffen'
https://www.zeit.de/news/2023-09/01/immer-mehr-cyberattacken-aus-russland-und-china,https://www.zeit.de/news/2023-09/01/immer-mehr-cyberattacken-aus-russland-und-china,0,www.zeit.de,Internet: Immer mehr Cyberattacken aus Russland und China,,,2023-09-01T11:38:30Z,https://web.archive.org/web/20230902111809/https://www.zeit.de/news/2023-09/01/immer-mehr-cyberattacken-aus-russland-und-china,"When browsing with ads:
We collect personal data and also transmit it to third-party providers
 that help us improve and finance our digital content. Some of the information stored on your device, … [+821 chars]",,de,'Russland'
https://de.catholicnewsagency.com/news/13956/bischof-overbeck-zu-ukraine-krieg-wir-sind-in-einem-systemkrieg-angekommen,https://de.catholicnewsagency.com/news/13956/bischof-overbeck-zu-ukraine-krieg-wir-sind-in-einem-systemkrieg-angekommen,0,de.catholicnewsagency.com,Bischof Overbeck zu Ukraine-Krieg: „Wir sind in einem Systemkrieg angekommen“,"Bischof Franz-Josef Overbeck von Essen hat am Mittwochabend mit Blick auf den Ukraine-Krieg erklärt: „Wir sind in einem Systemkrieg angekommen, einer neuen politischen, aber auch gesellschaftlich relevanten Realität, die geprägt ist von dem teuflischen Versuc…",https://de.catholicnewsagency.com/image/overbeck_1670847092.jpg?w=1150&jpg,2023-09-01T12:15:00Z,,"Von CNA Deutsch Nachrichtenredaktion
Münster - Freitag, 1. September 2023, 14:15 Uhr.
Bischof Franz-Josef Overbeck von Essen hat am Mittwochabend mit Blick auf den Ukraine-Krieg erklärt: Wir sind i… [+2000 chars]",,de,'Ukraine'
https://www.morgenpost.de/politik/ausland/article239339773/Russland-stellt-neue-Atomrakete-in-Dienst.html,https://www.morgenpost.de/politik/ausland/article239339773/Russland-stellt-neue-Atomrakete-in-Dienst.html,0,www.morgenpost.de,Waffen: Russland stellt neue Atomrakete in Dienst,Sie wiegt 208 Tonnen und hat eine Reichweite von 18.000 Kilometern: Die neue Interkontinentalrakete RS-28 Sarmat soll die Atomraketen aus Sowjetzeiten ersetzen.,https://img.morgenpost.de/img/ausland/crop239339771/0442603978-w820-cv16_9-q85/Wladimir-Putin.jpg,2023-09-01T12:43:47Z,,"Moskau. Russland hat nach offiziellen Angaben die neue leistungsstarke Interkontinentalrakete RS-28 Sarmat in Dienst gestellt. Das sagte der Leiter der russischen Raumfahrtbehörde Roskosmos, Juri Bor… [+1076 chars]",,de,'Waffen'
https://taz.de/Informelles-EU-Gipfel-in-Toledo/!5952917/,https://taz.de/Informelles-EU-Gipfel-in-Toledo/!5952917/,0,taz.de,Informelles EU-Gipfel in Toledo: Die 20-Milliarden-Euro-Frage,Die Verteidigungs- und Außenminister der EU wollen die Ukraine weiter unterstützen. Doch die Höhe der Hilfen ist umstritten.,https://taz.de/picture/6494540/948/Ukraines-Foreign-Minister-Dmytro-Kuleba-informal-meeting-EU-foreign-ministers-Toledo-Spain-1.jpeg,2023-09-01T12:57:00Z,,"Die Verteidigungs- und Außenminister der EU wollen die Ukraine weiter unterstützen. Doch die Höhe der Hilfen ist umstritten.
Auch der ukrainische Außenminister Kuleba war beim Treffen in Toledo mit … [+4252 chars]",,de,'Ukraine'
https://www.n-tv.de/politik/Kreml-stellt-atomwaffenfaehige-Sarmat-Rakete-in-Dienst-article24366525.html,https://www.n-tv.de/politik/Kreml-stellt-atomwaffenfaehige-Sarmat-Rakete-in-Dienst-article24366525.html,0,www.n-tv.de,Kann Ziele weltweit treffen: Kreml stellt atomwaffenfähige Sarmat-Rakete in Dienst,Im Frühjahr 2022 meldet Moskau den ersten erfolgreichen Test seiner Interkontinentalrakete Sarmat. Mit einer Reichweite von mehreren Tausend Kilometern kann die Rakete laut russischen Angaben jedes Ziel auf der Erde angreifen. Nun steht das Waffensystem angeb…,https://bilder1.n-tv.de/img/incoming/crop24366592/9741321239-cImg_16_9-w1200/imago0084578914h.jpg,2023-09-01T13:23:47Z,,Im Frühjahr 2022 meldet Moskau den ersten erfolgreichen Test seiner Interkontinentalrakete Sarmat. Mit einer Reichweite von mehreren Tausend Kilometern kann die Rakete laut russischen Angaben jedes Z… [+2110 chars],,de,'Waffen'
https://www.kino.de/serie/one-piece/news/netflix-one-piece-wie-hat-shanks-das-seeungeheuer-vertrieben-das-steckt-hinter-seiner-kraft/,https://www.kino.de/serie/one-piece/news/netflix-one-piece-wie-hat-shanks-das-seeungeheuer-vertrieben-das-steckt-hinter-seiner-kraft/,0,www.kino.de,Netflix' „One Piece“: Wie hat Shanks das Seeungeheuer vertrieben? Das steckt hinter seiner Kraft,"In einer „One Piece“-Rückblende bewies Shanks, dass mit ihm wahrlich nicht zu spaßen ist. Doch wie gelang es ihm, einen der gefürchteten Seekönige in die Flucht zu schlagen?",https://crops.giga.de/70/a3/e8/4ce2fff2af4f83ac5ed9d98edf_YyAzMTU5eDE3NzYrMzY4KzE3AnJlIDE5MjAgMTA4MAM3MzQyZmY4Y2Q5ZA==.jpg,2023-09-01T14:48:04Z,,"In einer „One Piece“-Rückblende bewies Shanks, dass mit ihm wahrlich nicht zu spaßen ist. Doch wie gelang es ihm, einen der gefürchteten Seekönige in die Flucht zu schlagen?
– Achtung: Es folgen Spo… [+4798 chars]",,de,'Waffen'
https://www.morgenpost.de/politik/article239342105/energiekrise-gas-winter-energiesparen-gasspeicher.html,https://www.morgenpost.de/politik/article239342105/energiekrise-gas-winter-energiesparen-gasspeicher.html,0,www.morgenpost.de,Kommentar: Putins Krieg: Die Energiekrise ist noch lange nicht vorbei,Deutschlands Gasversorgung ist sicherer als vor einem Jahr. Dennoch müssen Haushalte und Unternehmen weiter Energie sparen – auf Dauer. Ein Kommentar.,https://img.morgenpost.de/img/politik/crop239342099/1482605924-w820-cv16_9-q85/8808b28c-48d4-11ee-aae5-72207211cc45.jpg,2023-09-01T15:26:57Z,https://web.archive.org/web/20230903012306/https://www.morgenpost.de/politik/article239342105/energiekrise-gas-winter-energiesparen-gasspeicher.html,"Berlin.  Kann sich noch jemand an die Gasturbine erinnern? An jenes Riesending von der Ostsee-Pipeline Nord Stream 1, das zur Reparatur nach Kanada musste, dann in Deutschland lagerte und angeblich w… [+4037 chars]",,de,'Putin'
https://www.zeit.de/news/2023-09/01/bunker-und-wehrkunde-schulbeginn-in-ukraine-und-russland,https://www.zeit.de/news/2023-09/01/bunker-und-wehrkunde-schulbeginn-in-ukraine-und-russland,0,www.zeit.de,Russische Invasion: Bunker und Wehrkunde - Schulbeginn in Ukraine und Russland,,,2023-09-01T16:21:15Z,,"When browsing with ads:
We collect personal data and also transmit it to third-party providers
 that help us improve and finance our digital content. Some of the information stored on your device, … [+821 chars]",,de,'Ukraine'
https://taz.de/Haushaltsverhandlungen-der-Regierung/!5954770/,https://taz.de/Haushaltsverhandlungen-der-Regierung/!5954770/,0,taz.de,Haushaltsverhandlungen der Regierung: Sparen an der Demokratie,"Die AfD ist stark, und die Ampel will sparen – ausgerechnet dort, wo es um den Zusammenhalt in der Demokratie geht. Drei Beispiele.",https://taz.de/picture/6495230/948/21644699-1.jpeg,2023-09-02T10:14:00Z,,"Die AfD ist stark, und die Ampel will sparen ausgerechnet dort, wo es um den Zusammenhalt in der Demokratie geht. Drei Beispiele.
Einige Abgeordnete waren bestimmt auch auf einer der Unteilbar-Demos… [+6840 chars]",,de,'Sparen'
https://noe.orf.at/stories/3222417/,https://noe.orf.at/stories/3222417/,0,noe.orf.at,„Frühe Hilfen“ werden landesweit ausgerollt,"Das Projekt „Frühe Hilfen“ wird auf ganz Niederösterreich ausgeweitet. Das Angebot richtet sich an frischgebackene Eltern in schwierigen Lebenssituationen wie Armut, Überforderung oder mit psychischen Problemen.  24 Familienbegleiterinnen und -begleiter sind …",https://ibs.orf.at/noe?image=https%3A%2F%2Foekastatic.orf.at%2Fmims%2F2023%2F35%2F19%2Fcrops%2Fw%3D1200%2Ch%3D627%2Cq%3D75%2F1923905_master_722419_abd0014.jpg%3Fs%3D3af6b62696903f958cb4ec542b736254939e7631,2023-09-03T04:11:09Z,,"Bei der Frühen Hilfe sollen Schwangere und Eltern von Kleinkindern Unterstützung bekommen, wenn sie alleine nicht mehr zurecht kommen. Dafür kommen Familienbegleiterinnen und -begleiter direkt zu den… [+1859 chars]",,de,'Armut'
https://www.basicthinking.de/blog/2023/09/04/5-tipps-um-im-september-2023-geld-zu-sparen-2/,https://www.basicthinking.de/blog/2023/09/04/5-tipps-um-im-september-2023-geld-zu-sparen-2/,0,www.basicthinking.de,"5 Tipps, um im September 2023 Geld zu sparen","Die Energiepreise schwanken nach wie vor, haben sich jedoch zuletzt stabilisiert. Die Inflation sorgt allerdings bei vielen Produkten und Lebensmitteln für ungewohnt hohe Preise. Das Thema Sparen spielt deshalb immer noch eine große Rolle. Wir haben fünf Tipp…",https://www.basicthinking.de/blog/wp-content/uploads/2023/08/geld-sparen-september.jpeg,2023-09-04T08:15:39Z,,"Die Energiepreise schwanken nach wie vor, haben sich jedoch zuletzt stabilisiert. Die Inflation sorgt allerdings bei vielen Produkten und Lebensmitteln für ungewohnt hohe Preise. Das Thema Sparen spi… [+3194 chars]",,de,'Inflation'
https://www.stern.de/news/erdogan-spricht-sich-in-sotschi-gegen-alternativen-zu-getreideabkommen-aus-33794424.html,https://www.stern.de/news/erdogan-spricht-sich-in-sotschi-gegen-alternativen-zu-getreideabkommen-aus-33794424.html,0,www.stern.de,Erdogan spricht sich in Sotschi gegen Alternativen zu Getreideabkommen aus,"Der türkische Präsident Recep Tayyip Erdogan hat sich nach einem Treffen mit dem russischen Staatschef Wladimir Putin gegen Alternativen zum Abkommen über ukrainische Getreideexporte ausgesprochen. Die alternativen Vorschläge ""können kein nachhaltiges, sicher…",https://image.stern.de/33795266/t/GB/v1/w1440/r1.7778/-/04--putin-und-erdogan-auf-dem-weg-zur-pressekonferenz---cb2420d3e74a8022.jpg,2023-09-04T16:10:48Z,,Der türkische Präsident Recep Tayyip Erdogan hat sich nach einem Treffen mit dem russischen Staatschef Wladimir Putin gegen Alternativen zum Abkommen über ukrainische Getreideexporte ausgesprochen. D… [+3508 chars],,de,'Putin'
https://www.faz.net/aktuell/politik/ausland/putin-und-erdo-an-in-sotschi-kein-neues-getreideabkommen-19150743.html,https://www.faz.net/aktuell/politik/ausland/putin-und-erdo-an-in-sotschi-kein-neues-getreideabkommen-19150743.html,0,www.faz.net,Treffen in Sotschi: Kein neues Getreideabkommen vereinbart,Der türkische Präsident reist erstmals seit August 2022 wieder zu Putin nach Sotschi – und kommt dem Gastgeber in einem wichtigen Punkt entgegen.,https://media0.faz.net/ppmedia/aktuell/politik/3065332775/1.9150730/facebook_teaser/auf-versoehnungskurs-wladimir.jpg,2023-09-04T16:18:46Z,https://web.archive.org/web/20230904204508/https://www.faz.net/aktuell/politik/ausland/putin-und-erdo-an-in-sotschi-kein-neues-getreideabkommen-19150743.html,"Russlands Staatsfernsehen scheint die Bilder aus Sotschi am Schwarzen Meer zu schätzen. Sie zeigen, wie Präsident Wladimir Putin ranghohe Gäste begrüßt, mit Sonne und Palmen. Am Montag kam wieder ein… [+4521 chars]",,de,'Russland'
https://www.faz.net/aktuell/politik/ukraine-liveticker-ukraine-meldet-erfolgreiche-vorstoesse-im-raum-bachmut-faz-19030454.html,https://www.faz.net/aktuell/politik/ukraine-liveticker-ukraine-meldet-erfolgreiche-vorstoesse-im-raum-bachmut-faz-19030454.html,0,www.faz.net,Ukraine-Liveblog: Ukraine meldet erfolgreiche Vorstöße im Raum Bachmut,Putin: Kein Getreideabkommen ohne Erfüllung russischer Forderungen +++ Russland setzt den Cyberkrieg fort +++ Erdogan zu Gesprächen mit Putin in Sotschi +++ alle Entwicklungen im Liveblog,https://media1.faz.net/ppmedia/aktuell/politik/1163940504/1.9151091/facebook_teaser/ukrainische-soldaten-fahren-am.jpg,2023-09-04T16:23:08Z,https://web.archive.org/web/20230904203053/https://www.faz.net/aktuell/politik/ukraine-liveticker-ukraine-meldet-erfolgreiche-vorstoesse-im-raum-bachmut-faz-19030454.html,"Es sah nach einem großen Schlag aus, als die Ermittler im vergangenen September vor dem luxuriösen Anwesen am Tegernsee aufmarschierten. In einer großangelegten Aktion durchsuchten Beamte von Bundes-… [+1219 chars]",,de,'Russland'
https://www.n-tv.de/politik/Tausende-russische-Veteranen-schreiben-sich-an-Unis-ein-article24371470.html,https://www.n-tv.de/politik/Tausende-russische-Veteranen-schreiben-sich-an-Unis-ein-article24371470.html,0,www.n-tv.de,Privilegien für Kriegsteilnehmer: Tausende russische Veteranen schreiben sich an Unis ein,Auch an den russischen Universitäten beginnt zum Herbst das neue akademische Jahr. Der Start an den Hochschulen Russlands wird vor allem Kriegsteilnehmern und deren Kindern erleichtert. Tausende Soldaten machen von diesen und anderen Privilegien Gebrauch.,https://bilder1.n-tv.de/img/incoming/crop24371612/6771325938-cImg_16_9-w1200/imago0302518634h.jpg,2023-09-04T16:24:05Z,https://web.archive.org/web/20230905022352/https://www.n-tv.de/politik/Tausende-russische-Veteranen-schreiben-sich-an-Unis-ein-article24371470.html,Auch an den russischen Universitäten beginnt zum Herbst das neue akademische Jahr. Der Start an den Hochschulen Russlands wird vor allem Kriegsteilnehmern und deren Kindern erleichtert. Tausende Sold… [+1445 chars],,de,'Russland'
https://orf.at/stories/3329934/,https://orf.at/stories/3329934/,0,orf.at,Neue Vorwürfe von Putin gegen Ukraine,,https://orf.at/mojo/1_4_1/storyserver//news/common/images/og-fallback-news.png,2023-09-04T16:25:29Z,https://web.archive.org/web/20230905023422/https://orf.at/stories/3329934/,"Der russische Präsident Wladimir Putin hat der Ukraine versuchte Anschläge auf Gasleitungen vorgeworfen, die durch das Schwarze Meer in die Türkei verlaufen. Es werden Versuche unternommen, die Leitu… [+751 chars]",,de,'Russland'
https://www.tagesspiegel.de/internationales/ukraine-invasion-tag-558-die-vielleicht-wichtigsten-zehn-kilometer-der-front-10416859.html,https://www.tagesspiegel.de/internationales/ukraine-invasion-tag-558-die-vielleicht-wichtigsten-zehn-kilometer-der-front-10416859.html,0,www.tagesspiegel.de,Ukraine-Invasion Tag 558: Die vielleicht wichtigsten zehn Kilometer der Front,"Ukrainer kämpfen um den Durchbruch im Süden, Erdogan trifft Putin, Kritik an Scholz wegen Taurus-Verzögerung. Der Überblick am Abend.",https://www.tagesspiegel.de/images/a-ukrainian-serviceman-walks-near-a-destroyed-ukrainian-tank-near-the-village-of-robotyne/alternates/BASE_16_9_W1400/a-ukrainian-serviceman-walks-near-a-destroyed-ukrainian-tank-near-the-village-of-robotyne.jpeg,2023-09-04T16:36:30Z,https://web.archive.org/web/20230904183423/https://www.tagesspiegel.de/internationales/ukraine-invasion-tag-558-die-vielleicht-wichtigsten-zehn-kilometer-der-front-10416859.html,Die ukrainische Offensive im Süden nimmt an Fahrt auf. Kleine Infanterieeinheiten von bis zu 10 Soldaten greifen die russischen Stellungen in den Schützengräben zwischen den Dörfern Werbowe und Nowop… [+9294 chars],,de,'Putin'
https://www.faz.net/aktuell/politik/ausland/ukraine-wer-ist-verteidigungsminister-umerow-19150729.html,https://www.faz.net/aktuell/politik/ausland/ukraine-wer-ist-verteidigungsminister-umerow-19150729.html,0,www.faz.net,Neuer Verteidigungsminister in der Ukraine,Ein Finanzfachmann übernimmt das kriegswichtige Amt des Verteidigungsministers in der Ukraine. Der Neue ist Krimtatar und war schon an Verhandlungen über Gefangenenaustausche mit Russland beteiligt.,https://media0.faz.net/ppmedia/aktuell/2996986637/1.9150334/facebook_teaser/rustem-umerow.jpg,2023-09-04T16:55:50Z,https://web.archive.org/web/20230904202029/https://www.faz.net/aktuell/politik/ausland/ukraine-wer-ist-verteidigungsminister-umerow-19150729.html,"Als der ukrainische Präsident Wolodymyr Selenskyj am Sonntagabend den lange erwarteten Wechsel an der Spitze des Verteidigungsministeriums ankündigte, gab er sich sicher, dass das Parlament für seine… [+2372 chars]",,de,'Russland'
https://www.n-tv.de/politik/Es-koennte-jetzt-zu-einem-Dominoeffekt-kommen-article24370402.html,https://www.n-tv.de/politik/Es-koennte-jetzt-zu-einem-Dominoeffekt-kommen-article24370402.html,0,www.n-tv.de,"Reisners Blick auf die Front: ""Es könnte jetzt zu einem Dominoeffekt kommen""","Die Ukraine durchbricht nach eigener Aussage bei Robotyne die erste russische Verteidigungslinie. Warum man trotzdem nicht von einem ""operativen Durchbruch"" sprechen kann, erklärt Markus Reisner. Jetzt komme es darauf an, wie stark die weiteren Verteidigungsl…",https://bilder4.n-tv.de/img/incoming/crop24371639/4101322430-cImg_16_9-w1200/424088113.jpg,2023-09-04T17:02:23Z,https://web.archive.org/web/20230905022338/https://www.n-tv.de/politik/Es-koennte-jetzt-zu-einem-Dominoeffekt-kommen-article24370402.html,"Die Ukraine durchbricht nach eigener Aussage bei Robotyne die erste Verteidigungslinie. Trotzdem könne man noch nicht von einem ""operativen Durchbruch"" sprechen, sagt Oberst Markus Reisner im wöchent… [+9899 chars]",,de,'Ukraine'
https://www.n-tv.de/politik/Russland-sagt-Grossmanoever-Sapad-23-ab-article24371749.html,https://www.n-tv.de/politik/Russland-sagt-Grossmanoever-Sapad-23-ab-article24371749.html,0,www.n-tv.de,"Dafür ""Übungen in der Ukraine"": Russland sagt Großmanöver ""Sapad 23"" ab","Wenige Monate vor der großangelegten Invasion in die Ukraine üben die Streitkräfte von Russland und Belarus noch unter Gefechtsbedingungen. In diesem Jahr fällt das geplante ""Sapad""-Manöver aus. Russlands Verteidigungsminister verkündet stattdessen ""Übungen i…",https://bilder3.n-tv.de/img/incoming/crop24371774/6291321229-cImg_16_9-w1200/imago0134599935h.jpg,2023-09-04T17:07:01Z,https://web.archive.org/web/20230905021859/https://www.n-tv.de/politik/Russland-sagt-Grossmanoever-Sapad-23-ab-article24371749.html,"Wenige Monate vor der großangelegten Invasion in die Ukraine üben die Streitkräfte von Russland und Belarus noch unter Gefechtsbedingungen. In diesem Jahr fällt das geplante ""Sapad""-Manöver aus. Russ… [+1802 chars]",,de,'Russland'
https://www.morgenpost.de/politik/article239369355/russland-tuerkei-putin-erdogan-getreideabkommen-zynisches-speil.html,https://www.morgenpost.de/politik/article239369355/russland-tuerkei-putin-erdogan-getreideabkommen-zynisches-speil.html,0,www.morgenpost.de,Getreideabkommen: Nur Russland profitiert: Putin spielt ein zynisches Spiel,Der russische Präsident Wladimir Putin lässt erst ukrainische Getreide-Silos bombardieren und verhandelt dann zum Schein mit Präsident Recep Tayyip Erdogan. Nicht nur die Ukraine leidet.,https://img.morgenpost.de/img/politik/crop239369349/453260477-w820-cv16_9-q85/52ede8fe-4b3d-11ee-b215-9a57d0cb401e.jpg,2023-09-04T17:27:40Z,https://web.archive.org/web/20230905023859/https://www.morgenpost.de/politik/article239369355/russland-tuerkei-putin-erdogan-getreideabkommen-zynisches-speil.html,"Berlin. Wenn brutaler Zynismus eine Disziplin bei Olympischen Spielen der internationalen Politik wäre, hätte der russische Präsident Wladimir Putin die Goldmedaille sicher. Erst lässt Putin die Getr… [+1819 chars]",,de,'Putin'
https://www.jungewelt.de/artikel/458336.ukraine-krieg-sanktionen-müssen-fallen.html,https://www.jungewelt.de/artikel/458336.ukraine-krieg-sanktionen-müssen-fallen.html,0,www.jungewelt.de,Ukraine-Krieg: Sanktionen müssen fallen,"Erdoğan und Putin in Sotschi: Russland pocht auf Vorbedingungen, um Getreideabkommen wieder aufzunehmen. Türkei glaubt an baldige Lösung.",https://www.jungewelt.de/img/1100/185039.jpg,2023-09-04T17:37:18Z,https://web.archive.org/web/20230905023357/https://www.jungewelt.de/artikel/458336.ukraine-krieg-sanktionen-m%C3%BCssen-fallen.html,"Konstruktiv und geschäftsmäßig, so bezeichnete der russische Präsident Wladimir Putin am Montag die Gespräche mit seinem türkischen Amtskollegen Recep Tayyip Erdoan in Sotschi. Auf Initiative der Tür… [+3142 chars]",,de,'Russland'
https://www.jungewelt.de/artikel/458347.haushaltsdebatte-im-bundestag-sozialabbau-und-aufrüstung.html,https://www.jungewelt.de/artikel/458347.haushaltsdebatte-im-bundestag-sozialabbau-und-aufrüstung.html,0,www.jungewelt.de,Haushaltsdebatte im Bundestag: Sozialabbau und Aufrüstung,Die Ampel legt den größten Militärhaushalt seit 1945 auf. Zehn Thesen zum Niedergang in Deutschland und zu einer drohenden direkten Beteiligung am Ukraine-Krieg.,https://www.jungewelt.de/img/1100/185027.jpg,2023-09-04T17:37:18Z,https://web.archive.org/web/20230905020226/https://www.jungewelt.de/artikel/458347.haushaltsdebatte-im-bundestag-sozialabbau-und-aufr%C3%BCstung.html,"Unter dem Motto »Den Frieden und die Zukunft gewinnen, nicht den Krieg« hat das Kölner Friedensforum am 1. September zu einer Diskussionsveranstaltung eingeladen. Anlass war der Weltfriedenstag. Die … [+10357 chars]",,de,'Russland'
