index,url,valid,domain,title,description,image,published,archive,content,quote,language,keyword
https://www.zeit.de/news/2023-02/13/inflation-und-tarife-staedte-und-gemeinden-fordern-mehr-geld,https://www.zeit.de/news/2023-02/13/inflation-und-tarife-staedte-und-gemeinden-fordern-mehr-geld,0,www.zeit.de,Finanzausgleich: Inflation und Tarife: Städte und Gemeinden fordern mehr Geld,,,2023-02-13T09:34:34Z,https://web.archive.org/web/20230213095135/https://www.zeit.de/news/2023-02/13/inflation-und-tarife-staedte-und-gemeinden-fordern-mehr-geld,"When browsing with ads:
We collect personal data and also transmit it to third-party providers
 that help us improve and finance our digital content. Some of the information stored on your device, … [+732 chars]",,de,'Inflation'
https://www.welt.de/regionales/hamburg/article243742691/Offener-Brief-Es-wird-unterstellt-dass-die-Ukrainer-Kriegstreiber-sind.html,https://www.welt.de/regionales/hamburg/article243742691/Offener-Brief-Es-wird-unterstellt-dass-die-Ukrainer-Kriegstreiber-sind.html,0,www.welt.de,"„Es wird unterstellt, dass die Ukrainer Kriegstreiber sind“","Kurz bevor sich der Überfall Russlands auf die Ukraine zum ersten Mal jährt, meldet sich Wladimir Klitschko mit berührenden Worten an die deutsche Öffentlichkeit. Dabei geht der Hamburger Boxweltmeister und Bruder des Kiewer Bürgermeisters Vitali Klitschko au…",https://img.welt.de/img/regionales/hamburg/mobile241721573/4841359257-ci16x9-w1200/Medientage-2022.jpg,2023-02-13T10:14:58Z,,In seinem heute veröffentlichten Brief aus Kyiv wendet sich Wladimir Klitschko mit emotionalen Worten an die Deutschen und gedenkt zu Beginn zunächst der vielen Erdbeben-Opfer in der Türkei und Syrie… [+5325 chars],,de,'Waffen'
https://www.welt.de/politik/ausland/article243739905/Ukraine-News-Russen-stossen-bei-Bachmut-vor-und-bauen-Verteidigung-im-Sueden-aus.html,https://www.welt.de/politik/ausland/article243739905/Ukraine-News-Russen-stossen-bei-Bachmut-vor-und-bauen-Verteidigung-im-Sueden-aus.html,0,www.welt.de,Russen stoßen bei Bachmut vor und bauen Verteidigung im Süden aus,Seit Monaten versuchen russische Truppen die Stadt Bachmut im Osten der Ukraine einzunehmen. Nun decken die Streitkräfte die Gegend mit heftigen Artillerie-Angriffen und Sturmattacken ein. Bereits am Vortag seien Siedlungen in der Umgebung beschossen worden. …,https://img.welt.de/img/politik/ausland/mobile243749091/1081359687-ci16x9-w1200/Ukraine-Krieg-Bachmut.jpg,2023-02-13T10:58:00Z,http://archive.md/20230213154659/https://www.welt.de/politik/ausland/article243739905/Ukraine-News-Russen-stossen-bei-Bachmut-vor-und-bauen-Verteidigung-im-Sueden-aus.html,"Im Norden der seit Monaten umkämpften ukrainischen Stadt Bachmut toben heftige Gefechte. Die Lage im Vorort Paraskowijwka sei schwierig, teilte das ukrainische Präsidialbüro am Montag mit. Paraskowij… [+21921 chars]",,de,'Ukraine'
https://www.welt.de/geschichte/article243710973/Nach-dem-Kalten-Krieg-Als-die-USA-auf-ein-russisches-Wunder-setzten.html,https://www.welt.de/geschichte/article243710973/Nach-dem-Kalten-Krieg-Als-die-USA-auf-ein-russisches-Wunder-setzten.html,0,www.welt.de,Als die USA noch auf ein „russisches Wunder“ setzten,"Oft wird kolportiert, die USA seien Russland nach dem Zerfall der Sowjetunion arrogant und desinteressiert gegenübergetreten – das habe gar den Grundstein für die Aggression des Kremls gelegt. Jetzt freigegebene Dokumente aus den 1990ern zeichnen ein ganz and…",https://img.welt.de/img/geschichte/mobile243743865/1811357387-ci16x9-w1200/Gipfeltreffen-Boris-Jelzin-und-Bill-Clinton.jpg,2023-02-13T11:21:41Z,,"Seit Beginn des russischen Angriffskriegs gegen die Ukraine verbreiten manche Kommentatoren wieder einmal die Ansicht, der Westen trage eine Art historische Mitschuld am aggressiven Kurs des Kremls. … [+7473 chars]",,de,'Russland'
https://www.handelsblatt.com/politik/international/liveblog-zum-ukraine-krieg-bundeswehr-beginnt-mit-ausbildung-ukrainischer-soldaten-an-leopard-2-panzern/27982126.html,https://www.handelsblatt.com/politik/international/liveblog-zum-ukraine-krieg-bundeswehr-beginnt-mit-ausbildung-ukrainischer-soldaten-an-leopard-2-panzern/27982126.html,0,www.handelsblatt.com,+++ Ukraine-Krieg +++: Bundeswehr beginnt mit Ausbildung ukrainischer Soldaten an Leopard-2-Panzern,London: Russland baut Verteidigung in Ukraine weiter aus +++ USA rufen ihre Bürger zur Ausreise aus Russland auf +++ Selenski fordert Sanktionen gegen Russlands Atomindustrie +++ Der Newsblog.,https://www.handelsblatt.com/images/leopard-2/28979086/2-format2003.jpg,2023-02-13T11:45:00Z,,"<li>Herr Andreas Felsch13.02.2023, 10:12 Uhr
Möglicherweise hat RU die Unruhen im Donbas nicht geschürt, um imperialen Bestrebungen nachzugehen oder die UA zu spalten (was sicher keine unerwünschten… [+9332 chars]",,de,'Russland'
https://www.wiwo.de/politik/konjunktur/konjunktur-aussichten-fuer-wirtschaft-in-der-eu-hellen-sich-auf-/28979192.html,https://www.wiwo.de/politik/konjunktur/konjunktur-aussichten-fuer-wirtschaft-in-der-eu-hellen-sich-auf-/28979192.html,0,www.wiwo.de,Konjunktur: Aussichten für Wirtschaft in der EU hellen sich auf,"Die Folgen des russischen Angriffskriegs gegen die Ukraine haben die Wirtschaft in der EU stark belastet. Doch so düster wie es zwischenzeitlich aussah, kommt es wohl nicht.",https://www.wiwo.de/images/wirtschaft-in-der-eu/28979190/1-format11240.jpg,2023-02-13T13:17:08Z,https://web.archive.org/web/20230213135339/https://www.wiwo.de/politik/konjunktur/konjunktur-aussichten-fuer-wirtschaft-in-der-eu-hellen-sich-auf-/28979192.html,"Die Wirtschaft in der EU wird sich in diesem Jahr nach einer Prognose der EU-Kommission stabiler entwickeln als zunächst erwartet. Die Brüsseler Behörde geht für die EU nun von einem Wachstum von 0,8… [+3622 chars]",,de,'Gasspeicher'
https://www.basicthinking.de/blog/2023/02/13/chatgpt-plus-kosten-deutschlandstart/,https://www.basicthinking.de/blog/2023/02/13/chatgpt-plus-kosten-deutschlandstart/,0,www.basicthinking.de,ChatGPT Plus Kosten: Alle Infos zum Deutschlandstart im Überblick,"ChatGPT Plus ist ab sofort auch in Deutschland verfügbar. Das Bezahlabo der KI-Software von OpenAI verspricht schnellere Antwortzeiten, einen stabileren Zugang und zusätzliche Funktionen. Die Kosten für ChatGPT Plus liegen hierzulande derweil bei rund 23 Euro…",https://www.basicthinking.de/blog/wp-content/uploads/2023/02/chatgpt-plus-kosten-deutschland.jpg,2023-02-13T14:00:55Z,,"ChatGPT Plus ist ab sofort auch in Deutschland verfügbar. Das Bezahlabo der KI-Software von OpenAI verspricht schnellere Antwortzeiten, einen stabileren Zugang und zusätzliche Funktionen. Die Kosten … [+2897 chars]",,de,'Kosten'
https://www.tagesspiegel.de/internationales/manifest-fur-den-krieg-russland-besiegen-wie-soll-das-gehen-9342437.html,https://www.tagesspiegel.de/internationales/manifest-fur-den-krieg-russland-besiegen-wie-soll-das-gehen-9342437.html,0,www.tagesspiegel.de,Manifest für den Krieg: Russland besiegen - wie soll das gehen?,"Es ist leicht, das „Manifest für Frieden“ von Alice Schwarzer und Sahra Wagenknecht als naiv und zynisch zu kritisieren. Was aber fehlt, ist eine Alternative, in der Wort und Tat übereinstimmen",https://www.tagesspiegel.de/politik/images/alice-schwarzer-und-sahra-wagenknecht/alternates/BASE_16_9_W1400/alice-schwarzer-und-sahra-wagenknecht.jpeg,2023-02-13T14:41:26Z,,"Manchmal tobt jemand gegen andere, um die eigene Ratlosigkeit nicht zu spüren. Die Linken-Politikerin Sahra Wagenknecht und die Frauenrechtlerin Alice Schwarzer haben am Wochenende ein Manifest für F… [+6425 chars]",,de,'Kosten'
https://www.tagesspiegel.de/internationales/nach-kritik-am-manifest-fur-frieden-russland-besiegen-wie-soll-das-gehen-9342437.html,https://www.tagesspiegel.de/internationales/nach-kritik-am-manifest-fur-frieden-russland-besiegen-wie-soll-das-gehen-9342437.html,0,www.tagesspiegel.de,Nach Kritik am „Manifest für Frieden“: Russland besiegen – wie soll das gehen?,"Es ist leicht, die Petition von Alice Schwarzer und Sahra Wagenknecht als naiv und zynisch zu kritisieren. Was aber fehlt, ist eine Alternative, in der Wort und Tat übereinstimmen.",https://www.tagesspiegel.de/politik/images/alice-schwarzer-und-sahra-wagenknecht/alternates/BASE_16_9_W1400/alice-schwarzer-und-sahra-wagenknecht.jpeg,2023-02-13T14:41:26Z,,"Manchmal tobt jemand gegen andere, um die eigene Ratlosigkeit nicht zu spüren. Die Linken-Politikerin Sahra Wagenknecht und die Frauenrechtlerin Alice Schwarzer haben am Wochenende ein Manifest für F… [+6398 chars]",,de,'Russland'
https://taz.de/Taliban-verbieten-Verhuetungsmittel/!5912377/,https://taz.de/Taliban-verbieten-Verhuetungsmittel/!5912377/,0,taz.de,Taliban verbieten Verhütungsmittel: Frauen und Kinder zuletzt,"In Teilen Afghanistans verbieten die Taliban Verhütungsmittel. Angesichts von Hunger, Armut und Entrechtung kann das für Frauen den Tod bedeuten.",https://taz.de/picture/6091287/948/321397101-1.jpeg,2023-02-13T15:12:00Z,,"In Teilen Afghanistans verbieten die Taliban Verhütungsmittel. Angesichts von Hunger, Armut und Entrechtung kann das für Frauen den Tod bedeuten.
Noch gibt es weibliche Berufstätigkeit in Afghanista… [+2564 chars]",,de,'Armut'
https://www.tagesschau.de/wirtschaft/weltwirtschaft/frankreich-deutschland-wasserstoff-aus-atomkraft-101.html,https://www.tagesschau.de/wirtschaft/weltwirtschaft/frankreich-deutschland-wasserstoff-aus-atomkraft-101.html,0,www.tagesschau.de,Ist aus Atomstrom hergestellter Wasserstoff nachhaltig?,"Frankreich fordert, mit Atomstrom erzeugten Wasserstoff als ""grün"" einzustufen. Auch die EU-Kommission befürwortet das - unter bestimmen Bedingungen. Deutschland ist dagegen. Droht neuer Streit über die Zukunft Erneuerbarer Energien? <em>Von Emal Atif.</em>",https://www.tagesschau.de/multimedia/bilder/akw-frankreich-103~_v-original.jpg,2023-02-13T15:19:59Z,,"Frankreich fordert, mit Atomstrom erzeugten Wasserstoff als ""grün"" einzustufen. Auch die EU-Kommission befürwortet das - unter bestimmen Bedingungen. Deutschland ist dagegen. Droht neuer Streit über … [+5526 chars]",,de,'Atomenergie'
https://www.nzz.ch/wirtschaft/pensionskassen-reform-die-wirtschaft-will-nicht-als-totengraeberin-dastehen-gewerbeverband-schluckt-die-juengste-reformvariante-ld.1725800,https://www.nzz.ch/wirtschaft/pensionskassen-reform-die-wirtschaft-will-nicht-als-totengraeberin-dastehen-gewerbeverband-schluckt-die-juengste-reformvariante-ld.1725800,0,www.nzz.ch,Pensionskassen-Reform: Die Wirtschaft will nicht als Totengräberin dastehen – der Gewerbeverband schluckt die jüngste Reformvariante,Im Parlament bahnt sich nun doch eine Mehrheit für den Ausbau der beruflichen Vorsorge an. Der bisher sehr kritische Gewerbeverband bezeichnet den jüngsten Vorschlag aus der zuständigen Parlamentskommission trotz hoher Kosten als «verkraftbar». Der Arbeitgebe…,"https://img.nzz.ch/2022/06/20/3a10cf21-4980-41ba-923f-6e6f571995f3.jpeg?width=1200&height=675&fit=bound&quality=75&auto=webp&crop=5950,3347,x0,y382&wmark=nzz",2023-02-13T15:27:03Z,,"Der Nationalrat debattiert in der kommenden Frühlingssession über die Altersvorsorge.
In der März-Session des Bundesparlaments dürfte sich entscheiden, ob die mühselige Debatte zur Rentenreform in e… [+7281 chars]",,de,'Kosten'
https://www.zeit.de/news/2023-02/13/mhh-prueft-moeglichen-verstoss-gegen-russland-vorgaben,https://www.zeit.de/news/2023-02/13/mhh-prueft-moeglichen-verstoss-gegen-russland-vorgaben,0,www.zeit.de,Wissenschaft: MHH prüft möglichen Verstoß gegen Russland-Vorgaben,,,2023-02-13T16:24:30Z,,"When browsing with ads:
We collect personal data and also transmit it to third-party providers
 that help us improve and finance our digital content. Some of the information stored on your device, … [+732 chars]",,de,'Russland'
https://www.zeit.de/news/2023-02/13/maenner-nutzen-bei-videodreh-verbotene-waffen-als-requisiten,https://www.zeit.de/news/2023-02/13/maenner-nutzen-bei-videodreh-verbotene-waffen-als-requisiten,0,www.zeit.de,Schwäbisch Gmünd: Männer nutzen bei Videodreh verbotene Waffen als Requisiten,,,2023-02-13T16:27:53Z,https://web.archive.org/web/20230213205443/https://www.zeit.de/news/2023-02/13/maenner-nutzen-bei-videodreh-verbotene-waffen-als-requisiten,"When browsing with ads:
We collect personal data and also transmit it to third-party providers
 that help us improve and finance our digital content. Some of the information stored on your device, … [+732 chars]",,de,'Waffen'
https://www.faz.net/aktuell/politik/ausland/nato-stoltenberg-fordert-mehr-tempo-bei-waffen-fuer-die-ukraine-18676124.html,https://www.faz.net/aktuell/politik/ausland/nato-stoltenberg-fordert-mehr-tempo-bei-waffen-fuer-die-ukraine-18676124.html,0,www.faz.net,NATO-Generalsekretär Stoltenberg: „Wir sind in einem Logistikrennen“,"NATO-Generalsekretär Jens Stoltenberg fordert mehr Tempo bei der Lieferung von Waffen an Kiew. Sie müssten in der Ukraine eintreffen, bevor Russland die Initiative auf dem Schlachtfeld ergreifen könne.",https://media1.faz.net/ppmedia/aktuell/politik/117512784/1.8676257/facebook_teaser/jens-stoltenberg-am-13-februar.jpg,2023-02-13T17:56:38Z,https://web.archive.org/web/20230213202034/https://www.faz.net/aktuell/politik/ausland/nato-stoltenberg-fordert-mehr-tempo-bei-waffen-fuer-die-ukraine-18676124.html,"Vor fast einem Jahr trat NATO-Generalsekretär Jens Stoltenberg auf die Bremse. Die Ukraine hatte die Allianz aufge­fordert, eine Flugverbotszone über dem Land durchzusetzen; der russische Überfall ha… [+5328 chars]",,de,'Waffen'
https://www.welt.de/politik/ausland/article243739905/Ukraine-News-Stoltenberg-schliesst-Kampfjet-Lieferung-an-Ukraine-nicht-aus.html,https://www.welt.de/politik/ausland/article243739905/Ukraine-News-Stoltenberg-schliesst-Kampfjet-Lieferung-an-Ukraine-nicht-aus.html,0,www.welt.de,Stoltenberg schließt Kampfjet-Lieferung an Ukraine nicht aus,"Eine Kampfjet-Lieferung an die Ukraine lehnt Nato-Generalsekretär Stoltenberg nicht grundsätzlich ab. „Das wird uns nicht zur Konfliktpartei machen“, sagte er. Derweil kam es in der Gegend von Bachmut erneut zu heftigen Artillerie-Angriffen und Sturmattacken.…",https://img.welt.de/img/politik/ausland/mobile243756225/7291356437-ci16x9-w1200/BELGIUM-NATO-DEFENCE.jpg,2023-02-13T17:58:00Z,https://web.archive.org/web/20230213181210/https://www.welt.de/politik/ausland/article243739905/Ukraine-News-Stoltenberg-schliesst-Kampfjet-Lieferung-an-Ukraine-nicht-aus.html,"Nato-Generalsekretär Jens Stoltenberg schließt die Lieferung von Kampfjets für die Ukraine nicht aus. Die Unterstützung für die Ukraine hat sich ebenso entwickelt wie der Krieg selbst, sagte Stoltenb… [+27180 chars]",,de,'Ukraine'
https://www.zeit.de/news/2023-02/13/trotz-problemen-russland-haelt-an-eigener-raumstation-fest,https://www.zeit.de/news/2023-02/13/trotz-problemen-russland-haelt-an-eigener-raumstation-fest,0,www.zeit.de,Weltall: Trotz Problemen: Russland hält an eigener Raumstation fest,,,2023-02-13T18:44:58Z,,"When browsing with ads:
We collect personal data and also transmit it to third-party providers
 that help us improve and finance our digital content. Some of the information stored on your device, … [+732 chars]",,de,'Russland'
https://www.n-tv.de/politik/23-53-Selenskyj-erhofft-sich-von-Ukraine-Treffen-weitere-Waffen--article23915056.html,https://www.n-tv.de/politik/23-53-Selenskyj-erhofft-sich-von-Ukraine-Treffen-weitere-Waffen--article23915056.html,0,www.n-tv.de,Ukraine-Krieg im Liveticker: +++ 23:53 Selenskyj erhofft sich von Ukraine-Treffen weitere Waffen +++,"Berlin, Washington, Br\u00fcssel - \u00fcberall. n-tv berichtet von allen wichtigen Schaupl\u00e4tzen der Innen- und Au\u00dfenpolitik.",https://bilder2.n-tv.de/img/incoming/crop23332537/9041326157-cImg_16_9-w1200/Liveticker1-grau-1-Kopie.jpg,2023-02-13T21:00:00Z,https://web.archive.org/web/20230214020520/https://www.n-tv.de/politik/23-53-Selenskyj-erhofft-sich-von-Ukraine-Treffen-weitere-Waffen--article23915056.html,"Wenn am Dienstag die Verteidigungsminister der 30 NATO-Staaten in Brüssel zusammenkommen, hofft der ukrainische Präsident Wolodymyr Selenskyj auf eine Entscheidung für weitere Waffenlieferungen an se… [+39985 chars]",,de,'Frieren'
https://www.tagesschau.de/newsticker/liveblog-ukraine-dienstag-217.html,https://www.tagesschau.de/newsticker/liveblog-ukraine-dienstag-217.html,0,www.tagesschau.de,Liveblog: ++ Selenskyj hofft vor Treffen auf mehr Waffen ++,Der ukrainische Präsident Selenskyj erhofft sich vom heutigen Treffen der Ukraine-Kontaktgruppe weitere Waffen. Laut Angaben der Niederlande wurden russische Militärflugzeuge über Polen abgefangen. Alle Entwicklungen im Liveblog.,https://www.tagesschau.de/multimedia/bilder/flagge-ukraine-truemmer-haus-101~_v-original.jpg,2023-02-14T02:38:41Z,https://web.archive.org/web/20230214030857/https://www.tagesschau.de/newsticker/liveblog-ukraine-dienstag-217.html,Der ukrainische Präsident Selenskyj erhofft sich vom heutigen Treffen der Ukraine-Kontaktgruppe weitere Waffen. Laut Angaben der Niederlande wurden russische Militärflugzeuge über Polen abgefangen. A… [+1511 chars],,de,'Ukraine'
https://www.handelsblatt.com/politik/international/liveblog-zum-ukraine-krieg-russische-militaerflugzeuge-offenbar-ueber-polen-abgefangen-selenski-erhofft-sich-von-ukraine-treffen-weitere-waffen/27982126.html,https://www.handelsblatt.com/politik/international/liveblog-zum-ukraine-krieg-russische-militaerflugzeuge-offenbar-ueber-polen-abgefangen-selenski-erhofft-sich-von-ukraine-treffen-weitere-waffen/27982126.html,0,www.handelsblatt.com,+++ Ukraine-Krieg +++: Russische Militärflugzeuge offenbar über Polen abgefangen – Selenski erhofft sich von Ukraine-Treffen weitere Waffen,Baerbock nennt Kampfjets für Ukraine „kein Thema“ +++ USA rufen ihre Bürger zur Ausreise aus Russland auf +++ Russland knüpft Verlängerung von Getreide-Abkommen an Bedingungen +++ Der Newsblog.,https://www.handelsblatt.com/images/ausbildung-an-leopard-panzern-in-polen/28980280/2-format2003.jpg,2023-02-14T03:28:18Z,,"<li>Herr Andreas Felsch13.02.2023, 19:03 Uhr
Die Fachwelt ist sich inzwischen einig, dass die Seymour Hersch Geschichte zur Nordstream-Sprengung nichts weiter als eine Geschichte ist. Ohne Belege un… [+10300 chars]",,de,'Waffen'
https://www.zeit.de/politik/ausland/2023-02/ukraine-ueberblick-kampfjet-nato-treffen-waffen,https://www.zeit.de/politik/ausland/2023-02/ukraine-ueberblick-kampfjet-nato-treffen-waffen,0,www.zeit.de,"Ukraine-Überblick: Selenskyj wartet auf Waffen, Melnyk fordert Tempo bei Kampfjet-Debatte","Der ukrainische Präsident hofft auf eine Entscheidung für weitere Waffenlieferungen. Vizeaußenminister Melnyk erwartet, dass Deutschland Kampfjets liefern wird. Die Nacht",,2023-02-14T04:45:12Z,https://web.archive.org/web/20230214055125/https://www.zeit.de/politik/ausland/2023-02/ukraine-ueberblick-kampfjet-nato-treffen-waffen,"When browsing with ads:
We collect personal data and also transmit it to third-party providers
 that help us improve and finance our digital content. Some of the information stored on your device, … [+732 chars]",,de,'Waffen'
https://www.handelsblatt.com/politik/international/liveblog-zum-ukraine-krieg-stoltenberg-putin-bereitet-sich-auf-mehr-krieg-vor-russische-militaerflugzeuge-ueber-polen-abgefangen/27982126.html,https://www.handelsblatt.com/politik/international/liveblog-zum-ukraine-krieg-stoltenberg-putin-bereitet-sich-auf-mehr-krieg-vor-russische-militaerflugzeuge-ueber-polen-abgefangen/27982126.html,0,www.handelsblatt.com,+++ Ukraine-Krieg +++: Stoltenberg: „Putin bereitet sich auf mehr Krieg vor“ – Russische Militärflugzeuge über Polen abgefangen,Selenski hofft auf mehr Waffen nach Nato-Treffen +++ Baerbock nennt Kampfjets für Ukraine „kein Thema“ +++ Der Newsblog.,https://www.handelsblatt.com/images/nato-generalsekretaer-jens-stoltenberg/28980914/2-format2003.jpg,2023-02-14T09:49:00Z,,"<li>Herr Georg Sisow14.02.2023, 08:22 Uhr
Nicht bloß abfangen, abschießen muss man alle russischen Militärmaschinen die sich in die NATO Länder wagen.
</li><li>Herr Andreas Felsch13.02.2023, 19:03 … [+8743 chars]",,de,'Nordstream'
https://www.welt.de/politik/ausland/article243739905/Nato-Stoltenberg-schliesst-Kampfjet-Lieferung-an-Ukraine-nicht-aus-Baerbock-anderer-Meinung.html,https://www.welt.de/politik/ausland/article243739905/Nato-Stoltenberg-schliesst-Kampfjet-Lieferung-an-Ukraine-nicht-aus-Baerbock-anderer-Meinung.html,0,www.welt.de,Stoltenberg schließt Kampfjet-Lieferung an Ukraine nicht aus – laut Baerbock hingegen „kein Thema“,Einer Kampfjet-Lieferung an die Ukraine steht Nato-Generalsekretär Stoltenberg offen gegenüber. Außenministerin Baerbock sieht das anders. Derweil kam es in der Gegend von Bachmut erneut zu heftigen Artillerie-Angriffen.,https://img.welt.de/img/politik/ausland/mobile243756225/7291356437-ci16x9-w1200/BELGIUM-NATO-DEFENCE.jpg,2023-02-14T13:42:00Z,,"Nato-Generalsekretär Jens Stoltenberg schließt die Lieferung von Kampfjets an die Ukraine nicht aus. Wichtig ist, dass die Nato nicht Teil des Konflikts ist, sagte der Norweger am Montag in Brüssel. … [+30381 chars]",,de,'Ukraine'
https://www.zeit.de/news/2023-02/14/putin-kuesst-den-teufel-im-koelner-rosenmontagszug,https://www.zeit.de/news/2023-02/14/putin-kuesst-den-teufel-im-koelner-rosenmontagszug,0,www.zeit.de,Karneval: Putin küsst den Teufel im Kölner Rosenmontagszug,,,2023-02-14T13:56:39Z,https://web.archive.org/web/20230216081031/https://www.zeit.de/news/2023-02/14/putin-kuesst-den-teufel-im-koelner-rosenmontagszug,"When browsing with ads:
We collect personal data and also transmit it to third-party providers
 that help us improve and finance our digital content. Some of the information stored on your device, … [+732 chars]",,de,'Putin'
https://www.handelsblatt.com/unternehmen/industrie/kunststoffspezialist-grosse-ziele-wenig-erfolge-bmw-erbin-susanne-klatten-verlaesst-aufsichtsrat-von-sgl/28980110.html,https://www.handelsblatt.com/unternehmen/industrie/kunststoffspezialist-grosse-ziele-wenig-erfolge-bmw-erbin-susanne-klatten-verlaesst-aufsichtsrat-von-sgl/28980110.html,0,www.handelsblatt.com,Milliardärin: BMW-Erbin Susanne Klatten verlässt Aufsichtsrat von SGL Carbon,"Nach zehn Jahren gibt die Unternehmerin die Verantwortung als Chefkontrolleurin beim Kohlefaserspezialisten ab, offiziell aus Belastungsgründen. Doch SGL blieb für Klatten auch unerfüllte Hoffnung.",https://www.handelsblatt.com/images/susanne-klatten/28980112/2-format2003.jpg,2023-02-14T14:22:49Z,https://web.archive.org/web/20230214153637/https://www.handelsblatt.com/unternehmen/industrie/kunststoffspezialist-grosse-ziele-wenig-erfolge-bmw-erbin-susanne-klatten-verlaesst-aufsichtsrat-von-sgl/28980110.html,MünchenBMW-Großaktionärin Susanne Klatten tritt als Aufsichtsratschefin des Grafit-Spezialisten SGL Carbon ab. Die 60-Jährige wolle ihr Mandat im Aufsichtsrat nach der Hauptversammlung am 9. Mai aus … [+5730 chars],,de,'Teuer'
https://www.stern.de/news/motive-der-rosenmontagszuege-in-mainz-und-koeln-beschaeftigen-sich-mit-ukraine-krieg-33196414.html,https://www.stern.de/news/motive-der-rosenmontagszuege-in-mainz-und-koeln-beschaeftigen-sich-mit-ukraine-krieg-33196414.html,0,www.stern.de,Motive der Rosenmontagszüge in Mainz und Köln beschäftigen sich mit Ukraine-Krieg,Die Motivwagen der Rosenmontagszüge in Köln und Mainz beschäftigen sich unter anderem mit dem russischen Angriffskrieg in der Ukraine. In beiden Städten stellten die Organisatoren am Dienstag knapp eine Woche vor dem Rosenmontag die Wagen und Persiflagen vor.…,https://image.stern.de/33196416/t/rY/v1/w1440/r1.7778/-/14--persiflage-in-koeln---12fdad7f0b309a82.jpg,2023-02-14T14:50:57Z,,Die Motivwagen der Rosenmontagszüge in Köln und Mainz beschäftigen sich unter anderem mit dem russischen Angriffskrieg in der Ukraine. In beiden Städten stellten die Organisatoren am Dienstag knapp e… [+2122 chars],,de,'Nordstream'
https://www.handelsblatt.com/politik/deutschland/energie-deutschland-will-mehr-strom-gas-und-wasserstoff-aus-belgien/28981726.html,https://www.handelsblatt.com/politik/deutschland/energie-deutschland-will-mehr-strom-gas-und-wasserstoff-aus-belgien/28981726.html,0,www.handelsblatt.com,"Energie: Deutschland will mehr Strom, Gas und Wasserstoff aus Belgien","Deutschland muss seine Gasspeicher für kommende Winter füllen, doch die Pipelines von Belgien nach Deutschland sind ausgelastet. Jetzt sollen neue Rohre verlegt werden.",https://www.handelsblatt.com/images/olaf-scholz-und-alexander-de-croo-am-lng-terminal-zeebruegge/28981736/3-format2003.jpg,2023-02-14T15:02:37Z,https://web.archive.org/web/20230214153652/https://www.handelsblatt.com/politik/deutschland/energie-deutschland-will-mehr-strom-gas-und-wasserstoff-aus-belgien/28981726.html,Zeebrügge Deutschland und Belgien wollen für eine klimaneutrale Energieversorgung enger zusammenarbeiten. Bundeskanzler Olaf Scholz (SPD) und Belgiens Ministerpräsident Alexander De Croo unterzeichne… [+3554 chars],,de,'Gasspeicher'
