index,url,valid,domain,title,description,image,published,archive,content,quote,language,keyword
https://www.tagesspiegel.de/internationales/versprach-belohnung-von-30000-us-dollar-russland-beschuldigt-kiews-geheimdienst-nach-schussen-auf-general-15229632.html,https://www.tagesspiegel.de/internationales/versprach-belohnung-von-30000-us-dollar-russland-beschuldigt-kiews-geheimdienst-nach-schussen-auf-general-15229632.html,0,www.tagesspiegel.de,„Versprach Belohnung von 30.000 US-Dollar“: Russland beschuldigt Kiews Geheimdienst nach Schüssen auf General,Ein hochrangiger russischer General war am Freitag in Moskau bei einem Angriff schwer verletzt worden. Nun soll der mutmaßliche Täter seine „Schuld eingestanden haben“.,https://www.tagesspiegel.de/images/15232112/alternates/BASE_16_9_W1400/1770629890000/nach-attentat-auf-general-alexejew.jpeg,2026-02-08T08:11:32Z,,"Der im Zusammenhang mit dem Schusswaffenangriff auf einen russischen General festgenommene Verdächtige hat nach Angaben des russischen Inlandsgeheimdienstes FSB die Tat gestanden. 
Der in den Verein… [+5060 chars]",,de,'Schnee'
https://www.n-tv.de/wirtschaft/Trump-hat-Europa-mit-LNG-Lieferungen-in-der-Hand-id30333285.html,https://www.n-tv.de/wirtschaft/Trump-hat-Europa-mit-LNG-Lieferungen-in-der-Hand-id30333285.html,0,www.n-tv.de,Treten die USA auf die Gas-Bremse?: Trump hat Europa mit LNG-Lieferungen in der Hand,Vor dem Ukraine-Krieg hing Europa an Moskaus Energie-Tropf. Derselbe fatale Fehler wiederholt sich nun mit den USA: Durch US-Flüssiggas-Exporte hat Donald Trump ein massives Druckmittel in seinem Wirtschaftskrieg gegen Europa.,https://www.n-tv.de/img/30333355/1770386502/Img_16_9/1200/US-LNG-unloaded-at-Revithoussa-terminal-near-Athens-LNG-tanker-BRITISH-MENTOR-which-departed-from-Sabine-Pass-in-the-USA-unloads-US-liquefied-natural-gas-at-the-Revithoussa-terminal-near-Athens-Greece-is-emerging-as-a-major-regional-hub-for-US-LNG-as-the-EU-plans-to-phase-out-Russian-LNG-flows-by-2027.jpg,2026-02-08T13:51:10Z,,"Die EU bezieht den Großteil der LNG-Lieferungen aus den USA. (Foto: IMAGO/Nicolas Koutsokostas)
Vor dem Ukraine-Krieg hing Europa an Moskaus Energie-Tropf. Derselbe fatale Fehler wiederholt sich nun… [+6708 chars]",,de,'Nordstream'
https://www.zeit.de/news/2026-02/08/faellt-schnee-zum-hoehepunkt-der-fastnacht,https://www.zeit.de/news/2026-02/08/faellt-schnee-zum-hoehepunkt-der-fastnacht,0,www.zeit.de,Wetterausblick für die Woche: Fällt Schnee zum Höhepunkt der Fastnacht?,Hier finden Sie Informationen zu dem Thema „Wetterausblick für die Woche“. Lesen Sie jetzt „Fällt Schnee zum Höhepunkt der Fastnacht?“.,https://img.zeit.de/news/2026-02/08/faellt-schnee-zum-hoehepunkt-der-fastnacht-image-group/wide__1300x731,2026-02-08T13:59:37Z,,Die heiße Phase der Fastnacht könnte in vielen Teilen des Landes kalt werden - sogar Schnee ist möglich. Mit Blick auf Wettermodelle und -prognosen geht ein Meteorologe des Deutschen Wetterdienstes (… [+1291 chars],,de,'Schnee'
https://www.zeit.de/news/2026-02/08/glaette-und-schnee-sorgen-weiter-fuer-behinderungen,https://www.zeit.de/news/2026-02/08/glaette-und-schnee-sorgen-weiter-fuer-behinderungen,0,www.zeit.de,Flugverkehr: Glätte und Schnee sorgen weiter für Behinderungen,Hier finden Sie Informationen zu dem Thema „Flugverkehr“. Lesen Sie jetzt „Glätte und Schnee sorgen weiter für Behinderungen“.,https://img.zeit.de/news/2026-02/08/glaette-und-schnee-sorgen-weiter-fuer-behinderungen-image-group/wide__1300x731,2026-02-08T14:22:30Z,,"Das winterliche-trübe Wetter sorgt weiterhin in Berlin und Brandenburg in einigen Bereichen für Probleme. Nach Angaben des Deutschen Wetterdienstes (DWD) besteht weiter Glättegefahr, weil in der Nach… [+2997 chars]",,de,'Schnee'
https://www.zeit.de/news/2026-02/09/neue-woche-beginnt-im-nordosten-mit-glaettegefahr-und-kaelte,https://www.zeit.de/news/2026-02/09/neue-woche-beginnt-im-nordosten-mit-glaettegefahr-und-kaelte,0,www.zeit.de,Nebel im Süden und der Mitte: Neue Woche beginnt im Nordosten mit Glättegefahr und Kälte,Hier finden Sie Informationen zu dem Thema „Nebel im Süden und der Mitte“. Lesen Sie jetzt „Neue Woche beginnt im Nordosten mit Glättegefahr und Kälte“.,https://img.zeit.de/news/2026-02/09/neue-woche-beginnt-im-nordosten-mit-glaettegefahr-und-kaelte-image-group/wide__1300x731,2026-02-09T04:30:05Z,,"Im Nordosten Deutschlands müssen sich die Menschen auch zum Start in die neue Woche gebietsweise auf Glätte einstellen. Es herrsche Dauerfrost, durch gefrierenden Sprühregen oder Schneegriesel könne … [+1366 chars]",,de,'Kälte'
https://www.zeit.de/news/2026-02/09/wie-starlink-den-krieg-in-der-ukraine-beeinflusst,https://www.zeit.de/news/2026-02/09/wie-starlink-den-krieg-in-der-ukraine-beeinflusst,0,www.zeit.de,Krieg in der Ukraine: Wie Starlink den Krieg in der Ukraine beeinflusst,Hier finden Sie Informationen zu dem Thema „Krieg in der Ukraine“. Lesen Sie jetzt „Wie Starlink den Krieg in der Ukraine beeinflusst“.,https://img.zeit.de/news/2026-02/09/wie-starlink-den-krieg-in-der-ukraine-beeinflusst-image-group/wide__1300x731,2026-02-09T14:07:26Z,,Nach einer Reihe von aufsehenerregenden Schlägen des russischen Militärs gegen den Nachschub der Ukrainer wurden Moskaus Streitkräfte nun vom Internetsystem Starlink abgeschaltet. Erste Reaktionen ru… [+5180 chars],,de,'Ukraine'
https://www.zeit.de/news/2026-02/10/gefrierender-regen-und-schnee-wetter-im-norden-bleibt-trueb,https://www.zeit.de/news/2026-02/10/gefrierender-regen-und-schnee-wetter-im-norden-bleibt-trueb,0,www.zeit.de,Wetter: Gefrierender Regen und Schnee – Wetter im Norden bleibt trüb,Hier finden Sie Informationen zu dem Thema „Wetter“. Lesen Sie jetzt „Gefrierender Regen und Schnee – Wetter im Norden bleibt trüb“.,https://img.zeit.de/news/2026-02/10/gefrierender-regen-und-schnee-wetter-im-norden-bleibt-trueb-image-group/wide__1300x731,2026-02-10T06:40:30Z,,"Das Wetter im Norden bleibt ungemütlich. Am Dienstag wird es in allen Regionen stark bewölkt und teils neblig-trüb. Abends kann es von der Elbe her regnen, wobei der Regen teilweise gefrierend sein k… [+1733 chars]",,de,'Schnee'
https://www.focus.de/finanzen/boerse/anleger-erwarten-zu-viel-von-sparplaenen_38c02864-bd28-452f-b558-3b30768137ae.html,https://www.focus.de/finanzen/boerse/anleger-erwarten-zu-viel-von-sparplaenen_38c02864-bd28-452f-b558-3b30768137ae.html,0,www.focus.de,Anleger erwarten zu viel von Sparplänen,"Ein Sparplan sieht wie der sichere Weg zum Vermögen aus. Aber real nach Kosten bleibt leider viel weniger übrig, als gemeinhin angenommen.",https://quadro.burda-forward.de/ctf/1920f9f0-809e-4e0e-bff4-9088225b880d.2090e0a5-b570-4b14-9697-29ff7d7b003b.jpg?im=RegionOfInterestCrop%3D%281200%2C630%29%2CregionOfInterest%3D%28600%2C400%29&hash=fb0ea402950bcc756f767e2d49be2257829da1bb14b9b2ca9df27f15b0c35f60,2026-02-10T07:45:00Z,,Bei der Beurteilung der Wichtigkeit von Sparplänen für den Vermögensaufbau und die Altersvorsorge wird dem Zinseszinseffekt enorme Bedeutung zugesprochen. Entsprechende Beispiele basieren dann häufig… [+5025 chars],,de,'Sparen'
https://www.waz.de/ratgeber-wissen/article410088851/immobilien-vererben-kostenloser-ratgeber-bietet-praktische-steuertipps-von-profis.html,https://www.waz.de/ratgeber-wissen/article410088851/immobilien-vererben-kostenloser-ratgeber-bietet-praktische-steuertipps-von-profis.html,0,www.waz.de,Immobilien vererben: Kostenloser Ratgeber bietet praktische Steuertipps von Profis,"Das eBook unterstützt Sie, Immobilien konfliktfrei zu vererben. Vermeiden Sie familiären Streit, sparen Sie Steuern und sichern Sie Ihren Nachlass auf clevere Weise.",https://img.sparknews.funkemedien.de/411158645/411158645_1770649721_v16_9_1600.jpeg,2026-02-10T08:00:00Z,,"Jedes Jahr wechseln in Deutschland Werte in Milliardenhöhe den Besitzer. Besonders oft sind Immobilien Teil der Erbmasse ein zentraler Bestandteil des Vermögensbestands von Familien, aber auch eine p… [+6124 chars]",,de,'Sparen'
https://www.focus.de/politik/ausland/kann-man-kuba-ueberhaupt-noch-besuchen-insel-kaempft-mit-treibstoff-knappheit_4a205c7b-5bf3-4a21-8565-8c0ddbd145af.html,https://www.focus.de/politik/ausland/kann-man-kuba-ueberhaupt-noch-besuchen-insel-kaempft-mit-treibstoff-knappheit_4a205c7b-5bf3-4a21-8565-8c0ddbd145af.html,0,www.focus.de,Kann man Kuba überhaupt noch besuchen? Insel kämpft mit Treibstoff-Knappheit,"Wegen des US-Ölembargos hat Kuba kaum noch Treibstoff: Air Canada stoppt Flüge, Air Europa muss in der Dominikanischen Republik nachtanken. Kann man die Insel noch besuchen?",https://quadro.burda-forward.de/ctf/959c727b-52b9-4aeb-be1c-fd207bcdb398.67db8d0a-48bd-4f8b-8501-00794111ed9c.jpeg?im=RegionOfInterestCrop%3D%281200%2C630%29%2CregionOfInterest%3D%28990%2C586%29&hash=09530097124c34c2ccfeb312fa2dd59a288df5debc680b3a23a7c1029153962b,2026-02-10T09:19:00Z,,"Die Ölblockade der USA gegen das sozialistische Kuba wirkt sich auf den Flugverkehr aus. Wegen Treibstoff-Knappheit stellt die kanadische Fluglinie Air Canada vorerst ihre Flüge nach Kuba ein, wie da… [+1756 chars]",,de,'Knappheit'
https://www.zeit.de/politik/ausland/2026-02/russland-telegram-einschraenkungen-max,https://www.zeit.de/politik/ausland/2026-02/russland-telegram-einschraenkungen-max,0,www.zeit.de,Messaging-App: Russland kündigt Einschränkungen für Telegram-Messenger an,"Russlands Medienaufsicht wirft Telegram vor, verbotene Inhalte nicht gelöscht zu haben. Nutzer in Russland melden Verbindungsprobleme bei der dort sehr bedeutenden App.",https://img.zeit.de/politik/ausland/2026-02/russland-telegram-einschraenkungen-max-bild/wide__1300x731,2026-02-10T14:09:18Z,,"Die russische Medienaufsichtsbehörde Roskomnadsor (RKN) hat angekündigt, den Informationsaustausch über die in Russland intensiv genutzte Messaging-App Telegram einzuschränken. Es würden weitere rest… [+2147 chars]",,de,'Russland'
https://www.zeit.de/news/2026-02/10/eu-chefdiplomatin-russland-gewinnt-nicht-eu-kann-fordern,https://www.zeit.de/news/2026-02/10/eu-chefdiplomatin-russland-gewinnt-nicht-eu-kann-fordern,0,www.zeit.de,Ukraine-Krieg: EU-Chefdiplomatin: Russland gewinnt nicht - EU kann fordern,Hier finden Sie Informationen zu dem Thema „Ukraine-Krieg“. Lesen Sie jetzt „EU-Chefdiplomatin: Russland gewinnt nicht - EU kann fordern“.,https://img.zeit.de/news/2026-02/10/eu-chefdiplomatin-russland-gewinnt-nicht-eu-kann-fordern-image-group/wide__1300x731,2026-02-10T16:23:55Z,,Geheimdiensterkenntnisse deuten nach Angaben von EU-Chefdiplomatin Kaja Kallas nicht auf einen bevorstehenden russischen Durchbruch im Angriffskrieg gegen die Ukraine hin. «Russland gewinnt nicht. Im… [+2345 chars],,de,'Russland'
https://www.zeit.de/sport/2026-02/symbolpolitik-ioc-wladislaw-heraskewytsch-olympia,https://www.zeit.de/sport/2026-02/symbolpolitik-ioc-wladislaw-heraskewytsch-olympia,0,www.zeit.de,Symbolpolitik bei Olympia: Er trägt den falschen Helm,"Der Ukrainer Wladyslaw Heraskewytsch will an Landsleute erinnern, die im Krieg getötet wurden. Das IOC verbietet es, weil es ein eigenes Bild von Meinungsfreiheit hat.",https://img.zeit.de/sport/2026-02/olympische-winterspiele-wladyslaw-heraskewytsch-helm2/wide__1300x731,2026-02-10T18:07:17Z,,"Ein Helm ist zum politischen Objekt geworden. Der ukrainische Skeletonprofi Wladyslaw Heraskewytsch will ihn am Donnerstag beim olympischen Skeleton-Rennen tragen. Auf seinen ""memory helmet"" hat er F… [+704 chars]",,de,'Ukraine'
https://www.welt.de/politik/ausland/plus6981ac5f06b45afdb339b82d/oppositionspolitiker-kara-murza-in-den-geschichtsbuechern-wird-putin-als-zentraler-faktor-fuer-den-zusammenbruch-des-regimes-stehen.html,https://www.welt.de/politik/ausland/plus6981ac5f06b45afdb339b82d/oppositionspolitiker-kara-murza-in-den-geschichtsbuechern-wird-putin-als-zentraler-faktor-fuer-den-zusammenbruch-des-regimes-stehen.html,0,www.welt.de,„In den Geschichtsbüchern wird Putin als zentraler Faktor für den Zusammenbruch des Regimes stehen“,"Der Oppositionelle Wladimir Kara-Murza ist Teil der Delegation, die an einem Übergang zu einem demokratischen Russland arbeitet. Er überlebte zwei Giftanschläge und erklärt, woran man erkennen kann, wie die Stimmung im Land wirklich ist.",https://images.welt.de/6981ac5f06b45afdb339b82d/b9681db9899a6912eb11dd2d14e982a9-master/ci16x9-w1200/508239380-jpg,2026-02-11T09:07:24Z,,"Der Oppositionelle Wladimir Kara-Murza ist Teil der Delegation, die an einem Übergang zu einem demokratischen Russland arbeitet. Er überlebte zwei Giftanschläge und erklärt, woran man erkennen kann, … [+37 chars]",,de,'Putin'
https://www.welt.de/politik/ausland/plus6981ac5f06b45afdb339b82d/oppositionspolitiker-kara-murza-deshalb-verliert-die-putin-diktatur-diesen-krieg.html,https://www.welt.de/politik/ausland/plus6981ac5f06b45afdb339b82d/oppositionspolitiker-kara-murza-deshalb-verliert-die-putin-diktatur-diesen-krieg.html,0,www.welt.de,„Deshalb verliert die Putin-Diktatur diesen Krieg“,"Der Oppositionelle Wladimir Kara-Murza ist Teil der Delegation, die an einem Übergang zu einem demokratischen Russland arbeitet. Er überlebte zwei Giftanschläge und erklärt, woran man erkennen kann, wie die Stimmung im Land wirklich ist.",https://images.welt.de/6981ac5f06b45afdb339b82d/b9681db9899a6912eb11dd2d14e982a9-master/ci16x9-w1200/508239380-jpg,2026-02-11T09:07:24Z,,"Der Oppositionelle Wladimir Kara-Murza ist Teil der Delegation, die an einem Übergang zu einem demokratischen Russland arbeitet. Er überlebte zwei Giftanschläge und erklärt, woran man erkennen kann, … [+37 chars]",,de,'Putin'
https://www.focus.de/politik/ausland/showdown-am-15-mai-selenskyj-plant-schicksalswahl-mitten-im-krieg_e09afcdb-531f-49fb-be64-4e7de0d6f868.html,https://www.focus.de/politik/ausland/showdown-am-15-mai-selenskyj-plant-schicksalswahl-mitten-im-krieg_e09afcdb-531f-49fb-be64-4e7de0d6f868.html,0,www.focus.de,Showdown am 15. Mai: Selenskyj plant Schicksalswahl mitten im Krieg,"Die USA wollen ein schnelles Ende des Ukraine-Kriegs, sie machen Druck auf Kiew, nicht auf Moskau. Einem Bericht der „Financial Times“ zufolge könnte Präsident Selenskyj die Flucht nach vorn antreten.",https://quadro.burda-forward.de/ctf/c69e3c4b-3bf4-4f0d-b520-d6948ecf1936.3a44abe4-40c9-4253-8b68-536af95816b7.jpeg?im=RegionOfInterestCrop%3D%281200%2C630%29%2CregionOfInterest%3D%281024%2C683%29&hash=5c0690cc96481b0585bd938c714639edd37cbbadb4b8ada91f107551fef789b1,2026-02-11T09:41:00Z,,"Einem Bericht der Financial Times zufolge plant der ukrainische Staatschef Wolodymyr Selenskyj unter Druck der USA, eine Präsidentenwahl und ein Friedensreferendum für den 15. Mai anzusetzen. Die bri… [+1928 chars]",,de,'Putin'
https://www.faz.net/aktuell/politik/ukraine/unermuedlich-wie-arbeiter-in-der-ukraine-die-kraftwerke-reparieren-accg-110834930.html,https://www.faz.net/aktuell/politik/ukraine/unermuedlich-wie-arbeiter-in-der-ukraine-die-kraftwerke-reparieren-accg-110834930.html,0,www.faz.net,Ukrainische Kraftwerksarbeiter: Sie kämpfen um jede Kilowattstunde,"Bei klirrender Kälte greift Russland in der Ukraine Wärme- und Stromkraftwerke an. Die Arbeiter dort reparieren im Akkord, obwohl jederzeit der nächste Angriff folgen kann.",https://media0.faz.net/image/w1200h627/918c5f605b4a/w3000h1567x0y388o/022026/1.10834929/raeumt-auf-mitarbeiter-jewhen.webp,2026-02-11T10:27:26Z,,"Von dort, wo Jewhen normalerweise arbeitet, bietet sich ein Bild der Verwüstung. Das Dach des Kraftwerks ist teilweise eingestürzt. Stahlträger liegen verkeilt über Turbinen, abgebrochene Betonsäulen… [+9267 chars]",,de,'Kälte'
https://www.diepresse.com/20570710/trump-draengt-selenskij-offenbar-zu-wahlen-im-fruehling,https://www.diepresse.com/20570710/trump-draengt-selenskij-offenbar-zu-wahlen-im-fruehling,0,www.diepresse.com,Trump drängt Selenskij offenbar zu Wahlen im Frühling [premium],Laut US-Medienbericht könnte die Ukraine bis Mitte Mai Wahlen und eine Abstimmung über einen Friedensplan abhalten. Doch der Zeitplan scheint zu ambitioniert. Ein Deal ist nicht in Sicht.,https://img.diepresse.com/public/incoming/6hje9t-ukraine-crisistrump-zelenskiy/alternates/DPR_SOCIAL_NACHRICHTEN/UKRAINE-CRISISTRUMP-ZELENSKIY,2026-02-11T10:58:32Z,,US-Präsident Donald Trump erhöht offenbar den Druck bei den Friedensverhandlungen zwischen der Ukraine und Russland. Einem Bericht der Financial Times zufolge soll die Ukraine Präsidentenwahlen und e… [+3933 chars],,de,'Ukraine'
https://www.welt.de/politik/ausland/article698977ac2dc88ba237f4611e/ukraine-krieg-1-3-millionen-tote-russen-hoechste-opferzahlen-seit-1945-liveticker.html,https://www.welt.de/politik/ausland/article698977ac2dc88ba237f4611e/ukraine-krieg-1-3-millionen-tote-russen-hoechste-opferzahlen-seit-1945-liveticker.html,0,www.welt.de,"1,3 Millionen tote Russen – Höchste Opferzahlen seit 1945","US-Verteidigungsminister Hegseth hat seine Teilnahme an einem Nato-Treffen abgesagt. Die russischen Verluste im Ukraine-Krieg werden auf inzwischen 1,3 Millionen Soldaten beziffert. Mehr im Liveticker.",https://images.welt.de/698977ac2dc88ba237f4611e/df91448207e86ea1a9c536a6f0333f08/ci16x9-w1200/dpa-com-20090101-251114-911-013485-jpg,2026-02-11T11:02:00Z,,"US-Verteidigungsminister Hegseth hat seine Teilnahme an einem Nato-Treffen abgesagt. Die russischen Verluste im Ukraine-Krieg werden auf inzwischen 1,3 Millionen Soldaten beziffert. Mehr im Liveticke… [+17371 chars]",,de,'Ukraine'
https://www.welt.de/politik/ausland/article698977ac2dc88ba237f4611e/ukraine-krieg-hoechstgrenzen-fuer-atomwaffen-lawrow-nennt-den-usa-eine-bedingung-liveticker.html,https://www.welt.de/politik/ausland/article698977ac2dc88ba237f4611e/ukraine-krieg-hoechstgrenzen-fuer-atomwaffen-lawrow-nennt-den-usa-eine-bedingung-liveticker.html,0,www.welt.de,Höchstgrenzen für Atomwaffen? Lawrow nennt den USA eine Bedingung,"Russland hat erklärt, sich auch weiterhin an das Begrenzungsabkommen für Atomwaffen zu halten. Allerdings nur, wenn auch die USA mitmachen. Die USA haben derweil die Militärhilfen für die Ukraine um 99 Prozent zurückgefahren. Neue Zahlen offenbaren, wie viel …",https://images.welt.de/698977ac2dc88ba237f4611e/54cd898c07463b0f8c554d73cb95ee1a/ci16x9-w1200/dpa-com-20090101-260210-935-1142737-jpg,2026-02-11T11:02:00Z,,"Russland hat erklärt, sich auch weiterhin an das Begrenzungsabkommen für Atomwaffen zu halten allerdings nur, wenn auch die US-Amerikaner mitziehen. Die USA haben derweil die Militärhilfen für die Uk… [+15119 chars]",,de,'Putin'
https://www.zeit.de/news/2026-02/11/kiel-institut-europa-hat-ukraine-hilfe-2025-ausgeweitet,https://www.zeit.de/news/2026-02/11/kiel-institut-europa-hat-ukraine-hilfe-2025-ausgeweitet,0,www.zeit.de,Krieg: Kiel Institut: Europa hat Ukraine-Hilfe 2025 ausgeweitet,Hier finden Sie Informationen zu dem Thema „Krieg“. Lesen Sie jetzt „Kiel Institut: Europa hat Ukraine-Hilfe 2025 ausgeweitet“.,https://img.zeit.de/news/2026-02/11/kiel-institut-europa-hat-ukraine-hilfe-2025-ausgeweitet-image-group/wide__1300x731,2026-02-11T11:24:45Z,,Europa hat vergangenes Jahr die Hilfe für die angegriffene Ukraine deutlich ausgeweitet. Das geht aus einer Auswertung der Forschungseinrichtung Kiel Institut für Weltwirtschaft hervor. Die militäris… [+2031 chars],,de,'Ukraine'
https://www.zeit.de/news/2026-02/11/eu-parlament-billigt-90-milliarden-darlehen-an-die-ukraine,https://www.zeit.de/news/2026-02/11/eu-parlament-billigt-90-milliarden-darlehen-an-die-ukraine,0,www.zeit.de,Rüstung: EU-Parlament billigt 90-Milliarden-Darlehen an die Ukraine,Hier finden Sie Informationen zu dem Thema „Rüstung“. Lesen Sie jetzt „EU-Parlament billigt 90-Milliarden-Darlehen an die Ukraine“.,https://img.zeit.de/news/2026-02/11/eu-parlament-billigt-90-milliarden-darlehen-an-die-ukraine-image-group/wide__1300x731,2026-02-11T11:35:14Z,,"Das Europäische Parlament hat den Plänen für ein neues Darlehen in Milliardenhöhe an die Ukraine zugestimmt. Es sieht vor, dem von Russland angegriffenen Land über zwei Jahre bis zu 90 Milliarden Eur… [+1860 chars]",,de,'Ukraine'
https://www.bild.de/sport/olympia/finn-sonnekalb-glaenzt-olympia-traum-in-mailand-mit-papa-698c78c610c65e72bdaa4e06,https://www.bild.de/sport/olympia/finn-sonnekalb-glaenzt-olympia-traum-in-mailand-mit-papa-698c78c610c65e72bdaa4e06,0,www.bild.de,Mit dem Rad von Erfurt nach Mailand - 984 km durch Schnee und Eis zu Olympia,Eisschnellläufer Finn Sonnekalb startet bei Olympia. Sein Vater reiste mit dem Fahrrad nach Mailand und löste so eine Wette ein.,"https://images.bild.de/698c78c610c65e72bdaa4e06/ce0f02b0bdd18557a659890ea265d43f,dc6ae8f?w=1280",2026-02-11T14:04:36Z,,"TTS-Player überspringenArtikel weiterlesenAm Mittwochabend schlägt die große Stunde!
Ab 18.30 Uhr will Eisschnellläufer Finn Sonnekalb (18) bei den Olympischen Spielen in Mailand über 1000 Meter glä… [+3347 chars]",,de,'Schnee'
https://www.stern.de/news/waldbewohner-37128162.html,https://www.stern.de/news/waldbewohner-37128162.html,0,www.stern.de,Waldbewohner,"In einem Wald im Nationalpark Kampinos rund dreißig Kilometer nordwestlich von Warschau liegt ein Elch, der größte Vertreter der Familie der Hirsche, im Schnee.",https://image.stern.de/37128164/t/39/v1/w1440/r1.7778/-/11--waldbewohner---a32205f4641ef0a0.jpg,2026-02-11T14:21:20Z,,"Zugang zu stern+statt 11,96 
 nur 1  
<ul><li>Alles von stern+ mit erstklassigen Inhalten von GEO und Capital</li><li>4 Wochen testen, dann 2,99  je Woche</li><li>jederzeit kündbar</li></ul>",,de,'Schnee'
https://www.sueddeutsche.de/sport/nordische-kombination-olympia-coventry-entscheidung-li.3385729,https://www.sueddeutsche.de/sport/nordische-kombination-olympia-coventry-entscheidung-li.3385729,0,www.sueddeutsche.de,Nordische Kombination: Die IOC-Präsidentin ist „begeistert“,Die deutschen Kombinierer bleiben im tiefen Schnee des Val di Fiemme stecken und verpassen überraschend eine Medaille. Aber immerhin: Die angereiste Kirsty Coventry äußert sich nach dem Rennen positiv über die Sportart auf olympischer Bewährung.,https://www.sueddeutsche.de/2026/02/11/cf9202a7-6119-4af7-98ec-d658a28f6563.jpg?q=60&fm=webp&width=1200&rect=279%2C506%2C3636%2C2045,2026-02-11T15:32:05Z,,"Die beiden Top-Funktionäre wollten sich mal anschauen, wie sie sich so macht bei diesen Winterspielen, die Nordische Kombination. Denn die Sportart steht, in die Sprache der Tier- und Pflanzenwelt üb… [+4975 chars]",,de,'Schnee'
https://www.stern.de/gesellschaft/regional/mecklenburg-vorpommern/winter--schnee--nebel-und-unfaelle-in-vorpommern-37128560.html,https://www.stern.de/gesellschaft/regional/mecklenburg-vorpommern/winter--schnee--nebel-und-unfaelle-in-vorpommern-37128560.html,0,www.stern.de,"Winter: Schnee, Nebel und Unfälle in Vorpommern","Schwerin/Grimmen (mv) - Der Winter hat Vorpommern mit Schnee, Minusgraden und Nebel im Griff, während weiter westlich im Bundesland am Mittwoch leichte",https://image.stern.de/37128562/t/7f/v1/w1440/r1.7778/-/11--fe7u2mmyunv6axs2048jpeg---17c20839a9b4c63c.jpg,2026-02-11T15:35:09Z,,"Kopiere den aktuellen Link
Zur Merkliste hinzufügen
Das Wetter teilt Mecklenburg-Vorpommern: Im Westen herrschen leichte Plusgrade, in Vorpommern fällt Schnee. Es kommt zu einigen Unfällen.
Der Wi… [+1778 chars]",,de,'Schnee'
https://www.bild.de/news/ausland/zoff-um-schnee-skigebiet-will-ein-vermoegen-fuer-weisse-pisten-ausgeben-698c546810c65e72bdaa49a8,https://www.bild.de/news/ausland/zoff-um-schnee-skigebiet-will-ein-vermoegen-fuer-weisse-pisten-ausgeben-698c546810c65e72bdaa49a8,0,www.bild.de,Zoff um Schnee - Skigebiet will ein Vermögen für weiße Pisten ausgeben,Ein geplantes Millionen-Projekt sorgt in einem Skigebiet für mächtig Wirbel.,"https://images.bild.de/698c546810c65e72bdaa49a8/22bcc597a0b15e140903e2a3eaad7edf,fd57e4fd?w=1280",2026-02-11T15:58:07Z,,"TTS-Player überspringenArtikel weiterlesenLeysin (Schweiz) Weil Frau Holle streikt, sollen Hightech-Düsen die Pisten in Weiß tauchen. Fast 22 Millionen Euro sollen fließen, kilometerlange Leitungen v… [+2140 chars]",,de,'Schnee'
https://www.welt.de/sport/olympia/article698caabc214ef648aed067ed/olympia-schwerer-sturz-ueberschattet-die-halfpipe-qualifikation-der-snowboarderinnen.html,https://www.welt.de/sport/olympia/article698caabc214ef648aed067ed/olympia-schwerer-sturz-ueberschattet-die-halfpipe-qualifikation-der-snowboarderinnen.html,0,www.welt.de,Schwerer Sturz überschattet die Halfpipe-Qualifikation,"In der Qualifikation für das Halfpipe-Finale kommt Liu Jiayu zu Sturz, überschlägt sich mehrfach. Da die Chinesin zunächst regungslos im Schnee liegen bleibt, herrscht minutenlang Stille. Es ist nicht der erste schwere Unfall in der Halfpipe von Livigno.",https://images.welt.de/698caabc214ef648aed067ed/ab339db0ff453c871f69a59f580c5933-master/ci16x9-w1200/apdpa-32b896005fe8f307-jpg,2026-02-11T16:42:05Z,,Die Halfpipe-Qualifikation bei den Olympischen Spielen in Italien ist von einem weiteren heftigen Sturz überschattet worden. Die chinesische Snowboarderin Liu Jiayu überschlug sich gegen Ende ihres z… [+1764 chars],,de,'Schnee'
https://www.bild.de/news/wetter/temperaturen-fallen-unter-minus-10-grad-der-winter-ist-noch-lange-nicht-vorbei-698caed310c65e72bdaa54ca,https://www.bild.de/news/wetter/temperaturen-fallen-unter-minus-10-grad-der-winter-ist-noch-lange-nicht-vorbei-698caed310c65e72bdaa54ca,0,www.bild.de,Schnee-Comeback! - „Der Winter ist noch lange nicht vorbei“,Neue Kältewelle bringt Schnee und Minusgrade nach Deutschland ab Donnerstag.,"https://images.bild.de/698caed310c65e72bdaa54ca/a48dba1c660647a49639c9cc56d872ba,84eb2716?w=1280",2026-02-11T18:45:02Z,,"TTS-Player überspringenArtikel weiterlesenMild ist vorbei! Nachdem auch im Norden und Osten Schnee und Eis fast abgetaut sind, geht es wieder los: Denn über Nordeuropa lauert schon die nächste Kältew… [+2066 chars]",,de,'Schnee'
