index,url,valid,domain,title,description,image,published,archive,content,quote,language,keyword
https://www.faz.net/aktuell/politik/ukraine-liveticker-kiew-meldet-angriffe-entlang-der-1000-kilometer-front-19030454.html,https://www.faz.net/aktuell/politik/ukraine-liveticker-kiew-meldet-angriffe-entlang-der-1000-kilometer-front-19030454.html,0,www.faz.net,Ukraine-Liveblog: Kiew meldet geballte Angriffe entlang der 1000-Kilometer-Front,Selenskyj verspricht Reform der Einberufungsgesetze +++ Angehörige ukrainischer Soldaten demonstrieren für mehr Ruhepausen für Frontkämpfer +++ Russische Soldaten klagen über erschütternde Zustände an der Front +++ Alle Entwicklungen im Liveblog.,https://media1.faz.net/ppmedia/aktuell/3138941668/1.9355759/facebook_teaser/die-drohnenaufnahme-zeigt-den.jpg,2023-12-02T03:31:45Z,https://web.archive.org/web/20231202045406/https://www.faz.net/aktuell/politik/ukraine-liveticker-kiew-meldet-angriffe-entlang-der-1000-kilometer-front-19030454.html,"Der russische Außenminister Sergej Lawrow hat das OSZE-Treffen einmal mehr dafür genutzt, um der Ukraine die Schuld an dem von Moskau begonnenen Krieg zu geben. Wir sehen weiter keine Signale weder a… [+943 chars]",,de,'Ukraine'
https://www.stern.de/politik/ausland/russische-invasion--krieg-gegen-die-ukraine--so-ist-die-lage-34251704.html,https://www.stern.de/politik/ausland/russische-invasion--krieg-gegen-die-ukraine--so-ist-die-lage-34251704.html,0,www.stern.de,Russische Invasion: Krieg gegen die Ukraine: So ist die Lage,"Die Soldatenzahl der russischen Armee soll künftig auf 1,32 Millionen ansteigen. Kiew sucht derweil nach Möglichkeiten, um seine Soldaten zu entlasten. Die News im Überblick.",https://image.stern.de/34251706/t/Rd/v1/w1440/r1.7778/-/02--urnnewsmldpacom2009010123120299153816v2w800h600l460t262r1710b1092jpeg---69a906224fe68e02.jpg,2023-12-02T04:23:33Z,,"Die Soldatenzahl der russischen Armee soll künftig auf 1,32 Millionen ansteigen. Kiew sucht derweil nach Möglichkeiten, um seine Soldaten zu entlasten. Die News im Überblick.
Rund 21 Monate nach Beg… [+5696 chars]",,de,'Ukraine'
https://www.zeit.de/news/2023-12/02/krieg-gegen-die-ukraine-so-ist-die-lage,https://www.zeit.de/news/2023-12/02/krieg-gegen-die-ukraine-so-ist-die-lage,0,www.zeit.de,Russische Invasion: Krieg gegen die Ukraine: So ist die Lage,Hier finden Sie Informationen zu dem Thema „Russische Invasion“. Lesen Sie jetzt „Krieg gegen die Ukraine: So ist die Lage“.,https://img.zeit.de/news/2023-12/02/krieg-gegen-die-ukraine-so-ist-die-lage-image-group/wide__1300x731,2023-12-02T04:23:33Z,https://web.archive.org/web/20231203055105/https://www.zeit.de/news/2023-12/02/krieg-gegen-die-ukraine-so-ist-die-lage,"Rund 21 Monate nach Beginn seines Angriffskriegs gegen die Ukraine hat Russlands Präsident Wladimir Putin eine erneute Vergrößerung seiner Armee angeordnet. 
Mehr Schlagzeilen
Künftig soll die Zahl… [+6457 chars]",,de,'Ukraine'
https://www.nzz.ch/international/ukraine-krieg-russland-2024-im-vorteil-kiew-bleibt-abhaengig-vom-westen-ld.1767938,https://www.nzz.ch/international/ukraine-krieg-russland-2024-im-vorteil-kiew-bleibt-abhaengig-vom-westen-ld.1767938,0,www.nzz.ch,"2024 droht für die Ukraine das härteste Kriegsjahr zu werden, weil Russland für den Erfolg horrende Verluste in Kauf nimmt","Kiew steht nach der wenig erfolgreichen Offensive an fast allen Fronten unter Druck. Moskau hat Vorteile bei Soldaten und Munition, profitiert aber auch von der Unentschlossenheit des Westens.","https://img.nzz.ch/2023/11/29/9ff3dfab-7346-4527-8e4e-f634238ba4d2.jpeg?width=1200&height=675&fit=bound&quality=75&auto=webp&crop=4304,2421,x0,y224&wmark=nzz",2023-12-02T04:30:00Z,https://web.archive.org/web/20231202073948/http://www.nzz.ch/international/ukraine-krieg-russland-2024-im-vorteil-kiew-bleibt-abhaengig-vom-westen-ld.1767938,"Der Kriegsalltag wäre auch ohne einen «Jahrhundertsturm» hart genug. Doch heftige Schneefälle, Überschwemmungen und Winde liessen in den letzten Tagen über zweieinhalb Millionen Menschen im Süden der… [+135 chars]",,de,'Ukraine'
https://www.nzz.ch/meinung/der-kreml-hat-wochenlang-asylsuchende-nach-finnland-gedraengt-die-grenze-zu-schliessen-ist-die-einzige-moeglichkeit-die-perfide-aktion-zu-stoppen-ld.1768367,https://www.nzz.ch/meinung/der-kreml-hat-wochenlang-asylsuchende-nach-finnland-gedraengt-die-grenze-zu-schliessen-ist-die-einzige-moeglichkeit-die-perfide-aktion-zu-stoppen-ld.1768367,0,www.nzz.ch,"KOMMENTAR - Der Kreml hat wochenlang Asylsuchende nach Finnland gedrängt. Die Grenze zu schliessen, ist die einzige Möglichkeit, die perfide Aktion zu stoppen","Wer Finnland nun als migrationsfeindliches Land verunglimpft, tut genau das, was Putin möchte.","https://img.nzz.ch/2023/12/02/083b3835-d164-4f63-a7e2-09a5bd66dc66.jpeg?width=1200&height=675&fit=bound&quality=75&auto=webp&crop=5120,2880,x0,y264&wmark=nzz",2023-12-02T04:46:00Z,,"Der Grenzübergang Raja-Jooseppi in Nordfinnland ist geschlossen.
Ein neuer eiserner Vorhang trennt Russland vom Westen. Am Donnerstag hat Finnland seine Ostgrenze für den Personenverkehr komplett ge… [+3810 chars]",,de,'Ukraine'
https://www.morgenpost.de/politik/ausland/article240725926/Gruppe-von-Ukrainern-am-Flugabwehrsystem-Patriot-ausgebildet.html,https://www.morgenpost.de/politik/ausland/article240725926/Gruppe-von-Ukrainern-am-Flugabwehrsystem-Patriot-ausgebildet.html,0,www.morgenpost.de,Gruppe von Ukrainern am Flugabwehrsystem Patriot ausgebildet,Die Bundesregierung setzt bei der Militärhilfe für die Ukraine einen Schwerpunkt auf die Flugabwehr. Die Systeme sind teuer und kompliziert. Eine zweite Bedienmannschaft ist bald bereit für den Kampf.,https://img.sparknews.funkemedien.de/240725924/240725924_1701493997_v4_3_800.jpeg,2023-12-02T05:09:24Z,,Berlin. Die Bundesregierung setzt bei der Militärhilfe für die Ukraine einen Schwerpunkt auf die Flugabwehr. Die Systeme sind teuer und kompliziert. Eine zweite Bedienmannschaft ist bald bereit für d… [+3405 chars],,de,'Ukraine'
https://www.zeit.de/news/2023-12/02/gruppe-von-ukrainern-am-flugabwehrsystem-patriot-ausgebildet,https://www.zeit.de/news/2023-12/02/gruppe-von-ukrainern-am-flugabwehrsystem-patriot-ausgebildet,0,www.zeit.de,Konflikte: Gruppe von Ukrainern am Flugabwehrsystem Patriot ausgebildet,Hier finden Sie Informationen zu dem Thema „Konflikte“. Lesen Sie jetzt „Gruppe von Ukrainern am Flugabwehrsystem Patriot ausgebildet“.,https://img.zeit.de/news/2023-12/02/gruppe-von-ukrainern-am-flugabwehrsystem-patriot-ausgebildet-image-group/wide__1300x731,2023-12-02T05:09:24Z,,"Die Bundeswehr hat eine zweite Gruppe ukrainischer Soldaten am Flugabwehrsystem Patriot ausgebildet. Das Training der etwa 70 Männer und Frauen stand nach mehr als sechs Wochen vor dem Abschluss. 
M… [+4182 chars]",,de,'Ukraine'
https://www.stern.de/politik/ausland/konflikte--gruppe-von-ukrainern-am-flugabwehrsystem-patriot-ausgebildet-34251740.html,https://www.stern.de/politik/ausland/konflikte--gruppe-von-ukrainern-am-flugabwehrsystem-patriot-ausgebildet-34251740.html,0,www.stern.de,Konflikte: Gruppe von Ukrainern am Flugabwehrsystem Patriot ausgebildet,Die Bundesregierung setzt bei der Militärhilfe für die Ukraine einen Schwerpunkt auf die Flugabwehr. Die Systeme sind teuer und kompliziert. Eine zweite Bedienmannschaft ist bald bereit für den Kampf.,https://image.stern.de/34251742/t/xz/v1/w1440/r1.7778/-/02--urnnewsmldpacom2009010123120299153821v3w800h600l312t466r1592b1319jpeg---de16f23f10f238db.jpg,2023-12-02T05:09:24Z,https://web.archive.org/web/20231202070548/https://www.stern.de/politik/ausland/konflikte--gruppe-von-ukrainern-am-flugabwehrsystem-patriot-ausgebildet-34251740.html,Die Bundesregierung setzt bei der Militärhilfe für die Ukraine einen Schwerpunkt auf die Flugabwehr. Die Systeme sind teuer und kompliziert. Eine zweite Bedienmannschaft ist bald bereit für den Kampf… [+3372 chars],,de,'Ukraine'
https://www.googlewatchblog.de/?p=215391,https://www.googlewatchblog.de/?p=215391,0,www.googlewatchblog.de,"Google Maps: Vier Tipps für das Sparen beim Tanken, Gebühren vermeiden, Klima schonen und Routensuche","Zum Start in die Feiertagssaison gibt das Google Maps-Team vier praktische Tipps.Google Maps: Vier Tipps für das Sparen beim Tanken, Gebühren vermeiden, Klima schonen und RoutensucheKeine Google-News mehr verpassen: GoogleWatchBlog bei Google News abonnieren",https://www.googlewatchblog.de/wp-content/uploads/google-maps-cover.jpg,2023-12-02T06:00:32Z,https://web.archive.org/web/20231202103703/https://www.googlewatchblog.de/?p=215391,"Es ist Dezember und auch unter den Nutzern von Google Maps beginnt damit wieder die stressigste Zeit des Jahres, die man trotz allen Onlineshoppings oftmals auch im Auto, im Stau oder anderweitig unt… [+3424 chars]",,de,'Sparen'
https://www.zeit.de/mobilitaet/2023-12/bahn-bayern-wintereinbruch-schnee-zugausfaelle,https://www.zeit.de/mobilitaet/2023-12/bahn-bayern-wintereinbruch-schnee-zugausfaelle,0,www.zeit.de,Wintereinbruch: Schnee legt Bahnverkehr in Bayern lahm,"Im Großraum München fallen wegen Schnee und Eis zahlreiche Bahnverbindungen aus, Reisende mussten teilweise im Zug übernachten. Die Einschränkungen dürften andauern.",https://img.zeit.de/administratives/sharing/fallback-image/wide__1300x731,2023-12-02T06:29:38Z,https://web.archive.org/web/20231203073255/https://www.zeit.de/mobilitaet/2023-12/bahn-bayern-wintereinbruch-schnee-zugausfaelle,"Wegen des Wintereinbruchs ist der Bahnverkehr in Süddeutschland stark beeinträchtigt. Derzeit komme es zu Verspätungen und Zugausfällen, teilte eine Bahnsprecherin mit. Der Hauptbahnhof in München kö… [+1893 chars]",,de,'Schnee'
https://www.faz.net/aktuell/politik/ausland/etwa-20-staaten-wollen-energie-aus-kernkraft-verdreifachen-19356039.html,https://www.faz.net/aktuell/politik/ausland/etwa-20-staaten-wollen-energie-aus-kernkraft-verdreifachen-19356039.html,0,www.faz.net,Klimakonferenz: Etwa 20 Staaten wollen Energie aus Kernkraft verdreifachen,"Um die Klimaziele einzuhalten, ist Atomkraft nach Auffassung mehrerer Länder unerlässlich. Eine Gruppe um Frankreich und die Vereinigten Staaten fordert die Weltgemeinschaft auf, wieder massiv in Atomenergie zu investieren.",https://media1.faz.net/ppmedia/aktuell/gesellschaft/3153337808/1.9356065/facebook_teaser/belgiens-ministerpraesident.jpg,2023-12-02T09:14:23Z,https://web.archive.org/web/20231202100138/https://www.faz.net/aktuell/politik/ausland/etwa-20-staaten-wollen-energie-aus-kernkraft-verdreifachen-19356039.html,"Etwa 20 Staaten wollen zum Wohle des Klimas die Energieerzeugung aus Atomkraft deutlich hochschrauben. Bis zum Jahr 2050 sollten die Kapazitäten verdreifacht werden, hieß es in einer am Samstag auf d… [+903 chars]",,de,'Atomenergie'
https://www.tagesschau.de/wirtschaft/verbraucher/weihnachtsbaeume-preise-100.html,https://www.tagesschau.de/wirtschaft/verbraucher/weihnachtsbaeume-preise-100.html,0,www.tagesschau.de,Wie teuer Weihnachtsbäume dieses Jahr sind,Der Verkauf von Weihnachtsbäumen geht in die heiße Phase - mit einem bundesweitem Preisaufschlag. Händler geben die gestiegenen Kosten auf den Plantagen an ihre Kunden weiter. Von Martin Rottach.,https://images.tagesschau.de/image/9be51751-7005-486d-aecd-6c796133d96a/AAABjCVGH9E/AAABibBxqrQ/16x9-1280/weihnachtsbaum-auto-101.jpg,2023-12-02T09:44:25Z,,"Stand: 02.12.2023 10:44 Uhr
Der Verkauf von Weihnachtsbäumen geht in die heiße Phase - mit einem bundesweitem Preisaufschlag. Händler geben die gestiegenen Kosten auf den Plantagen an ihre Kunden we… [+3315 chars]",,de,'Kosten'
https://www.zeit.de/news/2023-12/02/bayerns-forstministerin-raet-von-aufenthalten-in-waeldern-ab,https://www.zeit.de/news/2023-12/02/bayerns-forstministerin-raet-von-aufenthalten-in-waeldern-ab,0,www.zeit.de,Schnee: Bayerns Forstministerin rät von Aufenthalten in Wäldern ab,Hier finden Sie Informationen zu dem Thema „Schnee“. Lesen Sie jetzt „Bayerns Forstministerin rät von Aufenthalten in Wäldern ab“.,https://img.zeit.de/news/2023-12/02/bayerns-forstministerin-raet-von-aufenthalten-in-waeldern-ab-image-group/wide__1300x731,2023-12-02T10:45:38Z,https://web.archive.org/web/20231203195314/https://www.zeit.de/news/2023-12/02/bayerns-forstministerin-raet-von-aufenthalten-in-waeldern-ab,Bayerns Forstministerin Michaela Kaniber (CSU) rät angesichts der starken Schneefälle insbesondere in Südostbayern vom Betreten der Wälder ab. Herabfallende Äste oder umstürzende Bäume seien eine Gef… [+451 chars],,de,'Schnee'
https://www.dw.com/de/cop28-viele-staaten-verlangen-ausbau-der-atomkraft/a-67615217,https://www.dw.com/de/cop28-viele-staaten-verlangen-ausbau-der-atomkraft/a-67615217,0,www.dw.com,COP28: Viele Staaten verlangen Ausbau der Atomkraft,Rund 20 Länder haben sich bei der UN-Klimakonferenz für eine Verdreifachung der Atomenergie bis 2050 ausgesprochen. Bundeskanzler Scholz betont dagegen in Dubai den ausschließlichen Vorrang der erneuerbaren Energien.,https://static.dw.com/image/67297895_6.jpg,2023-12-02T11:54:00Z,,"Eine Gruppe von etwa 20 Staaten hat auf der UN-Klimakonferenz in Dubai (COP28) zum Ausbau der Atomkraft aufgerufen. Beteiligt an der gemeinsamen Erklärung sind unter anderem die USA, Frankreich, Groß… [+4979 chars]",,de,'Atomenergie'
https://www.bild.de/ratgeber/wissenschaft/ratgeber/un-klimakonferenz-in-dubai-20-staaten-wollen-atomenergie-verdreifachen-86298570.bild.html,https://www.bild.de/ratgeber/wissenschaft/ratgeber/un-klimakonferenz-in-dubai-20-staaten-wollen-atomenergie-verdreifachen-86298570.bild.html,0,www.bild.de,UN-Klimakonferenz in Dubai - 20 Staaten wollen Atomenergie verdreifachen,Alle Atomkraftwerke ans Netz für mehr Klimaneutralität! Das fordern jetzt rund 20 Staaten auf der UN-Klimakonferenz in Dubai.,"https://images.bild.de/656aeedda146de1624e6087d/08045d066b904b9d3044acd7fdd9d8f3,a62129d4?w=1280",2023-12-02T14:18:26Z,,"Alle Atomkraftwerke ans Netz für mehr Klimaneutralität!
Das fordern jetzt rund 20 Staaten auf der UN-Klimakonferenz in Dubai. So haben unter anderem die USA, Frankreich, Großbritannien sowie das Gas… [+1460 chars]",,de,'Atomenergie'
https://www.faz.net/aktuell/politik/ukraine-liveticker-betreiber-akw-saporischschja-stand-kurz-vor-atomunfall-19030454.html,https://www.faz.net/aktuell/politik/ukraine-liveticker-betreiber-akw-saporischschja-stand-kurz-vor-atomunfall-19030454.html,0,www.faz.net,Ukraine-Liveblog: Betreiber: Akw Saporischschja stand „kurz vor Atomunfall“,Kiew meldet geballte russische Angriffe entlang der 1000-Kilometer-Front +++ Selenskyj verspricht Reform der Einberufungsgesetze +++ Angehörige ukrainischer Soldaten demonstrieren für mehr Ruhepausen für Frontkämpfer +++ Alle Entwicklungen im Liveblog.,https://media1.faz.net/ppmedia/aktuell/politik/1412669184/1.9356581/facebook_teaser/ein-russischer-soldat-bewacht.jpg,2023-12-02T15:28:39Z,,"Der russische Außenminister Sergej Lawrow hat das OSZE-Treffen einmal mehr dafür genutzt, um der Ukraine die Schuld an dem von Moskau begonnenen Krieg zu geben. Wir sehen weiter keine Signale weder a… [+943 chars]",,de,'Ukraine'
https://www.faz.net/aktuell/wirtschaft/klima-nachhaltigkeit/weltklimakonferenz-kann-nur-noch-die-kernkraft-die-erde-retten-19356663.html,https://www.faz.net/aktuell/wirtschaft/klima-nachhaltigkeit/weltklimakonferenz-kann-nur-noch-die-kernkraft-die-erde-retten-19356663.html,0,www.faz.net,Weltklimakonferenz: Kann nur noch die Kernkraft die Erde retten?,"Für den Klimaschutz wollen mehr als 20 Länder, darunter die USA, Japan, Großbritannien und Frankreich, die Atomenergie bis 2050 verdreifachen. Unterstützer der erneuerbaren Energien lehnen das ab, aber auch für sie gibt es gute Nachrichten aus Dubai.",https://media1.faz.net/ppmedia/aktuell/gesellschaft/234332222/1.9356703/facebook_teaser/diese-vertreter-wollen-die.jpg,2023-12-02T16:50:26Z,,"Am Samstag feiern die Vereinigten Arabischen Emirate ihren Nationalfeiertag, in Dubai aber kann von Ruhe keine Rede sein: Am zweiten Tag des Gipfeltreffens der 160 Staats- und Regierungschefs auf der… [+3204 chars]",,de,'Atomenergie'
https://www.faz.net/aktuell/politik/ukraine-liveticker-ukraine-hindert-frueheren-praesidenten-poroschenko-an-ausreise-19030454.html,https://www.faz.net/aktuell/politik/ukraine-liveticker-ukraine-hindert-frueheren-praesidenten-poroschenko-an-ausreise-19030454.html,0,www.faz.net,Ukraine-Liveblog: Ukraine hindert früheren Präsidenten Poroschenko an Ausreise,Betreiber: Akw Saporischschja stand „kurz vor Atomunfall“ +++ Kiew meldet geballte russische Angriffe entlang der 1000-Kilometer-Front +++ Selenskyj verspricht Reform der Einberufungsgesetze +++ Alle Entwicklungen im Liveblog.,https://media1.faz.net/ppmedia/aktuell/3525872618/1.9356783/facebook_teaser/petro-poroschenko-frueherer.jpg,2023-12-02T18:26:01Z,,"Der russische Außenminister Sergej Lawrow hat das OSZE-Treffen einmal mehr dafür genutzt, um der Ukraine die Schuld an dem von Moskau begonnenen Krieg zu geben. Wir sehen weiter keine Signale weder a… [+943 chars]",,de,'Ukraine'
https://www.faz.net/aktuell/wirtschaft/fernwaerme-statt-heizungsstreit-in-daenemark-ist-die-waermewende-geglueckt-19353650.html,https://www.faz.net/aktuell/wirtschaft/fernwaerme-statt-heizungsstreit-in-daenemark-ist-die-waermewende-geglueckt-19353650.html,0,www.faz.net,Wärmewende in Dänemark: Heizen lernen von den Dänen,"Aus Rechenzentren, Kläranlagen oder der Müllverbrennung: Die Dänen nutzen Abwärme schon lange als Heizquelle. 75 Prozent der Fernwärme ist grün – und günstig. Welche Lehren kann Deutschland daraus ziehen? Eine Erkundung.",https://media1.faz.net/ppmedia/aktuell/420571391/1.9353649/facebook_teaser/rohre-mit-zukunft.jpg,2023-12-02T20:31:28Z,https://web.archive.org/web/20231202215430/https://www.faz.net/aktuell/wirtschaft/fernwaerme-statt-heizungsstreit-in-daenemark-ist-die-waermewende-geglueckt-19353650.html,"Wer in Kopenhagen Ski läuft, fährt zum Müllheizkraftwerk. Seit dem Jahr 2017 können Skibegeisterte hier auf 450 Meter Kunstmatten den Amager Bakke herabfahren. Darunter werden bei 1000 Grad 560.000 T… [+3296 chars]",,de,'Heizen'
https://www.bild.de/sport/fussball/fortuna-duesseldorf/fortuna-duesseldorf-vincent-vermeij-erklaert-seine-tor-explosion-86306986.bild.html,https://www.bild.de/sport/fussball/fortuna-duesseldorf/fortuna-duesseldorf-vincent-vermeij-erklaert-seine-tor-explosion-86306986.bild.html,0,www.bild.de,5 Buden in 2 Spielen - VERMEIJ Das steckt hinter meiner Tor-Explosion,"Vincent Vermeij ist bei Fortuna Düsseldorf zum Edel-Knipser geworden. Gegen Schalke 04 traf er doppelt, beim 1. FC Nürnberg machte er einen Hattrick.","https://images.bild.de/656c3ffc37bcc33ccbc60e8d/d23096e23dad40b5be8c501391d59112,f54b581?w=1280",2023-12-03T09:22:01Z,https://web.archive.org/web/20231204050738/https://www.bild.de/sport/fussball/fortuna-duesseldorf/fortuna-duesseldorf-vincent-vermeij-erklaert-seine-tor-explosion-86306986.bild.html,"Plötzlich hat Fortuna Düsseldorf einen Tor-Schädel!
Nachdem Vincent Vermeij (29) schon Schalke (5:3) mit zwei Kopfballtoren versenkte, war er auch bei der Gala in Nürnberg (5:0) der Fortuna-Held. Di… [+2281 chars]",,de,'Explosion'
https://www.zeit.de/news/2023-12/03/bitterer-winter-fuer-die-ukraine-durchbruch-in-weiter-ferne,https://www.zeit.de/news/2023-12/03/bitterer-winter-fuer-die-ukraine-durchbruch-in-weiter-ferne,0,www.zeit.de,Krieg: Bitterer Winter für die Ukraine: Durchbruch in weiter Ferne,Hier finden Sie Informationen zu dem Thema „Krieg“. Lesen Sie jetzt „Bitterer Winter für die Ukraine: Durchbruch in weiter Ferne“.,https://img.zeit.de/news/2023-12/03/bitterer-winter-fuer-die-ukraine-durchbruch-in-weiter-ferne-image-group/wide__1300x731,2023-12-03T09:47:28Z,https://web.archive.org/web/20231203122546/https://www.zeit.de/news/2023-12/03/bitterer-winter-fuer-die-ukraine-durchbruch-in-weiter-ferne,Der ukrainische Versuch einer Gegenoffensive bis weit in das von Russland besetzte Gebiet ist vorerst gescheitert. Ein militärisch wichtiger Durchbruch zum Asowschen Meer - quer durch den von Kreml-T… [+7618 chars],,de,'Putin'
https://www.morgenpost.de/politik/ausland/article240731492/Bitterer-Winter-fuer-die-Ukraine-Durchbruch-in-weiter-Ferne.html,https://www.morgenpost.de/politik/ausland/article240731492/Bitterer-Winter-fuer-die-Ukraine-Durchbruch-in-weiter-Ferne.html,0,www.morgenpost.de,Bitterer Winter für die Ukraine: Durchbruch in weiter Ferne,"Die Ukraine ist unter Druck, in ihrer Führung tun sich Risse auf. Das kann bittere Konsequenzen haben.",https://img.sparknews.funkemedien.de/240731490/240731490_1701597002_v4_3_800.jpeg,2023-12-03T09:47:28Z,https://web.archive.org/web/20231205103608/https://www.morgenpost.de/politik/ausland/article240731492/Bitterer-Winter-fuer-die-Ukraine-Durchbruch-in-weiter-Ferne.html,"Kiew/Berlin. Die Ukraine ist unter Druck, in ihrer Führung tun sich Risse auf. Das kann bittere Konsequenzen haben.
Der ukrainische Versuch einer Gegenoffensive bis weit in das von Russland besetzte… [+6880 chars]",,de,'Explosion'
https://www.zeit.de/news/2023-12/03/messe-muenchen-wieder-geoeffnet,https://www.zeit.de/news/2023-12/03/messe-muenchen-wieder-geoeffnet,0,www.zeit.de,Schnee-Chaos: Messe München wieder geöffnet,Hier finden Sie Informationen zu dem Thema „Schnee-Chaos“. Lesen Sie jetzt „Messe München wieder geöffnet“.,https://img.zeit.de/administratives/sharing/fallback-image/wide__1300x731,2023-12-03T10:07:46Z,https://web.archive.org/web/20231204053933/https://www.zeit.de/news/2023-12/03/messe-muenchen-wieder-geoeffnet,Die Handwerksmesse in München hat nach einer Zwangspause wegen starken Schneefalls am Sonntag wieder für Besucher geöffnet. Einer Sprecherin zufolge gilt das neben der Heim+Handwerk auch für die Mess… [+200 chars],,de,'Schnee'
https://www.bild.de/regional/ruhrgebiet/ruhrgebiet-aktuell/herne-haehnchen-grill-ausgebrannt-mitarbeiter-in-lebensgefahr-86307312.bild.html,https://www.bild.de/regional/ruhrgebiet/ruhrgebiet-aktuell/herne-haehnchen-grill-ausgebrannt-mitarbeiter-in-lebensgefahr-86307312.bild.html,0,www.bild.de,Mitarbeiter in Lebensgefahr - Hähnchen-Grill ausgebrannt,"Auf dem Parkplatz eines Einkaufszentrums fackelte ein Imbisswagen komplett ab. Die Feuerwehr kühlte Gasflaschen, verhinderte eine Explosion.","https://images.bild.de/656c2684834e2f74ccd2039f/ff963da9f9a8899af11a622a78fb2964,2a2c456d?w=1280",2023-12-03T11:35:41Z,,"Herne (NRW) Der Parkplatz am Einkaufszentrum war rappelvoll, hunderte Menschen wurden Zeugen eines dramatischen Brandes. Ein Verkäufer im Hähnchen-Imbiss verlor dabei beinahe sein Leben.
Nachmittags… [+1230 chars]",,de,'Explosion'
https://www.zeit.de/news/2023-12/03/zwei-leichtverletzte-bei-wohnhausbrand-explosion-im-keller,https://www.zeit.de/news/2023-12/03/zwei-leichtverletzte-bei-wohnhausbrand-explosion-im-keller,0,www.zeit.de,Saarlouis: Zwei Leichtverletzte bei Wohnhausbrand: Explosion im Keller,Hier finden Sie Informationen zu dem Thema „Saarlouis“. Lesen Sie jetzt „Zwei Leichtverletzte bei Wohnhausbrand: Explosion im Keller“.,https://img.zeit.de/news/2023-12/03/zwei-leichtverletzte-bei-wohnhausbrand-explosion-im-keller-image-group/wide__1300x731,2023-12-03T12:30:35Z,,"Beim Brand eines Einfamilienhauses in Saarlouis sind zwei Menschen leicht verletzt worden. Die beiden Bewohner von Nachbargrundstücken erlitten eine leichte Rauchgasvergiftung, wie die saarländische … [+639 chars]",,de,'Explosion'
https://www.zeit.de/news/2023-12/03/dieb-hinterlaesst-spuren-im-schnee-und-wird-gestellt,https://www.zeit.de/news/2023-12/03/dieb-hinterlaesst-spuren-im-schnee-und-wird-gestellt,0,www.zeit.de,Zittau: Dieb hinterlässt Spuren im Schnee: Und wird gestellt,Hier finden Sie Informationen zu dem Thema „Zittau“. Lesen Sie jetzt „Dieb hinterlässt Spuren im Schnee: Und wird gestellt“.,https://img.zeit.de/news/2023-12/03/dieb-hinterlaesst-spuren-im-schnee-und-wird-gestellt-image-group/wide__1300x731,2023-12-03T12:47:07Z,https://web.archive.org/web/20231204090535/https://www.zeit.de/news/2023-12/03/dieb-hinterlaesst-spuren-im-schnee-und-wird-gestellt,"Mithilfe seiner Schuhabdrücke im Schnee hat die Polizei in Zittau einen Dieb gefunden und gestellt. Der 41-Jährige war am Samstagabend in eine Grundschule im Landkreis Görlitz eingebrochen, wie die P… [+583 chars]",,de,'Schnee'
https://www.stern.de/politik/ausland/terrorismus--philippinen--tote-bei-explosion-waehrend-katholischer-messe-34253628.html,https://www.stern.de/politik/ausland/terrorismus--philippinen--tote-bei-explosion-waehrend-katholischer-messe-34253628.html,0,www.stern.de,Terrorismus: Philippinen: Tote bei Explosion während katholischer Messe,"Sonntag, Gläubige auf den Philippinen feiern den ersten Advent. Plötzlich kommt es zu einer Explosion. Vier Menschen sterben. Präsident Marcos Jr. spricht von einem terroristischen Akt.",https://image.stern.de/34253630/t/K1/v2/w1440/r1.7778/-/03--urnnewsmldpacom2009010123120399163179v3w800h600l181t599r1461b1449jpeg---0fd259511eda2add.jpg,2023-12-03T14:53:00Z,https://web.archive.org/web/20231203151335/https://www.stern.de/politik/ausland/terrorismus--philippinen--tote-bei-explosion-waehrend-katholischer-messe-34253628.html,"Sonntag, Gläubige auf den Philippinen feiern den ersten Advent. Plötzlich kommt es zu einer Explosion. Vier Menschen sterben. Präsident Marcos Jr. spricht von einem terroristischen Akt.
Bei einer Ex… [+2493 chars]",,de,'Explosion'
