index,url,valid,domain,title,description,image,published,archive,content,quote,language,keyword
https://www.zeit.de/news/2026-03/02/luxuswagen-illegal-nach-russland-verkauft-sechs-jahre-haft,https://www.zeit.de/news/2026-03/02/luxuswagen-illegal-nach-russland-verkauft-sechs-jahre-haft,0,www.zeit.de,Illegale Geschäfte: Luxuswagen illegal nach Russland verkauft - Sechs Jahre Haft,Hier finden Sie Informationen zu dem Thema „Illegale Geschäfte“. Lesen Sie jetzt „Luxuswagen illegal nach Russland verkauft - Sechs Jahre Haft“.,https://img.zeit.de/news/2026-03/02/luxuswagen-illegal-nach-russland-verkauft-sechs-jahre-haft-image-group/wide__1300x731,2026-03-02T12:41:20Z,,"Das Landgericht Würzburg hat einen Autohändler vom Untermain zu sechs Jahren Haft verurteilt, der trotz Verbots Luxusautos nach Russland verkauft haben soll. Eine mutmaßliche Komplizin des 49-Jährige… [+1899 chars]",,de,'Russland'
https://www.n-tv.de/politik/Der-Krieg-im-Iran-ist-ein-strategisches-Geschenk-fuer-Russland-und-China-id30423238.html,https://www.n-tv.de/politik/Der-Krieg-im-Iran-ist-ein-strategisches-Geschenk-fuer-Russland-und-China-id30423238.html,0,www.n-tv.de,"Reisners Blick auf die Front: ""Der Krieg im Iran ist ein strategisches Geschenk für Russland und China""","Mit sechs operativen Manövergruppen halten die Russen den Druck auf die Ukrainer aufrecht. Ergebnisse sehe der Kreml vor allem westlich von Siwersk und Huljajpole, sagt Oberst Reisner. Durch den Krieg im Nahen Osten würde der Druck erhöht - weil Ressourcen kn…",https://www.n-tv.de/img/30423290/1772480066/Img_16_9/1200/RUSSIA-JANUARY-19-2026-A-serviceman-takes-part-in-a-military-training-exercise-held-by-an-engineer-unit-of-the-Russian-Southern-Military-District-based-on-the-experience-gained-in-Russia-s-special-military-operation-Credit-Image-Erik-Romanenko-TASS-via-ZUMA-Press.jpg,2026-03-02T18:56:59Z,,"""Vier Jahre nach Beginn des Krieges kontrolliert die russische Armee derzeit 92.092 Quadratkilometer, was 15,25 Prozent der Ukraine entspricht"", sagt Reisner. (Foto: picture alliance / ZUMAPRESS.com)… [+9478 chars]",,de,'Kälte'
https://www.n-tv.de/politik/21-13-Ukraine-meldet-Befreiung-von-neun-Siedlungen-id30423733.html,https://www.n-tv.de/politik/21-13-Ukraine-meldet-Befreiung-von-neun-Siedlungen-id30423733.html,0,www.n-tv.de,Ukraine-Krieg im Liveticker: +++ 21:13 Ukraine meldet Befreiung von neun Siedlungen +++,"Berlin, Washington, Brüssel - überall. ntv berichtet von allen wichtigen Schauplätzen der Innen- und Außenpolitik.",https://www.n-tv.de/img/2339153/1721988811/Img_16_9/1200/Ukraine-Liveticker.jpg,2026-03-02T21:00:00Z,,Die ukrainischen Streitkräfte haben nach eigenen Angaben im Südosten der Ukraine seit Ende Januar neun Siedlungen zurückerobert und setzen ihren Gegenangriff in Richtung Oleksandrivka fort. Die Befre… [+24845 chars],,de,'Knappheit'
https://www.dw.com/de/die-firma-voltavision-ist-das-groesste-pruefzentrum-fuer-batterien-in-europa/a-76056835,https://www.dw.com/de/die-firma-voltavision-ist-das-groesste-pruefzentrum-fuer-batterien-in-europa/a-76056835,0,www.dw.com,Strom sparen mit Erdkältespeichern,Voltavision in Bochum ist das größte Testlabor für Batterien von E-Autos. In einer Tiefe von 100 Metern entstehen Kältespeicher zur Kühlung der Abluft. Das spart Strom und schont die Umwelt.,https://static.dw.com/image/75785237_6.jpg,2026-03-03T10:21:00Z,,Für alle großen Automobilhersteller führt bei der Entwicklung ihrer elektrisch betriebenen Modelle kein Weg an Bochum vorbei. Mit Voltavision befindet sich schließlich das europaweit größte Labor für… [+5307 chars],,de,'Kälte'
https://www.whudat.de/kindheitstrauma-ueberwinden-eckhart-tolle-ueber-das-aufwachsen-im-chaos/,https://www.whudat.de/kindheitstrauma-ueberwinden-eckhart-tolle-ueber-das-aufwachsen-im-chaos/,0,www.whudat.de,Kindheitstrauma überwinden: Eckhart Tolle über das Aufwachsen im Chaos,"Viele Menschen tragen eine schwere Last aus ihrer Kindheit mit sich herum. Diese Last besteht oft aus Erinnerungen an Streit, emotionale Kälte oder ein völlig unberechenbares Umfeld. Der spirituelle Lehrer Eckhart Tolle widmet sich in seinem Vortrag „Kindheit…",https://www.whudat.de/images/2026/03/Kindheitstrauma-Eckhart-Tolle-BB.jpg,2026-03-03T15:07:53Z,,"Viele Menschen tragen eine schwere Last aus ihrer Kindheit mit sich herum. Diese Last besteht oft aus Erinnerungen an Streit, emotionale Kälte oder ein völlig unberechenbares Umfeld. Der spirituelle … [+4462 chars]",,de,'Kälte'
https://www.bild.de/news/wetter/der-fruehling-bekommt-eine-temperatur-delle-wo-die-kaelte-herkommt-69a6da696834877765da827c,https://www.bild.de/news/wetter/der-fruehling-bekommt-eine-temperatur-delle-wo-die-kaelte-herkommt-69a6da696834877765da827c,0,www.bild.de,Wo die Kälte herkommt - Der Frühling bekommt eine Temperatur-Delle,Eine kleine Bewegung öffnet das Tor einen Spalt: für einen eisigen Hauch. Mit Folgen für das Wetter in Deutschland.,"https://images.bild.de/69a6da696834877765da827c/f7d6c5e14f23ebddbfe82600ea913e34,e00a6e01?w=1280",2026-03-04T04:55:41Z,,TTS-Player überspringenArtikel weiterlesenWetter-Hoch Jannis sorgt weiterhin für Heiterkeit. Aber nicht überall ist das Frühlingswetter so stabil wie an den letzten Tagen. Eine kleine Bewegung in Nor… [+3059 chars],,de,'Kälte'
