index,url,valid,domain,title,description,image,published,archive,content,quote,language,keyword
https://www.telepolis.de/features/Was-hat-ein-Fussball-Laenderspiel-mit-toten-Kindern-in-Kolumbien-zu-tun-9194701.html,https://www.telepolis.de/features/Was-hat-ein-Fussball-Laenderspiel-mit-toten-Kindern-in-Kolumbien-zu-tun-9194701.html,0,www.telepolis.de,Was hat ein Fußball-Länderspiel mit toten Kindern in Kolumbien zu tun?,"Energie und Klima – kompakt: Aktivisten wollten sich an ein Tor binden, das Spiel wurde unterbrochen. Der Grund: Die Bundesregierung hat einen fatalen Kohle-Deal mit Kolumbien geschlossen. Wer den Preis zahlt.",https://heise.cloudimg.io/bound/1200x1200/q85.png-lossy-85.webp-lossy-85.foil1/_www-heise-de_/imgs/18/4/2/5/9/4/5/3/Protest_Stadion-a691936d73f0890d.jpeg,2023-06-22T09:00:00Z,https://web.archive.org/web/20230622093703/https://www.telepolis.de/features/Was-hat-ein-Fussball-Laenderspiel-mit-toten-Kindern-in-Kolumbien-zu-tun-9194701.html,"Zwei Aktivisten der Letzten Generation wollten sich aus Protest an ein Tor während des Länderspiels Deutschland gegen Kolumbien festbinden. Sie wurden abgeführt. Bild: Letzte Generation
Energie und … [+3092 chars]",,de,'Kohle'
https://consent.google.com/ml?continue=https://news.google.com/rss/articles/CBMiiwFodHRwczovL3d3dy5zdGVybi5kZS9saWZlc3R5bGUvbGV1dGUvZnJhdS12b24ta2V2aW4tY29zdG5lci1mb3JkZXJ0LWZhc3QtMjUwLTAwMC1kb2xsYXItdW50ZXJoYWx0LWZ1ZXItZGllLWtpbmRlci0tLXByby1tb25hdC0zMzU4MjEyNi5odG1s0gGPAWh0dHBzOi8vd3d3LnN0ZXJuLmRlL2FtcC9saWZlc3R5bGUvbGV1dGUvZnJhdS12b24ta2V2aW4tY29zdG5lci1mb3JkZXJ0LWZhc3QtMjUwLTAwMC1kb2xsYXItdW50ZXJoYWx0LWZ1ZXItZGllLWtpbmRlci0tLXByby1tb25hdC0zMzU4MjEyNi5odG1s?oc%3D5&gl=FR&hl=en-US&cm=2&pc=n&src=1,https://consent.google.com/ml?continue=https://news.google.com/rss/articles/CBMiiwFodHRwczovL3d3dy5zdGVybi5kZS9saWZlc3R5bGUvbGV1dGUvZnJhdS12b24ta2V2aW4tY29zdG5lci1mb3JkZXJ0LWZhc3QtMjUwLTAwMC1kb2xsYXItdW50ZXJoYWx0LWZ1ZXItZGllLWtpbmRlci0tLXByby1tb25hdC0zMzU4MjEyNi5odG1s0gGPAWh0dHBzOi8vd3d3LnN0ZXJuLmRlL2FtcC9saWZlc3R5bGUvbGV1dGUvZnJhdS12b24ta2V2aW4tY29zdG5lci1mb3JkZXJ0LWZhc3QtMjUwLTAwMC1kb2xsYXItdW50ZXJoYWx0LWZ1ZXItZGllLWtpbmRlci0tLXByby1tb25hdC0zMzU4MjEyNi5odG1s?oc%3D5&gl=FR&hl=en-US&cm=2&pc=n&src=1,0,consent.google.com,Frau von Kevin Costner fordert fast 250.000 Dollar Unterhalt für die Kinder – pro Monat - STERN.de,"<ol><li>Frau von Kevin Costner fordert fast 250.000 Dollar Unterhalt für die Kinder – pro Monat  STERN.de
</li><li>Kevin Costner: Noch-Ehefrau will WIE VIEL Kohle pro Monat?! | Unterhaltung  BILD
</li><li>Kevin Costner: Christine Baumgartner soll Unterhalt …",,2023-06-22T10:40:00Z,,"We use cookies and data to<ul><li>Deliver and maintain Google services</li><li>Track outages and protect against spam, fraud, and abuse</li><li>Measure audience engagement and site statistics to unde… [+1131 chars]",,de,'Kohle'
https://www.bild.de/unterhaltung/leute/leute/kevin-costner-noch-ehefrau-will-wie-viel-kohle-pro-monat-84419200.bild.html,https://www.bild.de/unterhaltung/leute/leute/kevin-costner-noch-ehefrau-will-wie-viel-kohle-pro-monat-84419200.bild.html,0,www.bild.de,Schmutzige Scheidung bei Kevin Costner - Noch-Ehefrau will WIE VIEL Kohle pro Monat?!,"Brisante Gerichtsunterlagen, heftige Vorwürfe – alles zur Hollywood-Schlammschlacht zwischen Kino-Star Kevin Costner und Noch-Frau Christine Baumgartner.","https://images.bild.de/6493f723358fca06e5b5d234/81692f5fe9b99e045c33d768cdaffc84,af6db75b?w=1280",2023-06-22T11:26:56Z,,"Diese Unterhaltsforderung ist echt DRÜBER!
Sie liefern sich aktuell den wohl brisantesten Rosenkrieg Hollywoods: Kino-Star Kevin Costner (68) und seine Noch-Ehefrau Christine Baumgartner (49). Nach … [+4837 chars]",,de,'Kohle'
https://www.welt.de/wirtschaft/plus245921000/Antibiotika-Die-letzte-Penicillin-Fabrik-des-Westens.html,https://www.welt.de/wirtschaft/plus245921000/Antibiotika-Die-letzte-Penicillin-Fabrik-des-Westens.html,0,www.welt.de,Die letzte Penicillin-Fabrik des Westens,"Bei rund 500 Medikamenten herrschen derzeit Lieferengpässe, auch bei Penicillin. Jede zweite Schachtel des Wirkstoffs in Europa stammt direkt oder indirekt aus einer Fabrik in der Tiroler Gemeinde Kundl. Die Ursachen für die derzeitige Knappheit werden hier b…",https://img.welt.de/img/wirtschaft/mobile246007702/5601358267-ci16x9-w1200-fnov-fpotl-fpi157750653/Sandoz-das-letzte-Penicilin-Werk-der-w-14.jpg,2023-06-22T13:13:51Z,https://web.archive.org/web/20230623125054/https://www.welt.de/wirtschaft/plus245921000/Antibiotika-Die-letzte-Penicillin-Fabrik-des-Westens.html,Die Probleme des Penicillin-Werks im österreichischen Kundl sind groß: Nicht nur die Kosten für die Rohstoffe sind die Höhe geschnellt. Auch die Energiekosten für die Produktion haben sich rasant ver… [+239 chars],,de,'Knappheit'
https://www.faz.net/aktuell/finanzen/der-euro-schlaegt-sich-tapfer-trotz-krieg-und-inflation-18979895.html,https://www.faz.net/aktuell/finanzen/der-euro-schlaegt-sich-tapfer-trotz-krieg-und-inflation-18979895.html,0,www.faz.net,Der Euro schlägt sich tapfer - trotz Krieg und Inflation,International bleibt der Euro die Nummer zwei unter den Währungen. Im vorigen Jahr stieg die Bargeldnachfrage plötzlich. Und auch bei den Währungsreserven gibt es bemerkenswerte Veränderungen.,https://media1.faz.net/ppmedia/aktuell/finanzen/2325242070/1.8980221/facebook_teaser/euro.jpg,2023-06-22T13:59:02Z,http://archive.md/20230622141257/https://www.faz.net/aktuell/finanzen/der-euro-schlaegt-sich-tapfer-trotz-krieg-und-inflation-18979895.html,Der Euro hat seinen internationalen Marktanteil unter den Währungen der Welt mit rund 20 Prozent im vergangenen Jahr weitgehend behauptet. Obwohl mit dem Ukrainekrieg ein geopolitisches Drama unmitte… [+4857 chars],,de,'Inflation'
https://www.zeit.de/politik/ausland/2023-06/ukraine-ueberblick-krim-bruecke-anschlag-akw,https://www.zeit.de/politik/ausland/2023-06/ukraine-ueberblick-krim-bruecke-anschlag-akw,0,www.zeit.de,"Ukraine-Überblick: Krim-Brücke bei Angriff beschädigt, Selenskyj warnt vor Anschlag","Nach russischen Angaben hat die Ukraine eine wichtige Brücke zur Halbinsel Krim beschädigt. Russland erwäge einen Terrorakt aufs AKW, warnt Wolodymyr Selenskyj. Der Tag",,2023-06-22T15:21:37Z,http://archive.md/20230622162703/https://www.zeit.de/politik/ausland/2023-06/ukraine-ueberblick-krim-bruecke-anschlag-akw,"When browsing with ads:
We collect personal data and also transmit it to third-party providers
 that help us improve and finance our digital content. Some of the information stored on your device, … [+821 chars]",,de,'Russland'
https://www.tagesspiegel.de/wirtschaft/mobilitaet/elektrisch-unterm-gasspeicher-den-opel-astra-gibt-es-als-verbrenner-plug-in--und-nun-auch-als-reinen-stromer-10030699.html,https://www.tagesspiegel.de/wirtschaft/mobilitaet/elektrisch-unterm-gasspeicher-den-opel-astra-gibt-es-als-verbrenner-plug-in--und-nun-auch-als-reinen-stromer-10030699.html,0,www.tagesspiegel.de,"Elektrisch unterm Gasspeicher: Den Opel Astra gibt es als Verbrenner, Plug-in – und nun auch als reinen Stromer","Einen klassischen Kühler hat der E-Astra nicht mehr, der Kühlergrill aber ist ihm geblieben. Traditionsbewussten Liebhabern des Modells hilft das beim Umstieg auf die neue Technik.",https://www.tagesspiegel.de/images/opel-astra-electric1/alternates/BASE_16_9_W1400/opel-astra-electric.jpeg,2023-06-22T16:15:14Z,https://web.archive.org/web/20230622200909/https://www.tagesspiegel.de/wirtschaft/mobilitaet/elektrisch-unterm-gasspeicher-den-opel-astra-gibt-es-als-verbrenner-plug-in--und-nun-auch-als-reinen-stromer-10030699.html,"Die sicherste Methode, einen vorbeirollenden vollelektrischen Opel Astra als solchen zu identifizieren, besteht darin, ihm hinterherzufahren. Eigentlich ist es auch die einzige. Das E im Kennzeichen … [+7601 chars]",,de,'Gasspeicher'
https://www.bild.de/regional/koeln/koeln-leute/playmate-christina-wie-ich-mit-meinen-tretern-richtig-kohle-mache-84426254.bild.html,https://www.bild.de/regional/koeln/koeln-leute/playmate-christina-wie-ich-mit-meinen-tretern-richtig-kohle-mache-84426254.bild.html,0,www.bild.de,Playmate Christina (33) - Wie ich mit meinen Tretern richtig Kohle mache,Manche Fans haben nur Augen für ihre sexy Sohlen!Foto: Markus Zielke,"https://images.bild.de/649447f702e2df1f89d31aee/b5d393705c124ebf7e389bcd31848fb1,b56260e6?w=1280",2023-06-22T16:33:20Z,https://web.archive.org/web/20230622223104/https://www.bild.de/regional/koeln/koeln-leute/playmate-christina-wie-ich-mit-meinen-tretern-richtig-kohle-mache-84426254.bild.html,"Köln (NRW) Playmate Christina Braun (33) ist bekannt für sinnliche Fotos. Doch manche Fans haben nur Augen für eins: ihre sexy Sohlen und für die drücken sie beim Model richtig Geld ab.
Es fing kürz… [+1936 chars]",,de,'Kohle'
https://www.zeit.de/politik/ausland/2023-06/grossbritannien-hypotheken-leitzins-bank-of-england,https://www.zeit.de/politik/ausland/2023-06/grossbritannien-hypotheken-leitzins-bank-of-england,0,www.zeit.de,Hypotheken in Großbritannien: Millionen Haushalten steht der Schreck noch bevor,"Um die hohe Inflation in den Griff zu bekommen, hat die Bank of England den Leitzins angehoben. Für die vielen hoch verschuldeten Immobilienkäufer wird das Leben teuer.",,2023-06-22T17:30:16Z,http://archive.md/20230622173825/https://www.zeit.de/politik/ausland/2023-06/grossbritannien-hypotheken-leitzins-bank-of-england,"When browsing with ads:
We collect personal data and also transmit it to third-party providers
 that help us improve and finance our digital content. Some of the information stored on your device, … [+821 chars]",,de,'Teuer'
https://www.faz.net/aktuell/wirtschaft/wohnen/heizen-mit-holz-so-gesundheitsschaedlich-sind-rauchgase-aus-dem-holzofen-18983124.html,https://www.faz.net/aktuell/wirtschaft/wohnen/heizen-mit-holz-so-gesundheitsschaedlich-sind-rauchgase-aus-dem-holzofen-18983124.html,0,www.faz.net,Schädliche Rauchgase: Heizen mit Holz ist ein Holzweg,"Die Regierung gibt Holzheizungen Rückenwind. Doch gesundheitsschädliche Holzofen-Rauchgase verunreinigen die Atemluft, warnt Partikelforscher Achim Dittler. Ein Gastbeitrag.",https://media1.faz.net/ppmedia/aktuell/2424720906/1.8983121/facebook_teaser_fplus/heizen-mit-folgen-holzpellets.jpg,2023-06-22T18:26:20Z,,Heizen mit Holz ist ein komplexes Thema mit vielen Facetten. Neben der Psychologie und der Wahrnehmung als gemütliche andere Wärme zählen zu den wesentlichen Aspekten die Herkunft und Verfügbarkeit d… [+934 chars],,de,'Heizen'
https://www.n-tv.de/politik/Kretschmer-fordert-Reparatur-von-Nord-Stream-1-article24211748.html,https://www.n-tv.de/politik/Kretschmer-fordert-Reparatur-von-Nord-Stream-1-article24211748.html,0,www.n-tv.de,"""Nichts spricht dagegen"": Kretschmer fordert Reparatur von Nord Stream 1",Vor dem russischen Angriff auf die Ukraine kämpfte Sachsens Ministerpräsident für die Inbetriebnahme der umstrittenen Nord Stream 2. Nach der Sprengung beider Gaspipelines im September verlangt Kretschmer nun die Reparatur von Nord Stream 1. Da sollten wir je…,https://bilder2.n-tv.de/img/incoming/crop24211757/8011323277-cImg_16_9-w1200/414141289.jpg,2023-06-22T19:30:52Z,https://web.archive.org/web/20230622224454/https://www.n-tv.de/politik/Kretschmer-fordert-Reparatur-von-Nord-Stream-1-article24211748.html,Vor dem russischen Angriff auf die Ukraine kämpfte Sachsens Ministerpräsident für die Inbetriebnahme der umstrittenen Nord Stream 2. Nach der Sprengung beider Gaspipelines im September verlangt Krets… [+3153 chars],,de,'Ukraine'
https://www.n-tv.de/politik/22-30-Selenskyj-zieht-Konsequenz-aus-Korruption-beim-eigenen-Militaer--article23143824.html,https://www.n-tv.de/politik/22-30-Selenskyj-zieht-Konsequenz-aus-Korruption-beim-eigenen-Militaer--article23143824.html,0,www.n-tv.de,Ukraine-Krieg im Liveticker: +++ 22:30 Selenskyj zieht Konsequenz aus Korruption beim eigenen Militär +++,"Berlin, Washington, Br\u00fcssel - \u00fcberall. n-tv berichtet von allen wichtigen Schaupl\u00e4tzen der Innen- und Au\u00dfenpolitik.",https://bilder2.n-tv.de/img/incoming/crop23332537/9041326157-cImg_16_9-w1200/Liveticker1-grau-1-Kopie.jpg,2023-06-22T22:15:00Z,,"Der ukrainische Präsident Wolodymyr Selenskyj zieht nach einem Bericht über einen Korruptionsskandal beim eigenen Militär Konsequenzen. Nachdem die ""Ukrajinska Prawda"" über einen ranghohen Kreiswehre… [+32046 chars]",,de,'Ukraine'
https://www.n-tv.de/politik/17-43-Selenskyj-Grosser-Teil-der-Schutzbunker-ist-unbenutzbar--article23143824.html,https://www.n-tv.de/politik/17-43-Selenskyj-Grosser-Teil-der-Schutzbunker-ist-unbenutzbar--article23143824.html,0,www.n-tv.de,Ukraine-Krieg im Liveticker: +++ 17:43 Selenskyj: Großer Teil der Schutzbunker ist unbenutzbar +++,"Berlin, Washington, Br\u00fcssel - \u00fcberall. n-tv berichtet von allen wichtigen Schaupl\u00e4tzen der Innen- und Au\u00dfenpolitik.",https://bilder2.n-tv.de/img/incoming/crop23332537/9041326157-cImg_16_9-w1200/Liveticker1-grau-1-Kopie.jpg,2023-06-22T22:15:00Z,,Der ukrainische Präsident Wolodymyr Selenskyj kündigt Konsequenzen aus gravierenden Mängeln bei der Bereitstellung von Schutzräumen bei Luftangriffen an. Ein Viertel der Schutzbunker in der Ukraine u… [+23691 chars],,de,'Ukraine'
https://www.n-tv.de/politik/09-44-ntv-Reporter-Hinter-Putins-Geduld-mit-Prigoschin-steckt-womoeglich-Kalkuel--article23143824.html,https://www.n-tv.de/politik/09-44-ntv-Reporter-Hinter-Putins-Geduld-mit-Prigoschin-steckt-womoeglich-Kalkuel--article23143824.html,0,www.n-tv.de,Ukraine-Krieg im Liveticker: +++ 09:44 ntv-Reporter: Hinter Putins Geduld mit Prigoschin steckt womöglich Kalkül +++,"Berlin, Washington, Br\u00fcssel - \u00fcberall. n-tv berichtet von allen wichtigen Schaupl\u00e4tzen der Innen- und Au\u00dfenpolitik.",https://bilder2.n-tv.de/img/incoming/crop23332537/9041326157-cImg_16_9-w1200/Liveticker1-grau-1-Kopie.jpg,2023-06-22T22:15:00Z,,"Wagner-Chef Prigoschin wettert immer wieder wüst über die russische Armeeführung. Dass er das ungestraft tut, könnte vonseiten Putins einem Kalkül folgen, wie ntv-Korrespondent Rainer Munz erklärt. D… [+10845 chars]",,de,'Ukraine'
https://www.n-tv.de/politik/15-46-Moskau-sagt-wichtige-Flugshow-ab--article23143824.html,https://www.n-tv.de/politik/15-46-Moskau-sagt-wichtige-Flugshow-ab--article23143824.html,0,www.n-tv.de,Ukraine-Krieg im Liveticker: +++ 15:46 Moskau sagt wichtige Flugshow ab +++,"Berlin, Washington, Br\u00fcssel - \u00fcberall. n-tv berichtet von allen wichtigen Schaupl\u00e4tzen der Innen- und Au\u00dfenpolitik.",https://bilder2.n-tv.de/img/incoming/crop23332537/9041326157-cImg_16_9-w1200/Liveticker1-grau-1-Kopie.jpg,2023-06-22T22:15:00Z,,"Die ""Moskau Air Show"" wird in diesem Jahr offenbar nicht stattfinden. Die Luftfahrtausstellung ist seit Jahrzehnten eine wichtige Veranstaltung zur Präsentation neuer Kampfflugzeuge und zur Aushandlu… [+20245 chars]",,de,'Putin'
https://www.n-tv.de/politik/17-12-Ukrainische-Armee-Hauptkraefte-noch-nicht-gegen-Russen-eingesetzt--article23143824.html,https://www.n-tv.de/politik/17-12-Ukrainische-Armee-Hauptkraefte-noch-nicht-gegen-Russen-eingesetzt--article23143824.html,0,www.n-tv.de,Ukraine-Krieg im Liveticker: +++ 17:12 Ukrainische Armee: Hauptkräfte noch nicht gegen Russen eingesetzt +++,"Berlin, Washington, Br\u00fcssel - \u00fcberall. n-tv berichtet von allen wichtigen Schaupl\u00e4tzen der Innen- und Au\u00dfenpolitik.",https://bilder2.n-tv.de/img/incoming/crop23332537/9041326157-cImg_16_9-w1200/Liveticker1-grau-1-Kopie.jpg,2023-06-22T22:15:00Z,,"Im Rahmen ihrer Gegenoffensive steckt die ukrainische Armee nach eigenen Angaben weiter in der Abtastphase und hat die Hauptkräfte noch nicht eingesetzt. ""Jeder will augenblicklich und sofort einen g… [+23018 chars]",,de,'Putin'
https://www.n-tv.de/politik/11-35-Gouverneur-Tote-nach-russischem-Angriff-auf-Cherson--article23143824.html,https://www.n-tv.de/politik/11-35-Gouverneur-Tote-nach-russischem-Angriff-auf-Cherson--article23143824.html,0,www.n-tv.de,Ukraine-Krieg im Liveticker: +++ 11:35 Gouverneur: Tote nach russischem Angriff auf Cherson +++,"Berlin, Washington, Br\u00fcssel - \u00fcberall. n-tv berichtet von allen wichtigen Schaupl\u00e4tzen der Innen- und Au\u00dfenpolitik.",https://bilder2.n-tv.de/img/incoming/crop23332537/9041326157-cImg_16_9-w1200/Liveticker1-grau-1-Kopie.jpg,2023-06-22T22:15:00Z,,Bei einem russischen Angriff auf die südukrainische Regionalhauptstadt Cherson sind nach Behördenangaben mindestens zwei Menschen getötet worden. Ein städtisches Transportunternehmen sei bei dem Besc… [+14440 chars],,de,'Putin'
https://www.n-tv.de/politik/21-12-Prigoschin-wirft-russischer-Armee-Angriff-auf-Wagner-Gruppe-vor--article23143824.html,https://www.n-tv.de/politik/21-12-Prigoschin-wirft-russischer-Armee-Angriff-auf-Wagner-Gruppe-vor--article23143824.html,0,www.n-tv.de,Ukraine-Krieg im Liveticker: +++ 21:12 Prigoschin wirft russischer Armee Angriff auf Wagner-Gruppe vor +++,"Berlin, Washington, Br\u00fcssel - \u00fcberall. n-tv berichtet von allen wichtigen Schaupl\u00e4tzen der Innen- und Au\u00dfenpolitik.",https://bilder2.n-tv.de/img/incoming/crop23332537/9041326157-cImg_16_9-w1200/Liveticker1-grau-1-Kopie.jpg,2023-06-22T22:15:00Z,,"Der Chef der russischen Söldnergruppe Wagner wirft der russischen Militärführung vor, seine Truppen bombardiert zu haben. Durch die Angriffe sei eine ""sehr große"" Zahl an Wagner-Söldnern getötet word… [+29896 chars]",,de,'Ukraine'
https://www.n-tv.de/politik/19-53-Bericht-Russen-errichten-provisorische-Bruecke-zur-Krim--article23143824.html,https://www.n-tv.de/politik/19-53-Bericht-Russen-errichten-provisorische-Bruecke-zur-Krim--article23143824.html,0,www.n-tv.de,"Ukraine-Krieg im Liveticker: +++ 19:31 Russland: Tschonhar-Brücke ""stärker beschädigt, als wir zunächst dachten"" +++","Berlin, Washington, Br\u00fcssel - \u00fcberall. n-tv berichtet von allen wichtigen Schaupl\u00e4tzen der Innen- und Au\u00dfenpolitik.",https://bilder2.n-tv.de/img/incoming/crop23332537/9041326157-cImg_16_9-w1200/Liveticker1-grau-1-Kopie.jpg,2023-06-22T22:15:00Z,,Nach der Beschädigung der wichtigen Tschonhar-Brücke vom ukrainischen Festland zur Halbinsel Krim durch Kiews Militär soll Russland dort laut Medienberichten einen Ponton-Übergang errichtet haben. Ei… [+27233 chars],,de,'Putin'
https://www.n-tv.de/politik/14-52-Selenskyj-Sprecher-Schlachtfeld-fuer-groessere-Kaempfe-wird-vorbereitet--article23143824.html,https://www.n-tv.de/politik/14-52-Selenskyj-Sprecher-Schlachtfeld-fuer-groessere-Kaempfe-wird-vorbereitet--article23143824.html,0,www.n-tv.de,"Ukraine-Krieg im Liveticker: +++ 14:52 Selenskyj-Sprecher: ""Schlachtfeld"" für größere Kämpfe wird vorbereitet +++","Berlin, Washington, Br\u00fcssel - \u00fcberall. n-tv berichtet von allen wichtigen Schaupl\u00e4tzen der Innen- und Au\u00dfenpolitik.",https://bilder2.n-tv.de/img/incoming/crop23332537/9041326157-cImg_16_9-w1200/Liveticker1-grau-1-Kopie.jpg,2023-06-22T22:15:00Z,,"Mychailo Podoljak, Sprecher des ukrainischen Präsidenten Wolodymyr Selenskyj, mahnt auf Twitter zur Geduld bei der ukrainischen Gegenoffensive. ""Ein echter Krieg ist kein Hollywood-Blockbuster. Die G… [+19086 chars]",,de,'Ukraine'
https://www.n-tv.de/politik/20-15-Ukraine-meldet-Angriff-auf-Stuetzpunkt-der-russischen-Nationalgarde-in-Cherson--article23143824.html,https://www.n-tv.de/politik/20-15-Ukraine-meldet-Angriff-auf-Stuetzpunkt-der-russischen-Nationalgarde-in-Cherson--article23143824.html,0,www.n-tv.de,Ukraine-Krieg im Liveticker: +++ 20:15 Ukraine meldet Angriff auf Stützpunkt der russischen Nationalgarde in Cherson +++,"Berlin, Washington, Br\u00fcssel - \u00fcberall. n-tv berichtet von allen wichtigen Schaupl\u00e4tzen der Innen- und Au\u00dfenpolitik.",https://bilder2.n-tv.de/img/incoming/crop23332537/9041326157-cImg_16_9-w1200/Liveticker1-grau-1-Kopie.jpg,2023-06-22T22:15:00Z,,"Eigenen Angaben zufolge haben die ukrainischen Streitkräfte einen Stützpunkt der russischen Nationalgarde in der besetzten Stadt Henitschesk in der Region Cherson getroffen. ""Stützpunkt der russische… [+28027 chars]",,de,'Putin'
https://www.n-tv.de/politik/08-52-FSB-verhindert-angeblich-Atommaterial-Schmuggel-eines-Ukrainers--article23143824.html,https://www.n-tv.de/politik/08-52-FSB-verhindert-angeblich-Atommaterial-Schmuggel-eines-Ukrainers--article23143824.html,0,www.n-tv.de,Ukraine-Krieg im Liveticker: +++ 08:52 FSB verhindert angeblich Atommaterial-Schmuggel eines Ukrainers +++,"Berlin, Washington, Br\u00fcssel - \u00fcberall. n-tv berichtet von allen wichtigen Schaupl\u00e4tzen der Innen- und Au\u00dfenpolitik.",https://bilder2.n-tv.de/img/incoming/crop23332537/9041326157-cImg_16_9-w1200/Liveticker1-grau-1-Kopie.jpg,2023-06-22T22:15:00Z,,"Der russische Inlandsgeheimdienst FSB hat nach eigenen Angaben einen Schmuggel von radioaktivem Material an einen ukrainischen Auftraggeber vereitelt. Es seien fünf Personen festgenommen worden, die … [+10061 chars]",,de,'Ukraine'
https://www.n-tv.de/politik/23-39-Video-soll-Militaerfahrzeuge-auf-Moskaus-Strassen-zeigen--article23143824.html,https://www.n-tv.de/politik/23-39-Video-soll-Militaerfahrzeuge-auf-Moskaus-Strassen-zeigen--article23143824.html,0,www.n-tv.de,Ukraine-Krieg im Liveticker: +++ 23:39 Video soll Militärfahrzeuge auf Moskaus Straßen zeigen +++,"Berlin, Washington, Br\u00fcssel - \u00fcberall. n-tv berichtet von allen wichtigen Schaupl\u00e4tzen der Innen- und Au\u00dfenpolitik.",https://bilder2.n-tv.de/img/incoming/crop23332537/9041326157-cImg_16_9-w1200/Liveticker1-grau-1-Kopie.jpg,2023-06-22T22:15:00Z,,"Russische Medien berichten dem ""Kyiv Indipendent"" zufolge, dass die Polizei in mehreren Regionen Russlands in höchste Alarmbereitschaft versetzt worden sei. In Rostow am Don nahe der ukrainischen Gre… [+32481 chars]",,de,'Putin'
https://www.n-tv.de/politik/21-45-Insider-Deutschland-will-60-Boeing-Hubschrauber-kaufen--article23143824.html,https://www.n-tv.de/politik/21-45-Insider-Deutschland-will-60-Boeing-Hubschrauber-kaufen--article23143824.html,0,www.n-tv.de,Ukraine-Krieg im Liveticker: +++ 21:45 Insider: Deutschland will 60 Boeing-Hubschrauber kaufen +++,"Berlin, Washington, Br\u00fcssel - \u00fcberall. n-tv berichtet von allen wichtigen Schaupl\u00e4tzen der Innen- und Au\u00dfenpolitik.",https://bilder2.n-tv.de/img/incoming/crop23332537/9041326157-cImg_16_9-w1200/Liveticker1-grau-1-Kopie.jpg,2023-06-22T22:15:00Z,,"Deutschland will Insider-Informationen zufolge 60 Chinook-Hubschrauber von Boeing kaufen. Das Paket einschließlich Infrastruktur werde bis zu acht Milliarden Euro kosten, berichtet eine mit der Sache… [+30360 chars]",,de,'Ukraine'
https://www.freitag.de/autoren/nik-afanasjew/ukraine-freiwillige-helfer-wie-leopold-lysogorski-aus-berlin-sind-unverzichtbar,https://www.freitag.de/autoren/nik-afanasjew/ukraine-freiwillige-helfer-wie-leopold-lysogorski-aus-berlin-sind-unverzichtbar,0,www.freitag.de,Reportage | Ukraine: Leopold Lysogorski aus Berlin bringt Hilfsgüter unter hohem Risiko in den Donbas,"Von Berlin nach Bachmut: Babynahrung, Milchpulver, Medikamente, Einweghandschuhe und schusssichere Westen sind Teil seiner Fracht. Zwei Wochen kann die Fahrt von Leopold Lysogorski dauern – manchmal auch länger Zwei Männer entladen in einer Kyiver Autowerksta…",https://www.freitag.de/autoren/nik-afanasjew/ukraine-freiwillige-helfer-wie-leopold-lysogorski-aus-berlin-sind-unverzichtbar/@@images/social_image,2023-06-23T02:00:00Z,https://web.archive.org/web/20230623022417/https://www.freitag.de/autoren/nik-afanasjew/ukraine-freiwillige-helfer-wie-leopold-lysogorski-aus-berlin-sind-unverzichtbar,"Zwei Männer entladen in einer Kyiver Autowerkstatt einen Geländewagen. Einer der beiden holt ein Fußkreuz aus einem vollgestopften Kofferraum, schwarz, mit fünf Armen und daran befestigten Rollen. Ge… [+484 chars]",,de,'Ukraine'
https://www.handelsblatt.com/politik/international/liveblog-zum-ukraine-krieg-selenski-fordert-russischen-abzug-aus-suedukrainischem-akw-kiew-offensive-schreitet-in-suedukraine-voran/27982126.html,https://www.handelsblatt.com/politik/international/liveblog-zum-ukraine-krieg-selenski-fordert-russischen-abzug-aus-suedukrainischem-akw-kiew-offensive-schreitet-in-suedukraine-voran/27982126.html,0,www.handelsblatt.com,+++ Ukraine-Krieg +++: Selenski fordert russischen Abzug aus südukrainischem AKW – Kiew: Offensive schreitet in Südukraine voran,Ukraine: Russland versteckt Leichen des Dammbruchs +++ Sachsens Ministerpräsident fordert umgehende Reparatur von Nord Stream 1 +++ UN-Bericht: Russland für Tötung von 136 Kindern verantwortlich +++ Der Newsblog.,https://www.handelsblatt.com/images/internationale-konferenz-zum-wiederaufbau-der-ukraine/29222968/2-format2003.jpg,2023-06-23T02:59:00Z,https://web.archive.org/web/20230623032110/https://www.handelsblatt.com/politik/international/liveblog-zum-ukraine-krieg-selenski-fordert-russischen-abzug-aus-suedukrainischem-akw-kiew-offensive-schreitet-in-suedukraine-voran/27982126.html,"<li>Frau Susanne Heitzler22.06.2023, 10:58 Uhr
""Der Planet hat andere Probleme zu lösen""... ja, damit könnte man auch den Ukraine - Konflikt relativieren.Unisono wird verkündet, dass Kriege nur durc… [+7852 chars]",,de,'Putin'
