index,url,valid,domain,title,description,image,published,archive,content,quote,language,keyword
https://www.stern.de/gesellschaft/regional/bayern/wetter--regnerische-feiertage-und-schnee-in-den-bayerischen-alpen-33354314.html,https://www.stern.de/gesellschaft/regional/bayern/wetter--regnerische-feiertage-und-schnee-in-den-bayerischen-alpen-33354314.html,0,www.stern.de,Wetter: Regnerische Feiertage und Schnee in den bayerischen Alpen,"Das verlängerte Osterwochenende wird in den meisten Teilen Bayerns bewölkt und regnerisch. Oberhalb von 1000 Metern Höhe soll es bis zum Sonntag immer wieder zeitweise schneien, wie der Deutsche Wetterdienst (DWD) am Donnerstag mitteilte.",https://image.stern.de/33354316/t/BE/v1/w1440/r1.7778/-/06--urnnewsmldpacom2009010123040699232208v2w800h600l664t286r1552b1084jpeg---03d8a1ebbb7dc5db.jpg,2023-04-06T09:53:30Z,,"Das verlängerte Osterwochenende wird in den meisten Teilen Bayerns bewölkt und regnerisch. Oberhalb von 1000 Metern Höhe soll es bis zum Sonntag immer wieder zeitweise schneien, wie der Deutsche Wett… [+1047 chars]",,de,'Schnee'
https://www.zeit.de/video/2023-04/6324072454112/china-emmanuel-macron-und-ursula-von-der-leyen-treffen-xi-jinping,https://www.zeit.de/video/2023-04/6324072454112/china-emmanuel-macron-und-ursula-von-der-leyen-treffen-xi-jinping,0,www.zeit.de,China: Emmanuel Macron und Ursula von der Leyen treffen Xi Jinping,Frankreichs Präsident und die EU-Kommissionspräsidentin haben zuvor mit Premierminister Li Qiang gesprochen. Kernthemen sind Wirtschaftspolitik und der Ukraine-Krieg.,,2023-04-06T10:04:06Z,https://web.archive.org/web/20230407063641/https://www.zeit.de/video/2023-04/6324072454112/china-emmanuel-macron-und-ursula-von-der-leyen-treffen-xi-jinping,"When browsing with ads:
We collect personal data and also transmit it to third-party providers
 that help us improve and finance our digital content. Some of the information stored on your device, … [+732 chars]",,de,'Ukraine'
https://www.n-tv.de/politik/Macron-und-Xi-fordern-rasche-Friedensgespraeche-article24037953.html,https://www.n-tv.de/politik/Macron-und-Xi-fordern-rasche-Friedensgespraeche-article24037953.html,0,www.n-tv.de,"""Russland zur Vernunft bringen"": Macron und Xi fordern rasche Friedensgespräche","Im Ukraine-Krieg könnte China eine wichtige Vermittlerrolle einnehmen. Frankreichs Präsident will bei seinem Staatsbesuch in Peking auf seinen Amtskollegen einwirken. Was eine diplomatische Lösung des Konflikts angeht, zeigen beide Einigkeit.",https://bilder3.n-tv.de/img/incoming/crop24037962/0731327080-cImg_16_9-w1200/57dc3085cd175f409c798c6f03cd1e80.jpg,2023-04-06T10:18:30Z,,Im Ukraine-Krieg könnte China eine wichtige Vermittlerrolle einnehmen. Frankreichs Präsident will bei seinem Staatsbesuch in Peking auf seinen Amtskollegen einwirken. Was eine diplomatische Lösung de… [+1868 chars],,de,'Waffen'
https://www.stern.de/politik/ausland/krieg-in-der-ukraine--kiew-deutet-verhandlungen-ueber-krim-an-33354530.html,https://www.stern.de/politik/ausland/krieg-in-der-ukraine--kiew-deutet-verhandlungen-ueber-krim-an-33354530.html,0,www.stern.de,Krieg in der Ukraine: Kiew deutet Verhandlungen über Krim an,Die Ukraine will die von Russland annektierte Krim zurück - und schließt dabei eine militärische Eroberung nicht aus. Unter bestimmten Umständen sei man aber auch bereit für eine diplomatische Lösung.,https://image.stern.de/33354532/t/C3/v1/w1440/r1.7778/-/06--urnnewsmldpacom2009010123040699232515v2w800h600l651t846r3345b2361jpeg---b008818032f6e9f9.jpg,2023-04-06T10:22:37Z,https://web.archive.org/web/20230406144700/https://www.stern.de/politik/ausland/krieg-in-der-ukraine--kiew-deutet-verhandlungen-ueber-krim-an-33354530.html,Die Ukraine will die von Russland annektierte Krim zurück - und schließt dabei eine militärische Eroberung nicht aus. Unter bestimmten Umständen sei man aber auch bereit für eine diplomatische Lösung… [+1799 chars],,de,'Ukraine'
https://www.welt.de/politik/ausland/article244675082/Ukraine-News-Kiew-deutet-Bereitschaft-zu-Verhandlungen-nach-Fruehjahrsoffensive-an.html,https://www.welt.de/politik/ausland/article244675082/Ukraine-News-Kiew-deutet-Bereitschaft-zu-Verhandlungen-nach-Fruehjahrsoffensive-an.html,0,www.welt.de,Kiew deutet Bereitschaft zu Verhandlungen nach Frühjahrsoffensive an,Die Ukraine könnte sich nach einer geplanten Frühjahrsoffensive mit Russland an den Verhandlungstisch setzen und über die Zukunft der Krim reden. Das deutete ein Regierungsvertreter in Kiew an. Mehr im Liveticker.,https://img.welt.de/img/politik/ausland/mobile244681268/1671352577-ci16x9-w1200/Ukraine-Krieg-Bachmut.jpg,2023-04-06T10:41:00Z,https://web.archive.org/web/20230406113531/https://www.welt.de/politik/ausland/article244675082/Ukraine-News-Kiew-deutet-Bereitschaft-zu-Verhandlungen-nach-Fruehjahrsoffensive-an.html,Die ukrainische Führung ist eigenen Angaben zufolge nach einer geplanten Frühjahrsoffensive zu Gesprächen mit Russland über die Krim bereit. Wenn wir auf dem Schlachtfeld unsere strategischen Ziele e… [+10202 chars],,de,'Russland'
https://www.welt.de/politik/ausland/article244679238/Ukraine-Krieg-Xi-plaediert-nach-Gespraech-mit-Macron-fuer-Verhandlungen.html,https://www.welt.de/politik/ausland/article244679238/Ukraine-Krieg-Xi-plaediert-nach-Gespraech-mit-Macron-fuer-Verhandlungen.html,0,www.welt.de,Xi plädiert nach Gespräch mit Macron für Verhandlungen,"Bei seinem Besuch in China will Frankreichs Präsident Emmanuel Macron seinen chinesischen Amtskollegen Xi Jinping dazu bringen, auf Russland einzuwirken – die Führung des Landes müsse „zur Vernunft“ gebracht werden. Der fordert ebenfalls Verhandlungen. Und bl…",https://img.welt.de/img/politik/ausland/mobile244681386/5251356847-ci16x9-w1200/Frankreichs-Praesident-Macron-besucht-China.jpg,2023-04-06T10:45:00Z,https://web.archive.org/web/20230407063206/https://www.welt.de/politik/ausland/article244679238/Ukraine-Krieg-Xi-plaediert-nach-Gespraech-mit-Macron-fuer-Verhandlungen.html,Chinas Staats- und Parteichef Xi Jinping hat sich für neue Verhandlungen im Ukraine-Krieg ausgesprochen. Nach Gesprächen mit Frankreichs Präsident Emmanuel Macron bekräftigte Xi Jinping am Donnerstag… [+3317 chars],,de,'Russland'
https://www.sueddeutsche.de/politik/russland-un-sicherheitsrat-provokation-maria-lwowa-belowa-1.5782873,https://www.sueddeutsche.de/politik/russland-un-sicherheitsrat-provokation-maria-lwowa-belowa-1.5782873,0,www.sueddeutsche.de,Vereinte Nationen: Russland startet Vorsitz im UN-Sicherheitsrat mit einer Provokation,"Im April hat Russland den Vorsitz im UN-Sicherheitsrat - und gleich zur ersten Sitzung darf eine Frau auftreten, gegen die der Internationale Strafgerichtshof einen Haftbefehl wegen Kriegsverbrechen erlassen hat. Was kommt als Nächstes?",https://www.sueddeutsche.de/image/sz.1.5782883/1200x675?v=1680778009,2023-04-06T10:46:55Z,http://archive.md/20230406110947/https://www.sueddeutsche.de/politik/russland-un-sicherheitsrat-provokation-maria-lwowa-belowa-1.5782873,"Im April hat Russland den Vorsitz im UN-Sicherheitsrat - und gleich zur ersten Sitzung darf eine Frau auftreten, gegen die der Internationale Strafgerichtshof einen Haftbefehl wegen Kriegsverbrechen … [+4925 chars]",,de,'Waffen'
https://www.stern.de/politik/ausland/macron-zu-besuch-in-peking--ukraine-konflikt--xi-jinping-plaediert-fuer-verhandlungen-33352970.html,https://www.stern.de/politik/ausland/macron-zu-besuch-in-peking--ukraine-konflikt--xi-jinping-plaediert-fuer-verhandlungen-33352970.html,0,www.stern.de,Macron zu Besuch in Peking: Ukraine-Konflikt: Xi Jinping plädiert für Verhandlungen,"Chinas Staatschef Xi Jinping ruft zu neuen Verhandlungen auf. Er fordert, dass dabei ""legitime Sicherheitsinteressen aller Parteien"" berücksichtigt werden müssten.",https://image.stern.de/33354218/t/RP/v2/w1440/r1.7778/-/06--urnnewsmldpacom2009010123040699231902v3w800h600l949t555r2052b1497jpeg---f9819c7799edac9e.jpg,2023-04-06T10:49:30Z,https://web.archive.org/web/20230406230758/https://www.stern.de/politik/ausland/macron-zu-besuch-in-peking--ukraine-konflikt--xi-jinping-plaediert-fuer-verhandlungen-33352970.html,"Chinas Staatschef Xi Jinping ruft zu neuen Verhandlungen auf. Er fordert, dass dabei ""legitime Sicherheitsinteressen aller Parteien"" berücksichtigt werden müssten.
Chinas Staats- und Parteichef Xi J… [+1418 chars]",,de,'Ukraine'
https://www.dw.com/de/selenskyj-in-warschau-demonstrativer-schulterschluss/a-65246053,https://www.dw.com/de/selenskyj-in-warschau-demonstrativer-schulterschluss/a-65246053,0,www.dw.com,Selenskyj in Warschau: Demonstrativer Schulterschluss,Polen unterstützt die Ukraine im Kampf gegen Russland massiv. In Warschau bekräftigten die Präsidenten Polens und der Ukraine den Schulterschluss. Gemeinsam will man die Vergangenheit aufarbeiten und nach vorn schauen. Der ukrainische Präsident Wolodymyr Sele…,https://static.dw.com/image/65234047_6.jpg,2023-04-06T10:50:00Z,,"Der ukrainische Präsident Wolodymyr Selenskyj war in den vergangenen Monaten bereits in Washington, London, Paris und Brüssel. Nun besuchte er auch die polnische Hauptstadt Warschau. In gewisser Weis… [+7581 chars]",,de,'Ukraine'
https://www.morgenpost.de/politik/article238089445/putin-rede-applaus-peinlich-botschafter-applaudieren-fail.html,https://www.morgenpost.de/politik/article238089445/putin-rede-applaus-peinlich-botschafter-applaudieren-fail.html,0,www.morgenpost.de,Russland: Putin: Peinlicher Auftritt sorgt für Diskussionen im Netz,Der russische Präsident Wladimir Putin hält in Moskau eine Ansprache vor neuen Botschaftern – und blamiert sich. Das ist passiert.,https://img.morgenpost.de/img/frontpage/crop238089869/8242607360-w820-cv16_9-q85/5FAD0A00B124DD3E.jpg,2023-04-06T10:52:56Z,https://web.archive.org/web/20230407063557/https://www.morgenpost.de/politik/article238089445/putin-rede-applaus-peinlich-botschafter-applaudieren-fail.html,"Berlin. Es kommt nicht häufig vor, dass der russische Präsident und Oberbefehlshaber der Streitkräfte Wladimir Putin um die Zuneigung seiner Zuhörer buhlen muss. Seit dem russischen Überfall auf die … [+2413 chars]",,de,'Nordstream'
https://www.tagesspiegel.de/berlin/mordkommission-ermittelt-taxifahrer-nach-angriff-in-berlin-grunewald-gestorben--tater-weiter-fluchtig-9625190.html,https://www.tagesspiegel.de/berlin/mordkommission-ermittelt-taxifahrer-nach-angriff-in-berlin-grunewald-gestorben--tater-weiter-fluchtig-9625190.html,0,www.tagesspiegel.de,Mordkommission ermittelt: Taxifahrer nach Angriff in Berlin-Grunewald gestorben – Täter weiter flüchtig,"Am Donnerstagmorgen wurde ein 49-jähriger Taxifahrer im Villenviertel Grunewald angegriffen, er starb wenig später im Krankenhaus. Noch immer sind der oder die Täter auf der Flucht.",https://www.tagesspiegel.de/images/angriff-auf-taxifahrer/alternates/BASE_16_9_W1400/angriff-auf-taxifahrer.jpeg,2023-04-06T10:55:21Z,https://web.archive.org/web/20230408061852/https://www.tagesspiegel.de/berlin/mordkommission-ermittelt-taxifahrer-nach-angriff-in-berlin-grunewald-gestorben--tater-weiter-fluchtig-9625190.html,Nach dem tödlichen Angriff auf einen Taxifahrer in Berlin sind der oder die Täter weiterhin flüchtig. Das erklärte ein Sprecher der Berliner Polizei am Freitag auf Nachfrage. Weitere Informationen ko… [+2634 chars],,de,'Flucht'
https://www.tagesspiegel.de/internationales/nach-geplanter-fruhjahrsoffensive-kiew-offenbar-zu-ersten-gesprachen-uber-krim-bereit-9624998.html,https://www.tagesspiegel.de/internationales/nach-geplanter-fruhjahrsoffensive-kiew-offenbar-zu-ersten-gesprachen-uber-krim-bereit-9624998.html,0,www.tagesspiegel.de,Nach geplanter Frühjahrsoffensive: Kiew offenbar zu ersten Gesprächen über Krim bereit,Bislang hat die Ukraine Verhandlungen über die Halbinsel Krim abgelehnt. Das scheint sich jetzt zu ändern. Voraussetzung sind aber Erfolge auf dem Schlachtfeld.,https://www.tagesspiegel.de/images/imago0203050395hjpg1/alternates/BASE_16_9_W1400/imago0203050395hjpg.jpeg,2023-04-06T11:07:43Z,https://web.archive.org/web/20230406175232/https://www.tagesspiegel.de/internationales/nach-geplanter-fruhjahrsoffensive-kiew-offenbar-zu-ersten-gesprachen-uber-krim-bereit-9624998.html,"Die ukrainische Führung ist eigenen Angaben zufolge nach einer geplanten Frühjahrsoffensive zu Gesprächen mit Russland über die Krim bereit. 
Wenn wir auf dem Schlachtfeld unsere strategischen Ziele… [+2242 chars]",,de,'Ukraine'
https://www.tagesschau.de/ausland/asien/macron-xi-von-der-leyen-101.html,https://www.tagesschau.de/ausland/asien/macron-xi-von-der-leyen-101.html,0,www.tagesschau.de,Krieg gegen die Ukraine: Xi und Macron fordern Friedensgespräche,Nach ihrem Treffen in Peking haben Frankreichs Präsident Macron und Chinas Staatschef Xi rasche Friedensgespräche zwischen Kiew und Moskau gefordert. Zudem warnten sie vor einer atomaren Eskalation.,https://www.tagesschau.de/ausland/asien/macron-xi-107~_v-original.jpg,2023-04-06T11:08:02Z,https://web.archive.org/web/20230406131430/https://www.tagesschau.de/ausland/asien/macron-xi-von-der-leyen-101.html,Nach ihrem Treffen in Peking haben Frankreichs Präsident Macron und Chinas Staatschef Xi rasche Friedensgespräche zwischen Kiew und Moskau gefordert. Zudem warnten sie vor einer atomaren Eskalation.,,,
https://www.diepresse.com/6272669/xi-und-macron-fordern-rasche-friedensgespraeche,https://www.diepresse.com/6272669/xi-und-macron-fordern-rasche-friedensgespraeche,0,www.diepresse.com,Xi und Macron fordern rasche Friedensgespräche,"China solle mehr Verantwortung für Frieden und Stabilität im Ukraine-Konflikt tragen, betont der französische Präsident. Chinas Staatschef ruft dazu auf, keine Atomwaffen einzusetzen. Ob er seinen Einfluss auf den Kreml nutzen werde, ließ er aber offen.",https://media.diepresse.com/social_diepresse_nachrichten/images/uploads_1200/6/9/d/6272669/486987DC-5FCE-4266-B2D6-07FDF6AF55B0_v0_l.jpg,2023-04-06T11:17:00Z,,"China solle mehr Verantwortung für Frieden und Stabilität im Ukraine-Konflikt tragen, betont der französische Präsident. Chinas Staatschef ruft dazu auf, keine Atomwaffen einzusetzen. Ob er seinen Ei… [+6043 chars]",,de,'Waffen'
https://www.welt.de/politik/ausland/article244675922/Putin-trifft-Botschafter-der-EU-und-USA-und-nutzte-Termin-zu-einer-Generalabrechnung.html,https://www.welt.de/politik/ausland/article244675922/Putin-trifft-Botschafter-der-EU-und-USA-und-nutzte-Termin-zu-einer-Generalabrechnung.html,0,www.welt.de,Putin bleibt bei Treffen mit Botschaftern auf Abstand – und kritisiert EU und USA,17 neu nach Russland entsandte Diplomaten wurden von Wladimir Putin persönlich begrüßt. Der Kremlchef hielt aber auffällig Distanz zu seinen Besuchern – und nutzte den Termin zu einer Generalabrechnung.,https://img.welt.de/img/politik/ausland/mobile244675918/8701355597-ci16x9-w1200/Russlands-Praesident-Putin.jpg,2023-04-06T11:25:00Z,https://web.archive.org/web/20230406143919/https://www.welt.de/politik/ausland/article244675922/Putin-trifft-Botschafter-der-EU-und-USA-und-nutzte-Termin-zu-einer-Generalabrechnung.html,Kremlchef Wladimir Putin hat in Moskau die neuen Botschafter der EU und der USA getroffen und dem Westen dabei eine geopolitische Konfrontation mit Russland vorgeworfen. Die EU habe diese Konfrontati… [+2575 chars],,de,'Putin'
https://wien.orf.at/stories/3201975/,https://wien.orf.at/stories/3201975/,0,wien.orf.at,Viele Hürden für Ukrainer am Arbeitsmarkt,"Der Fachkräftemangel ist ein großes Problem. Gleichzeitig erschwere man vielen geflüchteten Menschen aus der Ukraine die Integration auf dem Arbeitsmarkt, so Diakonie-Direktorin Maria Katharina Moser. „Wir haben Menschen, die arbeiten wollen, machen es ihnen …",https://ibs.orf.at/wie?image=https%3A%2F%2Foekastatic.orf.at%2Fmims%2F2022%2F38%2F92%2Fcrops%2Fw%3D1200%2Ch%3D627%2Cq%3D75%2F1497116_master_543492_20220913_kh_mieses_arbeitsklima_v1_00_00_07_16.jpg%3Fs%3D22bde9ef677130a08cea9515969eef9619457b19,2023-04-06T12:05:26Z,https://web.archive.org/web/20230406132559/https://wien.orf.at/stories/3201975/,"Der Aufenthaltsstatus als Vertriebene für Menschen aus der Ukraine ist auf ein Jahr begrenzt und muss danach verlängert werden. Das sei eines der größten Hindernisse für die Arbeitsmarktintegration, … [+2281 chars]",,de,'Flucht'
https://www.dw.com/de/serie-transatlantic-flucht-vor-den-nazis-in-die-freiheit/a-65235783,https://www.dw.com/de/serie-transatlantic-flucht-vor-den-nazis-in-die-freiheit/a-65235783,0,www.dw.com,"Serie ""Transatlantic"": Flucht vor den Nazis in die Freiheit","Die Serie von Anna Winger erzählt von der Rettung europäischer Intellektueller und Künstler wie Hannah Arendt oder Marc Chagall vor den Nazis. Eine wahre Geschichte, die an den Filmklassiker ""Casablanca"" erinnert.",https://static.dw.com/image/65224944_6.jpeg,2023-04-06T12:10:00Z,https://web.archive.org/web/20230407172347/https://www.dw.com/de/serie-transatlantic-flucht-vor-den-nazis-in-die-freiheit/a-65235783,"1940 wurde der US-amerikanische Journalist Varian Fry in die südfranzösische Stadt Marseille geschickt. Er sollte Europäern helfen, die vor den Nazis fliehen mussten. Im Auftrag des US-amerikanischen… [+6757 chars]",,de,'Flucht'
https://www.morgenpost.de/bezirke/pankow/article238088005/Auto-kracht-in-Verkehrsinsel-Zwei-Menschen-schwer-verletzt.html,https://www.morgenpost.de/bezirke/pankow/article238088005/Auto-kracht-in-Verkehrsinsel-Zwei-Menschen-schwer-verletzt.html,0,www.morgenpost.de,Berlin-Pankow: Pkw kracht in Verkehrsinsel – Polizeihubschrauber im Einsatz,Betrunken und kein Führerschein: Ein 28-Jähriger baute einen schweren Unfall in Buch – und ergriff zunächst die Flucht.,https://img.morgenpost.de/img/berlin/crop238088003/7822608599-w820-cv16_9-q85/Blaulicht.jpg,2023-04-06T12:25:00Z,https://web.archive.org/web/20230407071956/https://www.morgenpost.de/bezirke/pankow/article238088005/Auto-kracht-in-Verkehrsinsel-Zwei-Menschen-schwer-verletzt.html,"Berlin. Zwei Männer sind in der vergangenen Nacht bei einem Unfall in Pankow verletzt worden. Wie die Polizei Berlin am Donnerstag mitteilte, hatte der 28 Jahre alte Autofahrer kurz vor dem S-Bahnhof… [+1493 chars]",,de,'Flucht'
https://www.bild.de/regional/dresden/dresden-aktuell/unfall-auf-der-a-17-bmw-fahrer-20-stirbt-nach-verfolgungsjagd-83475082.bild.html,https://www.bild.de/regional/dresden/dresden-aktuell/unfall-auf-der-a-17-bmw-fahrer-20-stirbt-nach-verfolgungsjagd-83475082.bild.html,0,www.bild.de,Unfall auf der A 17 - 20-jähriger BMW-Fahrer stirbt nach Verfolgungsjagd,Dresden/Prag – Hätte er doch einfach nur angehalten! Ein erst 20-jähriger BMW-Fahrer bezahlte die Flucht vor der Polizei mit seinem Leben.,"https://images.bild.de/642ec6a798e02c7ceed4fd0f/b11ff1806fbecb4d7d98013d2b38fb39,2e6400fb?w=1280",2023-04-06T13:30:36Z,https://web.archive.org/web/20230407034931/https://www.bild.de/regional/dresden/dresden-aktuell/unfall-auf-der-a-17-bmw-fahrer-20-stirbt-nach-verfolgungsjagd-83475082.bild.html,"Dresden/Prag Hätte er doch einfach nur angehalten! Ein erst 20-jähriger BMW-Fahrer bezahlte die Flucht vor der Polizei mit seinem Leben. 
Beamte der Polizeidirektion Dresden wollten Mittwochabend ge… [+493 chars]",,de,'Flucht'
https://www.n-tv.de/panorama/Taxifahrer-stirbt-nach-Angriff-in-Berlin-article24038399.html,https://www.n-tv.de/panorama/Taxifahrer-stirbt-nach-Angriff-in-Berlin-article24038399.html,0,www.n-tv.de,Täter auf der Flucht: Taxifahrer stirbt nach Angriff in Berlin,"Am Morgen finden Passanten einen lebensgefährlich verletzten Taxifahrer. Sie wählen umgehend den Notruf, doch die Hilfe kommt zu spät - der Mann verstirbt wenig später in der Klinik. Der Polizei zufolge wurde der Fahrer angegriffen, die Täter befinden sich au…",https://bilder3.n-tv.de/img/incoming/crop24038462/0471324138-cImg_16_9-w1200/403166737.jpg,2023-04-06T13:58:08Z,https://web.archive.org/web/20230407062930/https://www.n-tv.de/panorama/Taxifahrer-stirbt-nach-Angriff-in-Berlin-article24038399.html,"Am Morgen finden Passanten einen lebensgefährlich verletzten Taxifahrer. Sie wählen umgehend den Notruf, doch die Hilfe kommt zu spät - der Mann verstirbt wenig später in der Klinik. Der Polizei zufo… [+1772 chars]",,de,'Flucht'
https://www.zeit.de/politik/ausland/2023-04/china-von-der-leyen-besuch-waffenlieferungen-taiwan,https://www.zeit.de/politik/ausland/2023-04/china-von-der-leyen-besuch-waffenlieferungen-taiwan,0,www.zeit.de,EU-Kommissionschefin: Von der Leyen warnt China vor Waffenlieferungen an Russland,"Chinesische Waffenlieferungen an Russland würden das Verhältnis zur EU ""erheblich schädigen"", sagt die EU-Kommissionschefin. Auch vor einem Angriff auf Taiwan warnt sie.",,2023-04-06T14:20:41Z,https://web.archive.org/web/20230407071551/https://www.zeit.de/politik/ausland/2023-04/china-von-der-leyen-besuch-waffenlieferungen-taiwan,"When browsing with ads:
We collect personal data and also transmit it to third-party providers
 that help us improve and finance our digital content. Some of the information stored on your device, … [+732 chars]",,de,'Waffen'
https://www.tagesschau.de/ausland/asien/von-der-leyen-china-101.html,https://www.tagesschau.de/ausland/asien/von-der-leyen-china-101.html,0,www.tagesschau.de,Von der Leyen warnt China vor Waffenlieferungen an Russland,"""Das würde unsere Beziehungen erheblich schädigen"": EU-Kommissionspräsidentin von der Leyen hat China gewarnt, Waffen an Russland zu liefern. Gemeinsam mit Frankreichs Präsident Macron rief sie Staatschef Xi auf, Chinas Einfluss auf Russland zu nutzen.",https://www.tagesschau.de/multimedia/bilder/von-der-leyen-china-103~_v-original.jpg,2023-04-06T14:23:06Z,https://web.archive.org/web/20230406173511/https://www.tagesschau.de/ausland/asien/von-der-leyen-china-101.html,"""Das würde unsere Beziehungen erheblich schädigen"": EU-Kommissionspräsidentin von der Leyen hat China gewarnt, Waffen an Russland zu liefern. Gemeinsam mit Frankreichs Präsident Macron rief sie Staat… [+2959 chars]",,de,'Waffen'
https://www.zeit.de/news/2023-04/06/polizei-beschlagnahmt-in-brueel-zahlreiche-waffen,https://www.zeit.de/news/2023-04/06/polizei-beschlagnahmt-in-brueel-zahlreiche-waffen,0,www.zeit.de,Ludwigslust-Parchim: Polizei beschlagnahmt in Brüel zahlreiche Waffen,,,2023-04-06T14:35:38Z,https://web.archive.org/web/20230407071316/https://www.zeit.de/news/2023-04/06/polizei-beschlagnahmt-in-brueel-zahlreiche-waffen,"When browsing with ads:
We collect personal data and also transmit it to third-party providers
 that help us improve and finance our digital content. Some of the information stored on your device, … [+732 chars]",,de,'Waffen'
https://www.wiwo.de/politik/ausland/staatsbesuch-macron-und-von-der-leyen-machen-druck-auf-china/29082306.html,https://www.wiwo.de/politik/ausland/staatsbesuch-macron-und-von-der-leyen-machen-druck-auf-china/29082306.html,0,www.wiwo.de,Staatsbesuch: Macron und von der Leyen machen Druck auf China,"China gibt Russland im Rückendeckung. Macron und von der Leyen machen Druck auf Xi, um seinen Einfluss zu nutzen. Doch beim Thema Wirtschaftsbeziehung gehen die Beiden unterschiedliche Wege. Sie mahnt, er verhandelt.",https://www.wiwo.de/images/french-president-macron-on-state-visit-in-china/29084054/2-format11240.jpg,2023-04-06T14:38:56Z,https://web.archive.org/web/20230407071310/https://www.wiwo.de/politik/ausland/staatsbesuch-macron-und-von-der-leyen-machen-druck-auf-china/29082306.html,"EU-Kommissionspräsidentin Ursula von der Leyen und Frankreichs Präsident Emmanuel Macron haben Druck auf China gemacht, zur Beendigung des Ukraine-Kriegs seinen Einfluss auf Russland zu nutzen. Wir z… [+5535 chars]",,de,'Putin'
https://www.der-postillon.com/2023/04/putin-fernglas.html,https://www.der-postillon.com/2023/04/putin-fernglas.html,0,www.der-postillon.com,"Putin kauft sich Fernglas, um seine Generäle am anderen Ende des Tisches besser zu erkennen","Moskau (dpo) - Putin rüstet auf – zumindest was die Optik anbelangt: Der Kreml-Befehlshaber hat sich in dieser Woche ein Fernglas angeschafft, um künftig seine Generäle am anderen Tisch-Ende besser erkennen zu können.
mehr...",https://blogger.googleusercontent.com/img/b/R29vZ2xl/AVvXsEgBjW6kgVA2r_-cukZEQq34nfdD5l3uRHTgeZzmP6MG0Z-ucz9bf_5qKjR_BBLhCicRZwEAh9p3kvdj3L1-tr5x74gXOaTFgYhI25h5nr4uB6YJIQ-sn2W7rfuS5rRlrUm3ABcUpSTbmyXhlq02NbjZGcxpmOsAZWvcbBjdTODQ0Z5QsLxmlTuJSwKb/w1600/Putin-Fernglas.jpg,2023-04-06T14:52:05Z,https://web.archive.org/web/20230406150334/https://www.der-postillon.com/2023/04/putin-fernglas.html,"Moskau (dpo) - Putin rüstet auf – zumindest was die Optik anbelangt: Der Kreml-Chef hat sich in dieser Woche ein Fernglas angeschafft, um künftig seine Generäle am anderen Tisch-Ende besser erkennen … [+1225 chars]",,de,'Putin'
https://www.nzz.ch/technologie/ukraine-krieg-eu-warnt-china-vor-waffenlieferungen-an-russland-ld.1732924,https://www.nzz.ch/technologie/ukraine-krieg-eu-warnt-china-vor-waffenlieferungen-an-russland-ld.1732924,0,www.nzz.ch,Die EU warnt China vor militärischen Exporten nach Russland,In Peking findet die Kommissionspräsidentin von der Leyen nach einem Treffen mit Partei- und Staatschef Xi klare Worte. Frankreichs Präsident Macron hingegen ist zahmer – und irritiert offenbar Xi.,"https://img.nzz.ch/2023/04/06/7798ddcb-fe6c-447c-a645-40f863a3490b.jpeg?width=1200&height=675&fit=bound&quality=75&auto=webp&crop=8192,4608,x0,y856&wmark=nzz",2023-04-06T15:00:00Z,http://archive.md/20230406193625/https://www.nzz.ch/technologie/ukraine-krieg-eu-warnt-china-vor-waffenlieferungen-an-russland-ld.1732924,"Emmanuel Macron geht am Donnerstag in Peking weniger auf Distanz zu Xi Jinping als Ursula von der Leyen.
Ein Zeichen der europäischen Einheit wollte der französische Präsident Emmanuel Macron bei se… [+5731 chars]",,de,'Putin'
