index,url,valid,domain,title,description,image,published,archive,content,quote,language,keyword
https://taz.de/Stromausfaelle-im-Kosovo/!6053845/,https://taz.de/Stromausfaelle-im-Kosovo/!6053845/,0,taz.de,Stromausfälle im Kosovo: Festnahmen nach Explosion,Unbekannte haben einen wichtigen Wasserversorgungskanal im Norden Kosovos angegriffen. Serbien bestreitet jegliche Beteiligung,https://taz.de/picture/7389187/1200/37138349-1.jpeg,2024-12-01T16:26:00Z,https://web.archive.org/web/20241202021134/https://taz.de/Stromausfaelle-im-Kosovo/!6053845/,Unbekannte haben einen wichtigen Wasserversorgungskanal im Norden Kosovos angegriffen. Serbien bestreitet jegliche Beteiligung mehr...,,de,'Explosion'
https://t3n.de/news/heizen-und-trotzdem-energie-sparen-das-ist-alles-eine-frage-der-richtigen-einstellung-1661085/,https://t3n.de/news/heizen-und-trotzdem-energie-sparen-das-ist-alles-eine-frage-der-richtigen-einstellung-1661085/,0,t3n.de,Heizen und trotzdem Energie sparen? Das ist alles eine Frage der richtigen Einstellung,"Schon mit einfachen Eingriffen in das Heizsystem ließe sich viel Energie sparen, etwa mit der richtigen Heizkurve. Doch nicht alle Hersteller erlauben das.weiterlesen auf t3n.de",https://t3n.de/news/wp-content/uploads/2024/12/shutterstock_2518184145.jpg,2024-12-02T13:45:31Z,https://web.archive.org/web/20241202135628/https://t3n.de/news/heizen-und-trotzdem-energie-sparen-das-ist-alles-eine-frage-der-richtigen-einstellung-1661085/,"Ein Teil unserer teuer bezahlten Heizwärme fließt regelmäßig ungenutzt durch die Heizungsrohre. Häufig sind Heizungen total überhöht eingestellt, aber die Kunden merken es nicht, weil es ausreichend … [+6882 chars]",,de,'Sparen'
https://www.morgenpost.de/blogs-kolumnen/article407792821/mit-gedankenflocken-gegen-die-kaelte-der-welt.html,https://www.morgenpost.de/blogs-kolumnen/article407792821/mit-gedankenflocken-gegen-die-kaelte-der-welt.html,0,www.morgenpost.de,Mit Gedankenflocken gegen die Kälte der Welt,"Ein Phantomschmerz im ÖPNV und überraschender Trost: Vom Zusammenhang zwischen ökologischen Dämmstoffen, Robert Habecks Heizungsdebatte und dem Zeitungssterben - die Stadtflucht-Kolumne aus Berlin.",https://img.sparknews.funkemedien.de/407793740/407793740_1732905548_v16_9_1600.jpeg,2024-12-02T16:45:59Z,,"Berlin. Abschied vom Lesen auf Papier? Die Autorin fühlt einen Phantomschmerz, aber es gibt einen überraschenden Trost die Stadtflucht-Kolumne.",,de,'Kälte'
https://www.zeit.de/geld/2024-11/geld-sparen-inflation-loehne-angst,https://www.zeit.de/geld/2024-11/geld-sparen-inflation-loehne-angst,0,www.zeit.de,Geld sparen: Sparen für den gefühlten Weltuntergang,"Die Inflation geht zurück, die Löhne steigen. Und die Deutschen? Legen ihr Geld zur Seite. Das ist nicht immer rational. Wenn Sie schon angstsparen, dann richtig.",https://img.zeit.de/geld/2024-12/geld-sparen-inflation-loehne-angst-bild/wide__1300x731,2024-12-03T09:51:56Z,http://archive.md/20241203095814/https://www.zeit.de/geld/2024-11/geld-sparen-inflation-loehne-angst,"Schließen
Artikelzusammenfassung
Viele Deutsche sparen derzeit lieber Geld anstatt es auszugeben, was zu einer durchschnittlichen Sparquote von 11,3 Prozent führt. Die Sparneigung wird durch politi… [+560 chars]",,de,'Sparen'
