index,url,valid,domain,title,description,image,published,archive,content,quote,language,keyword
https://www.nzz.ch/international/thailand-armut-trieb-die-arbeitskraefte-nach-israel-ld.1768736,https://www.nzz.ch/international/thailand-armut-trieb-die-arbeitskraefte-nach-israel-ld.1768736,0,www.nzz.ch,Die Armut in Thailands Nordosten treibt die Menschen ins Ausland. Israel ist wegen der hohen Saläre eine beliebte Destination gewesen – nun ist die Furcht jedoch gross,"Der Krieg zwischen Israel und der Hamas ist für die thailändische Regierung eine Blamage. Warum müssen Thailänder ihre Heimat, die einst als Tigerstaat galt, verlassen, um im Ausland ausreichend Geld zu verdienen? Zwei Betroffene aus dem Nordosten Thailands e…","https://img.nzz.ch/2023/12/05/dd27b4c0-0544-42cc-9f67-fa98b8b2547a.jpeg?width=1200&height=674&fit=bound&quality=75&auto=webp&crop=3000,1685,x0,y172&wmark=nzz",2023-12-06T10:00:00Z,,"39 Thailänder wurden beim Angriff der Hamas im Oktober ermordet und mindestens 32 wurden entführt. Im Bild eine von der palästinensischen Terrororganisation freigelassene Geisel.
Am Donnerstagabend … [+9815 chars]",,de,'Armut'
https://www.zeit.de/news/2023-12/06/zoo-leipzig-hebt-ticketpreise-leicht-an,https://www.zeit.de/news/2023-12/06/zoo-leipzig-hebt-ticketpreise-leicht-an,0,www.zeit.de,Steigende Kosten: Zoo Leipzig hebt Ticketpreise leicht an,Hier finden Sie Informationen zu dem Thema „Steigende Kosten“. Lesen Sie jetzt „Zoo Leipzig hebt Ticketpreise leicht an“.,https://img.zeit.de/news/2023-12/06/zoo-leipzig-hebt-ticketpreise-leicht-an-image-group/wide__1300x731,2023-12-06T12:01:48Z,,"Erstmals seit vier Jahren hebt der Zoo Leipzig seine Preise leicht an. Grund seien die steigenden Kosten in allen Bereichen, teilte der Zoo am Mittwoch mit. Demnach werden am 21. März 2024 die Preise… [+1310 chars]",,de,'Kosten'
https://taz.de/Bildungschancen-von-Roma-in-Spanien/!5974060/,https://taz.de/Bildungschancen-von-Roma-in-Spanien/!5974060/,0,taz.de,Bildungschancen von Roma in Spanien: Gitanos kämpfen gegen Segregation,"Nur ein Bruchteil der Roma in Spanien haben einen Hochschulabschluss. Wer als Gitano aufsteigen will, muss gegen Armut und Diskriminierung ankämpfen.",https://taz.de/picture/6692485/948/34192893-1.jpeg,2023-12-06T12:47:00Z,,"Nur ein Bruchteil der Roma in Spanien haben einen Hochschulabschluss. Wer als Gitano aufsteigen will, muss gegen Armut und Diskriminierung ankämpfen.
Die beiden jungen Gitanos José Santos und Sara J… [+9639 chars]",,de,'Armut'
https://www.sueddeutsche.de/projekte/artikel/wirtschaft/waermepumpe-vermieter-foerderung-kosten-e217012/,https://www.sueddeutsche.de/projekte/artikel/wirtschaft/waermepumpe-vermieter-foerderung-kosten-e217012/,0,www.sueddeutsche.de,Heizen: Wann sich für Vermieter die Wärmepumpe lohnt,"Gasheizung alt oder kaputt? Auch in Miets- und Mehrfamilienhäusern können Wärmepumpen helfen, klimafreundlicher zu heizen. Aber ob sich der Aufwand für Vermieter lohnt, ist umstritten - ein Wegweiser.","https://www.sueddeutsche.de/projekte/artikel/wirtschaft/waermepumpe-vermieter-foerderung-kosten-e217012/b14c70f0346fb9e15da319c32aeb0163e910526149d3d8a2d8ef4d97014eb1ef_w2400_h1256_r63,0,3200,1675_oszplus_q70.jpg",2023-12-06T14:53:48Z,,"Teuer, kompliziert und laut? Wärmepumpen sind bei Vermietern umstritten. Dabei gibt es Beispiele, wie sie in Mehrfamilienhäusern funktionieren und sich sogar auszahlen können.",,de,'Heizen'
https://www.diepresse.com/17896031/von-design-farben-und-villengeheimnissen,https://www.diepresse.com/17896031/von-design-farben-und-villengeheimnissen,0,www.diepresse.com,"Von Design, Farben und Villengeheimnissen","Sechs Neuerscheinungen zu Architektur, Wohnen und Leben – zum Verschenken, selbst Schmökern oder gemeinsamen Durchblättern am Sofa, während draußen der Schnee fällt.",https://img.diepresse.com/public/incoming/ilz544-cIm_Hause_Lagerfeld_235678_300dpi.jpg/alternates/DPR_SOCIAL_NACHRICHTEN/cIm_Hause_Lagerfeld_235678_300dpi.jpg,2023-12-06T16:04:05Z,,"Sechs Neuerscheinungen zu Architektur, Wohnen und Leben zum Verschenken, selbst Schmökern oder gemeinsamen Durchblättern am Sofa, während draußen der Schnee fällt.
Häuser in den Bergen, 208 Seiten, … [+5810 chars]",,de,'Schnee'
https://www.sueddeutsche.de/wissen/wettereinbruch-schneechaos-bahn-baeume-schneebruch-klimawandel-1.6315452,https://www.sueddeutsche.de/wissen/wettereinbruch-schneechaos-bahn-baeume-schneebruch-klimawandel-1.6315452,0,www.sueddeutsche.de,Wintereinbruch: Warum so viele Bäume unter dem Schnee zusammenbrechen,Nach den schweren Schneefällen krachen Bäume ein und stürzen auf Straßen oder Gleise. Ist das normal oder haben Trockenheit und Klimawandel ihre Spuren hinterlassen?,https://www.sueddeutsche.de/image/sz.1.6315453/1200x675?v=1701878692,2023-12-06T16:05:11Z,https://web.archive.org/web/20231206164219/https://www.sueddeutsche.de/wissen/wettereinbruch-schneechaos-bahn-baeume-schneebruch-klimawandel-1.6315452,"Ein kleiner roter Kreis mit weißem Ausrufezeichen in der Bahn-App. Reisende wissen, dass das nichts Gutes bedeutet: ""Verbindung fällt aus."" Die Warnung leuchtet seit Samstag noch häufiger als sonst i… [+3849 chars]",,de,'Schnee'
https://www.morgenpost.de/vermischtes/article240760214/Der-lange-Kampf-der-Bahn-gegen-Schnee-und-Eis.html,https://www.morgenpost.de/vermischtes/article240760214/Der-lange-Kampf-der-Bahn-gegen-Schnee-und-Eis.html,0,www.morgenpost.de,Der lange Kampf der Bahn gegen Schnee und Eis,"Schnee, Schnee, Schnee - so viel wie lange nicht. Am Samstag hat es im Süden Bayerns extrem geschneit. Noch immer fahren Züge teils nicht regulär. Wie kam es dazu - wird es Konsequenzen geben?",https://img.sparknews.funkemedien.de/240760212/240760212_1701880522_v4_3_800.jpeg,2023-12-06T16:13:07Z,,"München. Schnee, Schnee, Schnee - so viel wie lange nicht. Am Samstag hat es im Süden Bayerns extrem geschneit. Noch immer fahren Züge teils nicht regulär. Wie kam es dazu - wird es Konsequenzen gebe… [+6642 chars]",,de,'Schnee'
https://www.sueddeutsche.de/muenchen/muenchen-schneeraeumen-profi-ticks-interview-1.6315475,https://www.sueddeutsche.de/muenchen/muenchen-schneeraeumen-profi-ticks-interview-1.6315475,0,www.sueddeutsche.de,"Profi-Schneeräumer in München: ""Dieses Wochenende dachte ich das erste Mal: bitte nicht!""","Steve Weinrich befreit professionell Wege, Parkplätze und Dächer vom Schnee. Welche Tricks er beim Räumen hat - und wie er die aktuelle Lage in München bewertet.",https://www.sueddeutsche.de/image/sz.1.6315477/1200x675?v=1701880218,2023-12-06T16:30:22Z,https://web.archive.org/web/20231206180450/https://www.sueddeutsche.de/muenchen/muenchen-schneeraeumen-profi-ticks-interview-1.6315475,"Steve Weinrich befreit professionell Wege, Parkplätze und Dächer vom Schnee. Welche Tricks er beim Räumen hat - und wie er die aktuelle Lage in München bewertet.Trambahnschienen sind vereist, Bürgers… [+392 chars]",,de,'Schnee'
https://www.tagesschau.de/ausland/putin-arabische-emirate-100.html,https://www.tagesschau.de/ausland/putin-arabische-emirate-100.html,0,www.tagesschau.de,Russischer Präsident Putin besucht Emirate und Saudi-Arabien,Putin ist in die Golfregion gereist - allerdings nicht zum Klimagipfel. Russlands Präsident besucht die Staatschefs der Vereinigten Arabischen Emirate und Saudi-Arabiens. Eine Festnahme hat er dort nicht zu befürchten.,https://images.tagesschau.de/image/8eb0cdcf-35fd-4d65-af29-850b2f85757b/AAABjD_3qFk/AAABibBxqrQ/16x9-1280/putin-al-nahyan-100.jpg,2023-12-06T16:39:47Z,,"Stand: 06.12.2023 17:39 Uhr
Putin ist in die Golfregion gereist - allerdings nicht zum Klimagipfel. Russlands Präsident besucht die Staatschefs der Vereinigten Arabischen Emirate und Saudi-Arabiens.… [+2897 chars]",,de,'Russland'
https://www.faz.net/aktuell/wirtschaft/kofferberg-bei-lufthansa-mehr-als-10-000-gepaeckstuecke-nachzubearbeiten-19365390.html,https://www.faz.net/aktuell/wirtschaft/kofferberg-bei-lufthansa-mehr-als-10-000-gepaeckstuecke-nachzubearbeiten-19365390.html,0,www.faz.net,Flughafen München: Nach dem Schnee kämpft Lufthansa mit einem Kofferberg,"Nach Schnee und Eis meldet der Flughafen München: „Wir sind mit dem Gröbsten durch.“ Laut Lufthansa sind aber mehr als 10.000 Koffer nachzubearbeiten, einige waren schlicht im Weiß versunken.",https://media1.faz.net/ppmedia/aktuell/gesellschaft/2533402286/1.9365993/facebook_teaser/viel-spruehen-ein-lufthansa.jpg,2023-12-06T16:49:06Z,,"Für am Flughafen München gestrandete Passagiere waren Tage mit Schneechaos und Eisregen eine Nervenprobe, für Landwirte aus dem Umland brachten sie Zusatzschichten. Im Winterdienst setzt der Flughafe… [+2750 chars]",,de,'Schnee'
https://www.n-tv.de/mediathek/videos/wetter/Sueden-bibbert-und-rutscht-bei-zweistelligen-Minuswerten-article24579436.html,https://www.n-tv.de/mediathek/videos/wetter/Sueden-bibbert-und-rutscht-bei-zweistelligen-Minuswerten-article24579436.html,0,www.n-tv.de,Nacht verbreitet frostig und glatt: Süden bibbert und rutscht bei zweistelligen Minuswerten,"Die Nacht auf Donnerstag wird verbreitet frostig. Aufgrund anhaltender Niederschläge in Form von Regen und Schnee wird es auf den Straßen zudem gefährlich glatt. Besonders kalt wird es im Süden Deutschlands, wo die Temperaturen bis auf minus zehn Grad sinken.",https://bilder3.n-tv.de/img/incoming/crop24582622/4641322815-cImg_16_9-w1200/437449216.jpg,2023-12-06T17:02:00Z,https://web.archive.org/web/20231206222235/https://www.n-tv.de/mediathek/videos/wetter/Sueden-bibbert-und-rutscht-bei-zweistelligen-Minuswerten-article24579436.html,,,de,'Schnee'
https://www.bild.de/politik/inland/politik-inland/ampel-geheimaktion-haushalt-erst-belgien-koenig-dann-deutschland-kohle-86348306.bild.html,https://www.bild.de/politik/inland/politik-inland/ampel-geheimaktion-haushalt-erst-belgien-koenig-dann-deutschland-kohle-86348306.bild.html,0,www.bild.de,"Ampel-Geheimaktion Haushalt - Erst Belgien-König, dann Deutschland-Kohle?","Nach dem Haushalts-Desaster der Ampel steht die Frage: Torte oder Tränen, Sekt oder Selters? Foto: ODD ANDERSEN/AFP","https://images.bild.de/65709e29e9cf852e2af16eb3/19bfb163c8b4ed54a2be89123e1b366f,1c92c9b3?w=1280",2023-12-06T17:46:36Z,https://web.archive.org/web/20231208014647/https://www.bild.de/politik/inland/politik-inland/ampel-geheimaktion-haushalt-erst-belgien-koenig-dann-deutschland-kohle-86348306.bild.html,"Am Tag nach Nikolaus wird die Ampel 2 Jahre alt eigentlich müsste es am Jahrestag der Besiegelung des Koalitionsvertrages (Fortschrittskoalition) geben: Torte, Schnittchen Stößchen!
Doch nach dem Ha… [+4564 chars]",,de,'Schnee'
https://www.sueddeutsche.de/muenchen/nachrichten-newsletter-uebersicht-muenchen-heute-aktuell-1.6315525,https://www.sueddeutsche.de/muenchen/nachrichten-newsletter-uebersicht-muenchen-heute-aktuell-1.6315525,0,www.sueddeutsche.de,News-Überblick: Das sind die Nachrichten des Tages,"Wie es mit dem Gasteig weitergeht, warum München den Schnee nicht in den Griff bekommt, was mit dem C&A-Haus an der Kaufingerstraße passieren soll und mehr.",https://www.sueddeutsche.de/image/sz.1.5566091/1200x675?v=1701884913,2023-12-06T17:49:24Z,,"Wie es mit dem Gasteig weitergeht, warum München den Schnee nicht in den Griff bekommt, was mit dem C&amp;A-Haus an der Kaufingerstraße passieren soll und mehr.DER TAG IN MÜNCHEN
So geht es mit dem … [+1609 chars]",,de,'Schnee'
https://www.n-tv.de/ratgeber/So-behalten-Sie-den-Durchblick-article24581532.html,https://www.n-tv.de/ratgeber/So-behalten-Sie-den-Durchblick-article24581532.html,0,www.n-tv.de,Eisfreie Autoscheiben: So behalten Sie den Durchblick,Laternenparker müssen dieser Tage wieder häufig die Scheiben ihrer Autos von Eis und Schnee befreien. Mancher Autofahrer greift dabei tief in die Trickkiste. Manche Idee schadet allerdings mehr als sie nutzt.,https://bilder2.n-tv.de/img/incoming/crop7590081/0481327200-cImg_16_9-w1200/34572270.jpg,2023-12-06T18:20:32Z,https://web.archive.org/web/20231206193857/https://www.n-tv.de/ratgeber/So-behalten-Sie-den-Durchblick-article24581532.html,Laternenparker müssen dieser Tage wieder häufig die Scheiben ihrer Autos von Eis und Schnee befreien. Mancher Autofahrer greift dabei tief in die Trickkiste. Manche Idee schadet allerdings mehr als s… [+4735 chars],,de,'Schnee'
https://www.zeit.de/news/2023-12/06/biden-mahnt-kongress-ukraine-hilfen-koennen-nicht-warten,https://www.zeit.de/news/2023-12/06/biden-mahnt-kongress-ukraine-hilfen-koennen-nicht-warten,0,www.zeit.de,Konflikte: Biden mahnt Kongress: Ukraine-Hilfen können nicht warten,Hier finden Sie Informationen zu dem Thema „Konflikte“. Lesen Sie jetzt „Biden mahnt Kongress: Ukraine-Hilfen können nicht warten“.,https://img.zeit.de/news/2023-12/06/biden-mahnt-kongress-ukraine-hilfen-koennen-nicht-warten-image-group/wide__1300x731,2023-12-06T18:24:00Z,,"US-Präsident Joe Biden hat den Kongress erneut gedrängt, neue Hilfen für die von Russland angegriffene Ukraine zu genehmigen.
Mehr Schlagzeilen
«Das kann nicht warten. Der Kongress muss zusätzliche… [+2495 chars]",,de,'Ukraine'
https://www.stern.de/gesellschaft/regional/hessen/soziales--haertefallfonds-fuer-spaetaussiedler-und-kontingentfluechtlinge-34265642.html,https://www.stern.de/gesellschaft/regional/hessen/soziales--haertefallfonds-fuer-spaetaussiedler-und-kontingentfluechtlinge-34265642.html,0,www.stern.de,Soziales: Härtefallfonds für Spätaussiedler und Kontingentflüchtlinge,"Wer nach der deutschen Einheit Ansprüche auf DDR-Zusatzrenten einbüßte und nun in Armut lebt, könnte eine Einmalzahlung erhalten. Dasselbe gilt auch in Hessen für Spätaussiedler und jüdische Zuwanderer.",https://image.stern.de/34265644/t/8B/v3/w1440/r1.7778/-/07--urnnewsmldpacom2009010123120799208972v3w800h600l640t422r1920b1272jpeg---4922fa02745204c2.jpg,2023-12-07T07:07:17Z,https://web.archive.org/web/20231209015128/https://www.stern.de/gesellschaft/regional/hessen/soziales--haertefallfonds-fuer-spaetaussiedler-und-kontingentfluechtlinge-34265642.html,"Wer nach der deutschen Einheit Ansprüche auf DDR-Zusatzrenten einbüßte und nun in Armut lebt, könnte eine Einmalzahlung erhalten. Dasselbe gilt auch in Hessen für Spätaussiedler und jüdische Zuwander… [+2481 chars]",,de,'Armut'
https://www.zeit.de/politik/ausland/2023-12/sauli-niinistoe-ukraine-finnland-wladimir-putin,https://www.zeit.de/politik/ausland/2023-12/sauli-niinistoe-ukraine-finnland-wladimir-putin,0,www.zeit.de,"Sauli Niinistö zum Ukraine-Krieg: ""Putin hört auf nichts anderes als die Sprache der Macht""","Europa hat sich im Umgang mit Russland ablenken lassen, sagt Finnlands Präsident Sauli Niinistö. Ein Gespräch über Fehler des Westens, deutsche Wehrpflicht und Eishockey.",https://img.zeit.de/politik/ausland/2023-12/sauli-niinistoe-ukraine-finnland-wladimir-putin-interview-portraet/wide__1300x731,2023-12-07T09:33:07Z,,"Sauli Niinistö hat Wladimir Putin oft getroffen. Der Präsident empfängt in
seiner Residenz Mäntyniemi im Westen Helsinkis, die hohen Fenster geben den
Blick auf einen verschneiten Fjord frei. Niini… [+1066 chars]",,de,'Ukraine'
https://www.zeit.de/politik/ausland/2023-12/russland-praesidentschaftswahlen-maerz-2024,https://www.zeit.de/politik/ausland/2023-12/russland-praesidentschaftswahlen-maerz-2024,0,www.zeit.de,Russland: Russische Präsidentschaftswahlen für den 17. März angesetzt,"Im März 2024 soll in Russland gewählt werden. Bislang hat Wladimir Putin noch keine Kandidatur angekündigt – sollte er antreten, gilt sein Wahlsieg jedoch als gesichert.",https://img.zeit.de/administratives/sharing/fallback-image/wide__1300x731,2023-12-07T09:47:00Z,,Die Abgeordneten des russischen Föderationsrats haben einen Termin für die Präsidentschaftswahlen im kommenden Jahr festgelegt. Gewählt werden soll demnach am 17. März 2024. Staatschef Wladimir Putin… [+667 chars],,de,'Putin'
https://taz.de/Onlinemedium-Kyiv-Independent/!5974197/,https://taz.de/Onlinemedium-Kyiv-Independent/!5974197/,0,taz.de,"Onlinemedium „Kyiv Independent“: Raketen, Recherchen, Raketen",Kurz vor der russischen Invasion in der Ukraine launchte „Kyiv Independent“ und hat sich längst etabliert. Über ein Medium im Dauer-Ausnahmezustand.,https://taz.de/picture/6695733/948/Medien-Ukraine-Kyiv-Independent-1.jpeg,2023-12-07T13:27:00Z,,"Kurz vor der russischen Invasion in der Ukraine launchte Kyiv Independent und hat sich längst etabliert. Über ein Medium im Dauer-Ausnahmezustand.
Chefredakteurin Olga Rudenko wurde für ihre Arbeit … [+6522 chars]",,de,'Ukraine'
https://www.focus.de/politik/ausland/ukraine-krieg-im-ticker-ukrainischer-geheimdienst-soll-ermordung-von-politiker-organisiert-haben_id_57275780.html,https://www.focus.de/politik/ausland/ukraine-krieg-im-ticker-ukrainischer-geheimdienst-soll-ermordung-von-politiker-organisiert-haben_id_57275780.html,0,www.focus.de,Ukraine-Krieg - Stimmen und Entwicklungen - Ukrainischer Geheimdienst soll Ermordung von Politiker organisiert haben,"Der ukrainische Geheimdienst hat offenbar einen wichtigen Verbindungstunnel in Russland sabotiert. Nach seiner Absage an den US-Kongress, nimmt Selenskyj am Video-Gipfel der G7 teil. Zwei pro-russische ukrainische Politiker werden tot aufgefunden. Alle News z…",https://p6.focus.de/img/fotos/id_259469338/das-ausgebrannte-auto-in-dem-der-ukrainische-politiker-oleg-popow-gestorben-sein-soll.jpg?im=Crop%3D%280%2C115%2C746%2C373%29%3BResize%3D%281200%2C627%29&impolicy=perceptual&quality=mediumHigh&hash=2389a7dc5624e969a79e0de8a54e87bafe6eff3ee4dd218211e66c4a085cedf0,2023-12-07T13:46:42Z,,"Der ukrainische Geheimdienst hat offenbar einen wichtigen Verbindungstunnel in Russland sabotiert. Nach seiner Absage an den US-Kongress, nimmt Selenskyj am Video-Gipfel der G7 teil. Zwei pro-russisc… [+17339 chars]",,de,'Ukraine'
https://www.morgenpost.de/bezirke/charlottenburg-wilmersdorf/article240766140/Wieso-Vitali-Klitschko-Charlottenburg-Wilmersdorf-dankt.html,https://www.morgenpost.de/bezirke/charlottenburg-wilmersdorf/article240766140/Wieso-Vitali-Klitschko-Charlottenburg-Wilmersdorf-dankt.html,0,www.morgenpost.de,Wieso Vitali Klitschko Charlottenburg-Wilmersdorf dankt,Per Videobotschaft meldet sich der Bürgermeister von Kiew in Berlin. Den Bezirk und die Ukraine verbindet eine lange Partnerschaft.,https://img.sparknews.funkemedien.de/240766138/240766138_1701957051_v4_3_800.jpeg,2023-12-07T13:50:52Z,,"Berlin. Per Videobotschaft meldet sich der Bürgermeister von Kiew in Berlin. Den Bezirk und die Ukraine verbindet eine lange Partnerschaft.
In einem Hinterhof steht Vitali Klitschko in olivgrüner Kl… [+3309 chars]",,de,'Ukraine'
https://www.n-tv.de/politik/Wladimir-Putins-Spionagechef-Sergej-Naryschkin-prophezeit-USA-zweites-Vietnam-Kreml-hofft-auf-Dauer-Blockade-der-Republikaner-article24585548.html,https://www.n-tv.de/politik/Wladimir-Putins-Spionagechef-Sergej-Naryschkin-prophezeit-USA-zweites-Vietnam-Kreml-hofft-auf-Dauer-Blockade-der-Republikaner-article24585548.html,0,www.n-tv.de,"Wegen Unterstützung der Ukraine: Putins Spionagechef prophezeit USA ""zweites Vietnam""","In den USA tobt ein Streit darüber, wie es mit der Unterstützung der Ukraine im Krieg gegen Russland weitergeht. Die Republikaner haben ein milliardenschweres Hilfspaket vorerst blockiert. Moskau hofft, dass das so bleibt und warnt die Amerikaner vor einem ""S…",https://bilder2.n-tv.de/img/incoming/crop24585545/6231322692-cImg_16_9-w1200/imago0311638862h.jpg,2023-12-07T13:56:42Z,,"In den USA tobt ein Streit darüber, wie es mit der Unterstützung der Ukraine im Krieg gegen Russland weitergeht. Die Republikaner haben ein milliardenschweres Hilfspaket vorerst blockiert. Moskau hof… [+2610 chars]",,de,'Ukraine'
https://www.zeit.de/politik/ausland/2023-12/russland-praesidentschaftswahl-opposition-wladimir-putin-alexej-nawalny,https://www.zeit.de/politik/ausland/2023-12/russland-praesidentschaftswahl-opposition-wladimir-putin-alexej-nawalny,0,www.zeit.de,Präsidentschaftswahl in Russland: Russische Oppositionelle starten Wahlkampagne gegen Wladimir Putin,"Mit dem Motto ""Russland ohne Putin"" hat das Team von Alexej Nawalny eine Kampagne gegen den Präsidenten begonnen. Der Ausgang der Wahl im März gilt als vorherbestimmt.",https://img.zeit.de/politik/ausland/2023-12/russland-praesidentschaftswahl-opposition-wladimir-putin/wide__1300x731,2023-12-07T14:11:56Z,,"Russische Oppositionelle aus dem Umfeld des inhaftierten Regimegegners Alexej Nawalny haben eine Abwahlkampagne gegen den Präsidenten Wladimir Putin gestartet 100 Tage vor der Präsidentschaftswahl, d… [+7138 chars]",,de,'Ukraine'
https://www.n-tv.de/politik/Neun-Gruende-warum-es-fuer-die-Ukraine-jetzt-brandgefaehrlich-wird-article24585427.html,https://www.n-tv.de/politik/Neun-Gruende-warum-es-fuer-die-Ukraine-jetzt-brandgefaehrlich-wird-article24585427.html,0,www.n-tv.de,"Waffenmangel, Misserfolg, Kälte: Neun Gründe, warum es für die Ukraine jetzt brandgefährlich wird","Fehlende Waffen, fehlende Erfolge, kaum Schutz vor der Kälte und einbrechende US-Hilfen: Es gibt eine ganze Reihe von Gründen, warum der Winter für die Ukrainer zur Bedrohung wird.",https://bilder3.n-tv.de/img/incoming/crop24585450/5351324488-cImg_16_9-w1200/437715307.jpg,2023-12-07T14:20:30Z,,"Fehlende Waffen, fehlende Erfolge, kaum Schutz vor der Kälte und einbrechende US-Hilfen: Es gibt eine ganze Reihe von Gründen, warum dieser Winter für die Ukrainer zur Bedrohung wird. Will der Westen… [+11176 chars]",,de,'Waffen'
https://www.sueddeutsche.de/politik/ukraine-krieg-newsblog-hilfe-waffen-usa-blockade-ungarn-1.6309732,https://www.sueddeutsche.de/politik/ukraine-krieg-newsblog-hilfe-waffen-usa-blockade-ungarn-1.6309732,0,www.sueddeutsche.de,Liveblog zum Krieg in der Ukraine: Ukraine bekommt immer weniger internationale Hilfe,"Zahlen des Kieler Weltwirtschaftsinstituts zeigen, dass die Finanz- und Militärhilfe in den vergangenen Monaten auf das Niveau von vor dem Krieg abgerutscht ist. Hinzu kommt, dass in den USA die Republikaner und in der EU Ungarn weitere Gelder blockiert.",https://www.sueddeutsche.de/image/sz.1.6316000/1200x675?v=1701960366,2023-12-07T14:33:43Z,,Viele Angaben über den Kriegsverlauf wie Opferzahlen oder Details zu Kämpfen stammen von ukrainischen oder russischen Behörden und lassen sich oft nicht unabhängig überprüfen. Für unseren Liveblog ve… [+107 chars],,de,'Ukraine'
https://www.stern.de/politik/putin-und-nahost--expertin-ueber-russlands-ziele-und-die-gefahren--34267432.html,https://www.stern.de/politik/putin-und-nahost--expertin-ueber-russlands-ziele-und-die-gefahren--34267432.html,0,www.stern.de,"Putin und Gaza: ""Kleine Feuer in der Region sind im Sinne von Russland. Ein großes könnte ihm gefährlich werden""",Die Nahost- und Russland-Expertin Hanna Notte rechnet nicht mit einer raschen Friedenslösung im Nahen Osten. Weil der Mehr-Fronten-Krieg gegen Israel sich auszuweiten droht. Und weil Russland die westliche Friedensdiplomatie in der Region hintertreiben könnte.,https://image.stern.de/34267730/t/ov/v4/w1440/r1.7778/-/aufmacher-putin.jpg,2023-12-07T14:34:06Z,,Russlands Präsident Wladimir Putin hat sich seit Ausbruch des Gaza-Kriegs im Nahen Osten diplomatisch zurückgehalten. Nun ist er kurzfristig nach Saudi-Arabien und in die Vereinigten Arabischen Emira… [+1997 chars],,de,'Russland'
https://www.n-tv.de/politik/Putin-waehnt-Russland-auf-der-Gewinnerseite-article24585681.html,https://www.n-tv.de/politik/Putin-waehnt-Russland-auf-der-Gewinnerseite-article24585681.html,0,www.n-tv.de,"""Ära radikaler Veränderungen"": Putin wähnt Russland auf der Gewinnerseite",Der Angriffskrieg gegen die Ukraine kurbelt Russlands Wirtschaft an. Allerdings kämpft das Land auch mit hohen Zinsen und einer Inflation. Kremlchef Putin sieht sich dennoch auf der Gewinnerstraße und träumt bereits von einer neuen Weltordnung.,https://bilder3.n-tv.de/img/incoming/crop24585694/8221322571-cImg_16_9-w1200/437754838.jpg,2023-12-07T14:49:10Z,https://web.archive.org/web/20231208003636/https://www.n-tv.de/politik/Putin-waehnt-Russland-auf-der-Gewinnerseite-article24585681.html,Der Angriffskrieg gegen die Ukraine kurbelt Russlands Wirtschaft an. Allerdings kämpft das Land auch mit hohen Zinsen und einer Inflation. Kremlchef Putin sieht sich dennoch auf der Gewinnerstraße un… [+1673 chars],,de,'Ukraine'
https://www.zeit.de/news/2023-12/07/opposition-startet-kampagne-gegen-putin,https://www.zeit.de/news/2023-12/07/opposition-startet-kampagne-gegen-putin,0,www.zeit.de,Wahlen in Russland: Opposition startet Kampagne gegen Putin,Hier finden Sie Informationen zu dem Thema „Wahlen in Russland“. Lesen Sie jetzt „Opposition startet Kampagne gegen Putin“.,https://img.zeit.de/news/2023-12/07/opposition-startet-kampagne-gegen-putin-image-group/wide__1300x731,2023-12-07T14:50:01Z,,Kremlgegner um den inhaftierten russischen Oppositionellen Alexej Nawalny haben vor der Präsidentenwahl am 17. März eine Kampagne gegen Staatschef Wladimir Putin gestartet. «Russland ohne Putin» heiß… [+5130 chars],,de,'Putin'
https://www.stern.de/politik/ausland/wahlen-in-russland--opposition-startet-kampagne-gegen-putin-34268070.html,https://www.stern.de/politik/ausland/wahlen-in-russland--opposition-startet-kampagne-gegen-putin-34268070.html,0,www.stern.de,Wahlen in Russland: Opposition startet Kampagne gegen Putin,In Russland ist die Präsidentenwahl nun für den 17. März 2024 offiziell angesetzt. Kremlgegner wollen es Präsident Putin nicht einfach machen mit einem Verbleib im Amt.,https://image.stern.de/34268072/t/nh/v1/w1440/r1.7778/-/07--urnnewsmldpacom2009010123120799216129v3w800h600l186t5r1619b1705jpeg---a6e434dec44ecbc8.jpg,2023-12-07T14:50:01Z,,"In Russland ist die Präsidentenwahl nun für den 17. März 2024 offiziell angesetzt. Kremlgegner wollen es Präsident Putin nicht einfach machen mit einem Verbleib im Amt.
Kremlgegner um den inhaftiert… [+4275 chars]",,de,'Russland'
