index,url,valid,domain,title,description,image,published,archive,content,quote,language,keyword
https://www.faz.net/aktuell/politik/ukrainekrieg-waffenstillstand-fuehrt-nicht-zu-frieden-18931626.html,https://www.faz.net/aktuell/politik/ukrainekrieg-waffenstillstand-fuehrt-nicht-zu-frieden-18931626.html,0,www.faz.net,Ukrainekrieg: Waffenstillstand führt nicht zu Frieden,Ein Waffenstillstand zwischen Russland und der Ukraine würde nicht zu Frieden führen. Nur die dauerhafte militärische Unterstützung der Ukraine wird dieses Ziel erreichen. Eine Replik auf Johannes Varwick.,https://media1.faz.net/ppmedia/aktuell/gesellschaft/353838051/1.8931625/facebook_teaser_fplus/demonstration-fuer-die.jpg,2023-06-09T04:14:37Z,https://web.archive.org/web/20230609042203/http://www.faz.net/aktuell/politik/ukrainekrieg-waffenstillstand-fuehrt-nicht-zu-frieden-18931626.html,"Am 16. Mai schrieb mein Kollege Johannes Varwick an dieser Stelle, dass der Westen seine Strategie hinsichtlich des Kriegs zwischen Russland und der Ukraine ändern solle, um baldmöglichst einen Waffe… [+796 chars]",,de,'Ukraine'
https://consent.google.com/ml?continue=https://news.google.com/rss/articles/CBMinQFodHRwczovL3d3dy5zcGllZ2VsLmRlL3dpcnRzY2hhZnQvc2VydmljZS9zdHJvbW1hcmt0LWV4cGVydGUtc2llaHQtZ2VmYWhyLWV4cGxvZGllcmVuZGVyLWVuZXJnaWVwcmVpc2Utdm9yZXJzdC1nZWJhbm50LWEtMTcyMDNkZDItNjMxNi00MDViLTgyMDQtOGQ3OWM0MjAxYjgw0gEA?oc%3D5&gl=FR&hl=en-US&cm=2&pc=n&src=1,https://consent.google.com/ml?continue=https://news.google.com/rss/articles/CBMinQFodHRwczovL3d3dy5zcGllZ2VsLmRlL3dpcnRzY2hhZnQvc2VydmljZS9zdHJvbW1hcmt0LWV4cGVydGUtc2llaHQtZ2VmYWhyLWV4cGxvZGllcmVuZGVyLWVuZXJnaWVwcmVpc2Utdm9yZXJzdC1nZWJhbm50LWEtMTcyMDNkZDItNjMxNi00MDViLTgyMDQtOGQ3OWM0MjAxYjgw0gEA?oc%3D5&gl=FR&hl=en-US&cm=2&pc=n&src=1,0,consent.google.com,Trotz potenzieller Knappheit: Strommarktexperte sieht Gefahr explodierender Energiepreise vorerst gebannt - DER SPIEGEL,Trotz potenzieller Knappheit: Strommarktexperte sieht Gefahr explodierender Energiepreise vorerst gebannt  DER SPIEGELMehr zum Thema ansehen in Google News,,2023-06-09T06:29:55Z,,"We use cookies and data to<ul><li>Deliver and maintain Google services</li><li>Track outages and protect against spam, fraud, and abuse</li><li>Measure audience engagement and site statistics to unde… [+1131 chars]",,de,'Knappheit'
https://www.welt.de/geschichte/article245762662/DDR-Fluchttunnel-nach-53-Jahren-wiederentdeckt-und-gleich-zubetoniert.html,https://www.welt.de/geschichte/article245762662/DDR-Fluchttunnel-nach-53-Jahren-wiederentdeckt-und-gleich-zubetoniert.html,0,www.welt.de,Fluchttunnel nach 53 Jahren wiederentdeckt – und gleich zubetoniert,"Mehr als 70 Fluchttunnel wurden 1961 bis 1985 rund um West-Berlin gegraben, um Menschen aus der DDR ein freies Leben zu ermöglichen. Reste gibt es nur wenige. Jetzt wurde so ein Stollen gefunden. Aber er ist schon wieder unerreichbar.",https://img.welt.de/img/geschichte/mobile245762652/3531358297-ci16x9-w1200/Kombo-Tunnel-Bernauer-Strasse.jpg,2023-06-09T07:09:00Z,https://web.archive.org/web/20230609073215/http://www.welt.de/geschichte/article245762662/DDR-Fluchttunnel-nach-53-Jahren-wiederentdeckt-und-gleich-zubetoniert.html,"Immer noch stabil, nach mehr als einem halben Jahrhundert: Unter der Bernauer Straße in Berlin ist am 1. Juni 2023 ein hervorragend erhaltener Fluchttunnel aus der Zeit der Teilung der Stadt wiederen… [+5376 chars]",,de,'Flucht'
https://www.zeit.de/news/2023-06/09/wasserstand-sinkt-weiter-im-kachowka-stausee,https://www.zeit.de/news/2023-06/09/wasserstand-sinkt-weiter-im-kachowka-stausee,0,www.zeit.de,Ukraine: Wasserstand sinkt weiter im Kachowka-Stausee,,,2023-06-09T08:36:02Z,https://web.archive.org/web/20230610020326/https://www.zeit.de/news/2023-06/09/wasserstand-sinkt-weiter-im-kachowka-stausee,"When browsing with ads:
We collect personal data and also transmit it to third-party providers
 that help us improve and finance our digital content. Some of the information stored on your device, … [+821 chars]",,de,'Ukraine'
https://www.zeit.de/news/2023-06/09/verband-bei-kaltem-winter-sind-leere-gasspeicher-moeglich,https://www.zeit.de/news/2023-06/09/verband-bei-kaltem-winter-sind-leere-gasspeicher-moeglich,0,www.zeit.de,Energie: Verband: Bei kaltem Winter sind leere Gasspeicher möglich,,,2023-06-09T09:09:16Z,https://web.archive.org/web/20230610015019/https://www.zeit.de/news/2023-06/09/verband-bei-kaltem-winter-sind-leere-gasspeicher-moeglich,"When browsing with ads:
We collect personal data and also transmit it to third-party providers
 that help us improve and finance our digital content. Some of the information stored on your device, … [+821 chars]",,de,'Gasspeicher'
https://www.wiwo.de/unternehmen/energie/energie-speicherbetreiber-bei-kaltem-winter-gasmangel-moeglich/29196404.html,https://www.wiwo.de/unternehmen/energie/energie-speicherbetreiber-bei-kaltem-winter-gasmangel-moeglich/29196404.html,0,www.wiwo.de,Energie: Speicherbetreiber: Bei kaltem Winter Gasmangel möglich,"Wenig liegt ferner, als bei 30 Grad an besonders kalte Winter zu denken. Die Gasspeicherbetreiber tun es trotzdem und warnen: Auch volle Speicher könnten sich schnell leeren, wenn es richtig kalt wird.",https://www.wiwo.de/images/bernburg/29196402/3-format11240.jpg,2023-06-09T09:59:19Z,https://web.archive.org/web/20230609101446/http://www.wiwo.de/unternehmen/energie/energie-speicherbetreiber-bei-kaltem-winter-gasmangel-moeglich/29196404.html,Die Speicherbetreiber schließen weiterhin auch bei vollständig gefüllten Erdgasspeichern zu Winterbeginn einen Gasmangel im kommenden Frühjahr 2024 nicht aus. Dies geht aus aktualisierten Modellierun… [+3058 chars],,de,'Gasspeicher'
https://www.handelsblatt.com/politik/international/emissionen-was-der-ukrainekrieg-fuers-klima-bedeutet-forscher-berechnen-fussabdruck/29192556.html,https://www.handelsblatt.com/politik/international/emissionen-was-der-ukrainekrieg-fuers-klima-bedeutet-forscher-berechnen-fussabdruck/29192556.html,0,www.handelsblatt.com,Emissionen: Was der Ukrainekrieg fürs Klima bedeutet – Forscher berechnen Fußabdruck,Allein im ersten Jahr hat der Ukrainekrieg etwa so viele Emissionen verursacht wie ein Land wie Belgien im gleichen Zeitraum. Der größte Teil der Emissionen folgt aber erst noch.,https://www.handelsblatt.com/images/zerstoerter-wald-in-der-ukraine/29193142/2-format2003.jpg,2023-06-09T10:11:16Z,https://web.archive.org/web/20230609104012/https://www.handelsblatt.com/politik/international/emissionen-was-der-ukrainekrieg-fuers-klima-bedeutet-forscher-berechnen-fussabdruck/29192556.html,"Bonn Zerstörte Kraftwerke, brennende Wälder und Wohnblocks, die in Schutt und Asche liegen: Mit seinem Angriffskrieg in der Ukraine raubt Russland Menschen ihre Heimat oder sogar ihr Leben. Was der K… [+4997 chars]",,de,'Nordstream'
https://www.focus.de/politik/der-china-versteher/chinas-kohle-irrsinn-und-deutschland_id_195936583.html,https://www.focus.de/politik/der-china-versteher/chinas-kohle-irrsinn-und-deutschland_id_195936583.html,0,www.focus.de,Analyse vom China-Versteher - Chinas Kohle-Irrsinn macht Habecks Energiepolitik überflüssig,"Die Bundesregierung versucht, fossile Brennstoffe hinter sich zu lassen, um die deutsche Öko-Bilanz zu verbessern. Doch Chinas Kohlewahn macht die Klimabemühungen der Bundesregierung obsolet.Von FOCUS-online-Gastautor Alexander Görlach (Berlin und New York)",https://p6.focus.de/img/politik/ausland/id_186963651/kohlekraftwerk-in-xining-in-der-chinesischen-provinz-qinghai..jpg?im=Crop%3D%280%2C170%2C2048%2C1024%29%3BResize%3D%281200%2C627%29&impolicy=perceptual&quality=mediumHigh&hash=eb6fe05ba5ad5fef59853668f7621385d49e70bfc5600ef3c5028a250ad11bdd,2023-06-09T10:25:54Z,https://web.archive.org/web/20230609104220/https://www.focus.de/politik/der-china-versteher/chinas-kohle-irrsinn-und-deutschland_id_195936583.html,"<ul><li>
Kommentare</li><li>
E-Mail</li><li>
Teilen</li><li>
Mehr</li><li>
Twitter</li><li>
Drucken</li><li>
Feedback</li><li>
Fehler meldenSie haben einen Fehler gefunden?
Bitte markieren S… [+5332 chars]",,de,'Kohle'
https://www.faz.net/aktuell/wirtschaft/klima-nachhaltigkeit/gasspeicherverband-bei-kaltem-winter-sind-leere-speicher-moeglich-18951702.html,https://www.faz.net/aktuell/wirtschaft/klima-nachhaltigkeit/gasspeicherverband-bei-kaltem-winter-sind-leere-speicher-moeglich-18951702.html,0,www.faz.net,Gasspeicherverband: Bei kaltem Winter sind leere Speicher möglich,"Die Gasspeicher sind aktuell gut gefüllt. Sollte der nächste Winter besonders kalt werden, könnte trotzdem ein Mangel drohen, sagt der Verband der Speicherbetreiber.",https://media1.faz.net/ppmedia/aktuell/wirtschaft/4168705169/1.8951733/facebook_teaser/die-deutschen-gasspeicher-hier.jpg,2023-06-09T10:42:33Z,https://web.archive.org/web/20230609104353/http://www.faz.net/aktuell/wirtschaft/klima-nachhaltigkeit/gasspeicherverband-bei-kaltem-winter-sind-leere-speicher-moeglich-18951702.html,Die Speicherbetreiber schließen weiterhin auch bei vollständig gefüllten Erdgasspeichern zu Winterbeginn einen Gasmangel im kommenden Frühjahr nicht aus. Dies geht aus aktualisierten Modellierungen h… [+2303 chars],,de,'Gasspeicher'
https://www.zeit.de/politik/ausland/2023-06/ukraine-offensive-krieg-kreml-lawrence-freedman,https://www.zeit.de/politik/ausland/2023-06/ukraine-offensive-krieg-kreml-lawrence-freedman,0,www.zeit.de,"Offensive der Ukraine: ""Russland muss klar werden, dass seine Position unhaltbar ist""","Die erwartete Offensive der Ukraine hat begonnen. Der britische Militärexperte Sir Lawrence Freedman über Erfolgschancen, einen Waffenstillstand und die Lage im Kreml",,2023-06-09T10:45:41Z,http://archive.md/20230609104642/https://www.zeit.de/politik/ausland/2023-06/ukraine-offensive-krieg-kreml-lawrence-freedman,"When browsing with ads:
We collect personal data and also transmit it to third-party providers
 that help us improve and finance our digital content. Some of the information stored on your device, … [+821 chars]",,de,'Russland'
https://www.faz.net/aktuell/gesellschaft/kriminalitaet/nach-gefaengnisausbruch-casey-white-zu-lebenslanger-haft-verurteilt-18951730.html,https://www.faz.net/aktuell/gesellschaft/kriminalitaet/nach-gefaengnisausbruch-casey-white-zu-lebenslanger-haft-verurteilt-18951730.html,0,www.faz.net,Casey White zu lebenslanger Haft verurteilt,"Im Frühjahr 2022 war der Häftling mit einer Gefängniswärterin ausgebrochen. Die spektakuläre Flucht endete tragisch, als Ermittler das Paar aufspürten und die Vollzugsbeamtin sich das Leben nahm. Nun wurde Casey White wieder verurteilt.",https://media1.faz.net/ppmedia/aktuell/feuilleton/1136810289/1.8951763/facebook_teaser/der-entflohene-haeftling-casey.jpg,2023-06-09T10:59:13Z,https://web.archive.org/web/20230609134214/https://www.faz.net/aktuell/gesellschaft/kriminalitaet/nach-gefaengnisausbruch-casey-white-zu-lebenslanger-haft-verurteilt-18951730.html,"Nach einer spektakulären Flucht aus einem Gefängnis im Bundesstaat Alabama, die von der stellvertretenden Leiterin der Justizvollzugsanstalt geplant worden war, ist der Amerikaner Casey White zu lebe… [+1586 chars]",,de,'Flucht'
https://www.zeit.de/news/2023-06/09/erdogan-ersetzt-zentralbank-chef-mit-ehemaliger-us-bankerin,https://www.zeit.de/news/2023-06/09/erdogan-ersetzt-zentralbank-chef-mit-ehemaliger-us-bankerin,0,www.zeit.de,Kampf gegen die Inflation: Erdogan ersetzt Zentralbank-Chef mit ehemaliger US-Bankerin,,,2023-06-09T11:44:49Z,https://web.archive.org/web/20230610022636/https://www.zeit.de/news/2023-06/09/erdogan-ersetzt-zentralbank-chef-mit-ehemaliger-us-bankerin,"When browsing with ads:
We collect personal data and also transmit it to third-party providers
 that help us improve and finance our digital content. Some of the information stored on your device, … [+821 chars]",,de,'Inflation'
https://www.zeit.de/wirtschaft/2023-06/bauern-protest-polen-agrarimporte-ukraine,https://www.zeit.de/wirtschaft/2023-06/bauern-protest-polen-agrarimporte-ukraine,0,www.zeit.de,Protest: Polnische Landwirte blockieren Grenzübergang zur Ukraine,Im ostpolnischen Dorohusk können derzeit keine Güter aus der Ukraine die Grenze passieren. Mit der Blockade protestieren Bauern gegen den Import günstiger Agrarprodukte.,,2023-06-09T12:03:46Z,https://web.archive.org/web/20230610025937/https://www.zeit.de/wirtschaft/2023-06/bauern-protest-polen-agrarimporte-ukraine,"When browsing with ads:
We collect personal data and also transmit it to third-party providers
 that help us improve and finance our digital content. Some of the information stored on your device, … [+821 chars]",,de,'Ukraine'
https://www.stern.de/wirtschaft/news/eu--gemeinsame-gaseinkaeufe--erste-vertraege-unterschrieben-33544436.html,https://www.stern.de/wirtschaft/news/eu--gemeinsame-gaseinkaeufe--erste-vertraege-unterschrieben-33544436.html,0,www.stern.de,EU: Gemeinsame Gaseinkäufe: erste Verträge unterschrieben,"Vor dem Hintergrund des Ukraine-Krieges hatten EU-Länder beschlossen, gemeinsam Gas einzukaufen - und sich nicht gegenseitig zu überbieten. Erste Verträge seien bereits unterzeichnet, heißt es aus Brüssel.",https://image.stern.de/33544438/t/cC/v1/w1440/r1.7778/-/09--urnnewsmldpacom2009010123060999998258v3w800h600l555t81r1632b908jpeg---5ae3ce712fc030d3.jpg,2023-06-09T12:14:04Z,https://web.archive.org/web/20230609134054/https://www.stern.de/wirtschaft/news/eu--gemeinsame-gaseinkaeufe--erste-vertraege-unterschrieben-33544436.html,"Vor dem Hintergrund des Ukraine-Krieges hatten EU-Länder beschlossen, gemeinsam Gas einzukaufen - und sich nicht gegenseitig zu überbieten. Erste Verträge seien bereits unterzeichnet, heißt es aus Br… [+1350 chars]",,de,'Gasspeicher'
https://www.zeit.de/news/2023-06/09/polizei-geht-nach-explosion-von-zwei-verdaechtigen-aus,https://www.zeit.de/news/2023-06/09/polizei-geht-nach-explosion-von-zwei-verdaechtigen-aus,0,www.zeit.de,Angriff auf Trauergemeinde: Polizei geht nach Explosion von zwei Verdächtigen aus,,,2023-06-09T13:54:57Z,https://web.archive.org/web/20230610022210/https://www.zeit.de/news/2023-06/09/polizei-geht-nach-explosion-von-zwei-verdaechtigen-aus,"When browsing with ads:
We collect personal data and also transmit it to third-party providers
 that help us improve and finance our digital content. Some of the information stored on your device, … [+821 chars]",,de,'Explosion'
https://www.n-tv.de/wirtschaft/Bei-hartem-Winter-sind-leere-Gasspeicher-moeglich-article24180572.html,https://www.n-tv.de/wirtschaft/Bei-hartem-Winter-sind-leere-Gasspeicher-moeglich-article24180572.html,0,www.n-tv.de,Aktueller Füllstand sehr positiv: Bei hartem Winter sind leere Gasspeicher möglich,"Aller Befürchtungen zum Trotz kommt Deutschland mit seinem Gas sehr gut durch den letzten Winter. Auch das aktuelle Niveau der Gasspeicher ist positiv. Das heißt aber nicht, dass der Füllstand in einem kalten Jahr nicht auch mal auf Null fallen könne, warnen …",https://bilder4.n-tv.de/img/incoming/crop24180635/9161328135-cImg_16_9-w1200/401500465.jpg,2023-06-09T14:18:34Z,https://web.archive.org/web/20230609145553/https://www.n-tv.de/wirtschaft/Bei-hartem-Winter-sind-leere-Gasspeicher-moeglich-article24180572.html,"Aller Befürchtungen zum Trotz kommt Deutschland mit seinem Gas sehr gut durch den letzten Winter. Auch das aktuelle Niveau der Gasspeicher ist positiv. Das heißt aber nicht, dass der Füllstand in ein… [+2583 chars]",,de,'Gasspeicher'
https://www.n-tv.de/politik/Norweger-finden-Belege-fuer-Explosion-bei-Kachowka-Dammbruch-article24180731.html,https://www.n-tv.de/politik/Norweger-finden-Belege-fuer-Explosion-bei-Kachowka-Dammbruch-article24180731.html,0,www.n-tv.de,Seismologen messen Erschütterung: Norweger finden Belege für Explosion bei Kachowka-Dammbruch,"Ein norwegisches Institut unterhält unter anderem in Rumänien eine seismologische Messstation - und die schlägt offenbar an. Zum Zeitpunkt des Bruches des Kachowka-Staudamms in der Ukraine seien dort Erschütterungen gemessen worden, die von Explosionen stamme…",https://bilder1.n-tv.de/img/incoming/crop24180760/6891329873-cImg_16_9-w1200/412352332.jpg,2023-06-09T14:37:46Z,https://web.archive.org/web/20230609145532/https://www.n-tv.de/politik/Norweger-finden-Belege-fuer-Explosion-bei-Kachowka-Dammbruch-article24180731.html,Ein norwegisches Institut unterhält unter anderem in Rumänien eine seismologische Messstation - und die schlägt offenbar an. Zum Zeitpunkt des Bruches des Kachowka-Staudamms in der Ukraine seien dort… [+2072 chars],,de,'Explosion'
https://www.faz.net/aktuell/politik/ukraine-liveticker-putin-ukrainische-gegenoffensive-hat-begonnen-faz-18495964.html,https://www.faz.net/aktuell/politik/ukraine-liveticker-putin-ukrainische-gegenoffensive-hat-begonnen-faz-18495964.html,0,www.faz.net,Ukraine-Liveblog: Putin: Ukrainische Gegenoffensive hat begonnen,Russische Armee meldet schwere Kämpfe in Saporischschja und Donezk +++ Deutschlands Botschafterin in Kiew nennt russische Luftangriffe „Terror“ +++ Selenskyj wirft russischen Truppen „Ökozid“ vor +++ alle Entwicklungen im Liveblog,https://media0.faz.net/ppmedia/aktuell/928435980/1.8953218/facebook_teaser/der-russische-praesident.jpg,2023-06-09T15:09:00Z,https://web.archive.org/web/20230609154207/https://www.faz.net/aktuell/politik/ukraine-liveticker-putin-ukrainische-gegenoffensive-hat-begonnen-faz-18495964.html,"In der Region Dnipropetrowsk beschädigten Trümmer abgeschossener Drohnen und Raketen zwei Wohnhäuser, eine Gasleitung und ein Auto, wie der Militärgouverneur des Gebiets, Serhij Lyssak, mitteilte. Es… [+816 chars]",,de,'Ukraine'
https://www.handelsblatt.com/finanzen/geldpolitik/markus-brunnermeier-rueckkehr-zu-zwei-prozent-inflation-wird-ganze-weile-dauern/29194838.html,https://www.handelsblatt.com/finanzen/geldpolitik/markus-brunnermeier-rueckkehr-zu-zwei-prozent-inflation-wird-ganze-weile-dauern/29194838.html,0,www.handelsblatt.com,Marcus Brunnermeier im Interview: „Notenbanker müssen sich unbeliebt machen“ – Top-Ökonom sieht nur eine Chance gegen die hohe Inflation,Der Princeton-Ökonom fordert von Zentralbanken mehr Druck auf die Regierungen. Ohne fiskalpolitische Disziplin sei der Kampf gegen die Inflation kaum zu gewinnen.,https://www.handelsblatt.com/images/ezb-praesidentin-christine-lagarde/29198476/2-format2003.jpg,2023-06-09T15:14:44Z,,"EZB-Präsidentin Christine LagardeNoch sind die Inflationserwartungen der Bürger im Euro-Raum verankert, sagt Ökonom Brunnermeier.
(Foto: IMAGO/photothek)
Markus Brunnermeier hält sich zurzeit zu Fo… [+1321 chars]",,de,'Inflation'
https://www.welt.de/vermischtes/article245788086/Hamburg-Grossbrand-in-Hafencity-Gasflaschen-explodieren-auf-Baustelle.html,https://www.welt.de/vermischtes/article245788086/Hamburg-Grossbrand-in-Hafencity-Gasflaschen-explodieren-auf-Baustelle.html,0,www.welt.de,Explosion von Gasflaschen auf Baustelle in Hamburgs Hafencity,"Auf einem noch unfertigen Gebäude in der Hamburger Chicagostraße hat es mehrere Explosionen von Gasflaschen gegeben. Daraufhin entstand ein Großbrand mit einer Rauchwolke, die über die Stadt hinwegzog.",https://img.welt.de/img/newsticker/dpa_nt/infoline_nt/panorama_nt/mobile245789432/7891357827-ci16x9-w1200/Hamburger-HafenCity.jpg,2023-06-09T16:08:02Z,https://web.archive.org/web/20230609174221/https://www.welt.de/vermischtes/article245788086/Hamburg-Grossbrand-in-Hafencity-Gasflaschen-explodieren-auf-Baustelle.html,"Auf einem zehnstöckigen Gebäude auf einer Baustelle in der Hamburger Hafencity hat es am Freitag mehrere Explosionen gegeben. Es waren Knallgeräusche zu hören, die nach Angaben der Polizei von Gasfla… [+889 chars]",,de,'Explosion'
https://taz.de/Neue-Zentralbankchefin-in-der-Tuerkei/!5939621/,https://taz.de/Neue-Zentralbankchefin-in-der-Tuerkei/!5939621/,0,taz.de,Neue Zentralbankchefin in der Türkei: Die jüngste und die erste Frau,"Die US-Finanzmanagerin Hafize Gaye Erkan wird neue Chefin der türkischen Zentralbank. Schafft sie es, die Inflation am Bosporus zu bändigen?",https://taz.de/picture/6315327/948/Tuerkei-Zentralbank-Erkan-1.jpeg,2023-06-09T16:47:00Z,https://web.archive.org/web/20230609172321/https://taz.de/Neue-Zentralbankchefin-in-der-Tuerkei/!5939621/,"Die US-Finanzmanagerin Hafize Gaye Erkan wird neue Chefin der türkischen Zentralbank. Schafft sie es, die Inflation am Bosporus zu bändigen?
Neue Zentralbankchefin Hafize Gaye Erkan Foto: Emin Sansa… [+2898 chars]",,de,'Inflation'
https://www.zeit.de/politik/ausland/2023-06/ukraine-ueberblick-kachowka-staudamm-russland-getreideabkommen,https://www.zeit.de/politik/ausland/2023-06/ukraine-ueberblick-kachowka-staudamm-russland-getreideabkommen,0,www.zeit.de,"Ukraine-Überblick: Nachweis von Staudamm-Explosion, Getreideabkommen vor dem Ende",Seismologen haben eine Explosion am ukrainischen Kachowka-Staudamm zum Zeitpunkt seiner Zerstörung festgestellt. Russland will Getreideabkommen nicht verlängern. Der Tag,,2023-06-09T16:49:31Z,https://web.archive.org/web/20230609175528/https://www.zeit.de/politik/ausland/2023-06/ukraine-ueberblick-kachowka-staudamm-russland-getreideabkommen,"When browsing with ads:
We collect personal data and also transmit it to third-party providers
 that help us improve and finance our digital content. Some of the information stored on your device, … [+821 chars]",,de,'Russland'
https://www.faz.net/aktuell/politik/ausland/ukraine-krieg-die-kaempfe-werden-heftiger-18953045.html,https://www.faz.net/aktuell/politik/ausland/ukraine-krieg-die-kaempfe-werden-heftiger-18953045.html,0,www.faz.net,Krieg gegen die Ukraine: Die Kämpfe werden heftiger,"Im Donbass wird nach Angaben des ukrainischen Militärs „um jeden Quadratmeter“ gekämpft. Es mehren sich Berichte, dass Russland Hilfe für die Menschen im besetzten Teil des Flutgebiets behindert.",https://media1.faz.net/ppmedia/aktuell/1346809144/1.8953041/facebook_teaser/ukrainische-soldaten-nah-der.jpg,2023-06-09T18:15:00Z,https://web.archive.org/web/20230609194511/http://www.faz.net/aktuell/politik/ausland/ukraine-krieg-die-kaempfe-werden-heftiger-18953045.html,Seit Anfang der Woche meldet das russische Militär regelmäßig Erfolge bei der Abwehr der seit Langem erwarteten großen ukrainischen Gegenoffensive. Am Freitag sprach dann auch Russlands Präsident Wla… [+5181 chars],,de,'Explosion'
https://www.telepolis.de/features/Ukraine-Krieg-Die-Gegenoffensive-hat-begonnen-9183395.html,https://www.telepolis.de/features/Ukraine-Krieg-Die-Gegenoffensive-hat-begonnen-9183395.html,0,www.telepolis.de,Ukraine-Krieg: Die Gegenoffensive hat begonnen,"Meldungen verdichten sich: Kiews Offensive startet mit westlichen Waffen, aber zunächst ohne entscheidende Erfolge.",https://heise.cloudimg.io/bound/1200x1200/q85.png-lossy-85.webp-lossy-85.foil1/_www-heise-de_/imgs/18/4/2/5/3/3/3/3/Ukrainian_military_cars_on_the_outskirts_of_Shebekino-4eb10a488295a180.jpeg,2023-06-09T22:00:00Z,https://web.archive.org/web/20230609230011/https://www.telepolis.de/features/Ukraine-Krieg-Die-Gegenoffensive-hat-begonnen-9183395.html,"Ukrainische Militärfahrzeuge vor wenigen Tagen am Stadtrand von Shebekino. Foto: / CC-Zero
Meldungen verdichten sich: Kiews Offensive startet mit westlichen Waffen, aber zunächst ohne entscheidende … [+4087 chars]",,de,'Ukraine'
https://www.n-tv.de/politik/01-31-EU-Staaten-wollen-Regeln-fuer-die-Verfolgung-von-Sanktionsverstoessen--article23143824.html,https://www.n-tv.de/politik/01-31-EU-Staaten-wollen-Regeln-fuer-die-Verfolgung-von-Sanktionsverstoessen--article23143824.html,0,www.n-tv.de,Ukraine-Krieg im Liveticker: +++ 01:31 EU-Staaten wollen Regeln für die Verfolgung von Sanktionsverstößen +++,"Berlin, Washington, Br\u00fcssel - \u00fcberall. n-tv berichtet von allen wichtigen Schaupl\u00e4tzen der Innen- und Au\u00dfenpolitik.",https://bilder2.n-tv.de/img/incoming/crop23332537/9041326157-cImg_16_9-w1200/Liveticker1-grau-1-Kopie.jpg,2023-06-09T22:30:00Z,https://web.archive.org/web/20230609233242/https://www.n-tv.de/politik/01-31-EU-Staaten-wollen-Regeln-fuer-die-Verfolgung-von-Sanktionsverstoessen--article23143824.html,In der EU soll es künftig Mindestvorschriften für die Bestrafung von Verstößen gegen EU-Sanktionen geben. So soll zum Beispiel die Lieferung von Militärgütern an Russland künftig EU-weit mit einer Fr… [+9717 chars],,de,'Explosion'
https://www.n-tv.de/politik/00-41-Rheinmetall-Chef-raeumt-Verluste-deutscher-Waffen-in-der-Ukraine-ein--article23143824.html,https://www.n-tv.de/politik/00-41-Rheinmetall-Chef-raeumt-Verluste-deutscher-Waffen-in-der-Ukraine-ein--article23143824.html,0,www.n-tv.de,Ukraine-Krieg im Liveticker: +++ 00:41 Rheinmetall-Chef räumt Verluste deutscher Waffen in der Ukraine ein +++,"Berlin, Washington, Br\u00fcssel - \u00fcberall. n-tv berichtet von allen wichtigen Schaupl\u00e4tzen der Innen- und Au\u00dfenpolitik.",https://bilder2.n-tv.de/img/incoming/crop23332537/9041326157-cImg_16_9-w1200/Liveticker1-grau-1-Kopie.jpg,2023-06-09T22:30:00Z,https://web.archive.org/web/20230609225156/https://www.n-tv.de/politik/00-41-Rheinmetall-Chef-raeumt-Verluste-deutscher-Waffen-in-der-Ukraine-ein--article23143824.html,"Der Chef des größten deutschen Rüstungskonzerns Rheinmetall, Armin Papperger, räumt Verluste von Waffensystemen ein, die aus Deutschland in die Ukraine geliefert wurden. Gleichzeitig lobt er deren gr… [+8800 chars]",,de,'Waffen'
