index,url,valid,domain,title,description,image,published,archive,content,quote,language,keyword
https://www.faz.net/aktuell/politik/ukraine-liveticker-landesweiter-luftalarm-in-der-ukraine-faz-19030454.html,https://www.faz.net/aktuell/politik/ukraine-liveticker-landesweiter-luftalarm-in-der-ukraine-faz-19030454.html,0,www.faz.net,Ukraine-Liveblog: Landesweiter Luftalarm in der Ukraine,Selenskyj-Berater: Russland ist schon längst tot +++ Nach Belgorod-Beschuss: Putin kündigt neue Angriffe gegen Ukraine an +++ Nato-Generalsekretär erwartet 2024 Bündnisbeitritt Schwedensr +++ Alle Entwicklungen im Liveblog.,https://media1.faz.net/ppmedia/aktuell/politik/2383165944/1.9420553/facebook_teaser/nach-russischen-luftangriffen.jpg,2024-01-02T05:40:59Z,,"Bei einem russischen Raketenangriff auf ein Hotel in der ostukrainischen Stadt Charkiw ist am Samstag auch ein ZDF-Team getroffen worden. Das ZDF teilte am Sonntag mit, ein siebenköpfiges Team des Se… [+1050 chars]",,de,'Ukraine'
https://www.tagesschau.de/ausland/europa/ukraine-russische-angriffe-104.html,https://www.tagesschau.de/ausland/europa/ukraine-russische-angriffe-104.html,0,www.tagesschau.de,"Krieg in der Ukraine: ""Wir leiden alle wegen eines einzigen Menschen""",In den vergangenen Tagen hat Russland wieder vermehrt zivile Ziele in ukrainischen Großstädten angegriffen. Die Nerven vieler Menschen dort liegen blank. Von Andrea Beer.,https://images.tagesschau.de/image/71a3072d-1c49-40e2-8f3b-1287fea8e8c1/AAABjMvhsMo/AAABibBxqrQ/16x9-1280/charkiw-ukraine-zerstoerte-wohnung-100.jpg,2024-01-02T20:33:35Z,,"Stand: 02.01.2024 21:33 Uhr
In den vergangenen Tagen hat Russland wieder vermehrt zivile Ziele in ukrainischen Großstädten angegriffen. Die Nerven vieler Menschen dort liegen blank.
Ein Meer an Sch… [+5292 chars]",,de,'Ukraine'
https://www.faz.net/aktuell/politik/ukraine-liveticker-tuerkei-blockiert-uebergabe-von-minenraeum-schiffen-an-ukraine-faz-19030454.html,https://www.faz.net/aktuell/politik/ukraine-liveticker-tuerkei-blockiert-uebergabe-von-minenraeum-schiffen-an-ukraine-faz-19030454.html,0,www.faz.net,Ukraine-Liveblog: Türkei blockiert Übergabe von Minenräum-Schiffen an Ukraine,Russland setzt Raketenangriffe auf Kiew fort +++ Landesweiter Luftalarm in der Ukraine +++ Selenskyj-Berater: Russland ist schon längst tot +++ Alle Entwicklungen im Liveblog.,https://media1.faz.net/ppmedia/aktuell/politik/1590669665/1.9422465/facebook_teaser/ein-minenraeumer-faehrt-in-den.jpg,2024-01-02T21:30:07Z,,"Ein Minenräumer fährt in den Hafen von Konstanza, Rumänien: Das ehemalige Schiff der British Royal Navy soll Minen im Schwarzen Meer zerstören. Bild: EPA
Russland setzt Raketenangriffe auf Kiew fort… [+130 chars]",,de,'Russland'
https://www.faz.net/aktuell/politik/ukraine-liveticker-un-menschenrechtskommissar-fordert-deeskalation-faz-19030454.html,https://www.faz.net/aktuell/politik/ukraine-liveticker-un-menschenrechtskommissar-fordert-deeskalation-faz-19030454.html,0,www.faz.net,Ukraine-Liveblog: UN-Menschenrechtskommissar fordert Deeskalation,Türkei blockiert Übergabe von Minenräum-Schiffen an Ukraine +++ Russland setzt Raketenangriffe auf Kiew fort +++ Landesweiter Luftalarm in der Ukraine +++ Alle Entwicklungen im Liveblog.,https://media0.faz.net/ppmedia/aktuell/3117378613/1.9422532/facebook_teaser/schwer-beschaedigte-gebaeude.jpg,2024-01-03T02:34:01Z,,"Ukraine-Liveblog: UN-Menschenrechtskommissar fordert Deeskalation
Ukraine-Liveblog
UN-Menschenrechtskommissar fordert Deeskalation
Von Türkei blockiert Übergabe von Minenräum-Schiffen an Ukraine +… [+190 chars]",,de,'Ukraine'
https://m.focus.de/wissen/jetzt-kommt-eisige-kaelte-was-das-fuer-deutschlands-flutgebiete-bedeutet_id_259543810.html,https://m.focus.de/wissen/jetzt-kommt-eisige-kaelte-was-das-fuer-deutschlands-flutgebiete-bedeutet_id_259543810.html,0,m.focus.de,Hochwasser in Niedersachsen - Jetzt kommt eisige Kälte - was das für Deutschlands Flutgebiete bedeutet,Schon seit Weihnachten drücken die Flüsse gegen die Deiche - doch warum wird das nun zum Problem? Und woher kommt all das Wasser? Die sechs wichtigsten Fragen zu den Überschwemmungen.,https://p6.focus.de/img/wissen/id_259543808/fuer-niedersachsens-deiche-wird-es-kritisch.png?im=Crop%3D%2874%2C0%2C1448%2C724%29%3BResize%3D%281200%2C627%29&impolicy=perceptual&quality=mediumHigh&hash=27eff8f9277d369f29864ca9ae5abafde8e013b15422d3e35d9a5856bf5f388c,2024-01-03T08:23:49Z,,"Eines fragen sich alle: halten die Deiche? Überall in der norddeutschen Tiefebene sind die Flüsse angeschwollen, Elbe, Weser, Aller und Hunte drücken gegen die Schutzbauwerke entlang ihrer Ufer. Und … [+10359 chars]",,de,'Frieren'
