index,url,valid,domain,title,description,image,published,archive,content,quote,language,keyword
https://www.focus.de/kultur/kino_tv/tv-kolumne-maybrit-illner-konfliktforscherin-das-entsetzen-ueber-die-bilder-wird-sehr-sehr-gross-sein_id_196542591.html,https://www.focus.de/kultur/kino_tv/tv-kolumne-maybrit-illner-konfliktforscherin-das-entsetzen-ueber-die-bilder-wird-sehr-sehr-gross-sein_id_196542591.html,0,www.focus.de,TV-Kolumne „Maybrit Illner“ - Oberst: „Der Westen darf nicht müde werden und muss Waffen nachliefern“,"Politiker und Militärexperten diskutieren bei Maybrit Illner den weiteren Verkauf des Ukraine-Krieges und sind sich einig: Es wird lange dauern, sehr teuer - und sehr hässlich und blutig. Deshalb fordert die Runde fast unisono mehr Waffen für die Ukrainer.Von…",https://p6.focus.de/img/fotos/id_196541960/maybrit-illner-mit-ihren-gaesten-am-donnerstagabend.png?im=Crop%3D%2837%2C0%2C622%2C311%29%3BResize%3D%281200%2C627%29&impolicy=perceptual&quality=mediumHigh&hash=d8c702570f155093aa8f18a76a64bd2ade38e398f4e700d64fce3d6ee0dafbc6,2023-06-16T04:21:20Z,,"Politiker und Militärexperten diskutieren bei Maybrit Illner den weiteren Verkauf des Ukraine-Krieges und sind sich einig: Es wird lange dauern, sehr teuer - und sehr hässlich und blutig. Deshalb for… [+4855 chars]",,de,'Waffen'
https://www.zeit.de/news/2023-06/16/putin-lobt-russlands-wirtschaft-doch-die-probleme-wachsen,https://www.zeit.de/news/2023-06/16/putin-lobt-russlands-wirtschaft-doch-die-probleme-wachsen,0,www.zeit.de,Konflikte: Putin lobt Russlands Wirtschaft - doch die Probleme wachsen,,,2023-06-16T04:24:26Z,https://web.archive.org/web/20230617061612/https://www.zeit.de/news/2023-06/16/putin-lobt-russlands-wirtschaft-doch-die-probleme-wachsen,"When browsing with ads:
We collect personal data and also transmit it to third-party providers
 that help us improve and finance our digital content. Some of the information stored on your device, … [+821 chars]",,de,'Russland'
https://consent.google.com/ml?continue=https://news.google.com/rss/articles/CBMiqQFodHRwczovL3d3dy5ydWhybmFjaHJpY2h0ZW4uZGUvY2FzdHJvcC1yYXV4ZWwvc3RyZWl0LWNhc3Ryb3AtcmF1eGVsLWVza2FsaWVydC1wb2xpemVpLWdyb3NzYXVmZ2Vib3Qtc3RyYXNzZS1nZXNwZXJydC13YWZmZW4tbWFjaGV0ZW4ta251ZXBwZWwtbmV0dG8tdzc0NjAwMi1wLTIwMDA4MzU3NTAv0gEA?oc%3D5&gl=FR&hl=en-US&cm=2&pc=n&src=1,https://consent.google.com/ml?continue=https://news.google.com/rss/articles/CBMiqQFodHRwczovL3d3dy5ydWhybmFjaHJpY2h0ZW4uZGUvY2FzdHJvcC1yYXV4ZWwvc3RyZWl0LWNhc3Ryb3AtcmF1eGVsLWVza2FsaWVydC1wb2xpemVpLWdyb3NzYXVmZ2Vib3Qtc3RyYXNzZS1nZXNwZXJydC13YWZmZW4tbWFjaGV0ZW4ta251ZXBwZWwtbmV0dG8tdzc0NjAwMi1wLTIwMDA4MzU3NTAv0gEA?oc%3D5&gl=FR&hl=en-US&cm=2&pc=n&src=1,0,consent.google.com,RN+ Massenschlägerei mit Waffen in Castrop-Rauxel: Person in Lebensgefahr – Video zeigt brutale Szenen - Ruhr Nachrichten,"<ol><li>RN+ Massenschlägerei mit Waffen in Castrop-Rauxel: Person in Lebensgefahr – Video zeigt brutale Szenen  Ruhr Nachrichten
</li><li>CHAOS IN CASTROP-RAUXEL: Massive Massenschlägerei mit Macheten und Knüppel - Polizei-Großeinsatz  WELT Nachrichtensender…",,2023-06-16T04:35:00Z,,"We use cookies and data to<ul><li>Deliver and maintain Google services</li><li>Track outages and protect against spam, fraud, and abuse</li><li>Measure audience engagement and site statistics to unde… [+1131 chars]",,de,'Waffen'
https://www.telepolis.de/features/Heizen-mit-Holz-Nachhaltige-Alternative-oder-oekologisches-Dilemma-9189397.html,https://www.telepolis.de/features/Heizen-mit-Holz-Nachhaltige-Alternative-oder-oekologisches-Dilemma-9189397.html,0,www.telepolis.de,Heizen mit Holz: Nachhaltige Alternative oder ökologisches Dilemma?,"Bundesregierung hat Holzheizung ihr Gütesiegel verliehen – zurecht? Erfahren Sie, wie das Heizen mit Holz wirklich zur CO2-Bilanz beiträgt. Ist Holz eine Alternative beim Heizen?",https://heise.cloudimg.io/bound/1200x1200/q85.png-lossy-85.webp-lossy-85.foil1/_www-heise-de_/imgs/18/4/2/5/6/5/6/1/wood-fired-oven-1960099_1280-373b07d3c8fc0fce.jpeg,2023-06-16T05:00:00Z,https://web.archive.org/web/20230616053459/https://www.telepolis.de/features/Heizen-mit-Holz-Nachhaltige-Alternative-oder-oekologisches-Dilemma-9189397.html,"Holz verbrennen ist schön aber ist es auch nachhaltig?
(Bild: campellif, Pixabay)
Bundesregierung hat Holzheizung ihr Gütesiegel verliehen zurecht? Erfahren Sie, wie das Heizen mit Holz wirklich zu… [+3494 chars]",,de,'Heizen'
https://www.stern.de/panorama/video-iaea--situation-von-akw-saporischschja-stabil-33563716.html,https://www.stern.de/panorama/video-iaea--situation-von-akw-saporischschja-stabil-33563716.html,0,www.stern.de,Video: IAEA: Situation von AKW Saporischschja stabil,"Der Chef der Internationalen Atomenergie-Behörde, Rafael Grossi, hat das ukrainische Kernkraftwerk Saporischschja besucht - aus Sicherheitsgründen einen Tag später als ursprünglich geplant.",https://image.stern.de/33563718/t/kf/v1/w1440/r1.7778/-/16-iaea--situation-von-akw-saporischschja-stabil-6329520587112-1.jpg,2023-06-16T05:39:39Z,https://web.archive.org/web/20230617021634/https://www.stern.de/panorama/video-iaea--situation-von-akw-saporischschja-stabil-33563716.html,"Zugang zu allen STERN PLUS-Inhalten und Artikeln aus dem Print-Magazin
werbefrei &amp; jederzeit kündbar
Bereits registriert?
Hier anmelden",,de,'Atomenergie'
https://www.sueddeutsche.de/panorama/iaea-situation-von-akw-saporischschja-stabil-1.5936755,https://www.sueddeutsche.de/panorama/iaea-situation-von-akw-saporischschja-stabil-1.5936755,0,www.sueddeutsche.de,: IAEA: Situation von AKW Saporischschja stabil,"Der Chef der Internationalen Atomenergie-Behörde, Rafael Grossi, hat das ukrainische Kernkraftwerk Saporischschja besucht - aus Sicherheitsgründen einen Tag später als ursprünglich geplant.",https://www.sueddeutsche.de/image/sz.1.5936756/1200x675?v=1686893986000,2023-06-16T05:39:46Z,https://web.archive.org/web/20230616125239/https://www.sueddeutsche.de/panorama/iaea-situation-von-akw-saporischschja-stabil-1.5936755,"16. Juni 2023, 05:39
 "",""authorTextHtml"":""Direkt aus dem Reuters-Videokanal"",""mainTheme"":""Video"",""durationInSeconds"":""01:33"",""tags"":[""Video""],""autoListing"":true,""seoData"":{""seoTitle"":"""",""seoDescript… [+8314 chars]",,de,'Atomenergie'
https://kaernten.orf.at/stories/3211953/,https://kaernten.orf.at/stories/3211953/,0,kaernten.orf.at,Gestohlenes Sturmgewehr: Polizist suspendiert,Bei einer waffenpolizeilichen Verlässlichkeitsprüfung sind bei einem Kärntner Polizisten insgesamt 20 Waffen und über 5000 Schuss Munition gefunden worden. Unter den Waffen war auch ein gestohlenes Sturmgewehr aus dem Jahr 2015. Der Beamte wurde vom Dienst su…,https://ibs.orf.at/ktn?image=https%3A%2F%2Foekastatic.orf.at%2Fmims%2F2019%2F18%2F89%2Fcrops%2Fw%3D1200%2Ch%3D627%2Cq%3D75%2F141786_master_33189_on-2019-01-08-13h43m27s736.png%3Fs%3D49c34f18134647d7e03ea69e7da392b40696dd52,2023-06-16T06:58:34Z,https://web.archive.org/web/20230616103826/https://kaernten.orf.at/stories/3211953/,"Eine der sichergestellten Waffen ist ein Sturmgewehr, ein StG 77 mit verkürztem Lauf, samt vier Magazinen mit jeweils 30 Schuss Munition. Die Überprüfung ergab, dass diese Waffe im Jahr 2015 von der … [+1565 chars]",,de,'Waffen'
https://www.wiwo.de/politik/ausland/editorial-der-mythos-von-einem-schnellen-frieden-mit-russland/29209218.html,https://www.wiwo.de/politik/ausland/editorial-der-mythos-von-einem-schnellen-frieden-mit-russland/29209218.html,0,www.wiwo.de,Editorial: Der Mythos von einem schnellen Frieden mit Russland,"Der Frieden in der Ukraine ist in weiter Ferne – aber auch unser Verhältnis zu Russland bleibt ungeklärt. In diesem Vakuum machen sich allerlei Mythen und absurde Forderungen breit. Und ein Frust, dass die Sanktionen nicht so wirken wie erhofft.",https://www.wiwo.de/images/edi/29209504/3-format11240.jpg,2023-06-16T07:53:06Z,https://web.archive.org/web/20230616150313/https://www.wiwo.de/politik/ausland/editorial-der-mythos-von-einem-schnellen-frieden-mit-russland/29209218.html,"Dem Krieg in der Ukraine fehlt von Anbeginn ein realistisches Szenario für den Frieden, zumal Russland noch nicht einmal von einem Krieg sprach. Die Lösung ist deshalb bis heute eine diffuse Vorstell… [+5235 chars]",,de,'Russland'
https://www.handelsblatt.com/politik/international/liveblog-zum-ukraine-krieg-russischen-raketenangriff-auf-kiew-waehrend-des-besuchs-afrikanischer-delegation-deutschland-liefert-neue-patriot-munition/27982126.html,https://www.handelsblatt.com/politik/international/liveblog-zum-ukraine-krieg-russischen-raketenangriff-auf-kiew-waehrend-des-besuchs-afrikanischer-delegation-deutschland-liefert-neue-patriot-munition/27982126.html,0,www.handelsblatt.com,+++ Ukraine-Krieg +++: Russischen Raketenangriff auf Kiew während des Besuchs afrikanischer Delegation – Deutschland liefert neue Patriot-Munition,Russland zahlt Prämien für zerstörte westliche Panzer +++ Selenskyj optimistisch bei Erfolg der ukrainischen Gegenoffensive +++ Zwei Tote in Cherson +++ Der Newsblog.,https://www.handelsblatt.com/images/afrikanische-staatschefs-an-einem-massengrab-in-bucha/29210664/2-format2003.jpg,2023-06-16T08:04:00Z,,"<li>Herr Klaus Thiele16.06.2023, 14:32 Uhr
Putin will morgen die Afrikaner empfangen und beschießt sie heute in Kiew ? Was will er denn damit sagen ? Der Typ ist doch total bekloppt. Leider hält er … [+4993 chars]",,de,'Russland'
https://www.handelsblatt.com/politik/international/liveblog-zum-ukraine-krieg-explosionen-in-kiew-bei-besuch-afrikanischer-friedensdelegation-deutschland-liefert-neue-patriot-munition/27982126.html,https://www.handelsblatt.com/politik/international/liveblog-zum-ukraine-krieg-explosionen-in-kiew-bei-besuch-afrikanischer-friedensdelegation-deutschland-liefert-neue-patriot-munition/27982126.html,0,www.handelsblatt.com,+++ Ukraine-Krieg +++: Explosionen in Kiew bei Besuch afrikanischer Friedensdelegation – Deutschland liefert neue Patriot-Munition,Russland zahlt Prämien für zerstörte westliche Panzer +++ Ukraine will mehrere Dutzend F-16-Piloten ausbilden lassen +++ Zwei Tote in Cherson +++ Der Newsblog.,https://www.handelsblatt.com/images/afrikanische-staatschefs-an-einem-massengrab-in-bucha/29210664/2-format2003.jpg,2023-06-16T08:04:00Z,https://web.archive.org/web/20230616123520/https://www.handelsblatt.com/politik/international/liveblog-zum-ukraine-krieg-explosionen-in-kiew-bei-besuch-afrikanischer-friedensdelegation-deutschland-liefert-neue-patriot-munition/27982126.html,"<li>Herr Hans Schönenberg15.06.2023, 19:25 Uhr
Herr Michael: Sie suchen ausgewogene Informationen: einfach die SZ lesen; dort läuft es ein wenig anders, als im Handelsblatt. Wir sollten auch untersc… [+4699 chars]",,de,'Explosion'
https://consent.google.com/ml?continue=https://news.google.com/rss/articles/CBMiVWh0dHBzOi8vd3d3LnRhZ2Vzc2NoYXUuZGUvaW5sYW5kL2lubmVucG9saXRpay9oZWl6dW5nLWtvbW11bmVuLXdhZXJtZXBsYW51bmctMTAwLmh0bWzSAQA?oc%3D5&gl=FR&hl=en-US&cm=2&pc=n&src=1,https://consent.google.com/ml?continue=https://news.google.com/rss/articles/CBMiVWh0dHBzOi8vd3d3LnRhZ2Vzc2NoYXUuZGUvaW5sYW5kL2lubmVucG9saXRpay9oZWl6dW5nLWtvbW11bmVuLXdhZXJtZXBsYW51bmctMTAwLmh0bWzSAQA?oc%3D5&gl=FR&hl=en-US&cm=2&pc=n&src=1,0,consent.google.com,Kommunale Wärmeplanung: Heizen wie Heidelberg - tagesschau.de,Kommunale Wärmeplanung: Heizen wie Heidelberg  tagesschau.de,,2023-06-16T08:05:42Z,,"We use cookies and data to<ul><li>Deliver and maintain Google services</li><li>Track outages and protect against spam, fraud, and abuse</li><li>Measure audience engagement and site statistics to unde… [+1131 chars]",,de,'Heizen'
https://www.zeit.de/news/2023-06/16/deutschland-liefert-weitere-patriot-raketen-an-ukraine,https://www.zeit.de/news/2023-06/16/deutschland-liefert-weitere-patriot-raketen-an-ukraine,0,www.zeit.de,Verteidigung: Deutschland liefert weitere Patriot-Raketen an Ukraine,,,2023-06-16T08:10:14Z,https://web.archive.org/web/20230617031406/https://www.zeit.de/news/2023-06/16/deutschland-liefert-weitere-patriot-raketen-an-ukraine,"When browsing with ads:
We collect personal data and also transmit it to third-party providers
 that help us improve and finance our digital content. Some of the information stored on your device, … [+821 chars]",,de,'Ukraine'
https://www.zeit.de/video/2023-06/6329521938112/ukraine-situation-des-atomkraftwerks-in-saporischschja-nach-dammbruchstabil,https://www.zeit.de/video/2023-06/6329521938112/ukraine-situation-des-atomkraftwerks-in-saporischschja-nach-dammbruchstabil,0,www.zeit.de,Ukraine: Situation des Atomkraftwerks in Saporischschja nach Dammbruchstabil,"Der Chef der Internationalen Atomenergie-Behörde, Rafael Grossi, hat das ukrainische Kernkraftwerk Saporischschja besucht. Die Lage sei ""Ernst, jedoch stabil"".",,2023-06-16T08:13:29Z,,"When browsing with ads:
We collect personal data and also transmit it to third-party providers
 that help us improve and finance our digital content. Some of the information stored on your device, … [+821 chars]",,de,'Atomenergie'
https://www.zeit.de/video/2023-06/6329521938112/nach-dammbruch-situation-des-atomkraftwerks-in-saporischschja-ist-stabil,https://www.zeit.de/video/2023-06/6329521938112/nach-dammbruch-situation-des-atomkraftwerks-in-saporischschja-ist-stabil,0,www.zeit.de,Nach Dammbruch: Situation des Atomkraftwerks in Saporischschja ist stabil,"Der Chef der Internationalen Atomenergie-Organisation, Rafael Grossi, hat das ukrainische Kernkraftwerk Saporischschja besucht. Die Lage sei ""Ernst, jedoch stabil"".",,2023-06-16T08:36:43Z,https://web.archive.org/web/20230617032812/https://www.zeit.de/video/2023-06/6329521938112/nach-dammbruch-situation-des-atomkraftwerks-in-saporischschja-ist-stabil,"When browsing with ads:
We collect personal data and also transmit it to third-party providers
 that help us improve and finance our digital content. Some of the information stored on your device, … [+821 chars]",,de,'Atomenergie'
https://www.zeit.de/politik/ausland/2023-06/russland-opec-plus-saudi-arabien-5vor8,https://www.zeit.de/politik/ausland/2023-06/russland-opec-plus-saudi-arabien-5vor8,0,www.zeit.de,Russland und die Opec+: Öl zu Discounterpreisen,"Saudi-Arabien wollte den Ölpreis hochtreiben, indem es die Produktion drosselt. Doch der Trick funktioniert nicht mehr – das liegt auch an Russlands Angriffskrieg.",,2023-06-16T09:04:13Z,https://web.archive.org/web/20230616105750/https://www.zeit.de/politik/ausland/2023-06/russland-opec-plus-saudi-arabien-5vor8,"When browsing with ads:
We collect personal data and also transmit it to third-party providers
 that help us improve and finance our digital content. Some of the information stored on your device, … [+821 chars]",,de,'Russland'
https://wien.orf.at/stories/3211958/,https://wien.orf.at/stories/3211958/,0,wien.orf.at,Speiseeis als krisenfestes Geschäft,Die Sommerhitze bringt Eis in der Tüte oder im Becher schnell zum Schmelzen. Angesichts von Pandemie und Teuerung erweist sich das Geschäft mit Eis aber erstaunlich krisenfest – und bestärkt damit so manches altes Wissen.,https://ibs.orf.at/wie?image=https%3A%2F%2Foekastatic.orf.at%2Fmims%2F2023%2F24%2F18%2Fcrops%2Fw%3D1200%2Ch%3D627%2Cq%3D75%2F1829877_master_683018_vlcsnap-2023-06-16-09h43m13s130.jpg%3Fs%3Da16090b536d45e880dc145bdf3fc6da28b7c3182,2023-06-16T09:05:00Z,https://web.archive.org/web/20230616113719/https://wien.orf.at/stories/3211958/,"Klassiker wie Schokolade, Vanille und Zitrone oder Exoten wie gesalzenes Karamelleis, Spaghettieis und Lakritzeeis: Eissorten gibt es viele, sie kommen und gehen. Eisgeschäfte in Wien gibt es rund 15… [+2175 chars]",,de,'Teuer'
https://www.morgenpost.de/wirtschaft/article238226381/heizung-gasheizung-h2-ready-biogas-gasheizung-wasserstoff.html,https://www.morgenpost.de/wirtschaft/article238226381/heizung-gasheizung-h2-ready-biogas-gasheizung-wasserstoff.html,0,www.morgenpost.de,Hoffnung für Wärmewende: H2-ready-Gasheizung: Studie liefert erstaunliche Erkenntnis,Die Gasheizung in Zukunft mit Wasserstoff nutzen? Laut einer Studie ist das realistisch. Hier erfahren Sie mehr über die Chancen und Kosten.,https://img.morgenpost.de/img/frontpage/crop237779147/7862605159-w820-cv16_9-q85/imago0238044110h.jpg,2023-06-16T09:20:00Z,https://web.archive.org/web/20230617041928/https://www.morgenpost.de/wirtschaft/article238226381/heizung-gasheizung-h2-ready-biogas-gasheizung-wasserstoff.html,Berlin. Weg von fossilen Brennstoffen und stattdessen auf erneuerbare Energien setzen dieses Ziel verfolgt die Bundesregierung im neuen Heizungsgesetz. Im Detail also wie die Wärmewende gelingen soll… [+11864 chars],,de,'Kosten'
https://www.stern.de/gesellschaft/regional/hamburg-schleswig-holstein/energie--kerstan-warnt--wasserstoffkompatible-gasheizungen-sehr-teuer-33564528.html,https://www.stern.de/gesellschaft/regional/hamburg-schleswig-holstein/energie--kerstan-warnt--wasserstoffkompatible-gasheizungen-sehr-teuer-33564528.html,0,www.stern.de,Energie: Kerstan warnt: Wasserstoffkompatible Gasheizungen sehr teuer,"Hamburgs Umweltsenator Jens Kerstan hält die Öffnung des Gebäudeenergiegesetzes für wasserstoffkompatible Gasheizungen für einen Fehler. ""Als Energiesenator muss ich darauf hinweisen, dass Wasserstoff zum Heizen eine ineffiziente und teure Sackgasse ist - und…",https://image.stern.de/33564530/t/sS/v1/w1440/r1.7778/-/16--urnnewsmldpacom200901012306169977719v2w800h600l1396t275r4036b2033jpeg---1d8d76532e9b79a3.jpg,2023-06-16T09:37:34Z,https://web.archive.org/web/20230616100905/https://www.stern.de/gesellschaft/regional/hamburg-schleswig-holstein/energie--kerstan-warnt--wasserstoffkompatible-gasheizungen-sehr-teuer-33564528.html,"Hamburgs Umweltsenator Jens Kerstan hält die Öffnung des Gebäudeenergiegesetzes für wasserstoffkompatible Gasheizungen für einen Fehler. ""Als Energiesenator muss ich darauf hinweisen, dass Wasserstof… [+2244 chars]",,de,'Teuer'
https://www.faz.net/aktuell/karriere-hochschule/die-karrierefrage/karriere-so-vermeidet-man-fehler-in-der-gehaltsverhandlung-18950381.html,https://www.faz.net/aktuell/karriere-hochschule/die-karrierefrage/karriere-so-vermeidet-man-fehler-in-der-gehaltsverhandlung-18950381.html,0,www.faz.net,Die Karrierefrage: Wie vermeide ich Fehler in der Gehaltsverhandlung?,"Mehr Gehalt, am liebsten schnell? Dieser Wunsch liegt besonders in Zeiten hoher Inflation nahe. Dabei gibt es aber einiges zu beachten, um Fallstricke zu vermeiden.",https://media1.faz.net/ppmedia/aktuell/3553577208/1.8950385/facebook_teaser_fplus/gut-verhandelt-das-kann-sich.jpg,2023-06-16T09:39:37Z,https://web.archive.org/web/20230616110714/http://www.faz.net/aktuell/karriere-hochschule/die-karrierefrage/karriere-so-vermeidet-man-fehler-in-der-gehaltsverhandlung-18950381.html,"Kaum jemand redet gern darüber, aber fast alle interessiert es: die Frage nach dem angemessenen Gehalt und ob beim nächsten Gespräch mit dem Vorgesetzten mehr rausspringen könnte. Einige versuchen ga… [+998 chars]",,de,'Inflation'
https://www.tagesspiegel.de/internationales/kohle-aus-kolumbien-deutschlands-fragwurdige-rolle-bei-der-energiewende-in-sudamerika-9985636.html,https://www.tagesspiegel.de/internationales/kohle-aus-kolumbien-deutschlands-fragwurdige-rolle-bei-der-energiewende-in-sudamerika-9985636.html,0,www.tagesspiegel.de,Kohle aus Kolumbien: Deutschlands fragwürdige Rolle bei der Energiewende in Südamerika,Kolumbiens Staatschef Petro ist zu Gast bei Kanzler Scholz. Deutschland will Kolumbien bei der  Energiewende unterstützen – importiert aber selbst jede Menge Kohle aus dem südamerikanischen Land.,https://www.tagesspiegel.de/images/april-6-2018-cartagena-de-indias-bolivar-colombia-man-selling-coal-at-cartagena-s-local-popular-market-suggested-on/alternates/BASE_16_9_W1400/april-6-2018-cartagena-de-indias-bolivar-colombia-man-selling-coal-at-cartagena-s-local-popular-market-suggested-on.jpeg,2023-06-16T09:48:29Z,https://web.archive.org/web/20230616211402/https://www.tagesspiegel.de/internationales/kohle-aus-kolumbien-deutschlands-fragwurdige-rolle-bei-der-energiewende-in-sudamerika-9985636.html,"Deutschland will Kolumbien bei der Energiewende unterstützen. Und so wird an diesem Freitag der kolumbianische Präsident Gustavo Petro in Berlin erwartet, um mit Bundeskanzler Olaf Scholz (SPD) über … [+4334 chars]",,de,'Kohle'
https://www.morgenpost.de/ratgeber/article238106711/heizung-biomethan-gasheizung-alternative-verbraucher-biogas.html,https://www.morgenpost.de/ratgeber/article238106711/heizung-biomethan-gasheizung-alternative-verbraucher-biogas.html,0,www.morgenpost.de,Wärmewende in Deutschland: Heizen mit Biogas: Faktencheck – Behörde warnt vor Risiken,Einer Berechnung zufolge könnte Biogas eine Alternative für Millionen Haushalte sein. Doch das Umweltbundesamt hat Zweifel und warnt vor den Risiken.,https://img.morgenpost.de/img/incoming/crop234828229/0812606323-w820-cv16_9-q85/9a52a4ee-a514-11ec-822f-99ca0862cc29.jpg,2023-06-16T10:25:00Z,https://web.archive.org/web/20230617035720/https://www.morgenpost.de/ratgeber/article238106711/heizung-biomethan-gasheizung-alternative-verbraucher-biogas.html,Berlin. Neben der Wärmepumpe oder Pelletheizung sollen auch Gasheizungen ab 2024 neu eingebaut werden können nach vielen Debatten und Kontroversen hatte sich die Bundesregierung auf einen gemeinsamen… [+10656 chars],,de,'Heizen'
https://www.tagesspiegel.de/berlin/berliner-wirtschaft/teuer-eng-und-klimaschadlich-wer-fliegt-denn-heute-noch-kurzstrecke-9966096.html,https://www.tagesspiegel.de/berlin/berliner-wirtschaft/teuer-eng-und-klimaschadlich-wer-fliegt-denn-heute-noch-kurzstrecke-9966096.html,0,www.tagesspiegel.de,"Teuer, eng und klimaschädlich: Wer fliegt denn heute noch Kurzstrecke?",Die Route zwischen den Airports Berlin und München ist die meist geflogene in Deutschland. Elf Maschinen heben täglich vom BER nach Bayern ab. Unsere Autorin flog mit – und fuhr mit der Bahn zurück.,https://www.tagesspiegel.de/images/fluggesellschaft-lufthansa1/alternates/BASE_16_9_W1400/fluggesellschaft-lufthansa.jpeg,2023-06-16T10:44:47Z,http://archive.md/20230616194615/https://www.tagesspiegel.de/berlin/berliner-wirtschaft/teuer-eng-und-klimaschadlich-wer-fliegt-denn-heute-noch-kurzstrecke-9966096.html,"In dem bekannten Roman Faserland von Christian Kracht gibt es eine Szene, in der der Erzähler vor einem Buffet steht. Das Buffet ist am Flugsteig aufgebaut. Der Erzähler will von Hamburg nach Frankfu… [+169 chars]",,de,'Teuer'
https://www.basicthinking.de/blog/2023/06/16/erneuerbare-energien-deutschland/,https://www.basicthinking.de/blog/2023/06/16/erneuerbare-energien-deutschland/,0,www.basicthinking.de,Erneuerbare Energien: Deutschland überholt China im weltweiten Vergleich,"Das Thema erneuerbare Energien boomt. In Sachen Investitionspotenzial stellt Deutschland mittlerweile sogar China in den Schatten. Die Hintergründe.  Die vergangenen Monate haben verdeutlicht, dass wir unsere Klimaziele wohl verfehlen werden. Denn das 1,5-Gra…",https://www.basicthinking.de/blog/wp-content/uploads/2023/06/erneuerbare-energien.jpg,2023-06-16T11:00:17Z,,"Das Thema erneuerbare Energien boomt. In Sachen Investitionspotenzial stellt Deutschland mittlerweile sogar China in den Schatten. Die Hintergründe. 
Die vergangenen Monate haben verdeutlicht, dass … [+1830 chars]",,de,'Erneuerbare Energien'
https://www.faz.net/aktuell/politik/ukraine-liveticker-ukraine-schiesst-wohl-sechs-kinschal-raketen-ueber-kiew-ab-faz-18495964.html,https://www.faz.net/aktuell/politik/ukraine-liveticker-ukraine-schiesst-wohl-sechs-kinschal-raketen-ueber-kiew-ab-faz-18495964.html,0,www.faz.net,Ukraine-Liveblog: Ukraine schießt wohl sechs Kinschal-Raketen über Kiew ab,Zwölf Raketen laut ukrainischer Luftwaffe abgeschossen +++ Afrikanische Friedensmission besucht Kiew und St. Petersburg +++ London: Russischer Generalmajor mit hoher Wahrscheinlichkeit getötet +++ alle Entwicklungen im Liveblog,https://media1.faz.net/ppmedia/aktuell/211769327/1.8968697/facebook_teaser/einwohner-von-kiew-suchen-am.jpg,2023-06-16T11:47:20Z,https://web.archive.org/web/20230616125540/https://www.faz.net/aktuell/politik/ukraine-liveticker-ukraine-schiesst-wohl-sechs-kinschal-raketen-ueber-kiew-ab-faz-18495964.html,Nach der Zerstörung des Kachowka-Staudamms im Kriegsgebiet im Süden der Ukraine können sich die Böden in der gefluteten Region Cherson nach Einschätzung des Experten Georg Guggenberger auch wieder er… [+1333 chars],,de,'Ukraine'
https://www.welt.de/politik/ausland/article245888530/Ukraine-News-Ukraine-bekommt-auf-Nato-Gipfel-keine-Beitrittseinladung.html,https://www.welt.de/politik/ausland/article245888530/Ukraine-News-Ukraine-bekommt-auf-Nato-Gipfel-keine-Beitrittseinladung.html,0,www.welt.de,Deutschland liefert 64 weitere Patriot-Raketen an Ukraine,"Verteidigungsminister Boris Pistorius will 64 Patriot-Raketen an die Ukraine liefern. Zuvor hatten die USA, Großbritannien, Dänemark und die Niederlande angekündigt, Hunderte zusätzliche Flugabwehrraketen zur Verfügung zu stellen. Mehr im Liveticker.",https://img.welt.de/img/politik/ausland/mobile245908484/2571350607-ci16x9-w1200/Meeting-Of-NATO-Ministers-Of-Defence-In-Brussels.jpg,2023-06-16T14:23:00Z,https://web.archive.org/web/20230617052849/https://www.welt.de/politik/ausland/article245888530/Ukraine-News-Ukraine-bekommt-auf-Nato-Gipfel-keine-Beitrittseinladung.html,"Die Nato wird der Ukraine bei ihrem Gipfeltreffen in Litauen im Juli keine Beitrittseinladung aussprechen, wie von Präsident Wolodymyr Selenskyj erhofft. Wir werden bei dem Gipfel in Vilnius nicht üb… [+17225 chars]",,de,'Ukraine'
