index,url,valid,domain,title,description,image,published,archive,content,quote,language,keyword
https://www.stern.de/gesellschaft/regional/bayern/parteipolitik--oekonom-feld--momentan-nur-moderaten-wirtschaftsabschwung--33076540.html,https://www.stern.de/gesellschaft/regional/bayern/parteipolitik--oekonom-feld--momentan-nur-moderaten-wirtschaftsabschwung--33076540.html,0,www.stern.de,Parteipolitik: Ökonom Feld: Momentan nur moderaten Wirtschaftsabschwung,"Die deutsche Wirtschaft kommt aus Sicht des Ökonomen Lars Feld besser mit den Folgen des Ukraine-Krieges zurecht als zunächst gedacht. ""Es ist nicht ganz so schlimm wie letzten Sommer befürchtet. Die Wirtschaft scheint jetzt nicht zusammenzubrechen"", sagte de…",https://image.stern.de/33077612/t/pd/v1/w1440/r1.7778/-/07--urnnewsmldpacom2009010123010799136558v3w800h600l640t435r1920b1308jpeg---6bfb5058e66dc2bd.jpg,2023-01-07T13:43:06Z,,"Die deutsche Wirtschaft kommt aus Sicht des Ökonomen Lars Feld besser mit den Folgen des Ukraine-Krieges zurecht als zunächst gedacht. ""Es ist nicht ganz so schlimm wie letzten Sommer befürchtet. Die… [+2215 chars]",,de,'Ukraine'
https://www.n-tv.de/wirtschaft/Ausblick-2023-so-wird-das-neue-Boersenjahr-article23827043.html,https://www.n-tv.de/wirtschaft/Ausblick-2023-so-wird-das-neue-Boersenjahr-article23827043.html,0,www.n-tv.de,Worauf Anleger achten müssen: Ausblick 2023 - so wird das neue Börsenjahr,"Steigende Zinsen, eine historisch hohe Inflation, explodierende Energiepreise: Das vergangene Jahr hat Anleger vor zahlreiche Herausforderungen gestellt. Wie werden sich diese Faktoren im neuen Börsenjahr entwickeln?",https://bilder2.n-tv.de/img/incoming/crop23827041/3801321770-cImg_16_9-w1200/390211238.jpg,2023-01-07T14:30:00Z,,"Steigende Zinsen, eine historisch hohe Inflation, explodierende Energiepreise: Das vergangene Jahr hat Anleger vor zahlreiche Herausforderungen gestellt. Wie werden sich diese Faktoren im neuen Börse… [+355 chars]",,de,'Inflation'
https://noe.orf.at/stories/3189388/,https://noe.orf.at/stories/3189388/,0,noe.orf.at,Pyrotechnik-Unfall zu Silvester: Zweiter 18-Jähriger tot,Nach dem schweren Pyrotechnikunfall zu Silvester in Ternitz (Bezirk Neunkirchen) ist ein zweiter 18-Jähriger gestorben. Der junge Mann schwebte seit dem Vorfall in Lebensgefahr. Ein Gleichaltriger war bei der Explosion von Kugelbomben sofort getötet worden.,https://ibs.orf.at/noe?image=https%3A%2F%2Foekastatic.orf.at%2Fmojo%2F1_4_1%2Fstoryserver%2Foeka%2Fcommon%2Fimages%2Fog-fallback-noe.png%3Fs%3D197412428aa70cf6fe79beb4d538b3ce30d0d029,2023-01-07T15:15:06Z,https://web.archive.org/web/20230107155000/https://noe.orf.at/stories/3189388/,"Der 18-Jährige, der zuletzt in kritischem Zustand war, erlag laut Polizei seinen Verletzungen. Die Exekutive bestätigte am Samstag auf APA-Anfrage einen Heute-Bericht (Onlineausgabe). Zwei weitere Pe… [+758 chars]",,de,'Explosion'
https://www.n-tv.de/wirtschaft/Okonom-Feld-Wirtschaft-scheint-nicht-zusammenzubrechen-article23829009.html,https://www.n-tv.de/wirtschaft/Okonom-Feld-Wirtschaft-scheint-nicht-zusammenzubrechen-article23829009.html,0,www.n-tv.de,"Ukraine-Krieg und seine Folgen: Ökonom Feld: ""Wirtschaft scheint nicht zusammenzubrechen""","Auf der Winterklausurtagung der CSU im oberbayerischen Kloster Seeon ist der Angriffskrieg auf die Ukraine eines der zentralen Themen. Zu dem Treffen ist auch Ökonom Lars Feld geladen. Anders als noch im vergangenen Sommer vermutet, sieht er derzeit nur einen…",https://bilder4.n-tv.de/img/incoming/crop23829015/3341324050-cImg_16_9-w1200/390393836.jpg,2023-01-07T15:28:31Z,,Auf der Winterklausurtagung der CSU im oberbayerischen Kloster Seeon ist der Angriffskrieg auf die Ukraine eines der zentralen Themen. Zu dem Treffen ist auch Ökonom Lars Feld geladen. Anders als noc… [+1902 chars],,de,'Ukraine'
https://www.focus.de/finanzen/news/inflation-im-euro-raum-faellt-auf-9-2-prozent_id_182306282.html,https://www.focus.de/finanzen/news/inflation-im-euro-raum-faellt-auf-9-2-prozent_id_182306282.html,0,www.focus.de,"Sinkende Energiepreise - Inflation im Euro-Raum fällt auf 9,2 Prozent",Die Inflationsrate in der Euro-Zone ist zum Jahresende aufgrund eines nachlassenden Preisschubs bei Energie deutlich gesunken. Der Rückgang war stärker als erwartet. Experten geben aber keine Entwarnung.,https://p6.focus.de/img/finanzen/news/id_182306279/inflation-im-euro-raum-faellt-auf-9-2-prozent.jpg?im=Crop%3D%280%2C29%2C940%2C470%29%3BResize%3D%281200%2C627%29&impolicy=perceptual&quality=medium&hash=c11300af9e39eeeefbc11b65c686db1b3e61d829d49275b159f0569c2a00466e,2023-01-07T16:07:21Z,https://web.archive.org/web/20230107193241/https://www.focus.de/finanzen/news/inflation-im-euro-raum-faellt-auf-9-2-prozent_id_182306282.html,"Im Dezember kletterten die Verbraucherpreise binnen Jahresfrist um 9,2 Prozent, wie das Statistikamt Eurostat am Freitag in einer ersten Schätzung mitteilte. Noch im November hatte die Teuerungsrate … [+2533 chars]",,de,'Inflation'
https://www.faz.net/aktuell/finanzen/dividenden-im-dax-steigen-auf-rekord-18581657.html,https://www.faz.net/aktuell/finanzen/dividenden-im-dax-steigen-auf-rekord-18581657.html,0,www.faz.net,Ausschüttungen an Aktionäre: Dividenden im Dax steigen auf Rekord,Die Inflation kennt auch Gewinner. Viele Unternehmen konnten dank steigender Preise ihre Gewinne erhöhen. Aktionäre profitieren mit Rekorddividenden. Mercedes liegt an der Spitze.,https://media0.faz.net/ppmedia/aktuell/3011604731/1.8581490/facebook_teaser/wertschaffende-taetigkeit.jpg,2023-01-07T16:19:21Z,,Das Jahr 2022 hat einige Kata­­s­trophen mit sich gebracht. Vor allem der Krieg in der Ukraine verursachte viel Leid und Unheil. Wirtschaftliche Verwerfungen ließen Nahrungsmittel und Rohstoffe deutl… [+3559 chars],,de,'Inflation'
https://ooe.orf.at/stories/3189384/,https://ooe.orf.at/stories/3189384/,0,ooe.orf.at,Neue Möglichkeiten für Anleger,"Das abgelaufene Jahr war für die Finanzmärkte mehr als außergewöhnlich: nach Corona kamen der Ukraine-Krieg, eine kräftige Inflation und eine Zinswende. Die hat wieder ein etwas Normalität ins Finanzsystem gebracht – da sind sich die Experten einig. Für Anleg…",https://ibs.orf.at/ooe?image=https%3A%2F%2Foekastatic.orf.at%2Fmims%2F2022%2F06%2F22%2Fcrops%2Fw%3D1200%2Ch%3D627%2Cq%3D75%2F1222449_master_435822_220128_ooeh_warnung_vor_krypto_geschaeften_00_00_11_08.jpg%3Fs%3D9a43d0c61aec898fc3b8088986d27fdb934b9841,2023-01-07T16:30:00Z,,"Anleihen sind wieder interessant, denn die Aktienmärkte befinden sich in einem Seitwärtstrend, so der Fondsmanager der 3 Banken-Generali Investment, Alois Wögerbauer: Im Aktienbereich sind wir in ein… [+497 chars]",,de,'Ukraine'
https://www.zeit.de/wirtschaft/2023-01/konjunktur-2023-energiekrise-gewinne-inflation-materialengpass,https://www.zeit.de/wirtschaft/2023-01/konjunktur-2023-energiekrise-gewinne-inflation-materialengpass,0,www.zeit.de,"Konjunktur: Vier Gründe, warum es 2023 aufwärtsgehen könnte","Die Energie wird günstiger, die Inflation sinkt. Vielleicht kommt doch alles ganz anders im neuen Jahr als befürchtet. Der Absturz könnte ausbleiben.",,2023-01-07T16:58:55Z,http://archive.md/20230107175018/https://www.zeit.de/wirtschaft/2023-01/konjunktur-2023-energiekrise-gewinne-inflation-materialengpass,"When browsing with ads:
We collect personal data and also transmit it to third-party providers
 that help us improve and finance our digital content. Some of the information stored on your device, … [+732 chars]",,de,'Inflation'
https://vorarlberg.orf.at/stories/3189394/,https://vorarlberg.orf.at/stories/3189394/,0,vorarlberg.orf.at,Finanzen: Was sich im Jahr 2023 tut,"Das vergangene Jahr ist aus finanztechnischer Sicht alles andere als gut gelaufen. Zuerst sind die Energiepreise explodiert, dann hat eine generelle Welle der Teuerung eingesetzt. Zinsen auf Erspartes gab es so gut wie keine, dafür sind die Kreditzinsen gesti…",https://ibs.orf.at/vbg?image=https%3A%2F%2Foekastatic.orf.at%2Fmims%2F2023%2F01%2F26%2Fcrops%2Fw%3D1200%2Ch%3D627%2Cq%3D75%2F1632862_master_599326_downloadmedium_12.jpg%3Fs%3Db8c1017c0ee62ac6addc1ed340e0bff1e674dc9c,2023-01-07T18:08:30Z,,"Aus den USA kommen bereits positive Signale, sie zeigen einen Rückgang der Inflation. Vielleicht kommt die Stimmung auch nach Europa. Zumindest gibt es wieder Zinsen. In vier Schritten ist der EZB-Le… [+2443 chars]",,de,'Teuer'
https://www.faz.net/aktuell/wirtschaft/bundesnetzagentur-keine-gasmangellage-droht-18586431.html,https://www.faz.net/aktuell/wirtschaft/bundesnetzagentur-keine-gasmangellage-droht-18586431.html,0,www.faz.net,Bundesnetzagentur gibt Entwarnung für diesen Winter: Keine Gasmangellage droht,"Die Gasspeicher seien zu mehr als 90 Prozent gefüllt, und bis zum Frühjahr werde der Stand wohl nicht unter die Hälfte sinken, sagt Klaus Müller. Es gebe aber gute Gründe, weiter zu sparen. Die Zeit der Preissprünge sei wohl vorbei.",https://media1.faz.net/ppmedia/aktuell/wirtschaft/2343976519/1.8586461/facebook_teaser/ein-manometer-zeigt-den-druck.jpg,2023-01-08T04:21:39Z,https://web.archive.org/web/20230108042238/http://www.faz.net/aktuell/wirtschaft/bundesnetzagentur-keine-gasmangellage-droht-18586431.html,"Bundesnetzagentur-Präsident Klaus Müller rechnet mit einem Ende der Preisschwankungen bei Erdgas. Gas kostet aktuell wieder so viel wie im Dezember 2021"", sagte er der Bild am Sonntag. Dies sei insbe… [+1766 chars]",,de,'Teuer'
https://www.n-tv.de/wirtschaft/Gas-reicht-fuer-diesen-Winter-wohl-aus-article23829378.html,https://www.n-tv.de/wirtschaft/Gas-reicht-fuer-diesen-Winter-wohl-aus-article23829378.html,0,www.n-tv.de,Bundesnetzagentur zuversichtlich: Gas reicht für diesen Winter wohl aus,"Die deutschen Gasspeicher sind zu mehr als 90 Prozent gefüllt. Damit sei in diesem Winter nicht mehr mit einer Mangellage zu rechnen, sagt der Chef der Bundesnetzagentur, Klaus Müller. Gleichzeitig warnt er davor, mit dem Sparen aufzuhören. Das wäre nicht nur…",https://bilder1.n-tv.de/img/incoming/crop23829380/216132128-cImg_16_9-w1200/388161752.jpg,2023-01-08T05:47:16Z,https://web.archive.org/web/20230108055218/https://www.n-tv.de/wirtschaft/Gas-reicht-fuer-diesen-Winter-wohl-aus-article23829378.html,"Die deutschen Gasspeicher sind zu mehr als 90 Prozent gefüllt. Damit sei in diesem Winter nicht mehr mit einer Mangellage zu rechnen, sagt der Chef der Bundesnetzagentur, Klaus Müller. Gleichzeitig w… [+2022 chars]",,de,'Gasspeicher'
https://www.welt.de/wirtschaft/article243087431/Bundesnetzagentur-Chef-Mueller-Keine-Gasmangellage-in-diesem-Winter.html,https://www.welt.de/wirtschaft/article243087431/Bundesnetzagentur-Chef-Mueller-Keine-Gasmangellage-in-diesem-Winter.html,0,www.welt.de,„Gasspeicher zu mehr als 90 Prozent gefüllt – ein bemerkenswerter Wert,"Klaus Müller erwartet nicht mehr, dass in den nächsten Wochen in Deutschland das Gas knapp wird: „Wir konzentrieren uns jetzt auf den nächsten Winter.“ Er warnt trotzdem davor, jetzt mit dem Sparen etwa beim Heizen oder Duschen aufzuhören.",https://img.welt.de/img/wirtschaft/mobile243087513/7831351177-ci16x9-w1200/Symbolbilder-Gas.jpg,2023-01-08T07:39:34Z,https://web.archive.org/web/20230108074342/https://www.welt.de/wirtschaft/article243087431/Bundesnetzagentur-Chef-Mueller-Keine-Gasmangellage-in-diesem-Winter.html,"Der Präsident der Bundesnetzagentur, Klaus Müller, sieht für diesen Winter keine Gefahr mehr für eine Gasmangellage. Bei aller Restunsicherheit: Ich rechne nicht damit, dass diesen Winter noch etwas … [+1670 chars]",,de,'Heizen'
https://www.tagesschau.de/inland/gas-mangel-winter-101.html,https://www.tagesschau.de/inland/gas-mangel-winter-101.html,0,www.tagesschau.de,"Bundesnetzagentur: ""Keine Gefahr mehr für eine Gasmangellage""","Eine Gasmangellage wird es nach Angaben der Bundesnetzagentur diesen Winter wohl nicht mehr geben. Aber sie warnt, mit dem Sparen beim Heizen oder Duschen aufzuhören. Das wäre sehr teuer und unsolidarisch.",https://www.tagesschau.de/multimedia/bilder/klaus-mueller-111~_v-original.jpg,2023-01-08T08:24:18Z,https://web.archive.org/web/20230108082500/http://www.tagesschau.de/inland/gas-mangel-winter-101.html,"Eine Gasmangellage wird es nach Angaben der Bundesnetzagentur diesen Winter wohl nicht mehr geben. Aber sie warnt, mit dem Sparen beim Heizen oder Duschen aufzuhören. Das wäre sehr teuer und unsolida… [+1942 chars]",,de,'Teuer'
https://www.welt.de/politik/ausland/video243087535/Weihnachten-an-der-Front-Es-ist-der-Traum-von-jedem-Panzerfahrer-mit-dem-Leopard-2-bis-nach-Simferopol-zu-fahren.html,https://www.welt.de/politik/ausland/video243087535/Weihnachten-an-der-Front-Es-ist-der-Traum-von-jedem-Panzerfahrer-mit-dem-Leopard-2-bis-nach-Simferopol-zu-fahren.html,0,www.welt.de,"„Es ist der Traum von jedem Panzerfahrer, mit dem Leopard 2 bis nach Simferopol zu fahren“","36 Stunden sollen die Waffen zum orthodoxen Weihnachtsfest ruhen, versprach Moskau, aber hält es offenbar nicht ein. WELT-Reporterin Tatjana Ohm besucht ukrainische Soldaten, die versuchen, an der Front Traditionen aufrechtzuerhalten.",https://img.welt.de/img/videos/mobile243090369/4631355007-ci16x9-w1200/Bildschirmfoto-2023-01-08-um-11-27-52-png.jpg,2023-01-08T10:36:54Z,https://web.archive.org/web/20230108195845/https://www.welt.de/politik/ausland/video243087535/Weihnachten-an-der-Front-Es-ist-der-Traum-von-jedem-Panzerfahrer-mit-dem-Leopard-2-bis-nach-Simferopol-zu-fahren.html,"Die WELT als ePaper: Die vollständige Ausgabe steht Ihnen bereits am Vorabend zur Verfügung so sind Sie immer hochaktuell informiert. Weitere Informationen: http://epaper.welt.de 
 Der Kurz-Link die… [+49 chars]",,de,'Waffen'
https://www.stern.de/politik/ausland/ukraine-krieg--das-versteht-russland-also-unter-einer-feuerpause-33078540.html,https://www.stern.de/politik/ausland/ukraine-krieg--das-versteht-russland-also-unter-einer-feuerpause-33078540.html,0,www.stern.de,"Kämpfe trotz ""Waffenruhe"": Das versteht Russland also unter einer Feuerpause",Als vermeintlich fromme Geste in seinem gottlosen Angriffskrieg gegen die Ukraine hat Russlands Präsident Wladimir Putin eine temporäre Feuerpause deklariert. Doch auch zum Weihnachtsfest haben die Waffen nicht geschwiegen.,https://image.stern.de/33078982/t/Ou/v1/w1440/r1.7778/-/ukraine-krieg--das-versteht-russland-also-unter-einer-feuerpause.jpg,2023-01-08T11:29:00Z,https://web.archive.org/web/20230108114210/https://www.stern.de/politik/ausland/ukraine-krieg--das-versteht-russland-also-unter-einer-feuerpause-33078540.html,"Wolodymyr Selenskyj hat es ja gleich gesagt, trotzdem sagt er es noch einmal. ""Die Welt konnte einmal mehr sehen, wie falsch Aussagen aus Moskau auf jeder Ebene sind"", lautet seine Bilanz am Samstaga… [+5242 chars]",,de,'Ukraine'
https://www.focus.de/politik/ausland/ukraine-krieg-im-ticker-wagner-chef-prigoschin-will-bachmut-wegen-tunnelsystemen-einnehmen_id_57275780.html,https://www.focus.de/politik/ausland/ukraine-krieg-im-ticker-wagner-chef-prigoschin-will-bachmut-wegen-tunnelsystemen-einnehmen_id_57275780.html,0,www.focus.de,Ukraine-Krieg - Stimmen und Entwicklungen - Wagner-Chef Prigoschin will Bachmut wegen „Tunnelsystemen“ einnehmen,Die russische Flugabwehr hat staatlichen Angaben zufolge erneut einen Drohnenangriff auf die Halbinsel Krim abgewehrt. Mitten im russischen Angriffskrieg feiert Wladimir Putin das orthodoxe Weihnachten alleine in der Kreml-Kirche. Alle News zum Ukraine-Krieg …,https://p6.focus.de/img/fotos/id_150218034/vladimir-putin-tours-yevgeny-prigozhin-s-concord-food-catering-factory-08.jpg?im=Crop%3D%280%2C0%2C510%2C255%29%3BResize%3D%281200%2C627%29&hash=9418bc8766e4b91e15ed3a44707296f9e2d244c8e9bb0086b5a871ea08301ea2,2023-01-08T12:13:40Z,https://web.archive.org/web/20230108125358/https://www.focus.de/politik/ausland/ukraine-krieg-im-ticker-wagner-chef-prigoschin-will-bachmut-wegen-tunnelsystemen-einnehmen_id_57275780.html,Die russische Flugabwehr hat staatlichen Angaben zufolge erneut einen Drohnenangriff auf die Halbinsel Krim abgewehrt. Mitten im russischen Angriffskrieg feiert Wladimir Putin das orthodoxe Weihnacht… [+13951 chars],,de,'Waffen'
https://www.n-tv.de/politik/18-45-Habeck-schliesst-Lieferung-von-Leopard-Panzern-nicht-aus--article23143824.html,https://www.n-tv.de/politik/18-45-Habeck-schliesst-Lieferung-von-Leopard-Panzern-nicht-aus--article23143824.html,0,www.n-tv.de,"Ukraine-Krieg im Liveticker: +++ 18:45 Habeck schließt Lieferung von ""Leopard""-Panzern nicht aus +++","Berlin, Washington, Br\u00fcssel - \u00fcberall. n-tv berichtet von allen wichtigen Schaupl\u00e4tzen der Innen- und Au\u00dfenpolitik.",https://bilder2.n-tv.de/img/incoming/crop23332537/9041326157-cImg_16_9-w1200/Liveticker1-grau-1-Kopie.jpg,2023-01-08T12:30:00Z,https://web.archive.org/web/20230108191351/https://www.n-tv.de/politik/18-45-Habeck-schliesst-Lieferung-von-Leopard-Panzern-nicht-aus--article23143824.html,"Vize-Kanzler und Wirtschaftsminister Robert Habeck kündigt weitere Militärhilfe für die Ukraine an und schließt Kampfpanzer-Lieferungen nicht aus. ""Weitere Entscheidungen werden getroffen. Nein, ausg… [+25298 chars]",,de,'Waffen'
https://www.n-tv.de/politik/21-11-Vorher-Nachher-Bilder-zeigen-Ausmass-der-Zerstoerung-in-Bachmut--article23143824.html,https://www.n-tv.de/politik/21-11-Vorher-Nachher-Bilder-zeigen-Ausmass-der-Zerstoerung-in-Bachmut--article23143824.html,0,www.n-tv.de,Ukraine-Krieg im Liveticker: +++ 21:11 Vorher-Nachher-Bilder zeigen Ausmaß der Zerstörung in Bachmut +++,"Berlin, Washington, Br\u00fcssel - \u00fcberall. n-tv berichtet von allen wichtigen Schaupl\u00e4tzen der Innen- und Au\u00dfenpolitik.",https://bilder2.n-tv.de/img/incoming/crop23332537/9041326157-cImg_16_9-w1200/Liveticker1-grau-1-Kopie.jpg,2023-01-08T12:30:00Z,https://web.archive.org/web/20230108204405/https://www.n-tv.de/politik/21-11-Vorher-Nachher-Bilder-zeigen-Ausmass-der-Zerstoerung-in-Bachmut--article23143824.html,"Raketenbeschuss, Granateinschläge und Angriffe zu jeder Tages- oder Nachtzeit: Seit Monaten schon halten ukrainische Soldaten in Bachmut dem brutalen Ansturm russischer Truppen stand. Im Süden und Os… [+28174 chars]",,de,'Ukraine'
https://www.n-tv.de/politik/14-30-Schweden-sieht-im-Konflikt-mit-Tuerkei-noch-Hindernisse-fuer-NATO-Aufnahme--article23143824.html,https://www.n-tv.de/politik/14-30-Schweden-sieht-im-Konflikt-mit-Tuerkei-noch-Hindernisse-fuer-NATO-Aufnahme--article23143824.html,0,www.n-tv.de,Ukraine-Krieg im Liveticker: +++ 14:30 Schweden sieht im Konflikt mit Türkei noch Hindernisse für NATO-Aufnahme +++,"Berlin, Washington, Br\u00fcssel - \u00fcberall. n-tv berichtet von allen wichtigen Schaupl\u00e4tzen der Innen- und Au\u00dfenpolitik.",https://bilder2.n-tv.de/img/incoming/crop23332537/9041326157-cImg_16_9-w1200/Liveticker1-grau-1-Kopie.jpg,2023-01-08T12:30:00Z,https://web.archive.org/web/20230108142504/https://www.n-tv.de/politik/14-30-Schweden-sieht-im-Konflikt-mit-Tuerkei-noch-Hindernisse-fuer-NATO-Aufnahme--article23143824.html,"Schweden kann nach eigenen Angaben nicht sämtliche Bedingungen der Türkei für eine Aufnahme des skandinavischen Landes in die NATO erfüllen. Die Türkei habe zwar bestätigt, dass Schweden die selbst a… [+18124 chars]",,de,'Ukraine'
https://www.n-tv.de/politik/19-31-Kiew-Mehr-als-400-russische-Soldaten-an-einem-Tag-eliminiert--article23143824.html,https://www.n-tv.de/politik/19-31-Kiew-Mehr-als-400-russische-Soldaten-an-einem-Tag-eliminiert--article23143824.html,0,www.n-tv.de,"Ukraine-Krieg im Liveticker: +++ 19:31 Kiew: Mehr als 400 russische Soldaten an einem Tag ""eliminiert"" +++","Berlin, Washington, Br\u00fcssel - \u00fcberall. n-tv berichtet von allen wichtigen Schaupl\u00e4tzen der Innen- und Au\u00dfenpolitik.",https://bilder2.n-tv.de/img/incoming/crop23332537/9041326157-cImg_16_9-w1200/Liveticker1-grau-1-Kopie.jpg,2023-01-08T12:30:00Z,https://web.archive.org/web/20230108201238/https://www.n-tv.de/politik/19-31-Kiew-Mehr-als-400-russische-Soldaten-an-einem-Tag-eliminiert--article23143824.html,Laut offiziellen Zahlen aus Kiew sind binnen eines Tages 430 russische Soldaten im Krieg ums Leben gekommen oder können nicht mehr kämpfen. Nach Angaben des ukrainischen Verteidigungsministeriums sin… [+26148 chars],,de,'Ukraine'
https://www.n-tv.de/politik/20-42-Kiew-Russische-Nationalgarde-erschiesst-sechs-eigene-Soldaten--article23143824.html,https://www.n-tv.de/politik/20-42-Kiew-Russische-Nationalgarde-erschiesst-sechs-eigene-Soldaten--article23143824.html,0,www.n-tv.de,Ukraine-Krieg im Liveticker: +++ 20:42 Kiew: Russische Nationalgarde erschießt sechs eigene Soldaten +++,"Berlin, Washington, Br\u00fcssel - \u00fcberall. n-tv berichtet von allen wichtigen Schaupl\u00e4tzen der Innen- und Au\u00dfenpolitik.",https://bilder2.n-tv.de/img/incoming/crop23332537/9041326157-cImg_16_9-w1200/Liveticker1-grau-1-Kopie.jpg,2023-01-08T12:30:00Z,https://web.archive.org/web/20230108204940/https://www.n-tv.de/politik/20-42-Kiew-Russische-Nationalgarde-erschiesst-sechs-eigene-Soldaten--article23143824.html,"Moskau soll die russische Nationalgarde eingesetzt haben, um sechs Soldaten aus den eigenen Reihen zu erschießen. Das schreibt der ukrainische Generalstab in seiner abendlichen Mitteilung. Der Vorfal… [+27774 chars]",,de,'Waffen'
https://www.n-tv.de/politik/17-28-Keine-Hinweise-auf-angeblich-von-Russland-getoetete-600-Soldaten--article23143824.html,https://www.n-tv.de/politik/17-28-Keine-Hinweise-auf-angeblich-von-Russland-getoetete-600-Soldaten--article23143824.html,0,www.n-tv.de,Ukraine-Krieg im Liveticker: +++ 17:28 Keine Hinweise auf angeblich von Russland getötete 600 Soldaten +++,"Berlin, Washington, Br\u00fcssel - \u00fcberall. n-tv berichtet von allen wichtigen Schaupl\u00e4tzen der Innen- und Au\u00dfenpolitik.",https://bilder2.n-tv.de/img/incoming/crop23332537/9041326157-cImg_16_9-w1200/Liveticker1-grau-1-Kopie.jpg,2023-01-08T12:30:00Z,https://web.archive.org/web/20230108182834/https://www.n-tv.de/politik/17-28-Keine-Hinweise-auf-angeblich-von-Russland-getoetete-600-Soldaten--article23143824.html,"Nach einem russischen Raketenangriff auf die ostukrainische Stadt Kramatorsk gibt es einem Augenzeugen zufolge kein Hinweis auf hohe ukrainische Verluste. Es seien Schäden entstanden, aber zerstörte … [+23185 chars]",,de,'Ukraine'
https://www.n-tv.de/politik/21-40-Selenskyj-Ukraine-haelt-umkaempfte-Orte-im-oestlichen-Donbass--article23143824.html,https://www.n-tv.de/politik/21-40-Selenskyj-Ukraine-haelt-umkaempfte-Orte-im-oestlichen-Donbass--article23143824.html,0,www.n-tv.de,Ukraine-Krieg im Liveticker: +++ 21:40 Selenskyj: Ukraine hält umkämpfte Orte im östlichen Donbass +++,"Berlin, Washington, Br\u00fcssel - \u00fcberall. n-tv berichtet von allen wichtigen Schaupl\u00e4tzen der Innen- und Au\u00dfenpolitik.",https://bilder2.n-tv.de/img/incoming/crop23332537/9041326157-cImg_16_9-w1200/Liveticker1-grau-1-Kopie.jpg,2023-01-08T12:30:00Z,https://web.archive.org/web/20230108204405/https://www.n-tv.de/politik/21-40-Selenskyj-Ukraine-haelt-umkaempfte-Orte-im-oestlichen-Donbass--article23143824.html,"Die ukrainischen Streitkräfte wehren nach Darstellung von Präsident Wolodymyr Selenskyj russische Angriffe im Osten des Donbass ab. ""Bachmut hält trotz allem stand"", sagt er in seiner abendlichen Ans… [+28960 chars]",,de,'Waffen'
https://www.n-tv.de/politik/16-11-Belarus-Luftwaffen-Manoever-mit-Russland-ab-16-Januar-geplant--article23143824.html,https://www.n-tv.de/politik/16-11-Belarus-Luftwaffen-Manoever-mit-Russland-ab-16-Januar-geplant--article23143824.html,0,www.n-tv.de,Ukraine-Krieg im Liveticker: +++ 16:11 Belarus: Luftwaffen-Manöver mit Russland ab 16. Januar geplant +++,"Berlin, Washington, Br\u00fcssel - \u00fcberall. n-tv berichtet von allen wichtigen Schaupl\u00e4tzen der Innen- und Au\u00dfenpolitik.",https://bilder2.n-tv.de/img/incoming/crop23332537/9041326157-cImg_16_9-w1200/Liveticker1-grau-1-Kopie.jpg,2023-01-08T12:30:00Z,https://web.archive.org/web/20230108180507/https://www.n-tv.de/politik/16-11-Belarus-Luftwaffen-Manoever-mit-Russland-ab-16-Januar-geplant--article23143824.html,"Russland und Belarus wollen gemeinsame Luftwaffen-Manöver starten. Die Übungen sollten vom 16. Januar bis 1. Februar dauern, teilt das Verteidigungsministerium von Belarus mit.
+++ 15:56 Moskau spri… [+20645 chars]",,de,'Waffen'
https://www.n-tv.de/politik/17-01-Kiew-raeumt-Probleme-bei-Verteidigung-von-Soledar-in-der-Ostukraine-ein--article23143824.html,https://www.n-tv.de/politik/17-01-Kiew-raeumt-Probleme-bei-Verteidigung-von-Soledar-in-der-Ostukraine-ein--article23143824.html,0,www.n-tv.de,Ukraine-Krieg im Liveticker: +++ 17:01 Kiew räumt Probleme bei Verteidigung von Soledar in der Ostukraine ein +++,"Berlin, Washington, Br\u00fcssel - \u00fcberall. n-tv berichtet von allen wichtigen Schaupl\u00e4tzen der Innen- und Au\u00dfenpolitik.",https://bilder2.n-tv.de/img/incoming/crop23332537/9041326157-cImg_16_9-w1200/Liveticker1-grau-1-Kopie.jpg,2023-01-08T12:30:00Z,https://web.archive.org/web/20230108165603/https://www.n-tv.de/politik/17-01-Kiew-raeumt-Probleme-bei-Verteidigung-von-Soledar-in-der-Ostukraine-ein--article23143824.html,"Bei den Kämpfen im Gebiet Donezk im Osten der Ukraine sind die Verteidiger im Raum Soledar nach Angaben aus Kiew in eine schwierige Lage geraten. ""Derzeit ist es schwer in Soledar"", schreibt die stel… [+22251 chars]",,de,'Ukraine'
