index,url,valid,domain,title,description,image,published,archive,content,quote,language,keyword
https://www.diepresse.com/20543163/ihs-senkt-inflationserwartung-fuer-2026-auf-2-2-prozent,https://www.diepresse.com/20543163/ihs-senkt-inflationserwartung-fuer-2026-auf-2-2-prozent,0,www.diepresse.com,"IHS senkt Inflationserwartung für 2026 auf 2,2 Prozent",Die Anpassung der Prognose erfolgt vor dem Hintergrund einer deutlichen Beruhigung des Preisauftriebs.,https://img.diepresse.com/public/incoming/a8cxrw-22730394790646918bldhiresjpg/alternates/DPR_SOCIAL_NACHRICHTEN/22730394790646918_BLD_HiRes.jpg,2026-02-02T17:00:00Z,,"Die Anpassung der Prognose erfolgt vor dem Hintergrund einer deutlichen Beruhigung des Preisauftriebs. 
Das Institut für Höhere Studien (IHS) hat seine Inflationserwartung für das Jahr 2026 auf 2,2 … [+4612 chars]",,de,'Inflation'
https://www.zeit.de/news/2026-02/03/raketen-gegen-kiew-und-charkiw,https://www.zeit.de/news/2026-02/03/raketen-gegen-kiew-und-charkiw,0,www.zeit.de,Ukraine-Krieg: Raketen gegen Kiew und Charkiw,Hier finden Sie Informationen zu dem Thema „Ukraine-Krieg“. Lesen Sie jetzt „Raketen gegen Kiew und Charkiw“.,https://img.zeit.de/news/2026-02/03/raketen-gegen-kiew-und-charkiw-image-group/wide__1300x731,2026-02-03T00:01:41Z,,Die ukrainische Hauptstadt Kiew und die zweitgrößte Stadt Charkiw sind in der Nacht erneut zum Ziel russischer Raketen und Kampfdrohnen geworden. Kiews Militärverwalter Tymur Tkatschenko warnte auf T… [+1724 chars],,de,'Ukraine'
https://www.zeit.de/news/2026-02/03/wadephul-moskau-will-mit-revanchismus-vorwuerfen-ablenken,https://www.zeit.de/news/2026-02/03/wadephul-moskau-will-mit-revanchismus-vorwuerfen-ablenken,0,www.zeit.de,Krieg in der Ukraine: Wadephul: Moskau will mit Revanchismus-Vorwürfen ablenken,Hier finden Sie Informationen zu dem Thema „Krieg in der Ukraine“. Lesen Sie jetzt „Wadephul: Moskau will mit Revanchismus-Vorwürfen ablenken“.,https://img.zeit.de/news/2026-02/03/wadephul-moskau-will-mit-revanchismus-vorwuerfen-ablenken-image-group/wide__1300x731,2026-02-03T00:13:35Z,,Außenminister Johann Wadephul weist Moskauer Revanchismus-Vorwürfe im Zusammenhang mit der deutschen Unterstützung für die von Russland angegriffene Ukraine strikt zurück. «Das ist ein billiger Ablen… [+2896 chars],,de,'Ukraine'
https://www.zeit.de/news/2026-02/03/glatteisgefahr-im-westen-eisige-kaelte-im-osten,https://www.zeit.de/news/2026-02/03/glatteisgefahr-im-westen-eisige-kaelte-im-osten,0,www.zeit.de,Wetter: Glatteisgefahr im Westen - eisige Kälte im Osten,Hier finden Sie Informationen zu dem Thema „Wetter“. Lesen Sie jetzt „Glatteisgefahr im Westen - eisige Kälte im Osten“.,https://img.zeit.de/news/2026-02/03/glatteisgefahr-im-westen-eisige-kaelte-im-osten-image-group/wide__1300x731,2026-02-03T03:41:42Z,,"Während die Menschen im Osten und Nordosten mit den eisigen Temperaturen zu kämpfen haben, droht im Westen und Südwesten Deutschlands zur Wochenmitte neue Glatteisgefahr. Am Dienstag fällt dort laut … [+2939 chars]",,de,'Kälte'
https://www.zeit.de/news/2026-02/03/glatte-strassen-moeglich-neuer-schnee-zieht-heran,https://www.zeit.de/news/2026-02/03/glatte-strassen-moeglich-neuer-schnee-zieht-heran,0,www.zeit.de,Wetter-Vorhersage: Glatte Straßen möglich - neuer Schnee zieht heran,Hier finden Sie Informationen zu dem Thema „Wetter-Vorhersage“. Lesen Sie jetzt „Glatte Straßen möglich - neuer Schnee zieht heran“.,https://img.zeit.de/news/2026-02/03/glatte-strassen-moeglich-neuer-schnee-zieht-heran-image-group/wide__1300x731,2026-02-03T06:04:54Z,,"Verkehrsteilnehmer müssen heute Morgen mit Glätte auf Straßen und Wegen rechnen. Dies trete örtlich durch überfrierende Nässe, vereinzelt auch durch Reif auf, teilt der Deutsche Wetterdienst (DWD) in… [+1147 chars]",,de,'Schnee'
https://www.zeit.de/news/2026-02/03/keine-regierungsvertreter-russlands-in-muenchen-erwartet,https://www.zeit.de/news/2026-02/03/keine-regierungsvertreter-russlands-in-muenchen-erwartet,0,www.zeit.de,Münchner Sicherheitskonferenz: Keine Regierungsvertreter Russlands in München erwartet,Hier finden Sie Informationen zu dem Thema „Münchner Sicherheitskonferenz“. Lesen Sie jetzt „Keine Regierungsvertreter Russlands in München erwartet“.,https://img.zeit.de/news/2026-02/03/keine-regierungsvertreter-russlands-in-muenchen-erwartet-image-group/wide__1300x731,2026-02-03T06:44:15Z,,"Die russische Regierung hat nach Angaben der Münchner Sicherheitskonferenz (MSC) bisher kein Interesse signalisiert, an dem Treffen von Spitzenpolitikern und Experten in der kommenden Woche teilzuneh… [+3094 chars]",,de,'Russland'
https://www.waz.de/ratgeber-wissen/energie/article408955020/flexible-solarmodule-nachhaltige-stromversorgung-fuer-balkon-wohnmobil-und-garten.html,https://www.waz.de/ratgeber-wissen/energie/article408955020/flexible-solarmodule-nachhaltige-stromversorgung-fuer-balkon-wohnmobil-und-garten.html,0,www.waz.de,"Flexible Solarmodule: Nachhaltige Stromversorgung für Balkon, Wohnmobil & Garten",Flexible Solarmodule von Kleines Kraftwerk ab 379 € liefern bis zu 1800Wp Strom. Sparen Sie 42 % beim Kauf eines Sets und senken Sie Ihre Energiekosten nachhaltig.,https://img.sparknews.funkemedien.de/411095970/411095970_1770034707_v16_9_1600.jpeg,2026-02-03T06:50:00Z,,"Stellen Sie sich vor, Sie erzeugen Ihren eigenen Strom auf dem Balkon, im Garten oder sogar auf dem Wohnmobil. Ganz ohne Lärm, ganz ohne aufwendige Installation. Genau das ermöglichen flexible Solarm… [+6997 chars]",,de,'Sparen'
https://www.zeit.de/gesellschaft/2026-02/armutsgefaehrdungsquote-deutschland-armutsgrenze-einkommen-gxe,https://www.zeit.de/gesellschaft/2026-02/armutsgefaehrdungsquote-deutschland-armutsgrenze-einkommen-gxe,0,www.zeit.de,Armutsrisiko: Mehr als 13 Millionen Menschen in Deutschland sind armutsgefährdet,In Deutschland gelten mehr Menschen als armutsgefährdet. Besonders betroffen sind laut dem Statistischen Bundesamt Alleinlebende und Alleinerziehende.,https://img.zeit.de/gesellschaft/zeitgeschehen/2026-02/menschen-deutschland-armut-bild/wide__1300x731,2026-02-03T08:14:06Z,,"Der Anteil der armutsgefährdeten Menschen in Deutschland nimmt zu. Rund 13,3 Millionen hatten im Jahr 2024 ein Einkommen unterhalb der Armutsgefährdungsgrenze, wie das Statistische Bundesamt mitteilt… [+1496 chars]",,de,'Armut'
https://www.faz.net/aktuell/wirtschaft/arm-und-reich/deutschland-armutsgefaehrdung-steigt-laut-statistischem-bundesamt-accg-200501547.html,https://www.faz.net/aktuell/wirtschaft/arm-und-reich/deutschland-armutsgefaehrdung-steigt-laut-statistischem-bundesamt-accg-200501547.html,0,www.faz.net,"13,3 Millionen: Mehr Menschen in Deutschland von Armut bedroht","Der Anteil armutsgefährdeter Menschen ist in Deutschland laut Statistischem Bundesamt von 15,5 auf 16,1 Prozent gestiegen. Wer besonders betroffen ist.",https://media0.faz.net/image/w1200h627/88d6838638c3/w5144h2687x0y371o/202602/43601.0.1730348152/obdachlose-menschen-in-einer.webp,2026-02-03T08:35:18Z,,"In Deutschland sind mehr Menschen von Armut bedroht. Rund 13,3 Millionen Menschen hatten zuletzt ein Einkommen unterhalb der Armutsgefährdungsgrenze, wie das Statistische Bundesamt am Dienstag mittei… [+1824 chars]",,de,'Armut'
https://www.tagesspiegel.de/politik/erhebung-armut-133-millionen-menschen-gefahrdet-15211386.html,https://www.tagesspiegel.de/politik/erhebung-armut-133-millionen-menschen-gefahrdet-15211386.html,0,www.tagesspiegel.de,"Erhebung: Armut: 13,3 Millionen Menschen gefährdet",Bei sehr vielen Menschen reicht das Geld hinten und vorne nicht. Die jüngste Statistik zeigt eine deutliche Zunahme. Die Opposition fordert Konsequenzen.,https://www.tagesspiegel.de/images/15213104/alternates/BASE_16_9_W1400/1770126155000/bremer-tafel.jpeg,2026-02-03T08:49:32Z,,"In Deutschland ist die Zahl der armutsgefährdeten Menschen binnen eines Jahres um 200.000 auf 13,3 Millionen gestiegen - das entspricht 16,1 Prozent der Bevölkerung. Dies teilte das Statistische Bund… [+3669 chars]",,de,'Sparen'
https://www.n-tv.de/ratgeber/Unfallauto-laenger-in-der-Reparatur-Versicherer-muss-zahlen-id30317752.html,https://www.n-tv.de/ratgeber/Unfallauto-laenger-in-der-Reparatur-Versicherer-muss-zahlen-id30317752.html,0,www.n-tv.de,Kosten für die Wartung: Unfallauto länger in der Reparatur: Versicherer muss zahlen,Kostenvoranschläge schwanken stark und außerhalb der Stadt sind Werkstätten oft günstiger. Warum sich das Vergleichen für Autofahrer besonders lohnt und worauf man bei den Aufträgen achten sollte.,https://www.n-tv.de/img/30316751/1770076885/Img_16_9/1200/Auch-bei-der-Autoinspektion-kann-gespart-werden-mit-Vergleichsangeboten-und-einem-detaillierten-Kostenvoranschlag.jpg,2026-02-03T09:56:54Z,,"Auch bei der Autoinspektion kann gespart werden - mit Vergleichsangeboten und einem detaillierten Kostenvoranschlag. (Foto: picture alliance / dpa Themendienst)
Kostenvoranschläge schwanken stark un… [+2896 chars]",,de,'Sparen'
https://www.zeit.de/politik/ausland/2026-02/atomwaffenkontrollvertrag-russland-usa-new-start-atomare-obergrenze-sergej-rjabkow,https://www.zeit.de/politik/ausland/2026-02/atomwaffenkontrollvertrag-russland-usa-new-start-atomare-obergrenze-sergej-rjabkow,0,www.zeit.de,Atomwaffenkontrollvertrag: Russland stellt sich auf Welt ohne atomare Obergrenzen ein,Der Rüstungskontrollvertrag New Start zwischen Russland und den USA läuft diese Woche aus. Russland spricht von einer neuen Realität – eine Einigung ist nicht in Sicht.,https://img.zeit.de/administratives/sharing/fallback-image-die-zeit/wide__1300x731,2026-02-03T10:16:45Z,,"Russland bereitet sich auf das Auslaufen des
Atomwaffenkontrollvertrags New Start in dieser Woche vor. Die
Regierung in Moskau sei bereit für die ""neue Realität"" einer
Welt ohne Rüstungskontrollgr… [+695 chars]",,de,'Russland'
https://www.zeit.de/news/2026-02/03/tanken-wird-teurer-rohoel-und-co2-preis-treiben-kosten,https://www.zeit.de/news/2026-02/03/tanken-wird-teurer-rohoel-und-co2-preis-treiben-kosten,0,www.zeit.de,Verbraucherpreise: Tanken wird teurer – Rohöl und CO2-Preis treiben Kosten,Hier finden Sie Informationen zu dem Thema „Verbraucherpreise“. Lesen Sie jetzt „Tanken wird teurer – Rohöl und CO2-Preis treiben Kosten“.,https://img.zeit.de/news/2026-02/03/tanken-wird-teurer-rohoel-und-co2-preis-treiben-kosten-image-group/wide__1300x731,2026-02-03T11:21:53Z,,"Tanken ist im Januar deutlich kostspieliger gewesen als im Vormonat Dezember. Im Durchschnitt war Superbenzin der Sorte E10 um 8,6 Cent teurer, Diesel sogar um 9,4 Cent, wie der ADAC mitteilt. Ein Li… [+1703 chars]",,de,'Kosten'
https://www.tagesspiegel.de/potsdam/landeshauptstadt/mehr-heizkostennachzahlungen-bei-pro-potsdam-teurere-fernwarme-und-wegfallende-entlastungen-belasten-viele-mieter-15201509.html,https://www.tagesspiegel.de/potsdam/landeshauptstadt/mehr-heizkostennachzahlungen-bei-pro-potsdam-teurere-fernwarme-und-wegfallende-entlastungen-belasten-viele-mieter-15201509.html,0,www.tagesspiegel.de,Mehr Heizkosten‑Nachzahlungen bei Pro Potsdam: Teurere Fernwärme und wegfallende Entlastungen belasten viele Mieter,Der Eindruck täuscht nicht: Für 2024 wurden mehr Forderungen für Nachzahlungen bei den Betriebskosten verschickt als für das Jahr davor. Dabei war Heizen der Preistreiber. Das ergibt die Analyse der Pro Potsdam.,https://www.tagesspiegel.de/images/15203503/alternates/BASE_16_9_W1400/1769789889000/propotsdam-wohnungsbaugesellschaft.jpeg,2026-02-03T12:40:59Z,,Mit dem Wegfall der steuerlichen Erleichterungen bei den Heizkosten drohten im Vorjahr teils hohe Nachzahlungen mit den Nebenkostenabrechnungen. Die Verbraucherschützer warnten und berieten. Tatsächl… [+188 chars],,de,'Heizen'
https://www.stern.de/politik/ausland/ukraine-krieg--neue-russische-angriffe--frieren-in-der-ukraine-geht-weiter-37100174.html,https://www.stern.de/politik/ausland/ukraine-krieg--neue-russische-angriffe--frieren-in-der-ukraine-geht-weiter-37100174.html,0,www.stern.de,Ukraine-Krieg: Neue russische Angriffe: Frieren in der Ukraine geht weiter,Moskau bestätigte eine von US-Präsident Trump angestoßene begrenzte Waffenruhe – bis Sonntag. Das ist nun augenscheinlich vorbei. Hunderttausende Menschen kämpfen mit Strom- und Heizungsausfällen.,https://image.stern.de/37102304/t/2f/v1/w1440/r1.7778/-/03--6k7ry6cqvvv3axs2048jpeg---33802efea640d4ac.jpg,2026-02-03T12:53:54Z,,"Kopiere den aktuellen Link
Zur Merkliste hinzufügen
Moskau bestätigte eine von US-Präsident Trump angestoßene begrenzte Waffenruhe bis Sonntag. Das ist nun augenscheinlich vorbei. Hunderttausende M… [+5085 chars]",,de,'Frieren'
https://www.golem.de/sonstiges/zustimmung/auswahl.html?from=https://www.golem.de/news/cxmt-ymtc-chinesische-speicherhersteller-bauen-kapazitaet-massiv-aus-2602-204943.html&referer=https://t.co/bd7351a202,https://www.golem.de/sonstiges/zustimmung/auswahl.html?from=https://www.golem.de/news/cxmt-ymtc-chinesische-speicherhersteller-bauen-kapazitaet-massiv-aus-2602-204943.html&referer=https://t.co/bd7351a202,0,www.golem.de,CXMT & YMTC: Chinesische Speicherhersteller bauen Kapazität massiv aus,"Chinas Speicherhersteller könnten Gewinner der Knappheit sein. Der Bedarf ist so hoch, dass ein Flash-Hersteller künftig auch RAM fertigen will. (RAM, 3D-Speicher)",,2026-02-03T13:00:02Z,,"Besuchen Sie Golem.de wie gewohnt mit Werbung und Tracking,
 indem Sie der Nutzung aller Cookies zustimmen.
 Details zum Tracking finden Sie im Privacy Center.
Skript wurde nicht geladen. Informat… [+607 chars]",,de,'Knappheit'
https://www.zeit.de/politik/deutschland/2026-02/russland-netzwerk-untersuchungshaft-karlsruhe-bundesgerichtshof,https://www.zeit.de/politik/deutschland/2026-02/russland-netzwerk-untersuchungshaft-karlsruhe-bundesgerichtshof,0,www.zeit.de,EU-Sanktionen gegen Russland: Verdächtige wegen mutmaßlich illegaler Exporte nach Russland in U-Haft,Fünf Verdächtige eines mutmaßlichen Beschaffungsnetzwerks für Russland sitzen in Untersuchungshaft. Sie sollen systematisch EU-Sanktionen umgangen haben.,https://img.zeit.de/gesellschaft/zeitgeschehen/2026-02/russland-netzwerk-untersuchungshaft-karlsruhe-bundesgerichtshof-bild/wide__1300x731,2026-02-03T14:50:47Z,,Ein Ermittlungsrichter am Bundesgerichtshof in Karlsruhe hat die Haftbefehle gegen fünf mutmaßliche Mitglieder eines Beschaffungsnetzwerks für Russland in Vollzug gesetzt. Die Bundesanwaltschaft hatt… [+779 chars],,de,'Russland'
https://www.zeit.de/news/2026-02/03/schnee-am-frankfurter-airport-flieger-landen-in-stuttgart,https://www.zeit.de/news/2026-02/03/schnee-am-frankfurter-airport-flieger-landen-in-stuttgart,0,www.zeit.de,Winterwetter: Schnee am Frankfurter Airport - Flieger landen in Stuttgart,Hier finden Sie Informationen zu dem Thema „Winterwetter“. Lesen Sie jetzt „Schnee am Frankfurter Airport - Flieger landen in Stuttgart“.,https://img.zeit.de/news/2026-02/03/schnee-am-frankfurter-airport-flieger-landen-in-stuttgart-image-group/wide__1300x731,2026-02-03T14:54:21Z,,"Wegen Schneefalls am Frankfurter Flughafen sind mehrere Flugzeuge nach Stuttgart umgeleitet worden. Zehn Maschinen seien am Stuttgarter Airport gelandet, sagte eine Sprecherin. Ob und wie viele weite… [+921 chars]",,de,'Schnee'
https://www.zeit.de/news/2026-02/03/30-kilometer-stau-auf-a3-mit-schnee-rettungsdienste-bereit,https://www.zeit.de/news/2026-02/03/30-kilometer-stau-auf-a3-mit-schnee-rettungsdienste-bereit,0,www.zeit.de,Schnee und Glätte: 30 Kilometer Stau auf A3 mit Schnee: Rettungsdienste bereit,Hier finden Sie Informationen zu dem Thema „Schnee und Glätte“. Lesen Sie jetzt „30 Kilometer Stau auf A3 mit Schnee: Rettungsdienste bereit“.,https://img.zeit.de/news/2026-02/03/30-kilometer-stau-auf-a3-mit-schnee-rettungsdienste-bereit-image-group/wide__1300x731,2026-02-03T17:33:23Z,,"Nach heftigen Schneefällen staut es sich auf der A3 zwischen Raunheim und Idstein in Hessen auf knapp 30 Kilometern Länge. Derzeit hoffe die Polizei, dass der Stau in den nächsten Stunden zumindest e… [+944 chars]",,de,'Schnee'
https://www.welt.de/debatte/article6981f9d948913c22813941f4/ukraine-krieg-russland-trifft-bei-eiseskaelte-die-aeltesten-und-schwaechsten.html,https://www.welt.de/debatte/article6981f9d948913c22813941f4/ukraine-krieg-russland-trifft-bei-eiseskaelte-die-aeltesten-und-schwaechsten.html,0,www.welt.de,Russland trifft bei Eiseskälte die Ältesten und Schwächsten,"Putin will die Ukraine in den totalen Blackout bomben. Stromausfälle gibt es im ganzen Land, die humanitäre Lage spitzt sich zu. Bei diesen systematischen Angriffen handelt es sich um eine Terrorkampagne.",https://images.welt.de/6981f9d948913c22813941f4/8fb27c36427241df1435489bdeaf59e2/ci16x9-w1200/ibra-naber-welt,2026-02-03T20:04:19Z,,"Putin will die Ukraine in den totalen Blackout bomben. Stromausfälle gibt es im ganzen Land, die humanitäre Lage spitzt sich zu. Bei diesen systematischen Angriffen handelt es sich um eine Terrorkamp… [+3486 chars]",,de,'Frieren'
https://www.zeit.de/news/2026-02/04/trotz-angriffen-ukrainer-und-russen-verhandeln-in-abu-dhabi,https://www.zeit.de/news/2026-02/04/trotz-angriffen-ukrainer-und-russen-verhandeln-in-abu-dhabi,0,www.zeit.de,Die Lage im Überblick: Trotz Angriffen: Ukrainer und Russen verhandeln in Abu Dhabi,Hier finden Sie Informationen zu dem Thema „Die Lage im Überblick“. Lesen Sie jetzt „Trotz Angriffen: Ukrainer und Russen verhandeln in Abu Dhabi“.,https://img.zeit.de/news/2026-02/04/trotz-angriffen-ukrainer-und-russen-verhandeln-in-abu-dhabi-image-group/wide__1300x731,2026-02-04T03:55:04Z,,Trotz schwerer russischer Luftangriffe auf die Ukraine sollen Unterhändler aus Kiew und Moskau heute wieder in Abu Dhabi Möglichkeiten für ein Kriegsende ausloten. Beide Seiten wie auch die USA als V… [+6051 chars],,de,'Ukraine'
https://www.zeit.de/news/2026-02/04/berlin-oeffnet-tueren-orte-zum-aufwaermen,https://www.zeit.de/news/2026-02/04/berlin-oeffnet-tueren-orte-zum-aufwaermen,0,www.zeit.de,Kälte: Berlin öffnet Türen: Orte zum Aufwärmen,Hier finden Sie Informationen zu dem Thema „Kälte“. Lesen Sie jetzt „Berlin öffnet Türen: Orte zum Aufwärmen“.,https://img.zeit.de/news/2026-02/04/berlin-oeffnet-tueren-orte-zum-aufwaermen-image-group/wide__1300x731,2026-02-04T04:00:12Z,,"Der Kälte für ein paar Stunden entkommen, sich ein wenig aufwärmen und das alles, ohne Geld auszugeben: Das ist in Berlin an vielen Orten möglich. 
Zum Beispiel in den beiden Standorten der Zentral-… [+1085 chars]",,de,'Kälte'
https://www.zeit.de/news/2026-02/04/schnee-und-glatteis-in-teilen-deutschlands-angesagt,https://www.zeit.de/news/2026-02/04/schnee-und-glatteis-in-teilen-deutschlands-angesagt,0,www.zeit.de,Wetter: Schnee und Glatteis in Teilen Deutschlands angesagt,Hier finden Sie Informationen zu dem Thema „Wetter“. Lesen Sie jetzt „Schnee und Glatteis in Teilen Deutschlands angesagt“.,https://img.zeit.de/news/2026-02/04/schnee-und-glatteis-in-teilen-deutschlands-angesagt-image-group/wide__1300x731,2026-02-04T04:04:48Z,,Wegen des Winterwetters müssen sich die Menschen in Teilen Deutschlands am Morgen auf glatte Straßen einstellen. Der Deutsche Wetterdienst hatte für die Nacht stellenweise vor Glätte durch überfriere… [+2095 chars],,de,'Schnee'
https://www.basicthinking.de/blog/2026/02/04/co2-preis-heizen-teurer-europa/,https://www.basicthinking.de/blog/2026/02/04/co2-preis-heizen-teurer-europa/,0,www.basicthinking.de,CO2-Preis macht Heizen teurer – aber nicht überall und überall gleich,"Der Beitrag CO2-Preis macht Heizen teurer – aber nicht überall und überall gleich erschien zuerst beim Online-Magazin BASIC thinking. Über unseren Newsletter UPDATE startest du jeden Morgen bestens informiert in den Tag.
Der von der EU geplante CO2-Preis wird…",https://www.basicthinking.de/blog/wp-content/uploads/2026/01/co2-preis-heizen.jpeg,2026-02-04T04:45:17Z,,"Der von der EU geplante CO2-Preis wird die Heizkosten vieler Haushalte spürbar verändern. Je nach Land wird es hier allerdings enorme Unterschiede geben. Eine Analyse der Bertelsmann Stiftung zeigt, … [+3445 chars]",,de,'Heizen'
https://www.zeit.de/news/2026-02/04/schnee-und-glaette-in-berlin-und-brandenburg-erwartet,https://www.zeit.de/news/2026-02/04/schnee-und-glaette-in-berlin-und-brandenburg-erwartet,0,www.zeit.de,Wetter: Schnee und Glätte in Berlin und Brandenburg erwartet,Hier finden Sie Informationen zu dem Thema „Wetter“. Lesen Sie jetzt „Schnee und Glätte in Berlin und Brandenburg erwartet“.,https://img.zeit.de/news/2026-02/04/schnee-und-glaette-in-berlin-und-brandenburg-erwartet-image-group/wide__1300x731,2026-02-04T04:56:16Z,,In Berlin und Brandenburg sind Schnee und Temperaturen über dem Gefrierpunkt in Sicht. Laut Deutschem Wetterdienst (DWD) ist es am Mittwoch stark bewölkt bei Höchsttemperaturen von -6 bis 1 Grad. In … [+578 chars],,de,'Schnee'
https://www.zeit.de/news/2026-02/04/winterwetter-bremst-nahverkehr-wo-pendler-geduld-brauchen,https://www.zeit.de/news/2026-02/04/winterwetter-bremst-nahverkehr-wo-pendler-geduld-brauchen,0,www.zeit.de,Glätte und Schnee: Winterwetter bremst Nahverkehr – Wo Pendler Geduld brauchen,Hier finden Sie Informationen zu dem Thema „Glätte und Schnee“. Lesen Sie jetzt „Winterwetter bremst Nahverkehr – Wo Pendler Geduld brauchen“.,https://img.zeit.de/news/2026-02/04/winterwetter-bremst-nahverkehr-wo-pendler-geduld-brauchen-image-group/wide__1300x731,2026-02-04T06:00:07Z,,"Wer mit Bus oder Regionalbahn in Niedersachsen unterwegs ist, braucht wegen des Winterwetters Geduld. Fahrgäste müssen mit Verzögerungen oder Ausfällen im Linienverkehr rechnen, wie mehrere Busuntern… [+979 chars]",,de,'Schnee'
https://www.faz.net/aktuell/politik/menschenrechtssystem-laut-human-rights-watch-stark-unter-druck-accg-200504679.html,https://www.faz.net/aktuell/politik/menschenrechtssystem-laut-human-rights-watch-stark-unter-druck-accg-200504679.html,0,www.faz.net,Hinrichtungen und Rassismus: Menschenrechte laut Human Rights Watch stark unter Druck,"Der HRW-Jahresbericht zeigt, wo Rechte systematisch untergraben werden. Länder wie Afghanistan, Iran und Russland stehen auf der Liste. Aber auch Deutschland verliert demnach an Glaubwürdigkeit.",https://media0.faz.net/image/w1200h627/1877ac3cb835/w6144h3210x0y443o/202602/43601.0.1733488745/menschen-protestieren-in.webp,2026-02-04T06:23:33Z,,"Die Menschenrechtsorganisation Human Rights Watch (HRW) zeichnet in ihrem Jahresbericht 2026 ein so düsteres Bild der aktuellen Weltlage wie selten. Verantwortlich macht sie dafür neben Russland, Chi… [+4292 chars]",,de,'Russland'
https://www.welt.de/politik/ausland/article6982e2a5f0e62064809e404f/mittelmeer-migrantenboot-kollidiert-mit-kuestenwache-vor-griechischer-insel-polizei-spricht-von-14-toten.html,https://www.welt.de/politik/ausland/article6982e2a5f0e62064809e404f/mittelmeer-migrantenboot-kollidiert-mit-kuestenwache-vor-griechischer-insel-polizei-spricht-von-14-toten.html,0,www.welt.de,Migrantenboot kollidiert mit Küstenwache vor griechischer Insel – Polizei spricht von 14 Toten,"Ein Patrouillenboot der Hafenpolizei trifft vor der Insel Chios in der Ägäis auf ein Schnellboot mit dutzenden Migranten. Die Küstenwache gibt ein Warnsignal ab, der Fahrer des Migrantenbootes leitet die Flucht ein. Dann kommt es zur Kollision.",https://images.welt.de/6982e2a5f0e62064809e404f/ce6496a45a430821caf14a2f00f59004/ci16x9-w1200/2026-02-03t223205z-70109124-rc2kejaab9hs-rtrmadp-3-migration-greece-jpg,2026-02-04T06:47:42Z,,"Bei dem Zusammenstoß eines Migrantenbootes mit einem Boot der griechischen Küstenwache sind vor der Insel Chios in der Ägäis Polizeiangaben zufolge 14 Menschen ums Leben gekommen. 
25 gerettete Migr… [+1547 chars]",,de,'Flucht'
https://www.zeit.de/news/2026-02/04/winterwetter-legt-teile-des-bahn-fernverkehrs-lahm,https://www.zeit.de/news/2026-02/04/winterwetter-legt-teile-des-bahn-fernverkehrs-lahm,0,www.zeit.de,"Schnee, Eis, Kälte: Winterwetter legt Teile des Bahn-Fernverkehrs lahm","Hier finden Sie Informationen zu dem Thema „Schnee, Eis, Kälte“. Lesen Sie jetzt „Winterwetter legt Teile des Bahn-Fernverkehrs lahm“.",https://img.zeit.de/news/2026-02/04/winterwetter-legt-teile-des-bahn-fernverkehrs-lahm-image-group/wide__1300x731,2026-02-04T08:11:13Z,,"Das Winterwetter sorgt im Fernverkehr der Deutschen Bahn zwischen Berlin und Hannover am Morgen für zahlreiche Ausfälle. Wie die Bahn online mitteilte, fällt unter anderem der ICE-Sprinter zwischen B… [+338 chars]",,de,'Schnee'
https://www.golem.de/sonstiges/zustimmung/auswahl.html?from=https://www.golem.de/news/unitree-g1-humanoider-roboter-stapft-kilometerweit-durch-schnee-2602-204976.html&referer=https://t.co/95c39e23ea,https://www.golem.de/sonstiges/zustimmung/auswahl.html?from=https://www.golem.de/news/unitree-g1-humanoider-roboter-stapft-kilometerweit-durch-schnee-2602-204976.html&referer=https://t.co/95c39e23ea,0,www.golem.de,Unitree G1: Humanoider Roboter stapft kilometerweit durch Schnee,"Über mehrere Stunden war der Roboter bei -50 °C unterwegs, um die Robustheit und Präzision zu demonstrieren - bei erleichterten Bedingungen. (Roboter, GPS)",,2026-02-04T08:44:02Z,,"Besuchen Sie Golem.de wie gewohnt mit Werbung und Tracking,
 indem Sie der Nutzung aller Cookies zustimmen.
 Details zum Tracking finden Sie im Privacy Center.
Skript wurde nicht geladen. Informat… [+607 chars]",,de,'Schnee'
