index,url,valid,domain,title,description,image,published,archive,content,quote,language,keyword
https://www.tagesspiegel.de/internationales/us-wahl-us-geheimdienste-wahlmanipulation-bleibt-russlands-ziel-12646004.html,https://www.tagesspiegel.de/internationales/us-wahl-us-geheimdienste-wahlmanipulation-bleibt-russlands-ziel-12646004.html,0,www.tagesspiegel.de,US-Wahl: US-Geheimdienste: Wahlmanipulation bleibt Russlands Ziel,Lange schon wirft die US-Regierung ihren Feinden versuchte Beeinflussung der US-Wahl vor. Der Kreml soll seine Falschnachrichten zuletzt gar noch verstärkt haben. Und noch ein Akteur wird genannt.,https://www.tagesspiegel.de/images/12646001/alternates/BASE_16_9_W1400/1730776113000/russland-nationaler-gesundheitskongress-putin.jpeg,2024-11-05T03:08:33Z,,Vor der weltweit mit Spannung erwarteten US-Wahl warnen amerikanische Geheimdienste vor versuchter Manipulation der Abstimmung durch Russland - auch am Wahltag und in den Wochen danach. Russland ist … [+1472 chars],,de,'Russland'
https://www.nzz.ch/international/ukraine-krieg-kiew-will-armee-vergroessern-erlebt-aber-rekrutierungskrise-ld.1854985,https://www.nzz.ch/international/ukraine-krieg-kiew-will-armee-vergroessern-erlebt-aber-rekrutierungskrise-ld.1854985,0,www.nzz.ch,Die Ukraine braucht dringend mehr Soldaten – doch Zwang ist kein Ersatz für fehlende Motivation,"Kiew will die Armee stark vergrössern, um Verluste zu ersetzen. Doch viele Männer im Land verstecken sich, und die Militärbehörden bekommen die Korruption nicht in den Griff.","https://img.nzz.ch/2024/11/04/0c597f3c-a6f9-456f-ba67-412a66b750e7.jpeg?width=1200&height=675&fit=bounds&quality=75&auto=webp&crop=6000,3375,x0,y135&wmark=nzz",2024-11-05T04:30:00Z,http://archive.md/20241105073655/https://www.nzz.ch/international/ukraine-krieg-kiew-will-armee-vergroessern-erlebt-aber-rekrutierungskrise-ld.1854985,"Der Krieg ist in der Ukraine an jeder Ecke präsent, so auch an diesem Stand für Brigade-Abzeichen und Magnete mit patriotischen Symbolen. Doch die Zahl der Freiwilligen nimmt ab.
Seit mehr als zweie… [+6553 chars]",,de,'Ukraine'
https://www.diepresse.com/18498832/heute-vor-90-jahren-fuer-die-hungernden-und-frierenden,https://www.diepresse.com/18498832/heute-vor-90-jahren-fuer-die-hungernden-und-frierenden,0,www.diepresse.com,Heute vor 90 Jahren: Für die Hungernden und Frierenden [premium],Ein Aufruf des Handelsministers.,https://img.diepresse.com/public/incoming/84t83w-Unbenannt-1_bearbeitet-2_1573327141100231.jpg/alternates/DPR_SOCIAL_MAGAZIN/Unbenannt-1_bearbeitet-2_1573327141100231.jpg,2024-11-05T04:51:02Z,,"Ein Aufruf des Handelsministers. 
Neue Freie Presse am 5. November 1934
Bundesminister für Handel und Gewerbe Fritz Stockinger wendet sich mit nachstehendem Aufruf an die Wiener Oeffentlichkeit: Ei… [+203 chars]",,de,'Frieren'
https://futurezone.at/digital-life/smartphone-kopfhoerer-smartwatch-kaelte-naesse-winter-akku/402970917,https://futurezone.at/digital-life/smartphone-kopfhoerer-smartwatch-kaelte-naesse-winter-akku/402970917,0,futurezone.at,"Handy, Kopfhörer, Smartwatch: Darauf sollte man bei Kälte achten","Jahreszeitenbedingt sinken die Temperaturen. Für Handy, Kopfhörer und anderen Geräte bedeuten Herbst und Winter Strapazen.",https://image.futurezone.at/images/facebook/8862945/ad.jpg,2024-11-05T05:00:00Z,,"Jahreszeitenbedingt sinken die Temperaturen. Für Handy, Kopfhörer und anderen Geräte bedeuten Herbst und Winter Strapazen.
Auch in der kalten Jahreszeit brauchen wir das Handy etwa, weil wir damit s… [+357 chars]",,de,'Kälte'
https://www.businessinsider.de/gruenderszene/business/fahrraeder-beauty-energie-diese-startups-haben-ex-mitarbeiter-von-enpal-gegruendet/,https://www.businessinsider.de/gruenderszene/business/fahrraeder-beauty-energie-diese-startups-haben-ex-mitarbeiter-von-enpal-gegruendet/,0,www.businessinsider.de,"Fahrräder, Beauty, Energie: Diese Startups haben Ex-Mitarbeiter von Enpal gegründet","Fahrräder, Beauty und Energielösungen: Diese sechs Startups haben ehemalige Mitarbeiter von Mario Kohles Energie-Einhorn Enpal gegründet.",https://cdn.businessinsider.de/wp-content/uploads/2024/11/202411_GS_Enpal_1800x1200.jpg?ver=1730734824,2024-11-05T05:00:00Z,http://archive.md/20241105094600/https://www.businessinsider.de/gruenderszene/business/fahrraeder-beauty-energie-diese-startups-haben-ex-mitarbeiter-von-enpal-gegruendet/,"Enpal ist für vieles bekannt. Zum Beispiel dafür, dass das Solar-Startup von Mario Kohle 2021, nur vier Jahre nach der Gründung, in den Club der deutschen Einhörner aufstieg. Oder für seine Rivalität… [+748 chars]",,de,'Kohle'
https://www.stern.de/panorama/toedliche-schleuserfahrt--urteil-im-prozess-erwartet-35198972.html,https://www.stern.de/panorama/toedliche-schleuserfahrt--urteil-im-prozess-erwartet-35198972.html,0,www.stern.de,Bayern: Urteil im Prozess um tödliche Schleuserfahrt erwartet,Auf der Flucht vor der Polizei rast ein Schleuserfahrzeug in die Leitplanke. Sieben Migranten sterben. Jetzt geht der Prozess gegen den Fahrer zu Ende. War es Mord?,https://image.stern.de/35198974/t/1j/v2/w1440/r1.7778/-/bayern-schleuser.jpg,2024-11-05T05:19:00Z,,"Kopiere den aktuellen Link
Auf der Flucht vor der Polizei rast ein Schleuserfahrzeug in die Leitplanke. Sieben Migranten sterben. Jetzt geht der Prozess gegen den Fahrer zu Ende. War es Mord?
Im Pr… [+1473 chars]",,de,'Flucht'
https://www.focus.de/auto/auf-keinen-fall-liegen-lassen-fuenf-dinge-sollten-sie-im-winter-nicht-im-auto-lassen_id_259473697.html,https://www.focus.de/auto/auf-keinen-fall-liegen-lassen-fuenf-dinge-sollten-sie-im-winter-nicht-im-auto-lassen_id_259473697.html,0,www.focus.de,Auf keinen Fall liegen lassen - Fünf Dinge sollten Sie im Winter nicht im Auto lassen,"Lassen Sie gern Dinge im Auto liegen? Besonders im Winter sollten Sie das vermeiden. Hier erfahren Sie, welche fünf Gegenstände bei Kälte besser aus dem Auto genommen werden sollten.",https://p6.focus.de/img/fotos/id_260452262/fuenf-dinge-sollten-sie-im-winter-nicht-im-auto-lassen-2181970768.jpg?im=Crop%3D%280%2C129%2C2121%2C1060%29%3BResize%3D%281200%2C627%29&impolicy=perceptual&quality=mediumHigh&hash=2fd6d88f0bbecbaa497d065c0937131e0885d4e90601a8fe0c047f9effa2412b,2024-11-05T06:54:18Z,,"<ul><li>
Kommentare</li><li>
E-Mail</li><li>
Teilen</li><li>
Mehr</li><li>
Twitter</li><li>
Drucken</li><li>
Feedback</li><li>
Fehler meldenSie haben einen Fehler gefunden?
Bitte markieren S… [+2234 chars]",,de,'Kälte'
https://www.kino-zeit.de/film-kritiken-trailer-streaming/flowers-of-ukraine-2024,https://www.kino-zeit.de/film-kritiken-trailer-streaming/flowers-of-ukraine-2024,0,www.kino-zeit.de,Flowers of Ukraine (2024),"DOK Leipzig

 
 
 




 
 Natalia Grzegorzek, Glib Lukianets (via Dok Leipzig)

 
 Flowers of Ukraine (2024) von Adelina Borets

 







Umgeben von Hochhäusern, hat Natalia sich ihr gar nicht mal so kleines Paradies geschaffen: Ziegen laufen frei herum, …",,2024-11-05T09:55:15Z,,"Flowers of Ukraine ist die erste Lang-Dokumentation der 1998 in Mariuopol geborenen Regisseurin Adelina Borets, der mit ihrer Protagonistin ein echter Glücksgriff gelungen ist. Natalia strahlt derart… [+2433 chars]",,de,'Flucht'
https://www.nzz.ch/international/medizinische-not-im-krieg-libanons-gesundheitssystem-am-limit-ld.1855228,https://www.nzz.ch/international/medizinische-not-im-krieg-libanons-gesundheitssystem-am-limit-ld.1855228,0,www.nzz.ch,Es mangelt an allem – nur nicht an Problemen: Libanons Gesundheitssystem droht im Krieg der Zusammenbruch,Schon vor dem Waffengang zwischen Israel und dem Hizbullah wurden die Krankenhäuser in Libanon heruntergewirtschaftet. Das rächt sich jetzt: Bombenangriffe und Überlastung bringen das System an den Rand des Kollapses.,"https://img.nzz.ch/2024/11/01/8e7e2ad3-c0de-42be-8866-2cfa6bcebfe0.jpeg?width=1200&height=675&fit=bounds&quality=75&auto=webp&crop=6000,3375,x0,y625&wmark=nzz",2024-11-05T10:00:00Z,http://archive.md/20241105203510/https://www.nzz.ch/international/medizinische-not-im-krieg-libanons-gesundheitssystem-am-limit-ld.1855228,"Der Krankenpfleger Ali Saleh arbeitet in der Notaufnahme des Rafik-Hariri-Krankenhauses in Beirut.
Bassel Abdallah eilt durch die Gänge des Spitals von Rayak. Um seinen Hals baumelt ein goldenes Ste… [+7065 chars]",,de,'Flucht'
https://www.stern.de/gesellschaft/regional/bayern/schleuser-prozess--15-jahre-haft-in-prozess-um-toedliche-schleuserfahrt-35200152.html,https://www.stern.de/gesellschaft/regional/bayern/schleuser-prozess--15-jahre-haft-in-prozess-um-toedliche-schleuserfahrt-35200152.html,0,www.stern.de,Schleuser-Prozess: 15 Jahre Haft in Prozess um tödliche Schleuserfahrt,Auf der Flucht vor der Polizei verunglückt ein Schleuserauto. Sieben Migranten sterben. Jetzt ist der Prozess gegen den Fahrer zu Ende gegangen. Die entscheidende Frage für das Gericht: War es Mord?,https://image.stern.de/35200186/t/T6/v1/w1440/r1.7778/-/05--ryk3iivi5cv1axw800h600jpeg---107c623ff165c916.jpg,2024-11-05T10:13:17Z,,"Kopiere den aktuellen Link
Auf der Flucht vor der Polizei verunglückt ein Schleuserauto. Sieben Migranten sterben. Jetzt ist der Prozess gegen den Fahrer zu Ende gegangen. Die entscheidende Frage fü… [+1711 chars]",,de,'Flucht'
https://www.stern.de/familie/garten-noch-nicht-winterfest--so-schuetzen-sie-pflanzen-und-moebel-35200196.html,https://www.stern.de/familie/garten-noch-nicht-winterfest--so-schuetzen-sie-pflanzen-und-moebel-35200196.html,0,www.stern.de,"Kalte Jahreszeit: Den Garten winterfest machen: So überdauern Ihre Pflanzen Frost, Eis und Schnee","Nicht nur Pflanzen, auch Gartenmöbel leiden im Winter. Wenn Sie im Frühjahr keine bösen Überraschungen erleben wollen, sollten Sie Ihren Garten winterfest machen.",https://image.stern.de/9021216/t/qY/v3/w1440/r1.7778/-/garten-winterfest-machen-neu.jpg,2024-11-05T10:25:00Z,,"Kopiere den aktuellen Link
Nicht nur Pflanzen, auch Gartenmöbel leiden im Winter. Wenn Sie im Frühjahr keine bösen Überraschungen erleben wollen, sollten Sie Ihren Garten winterfest machen.
Auch we… [+7232 chars]",,de,'Schnee'
https://www.zeit.de/news/2024-11/05/sonderkommission-prueft-hinweise-nach-explosion-in-wetzlar,https://www.zeit.de/news/2024-11/05/sonderkommission-prueft-hinweise-nach-explosion-in-wetzlar,0,www.zeit.de,Kriminalität: Sonderkommission prüft Hinweise nach Explosion in Wetzlar,Hier finden Sie Informationen zu dem Thema „Kriminalität“. Lesen Sie jetzt „Sonderkommission prüft Hinweise nach Explosion in Wetzlar“.,https://img.zeit.de/news/2024-11/05/sonderkommission-prueft-hinweise-nach-explosion-in-wetzlar-image-group/wide__1300x731,2024-11-05T10:32:35Z,,Gut zwei Wochen nach der Explosion eines Pakets vor einem Café in Wetzlar prüft die eigens eingerichtete Sonderkommission der Polizei Zeugenhinweise zu dem Vorfall. Bislang sei eine einstellige Zahl … [+846 chars],,de,'Explosion'
https://www.welt.de/vermischtes/article254354976/Kriminalitaet-Zwei-Maenner-in-Berlin-angeschossen-maskierte-Maenner-mit-Waffen-auf-der-Flucht.html,https://www.welt.de/vermischtes/article254354976/Kriminalitaet-Zwei-Maenner-in-Berlin-angeschossen-maskierte-Maenner-mit-Waffen-auf-der-Flucht.html,0,www.welt.de,Zwei Männer in Berlin angeschossen – maskierte Männer mit Waffen auf der Flucht,"Mehrere maskierte Männer mit Waffen steigen aus einem Auto im Stadtzentrum, wenig später verletzt eine Kugel einen 37-Jährigen. Nur Minuten später wird ein anderer Mann angeschossen – ein Bekannter setzt ihn in ein Taxi zum Krankenhaus. Die Täter sind auf der…",https://img.welt.de/img/regionales/hessen/mobile254355050/5817938917-ci16x9-w1200/Polizei-Symbolbild.jpg,2024-11-05T10:38:00Z,,Zwei Männer sind in Berlin kurz hintereinander an zwei verschiedenen Orten angeschossen und schwer verletzt worden. Mindestens in einem der beiden Fälle von Montagabend waren die Täter fünf maskierte… [+1391 chars],,de,'Flucht'
https://www.faz.net/aktuell/rhein-main/region-und-hessen/sonderkommission-prueft-hinweise-nach-explosion-in-wetzlar-110090692.html,https://www.faz.net/aktuell/rhein-main/region-und-hessen/sonderkommission-prueft-hinweise-nach-explosion-in-wetzlar-110090692.html,0,www.faz.net,Explosion in Wetzlar: Sonderkommission der Polizei prüft Hinweise,Eine Explosion vor einem Café hatte vor gut zwei Wochen zahlreiche Menschen in Wetzlar aufgeschreckt. Die Polizei prüft Zeugenhinweise.,https://media1.faz.net/ppmedia/aktuell/rhein-main/region-und-hessen/2889775328/1.10060761/facebook_teaser/die-polizei-hat-das-cafe-vor.jpg,2024-11-05T10:48:19Z,,Der Brand- oder Sprengsatz war am frühen Morgen des 20. Oktober vor dem Café in der Bahnhofstraße von Wetzlar im Lahn-Dill-Kreis explodiert. Wenige Momente zuvor hatte nach Polizeiangaben ein Mann ei… [+390 chars],,de,'Explosion'
https://www.stern.de/politik/deutschland/hoehere-kosten--pflegebeitrag-koennte-2025-erneut-steigen-35200390.html,https://www.stern.de/politik/deutschland/hoehere-kosten--pflegebeitrag-koennte-2025-erneut-steigen-35200390.html,0,www.stern.de,Höhere Kosten: Pflegebeitrag könnte 2025 erneut steigen,Berlin - Angesichts steigender Kosten für die Pflege kommen im neuen Jahr möglicherweise erneut höhere Beiträge auf die Versicherten zu. In der,https://image.stern.de/35200392/t/Fk/v1/w1440/r1.7778/-/05--vwai4omjvwv13axw800h600jpeg---a442bd43fb1b13ac.jpg,2024-11-05T11:24:26Z,,"Kopiere den aktuellen Link
Immer mehr Menschen sind auf Pflege angewiesen. Wie können wachsende Ausgaben dafür gestemmt werden? Die Regierung arbeitet an einem Konzept.
Angesichts steigender Kosten… [+4422 chars]",,de,'Explosion'
https://www.tagesspiegel.de/politik/hohere-kosten-pflegebeitrag-konnte-2025-erneut-steigen-12648353.html,https://www.tagesspiegel.de/politik/hohere-kosten-pflegebeitrag-konnte-2025-erneut-steigen-12648353.html,0,www.tagesspiegel.de,Höhere Kosten: Pflegebeitrag könnte 2025 erneut steigen,Immer mehr Menschen sind auf Pflege angewiesen. Wie können wachsende Ausgaben dafür gestemmt werden? Die Regierung arbeitet an einem Konzept.,https://www.tagesspiegel.de/images/12648350/alternates/BASE_16_9_W1400/1730805939000/pflegerin-und-patientin-symbolbild.jpeg,2024-11-05T11:25:40Z,,"Angesichts steigender Kosten für die Pflege kommen im neuen Jahr möglicherweise erneut höhere Beiträge auf die Versicherten zu. In der Bundesregierung wird über eine mögliche Erhöhung um 0,15 Punkte … [+4343 chars]",,de,'Explosion'
https://www.stern.de/wirtschaft/kuerzungen-bei-vw--was-verdienen-mitarbeiter-bei-volkswagen--35200602.html,https://www.stern.de/wirtschaft/kuerzungen-bei-vw--was-verdienen-mitarbeiter-bei-volkswagen--35200602.html,0,www.stern.de,Gehaltscheck: Wie viel Geld verdienen VW-Mitarbeiter?,"Das VW-Management will in der aktuellen Krise des Autobauers die Gehälter um mehr als zehn Prozent kürzen, um die Kosten zu drücken. Aber was verdienen Volkswagen-Beschäftigte aktuell?",https://image.stern.de/35200670/t/0a/v1/w1440/r1.7778/-/vw-fliessband.jpg,2024-11-05T13:20:00Z,,"Kopiere den aktuellen Link
Das VW-Management will in der aktuellen Krise des Autobauers die Gehälter um mehr als zehn Prozent kürzen, um die Kosten zu drücken. Aber was verdienen Volkswagen-Beschäft… [+4438 chars]",,de,'Kosten'
https://www.focus.de/panorama/renter-hortet-riesiges-waffenarsenal-in-selbstgebauten-geheimverstecken_889348cb-739b-44b7-8715-3729972d534b.html,https://www.focus.de/panorama/renter-hortet-riesiges-waffenarsenal-in-selbstgebauten-geheimverstecken_889348cb-739b-44b7-8715-3729972d534b.html,0,www.focus.de,In Bayern - Rentner hortet riesiges Waffenarsenal in selbstgebauten Geheimverstecken,Ein 70-jähriger Rentner hortete in seinem Anwesen zahlreiche Waffen und Munition. Bei einer Durchsuchung stießen die Zollfahnder auf ein regelrechtes Waffenlager.,https://quadro.burda-forward.de/ctf/69fbed0f-2042-494c-8f56-2ee69c9f34e0.40a0ed64-61e9-4e37-8ab4-c746fdbe5c48.jpg?im=RegionOfInterestCrop%3D%281200%2C630%29%2CregionOfInterest%3D%28986%2C715%29&hash=64cbeff93c8889df15783bf346b2a347c58cc3e5bd9e138b5a391264f5aace00,2024-11-05T15:29:00Z,,Ein 70-jähriger Rentner aus dem Landkreis Wunsiedel hortete in seinem Anwesen zahlreiche Waffen und Munition. Bei einer Durchsuchung am 23. September stießen die Zollfahnder auf ein regelrechtes Waff… [+2852 chars],,de,'Waffen'
https://www.n-tv.de/politik/10-45-Berichte-Ukraine-greift-erstmals-Dagestan-an-Drohne-trifft-Marinestuetzpunkt--article23143824.html,https://www.n-tv.de/politik/10-45-Berichte-Ukraine-greift-erstmals-Dagestan-an-Drohne-trifft-Marinestuetzpunkt--article23143824.html,0,www.n-tv.de,Ukraine-Krieg im Liveticker: +++ 10:45 Berichte: Ukraine greift erstmals Dagestan an - Drohne trifft Marinestützpunkt +++,Lesen Sie alle aktuellen Entwicklungen und Nachrichten über den russischen Angriffskrieg auf die Ukraine im Liveticker von ntv.de.,https://bilder3.n-tv.de/img/incoming/crop25117070/4231326595-cImg_16_9-w1200/Ukraine-Liveticker.jpg,2024-11-05T23:19:00Z,,"Berichten zufolge zufolge haben die ukrainischen Streitkräfte die nordkaukasische Republik Dagestan mit Drohnen angegriffen. Demnach war es der erste Angriff auf die Region, die rund 1000 Kilometer h… [+13201 chars]",,de,'Ukraine'
https://www.n-tv.de/politik/11-46-Russland-meldet-Einnahme-von-zwei-weiteren-Orten--article23143824.html,https://www.n-tv.de/politik/11-46-Russland-meldet-Einnahme-von-zwei-weiteren-Orten--article23143824.html,0,www.n-tv.de,Ukraine-Krieg im Liveticker: +++ 11:46 Russland meldet Einnahme von zwei weiteren Orten +++,Lesen Sie alle aktuellen Entwicklungen und Nachrichten über den russischen Angriffskrieg auf die Ukraine im Liveticker von ntv.de.,https://bilder3.n-tv.de/img/incoming/crop25117070/4231326595-cImg_16_9-w1200/Ukraine-Liveticker.jpg,2024-11-05T23:19:00Z,http://archive.md/20241106110748/https://www.n-tv.de/politik/11-46-Russland-meldet-Einnahme-von-zwei-weiteren-Orten--article23143824.html,"Die russischen Truppen haben nach Angaben der Regierung in Moskau zwei weitere Siedlungen unter ihre Kontrolle gebracht. Es handele sich um die Orte Maksymiwka und Antoniwka, teilt das Verteidigungsm… [+14321 chars]",,de,'Russland'
https://www.faz.net/aktuell/politik/ausland/litauen-festnahmen-wegen-brennender-pakete-110092445.html,https://www.faz.net/aktuell/politik/ausland/litauen-festnahmen-wegen-brennender-pakete-110092445.html,0,www.faz.net,Litauen: Festnahmen wegen brennender Pakete,"Pakete, die in Deutschland oder Großbritannien in Flammen aufgingen, wurden in Litauen abgeschickt. Dort melden die Ermittler nun Festnahmen. Spuren führen nach Russland.",https://media1.faz.net/ppmedia/aktuell/politik/2207141513/1.10092451/facebook_teaser/ein-paket-liegt-bei-dhl-am.jpg,2024-11-06T00:51:21Z,,"Ein nationaler Sicherheitsberater des baltischen Landes machte Russland für die Vorfälle verantwortlich.
Die Ermittlungen seien ziemlich intensiv, sagte die Generalstaatsanwältin Nida Grunskiene vor… [+1890 chars]",,de,'Russland'
https://www.faz.net/aktuell/politik/ukraine/ukraine-liveticker-nordkoreaner-sollen-erstmals-in-kaempfe-eingegriffen-haben-faz-19030454.html,https://www.faz.net/aktuell/politik/ukraine/ukraine-liveticker-nordkoreaner-sollen-erstmals-in-kaempfe-eingegriffen-haben-faz-19030454.html,0,www.faz.net,Ukraine-Liveblog: Nordkoreaner sollen erstmals in Kämpfe eingegriffen haben,Baerbock kritisiert Nordkoreas Unterstützung für Russland +++ Außenministerin bekräftigt in Kiew Unterstützung +++ Zahlreiche russische Angriffe an Fronten der Ukraine +++ alle Entwicklungen im Liveblog,https://media1.faz.net/ppmedia/aktuell/politik/4094998882/1.10092463/facebook_teaser/in-einem-von-der-ukraine.jpg,2024-11-06T01:17:18Z,,"Baerbock fügte mit Blick auf die Präsenz nordkoreanischer Soldaten an: Daher ist es so essentiell, dass wir das nicht nur auf Schärfste verurteilen (...), sondern dass wir, solange (Russlands Präside… [+751 chars]",,de,'Russland'
https://www.zeit.de/news/2024-11/06/ukraine-verlangt-harte-reaktion-auf-nordkoreas-kriegshilfe,https://www.zeit.de/news/2024-11/06/ukraine-verlangt-harte-reaktion-auf-nordkoreas-kriegshilfe,0,www.zeit.de,Die Lage im Überblick: Ukraine verlangt harte Reaktion auf Nordkoreas Kriegshilfe,Hier finden Sie Informationen zu dem Thema „Die Lage im Überblick“. Lesen Sie jetzt „Ukraine verlangt harte Reaktion auf Nordkoreas Kriegshilfe“.,https://img.zeit.de/news/2024-11/06/ukraine-verlangt-harte-reaktion-auf-nordkoreas-kriegshilfe-image-group/wide__1300x731,2024-11-06T04:00:38Z,,Die ukrainische Regierung hält den Einsatz nordkoreanischer Soldaten in Russlands Angriffskrieg gegen ihr Land für erwiesen und fordert eine harte Reaktion der Weltgemeinschaft. Verteidigungsminister… [+5543 chars],,de,'Ukraine'
https://www.fitforfun.de/news/trockene-haende-5-hausmittel-machen-sie-wieder-weich-464651.html,https://www.fitforfun.de/news/trockene-haende-5-hausmittel-machen-sie-wieder-weich-464651.html,0,www.fitforfun.de,Trockene Hände: 5 Hausmittel machen sie wieder weich,"Kälte, trockene Heizungsluft oder häufiges Händewaschen machen die Hände oft rissig. Diese Hausmittel pflegen deine Hände jetzt.","https://www.fitforfun.de/files/images/202210/1/herbst-und-winter-einfache-hausmittel-helfen-bei-trockenen-haenden-1215997407,533121_3x2_n.jpg",2024-11-06T07:40:00Z,,Handcreme hat vor allem jetzt während der kalten Jahreszeit wieder Hochsaison. Kein Wunder: Die Luft in den Räumen wird trockener und wir versuchen uns die klassischen Erkältungsbakterien oder Krankh… [+574 chars],,de,'Kälte'
https://www.faz.net/aktuell/politik/ausland/wegen-russland-schweden-stoppt-windparks-in-der-ostsee-110091616.html,https://www.faz.net/aktuell/politik/ausland/wegen-russland-schweden-stoppt-windparks-in-der-ostsee-110091616.html,0,www.faz.net,Wegen Russland: Schweden stoppt Windparks in der Ostsee,Große Windparks in der Ostsee sind aus Sicht der schwedischen Regierung angesichts der russischen Bedrohung zu gefährlich. Die Atomkraft will das Land hingegen ausbauen. Aber auch dagegen gibt es Sicherheitsbedenken.,https://media1.faz.net/ppmedia/aktuell/1305171637/1.10091609/facebook_teaser_fplus/windraeder-in-burgsvik-auf-der.jpg,2024-11-06T09:20:09Z,http://archive.md/20241107051304/https://www.faz.net/aktuell/politik/ausland/wegen-russland-schweden-stoppt-windparks-in-der-ostsee-110091616.html,"Schwedens Streitkräfte warnten schon länger, dass die vielen geplanten Windkraftprojekte vor der Küste die Sicherheit gefährdeten. Aber das Militär warnt derzeit vor vielem. Wirklich ernst nahm das i… [+426 chars]",,de,'Russland'
https://www.zeit.de/politik/ausland/2024-11/russland-oberhaus-beistandspakt-nordkorea,https://www.zeit.de/politik/ausland/2024-11/russland-oberhaus-beistandspakt-nordkorea,0,www.zeit.de,Krieg in der Ukraine: Russland stimmt für militärischen Pakt mit Nordkorea,Der russische Föderationsrat hat einem Verteidigungsabkommen mit Nordkorea zugestimmt. Beide Länder wollen sich im Falle eines Angriffs militärische Hilfe leisten.,https://img.zeit.de/administratives/sharing/fallback-image/wide__1300x731,2024-11-06T09:46:08Z,,Das russische Oberhaus hat einstimmig einen militärischen Beistandspakt mit Nordkorea ratifiziert. Das Verteidigungsabkommen beider Nationen hatte der russische Präsident Wladimir Putin im Juni bei e… [+614 chars],,de,'Ukraine'
https://www.zeit.de/2024/47/zweite-amtszeit-donald-trump-wahlsieg-aussenpolitik,https://www.zeit.de/2024/47/zweite-amtszeit-donald-trump-wahlsieg-aussenpolitik,0,www.zeit.de,"Zweite Amtszeit von Donald Trump: Jetzt kann er machen, was er will","Trump wird wieder Präsident – und seine Partei gewinnt wohl beide Kammern des Parlaments. Ukraine, Israel, China: Sein Comeback wird außenpolitisch alles verändern.",https://img.zeit.de/politik/ausland/2024-11/donald-trump-aussenpolitik-wahlsieg-china-ukraine/wide__1300x731,2024-11-06T11:30:47Z,http://archive.md/20241106113237/https://www.zeit.de/2024/47/zweite-amtszeit-donald-trump-wahlsieg-aussenpolitik,"Am Mittwochmorgen hat sich die Karte weitgehend rot gefärbt. Für Kamala Harris sieht es schlecht aus. Donald Trump schneidet in Staaten, die er 2020 gewonnen hatte, dieses Mal noch besser ab. In den … [+937 chars]",,de,'Ukraine'
https://www.welt.de/vermischtes/article254387106/Drei-Leichen-in-Berlin-entdeckt-Verdaechtiger-auf-der-Flucht-festgenommen.html,https://www.welt.de/vermischtes/article254387106/Drei-Leichen-in-Berlin-entdeckt-Verdaechtiger-auf-der-Flucht-festgenommen.html,0,www.welt.de,Drei Leichen in Berlin entdeckt – Verdächtiger auf der Flucht festgenommen,Die Polizei hat am Wochenende in Berlin-Marzahn eine Frau und ihre beiden kleinen Töchter tot in einer Wohnung entdeckt. Nun wurde der Tatverdächtige in Baden-Württemberg gestellt. Der 42-Jährige befand sich auf der Flucht.,https://img.welt.de/img/vermischtes/mobile254387804/8097930087-ci16x9-w1200/Toetungsdelikt-in-Berlin-Marzahn.jpg,2024-11-06T13:59:00Z,,Die Polizei hat am Wochenende in Berlin-Marzahn eine Frau und ihre beiden kleinen Töchter tot in einer Wohnung entdeckt. Nun wurde der Tatverdächtige in Baden-Württemberg gestellt. Der 42-Jährige bef… [+1269 chars],,de,'Flucht'
