index,url,valid,domain,title,description,image,published,archive,content,quote,language,keyword
https://www.n-tv.de/politik/06-47-Wagner-Deserteur-Tut-mir-leid-dass-ich-in-der-Ukraine-gekaempft-habe--article23143824.html,https://www.n-tv.de/politik/06-47-Wagner-Deserteur-Tut-mir-leid-dass-ich-in-der-Ukraine-gekaempft-habe--article23143824.html,0,www.n-tv.de,"Ukraine-Krieg im Liveticker: +++ 06:47 Wagner-Deserteur: ""Tut mir leid, dass ich in der Ukraine gekämpft habe +++","Berlin, Washington, Br\u00fcssel - \u00fcberall. n-tv berichtet von allen wichtigen Schaupl\u00e4tzen der Innen- und Au\u00dfenpolitik.",https://bilder2.n-tv.de/img/incoming/crop23332537/9041326157-cImg_16_9-w1200/Liveticker1-grau-1-Kopie.jpg,2023-02-02T00:22:00Z,https://web.archive.org/web/20230202055533/https://www.n-tv.de/politik/06-47-Wagner-Deserteur-Tut-mir-leid-dass-ich-in-der-Ukraine-gekaempft-habe--article23143824.html,"Der ehemaliger Kommandeur der russischen Söldnertruppe Wagner, der nach Norwegen geflohen ist, entschuldigt sich für die Kämpfe in der Ukraine. ""Viele halten mich für einen Schurken, einen Kriminelle… [+11255 chars]",,de,'Heizen'
https://www.n-tv.de/politik/13-39-Zerstoerte-Krim-Bruecke-angeblich-fast-vollstaendig-repariert--article23143824.html,https://www.n-tv.de/politik/13-39-Zerstoerte-Krim-Bruecke-angeblich-fast-vollstaendig-repariert--article23143824.html,0,www.n-tv.de,Ukraine-Krieg im Liveticker: +++ 13:39 Zerstörte Krim-Brücke angeblich fast vollständig repariert +++,"Berlin, Washington, Br\u00fcssel - \u00fcberall. n-tv berichtet von allen wichtigen Schaupl\u00e4tzen der Innen- und Au\u00dfenpolitik.",https://bilder2.n-tv.de/img/incoming/crop23332537/9041326157-cImg_16_9-w1200/Liveticker1-grau-1-Kopie.jpg,2023-02-02T00:22:00Z,https://web.archive.org/web/20230202125545/https://www.n-tv.de/politik/13-39-Zerstoerte-Krim-Bruecke-angeblich-fast-vollstaendig-repariert--article23143824.html,"Anfang Oktober letzten Jahres ereignet sich auf der Brücke, welche die Halbinsel Krim mit dem russischen Festland verbindet, eine schwere Explosion. Zwei der vier Fahrspuren stürzen dabei auf einer L… [+20634 chars]",,de,'Heizen'
https://www.n-tv.de/politik/14-03-Heusgen-Putin-guckt-sehr-ueberrascht-nach-Deutschland--article23143824.html,https://www.n-tv.de/politik/14-03-Heusgen-Putin-guckt-sehr-ueberrascht-nach-Deutschland--article23143824.html,0,www.n-tv.de,"Ukraine-Krieg im Liveticker: +++ 14:03 Heusgen: Putin ""guckt sehr überrascht"" nach Deutschland +++","Berlin, Washington, Br\u00fcssel - \u00fcberall. n-tv berichtet von allen wichtigen Schaupl\u00e4tzen der Innen- und Au\u00dfenpolitik.",https://bilder2.n-tv.de/img/incoming/crop23332537/9041326157-cImg_16_9-w1200/Liveticker1-grau-1-Kopie.jpg,2023-02-02T00:22:00Z,https://web.archive.org/web/20230202133051/https://www.n-tv.de/politik/14-03-Heusgen-Putin-guckt-sehr-ueberrascht-nach-Deutschland--article23143824.html,"Putin setzt im Ukraine-Krieg laut dem Leiter der Münchener Sicherheitskonferenz, Christoph Heusgen, auf Russlands langen Atem. Doch der Kreml-Chef begehe einen Fehler nach dem anderen und blicke unte… [+20970 chars]",,de,'Putin'
https://www.n-tv.de/politik/09-46-Russland-zeigt-jetzt-viele-Merkmale-einer-Diktatur--article23143824.html,https://www.n-tv.de/politik/09-46-Russland-zeigt-jetzt-viele-Merkmale-einer-Diktatur--article23143824.html,0,www.n-tv.de,"Ukraine-Krieg im Liveticker: +++ 09:46 Russland zeigt jetzt ""viele Merkmale einer Diktatur"" +++","Berlin, Washington, Br\u00fcssel - \u00fcberall. n-tv berichtet von allen wichtigen Schaupl\u00e4tzen der Innen- und Au\u00dfenpolitik.",https://bilder2.n-tv.de/img/incoming/crop23332537/9041326157-cImg_16_9-w1200/Liveticker1-grau-1-Kopie.jpg,2023-02-02T00:22:00Z,https://web.archive.org/web/20230202085858/https://www.n-tv.de/politik/09-46-Russland-zeigt-jetzt-viele-Merkmale-einer-Diktatur--article23143824.html,"Russland nimmt einer Studie des britischen Analyseunternehmens Economist Intelligence Unit zufolge zunehmend die Züge einer Diktatur an. ""Russland hat sich schon seit langem von der Demokratie entfer… [+16268 chars]",,de,'Ukraine'
https://www.n-tv.de/politik/02-03-Tote-und-Verletzte-bei-Raketenangriff-auf-Wohnhaus-in-Kramatorsk--article23143824.html,https://www.n-tv.de/politik/02-03-Tote-und-Verletzte-bei-Raketenangriff-auf-Wohnhaus-in-Kramatorsk--article23143824.html,0,www.n-tv.de,Ukraine-Krieg im Liveticker: +++ 02:03 Tote und Verletzte bei Raketenangriff auf Wohnhaus in Kramatorsk +++,"Berlin, Washington, Br\u00fcssel - \u00fcberall. n-tv berichtet von allen wichtigen Schaupl\u00e4tzen der Innen- und Au\u00dfenpolitik.",https://bilder2.n-tv.de/img/incoming/crop23332537/9041326157-cImg_16_9-w1200/Liveticker1-grau-1-Kopie.jpg,2023-02-02T00:22:00Z,https://web.archive.org/web/20230202051357/https://www.n-tv.de/politik/02-03-Tote-und-Verletzte-bei-Raketenangriff-auf-Wohnhaus-in-Kramatorsk--article23143824.html,"Beim Einschlag einer Rakete in einem Wohnhaus der Stadt Kramatorsk im Osten der Ukraine sind nach Angaben der Behörden mindestens zwei Menschen getötet und sieben verletzt worden. ""Ein weiterer Terro… [+6443 chars]",,de,'Heizen'
https://www.n-tv.de/politik/07-16-Zielgenaue-Angriffe-US-Firma-raeumt-Kriegsbeteiligung-ein--article23143824.html,https://www.n-tv.de/politik/07-16-Zielgenaue-Angriffe-US-Firma-raeumt-Kriegsbeteiligung-ein--article23143824.html,0,www.n-tv.de,Ukraine-Krieg im Liveticker: +++ 07:16 Zielgenaue Angriffe - US-Firma räumt Kriegsbeteiligung ein +++,"Berlin, Washington, Br\u00fcssel - \u00fcberall. n-tv berichtet von allen wichtigen Schaupl\u00e4tzen der Innen- und Au\u00dfenpolitik.",https://bilder2.n-tv.de/img/incoming/crop23332537/9041326157-cImg_16_9-w1200/Liveticker1-grau-1-Kopie.jpg,2023-02-02T00:22:00Z,,"Die US-Datenanalysefirma Palantir räumt erstmals eine umfassende Beteiligung an den Kriegsanstrengungen der Ukraine ein. Nach den Worten von Firmenchef Alex Karp ist das US-Unternehmen ""für den größt… [+12162 chars]",,de,'Ukraine'
https://www.apfelpage.de/news/homekit-deals-mit-tado-bis-zu-32-lassen-sich-sparen/,https://www.apfelpage.de/news/homekit-deals-mit-tado-bis-zu-32-lassen-sich-sparen/,0,www.apfelpage.de,HomeKit-Deals mit Tado: Bis zu 32% lassen sich sparen,"Der Winter hat hierzulande dann doch noch einmal Einzug gehalten und angesichts der Preise für Energie ist cleveres und smartes Heizen eine Option, die man sich anschauen sollte. Und mit tado° gibt es die […]",https://www.apfelpage.de/wp-content/uploads/2021/02/2.jpg,2023-02-02T05:31:42Z,,"Der Winter hat hierzulande dann doch noch einmal Einzug gehalten und angesichts der Preise für Energie ist cleveres und smartes Heizen eine Option, die man sich anschauen sollte. Und mit tado° gibt e… [+982 chars]",,de,'Heizen'
https://www.nzz.ch/feuilleton/macron-traegt-ihn-und-putin-der-rollkragenpullover-ist-ueberall-ld.1723980,https://www.nzz.ch/feuilleton/macron-traegt-ihn-und-putin-der-rollkragenpullover-ist-ueberall-ld.1723980,0,www.nzz.ch,"Der Rollkragenpullover ist plötzlich überall, er ist die Uniform der Krise","Die französische Regierung trägt ihn, um Energie zu sparen. Wladimir Putin für seine Propaganda-Show. Der Rollkragenpullover ist wie eine Rüstung: Der Kopf sitzt auf einem Sockel.","https://img.nzz.ch/2023/02/01/98505483-69d2-4b27-9467-6ad39552af4e.jpeg?width=1200&height=674&fit=bound&quality=75&auto=webp&crop=2445,1374,x0,y919&wmark=nzz",2023-02-02T05:45:04Z,http://archive.md/20230203144249/https://www.nzz.ch/feuilleton/macron-traegt-ihn-und-putin-der-rollkragenpullover-ist-ueberall-ld.1723980,"Der Mensch im Rollkragenpullover ist vor allem Gesicht. Der irische Schriftsteller Samuel Beckett, 1966 in Paris. 
Der Rollkragenpullover war ein Geschenk von Grossmüttern und Grosstanten. Er kam zu… [+7814 chars]",,de,'Heizen'
https://www.zeit.de/politik/ausland/2023-02/krieg-russland-ukraine-demokratie-index-diktatur,https://www.zeit.de/politik/ausland/2023-02/krieg-russland-ukraine-demokratie-index-diktatur,0,www.zeit.de,Krieg gegen die Ukraine: Russland stürzt in Demokratieindex ab,"Nirgendwo ist die Demokratie 2022 so stark zurückgedrängt worden wie in Russland. Der Krieg beschleunige die Entwicklung hin zu einer Diktatur, heißt es in einem Bericht.",,2023-02-02T06:55:01Z,https://web.archive.org/web/20230202072201/https://www.zeit.de/politik/ausland/2023-02/krieg-russland-ukraine-demokratie-index-diktatur,"When browsing with ads:
We collect personal data and also transmit it to third-party providers
 that help us improve and finance our digital content. Some of the information stored on your device, … [+732 chars]",,de,'Russland'
https://www.handelsblatt.com/finanzen/immobilien/heizen-mit-holz-ist-pelletheizung-fuer-ihre-immobilie-geeignet/28788638.html,https://www.handelsblatt.com/finanzen/immobilien/heizen-mit-holz-ist-pelletheizung-fuer-ihre-immobilie-geeignet/28788638.html,0,www.handelsblatt.com,Heizen mit Holz: Ist Pelletheizung für Ihre Immobilie geeignet?,"Das Heizen mit Holzpellets ist in den vergangenen Monaten attraktiver geworden. Ein Überblick, für wen sich eine Pelletheizung wirklich lohnt und was Immobilienbesitzer dringend beachten sollten.",https://www.handelsblatt.com/images/heizen-mit-holzpellets/28788736/2-format2003.jpg,2023-02-02T06:58:01Z,,"Heizen mit HolzpelletsHolzpellets zum Heizen werden immer beliebter. Aber für wen lohnt sich eine Pelletheizung wirklich?
(Foto: AP) 
Düsseldorf Bei der Suche nach der passenden Heizung für die eig… [+1182 chars]",,de,'Heizen'
https://www.bild.de/regional/hamburg/hamburg-aktuell/taeter-auf-der-flucht-geld-streit-endet-mit-messerattacke-82762602.bild.html,https://www.bild.de/regional/hamburg/hamburg-aktuell/taeter-auf-der-flucht-geld-streit-endet-mit-messerattacke-82762602.bild.html,0,www.bild.de,Täter auf der Flucht - Geld-Streit endet mit Messerattacke,"Erst stritten sie um Geld, dann stach einer zu. Messerattacke in Hamburg-Harburg!Foto: Lenthe-Medien","https://images.bild.de/63db60e8f3c67d107989a402/f967b05e85d99c65d04f6fde915a6c0a,b9d040ab?w=1280",2023-02-02T07:53:09Z,,"Hamburg - Erst stritten sie um Geld, dann stach einer zu.
In Hamburg-Harburg ist es zu einer gefährlichen Messerattacke gekommen.
Zwei Männer hatten sich am Mittwochnachmittag in die Haare gekriegt… [+484 chars]",,de,'Flucht'
https://taz.de/-Nachrichten-im-Ukrainekrieg-/!5913234/,https://taz.de/-Nachrichten-im-Ukrainekrieg-/!5913234/,0,taz.de,+++ Nachrichten im Ukrainekrieg +++: Tote nach Raketeneinschlag,70 ukrainische Soldaten trainieren in Deutschland am Flugabwehrraketensystem Patriot. Der Einschlag einer russischen Rakete in Kramatorsk tötet drei Menschen.,https://taz.de/picture/6071278/948/32081050-1.jpeg,2023-02-02T08:24:00Z,,"70 ukrainische Soldaten trainieren in Deutschland am Flugabwehrraketensystem Patriot. Der Einschlag einer russischen Rakete in Kramatorsk tötet drei Menschen.
Nur Trümmer: Ein Wohnhaus im ostukraini… [+6525 chars]",,de,'Ukraine'
https://www.dw.com/de/welche-heizung-ist-die-beste/a-64464340,https://www.dw.com/de/welche-heizung-ist-die-beste/a-64464340,0,www.dw.com,Welche Heizung ist die Beste?,"Heizen mit Erdgas und Öl ist klimaschädlich und teuer. Wie gut sind Wärmepumpe, Holz und Co fürs Klima und den Geldbeutel? Wir checken fünf Alternativen.",https://static.dw.com/image/63000958_6.jpg,2023-02-02T09:01:00Z,,"1. Wärmepumpen erobern die Welt 
Künftig könnten Wärmepumpen mehr als die Hälfte des weltweiten Wärmebedarfs decken, das zeigt ein Szenario der internationalen Energieagentur IEA. Bisher werden dami… [+5195 chars]",,de,'Heizen'
https://www.focus.de/finanzen/news/gaspreisbremse-heizgeschenk-vom-staat-wer-darf-sich-auf-den-1-maerz-freuen_id_184200876.html,https://www.focus.de/finanzen/news/gaspreisbremse-heizgeschenk-vom-staat-wer-darf-sich-auf-den-1-maerz-freuen_id_184200876.html,0,www.focus.de,Gaspreisbremse - Heizgeschenk vom Staat! Wer darf sich auf den 1. März freuen?,"Nun können Millionen Menschen auf Entlastung hoffen. Ab dem 1. März greift die Gaspreisbremse. Heizen wird dann für Millionen Haushalte günstiger. FOCUS online sagt, wer sich freuen darf und wer davon kaum bis gar nicht profitiert.",https://p6.focus.de/img/regional/mecklenburg-vorpommern/id_184035621/die-flamme-eines-gasherdes-brennt-in-einer-kueche..jpg?im=Crop%3D%280%2C170%2C2048%2C1024%29%3BResize%3D%281200%2C627%29&impolicy=perceptual&quality=medium&hash=0b0d97f75e178ea1346443c4409be9e3501d845e68f82ad88a59b18355e83865,2023-02-02T09:26:04Z,,"Nun können Millionen Menschen auf Entlastung hoffen. Ab dem 1. März greift die Gaspreisbremse. Heizen wird dann für Millionen Haushalte günstiger. FOCUS online sagt, wer sich freuen darf und wer davo… [+6438 chars]",,de,'Heizen'
https://www.handelsblatt.com/unternehmen/energie/gasspeicher-in-deutschland-fuellstand-auf-79-prozent-gefallen-/28819652.html,https://www.handelsblatt.com/unternehmen/energie/gasspeicher-in-deutschland-fuellstand-auf-79-prozent-gefallen-/28819652.html,0,www.handelsblatt.com,Gasspeicher in Deutschland: Füllstand auf 79 Prozent gefallen,Ein hoher Gasspeicher-Füllstand ist für Deutschlands Gasversorgung in der Energiekrise essenziell. Wie steht es aktuell um die Gasreserven? Ein Überblick.,https://www.handelsblatt.com/images/gasspeicher-in-sachsen-anhalt/28877480/2-format2003.jpg,2023-02-02T09:50:44Z,,"Gasspeicher in Sachsen-AnhaltDer Gasspeicher-Füllstand in Deutschland ist in der Energiekrise zum wichtigen Faktor geworden.
(Foto: dpa)
Düsseldorf Ein stabiler Füllstand der deutschen Gasspeicher … [+7396 chars]",,de,'Heizen'
https://www.handelsblatt.com/politik/international/paradies-fuer-rentner-in-diesen-neun-laendern-laesst-sich-der-ruhestand-geniessen-/28903558.html,https://www.handelsblatt.com/politik/international/paradies-fuer-rentner-in-diesen-neun-laendern-laesst-sich-der-ruhestand-geniessen-/28903558.html,0,www.handelsblatt.com,Rente im Ausland: Flucht vor der Inflation: In diesen neun Ländern bekommen Rentner viel für ihr Geld,"Immer mehr Rentner ziehen ins Ausland. Sie profitieren von einer deutlich höheren Kaufkraft – und von einer besseren Lebensqualität. Neun  Länder, die sich lohnen.",https://www.handelsblatt.com/images/rente-im-ausland-geniessen/28914698/4-format2003.png,2023-02-02T10:25:58Z,https://web.archive.org/web/20230202123422/https://www.handelsblatt.com/politik/international/paradies-fuer-rentner-in-diesen-neun-laendern-laesst-sich-der-ruhestand-geniessen-/28903558.html,"Rente im Ausland genießenIm Ausland bekommen Rentner meist deutlich mehr für ihr Geld. Auch steuerlich kann sich eine Auswanderung lohnen.
(Foto: Getty Images) 
Zürich, Madrid, Bangkok, Stockholm D… [+1354 chars]",,de,'Flucht'
https://www.nzz.ch/schweiz/der-wandel-zum-skigebiet-ohne-schnee-ld.1723441,https://www.nzz.ch/schweiz/der-wandel-zum-skigebiet-ohne-schnee-ld.1723441,0,www.nzz.ch,Wenn sich der Schnee rarmacht,"Wegen des regelmässigen Schneemangels versucht das Skigebiet Sattel-Hochstuckli schon lange, seine Gäste mit anderen Angeboten auf den Berg zu locken. Mit Erfolg. Doch nicht alle können davon profitieren.","https://img.nzz.ch/2023/01/27/3f258719-dd5a-4d83-83ca-4bb919e8feaa.jpeg?width=1200&height=675&fit=bound&quality=75&auto=webp&crop=5568,3132,x0,y290&wmark=nzz",2023-02-02T10:30:00Z,https://web.archive.org/web/20230202104241/https://www.nzz.ch/schweiz/der-wandel-zum-skigebiet-ohne-schnee-ld.1723441,Über der Bergstation der Gondelbahn in Sattel-Hochstuckli scheint die Sonne. Einzig ein paar kleine Wolken sind an dem sonst blauen Himmel auszumachen. Trotzdem hängt eine neblige Schneewolke über de… [+8626 chars],,de,'Schnee'
https://www.welt.de/politik/ausland/video243560101/Ex-Kommandeur-packt-aus-Wagner-Soeldner-die-nicht-kaempfen-wollen-werden-hingerichtet.html,https://www.welt.de/politik/ausland/video243560101/Ex-Kommandeur-packt-aus-Wagner-Soeldner-die-nicht-kaempfen-wollen-werden-hingerichtet.html,0,www.welt.de,"„Wagner-Söldner, die nicht kämpfen wollten, wurden hingerichtet“","Die meisten der rund 50.000 Wagner-Söldner sind Straftäter, rekrutiert aus russischen Haftanstalten. Ihnen wird Freilassung versprochen. Wer nicht kämpft, wird hingerichtet. Dem Kommandeur Andrej Medwedew gelang die Flucht über Norwegen, verfolgt von Hunden u…",https://img.welt.de/img/politik/ausland/mobile243562415/1551351637-ci16x9-w1200/Bildschirmfoto-2023-02-02-um-11-23-08-png.jpg,2023-02-02T10:51:01Z,http://archive.md/20230202110403/https://www.welt.de/politik/ausland/video243560101/Ex-Kommandeur-packt-aus-Wagner-Soeldner-die-nicht-kaempfen-wollen-werden-hingerichtet.html,"Die WELT als ePaper: Die vollständige Ausgabe steht Ihnen bereits am Vorabend zur Verfügung so sind Sie immer hochaktuell informiert. Weitere Informationen: http://epaper.welt.de 
 Der Kurz-Link die… [+49 chars]",,de,'Flucht'
https://www.zeit.de/news/2023-02/02/zwei-verletzte-bei-unfall-auf-flucht-vor-polizei,https://www.zeit.de/news/2023-02/02/zwei-verletzte-bei-unfall-auf-flucht-vor-polizei,0,www.zeit.de,Mülheim an der Ruhr: Zwei Verletzte bei Unfall auf Flucht vor Polizei,,,2023-02-02T12:00:30Z,,"When browsing with ads:
We collect personal data and also transmit it to third-party providers
 that help us improve and finance our digital content. Some of the information stored on your device, … [+732 chars]",,de,'Flucht'
https://www.stern.de/gesellschaft/regional/nordrhein-westfalen/muelheim-an-der-ruhr--zwei-verletzte-bei-unfall-auf-flucht-vor-polizei-33160512.html,https://www.stern.de/gesellschaft/regional/nordrhein-westfalen/muelheim-an-der-ruhr--zwei-verletzte-bei-unfall-auf-flucht-vor-polizei-33160512.html,0,www.stern.de,Mülheim an der Ruhr: Zwei Verletzte bei Unfall auf Flucht vor Polizei,Auf der Flucht vor einer Polizeikontrolle ist ein mutmaßlich unter Drogeneinfluss stehender Autofahrer in Mülheim an der Ruhr mit einem weiteren Auto kollidiert. Die 42 Jahre alte Fahrerin des zweiten Autos und ihr vier Jahre alter Sohn seien bei dem Zusammen…,https://image.stern.de/33160514/t/JR/v1/w1440/r1.7778/-/02--urnnewsmldpacom2009010123020299450267v2w800h600l1293t859r3879b2583jpeg---2c9fbc35d17c40e1.jpg,2023-02-02T12:00:30Z,,Auf der Flucht vor einer Polizeikontrolle ist ein mutmaßlich unter Drogeneinfluss stehender Autofahrer in Mülheim an der Ruhr mit einem weiteren Auto kollidiert. Die 42 Jahre alte Fahrerin des zweite… [+1136 chars],,de,'Flucht'
https://www.bild.de/news/ausland/news-ausland/mafiaboss-edgardo-greco-nach-16-jahren-flucht-gefasst-82765178.bild.html,https://www.bild.de/news/ausland/news-ausland/mafiaboss-edgardo-greco-nach-16-jahren-flucht-gefasst-82765178.bild.html,0,www.bild.de,Er war wegen Doppelmord verurteilt - Mafiaboss nach 16 Jahren auf der Flucht gefasst,Edgardo Greco war Mafiaboss des Klans 'Ndrangheta und wurde seit 2006 europaweit gesucht. Nun ging er den Fahndern ins Netz.,"https://images.bild.de/63db96d6d603c064b4ea33cd/b7cfa0f2c3cba2722d7b182d23cf9b99,8f2487ad?w=1280",2023-02-02T12:01:11Z,https://web.archive.org/web/20230202151246/https://www.bild.de/news/ausland/news-ausland/mafiaboss-edgardo-greco-nach-16-jahren-flucht-gefasst-82765178.bild.html,"Saint-Étienne Anfang der 1990er-Jahre versetzten Mafia-Clans Italien in Angst und Schrecken. Entführungen, Morde und blutige Attentate gehörten zum Alltag. Einer der mächtigsten Mafiabosse war Edgard… [+2728 chars]",,de,'Flucht'
https://www.stern.de/panorama/polizisten-stellen-fluechtige-automatensprenger---mit-waermebildkamera-33160618.html,https://www.stern.de/panorama/polizisten-stellen-fluechtige-automatensprenger---mit-waermebildkamera-33160618.html,0,www.stern.de,Spektakuläre Festnahme: Polizisten stellen flüchtige Automatensprenger im Wald – mithilfe einer Wärmebildkamera,"Drei Männer hatten im nordrhein-westfälischen Kierspe versucht, einen Geldautomaten zu sprengen. Den Tatverdächtigen gelang die Flucht – bis in einen Wald. Dort konnten sie mithilfe einer Wärmebildkamera aus einem Hubschrauber gestellt werden.",https://image.stern.de/33160650/t/rz/v2/w1440/r1.7778/-/automatensprenger.jpg,2023-02-02T12:50:13Z,,Sehen Sie im Video: Polizisten stellen flüchtige Automatensprenger im Wald  mittels Wärmebildkamera.Hier werden Automatensprenger auf der Flucht mitten im Wald nahe Odenthal im Rheinisch Bergischen K… [+1080 chars],,de,'Flucht'
https://www.n-tv.de/politik/14-52-Russische-Truppe-treffen-Privathaus-in-Komyschany-eine-Frau-stirbt--article23143824.html,https://www.n-tv.de/politik/14-52-Russische-Truppe-treffen-Privathaus-in-Komyschany-eine-Frau-stirbt--article23143824.html,0,www.n-tv.de,Ukraine-Krieg im Liveticker: +++ 14:29 Sunak widerspricht Johnson: Kampfjets für Ukraine keine gute Idee +++ - n-tv NACHRICHTEN,"Berlin, Washington, Br\u00fcssel - \u00fcberall. n-tv berichtet von allen wichtigen Schaupl\u00e4tzen der Innen- und Au\u00dfenpolitik.",https://bilder2.n-tv.de/img/incoming/crop23332537/9041326157-cImg_16_9-w1200/Liveticker1-grau-1-Kopie.jpg,2023-02-02T12:56:15Z,,"Am Morgen beschießen russische Truppen das Dorf Komyschany in der Region Cherson. Dabei wird ein Privathaus getroffen, eine Frau stirbt, wie die regionale Militärverwaltung mitteilt. Später am Tag me… [+22529 chars]",,de,'Ukraine'
https://www.n-tv.de/wirtschaft/EZB-erhoeht-Leitzins-im-Euroraum-auf-3-0-Prozent-article23888561.html,https://www.n-tv.de/wirtschaft/EZB-erhoeht-Leitzins-im-Euroraum-auf-3-0-Prozent-article23888561.html,0,www.n-tv.de,"Kampf gegen hohe Inflation: EZB erhöht Leitzins im Euroraum auf 3,0 Prozent","Die Europäische Zentralbank versucht, mit steigenden Zinsen die hohe Teuerung zu zügeln. Die Notenbank legt zum fünften Mal in Folge nach - und kündigt bereits eine weitere Zinserhöhung an.",https://bilder2.n-tv.de/img/incoming/crop23888569/7761328287-cImg_16_9-w1200/393746078.jpg,2023-02-02T13:16:59Z,,"Die Europäische Zentralbank versucht, mit steigenden Zinsen die hohe Teuerung zu zügeln. Die Notenbank legt zum fünften Mal in Folge nach - und kündigt bereits eine weitere Zinserhöhung an. 
Mit der… [+1212 chars]",,de,'Heizen'
https://www.welt.de/wirtschaft/article243567079/Europaeische-Zentralbank-EZB-erhoeht-Zinsen-im-Euroraum-zum-fuenften-Mal-in-Folge-auf-3-0-Prozent.html,https://www.welt.de/wirtschaft/article243567079/Europaeische-Zentralbank-EZB-erhoeht-Zinsen-im-Euroraum-zum-fuenften-Mal-in-Folge-auf-3-0-Prozent.html,0,www.welt.de,"EZB erhöht Leitzins im Euroraum auf 3,0 Prozent","Mit steigenden Zinsen versucht die EZB, die hohe Teuerung zu zähmen. Die Notenbank legt erneut nach. Für die Sitzung am 16. März ist bereits eine weitere Zinserhöhung in Aussicht gestellt.",https://img.welt.de/img/bildergalerien/mobile243567251/4711355507-ci16x9-w1200/EZB-Ratssitzung-mit-Zinsentscheidung.jpg,2023-02-02T13:17:04Z,http://archive.md/20230202162211/https://www.welt.de/wirtschaft/article243567079/Europaeische-Zentralbank-EZB-erhoeht-Zinsen-im-Euroraum-zum-fuenften-Mal-in-Folge-auf-3-0-Prozent.html,"Mit der fünften Zinserhöhung in Folge stemmen sich die Euro-Währungshüter gegen die nach wie vor hohe Teuerung. Die Europäische Zentralbank (EZB) hebt den Leitzins im Euroraum erneut um 0,50 Prozentp… [+2339 chars]",,de,'Teuer'
https://www.tagesspiegel.de/gesellschaft/panorama/nach-16-jahren-flucht-polizei-fasst-ndrangheta-mafioso-in-frankreich-9283038.html,https://www.tagesspiegel.de/gesellschaft/panorama/nach-16-jahren-flucht-polizei-fasst-ndrangheta-mafioso-in-frankreich-9283038.html,0,www.tagesspiegel.de,Nach 16 Jahren Flucht: Polizei fasst ‘Ndrangheta-Mafioso in Frankreich,"Anfang der 1990er Jahre beteiligte sich Edgardo Greco an einem Mafia-Krieg, wohl auch mit Tötungen. Seit der Verurteilung zu lebenslanger Haft war er flüchtig – bis jetzt.",https://www.tagesspiegel.de/images/jahrelang-fluchtiger-mafioso-edgardo-greco-in-frankreich-gefass/alternates/BASE_16_9_W1400/jahrelang-fluechtiger-mafioso-edgardo-greco-in-frankreich-gefass.jpeg,2023-02-02T13:21:40Z,,Italienische und französische Polizisten haben einen seit mehr als 16 Jahre flüchtigen Mafioso der 'Ndrangheta im Südosten Frankreichs verhaftet. Spezialeinheiten der italienischen Polizei hätten Edg… [+1760 chars],,de,'Flucht'
https://www.zeit.de/news/2023-02/02/gestiegene-kosten-erste-tafeln-erhalten-landesfoerderung,https://www.zeit.de/news/2023-02/02/gestiegene-kosten-erste-tafeln-erhalten-landesfoerderung,0,www.zeit.de,Soziales: Gestiegene Kosten: Erste Tafeln erhalten Landesförderung,,,2023-02-02T13:24:42Z,,"When browsing with ads:
We collect personal data and also transmit it to third-party providers
 that help us improve and finance our digital content. Some of the information stored on your device, … [+732 chars]",,de,'Kosten'
https://www.sueddeutsche.de/muenchen/starnberg/tutzing-container-kloster-ruth-schoeneberger-1.5743982,https://www.sueddeutsche.de/muenchen/starnberg/tutzing-container-kloster-ruth-schoeneberger-1.5743982,0,www.sueddeutsche.de,"Flucht und Migration: ""Wir könnten da auch eine Schickimicki-Wohnanlage hinstellen""","Das Tutzinger Grundstücksroulette für Asylcontainer schien verfahren, da sprangen die Klosterschwestern in die Bresche. Wieso sie das taten, erklärt Priorin Ruth Schöneberger.",https://www.sueddeutsche.de/image/sz.1.5743983/1200x675?v=1675344980,2023-02-02T13:32:07Z,,"Das Tutzinger Grundstücksroulette für Asylcontainer schien verfahren, da sprangen die Klosterschwestern in die Bresche. Wieso sie das taten, erklärt Priorin Ruth Schöneberger.Die Missions-Benediktine… [+3768 chars]",,de,'Flucht'
