index,url,valid,domain,title,description,image,published,archive,content,quote,language,keyword
https://www.stern.de/reise/island-im-winter--tipps-und-tricks-fuer-ihre-reise-33075508.html,https://www.stern.de/reise/island-im-winter--tipps-und-tricks-fuer-ihre-reise-33075508.html,0,www.stern.de,"Eine Reise im Winter: Schnee, Eis, Kälte: So kommen Sie durch die raue Natur Islands – ein Erfahrungsbericht","Eisberge, Geysire, Wasserfälle, Vulkane: Islands Naturschauspiele verdienen einen Oskar. Verständlich also, dass der nordische Inselstaat immer mehr Schaulustige anzieht – so auch unsere stern-Autorin. Sie verrät, wie es dort außerhalb der Hauptsaison zugeht.…",https://image.stern.de/33082304/t/VI/v3/w1440/r1.7778/-/samira-debbeler-island-eisberg.jpg,2023-11-01T14:31:00Z,,Eisige Winde fegten über die von Felsen gerahmten Küstenorte. Es schneite und schneite und schneite. Kein Flieger startete oder landete. Touristen saßen am Flughafen Keflavík fest. Zufahrten waren ge… [+5478 chars],,de,'Schnee'
https://www.stern.de/wirtschaft/fenster-abdichten--so-sparen-sie-waerme-und-energie-9434330.html,https://www.stern.de/wirtschaft/fenster-abdichten--so-sparen-sie-waerme-und-energie-9434330.html,0,www.stern.de,Energie sparen: Fenster abdichten: So bleibt die Kälte draußen – und die Wärme drinnen,"Wenn es draußen kälter wird, startet in vielen Haushalten die Heizsaison. Doch trotz der künstlich erzeugten Wärme kann es in manchen Räumen ziehen, insbesondere in Fensternähe. Spätestens dann sollten Sie der Sache auf den Grund gehen, um Energie zu sparen u…",https://image.stern.de/9434980/t/yj/v3/w1440/r1.7778/-/gummidichtung-neu.jpg,2023-11-01T14:41:00Z,,"Sogenannte Zugluft wird durch undichte Stellen gefördert, die genau dort entstehen, wo unterschiedliche Materialien aufeinandertreffen etwa am Fenster. Da vor allem Holzrahmen das ganze Jahr über arb… [+6401 chars]",,de,'Kälte'
https://www.n-tv.de/politik/Schlacht-um-Awdijiwka-Blick-in-die-Kriegszone-in-der-Ukraine-article24503460.html,https://www.n-tv.de/politik/Schlacht-um-Awdijiwka-Blick-in-die-Kriegszone-in-der-Ukraine-article24503460.html,0,www.n-tv.de,Satellitenbild mit Frontlinie: So greift Russland bei Awdijiwka an,"Schwere Kämpfe im Osten der Ukraine: Seit fast vier Wochen schon greift Russlands Invasionsarmee mit aller Macht bei Awdijiwka an - bisher ohne größere Erfolge. Ein Blick auf die Karte zeigt, an welchen Stellen die russischen Attacken ansetzen.",https://bilder2.n-tv.de/img/incoming/crop24503437/15713253-cImg_16_9-w1200/2023-11-01-LagebeiAwdijiwk-mitFL-enhanced.jpg,2023-11-02T05:46:16Z,,"Schwere Kämpfe im Osten der Ukraine: Seit fast vier Wochen schon greift Russlands Invasionsarmee mit aller Macht bei Awdijiwka an - bisher ohne größere Erfolge. Ein Blick auf die Karte zeigt, an welc… [+4769 chars]",,de,'Ukraine'
https://www.faz.net/aktuell/politik/ausland/die-nacht-in-der-ukraine-ukrainischer-armeechef-warnt-vor-stellungskrieg-19284960.html,https://www.faz.net/aktuell/politik/ausland/die-nacht-in-der-ukraine-ukrainischer-armeechef-warnt-vor-stellungskrieg-19284960.html,0,www.faz.net,Die Nacht in der Ukraine: Ukrainischer Armeechef warnt vor Stellungskrieg,"Ein Stillstand auf dem Schlachtfeld helfe nur Russland, warnt der ukrainische Oberkommandierende und fordert Kampfflugzeuge aus dem Westen. Derweil meldet die Ukraine die Abwehr zahlreicher russischer Angriffe an der Ostfront. Der Überblick.",https://media0.faz.net/ppmedia/aktuell/331830188/1.9282610/facebook_teaser/ukrainische-soldaten-bei-einem.jpg,2023-11-02T05:59:04Z,,Der Bodenkrieg in der Ukraine hat sich festgefahren und das sieht der ukrainische Oberkommandierende Walerij Saluschnyj als große Gefahr. Nur ein Technologiesprung können einen Ausweg aus diesem Stel… [+3086 chars],,de,'Russland'
https://www.stern.de/politik/ausland/ukraine--armee-chef-saluschnyj-warnt-vor-stellungskrieg-33963298.html,https://www.stern.de/politik/ausland/ukraine--armee-chef-saluschnyj-warnt-vor-stellungskrieg-33963298.html,0,www.stern.de,"Putins Invasion: ""Russland darf nicht unterschätzt werden"": Ukrainischer Armee-Chef warnt vor Stellungskrieg",In der von Russland angegriffenen Ukraine sind weite Teile mit tückischen Landminen übersät. Die Bodenangriffe wandeln sich zudem zunehmend in einen Stellungskrieg. Der ukrainische Oberkommandierende Walerij Saluschnyj warnt vor den Gefahren.,https://image.stern.de/33963332/t/K3/v2/w1440/r1.7778/-/saluschnyj.jpg,2023-11-02T06:05:00Z,,In der von Russland angegriffenen Ukraine sind weite Teile mit tückischen Landminen übersät. Die Bodenangriffe wandeln sich zudem zunehmend in einen Stellungskrieg. Der ukrainische Oberkommandierende… [+5140 chars],,de,'Ukraine'
https://www.focus.de/politik/ausland/ukraine-krise/ukraine-update-am-2-november-militaerexperten-russland-macht-immer-wieder-den-selben-toedlichen-fehler_id_72885571.html,https://www.focus.de/politik/ausland/ukraine-krise/ukraine-update-am-2-november-militaerexperten-russland-macht-immer-wieder-den-selben-toedlichen-fehler_id_72885571.html,0,www.focus.de,Ukraine-Update am Morgen - Militärexperten: Russland macht immer wieder den selben tödlichen Fehler,"Die russische Armee versucht unter sehr hohen Verlusten die ukrainische Stadt Awdijiwka einzunehmen. Erfolge erzielt sie dabei kaum. Die Militärexperten des „ISW“ analysieren, dass Russland dabei alte Fehler wiederholt. Lesen Sie hier alles dazu und was sonst…",https://p6.focus.de/img/fotos/id_167007386/putin-und-die-beerdigung-russischer-soldaten.png?im=Crop%3D%2859%2C0%2C831%2C415%29%3BResize%3D%281200%2C627%29&impolicy=perceptual&quality=mediumHigh&hash=423d41c27afa20df5a053de0facbe6d2f4daa2a1ca0b4d387fb903a8adbcc0d1,2023-11-02T06:10:00Z,,"Die russische Armee versucht unter sehr hohen Verlusten die ukrainische Stadt Awdijiwka einzunehmen. Erfolge erzielt sie dabei kaum. Die Militärexperten des ISW analysieren, dass Russland dabei alte … [+6682 chars]",,de,'Russland'
https://www.zeit.de/wirtschaft/2023-10/energie-russland-europa-ukraine-krieg-energiepolitik,https://www.zeit.de/wirtschaft/2023-10/energie-russland-europa-ukraine-krieg-energiepolitik,0,www.zeit.de,Energie aus Russland: Europas dreckige Geschäfte mit Russland,Die EU will sich eigentlich von Russland unabhängig machen – doch noch immer fließen jeden Monat Gas und Öl im Milliardenwert. Nur ein Instrument könnte das beenden.,https://img.zeit.de/wirtschaft/2023-11/energie-russland-europa-ukraine-krieg-energiepolitik-bild/wide__1300x731,2023-11-02T06:55:44Z,,"Die Heizsaison hat begonnen und zwar unter anderen
Vorzeichen als noch im letzten Jahr: Die Gasspeicher sind vollständig gefüllt,
die Bundesnetzagenturblickt
optimistisch in den Winter. Und auch R… [+532 chars]",,de,'Russland'
https://www.tagesschau.de/ausland/asien/ukraine-kriegsgefangene-100.html,https://www.tagesschau.de/ausland/asien/ukraine-kriegsgefangene-100.html,0,www.tagesschau.de,Kriegsgefangene in der Ukraine: Verachtung und unterdrückte Wut,Seit Beginn des Krieges sind viele Angehörige der russischen Armee in ukrainische Kriegsgefangenschaft geraten. Sie sitzen in Gefängnissen oder im landesweit einzigen Kriegsgefangenenlager. Andrea Beer hat mit einigen von ihnen gesprochen.,https://images.tagesschau.de/image/620fcba1-44a4-40bc-a5fb-739b4e535bd7/AAABhnSPEi0/AAABibBxqrQ/16x9-1280/russland-ukraine-soldaten-101.jpg,2023-11-02T07:08:57Z,,"Stand: 02.11.2023 08:08 Uhr
Seit Beginn des Krieges sind viele Angehörige der russischen Armee in ukrainische Kriegsgefangenschaft geraten. Sie sitzen in Gefängnissen oder im landesweit einzigen Kri… [+5275 chars]",,de,'Ukraine'
https://www.zeit.de/politik/ausland/2023-11/ukraine-krieg-waleryj-saluschnyj-stellungskrieg-gegenoffensive,https://www.zeit.de/politik/ausland/2023-11/ukraine-krieg-waleryj-saluschnyj-stellungskrieg-gegenoffensive,0,www.zeit.de,Ukraine-Krieg: Ukrainischer Militärchef warnt vor jahrelangem Stellungskrieg,"Die Gegenoffensive der Ukraine hat die Erwartungen weit verfehlt. Walerij Saluschnyj, der oberste ukrainische General, sieht den Krieg nun in einer gefährlichen Phase.",https://img.zeit.de/politik/ausland/2023-11/ukraine-krieg-walerij-saluschnyj-stellungskrieg/wide__1300x731,2023-11-02T07:36:17Z,,"Der Oberkommandierende des ukrainischen Militärs, General Walerij Saluschnyj, befürchtet einen lange andauernden Abnutzungskrieg gegen Russland. Keine Kriegspartei habe einen entscheidenden Vorteil g… [+7115 chars]",,de,'Ukraine'
https://www.tagesschau.de/newsticker/liveblog-ukraine-138.html,https://www.tagesschau.de/newsticker/liveblog-ukraine-138.html,0,www.tagesschau.de,++ Liveblog: Russland meldet Abwehr von Drohnen über Krim ++,"Die russische Flugabwehr hat nach eigenen Angaben ukrainische Drohnenangriffe auf die Halbinsel Krim abgewehrt. Papst Franziskus hat davor gewarnt, sich an die Kriege auf der Welt zu gewöhnen. Alle Entwicklungen im Liveblog.",https://images.tagesschau.de/image/be112992-34f6-48ad-8343-e47f3a31b4b9/AAABh3-cnUw/AAABibBxqrQ/16x9-1280/krim-satellitenaufnahme-101.jpg,2023-11-02T08:49:01Z,,"Stand: 02.11.2023 09:53 Uhr
Die russische Flugabwehr hat nach eigenen Angaben ukrainische Drohnenangriffe auf die Halbinsel Krim abgewehrt. Papst Franziskus hat davor gewarnt, sich an die Kriege auf… [+2649 chars]",,de,'Russland'
https://www.welt.de/politik/ausland/video248318500/Krieg-in-der-Ukraine-Putin-setzt-darauf-dass-er-den-laengeren-Atem-hat.html,https://www.welt.de/politik/ausland/video248318500/Krieg-in-der-Ukraine-Putin-setzt-darauf-dass-er-den-laengeren-Atem-hat.html,0,www.welt.de,"„Putin setzt darauf, dass er den längeren Atem hat“","Nur ein Technologiesprung könne den Ausweg aus dem „Stellungskrieg“ mit Russland einleiten, schreibt der ukrainische Oberbefehlshaber Walerij Saluschnyj in einem Beitrag für „The Economist“. Christoph Wanner berichtet über die aktuellen Entwicklungen an der F…",https://img.welt.de/img/politik/ausland/mobile248318522/5451355747-ci16x9-w1200/christoph-wanner-0211-01-jpg.jpg,2023-11-02T08:53:48Z,,"Die WELT als ePaper: Die vollständige Ausgabe steht Ihnen bereits am Vorabend zur Verfügung so sind Sie immer hochaktuell informiert. Weitere Informationen: http://epaper.welt.de 
 Der Kurz-Link die… [+49 chars]",,de,'Russland'
https://www.n-tv.de/politik/Russland-berichtet-von-Drohnenbeschuss-auf-Krim-article24504171.html,https://www.n-tv.de/politik/Russland-berichtet-von-Drohnenbeschuss-auf-Krim-article24504171.html,0,www.n-tv.de,Sechs Attacken abgewehrt: Russland berichtet von Drohnenbeschuss auf Krim,Kiew verstärkt seine Attacken auf die annektierte Krim. Den ukrainischen Streitkräften glückt dabei ein Schlag gegen die russische Flotte. Moskau will nun eine ukrainische Drohne über dem Schwarzen Meer abgeschossen und fünf weitere über der Halbinsel abgefan…,https://bilder1.n-tv.de/img/incoming/crop24504288/8631325314-cImg_16_9-w1200/Satelittenbild-auf-die-Krim-Russland-nutzt-die-annektierte-Insel-als-Nachschubbasis.jpg,2023-11-02T09:14:46Z,,Kiew verstärkt seine Attacken auf die annektierte Krim. Den ukrainischen Streitkräften glückt dabei ein Schlag gegen die russische Flotte. Moskau will nun eine ukrainische Drohne über dem Schwarzen M… [+2091 chars],,de,'Russland'
https://orf.at/stories/3338497/,https://orf.at/stories/3338497/,0,orf.at,Nun fix: Putin hebt Verbot für Atomwaffentests auf,,https://orf.at/mojo/1_4_1/storyserver//news/common/images/og-fallback-news.png,2023-11-02T09:42:33Z,,Russlands Präsident Wladimir Putin hat per Gesetz die russische Ratifizierung für das Verbot von Atomwaffentests zurückgezogen. Der entsprechende Erlass wurde heute in der offiziellen russischen Gese… [+912 chars],,de,'Putin'
https://www.faz.net/aktuell/politik/ukraine-liveticker-moskau-fuenf-drohnenangriffe-ueber-der-krim-abgewehrt-faz-19030454.html,https://www.faz.net/aktuell/politik/ukraine-liveticker-moskau-fuenf-drohnenangriffe-ueber-der-krim-abgewehrt-faz-19030454.html,0,www.faz.net,Ukraine-Liveblog: Moskau: Fünf Drohnenangriffe über der Krim abgewehrt,Kiew: Russland hat in 24 Stunden mehr als 100 Orte angegriffen +++ London: Russland setzt zunehmend Lancet-Drohnen ein +++ Ukraine: Russland hat Ölraffinerie in Krementschuk angegriffen +++ alle Entwicklungen im Liveblog,https://media0.faz.net/ppmedia/aktuell/618902803/1.9285338/facebook_teaser/rauch-steigt-aus-einem.jpg,2023-11-02T09:50:29Z,,"Das ukrainische Volk wird an diesem Freitag mit dem Leibniz-Ring Hannover geehrt. Oleksii Makeiev, Botschafter der Ukraine in Deutschland, werde die renommierte Auszeichnung stellvertretend in Hannov… [+1212 chars]",,de,'Russland'
https://www.tagesspiegel.de/internationales/wie-im-ersten-weltkrieg-ukrainischer-armeechef-warnt-vor-langem-stellungskrieg-10718134.html,https://www.tagesspiegel.de/internationales/wie-im-ersten-weltkrieg-ukrainischer-armeechef-warnt-vor-langem-stellungskrieg-10718134.html,0,www.tagesspiegel.de,„Wie im ersten Weltkrieg“: Ukrainischer Armeechef warnt vor langem Stellungskrieg,Im Krieg zwischen der Ukraine und Russland droht nach Ansicht des ukrainischen Oberkommandierenden ein gefährlicher Zermürbungskrieg. Es brauche einen „massiven Technologiesprung“.,https://www.tagesspiegel.de/images/ukraine-russia-conflict-war111/alternates/BASE_16_9_W1400/ukraine-russia-conflict-war.jpeg,2023-11-02T10:01:16Z,,Der Bodenkrieg in der Ukraine hat sich festgefahren und das sieht der ukrainische Oberkommandierende Walerij Saluschnyj als große Gefahr. Genau wie im Ersten Weltkrieg haben wir ein technologisches N… [+4345 chars],,de,'Ukraine'
https://www.diepresse.com/17786340/putin-hebt-das-verbot-fuer-atomwaffentests-auf,https://www.diepresse.com/17786340/putin-hebt-das-verbot-fuer-atomwaffentests-auf,0,www.diepresse.com,Putin hebt das Verbot für Atomwaffentests auf,"Der Schritt war erwartet worden: Putin begründet den Ausstieg aus dem Vertrag über den Stopp von Nukleartests (CTBT) damit, dass Russland die gleichen Möglichkeiten haben müsse wie die USA.",https://img.diepresse.com/public/incoming/j0wgvc-ISRAEL-PALESTINIANSRUSSIA-PUTIN/alternates/DPR_SOCIAL_NACHRICHTEN/ISRAEL-PALESTINIANSRUSSIA-PUTIN,2023-11-02T10:05:41Z,,"Der Schritt war erwartet worden: Putin begründet den Ausstieg aus dem Vertrag über den Stopp von Nukleartests (CTBT) damit, dass Russland die gleichen Möglichkeiten haben müsse wie die USA. 
Russlan… [+1118 chars]",,de,'Putin'
https://www.faz.net/aktuell/politik/ausland/wladimir-putin-hebt-atomwaffentest-verbot-auf-19285379.html,https://www.faz.net/aktuell/politik/ausland/wladimir-putin-hebt-atomwaffentest-verbot-auf-19285379.html,0,www.faz.net,Putin hebt Verbot von Atomwaffentests auf,"Russland müsse die gleichen Möglichkeiten haben wie Amerika, begründet der russische Präsident den Schritt. Testen wolle Moskau aber erst, wenn die Vereinigten Staaten das auch tun.",https://media1.faz.net/ppmedia/aktuell/politik/ausland/2796201571/1.9285383/facebook_teaser/wladimir-putin-im-oktober-in.jpg,2023-11-02T10:20:44Z,,Russlands Präsident Wladimir Putin hat per Gesetz die russische Ratifizierung für das Verbot von Atomwaffentests zurückgezogen. Der entsprechende Erlass wurde am Donnerstag in der offiziellen russisc… [+973 chars],,de,'Russland'
