index,url,valid,domain,title,description,image,published,archive,content,quote,language,keyword
https://www.stern.de/gesellschaft/regional/berlin-brandenburg/energie--eon-baut-waerme--und-kaelteversorgung-der-berliner-messe-um-33083536.html,https://www.stern.de/gesellschaft/regional/berlin-brandenburg/energie--eon-baut-waerme--und-kaelteversorgung-der-berliner-messe-um-33083536.html,0,www.stern.de,Energie: Eon baut Wärme- und Kälteversorgung der Berliner Messe um,"Die Berliner Messe will beim Heizen und Kühlen stärker auf klimafreundlichere Technologien und Quellen setzen und hat damit den Energiekonzern Eon beauftragt. Bis 2025 soll das Essener Unternehmen die Wärme- und Kälteversorgung der Messe entsprechend umbauen,…",https://image.stern.de/6681672/t/31/v5/w1440/r1.7778/-/video-fallback-image.jpg,2023-01-10T04:29:20Z,https://web.archive.org/web/20230110044159/https://www.stern.de/gesellschaft/regional/berlin-brandenburg/energie--eon-baut-waerme--und-kaelteversorgung-der-berliner-messe-um-33083536.html,Die Berliner Messe will beim Heizen und Kühlen stärker auf klimafreundlichere Technologien und Quellen setzen und hat damit den Energiekonzern Eon beauftragt. Bis 2025 soll das Essener Unternehmen di… [+1825 chars],,de,'Heizen'
https://www.autobild.de/artikel/e-auto-reichweite-winter-kaelte-akku-niedrige-temperatur-14560307.html,https://www.autobild.de/artikel/e-auto-reichweite-winter-kaelte-akku-niedrige-temperatur-14560307.html,0,www.autobild.de,"E-Auto-Reichweite: Winter, Kälte, Akku, niedrige Temperatur Diese E-Autos verlieren bei winterlicher Kälte am wenigsten Reichweite","Bei niedrigen Temperaturen sinkt die Reichweite von Elektroautos. Wie stark, das hat eine US-Firma errechnet. Diese Tipps bringen Sie im Winter weiter, schonen den Akku und helfen, teure Ladestopps zu vermeiden!",https://i.auto-bild.de/ir_img/2/2/6/8/6/5/1/d270068f419ec3a1.jpg?impolicy=og_images,2023-01-10T05:00:00Z,,Jeder kennt es vom Smartphone: Batterien halten bei Kälte nicht so lange durch wie bei warmen Außentemperaturen. Das gilt natürlich auch für die Akkus von Elektroautos. Nur: Wie stark sinkt die Reich… [+11216 chars],,de,'Kälte'
https://www.autobild.de/artikel/vw-golf-8-2023-leasing-kompaktwagen-ps-preis-kosten-privatleasing-22396965.html,https://www.autobild.de/artikel/vw-golf-8-2023-leasing-kompaktwagen-ps-preis-kosten-privatleasing-22396965.html,0,www.autobild.de,"VW Golf 8 (2023): Leasing, Kompaktwagen, PS, Preis, Kosten, Privatleasing VW Golf preiswert und ohne zusätzliche Kosten leasen",Privatkunden können den VW Golf 8 aktuell für 289 Euro brutto monatlich leasen. Der Kompaktwagen ist noch frei konfigurierbar. Alle Infos!,https://i.auto-bild.de/ir_img/3/1/8/8/6/3/5/2c057870435045c6.jpg?impolicy=og_images,2023-01-10T06:54:00Z,,"Kein anderer Neuwagen ist in Deutschland so beliebt wie der VW Golf. Das ist natürlich nichts Neues, Jahr um Jahr lässt der Kompakte die anderen Neuwagen im Schatten stehen trotz seiner überschaubare… [+1660 chars]",,de,'Sparen'
https://taz.de/Winter-in-Syrien/!5904846/,https://taz.de/Winter-in-Syrien/!5904846/,0,taz.de,Winter in Syrien: Selbst Nussschalen werden teurer,Im Nordwesten Syriens leben Millionen Vertriebene in provisorischen Unterkünften. Viele können sich in diesem Winter das Heizen nicht leisten.,https://taz.de/picture/6021926/948/31909618-1.jpeg,2023-01-10T06:59:00Z,,"Im Nordwesten Syriens leben Millionen Vertriebene in provisorischen Unterkünften. Viele können sich in diesem Winter das Heizen nicht leisten.
Nass und kalt: Jassim al-Hamud (l.) in seinem Flüchtlin… [+4403 chars]",,de,'Heizen'
https://www.freitag.de/autoren/the-guardian/holzoefen-in-meinem-haus-meine-brennende-schande,https://www.freitag.de/autoren/the-guardian/holzoefen-in-meinem-haus-meine-brennende-schande,0,www.freitag.de,Meinung | Heizen mit Holz: Meine brennende Schande,"Holzöfen sind unglaublich schlecht für die Umwelt. Dazu fluten sie unser Zuhause mit Giftstoffen. Ich wünschte, ich hätte das 2008 gewusst Die pure Scham hielt mich bisher davon ab, über dieses Thema zu schreiben. Die Scham, darin versagt zu haben, selbst zu …",https://www.freitag.de/autoren/the-guardian/holzoefen-in-meinem-haus-meine-brennende-schande/@@images/image/lead_article,2023-01-10T09:50:00Z,https://web.archive.org/web/20230110070033/https://www.freitag.de/autoren/the-guardian/holzoefen-in-meinem-haus-meine-brennende-schande/,"Die pure Scham hielt mich bisher davon ab, über dieses Thema zu schreiben. Die Scham, darin versagt zu haben, selbst zu denken und das große Ganze zu erkennen, was mehr oder weniger meine Jobbeschrei… [+5387 chars]",,de,'Heizen'
https://www.morgenpost.de/lifestyle/wohnen/article237330645/Baupreise-ziehen-weiter-an.html,https://www.morgenpost.de/lifestyle/wohnen/article237330645/Baupreise-ziehen-weiter-an.html,0,www.morgenpost.de,Statistisches Bundesamt: Baupreise ziehen weiter an,"Nicht nur Immobilienkredite werden teurer. Auch das Bauen an sich verursacht immer höhere Kosten. Wie viel mehr Geld Bauherren zuletzt in die Hand nehmen mussten, zeigen aktuelle Zahlen.",https://img.morgenpost.de/img/wohnen/crop237330643/7502602291-w820-cv16_9-q85/Steigende-Baupreise.jpg,2023-01-10T09:51:12Z,,Wiesbaden. Bauen in Deutschland bleibt vergleichsweise teuer. Der Preisanstieg beschleunigte sich zuletzt wieder. Die Preise für den Neubau konventionell gefertigter Wohngebäude legten im November ge… [+673 chars],,de,'Kosten'
https://www.kino.de/film/avatar-2-the-way-of-water-2022/news/avatar-2-einspielergebnis-naechster-deutscher-rekord-gebrochen-fuer-marvel-hits-wird-es-eng/,https://www.kino.de/film/avatar-2-the-way-of-water-2022/news/avatar-2-einspielergebnis-naechster-deutscher-rekord-gebrochen-fuer-marvel-hits-wird-es-eng/,0,www.kino.de,„Avatar 2“-Einspielergebnis: Nächster deutscher Rekord gebrochen – für Marvel-Hits wird es eng,"„Avatar: The Way of Water“ muss eine enorme Summe einspielen, um die Kosten zu decken – und hat sein Ziel jetzt fast erreicht...",https://crops.giga.de/1d/ac/bb/17f15d48d5fc2a5a031f277e8a_YyAxODA1eDEwMTUrMTIyKzMyAnJlIDE5MjAgMTA4MAMxYzExNDUyYTE3OA==.jpg,2023-01-10T10:01:02Z,,"„Avatar: The Way of Water“ muss eine enorme Summe einspielen, um die Kosten zu decken – und hat sein Ziel jetzt fast erreicht.
Seid „Avatar: The Way of Water“ in den Kinos gestartet ist, dürfte Fans… [+8529 chars]",,de,'Kosten'
https://www.stern.de/digital/technik/ces-las-vegas--hightech-toilette-verspricht-verwoehnprogramm---fuer-reiche--video--33084658.html,https://www.stern.de/digital/technik/ces-las-vegas--hightech-toilette-verspricht-verwoehnprogramm---fuer-reiche--video--33084658.html,0,www.stern.de,CES in Las Vegas: Hightech-Toilette verspricht Verwöhnprogramm – für den ganz dicken Geldbeutel,"Sprachsteuerung, Beleuchtung und Selbstreinigung: Damit wartet eine neue Toilette der Firma Kohler auf der Technikmesse CES in Las Vegas auf. Für das Design-Objekt mit den vielen Extras müssen Interessierte allerdings tief in die Tasche greifen.",https://image.stern.de/33084660/t/u5/v4/w1440/r1.7778/-/10-hi-tech-toilette-in-den-usa-vorgestellt-6318449734112-1.jpg,2023-01-10T10:49:00Z,,"Sehen Sie im Video: CES Las Vegas Hightech-Toilette verspricht Verwöhnprogramm.Las Vegas, USA: Besonderes Ausstellungsstück auf der Elektronikmesse CES. Eine Toilette mit vielen Extras: Amazon Alexa,… [+541 chars]",,de,'Kohle'
https://www.stern.de/politik/deutschland/worum-geht-es-in-luetzerath---klima-clash-an-der-abbruchkante-33085232.html,https://www.stern.de/politik/deutschland/worum-geht-es-in-luetzerath---klima-clash-an-der-abbruchkante-33085232.html,0,www.stern.de,Worum geht es in Lützerath?: Klima-Clash an der Abbruchkante,"Ein Energiekonzern will ein Dorf abreißen, um Kohle abzubaggern. Klimaaktivisten wollen das verhindern. Das ist die Ausgangslage im rheinischen Lützerath - politisch brisant vor allem für die Grünen.",https://image.stern.de/33085234/t/9f/v1/w1440/r1.7778/-/10--urnnewsmldpacom2009010123011099165604v3w800h600l826t612r2106b1462jpeg---11b27f9adb3819b0.jpg,2023-01-10T11:02:43Z,https://web.archive.org/web/20230110115311/https://www.stern.de/politik/deutschland/worum-geht-es-in-luetzerath---klima-clash-an-der-abbruchkante-33085232.html,"Ein Energiekonzern will ein Dorf abreißen, um Kohle abzubaggern. Klimaaktivisten wollen das verhindern. Das ist die Ausgangslage im rheinischen Lützerath - politisch brisant vor allem für die Grünen.… [+4360 chars]",,de,'Kohle'
https://www.stern.de/gesellschaft/regional/nordrhein-westfalen/ausstellungen--ausstellung--haende-weg-vom-ruhrgebiet--startet-in-essen--33085256.html,https://www.stern.de/gesellschaft/regional/nordrhein-westfalen/ausstellungen--ausstellung--haende-weg-vom-ruhrgebiet--startet-in-essen--33085256.html,0,www.stern.de,"Ausstellungen: Ausstellung ""Hände weg vom Ruhrgebiet"" startet in Essen","Hyperinflation, Hunger, Armut, Arbeitslosigkeit und Widerstand gegen französische und belgische Besatzer: Eine Ausstellung im Ruhr Museum in Essen zeigt ab Donnerstag den drastischen Alltag der Bevölkerung, den Boykott der Arbeiter im Ruhrgebiet vor rund 100 …",https://image.stern.de/33085258/t/2V/v1/w1440/r1.7778/-/10--urnnewsmldpacom2009010123011099165763v3w800h600l640t439r1920b1317jpeg---cc7a6f38597dc9dd.jpg,2023-01-10T11:03:54Z,,"Hyperinflation, Hunger, Armut, Arbeitslosigkeit und Widerstand gegen französische und belgische Besatzer: Eine Ausstellung im Ruhr Museum in Essen zeigt ab Donnerstag den drastischen Alltag der Bevöl… [+1368 chars]",,de,'Armut'
https://www.focus.de/finanzen/news/o2-hebt-preise-an-handy-tarife-viel-teurer-so-kommen-sie-aus-ihrem-vertrag-raus_id_182669569.html,https://www.focus.de/finanzen/news/o2-hebt-preise-an-handy-tarife-viel-teurer-so-kommen-sie-aus-ihrem-vertrag-raus_id_182669569.html,0,www.focus.de,O2 hebt Preise an - Handy-Tarife viel teurer! So kommen Sie aus Ihrem Vertrag raus,"Die Inflation bleibt auf einem sehr hohen Niveau. Viele Menschen müssen im Alltag tiefer in die Tasche greifen, um ihren Alltag finanziell zu stemmen. Erstmals sind nun auch Handytarife betroffen. O2 will erstmals kräftig an der Preisschraube drehen.",https://p6.focus.de/img/regional/hamburg/id_181954405/eine-person-haelt-ein-smartphone-in-der-hand..jpg?im=Crop%3D%280%2C170%2C2048%2C1024%29%3BResize%3D%281200%2C627%29&impolicy=perceptual&quality=medium&hash=b00180a00553e578c4b28d939edb11cf5588e2dcff26a5f81124df11af5abaef,2023-01-10T13:12:50Z,https://web.archive.org/web/20230110170903/https://www.focus.de/finanzen/news/o2-hebt-preise-an-handy-tarife-viel-teurer-so-kommen-sie-aus-ihrem-vertrag-raus_id_182669569.html,"Die Inflation bleibt auf einem sehr hohen Niveau. Viele Menschen müssen im Alltag tiefer in die Tasche greifen, um ihren Alltag finanziell zu stemmen. Erstmals sind nun auch Handytarife betroffen. O2… [+5994 chars]",,de,'Inflation'
https://www.dw.com/de/weltbank-warnt-vor-risiko-globaler-rezession/a-64343064,https://www.dw.com/de/weltbank-warnt-vor-risiko-globaler-rezession/a-64343064,0,www.dw.com,Weltbank warnt vor Risiko globaler Rezession,"Die Wirtschaft brummt aktuell nicht sonderlich - das gilt für Industriestaaten wie Schwellen- und Entwicklungsländer gleichermaßen. Und auch ein Blick in die nähere Zukunft ist alles andere als rosig. Die hohe Inflation, steigende Zinsen und der russische Ang…",https://static.dw.com/image/63995224_6.jpg,2023-01-10T15:32:00Z,,"Die hohe Inflation, steigende Zinsen und der russische Angriffskrieg gegen die Ukraine bremsen das weltweite Wirtschaftswachstum nachhaltig und drastisch aus. Die Weltbank senkte am Dienstag ihre glo… [+5135 chars]",,de,'Inflation'
https://www.sueddeutsche.de/politik/syrien-tuerkei-idlib-russland-1.5729658,https://www.sueddeutsche.de/politik/syrien-tuerkei-idlib-russland-1.5729658,0,www.sueddeutsche.de,Syrien: UN-Sicherheitsrat billigt weitere Hilfslieferungen für Syrien,Auch Russland stimmt für Fortsetzung der Hilfe für den Nordwesten des Landes. Doch wie zuvor bleibt das Mandat für die Lieferungen über die Türkei auf sechs Monate begrenzt. Möglicherweise ist die Katastrophe also nur vertagt.,https://www.sueddeutsche.de/image/sz.1.5729659/1200x675?v=1673366475,2023-01-10T16:47:11Z,https://web.archive.org/web/20230110165328/https://www.sueddeutsche.de/politik/syrien-tuerkei-idlib-russland-1.5729658,Auch Russland stimmt für Fortsetzung der Hilfe für den Nordwesten des Landes. Doch wie zuvor bleibt das Mandat für die Lieferungen über die Türkei auf sechs Monate begrenzt. Möglicherweise ist die Ka… [+5701 chars],,de,'Heizen'
https://www.tagesschau.de/wirtschaft/weltwirtschaft/weltbank-wachstumsprognose-konjunktur-101.html,https://www.tagesschau.de/wirtschaft/weltwirtschaft/weltbank-wachstumsprognose-konjunktur-101.html,0,www.tagesschau.de,Überall auf der Welt wächst die Wirtschaft langsamer,"Die hohe Inflation, steigende Zinsen und der russische Angriffskrieg gegen die Ukraine bremsen das weltweite Wirtschaftswachstum. Weitere Schocks konnten gar zu einer globalen Rezession führen.",https://www.tagesschau.de/multimedia/bilder/kunjunktur-hafen-hamburg-101~_v-original.jpg,2023-01-10T16:48:50Z,,"Die hohe Inflation, steigende Zinsen und der russische Angriffskrieg gegen die Ukraine bremsen das weltweite Wirtschaftswachstum. Weitere Schocks konnten gar zu einer globalen Rezession führen.
Die … [+2855 chars]",,de,'Ukraine'
https://www.faz.net/aktuell/politik/ausland/waffenlieferungen-fuer-die-ukraine-die-usa-zoegert-bislang-18592752.html,https://www.faz.net/aktuell/politik/ausland/waffenlieferungen-fuer-die-ukraine-die-usa-zoegert-bislang-18592752.html,0,www.faz.net,Kampfpanzer für Kiew oder nicht? Die Verschiebung des Tabus,"Auch Washington zögert bislang, eigene schwere Kampfpanzer an die Ukraine zu liefern. Ist es nur eine Frage der Zeit, bis sich diese Haltung ändert?",https://media0.faz.net/ppmedia/aktuell/politik/2267504267/1.8592750/facebook_teaser_fplus/ein-amerikanischer-m1a1-abrams.jpg,2023-01-10T17:14:14Z,https://web.archive.org/web/20230111082103/https://www.faz.net/aktuell/politik/ausland/waffenlieferungen-fuer-die-ukraine-die-usa-zoegert-bislang-18592752.html,"Als die Regierungen in Washington und Berlin in der vergangenen Woche mitteilten, dass sie Kiew nunmehr auch Schützenpanzer vom Typ Marder und Bradley zur Verfügung stellten, reagierte die ukrainisch… [+503 chars]",,de,'Waffen'
https://www.welt.de/kultur/plus243110009/Prinz-Harrys-Autobiografie-Warum-Reserve-brillant-ist.html,https://www.welt.de/kultur/plus243110009/Prinz-Harrys-Autobiografie-Warum-Reserve-brillant-ist.html,0,www.welt.de,Warum Prinz Harrys Buch brillant ist,"Sex, Drogen und emotionale Kälte: Prinz Harrys Autobiografie steckt voller explosiver Anekdoten aus der Innenwelt von Buckingham Palace. „Reserve” ist aber vor allem eine meisterhafte Erzählung. Im Zentrum steht eine Verwandlung, die für Engländer schockieren…",https://img.welt.de/img/incoming/mobile243137327/6111351837-ci16x9-w1200-fnov-fpotl-fpi157750653/Duke-of-Sussex-autobiography-Spare-2.jpg,2023-01-10T17:38:10Z,http://archive.md/20230111013435/https://www.welt.de/kultur/plus243110009/Prinz-Harrys-Autobiografie-Warum-Reserve-brillant-ist.html,"eluekOeu Fellv Bullel peveekle Blneheleleu, Ileehlua uuu Ueplvoaeu.
Vup pu aep ep pekuu uulep etteltel Punteuelpetlehpell, Plutt leluplel Pulle: Be lpl ple 6epeklekle uuu pel Bleaetel pel pelpeu elv… [+9972 chars]",,de,'Kälte'
https://www.welt.de/politik/ausland/article243098731/Ukraine-News-Ukraine-befuerchtet-neuen-Angriff-auf-Kiew.html,https://www.welt.de/politik/ausland/article243098731/Ukraine-News-Ukraine-befuerchtet-neuen-Angriff-auf-Kiew.html,0,www.welt.de,Ukraine befürchtet neuen Angriff auf Kiew – Soldaten erhalten Patriot-Training in USA,"Zu Beginn des russischen Angriffskriegs haben ukrainische Streitkräfte einen Angriff russischer Truppen auf Kiew abgeschlagen. Nun wappnet sich die Armee für einen neuen Vorstoß. Die USA teilen mit, dass ukrainische Soldaten in Oklahoma am Patriot-System ausg…",https://img.welt.de/img/politik/ausland/mobile243138629/6481353587-ci16x9-w1200/Daily-Life-In-Kyiv-More-Than-10-Months-Since-Russia-s-Large-Scal.jpg,2023-01-10T19:12:00Z,https://web.archive.org/web/20230110201141/https://www.welt.de/politik/ausland/article243098731/Ukraine-News-Ukraine-befuerchtet-neuen-Angriff-auf-Kiew.html,Das ukrainische Militär bereitet sich auf einen möglichen neuen Angriff russischer Bodentruppen aus Belarus in Richtung der Hauptstadt Kiew vor. Dazu seien bereits Abwehrstellungen im Norden des Land… [+44602 chars],,de,'Kälte'
https://praxistipps.chip.de/heizen-mit-oelradiator-das-sollten-sie-darueber-wissen_154505,https://praxistipps.chip.de/heizen-mit-oelradiator-das-sollten-sie-darueber-wissen_154505,0,praxistipps.chip.de,Heizen mit Ölradiator: Das sollten Sie darüber wissen,"In Zeiten von steigenden Preisen für fossile Brennstoffe kamen Sie eventuell bereits auf die Idee, stattdessen mit einem Ölradiator zu heizen. Doch im Allgemeinen ist dies weder eine gute ökologische, noch ökonomische Lösung. Dennoch kann es Vorteile bieten. …",https://im.contentlounge.net/styles/manual_crop/s3/2023-01/imago_152716649-v1.jpg?im=AspectCrop%3D%281.91%2C1%29%2Cgravity%3DCenter%3BResize%3D%281200%2C630%29%2Caspect%3Dfit%3BBackgroundColor%2Ccolor%3Dffffff&hash=a858c8ca493967073a8af038fae74364a795bf43a51a7e41cf834016c5eae9cf,2023-01-10T21:28:09Z,https://web.archive.org/web/20230112205653/https://praxistipps.chip.de/heizen-mit-oelradiator-das-sollten-sie-darueber-wissen_154505,"In Zeiten von steigenden Preisen für fossile Brennstoffe kamen Sie eventuell bereits auf die Idee, stattdessen mit einem Ölradiator zu heizen. Doch im Allgemeinen ist dies weder eine gute ökologische… [+3076 chars]",,de,'Heizen'
https://www.faz.net/aktuell/politik/wladimir-putins-sadismus-und-alexej-nawalnyjs-standhaftigkeit-18592388.html,https://www.faz.net/aktuell/politik/wladimir-putins-sadismus-und-alexej-nawalnyjs-standhaftigkeit-18592388.html,0,www.faz.net,Kommentar: Putins Sadismus und Nawalnyjs Standhaftigkeit,Das russische Regime will seinen Gegner Alexej Nawalnyj durch die Haftbedingungen körperlich und geistig brechen. Es will den vernichteten Gegner als Trophäe präsentieren.,https://media0.faz.net/ppmedia/aktuell/1969466049/1.8592384/facebook_teaser/alexej-nawalnyj-bei-einer.jpg,2023-01-11T05:08:43Z,https://web.archive.org/web/20230111085335/https://www.faz.net/aktuell/politik/wladimir-putins-sadismus-und-alexej-nawalnyjs-standhaftigkeit-18592388.html,"Es ist nicht von Bedeutung, zu wie vielen Jahren Haft der russische Regimegegner Alexej Nawalnyj bisher verurteilt worden ist. Ob und wann er freikommt, hängt nicht von der Länge der von Gerichten ve… [+1129 chars]",,de,'Putin'
https://www.faz.net/aktuell/politik/ausland/erneuerbare-energien-frankreichs-nationalversammlung-fuer-ausbau-18593061.html,https://www.faz.net/aktuell/politik/ausland/erneuerbare-energien-frankreichs-nationalversammlung-fuer-ausbau-18593061.html,0,www.faz.net,Tumulte im Parlament: Nationalversammlung stimmt für Ausbau der Erneuerbaren,"Der Ausbau der Erneuerbaren Energien in Frankreich hinkt dem Plan hinterher. Nun sollen Genehmigungsverfahren gestrafft werden, um schneller ans Ziel zu kommen.",https://media0.faz.net/ppmedia/aktuell/politik/ausland/183465701/1.8593072/facebook_teaser/ein-windpark-vor-st-nazaire-im.jpg,2023-01-11T05:18:22Z,https://web.archive.org/web/20230111132319/https://www.faz.net/aktuell/politik/ausland/erneuerbare-energien-frankreichs-nationalversammlung-fuer-ausbau-18593061.html,Frankreich will seinen Rückstand beim Ausbau erneuerbarer Energien aufholen. Die Nationalversammlung hat am Dienstagabend mit einer Mehrheit von 286Stimmen bei238 Gegenstimmen dem Gesetzentwurf zur B… [+4030 chars],,de,'Erneuerbare Energien'
https://www.welt.de/vermischtes/prominente/article243140969/Pop-Titan-Dieter-Bohlen-verteidigt-eigene-Aussage-ueber-Russland-Sanktionen.html,https://www.welt.de/vermischtes/prominente/article243140969/Pop-Titan-Dieter-Bohlen-verteidigt-eigene-Aussage-ueber-Russland-Sanktionen.html,0,www.welt.de,„Keinerlei Sympathien für Putin“ – Dieter Bohlen verteidigt eigene Aussage über Russland-Sanktionen,Mit einem Video über Russland-Sanktionen hatte Dieter Bohlen für Aufsehen gesorgt. Dafür war er unter anderem von SPD-Chefin Esken kritisiert worden. Nur verteidigt der Musikproduzent in einem Interview seine Äußerungen.,https://img.welt.de/img/newsticker/dpa_nt/infoline_nt/boulevard_nt/mobile232902321/7771354537-ci16x9-w1200/urn-newsml-dpa-com-20090101-210803-99-681802-large-4-3-jpg.jpg,2023-01-11T08:11:25Z,https://web.archive.org/web/20230111082852/https://www.welt.de/vermischtes/prominente/article243140969/Pop-Titan-Dieter-Bohlen-verteidigt-eigene-Aussage-ueber-Russland-Sanktionen.html,"Musikproduzent Dieter Bohlen (68) hat eigene Äußerungen über Russland-Sanktionen wegen des Ukraine-Kriegs gegen Kritik verteidigt. Ich kenne Physik: Druck erzeugt Gegendruck. Mit Gewalt, damit, immer… [+1515 chars]",,de,'Frieren'
https://www.bild.de/politik/inland/politik-inland/luetzerath-entlarvt-habecks-klima-irrweg-82519102.bild.html,https://www.bild.de/politik/inland/politik-inland/luetzerath-entlarvt-habecks-klima-irrweg-82519102.bild.html,0,www.bild.de,Kommentar zu Kohle-Protesten - Lützerath entlarvt Habecks Klima-Irrweg,Die Räumung von Lützerath durch die Polizei ist nicht nur ein Fiasko für den Klimaschutz.Foto: Getty Images,"https://images.bild.de/63bea6b8261468542f73a315/69a66f929aa37b53d0342e35ad62483d,7abf0a8b?w=1280",2023-01-11T12:38:02Z,http://archive.md/20230111175643/https://www.bild.de/politik/inland/politik-inland/luetzerath-entlarvt-habecks-klima-irrweg-82519102.bild.html,"Die Räumung von Lützerath durch die Polizei ist nicht nur ein Fiasko für den Klimaschutz: Es ist vor allem ein Fiasko für Robert Habeck (53, Grüne) und seine Energiepolitik!
Der Klimaschutzminister … [+1764 chars]",,de,'Kohle'
https://www.golem.de/sonstiges/zustimmung/auswahl.html?from=https://www.golem.de/news/baerbock-deutschland-sagt-ukraine-20-millionen-euro-fuer-starlink-zu-2301-171119.html&referer=https://t.co/5ac36a8164,https://www.golem.de/sonstiges/zustimmung/auswahl.html?from=https://www.golem.de/news/baerbock-deutschland-sagt-ukraine-20-millionen-euro-fuer-starlink-zu-2301-171119.html&referer=https://t.co/5ac36a8164,0,www.golem.de,Baerbock: Deutschland sagt Ukraine 20 Millionen Euro für Starlink zu,"Bei einem Besuch im ukrainischen Charkiw bestätigt Außenministerin Annalena Baerbock die Finanzierung von Starlink-Terminals - auch für die Armee. (Starlink, Internet)",,2023-01-11T13:00:02Z,,"Besuchen Sie Golem.de wie gewohnt mit Werbung und Tracking,
 indem Sie der Nutzung aller Cookies zustimmen.
 Details zum Tracking finden Sie im Privacy Center.
Skript wurde nicht geladen. Informat… [+607 chars]",,de,'Ukraine'
https://www.zeit.de/news/2023-01/11/muetzenich-will-ukraine-hilfe-nicht-auf-waffen-verengen,https://www.zeit.de/news/2023-01/11/muetzenich-will-ukraine-hilfe-nicht-auf-waffen-verengen,0,www.zeit.de,SPD-Fraktionsvorsitzender: Mützenich will Ukraine-Hilfe nicht auf Waffen verengen,,,2023-01-11T14:04:32Z,https://web.archive.org/web/20230111142410/https://www.zeit.de/news/2023-01/11/muetzenich-will-ukraine-hilfe-nicht-auf-waffen-verengen,"When browsing with ads:
We collect personal data and also transmit it to third-party providers
 that help us improve and finance our digital content. Some of the information stored on your device, … [+732 chars]",,de,'Waffen'
https://www.stern.de/wirtschaft/news/boerse-in-frankfurt--dax-weiter-auf-hoehenflug-33088786.html,https://www.stern.de/wirtschaft/news/boerse-in-frankfurt--dax-weiter-auf-hoehenflug-33088786.html,0,www.stern.de,Börse in Frankfurt: Dax weiter auf Höhenflug,"Die Hoffnung auf eine weiter abflauende Inflation hat die Aktienkurse am Mittwoch wieder angeschoben. Der deutsche Leitindex Dax rückte nah an 15.000 Punkte heran. Aus dem Handel ging er mit plus 1,17 Prozent bei einem Stand von 14.947,91 Punkten. Für den MDa…",https://image.stern.de/33088788/t/SE/v4/w1440/r1.7778/-/11--urnnewsmldpacom2009010123011199178233v1w800h600l294t274r1853b1142jpeg---016fa7ea4a2d95d1.jpg,2023-01-11T17:07:10Z,,"Die Hoffnung auf eine weiter abflauende Inflation hat die Aktienkurse am Mittwoch wieder angeschoben. Der deutsche Leitindex Dax rückte nah an 15.000 Punkte heran. Aus dem Handel ging er mit plus 1,1… [+779 chars]",,de,'Inflation'
https://www.stern.de/gesellschaft/regional/hamburg-schleswig-holstein/ministerpraesident--guenther-blickt-optimistisch-auf-2023-33090650.html,https://www.stern.de/gesellschaft/regional/hamburg-schleswig-holstein/ministerpraesident--guenther-blickt-optimistisch-auf-2023-33090650.html,0,www.stern.de,Ministerpräsident: Günther blickt optimistisch auf 2023,"Schleswig-Holsteins Ministerpräsident Daniel Günther (CDU) sieht für 2023 trotz Ukraine-Kriegs und Inflation Gründe für Zuversicht. Für viele Menschen sei 2022 ein belastendes Jahr gewesen, erklärte Günther laut Staatskanzlei am Mittwoch zum traditionellen Ne…",https://image.stern.de/33090652/t/aa/v1/w1440/r1.7778/-/11--urnnewsmldpacom2009010123011199183672v3w800h600l387t0r2052b1323jpeg---7eedb146795ff0e2.jpg,2023-01-11T17:42:32Z,https://web.archive.org/web/20230111182809/https://www.stern.de/gesellschaft/regional/hamburg-schleswig-holstein/ministerpraesident--guenther-blickt-optimistisch-auf-2023-33090650.html,"Schleswig-Holsteins Ministerpräsident Daniel Günther (CDU) sieht für 2023 trotz Ukraine-Kriegs und Inflation Gründe für Zuversicht. Für viele Menschen sei 2022 ein belastendes Jahr gewesen, erklärte … [+2294 chars]",,de,'Inflation'
