index,url,valid,domain,title,description,image,published,archive,content,quote,language,keyword
https://www.faz.net/aktuell/politik/ukraine-liveticker-usa-setzen-stahlzoelle-gegen-ukraine-weiterhin-aus-faz-18495964.html,https://www.faz.net/aktuell/politik/ukraine-liveticker-usa-setzen-stahlzoelle-gegen-ukraine-weiterhin-aus-faz-18495964.html,0,www.faz.net,Ukraine-Liveblog: USA setzen Stahlzölle gegen Ukraine weiterhin aus,Aus den Vereinigten Staaten kommen neue Militärhilfen für die Ukraine +++ Russland will Kinder aus Grenzregion in Sicherheit bringen +++ Vier russische Generalkonsulate in Deutschland müssen schließen +++ alle Entwicklungen im Liveblog,https://media0.faz.net/ppmedia/aktuell/politik/2836871613/1.8933088/facebook_teaser/zum-sinnbild-des-ukrainischen.jpg,2023-06-01T05:01:57Z,https://web.archive.org/web/20230601060846/https://www.faz.net/aktuell/politik/ukraine-liveticker-usa-setzen-stahlzoelle-gegen-ukraine-weiterhin-aus-faz-18495964.html,Eine Stellungnahme der UN lag zunächst nicht vor. Sie hatten im Juli zusammen mit der Türkei das Getreideabkommen zwischen den Regierungen in Moskau und Kiew vermittelt. Zwar hat Russland in diesem M… [+483 chars],,de,'Ukraine'
https://www.golem.de/sonstiges/zustimmung/auswahl.html?from=https://www.golem.de/news/erneuerbare-energien-powerx-baut-das-erste-tankschiff-fuer-sauberen-strom-2306-174609.html&referer=https://t.co/2e47f337a7,https://www.golem.de/sonstiges/zustimmung/auswahl.html?from=https://www.golem.de/news/erneuerbare-energien-powerx-baut-das-erste-tankschiff-fuer-sauberen-strom-2306-174609.html&referer=https://t.co/2e47f337a7,0,www.golem.de,Erneuerbare Energien: PowerX baut das erste Tankschiff für sauberen Strom,"Wenn Öl oder Gas mit dem Schiff transportiert werden: warum nicht auch Strom? (Schiff, Akku)",,2023-06-01T09:17:02Z,https://web.archive.org/web/20230603105517/https://www.golem.de/sonstiges/zustimmung/auswahl.html?from=https:%2F%2Fwww.golem.de%2Fnews%2Ferneuerbare-energien-powerx-baut-das-erste-tankschiff-fuer-sauberen-strom-2306-174609.html&amp;referer=https:%2F%2Ft.co%2F2e47f337a7,"Besuchen Sie Golem.de wie gewohnt mit Werbung und Tracking,
 indem Sie der Nutzung aller Cookies zustimmen.
 Details zum Tracking finden Sie im Privacy Center.
Skript wurde nicht geladen. Informat… [+607 chars]",,de,'Erneuerbare Energien'
https://www.handelsblatt.com/politik/deutschland/energie-moskau-will-groessere-ieaa-mission-in-ukrainischem-akw-zulassen-ex-omv-chef-nach-2024-fliesst-kein-russisches-gas-mehr-ueber-die-ukraine/28616386.html,https://www.handelsblatt.com/politik/deutschland/energie-moskau-will-groessere-ieaa-mission-in-ukrainischem-akw-zulassen-ex-omv-chef-nach-2024-fliesst-kein-russisches-gas-mehr-ueber-die-ukraine/28616386.html,0,www.handelsblatt.com,+++ Energiekrise +++: Moskau will größere IEAA-Mission in ukrainischem AKW zulassen – Ex-OMV-Chef: Nach 2024 fließt kein russisches Gas mehr über die Ukraine,Deutsche Windindustrie weiter zuversichtlich +++ Debatte um Industriestrompreis: IHK schlägt Drei-Stufen-Modell vor +++ Der Newsblog.,https://www.handelsblatt.com/images/saporischschja/29181474/2-format2003.jpg,2023-06-01T10:01:39Z,https://web.archive.org/web/20230601111047/https://www.handelsblatt.com/politik/deutschland/energie-moskau-will-groessere-ieaa-mission-in-ukrainischem-akw-zulassen-ex-omv-chef-nach-2024-fliesst-kein-russisches-gas-mehr-ueber-die-ukraine/28616386.html,"<li>Herr Max Heck31.05.2023, 13:32 Uhr
Nur Firmen? 
Der ist gut! 
</li><li>Herr Josef Berchtold30.05.2023, 11:51 Uhr
@Max HeckVolle Zustimmung. Es wird intellektuell völlig abgehoben von ""Kulture… [+5980 chars]",,de,'Ukraine'
https://www.der-postillon.com/2023/06/putin-doppelgaenger-doppelgaenger.html,https://www.der-postillon.com/2023/06/putin-doppelgaenger-doppelgaenger.html,0,www.der-postillon.com,Arbeit zu riskant: Putins Doppelgänger schickt Doppelgänger vor,"Moskau (dpo) - Sicher ist sicher: Weil sein Job immer gefährlicher wird, nimmt Putins Doppelgänger Aleksandr Orlow seit neuestem die Dienste eines Doppelgängers in Anspruch, der an seiner Stelle den russischen Präsidenten verkörpern soll.
mehr...",https://blogger.googleusercontent.com/img/b/R29vZ2xl/AVvXsEgFWLavBZ-DepxDHXA3RjOtzPMl6lH5kTo_EuREUjFrowI57Qz7XUrxMOkzU3XnhvxKuzm-KeXiZ40MwyXd6pwL4xZlc7up2tqTg_2pD5bMyCLKUcNHsgQsc2Ddnc9anSBup7uOXRnXLGM65UnQoDwPn4eR4SquhCobtSGLDlH7nS5yambKZPoGFqtH/w1600/Putin-Doppelgaenger-Doppelgaenger.jpg,2023-06-01T11:26:55Z,https://web.archive.org/web/20230601133150/https://www.der-postillon.com/2023/06/putin-doppelgaenger-doppelgaenger.html,"Moskau (dpo) - Sicher ist sicher: Weil sein Job immer gefährlicher wird, nimmt Putins Doppelgänger Aleksandr Orlow seit neuestem die Dienste eines Doppelgängers in Anspruch, der an seiner Stelle den … [+1814 chars]",,de,'Putin'
https://www.handelsblatt.com/politik/international/erneuerbare-energien-deutschland-und-daenemark-teilen-sich-leitungen-fuer-offshore-windkraft/29181698.html,https://www.handelsblatt.com/politik/international/erneuerbare-energien-deutschland-und-daenemark-teilen-sich-leitungen-fuer-offshore-windkraft/29181698.html,0,www.handelsblatt.com,Erneuerbare Energien: Deutschland und Dänemark teilen sich Leitungen für Offshore-Windkraft,Die beiden Länder unterzeichnen das erste europäische Kooperationsabkommen für die gemeinsame Nutzung von Windstrom. Sie betreten damit Neuland.,https://www.handelsblatt.com/images/windpark-in-daenemark/29181810/2-format2003.jpg,2023-06-01T11:53:01Z,https://web.archive.org/web/20230601122529/https://www.handelsblatt.com/politik/international/erneuerbare-energien-deutschland-und-daenemark-teilen-sich-leitungen-fuer-offshore-windkraft/29181698.html,"Windpark in DänemarkEine enge Kooperation der Nord- und Ostsee-Anrainer gilt als eine der Grundvoraussetzungen, um die ehrgeizigen Ziele der EU für den Ausbau der Offshore-Windkraft zu erreichen.
(F… [+1485 chars]",,de,'Erneuerbare Energien'
https://www.faz.net/aktuell/politik/ukraine-liveticker-russland-spricht-von-versuchter-ukrainischer-invasion-in-grenzregion-faz-18495964.html,https://www.faz.net/aktuell/politik/ukraine-liveticker-russland-spricht-von-versuchter-ukrainischer-invasion-in-grenzregion-faz-18495964.html,0,www.faz.net,Ukraine-Liveblog: Russland spricht von versuchter ukrainischer „Invasion“ in Grenzregion,Baerbock: Kein NATO-Beitritt der Ukraine „mitten im Krieg“ +++ Russland verärgert über Gipfeltreffen in Moldau +++ Selenskyj in Chisinau eingetroffen +++ USA setzen Stahlzölle gegen Ukraine weiter aus +++ alle Entwicklungen im Liveblog,https://media0.faz.net/ppmedia/aktuell/2467858533/1.8934158/facebook_teaser/krieg-auf-russischem-boden.jpg,2023-06-01T12:50:54Z,https://web.archive.org/web/20230601133931/https://www.faz.net/aktuell/politik/ukraine-liveticker-russland-spricht-von-versuchter-ukrainischer-invasion-in-grenzregion-faz-18495964.html,"Angesprochen auf den Drohnenangriff auf russischem Boden am Dienstag hat NATO-Generalsekretär Jens Stoltenberg das Selbstverteidigungsrecht der Ukraine hervorgehoben. Die Ukraine das Recht, sich selb… [+646 chars]",,de,'Ukraine'
https://www.bild.de/regional/berlin/berlin-regional-politik-und-wirtschaft/robert-habeck-alte-kohlekraftwerke-im-winter-wieder-anschalten-84146128.bild.html,https://www.bild.de/regional/berlin/berlin-regional-politik-und-wirtschaft/robert-habeck-alte-kohlekraftwerke-im-winter-wieder-anschalten-84146128.bild.html,0,www.bild.de,Ganz neue Töne von Habeck! - Alte Kohlekraftwerke im Winter wieder anschalten,Überraschung bei Habecks Besuch in Brandenburg! Als Grüner will er bis 2030 aus der Braunkohle aussteigen. Doch als Wirtschaftsminister braucht er Reserven.,"https://images.bild.de/647896cb73ed0222d380c91b/98a9b7793e923f18dcc9a9c2f48cc67a,83dc1328?w=1280",2023-06-01T13:17:51Z,http://archive.md/20230601162020/https://www.bild.de/regional/berlin/berlin-regional-politik-und-wirtschaft/robert-habeck-alte-kohlekraftwerke-im-winter-wieder-anschalten-84146128.bild.html,Potsdam Überraschung bei Habecks Besuch im Braunkohle-Land Brandenburg! Als Grüner will Robert Habeck (53) bis 2030 aus der Braunkohle aussteigen. Doch als Wirtschaftsminister will er die schmutzigen… [+2691 chars],,de,'Erneuerbare Energien'
https://www.handelsblatt.com/unternehmen/energie/erneuerbare-energie-solar-start-up-nexwafe-sammelt-30-millionen-euro-ein/29167316.html,https://www.handelsblatt.com/unternehmen/energie/erneuerbare-energie-solar-start-up-nexwafe-sammelt-30-millionen-euro-ein/29167316.html,0,www.handelsblatt.com,Erneuerbare Energien: Solar-Start-up Nexwafe sammelt 30 Millionen Euro für den Bau seiner Fabrik ein,"Die Firma verspricht, die wichtigen Silizium-Wafer künftig ressourcenschonender und günstiger herzustellen. Nach Bitterfeld könnte das nächste Werk in Saudi-Arabien entstehen.",https://www.handelsblatt.com/images/nexwafe/29174118/2-format2003.jpg,2023-06-01T13:45:53Z,https://web.archive.org/web/20230601142443/https://www.handelsblatt.com/unternehmen/energie/erneuerbare-energie-solar-start-up-nexwafe-sammelt-30-millionen-euro-ein/29167316.html,"Düsseldorf Das Freiburger Solar-Start-up Nexwafe hat in seiner neuesten Finanzierungsrunde 30 Millionen Euro eingesammelt. Damit der Bau der angekündigten Solarfabrik in Bitterfeld vorangehen kann, s… [+4689 chars]",,de,'Erneuerbare Energien'
https://www.handelsblatt.com/politik/deutschland/erneuerbare-energien-strom-vom-kartoffelacker-energiebranche-sieht-hohes-potenzial-bei-agri-pv/29181186.html,https://www.handelsblatt.com/politik/deutschland/erneuerbare-energien-strom-vom-kartoffelacker-energiebranche-sieht-hohes-potenzial-bei-agri-pv/29181186.html,0,www.handelsblatt.com,Erneuerbare Energien: Strom vom Kartoffelacker: Energiebranche sieht hohes Potenzial bei Agri-PV,"Die parallele Nutzung von Land für die Strom- und die Agrarproduktion kann Konkurrenz um Flächen reduzieren. Die Energie- und Wasserwirtschaft sieht große Chancen, Landwirte fürchten Nachteile.",https://www.handelsblatt.com/images/solaranlage-auf-kuhweide-in-baden-wuerttemberg/29181556/2-format2003.jpg,2023-06-01T15:21:58Z,https://web.archive.org/web/20230601160808/https://www.handelsblatt.com/politik/deutschland/erneuerbare-energien-strom-vom-kartoffelacker-energiebranche-sieht-hohes-potenzial-bei-agri-pv/29181186.html,"Berlin Multifunktionale Sonnensegel, Photovoltaikanlagen, aufgeständert in sechs Meter Höhe oder vertikal installiert neben grasenden Kühen und Schafen: In der zeitgleichen Nutzung von Flächen für di… [+6199 chars]",,de,'Erneuerbare Energien'
https://www.tagesspiegel.de/politik/briefe-an-kabinettskollegen-lindner-fordert-ministerien-zum-sparen-auf-9913304.html,https://www.tagesspiegel.de/politik/briefe-an-kabinettskollegen-lindner-fordert-ministerien-zum-sparen-auf-9913304.html,0,www.tagesspiegel.de,Briefe an Kabinettskollegen: Lindner fordert Ministerien zum Sparen auf,"Seit Monaten legt der Finanzminister keine Eckwerte für den Bundeshaushalt vor, nun hat er aber Sparbriefe an seine Minister-Kollegen verschickt. Die Grünen sind empört.",https://www.tagesspiegel.de/images/germany-politics-migrants2/alternates/BASE_16_9_W1400/germany-politics-migrants.jpeg,2023-06-01T15:34:24Z,https://web.archive.org/web/20230601155625/https://www.tagesspiegel.de/politik/briefe-an-kabinettskollegen-lindner-fordert-ministerien-zum-sparen-auf-9913304.html,"Im Haushaltsstreit erhöht Finanzminister Christian Lindner (FDP) den Druck auf die anderen Ressorts. Man habe die Ministerien in Briefen unterrichtet, welche Haushaltsmittel ihnen jeweils zur Verfügu… [+3682 chars]",,de,'Sparen'
https://consent.google.com/ml?continue=https://news.google.com/rss/articles/CBMid2h0dHBzOi8vd3d3LnRhZ2Vzc3BpZWdlbC5kZS9wb2xpdGlrL2JyaWVmZS1hbi1rYWJpbmV0dHNrb2xsZWdlbi1saW5kbmVyLWZvcmRlcnQtbWluaXN0ZXJpZW4tenVtLXNwYXJlbi1hdWYtOTkxMzMwNC5odG1s0gEA?oc%3D5&gl=FR&hl=en-US&cm=2&pc=n&src=1,https://consent.google.com/ml?continue=https://news.google.com/rss/articles/CBMid2h0dHBzOi8vd3d3LnRhZ2Vzc3BpZWdlbC5kZS9wb2xpdGlrL2JyaWVmZS1hbi1rYWJpbmV0dHNrb2xsZWdlbi1saW5kbmVyLWZvcmRlcnQtbWluaXN0ZXJpZW4tenVtLXNwYXJlbi1hdWYtOTkxMzMwNC5odG1s0gEA?oc%3D5&gl=FR&hl=en-US&cm=2&pc=n&src=1,0,consent.google.com,Briefe an Kabinettskollegen: Lindner fordert Ministerien zum Sparen auf - Tagesspiegel,"<ol><li>Briefe an Kabinettskollegen: Lindner fordert Ministerien zum Sparen auf  Tagesspiegel
</li><li>Lindner verschickt Briefe an Ministerien – bis auf eines sollen alle sparen  WEB.DE News
</li><li>Lücken im Haushalt 2024: Lindner verschickt Sparvorgaben…",,2023-06-01T15:34:24Z,,"We use cookies and data to<ul><li>Deliver and maintain Google services</li><li>Track outages and protect against spam, fraud, and abuse</li><li>Measure audience engagement and site statistics to unde… [+1131 chars]",,de,'Sparen'
https://ooe.orf.at/stories/3209996/,https://ooe.orf.at/stories/3209996/,0,ooe.orf.at,Erhöhung bei Kindergartengebühren wird ausgesetzt,"Für Kindergärten, Krabbelstuben und den Hortbereich soll es im kommenden Betreuungsjahr keine Gebühren-Erhöhung für die Elternbeiträge geben. Das Land will einmalig auf die Inflationsanpassung verzichten.",https://ibs.orf.at/ooe?image=https%3A%2F%2Foekastatic.orf.at%2Fmims%2F2022%2F26%2F42%2Fcrops%2Fw%3D1200%2Ch%3D627%2Cq%3D75%2F1395546_master_501542_220419_ooeh_mangel_an_kindergartenpaedagoginnen_00_00_00_00.jpg%3Fs%3D9acf409588f59fabbaf75ffce83f90763968bf17,2023-06-01T16:46:54Z,https://web.archive.org/web/20230601172200/https://ooe.orf.at/stories/3209996/,"Eltern eines Kindergartenkindes würden sich bis zu 130 Euro im Kindergartenjahr 2023/24 für den Nachmittags-Elternbeitrag sparen, heißt es in einer Aussendung von Landeshauptmann Thomas Stelzer (ÖVP)… [+848 chars]",,de,'Sparen'
https://www.faz.net/aktuell/politik/ukraine-liveticker-usa-kauft-gepard-luftabwehrsysteme-fuer-die-ukraine-faz-18495964.html,https://www.faz.net/aktuell/politik/ukraine-liveticker-usa-kauft-gepard-luftabwehrsysteme-fuer-die-ukraine-faz-18495964.html,0,www.faz.net,Ukraine-Liveblog: USA kauft Gepard-Luftabwehrsysteme für die Ukraine,Russland spricht von versuchter ukrainischer „Invasion“ in Grenzregion +++ Baerbock: Kein NATO-Beitritt der Ukraine „mitten im Krieg“ +++ Russland verärgert über Gipfeltreffen in Moldau +++ Selenskyj in Bulboaca eingetroffen +++ alle Entwicklungen im Liveblog,https://media0.faz.net/ppmedia/aktuell/politik/647085548/1.8935332/facebook_teaser/ein-flakpanzer-vom-typ-gepard.jpg,2023-06-01T16:53:15Z,https://web.archive.org/web/20230601174128/https://www.faz.net/aktuell/politik/ukraine-liveticker-usa-kauft-gepard-luftabwehrsysteme-fuer-die-ukraine-faz-18495964.html,"Angesprochen auf den Drohnenangriff auf russischem Boden am Dienstag hat NATO-Generalsekretär Jens Stoltenberg das Selbstverteidigungsrecht der Ukraine hervorgehoben. Die Ukraine das Recht, sich selb… [+646 chars]",,de,'Ukraine'
https://www.n-tv.de/politik/Strom-aus-erneuerbaren-Energien-erreicht-Rekordwert-article24161625.html,https://www.n-tv.de/politik/Strom-aus-erneuerbaren-Energien-erreicht-Rekordwert-article24161625.html,0,www.n-tv.de,Sonnenreicher Mai: Strom aus erneuerbaren Energien erreicht Rekordwert,Wind- und Solarkraft haben im vergangenen Monat mehr zum deutschen Strommix beigetragen als Kohle und Gas. An manchen Tagen führt die Ergiebigkeit der erneuerbaren Energiequellen sogar zu einem Überschuss an Energie - und zu negativen Preisen.,https://bilder3.n-tv.de/img/Bilder_dpa_Import/crop24141630/2071322144-cImg_16_9-w1200/Die-Sonne-geht-hinter-Windradern-auf.jpg,2023-06-01T17:13:17Z,https://web.archive.org/web/20230601172421/https://www.n-tv.de/politik/Strom-aus-erneuerbaren-Energien-erreicht-Rekordwert-article24161625.html,Wind- und Solarkraft haben im vergangenen Monat mehr zum deutschen Strommix beigetragen als Kohle und Gas. An manchen Tagen führt die Ergiebigkeit der erneuerbaren Energiequellen sogar zu einem Übers… [+2341 chars],,de,'Erneuerbare Energien'
https://www.morgenpost.de/politik/ausland/article238562583/Aussenministerin-betont-Sicherheitskooperation-im-Ostseeraum.html,https://www.morgenpost.de/politik/ausland/article238562583/Aussenministerin-betont-Sicherheitskooperation-im-Ostseeraum.html,0,www.morgenpost.de,Ukraine-Krieg & Energie: Außenministerin betont Sicherheitskooperation im Ostseeraum,Moskau bestimmt auch das Treffen der Ostseeanrainer in der Hansestadt Wismar. Es geht es um verstärkte Zusammenarbeit bei der Energiewende - und einen gemeinsamen Schatz.,https://img.morgenpost.de/img/ausland/crop238562581/1482607290-w820-cv16_9-q85/Baerbock-und-Geywitz.jpg,2023-06-01T18:13:40Z,https://web.archive.org/web/20230601191200/https://www.morgenpost.de/politik/ausland/article238562583/Aussenministerin-betont-Sicherheitskooperation-im-Ostseeraum.html,"Wismar. Außenministerin Annalena Baerbock hat angesichts des russischen Angriffs auf die Ukraine die Bedeutung einer engen Zusammenarbeit der Ostseeanrainer hervorgehoben. 
Die Sicherheit eines jede… [+4169 chars]",,de,'Ukraine'
https://www.stern.de/politik/ausland/ukraine-krieg---energie--aussenministerin-betont-sicherheitskooperation-im-ostseeraum-33521478.html,https://www.stern.de/politik/ausland/ukraine-krieg---energie--aussenministerin-betont-sicherheitskooperation-im-ostseeraum-33521478.html,0,www.stern.de,Ukraine-Krieg & Energie: Außenministerin betont Sicherheitskooperation im Ostseeraum,Moskau bestimmt auch das Treffen der Ostseeanrainer in der Hansestadt Wismar. Es geht es um verstärkte Zusammenarbeit bei der Energiewende - und einen gemeinsamen Schatz.,https://image.stern.de/33521480/t/L6/v1/w1440/r1.7778/-/01--urnnewsmldpacom2009010123060199909667v3w800h600l580t218r1724b1370jpeg---4c2dbf8790debfde.jpg,2023-06-01T18:13:40Z,https://web.archive.org/web/20230601193932/https://www.stern.de/politik/ausland/ukraine-krieg---energie--aussenministerin-betont-sicherheitskooperation-im-ostseeraum-33521478.html,"Moskau bestimmt auch das Treffen der Ostseeanrainer in der Hansestadt Wismar. Es geht es um verstärkte Zusammenarbeit bei der Energiewende - und einen gemeinsamen Schatz.
Außenministerin Annalena Ba… [+4218 chars]",,de,'Erneuerbare Energien'
https://www.tagesspiegel.de/politik/frankfurt-an-der-oder-razzia-wegen-anschlagen-auf-nord-stream-pipelines-9914654.html,https://www.tagesspiegel.de/politik/frankfurt-an-der-oder-razzia-wegen-anschlagen-auf-nord-stream-pipelines-9914654.html,0,www.tagesspiegel.de,Frankfurt an der Oder : Razzia wegen Anschlägen auf Nord-Stream-Pipelines,"In Brandenburg ist die Wohnung einer Frau durchsucht worden, die offenbar Zeugin der Anschläge auf die Nordstream-Pipelines in der Ostsee ist. Ermittler nahmen auch eine DNA-Probe ihres Kindes.",https://www.tagesspiegel.de/images/polizeiabzeichen-brandenburg/alternates/BASE_16_9_W1400/polizeiabzeichen-brandenburg.jpeg,2023-06-01T18:46:20Z,https://web.archive.org/web/20230601191013/https://www.tagesspiegel.de/politik/frankfurt-an-der-oder-razzia-wegen-anschlagen-auf-nord-stream-pipelines-9914654.html,Im brandenburgischen Frankfurt an der Oder hat es laut Medienberichten eine Razzia in Zusammenhang mit dem Anschlag auf die Nordstream-Pipelines in der Ostsee gegeben. Das Bundeskriminalamt habe eine… [+1879 chars],,de,'Nordstream'
https://consent.google.com/ml?continue=https://news.google.com/rss/articles/CBMieGh0dHBzOi8vd3d3LnRhZ2Vzc3BpZWdlbC5kZS9wb2xpdGlrL2ZyYW5rZnVydC1hbi1kZXItb2Rlci1yYXp6aWEtd2VnZW4tYW5zY2hsYWdlbi1hdWYtbm9yZC1zdHJlYW0tcGlwZWxpbmVzLTk5MTQ2NTQuaHRtbNIBAA?oc%3D5&gl=FR&hl=en-US&cm=2&pc=n&src=1,https://consent.google.com/ml?continue=https://news.google.com/rss/articles/CBMieGh0dHBzOi8vd3d3LnRhZ2Vzc3BpZWdlbC5kZS9wb2xpdGlrL2ZyYW5rZnVydC1hbi1kZXItb2Rlci1yYXp6aWEtd2VnZW4tYW5zY2hsYWdlbi1hdWYtbm9yZC1zdHJlYW0tcGlwZWxpbmVzLTk5MTQ2NTQuaHRtbNIBAA?oc%3D5&gl=FR&hl=en-US&cm=2&pc=n&src=1,0,consent.google.com,Durchsuchung in Frankfurt an der Oder : Razzia wegen Anschlägen auf Nord-Stream-Pipelines - Tagesspiegel,"<ol><li>Durchsuchung in Frankfurt an der Oder : Razzia wegen Anschlägen auf Nord-Stream-Pipelines  Tagesspiegel
</li><li>Anschlag auf Pipelines: Durchsuchung in Deutschland  tagesschau.de
</li><li>Razzia in Frankfurt/Oder: Polizei sucht Nordstream-Bomber in…",,2023-06-01T18:46:20Z,,"We use cookies and data to<ul><li>Deliver and maintain Google services</li><li>Track outages and protect against spam, fraud, and abuse</li><li>Measure audience engagement and site statistics to unde… [+1131 chars]",,de,'Nordstream'
https://www.n-tv.de/politik/Deutschland-will-Ostsee-Munition-an-den-Kragen-article24162659.html,https://www.n-tv.de/politik/Deutschland-will-Ostsee-Munition-an-den-Kragen-article24162659.html,0,www.n-tv.de,Anrainer-Treffen ohne Russland: Deutschland will Ostsee-Munition an den Kragen,Moskau bestimmt auch das Treffen der Ostseeanrainer in der Hansestadt Wismar. Russland selbst ist in dem Format aber nicht mehr dabei. Es geht bei den Besprechungen der Staaten um verstärkte Zusammenarbeit bei der Energiewende - und die Entsorgung von Munitio…,https://bilder2.n-tv.de/img/incoming/crop24162665/7611324349-cImg_16_9-w1200/411423142.jpg,2023-06-01T20:11:30Z,https://web.archive.org/web/20230601215318/https://www.n-tv.de/politik/Deutschland-will-Ostsee-Munition-an-den-Kragen-article24162659.html,Moskau bestimmt auch das Treffen der Ostseeanrainer in der Hansestadt Wismar. Russland selbst ist in dem Format aber nicht mehr dabei. Es geht bei den Besprechungen der Staaten um verstärkte Zusammen… [+4238 chars],,de,'Erneuerbare Energien'
https://www.telepolis.de/features/Militaerisch-Industrieller-Exzess-Was-Kriege-wie-in-der-Ukraine-wirklich-kosten-9159234.html,https://www.telepolis.de/features/Militaerisch-Industrieller-Exzess-Was-Kriege-wie-in-der-Ukraine-wirklich-kosten-9159234.html,0,www.telepolis.de,Militärisch-Industrieller Exzess: Was Kriege wie in der Ukraine wirklich kosten,Der Stellvertreterkrieg vernichtet Menschen und Geld. Er stellt Geopolitik über Leben. Über die wahre Dimension der Kosten und ihre Profiteure.,https://heise.cloudimg.io/bound/1200x1200/q85.png-lossy-85.webp-lossy-85.foil1/_www-heise-de_/imgs/18/4/2/4/0/9/2/7/Soldat_Schuetzengraben-6ec4cd9163e5900a.jpeg,2023-06-01T22:00:00Z,https://web.archive.org/web/20230601230250/https://www.telepolis.de/features/Militaerisch-Industrieller-Exzess-Was-Kriege-wie-in-der-Ukraine-wirklich-kosten-9159234.html,"Ukrainische Einheit bedient eine 122-mm-Haubitze. Bild: armyinform.ua
Der Stellvertreterkrieg vernichtet Menschen und Geld. Er stellt Geopolitik über Leben. Über die wahre Dimension der Kosten und i… [+4376 chars]",,de,'Kosten'
https://www.bild.de/sport/mehr-sport/boxen/boxen-von-wegen-fury-kampf-anthony-joshua-hat-vor-dem-saudi-turnier-schiss-84148482.bild.html,https://www.bild.de/sport/mehr-sport/boxen/boxen-von-wegen-fury-kampf-anthony-joshua-hat-vor-dem-saudi-turnier-schiss-84148482.bild.html,0,www.bild.de,Von wegen Kampf mit Fury! - Anthony Joshua hat vor dem Saudi-Turnier Schiss,Im Streben um ganz viel Saudi-Kohle will Anthony Joshua nichts riskieren.Foto: picture alliance / empics,"https://images.bild.de/64789bc7475a4056cdd1c49b/a99178c16d1f2a5117702ed1dcfe922d,d6771ff5?w=1280",2023-06-02T00:45:39Z,https://web.archive.org/web/20230602144324/https://www.bild.de/sport/mehr-sport/boxen/boxen-von-wegen-fury-kampf-anthony-joshua-hat-vor-dem-saudi-turnier-schiss-84148482.bild.html,"++ Im Newsletter Fighting-Insider enthüllen die BILD-Reporter jeden Donnerstag Geheimnisse aus der Kampfsport-Welt und bringen Euch mit den spannendsten News auf den neusten Stand. ++
Lieber Leser,… [+2791 chars]",,de,'Kohle'
https://www.handelsblatt.com/finanzen/geldpolitik/zinspolitik-irlands-notenbankchef-erwartet-zinsanhebung-auf-naechster-ezb-sitzung/29183586.html,https://www.handelsblatt.com/finanzen/geldpolitik/zinspolitik-irlands-notenbankchef-erwartet-zinsanhebung-auf-naechster-ezb-sitzung/29183586.html,0,www.handelsblatt.com,Zinspolitik: Irlands Notenbankchef erwartet Zinsanhebung auf nächster EZB-Sitzung,"Die Inflation gehe zwar zurück, der Preisdruck bleibe aber hoch, sagt Makhlouf. Die EZB dürfe deshalb nicht vor weiteren Zinserhöhungen zurückschrecken – vorerst.",https://www.handelsblatt.com/images/gabriel-makhlouf/29184352/3-format2003.jpg,2023-06-02T06:45:00Z,https://web.archive.org/web/20230602124035/https://www.handelsblatt.com/finanzen/geldpolitik/zinspolitik-irlands-notenbankchef-erwartet-zinsanhebung-auf-naechster-ezb-sitzung/29183586.html,Frankfurt Irlands Notenbankchef Gabriel Makhlouf rechnet angesichts des anhaltenden Preisdrucks im Euro-Raum mit einer weiteren Zinsanhebung der Europäischen Zentralbank (EZB) in zwei Wochen.Zwar sei… [+2020 chars],,de,'Inflation'
https://www.handelsblatt.com/politik/international/preise-warum-die-inflation-in-spanien-so-niedrig-ist/29182730.html,https://www.handelsblatt.com/politik/international/preise-warum-die-inflation-in-spanien-so-niedrig-ist/29182730.html,0,www.handelsblatt.com,Preise: Warum die Inflation in Spanien so niedrig ist,"Die Teuerung in Spanien lag im Mai bei nur 3,2 Prozent. Grund sind vor allem niedrige Energiepreise, viel Strom aus Erneuerbaren – und eine eigenwillige Berechnung.",https://www.handelsblatt.com/images/fischverkaeuferin-in-barcelona/29183552/2-format2003.jpg,2023-06-02T07:08:15Z,https://web.archive.org/web/20230602084008/https://www.handelsblatt.com/politik/international/preise-warum-die-inflation-in-spanien-so-niedrig-ist/29182730.html,"Madrid Viele EU-Länder dürften neidisch auf Spanien schauen. Denn die Inflation ist dort inzwischen deutlich niedriger als im EU-Schnitt und lag im Mai gerade einmal bei 3,2 Prozent. In Deutschland w… [+3525 chars]",,de,'Teuer'
