index,url,valid,domain,title,description,image,published,archive,content,quote,language,keyword
https://www.faz.net/aktuell/politik/ausland/gefangenenaustausch-putin-mit-rotem-teppich-fuer-auftragsmoerder-19895050.html,https://www.faz.net/aktuell/politik/ausland/gefangenenaustausch-putin-mit-rotem-teppich-fuer-auftragsmoerder-19895050.html,0,www.faz.net,Gefangenenaustausch: Putins roter Teppich für einen Auftragsmörder,Putin empfängt die Freigelassenen feierlich und dankt den Geheimdienstmitarbeitern unter ihnen für ihre Treue. Er dürfte mit dem Austausch vor allem eines zeigen wollen: dass er seinen Agenten beisteht.,https://media0.faz.net/ppmedia/aktuell/politik/4110988483/1.9894846/facebook_teaser/der-russische-praesident.jpg,2024-08-02T11:53:45Z,,"Zum Begrüßungskomitee gehören zudem Verteidigungsminister Andrej Beloussow, der Chef des Auslandsgeheimdienstes SWR Sergej Naryschkin und der Direktor des Inlandsgeheimdienstes FSB Alexandr Bortnikow… [+7771 chars]",,de,'Putin'
https://www.sueddeutsche.de/bayern/bayern-windraeder-neuoetting-buergerbegehren-lux.TDtaGQKtYeFVy8aJebjmah,https://www.sueddeutsche.de/bayern/bayern-windraeder-neuoetting-buergerbegehren-lux.TDtaGQKtYeFVy8aJebjmah,0,www.sueddeutsche.de,Erneuerbare Energien: Neuötting lehnt Bürgerbegehen zu Windrädern ab,Bürgerentscheide haben bisher den Bau von Windkraftanlagen im Staatswald erschwert. Vor allem bei Altötting löst das Wirbel aus. Nun gibt es eine neue Regelung – von der Neuötting nun Gebrauch macht.,https://www.sueddeutsche.de/2024/08/02/2b43da1b-fc4d-4bc9-ab7b-6389421f9502.jpeg?q=60&fm=webp&width=1200&rect=0%2C359%2C3000%2C1688,2024-08-02T13:13:28Z,,"Wie der Geschäftsleiter der Stadt Neuötting, Erich Nachreiner, nun erläuterte, basierte die Ablehnung auf der Aufhebung der sogenannten Kommunalklausel durch die Bayerischen Staatsforsten im Juni. Zu… [+1846 chars]",,de,'Erneuerbare Energien'
https://www.sueddeutsche.de/politik/russland-putin-usa-gefangenenaustausch-tiergarten-moerder-lux.Rmt1fyr76syA3cK1GrVsjP,https://www.sueddeutsche.de/politik/russland-putin-usa-gefangenenaustausch-tiergarten-moerder-lux.Rmt1fyr76syA3cK1GrVsjP,0,www.sueddeutsche.de,Gefangenenaustausch : Triumph für Putin,"Russlands Präsident hat nicht nur die Freilassung des Tiergarten-Mörders durchgesetzt. Der Gefangenenaustausch zeigt der ganzen Welt, wie flexibel die USA im Umgang mit ihm sein können.",https://www.sueddeutsche.de/2024/08/02/51283301-1098-4b86-a70a-10c9b12273de.jpeg?q=60&fm=webp&width=1200&rect=508%2C379%2C3466%2C1950,2024-08-02T13:37:52Z,,"2. August 2024, 15:37 UhrLesezeit: 4 min
Russlands Präsident hat nicht nur die Freilassung des Tiergarten-Mörders durchgesetzt. Der Gefangenenaustausch zeigt der ganzen Welt, wie flexibel die USA im… [+618 chars]",,de,'Putin'
https://www.bild.de/politik/ausland-und-internationales/nawalny-vertrauter-zu-gefangenen-austausch-heute-ist-fuer-uns-alle-ein-tag-der-freude-66ac310308645b358aebc61f,https://www.bild.de/politik/ausland-und-internationales/nawalny-vertrauter-zu-gefangenen-austausch-heute-ist-fuer-uns-alle-ein-tag-der-freude-66ac310308645b358aebc61f,0,www.bild.de,Nawalny-Vertrauter zu BILD - „Heute ist für uns alle ein Tag der Freude“,Am Donnerstag um 22.37 Uhr konnten die Freunde und Weggefährten von den befreiten Geiseln von Putin endlich aufatmen.,"https://images.bild.de/66ac310308645b358aebc61f/7905d46fb2943a86fd773eafe55d9e75,2ca3962e?w=1280",2024-08-02T13:38:23Z,,"Sie haben seit Jahren auf die erlösende Nachricht gewartet, am Donnerstag um 22.37 Uhr konnten die Freunde und Weggefährten der befreiten Geiseln von Wladimir Putin endlich aufatmen: Der Flieger mit … [+2628 chars]",,de,'Putin'
https://www.welt.de/politik/ausland/video252821832/Gefangenenaustausch-Begriff-Austausch-ist-verharmlosend-Es-geht-ums-Freipressen-von-Verbrechern.html,https://www.welt.de/politik/ausland/video252821832/Gefangenenaustausch-Begriff-Austausch-ist-verharmlosend-Es-geht-ums-Freipressen-von-Verbrechern.html,0,www.welt.de,„Begriff ‚Austausch‘ ist verharmlosend. Es geht ums Freipressen von Verbrechern“,"Am Donnerstag tauschten Russland, Belarus und mehrere westliche Länder auf dem Flughafen von Ankara insgesamt 26 Gefangene aus. General a.D. Klaus Wittmann sagt bei WELT TV, Putin setze auf Erpressbarkeit im Westen.",https://img.welt.de/img/bildergalerien/mobile252822146/2141356727-ci16x9-w1200/Gefangenenaustausch-US-amerikanische-Gefangene-kommen-in-USA-an.jpg,2024-08-02T13:53:32Z,,"Die WELT als ePaper: Die vollständige Ausgabe steht Ihnen bereits am Vorabend zur Verfügung so sind Sie immer hochaktuell informiert. Weitere Informationen: http://epaper.welt.de 
 Der Kurz-Link die… [+49 chars]",,de,'Russland'
https://www.welt.de/politik/ausland/video252818414/Gefangenenaustausch-Gershkovich-soll-Putin-kurz-vor-Entlassung-um-ein-Interview-gebeten-haben.html,https://www.welt.de/politik/ausland/video252818414/Gefangenenaustausch-Gershkovich-soll-Putin-kurz-vor-Entlassung-um-ein-Interview-gebeten-haben.html,0,www.welt.de,Gershkovich soll Putin kurz vor Entlassung um ein Interview gebeten haben,Der aus Russland freigekommene US-Journalist Evan Gershkovich hat den russischen Präsidenten Wladimir Putin einem Bericht zufolge kurz vor seiner Entlassung um ein Interview gebeten. Max Hermes berichtet aus Washington.,https://img.welt.de/img/politik/ausland/mobile252818590/0791355037-ci16x9-w1200/Russia-Prisoner-Swap.jpg,2024-08-02T13:54:39Z,,"Die WELT als ePaper: Die vollständige Ausgabe steht Ihnen bereits am Vorabend zur Verfügung so sind Sie immer hochaktuell informiert. Weitere Informationen: http://epaper.welt.de 
 Der Kurz-Link die… [+49 chars]",,de,'Putin'
https://www.morgenpost.de/politik/article406934071/freiheit-fuer-putins-killer-bitterer-nachgeschmack-bleibt.html,https://www.morgenpost.de/politik/article406934071/freiheit-fuer-putins-killer-bitterer-nachgeschmack-bleibt.html,0,www.morgenpost.de,Freiheit für Putins Killer: Bitterer Nachgeschmack bleibt,Auch wenn der große Gefangenenaustausch zwischen Russland und dem Westen richtig gewesen sein mag: Er darf auf keinen Fall Schule machen.,https://img.sparknews.funkemedien.de/406934270/406934270_1722607016_v16_9_1600.jpeg,2024-08-02T13:56:53Z,,"Berlin. Auch wenn der große Gefangenenaustausch zwischen Russland und dem Westen richtig gewesen sein mag: Er darf auf keinen Fall Schule machen. 
Selten lässt einen eine politische Entscheidung der… [+4129 chars]",,de,'Putin'
https://www.morgenpost.de/politik/article406932005/waechst-die-chance-auf-frieden-in-der-ukraine-herr-masala.html,https://www.morgenpost.de/politik/article406932005/waechst-die-chance-auf-frieden-in-der-ukraine-herr-masala.html,0,www.morgenpost.de,"Wächst die Chance auf Frieden in der Ukraine, Herr Masala?","Der Militärexperte über die Bedeutung des Gefangenenaustauschs und was möglich ist, wenn Putin und der Westen ähnliche Interessen haben.",https://img.sparknews.funkemedien.de/406931905/406931905_1722609256_v16_9_1600.jpeg,2024-08-02T14:27:20Z,,"Berlin. Der Militärexperte über die Bedeutung des Gefangenenaustauschs und was möglich ist, wenn Putin und der Westen ähnliche Interessen haben.",,de,'Putin'
https://www.welt.de/wirtschaft/article252824028/Habeck-legt-Vorschlaege-fuer-kuenftige-Stromversorgung-vor.html,https://www.welt.de/wirtschaft/article252824028/Habeck-legt-Vorschlaege-fuer-kuenftige-Stromversorgung-vor.html,0,www.welt.de,Habeck legt Vorschläge für künftige Stromversorgung vor,"Mehr Erneuerbare Energien, „flexible Kraftwerke“, Honorierungen für Stromanbieter – das Wirtschaftsministerium will das Stromsystem in Deutschland reformieren. Dazu gibt es nun ein Papier mit verschiedenen Modellen.",https://img.welt.de/img/bildergalerien/mobile252823700/3607934077-ci16x9-w1200/IPCEI-Wasserstoffleitungsprojekte.jpg,2024-08-02T14:30:39Z,,"Mehr Erneuerbare Energien, flexible Kraftwerke, Honorierungen für Stromanbieter das Wirtschaftsministerium will das Stromsystem in Deutschland reformieren. Dazu gibt es nun ein Papier mit verschieden… [+2099 chars]",,de,'Erneuerbare Energien'
https://www.nzz.ch/sport/olympische-spiele/in-der-debatte-um-die-boxerin-imane-khelif-geht-es-nur-vordergruendig-um-intersexualitaet-ein-boxverband-macht-damit-stimmung-gegen-das-iok-und-fuer-russland-ld.1842085,https://www.nzz.ch/sport/olympische-spiele/in-der-debatte-um-die-boxerin-imane-khelif-geht-es-nur-vordergruendig-um-intersexualitaet-ein-boxverband-macht-damit-stimmung-gegen-das-iok-und-fuer-russland-ld.1842085,0,www.nzz.ch,In der Debatte um die Boxerin Imane Khelif geht es nur vordergründig um Intersexualität – ein Boxverband macht damit Stimmung gegen das IOK und für Russland,Der Boxverband IBA ist im Sport ein Paria und ist vom Internationalen Olympischen Komitee ausgeschlossen. In Paris sorgen die IBA und ihr russischer Präsident trotzdem für Wirbel.,"https://img.nzz.ch/2024/08/02/d5fcf42e-a369-4fe6-a6bb-33dde5782c09.jpeg?width=1200&height=674&fit=bounds&quality=75&auto=webp&crop=3448,1939,x0,y212&wmark=nzz",2024-08-02T14:33:49Z,,"Handelt es sich bei Imane Khelif um eine intersexuelle Athletin? Der Boxverband IBA liefert für diese Behauptung keine eindeutigen Beweise.
Auf den ersten Blick scheint das Verdikt klar. Da verprüge… [+4309 chars]",,de,'Putin'
https://www.stern.de/politik/ausland/gefangenen-deal--usa-und-russland-bleiben-nach-austausch-auf-konfrontation-34942906.html,https://www.stern.de/politik/ausland/gefangenen-deal--usa-und-russland-bleiben-nach-austausch-auf-konfrontation-34942906.html,0,www.stern.de,Gefangenen-Deal: USA und Russland bleiben nach Austausch auf Konfrontation,Der Gefangenaustausch zwischen den USA und Russland wirft neue Fragen auf. Was bedeutet der Deal für die US-Wahl und den Krieg in der Ukraine? Folgen weitere Verhandlungen?,https://image.stern.de/34942908/t/0B/v1/w1440/r1.7778/-/02--b6vmka6fujv19axw800h600jpeg---589c84a315003b41.jpg,2024-08-02T14:41:13Z,,"Der Gefangenaustausch zwischen den USA und Russland wirft neue Fragen auf. Was bedeutet der Deal für die US-Wahl und den Krieg in der Ukraine? Folgen weitere Verhandlungen?
Es sind ähnliche Bilder a… [+5998 chars]",,de,'Ukraine'
https://www.zeit.de/news/2024-08/02/usa-und-russland-bleiben-nach-austausch-auf-konfrontation,https://www.zeit.de/news/2024-08/02/usa-und-russland-bleiben-nach-austausch-auf-konfrontation,0,www.zeit.de,Gefangenen-Deal: USA und Russland bleiben nach Austausch auf Konfrontation,Hier finden Sie Informationen zu dem Thema „Gefangenen-Deal“. Lesen Sie jetzt „USA und Russland bleiben nach Austausch auf Konfrontation“.,https://img.zeit.de/news/2024-08/02/usa-und-russland-bleiben-nach-austausch-auf-konfrontation-image-group/wide__1300x731,2024-08-02T14:41:13Z,,"Es sind ähnliche Bilder auf den Flughäfen in Köln, Washington und Moskau, aber die Vorzeichen sind andere: Mehr als 20 Inhaftierte, darunter fünf Deutsche, sind nach dem größten Gefangenenaustausch s… [+6733 chars]",,de,'Russland'
https://www.tagesspiegel.de/internationales/gefangenen-deal-usa-und-russland-bleiben-nach-austausch-auf-konfrontation-12136124.html,https://www.tagesspiegel.de/internationales/gefangenen-deal-usa-und-russland-bleiben-nach-austausch-auf-konfrontation-12136124.html,0,www.tagesspiegel.de,Gefangenen-Deal: USA und Russland bleiben nach Austausch auf Konfrontation,Der Gefangenaustausch zwischen den USA und Russland wirft neue Fragen auf. Was bedeutet der Deal für die US-Wahl und den Krieg in der Ukraine? Folgen weitere Verhandlungen?,https://www.tagesspiegel.de/images/12136121/alternates/BASE_16_9_W1400/1722609733000/gefangenenaustausch-russische-gefangene-kommen-in-moskau-an.jpeg,2024-08-02T14:42:13Z,,"Es sind ähnliche Bilder auf den Flughäfen in Köln, Washington und Moskau, aber die Vorzeichen sind andere: Mehr als 20 Inhaftierte, darunter fünf Deutsche, sind nach dem größten Gefangenenaustausch s… [+5897 chars]",,de,'Putin'
https://www.nzz.ch/meinung/geiselnahme-im-geheimdienststaat-ld.1842115,https://www.nzz.ch/meinung/geiselnahme-im-geheimdienststaat-ld.1842115,0,www.nzz.ch,KOMMENTAR - Geiselnahme im Geheimdienststaat,"Der Gefangenentausch mit Russland zeigt, wie sehr das Land zu einem Unrechtsstaat geworden ist. Wer nach Russland reist oder dort arbeitet, setzt sich dem Risiko aus, als Geisel genommen zu werden.","https://img.nzz.ch/2024/08/02/22e4efea-d390-4904-95c8-2db3af312cb8.jpeg?width=1200&height=675&fit=bounds&quality=75&auto=webp&crop=1509,849,x0,y60&wmark=nzz",2024-08-02T14:56:40Z,,"Der amerikanische Korrespondent Evan Gershkovich wurde am Donnerstag in Moskau zu einem Flugzeug gebracht, das ihn in die Türkei ausflog.
Die Freilassung des Russland-Korrespondenten des «Wall Stree… [+4032 chars]",,de,'Russland'
https://www.dw.com/de/deutschland-tritt-schutzmission-an-s%C3%BCdkoreas-grenze-bei/a-69840682,https://www.dw.com/de/deutschland-tritt-schutzmission-an-s%C3%BCdkoreas-grenze-bei/a-69840682,0,www.dw.com,Deutschland tritt Schutzmission an Südkoreas Grenze bei,"Bundesverteidigungsminister Pistorius spricht von einem Beitrag zur ""Stabilität auf der koreanischen Halbinsel"". Das United Nations Command überwacht seit 1953 den Waffenstillstand zwischen Süd- und Nordkorea. Deutschland ist der internationalen Militärmissio…",https://static.dw.com/image/69836484_6.jpg,2024-08-02T14:57:00Z,,Deutschland ist der internationalen Militärmission zur Sicherung des Waffenstillstands zwischen Süd- und Nordkorea beigetreten. Deutschlands Mitgliedschaft im United Nations Command (UNC) wurde mit e… [+2570 chars],,de,'Waffen'
https://www.tagesspiegel.de/internationales/gefangenenaustausch-mit-russland-wer-ist-putins-spionenpaar-12135380.html,https://www.tagesspiegel.de/internationales/gefangenenaustausch-mit-russland-wer-ist-putins-spionenpaar-12135380.html,0,www.tagesspiegel.de,Gefangenenaustausch mit Russland: Wer ist Putins Spionenpaar?,"Am Mittwoch saßen Artjom Dulzew and Anna Dulzewa im Gefängnis, am Donnerstag wurden sie von Putin feierlich empfangen. Das Paar lebte jahrelang unter falscher Identität in Nato-Ländern. Wer sind sie?",https://www.tagesspiegel.de/images/12135749/alternates/BASE_16_9_W1400/1722607558000/president-putin-greets-russians-returning-to-moscow-after-prisoner-swap.jpeg,2024-08-02T15:03:47Z,,Maria Rosa Mayer Muños und Ludwig Gisch waren bei ihren Nachbarn beliebt. In das pastellfarbene Haus mit breitem Holztor dahinter ein kleiner Garten mit Sonnenschirm auf der Terrasse in einem Vorort … [+80 chars],,de,'Putin'
https://www.faz.net/aktuell/politik/ukraine/kommentar-zum-gefangenenaustausch-olaf-scholz-pakt-mit-dem-teufel-19896177.html,https://www.faz.net/aktuell/politik/ukraine/kommentar-zum-gefangenenaustausch-olaf-scholz-pakt-mit-dem-teufel-19896177.html,0,www.faz.net,Kommentar: Ein Pakt mit dem Teufel im Namen der Menschlichkeit,"Der Kanzler ist sich sicher, dass der Gefangenenaustausch richtig war. Doch wie will er nun verhindern, dass Putin auch Deutschland weiter erpresst?",https://media1.faz.net/ppmedia/aktuell/politik/3194703683/1.9896173/facebook_teaser/bundeskanzler-olaf-scholz-am.jpg,2024-08-02T15:06:21Z,,"Warum aber hatte die Bundesregierung sich die Zustimmung zu dem Handel mit Putin dann nicht leicht gemacht, wie Scholz vorher geäußert hatte? Weil Deutschland dafür einen verurteilten Auftragsmörder … [+4287 chars]",,de,'Putin'
https://www.faz.net/aktuell/politik/ukraine/was-sie-zum-gefangenenaustausch-mit-russland-wissen-muessen-19895120.html,https://www.faz.net/aktuell/politik/ukraine/was-sie-zum-gefangenenaustausch-mit-russland-wissen-muessen-19895120.html,0,www.faz.net,Was Sie zum Gefangenenaustausch mit Russland wissen müssen,"Wie lief der größte Gefangenenaustausch mit Russland seit dem Kalten Krieg ab? Warum spielte Deutschland eine Schlüsselrolle, und was tat die Türkei? Ein Überblick.",https://media1.faz.net/ppmedia/aktuell/1116681729/1.9896109/facebook_teaser/evan-gershkovich-und-paul.jpg,2024-08-02T15:06:49Z,,"Wie lief der Austausch ab?
Die Operation wurde über die türkische Hauptstadt Ankara abgewickelt, und der türkische Geheimdienst MIT teilte am Donnerstag als erster die Namen der Freigekommenen mit. … [+13483 chars]",,de,'Russland'
https://www.bild.de/regional/sachsen/abschiebung-droht-familienvater-43-will-nicht-fuer-putin-kaempfen-66a87f018dc3c87f8e016b8a,https://www.bild.de/regional/sachsen/abschiebung-droht-familienvater-43-will-nicht-fuer-putin-kaempfen-66a87f018dc3c87f8e016b8a,0,www.bild.de,Abschiebung zur Russen-Armee? - Familienvater (43) will nicht für Putin kämpfen,"Dresden/Leipzig – Sorgen Dresdner Verwaltungsrichter dafür, dass Kriegsverbrecher Wladimir Putin Soldaten-Nachschub aus Deutschland bekommt?","https://images.bild.de/66a87f018dc3c87f8e016b8a/42c3c3158e55f1c4e88914ae7e14bf33,5487b2d9?w=1280",2024-08-02T15:08:16Z,,"Dresden/Leipzig  Sorgen Dresdner Verwaltungsrichter dafür, dass Kriegsverbrecher Wladimir Putin Soldaten-Nachschub aus Deutschland bekommt? Einem Familienvater aus Görlitz droht das Schicksal, abgesc… [+2255 chars]",,de,'Putin'
https://www.tagesspiegel.de/internationales/wer-sind-die-16-von-russland-freigelassenen-wie-sie-in-putins-fange-gerieten-was-sie-erlitten-12133829.html,https://www.tagesspiegel.de/internationales/wer-sind-die-16-von-russland-freigelassenen-wie-sie-in-putins-fange-gerieten-was-sie-erlitten-12133829.html,0,www.tagesspiegel.de,"Wer sind die 16 von Russland Freigelassenen? : Wie sie in Putins Fänge gerieten, was sie erlitten","Ausländische Korrespondenten, Oppositionelle, Lokalpolitiker und Künstler – sie alle waren in russischer Gefangenschaft. Einige von ihnen hätten diese wohl nicht überlebt.",https://www.tagesspiegel.de/images/12133820/alternates/BASE_16_9_W1400/1722596864000/combo-files-us-germany-slovenia-norway-poland-russia-prisoners.jpeg,2024-08-02T15:11:05Z,,"Der Austausch ist umstritten, doch für sie hat er sich auf jeden Fall gelohnt: Insgesamt 16 deutsche, amerikanische und russische Männer und Frauen wurden freigelassen, die in Russland und Belarus bi… [+11571 chars]",,de,'Russland'
https://www.tagesspiegel.de/internationales/sind-die-1990er-zuruck-russischer-senator-wegen-mordkomplotts-festgenommen-12136229.html,https://www.tagesspiegel.de/internationales/sind-die-1990er-zuruck-russischer-senator-wegen-mordkomplotts-festgenommen-12136229.html,0,www.tagesspiegel.de,Sind die 1990er zurück?: Russischer Senator wegen Mordkomplotts festgenommen,"Früher gab es in Russland viele Auftragsmorde wegen geschäftlicher Konflikte. Eigentlich sind diese Zeiten vorbei, doch ein Politiker soll trotzdem einen Killer beauftragt haben.",https://www.tagesspiegel.de/images/9905357/alternates/BASE_16_9_W1400/1722612060000/deutschland-untersagt-russland-betrieb-von-vier-generalkonsulaten.jpeg,2024-08-02T15:28:13Z,,"Ein russischer Senator der Regierungspartei ist festgenommen worden, weil er einen Mord in Auftrag gegeben haben soll. Der Föderationsrat, das Oberhaus des russischen Parlaments in Moskau, habe dafür… [+1798 chars]",,de,'Putin'
https://www.sueddeutsche.de/politik/russland-gefangenenaustausch-putin-wadim-krasikow-usa-lux.Qu3gJePB6FDqBSqSjCNdbw,https://www.sueddeutsche.de/politik/russland-gefangenenaustausch-putin-wadim-krasikow-usa-lux.Qu3gJePB6FDqBSqSjCNdbw,0,www.sueddeutsche.de,"Russische Agenten: Wer sind die Gefangenen, die Putin freigetauscht hat?","Ein Schmuggler, ein Mörder und mehrere Spione: Die Identität der acht zurückgekehrten Russen zeigt die unterschiedlichen Agentenaktivitäten im Westen auf.",https://www.sueddeutsche.de/2024/08/02/2d96fff2-ecf4-4f85-ad15-125c0c8efa2b.jpeg?q=60&fm=webp&width=1200&rect=0%2C0%2C3000%2C1688,2024-08-02T15:33:03Z,,"2. August 2024, 17:33 UhrLesezeit: 3 min
Ein Schmuggler, ein Mörder und mehrere Spione: Die Identität der acht zurückgekehrten Russen zeigt die unterschiedlichen Agentenaktivitäten im Westen auf.
V… [+778 chars]",,de,'Putin'
https://www.tagesspiegel.de/internationales/ukraine-invasion-tag-891-warum-der-gefangenendeal-nicht-als-vorbild-fur-frieden-taugt-12136616.html,https://www.tagesspiegel.de/internationales/ukraine-invasion-tag-891-warum-der-gefangenendeal-nicht-als-vorbild-fur-frieden-taugt-12136616.html,0,www.tagesspiegel.de,"Ukraine-Invasion, Tag 891: Warum der Gefangenendeal nicht als Vorbild für Frieden taugt","US-Berater dämpft Hoffnungen für Friedensverhandlungen, schwere Kämpfe in der Ostukraine dauern an, der „Tiergartenmörder“ ist ein FSB-Agent. Der Überblick am Abend.",https://www.tagesspiegel.de/images/12136583/alternates/BASE_16_9_W1400/1722612865000/ukrainian-servicemen-attend-a-military-exercise-in-kherson-region.jpeg,2024-08-02T15:48:06Z,,"Dass westliche Staaten mit Russland, in beiderseitigem Interesse und trotz völlig unterschiedlicher Voraussetzungen, eine Verhandlungslösung finden können, zeigt der Gefangenenaustausch eindrucksvoll… [+4717 chars]",,de,'Putin'
https://www.bild.de/politik/ausland-und-internationales/erdogan-vermittler-beim-gefangenen-austausch-von-putin-und-dem-westen-66aca714c2f9937ed7027501,https://www.bild.de/politik/ausland-und-internationales/erdogan-vermittler-beim-gefangenen-austausch-von-putin-und-dem-westen-66aca714c2f9937ed7027501,0,www.bild.de,Gefangenenaustausch - Ist Erdogan der geheime Deal-Maker?,Beim historischen Deal zwischen dem Westen und Kreml-Despot Putin hat der türkische Präsident Erdogan die Rolle des mysteriösen Vermittlers eingenommen.,"https://images.bild.de/66aca714c2f9937ed7027501/c3836d38b1ab5e397e578b9c7c7a26b6,cb2b3efa?w=1280",2024-08-02T15:56:11Z,,"Vieles spricht dafür, dass er bei dem historischen Deal zwischen dem Westen und Kreml-Despot Wladimir Putin (71) die Rolle des geheimen Vermittlers eingenommen hat: 
Recep Tayyip Erdogan (70). Hat d… [+2447 chars]",,de,'Putin'
https://www.faz.net/aktuell/feuilleton/debatten/der-gefangenenaustausch-als-putins-olympisches-spiel-19895793.html,https://www.faz.net/aktuell/feuilleton/debatten/der-gefangenenaustausch-als-putins-olympisches-spiel-19895793.html,0,www.faz.net,Putins olympisches Spiel: Blutroter Teppich für das Böse,Putins olympisches Spiel: Der Gefangenentausch Russlands mit dem Westen stellt abgründige Rekorde auf und sendet ein Signal an die Regime-Gegner im Ausland.,https://media0.faz.net/ppmedia/aktuell/3291451178/1.9895792/facebook_teaser/blutroter-teppich-in-finsterer.jpg,2024-08-02T15:57:55Z,,"Der größte Gefangenenaustausch seit dem Kalten Krieg, bei dem aus russischer Haft und aus belarussischer Haft insgesamt sechzehn westliche, aber auch russische Staatsbürger ausgeflogen wurden, um zeh… [+3229 chars]",,de,'Putin'
https://www.stern.de/politik/ausland/auch-alexej-nawalny-war-fuer-den-gefangenenaustausch-vorgesehen-34941282.html,https://www.stern.de/politik/ausland/auch-alexej-nawalny-war-fuer-den-gefangenenaustausch-vorgesehen-34941282.html,0,www.stern.de,Kremlkritiker: Einer fehlt beim Austausch: Die besondere Tragik des Falls Alexej Nawalny,Der Deal zur Freilassung Gefangener aus Russland sorgt insbesondere bei den Angehörigen für pure Freude. Inzwischen ist klar: Auch Alexej Nawalny sollte mit im Flieger sitzen.,https://image.stern.de/34941316/t/Ai/v1/w1440/r1.7778/-/alexej-nawalny-bild-1.jpg,2024-08-02T15:58:00Z,,"Freude allenthalben, Jubel der Angehörigen und Lob von und für alle Beteiligten: Nach dem geglückten Gefangenenaustausch zwischen dem Westen und Russland atmet die Welt auf. Einziger Wermutstropfen: … [+4348 chars]",,de,'Russland'
https://www.tagesspiegel.de/internationales/nach-gefangenenaustausch-ruckkehr-in-unbekannte-heimat-agenten-kinder-wussten-laut-kreml-nichts-von-russischer-herkunft-12136619.html,https://www.tagesspiegel.de/internationales/nach-gefangenenaustausch-ruckkehr-in-unbekannte-heimat-agenten-kinder-wussten-laut-kreml-nichts-von-russischer-herkunft-12136619.html,0,www.tagesspiegel.de,Putin spricht bei Gefangenenaustausch Spanisch : Agenten-Kinder wussten laut Kreml nichts von russischer Herkunft,"Bei der Begrüßung der beim Gefangenenaustausch freigelassenen Russen wechselt Kremlchef Putin die Sprache. Der Grund sind zwei Kinder, die offenbar ahnungslos waren, wer ihre Eltern wirklich sind.",https://www.tagesspiegel.de/images/12135863/alternates/BASE_16_9_W1400/1722608514000/russia-moscow-august-1-2024-russia-s-president-vladimir-putin-r-welcomes-russian-citizens-released-in-a-prisoner.jpeg,2024-08-02T16:01:12Z,,"Die beiden Kinder zweier Spione, die durch den spektakulären Gefangenenaustausch zwischen Moskau und westlichen Staaten nach Russland zurückgekehrt sind, haben nach Kremlangaben nichts von ihren russ… [+1266 chars]",,de,'Putin'
https://www.stern.de/news/trump--gefangenenaustausch-zwischen-russland-und-dem-westen--sieg-fuer-putin--34943160.html,https://www.stern.de/news/trump--gefangenenaustausch-zwischen-russland-und-dem-westen--sieg-fuer-putin--34943160.html,0,www.stern.de,"Trump: Gefangenenaustausch zwischen Russland und dem Westen ""Sieg für Putin""","Der frühere US-Präsident Donald Trump hat den Gefangenenaustausch zwischen Russland und dem Westen scharf kritisiert und ihn als ""Sieg"" für Kreml-Chef Wladimir Putin bezeichnet. ""Die Russen haben ein großartiges Geschäft gemacht"", sagte der republikanische Pr…",https://image.stern.de/34943162/t/O1/v1/w1440/r1.7778/-/02--donald-trump---26cbb57b45ada2ec.jpg,2024-08-02T16:01:18Z,,"Der frühere US-Präsident Donald Trump hat den Gefangenenaustausch zwischen Russland und dem Westen scharf kritisiert und ihn als ""Sieg"" für Kreml-Chef Wladimir Putin bezeichnet. ""Die Russen haben ein… [+2314 chars]",,de,'Putin'
