index,url,valid,domain,title,description,image,published,archive,content,quote,language,keyword
https://www.handelsblatt.com/unternehmen/gasversorgung-steigende-lng-preise-hohe-nachfrage-aus-asien-gefaehrdet-europas-gas-plaene/28461350.html,https://www.handelsblatt.com/unternehmen/gasversorgung-steigende-lng-preise-hohe-nachfrage-aus-asien-gefaehrdet-europas-gas-plaene/28461350.html,0,www.handelsblatt.com,Knappes Flüssigerdgas: LNG-Preise auf Höhenflug,"Die Preise für Flüssigerdgas steigen immer weiter – die Nachfrage ist hoch, das Angebot knapp. Der notwendige Ersatz für Gas aus Russland wird teuer für Europa.",https://www.handelsblatt.com/images/transport-von-fluessigem-erdgas/28461376/7-format2003.jpg,2022-07-01T09:38:29Z,https://web.archive.org/web/20220701093829/https://www.handelsblatt.com/unternehmen/gasversorgung-steigende-lng-preise-hohe-nachfrage-aus-asien-gefaehrdet-europas-gas-plaene/28461350.html,,,de,'Russland'
https://www.spiegel.de/politik/deutschland/gas-aus-russland-wie-sich-deutschland-putin-ausgeliefert-hat-podcast-a-dc441d8b-9cc1-44ef-9c5f-74b17ccf278f,https://www.spiegel.de/politik/deutschland/gas-aus-russland-wie-sich-deutschland-putin-ausgeliefert-hat-podcast-a-dc441d8b-9cc1-44ef-9c5f-74b17ccf278f,0,www.spiegel.de,Gas aus Russland: Wie sich Deutschland Wladimir Putin ausgeliefert hat - Podcast - DER SPIEGEL,Deutschland muss Gas sparen: Wladimir Putin drosselt die Lieferungen. Jahrelang hat sich die Politik auf Russland verlassen. Wie sind wir in die Abhängigkeit geraten? Und finden wir heraus?,https://cdn.prod.www.spiegel.de/images/8b789ba0-0160-4d52-9e56-16e11e91013b_w1280_r1.77_fpx50_fpy50.jpg,2022-07-04T06:00:00+02:00,https://web.archive.org/web/20220704040241/https://www.spiegel.de/politik/deutschland/gas-aus-russland-wie-sich-deutschland-putin-ausgeliefert-hat-podcast-a-dc441d8b-9cc1-44ef-9c5f-74b17ccf278f,,,de,'Russland'
https://www.dw.com/de/lieferstopp-bei-nord-stream-m%C3%BCssen-die-deutschen-bald-frieren/a-62409422,https://www.dw.com/de/lieferstopp-bei-nord-stream-m%C3%BCssen-die-deutschen-bald-frieren/a-62409422,0,www.dw.com,Wartung von Nord Stream: Lässt Russland die Deutschen bald frieren? | Wirtschaft | DW | 11.07.2022,"Seit Montagmorgen fließt wie erwartet kein Gas mehr durch die Ostseepipeline Nord Stream 1 nach Deutschland. Die Leitung wird planmäßig gewartet, aber niemand weiß, ob danach wieder Gas kommt. ",https://static.dw.com/image/62427403_6.jpg,2022-07-08T14:39:10Z,https://web.archive.org/web/20220708143910/https://www.dw.com/de/lieferstopp-bei-nord-stream-m%C3%BCssen-die-deutschen-bald-frieren/a-62409422,,,de,'Russland'
https://www.dw.com/de/ukraine-aktuell-russland-verletzt-massiv-das-v%C3%B6lkerrecht/a-62545489,https://www.dw.com/de/ukraine-aktuell-russland-verletzt-massiv-das-v%C3%B6lkerrecht/a-62545489,0,www.dw.com,Ukraine aktuell: Wirtschaftsminister Habeck wirft Russland Erpressung vor | Aktuell Europa | DW | 21.07.2022,"Bundeswirtschaftsminister Robert Habeck hat Äußerungen aus Russland zurückgewiesen, das Land sei Garant der Energieversorgung. Zuvor war die Gaslieferung durch die Pipeline Nord Stream 1 wieder angelaufen. Ein Überblick.",https://static.dw.com/image/62553896_6.jpg,2022-07-21T03:05:27Z,https://web.archive.org/web/20220721030527/https://www.dw.com/de/ukraine-aktuell-russland-verletzt-massiv-das-v%C3%B6lkerrecht/a-62545489,,,de,'Ukraine'
https://www.spiegel.de/wirtschaft/energiesparen-hauseigentuemer-daempfen-hoffnung-auf-schnelle-massnahmen-a-32c44fe6-1bc4-4398-9553-ee287f28c475,https://www.spiegel.de/wirtschaft/energiesparen-hauseigentuemer-daempfen-hoffnung-auf-schnelle-massnahmen-a-32c44fe6-1bc4-4398-9553-ee287f28c475,0,www.spiegel.de,Energiesparen: Hauseigentümer dämpfen Hoffnung auf schnelle Maßnahmen - DER SPIEGEL,"Jeder nicht verbrauchte Kubikmeter Gas reduziert die Abhängigkeit von Kremlherrscher Putin. Doch so schnell, wie mancher das gern hätte, werden die Häuser wohl nicht sparsamer.",https://cdn.prod.www.spiegel.de/images/b4b22fc8-51a4-47e8-8fdf-681d67afffaf_w1280_r1.77_fpx38.7_fpy50.jpg,2022-07-22T07:58:23+02:00,https://web.archive.org/web/20220722060055/https://www.spiegel.de/wirtschaft/energiesparen-hauseigentuemer-daempfen-hoffnung-auf-schnelle-massnahmen-a-32c44fe6-1bc4-4398-9553-ee287f28c475,,,de,'Putin'
https://www.spiegel.de/politik/deutschland/news-des-tages-krieg-in-der-ukraine-uniper-markus-soeder-a-fe72e37c-8466-4098-8579-efbd801a02be,https://www.spiegel.de/politik/deutschland/news-des-tages-krieg-in-der-ukraine-uniper-markus-soeder-a-fe72e37c-8466-4098-8579-efbd801a02be,0,www.spiegel.de,"News des Tages: Krieg in der Ukraine, Uniper, Markus Söder - DER SPIEGEL","Markus Söder wirft dem Bund vor, Bayern in der Energiekrise zu benachteiligen. Der Gaskonzern Uniper ist vorerst gerettet. Und Polen kritisiert die Berliner Regierung wegen eines offenbar gescheiterten Panzerdeals. Das ist die Lage am Freitagabend.",https://cdn.prod.www.spiegel.de/images/0fb372c3-843d-4dc6-a445-e7c34c92f75c_w1195_r1.77_fpx28.09_fpy49.93.png,2022-07-22T18:07:42+02:00,https://web.archive.org/web/20220722160929/https://www.spiegel.de/politik/deutschland/news-des-tages-krieg-in-der-ukraine-uniper-markus-soeder-a-fe72e37c-8466-4098-8579-efbd801a02be,,,de,'Ukraine'
https://de.euronews.com/my-europe/2022/07/28/energiearmut-in-spanien-kampf-mit-hoher-inflation-und-hitzewelle,https://de.euronews.com/my-europe/2022/07/28/energiearmut-in-spanien-kampf-mit-hoher-inflation-und-hitzewelle,0,de.euronews.com,Energiearmut in Spanien - Kampf mit hoher Inflation und Hitzewelle | Euronews,"Euronews sprach mit Monica Guiteras Blaya über die Verschärfung der Energiekrise für diejenigen, die es sich nicht leisten können, die Rechnungen zu bezahlen. #EuropeNews",https://static.euronews.com/articles/stories/06/88/27/96/1000x563_cmsv2_71437c8d-4632-5888-af5a-304911f36b36-6882796.jpg,2022-07-28 10:43:55,https://web.archive.org/web/20220728091650/https://de.euronews.com/my-europe/2022/07/28/energiearmut-in-spanien-kampf-mit-hoher-inflation-und-hitzewelle,,,de,'Inflation'
https://de.rt.com/nordamerika/144661-usa-werden-zum-lng-exporteur/,https://de.rt.com/nordamerika/144661-usa-werden-zum-lng-exporteur/,0,de.rt.com,USA werden zum LNG-Exporteur des Jahres — RT DE,"Europas erklärtes Ziel, immer mehr Gasmengen außerhalb Russlands einzukaufen, lässt die USA zum größten LNG-Exporteur werden. Die Ausfuhren des verflüssigten Erdgases aus den Vereinigten Staaten schossen in der ersten Jahreshälfte in die Höhe.",https://web.archive.org/web/20220728145405im_/https://cdni.russiatoday.com/deutsch/images/2022.07/article/62e28cf648fbef7ca06a089a.jpg,2022-07-28T14:54:05Z,https://web.archive.org/web/20220728145405/https://de.rt.com/nordamerika/144661-usa-werden-zum-lng-exporteur/,,,de,'Russland'
https://www.morgenpost.de/lifestyle/wohnen/article235777555/Energiekrise-Oefen-und-Brennholz-werden-knapp.html,https://www.morgenpost.de/lifestyle/wohnen/article235777555/Energiekrise-Oefen-und-Brennholz-werden-knapp.html,0,www.morgenpost.de,Energiekrise: Öfen und Brennholz werden knapp - Berliner Morgenpost ,"Der Ukraine-Krieg und die Sorge um die Energieversorgung haben viele Bürger verunsichert. Die Folge: Holzöfen sind gefragt wie nie. Doch auch ein Ofen garantiert kein warmes Wohnzimmer, wenn es am Brennholz fehlt.",https://img.morgenpost.de/img/wohnen/crop235777553/8152603954-w820-cv16_9-q85/Kaminofen.jpg,2022-07-01T12:00:54+02:00,https://web.archive.org/web/20220702073454/https://www.morgenpost.de/lifestyle/wohnen/article235777555/Energiekrise-Oefen-und-Brennholz-werden-knapp.html,,,de-DE,'Ukraine'
https://www.n-tv.de/politik/Kanzler-Scholz-schliesst-Tempolimit-klar-aus-article23439265.html,https://www.n-tv.de/politik/Kanzler-Scholz-schliesst-Tempolimit-klar-aus-article23439265.html,0,www.n-tv.de,Kanzler Scholz schließt Tempolimit trotz Energiekrise aus - n-tv.de,"Bundeskanzler Scholz wehrt sich gegen Forderungen nach einem Tempolimit auf Autobahnen. Ein solches habe die Regierung nicht vereinbart, sagt er zur Begründung. Scholz äußert sich außerdem zum 9-Euro-Ticket, zu Sicherheitsgarantien für die Ukraine - und seinen Duschgewohnheiten.",https://bilder1.n-tv.de/img/incoming/crop23439220/4391322876-cImg_16_9-w1200/d719b53cf638594d2a795ebb23de1df7.jpg,2022-07-03T13:13:41+02:00,https://web.archive.org/web/20220703112439/https://www.n-tv.de/politik/Kanzler-Scholz-schliesst-Tempolimit-klar-aus-article23439265.html,,,de,'Ukraine'
https://www.focus.de/finanzen/news/frieren-oder-schwitzen-gegen-putin-temperatur-im-job-wird-thema_id_115105375.html,https://www.focus.de/finanzen/news/frieren-oder-schwitzen-gegen-putin-temperatur-im-job-wird-thema_id_115105375.html,0,www.focus.de,Gaskrise: Temperatur im Büro wird zum Thema - „jedes Grad zählt“ - FOCUS online,"Durch die Energiekrise leidet Deutschland unter mangelnden Gas. Sollte Putin den Gashahn zudrehen, könnte es kalt im Winter werden. Unternehmen suchen deswegen händeringend nach Lösungen für ihre Mitarbeiter im Büro.",https://p6.focus.de/img/fotos/id_115119262/arbeit-nicht-zu-kalt-und-nicht-zu-warm-die-ideale-raumtemperatur-im-buero-liegt-zwischen-20-und-24-grad-celsius..jpg?im=Crop%3D%280%2C99%2C800%2C400%29%3BResize%3D%281200%2C627%29&impolicy=perceptual&quality=medium&hash=230cd7ae631cb2a2fcb5c0cf93af2f75a90d5db7b4f3f5c69d55ba843ea0d87f,2022-07-12T16:41:35+02:00,https://web.archive.org/web/20220712153211/https://www.focus.de/finanzen/news/frieren-oder-schwitzen-gegen-putin-temperatur-im-job-wird-thema_id_115105375.html,,,de,'Putin'
https://www.n-tv.de/wirtschaft/Wird-der-Strom-im-Winter-knapp-article23473881.html,https://www.n-tv.de/wirtschaft/Wird-der-Strom-im-Winter-knapp-article23473881.html,0,www.n-tv.de,Folgen des Ukraine-Konflikts: Wird der Strom im Winter knapp? - n-tv.de,"Nach der Gasknappheit, als Folge des Angriffskriegs Russlands, gibt es nun die Sorge, dass auch der Strom knapp wird. Dies birgt neue Risiken für Firmen und Verbraucher. Die Stromversorgung Deutschlands ist relativ sicher - aber auch gewappnet für den Winter?",https://bilder4.n-tv.de/img/incoming/crop23474299/6181324701-cImg_16_9-w1200/imago0162857957h.jpg,2022-07-19T16:32:04+02:00,https://web.archive.org/web/20220719144122/https://www.n-tv.de/wirtschaft/Wird-der-Strom-im-Winter-knapp-article23473881.html,,,de,'Ukraine'
https://www.dw.com/de/gasknappheit-angst-vor-zitterpartie-in-schulen/a-62554109,https://www.dw.com/de/gasknappheit-angst-vor-zitterpartie-in-schulen/a-62554109,0,www.dw.com,Gasknappheit: Angst vor „Zitterpartie“ in Schulen | Deutschlehrer-Info | DW | 21.07.2022,"Weil Putin die Gaszufuhr nach Deutschland drosselt, befürchtet der Lehrerverband, dass Kinder im nächsten Winter in kalten Klassenräumen sitzen könnten. Auch die Bildungsministerin schlägt Alarm.",https://static.dw.com/image/62555731_6.jpg,2022-07-23T02:25:30Z,https://web.archive.org/web/20220723022530/https://www.dw.com/de/gasknappheit-angst-vor-zitterpartie-in-schulen/a-62554109,,,de,'Putin'
https://www.dw.com/de/3000-statt-1000-euro-f%C3%BCr-gas-wird-heizen-luxus/a-62627399,https://www.dw.com/de/3000-statt-1000-euro-f%C3%BCr-gas-wird-heizen-luxus/a-62627399,0,www.dw.com,3000 statt 1000 Euro für Gas: Wird Heizen Luxus? | Deutschland | DW | 29.07.2022,"Hannover hat einen Energiesparplan vorgelegt. Das Rathaus bleibt dunkel, in Bädern und Turnhallen wird nur noch kalt geduscht. Privathaushalte werden auch sparen müssen - oder viel mehr bezahlen. ",https://static.dw.com/image/62642210_6.jpg,2022-07-29T11:07:44Z,https://web.archive.org/web/20220729110744/https://www.dw.com/de/3000-statt-1000-euro-f%C3%BCr-gas-wird-heizen-luxus/a-62627399,,,de,'Heizen'
https://www.spiegel.de/politik/deutschland/wir-werden-abwarten-muessen-a-e03ee597-761c-48cf-bba1-9899f01d6962,https://www.spiegel.de/politik/deutschland/wir-werden-abwarten-muessen-a-e03ee597-761c-48cf-bba1-9899f01d6962,0,www.spiegel.de,Robert Habeck über russisches Gas-Aus: »Wir werden abwarten müssen« - DER SPIEGEL,"Auch Wirtschaftsminister Habeck kann nicht sagen, ob Russland bald wieder Gas schickt – und schwört die Deutschen entsprechend auf einen Sparkurs ein.",https://cdn.prod.www.spiegel.de/images/35dd67db-b6bf-4586-96b8-52ec60b6c28a_w1280_r1.77_fpx47.32_fpy44.96.jpg,2022-07-12T06:32:48+02:00,https://web.archive.org/web/20220712043657/https://www.spiegel.de/politik/deutschland/wir-werden-abwarten-muessen-a-e03ee597-761c-48cf-bba1-9899f01d6962,,,de,'Russland'
https://www.morgenpost.de/wirtschaft/article235930967/Wie-beim-Gas-so-beim-Strom-Sorgen-um-Knappheit-im-Winter.html,https://www.morgenpost.de/wirtschaft/article235930967/Wie-beim-Gas-so-beim-Strom-Sorgen-um-Knappheit-im-Winter.html,0,www.morgenpost.de,"Wie beim Gas, so beim Strom? - Sorgen um Knappheit im Winter - Berliner Morgenpost ",Im Rätseln über Russlands nächste Schritte denken viele ans Erdgas. Doch die Märkte für Wärme und Elektrizität hängen eng zusammen. Könnte auch Deutschlands Stromversorgung bedroht sein?,https://img.morgenpost.de/img/wirtschaft/crop235930965/20926059-w820-cv16_9-q85/Strom.jpg,2022-07-19T16:49:51+02:00,https://web.archive.org/web/20220719070101/https://www.morgenpost.de/wirtschaft/article235930967/Wie-beim-Gas-so-beim-Strom-Sorgen-um-Knappheit-im-Winter.html,,,de-DE,'Knappheit'
https://www.focus.de/politik/meinung/gastkommentar-putins-kann-seinen-petrostaat-nicht-retten-das-aendern-auch-deutsche-friedensbriefe-nicht_id_121220484.html,https://www.focus.de/politik/meinung/gastkommentar-putins-kann-seinen-petrostaat-nicht-retten-das-aendern-auch-deutsche-friedensbriefe-nicht_id_121220484.html,0,www.focus.de,"Wer mit Putin einen Pakt schließt, wird mehr Krieg bekommen - FOCUS online","Deutsche Friedensfreunde melden sich derzeit zu Wort. Sie fordern, die Waffen niederzulegen und die belagerte Ukraine preiszugeben. Doch das wäre das Ende Europas. Denn wer mit Putin einen neuen Pakt schließen will, wird nur mehr Krieg bekommen.  ",https://p6.focus.de/img/fotos/id_121244258/imago0163246098h.jpg?im=Crop%3D%280%2C210%2C3600%2C1800%29%3BResize%3D%281200%2C627%29&hash=653fd52bd64489e7a823f9badde0f3ec423fd4d8d509130ad60064a4d4fad4d0,2022-07-26T20:40:48+02:00,https://web.archive.org/web/20220722152540/https://www.focus.de/politik/meinung/gastkommentar-putins-kann-seinen-petrostaat-nicht-retten-das-aendern-auch-deutsche-friedensbriefe-nicht_id_121220484.html,,,de,'Ukraine'
https://www.spiegel.de/politik/energiekrise-wie-der-rhein-hunsrueck-kreis-ohne-putins-gas-auskommt-a-fc0246a3-100a-4b75-a611-36f209fd107e,https://www.spiegel.de/politik/energiekrise-wie-der-rhein-hunsrueck-kreis-ohne-putins-gas-auskommt-a-fc0246a3-100a-4b75-a611-36f209fd107e,0,www.spiegel.de,Energiekrise: Wie der Rhein-Hunsrück-Kreis ohne Putins Gas auskommt - DER SPIEGEL,"Strom aus Windkraft, eigene Heizanlagen: Der Rhein-Hunsrück-Kreis deckt seinen Energiebedarf seit Jahren selbst. Dabei ist das Potenzial nicht einmal ausgeschöpft.",https://cdn.prod.www.spiegel.de/images/0dafef46-798e-4b42-9d94-2569ef4f9915_w1280_r1.77_fpx50_fpy54.jpg,2022-07-26T20:54:55+02:00,https://web.archive.org/web/20220726185725/https://www.spiegel.de/politik/energiekrise-wie-der-rhein-hunsrueck-kreis-ohne-putins-gas-auskommt-a-fc0246a3-100a-4b75-a611-36f209fd107e,,,de,'Putin'
https://de.rt.com/inland/144618-wegen-energiekrise-rugens-burgermeister-fordern/,https://de.rt.com/inland/144618-wegen-energiekrise-rugens-burgermeister-fordern/,0,de.rt.com,Wegen Energiekrise: Rügener Bürgermeister fordern Inbetriebnahme von Nord Stream 2 — RT DE,Mehrere Bürgermeister haben in einem Schreiben an die Bundesregierung die Nutzung der derzeit noch nicht in Betrieb genommenen Pipeline Nord Stream 2 gefordert. Die Bundesregierung hatte deren Zertifizierung noch vor Beginn der russischen Militäroperation in der Ukraine ausgesetzt.,https://web.archive.org/web/20220728072402im_/https://cdni.russiatoday.com/deutsch/images/2022.07/article/62e21b5548fbef7ecb19cc86.jpg,2022-07-28T07:24:02Z,https://web.archive.org/web/20220728072402/https://de.rt.com/inland/144618-wegen-energiekrise-rugens-burgermeister-fordern/,,,de,'Ukraine'
https://www.bild.de/bild-plus/ratgeber/2022/ratgeber/flucht-vor-heizkosten-urlaub-guenstiger-als-winter-in-deutschland-80851354.bild.html,https://www.bild.de/bild-plus/ratgeber/2022/ratgeber/flucht-vor-heizkosten-urlaub-guenstiger-als-winter-in-deutschland-80851354.bild.html,0,www.bild.de,Flucht vor Heizkosten: Urlaub günstiger als Winter in Deutschland | Leben & Wissen | BILD.de,"Deutschland drohen im Winter: explodierende Gaspreise, Teuer-Schock im Supermarkt und Minus-Temperaturen! Zeit, im Winter in den günstigen Urlaub zu fliegen!","https://images.bild.de/62e3e1b560a3e73b21ea3382/b6ad7e32c6c13066732a65a5f9150aaf,5fd416f9?w=1280",2022-07-31T11:58:41Z,https://web.archive.org/web/20220731115841/https://www.bild.de/bild-plus/ratgeber/2022/ratgeber/flucht-vor-heizkosten-urlaub-guenstiger-als-winter-in-deutschland-80851354.bild.html,,,de,'Flucht'
https://www.morgenpost.de/politik/article236035939/energiekrise-verunsicherung-plan-panik.html,https://www.morgenpost.de/politik/article236035939/energiekrise-verunsicherung-plan-panik.html,0,www.morgenpost.de,Energie-Krise und Verunsicherung: Plan statt Panik - Berliner Morgenpost ,Reicht das Gas im Winter zum Heizen? Die Verunsicherung nimmt zu. Jörg Quoos vermisst eine Koalition der Vernunft – und einen Plan.,https://img.morgenpost.de/img/politik/crop235836983/0532601128-w820-cv16_9-q85/f84a08ae-fe14-11ec-8725-64086c556e51.jpg,2022-07-31T20:02:06+02:00,https://web.archive.org/web/20220731185354/https://www.morgenpost.de/politik/article236035939/energiekrise-verunsicherung-plan-panik.html,,,de-DE,'Heizen'
