index,url,valid,domain,title,description,image,published,archive,content,quote,language,keyword
https://www.zeit.de/news/2023-12/01/schnee-und-glaette-zum-wochenendstart-in-thueringen,https://www.zeit.de/news/2023-12/01/schnee-und-glaette-zum-wochenendstart-in-thueringen,0,www.zeit.de,Wetter: Schnee und Glätte zum Wochenendstart in Thüringen,Hier finden Sie Informationen zu dem Thema „Wetter“. Lesen Sie jetzt „Schnee und Glätte zum Wochenendstart in Thüringen“.,https://img.zeit.de/news/2023-12/01/schnee-und-glaette-zum-wochenendstart-in-thueringen-image-group/wide__1300x731,2023-12-01T06:32:10Z,https://web.archive.org/web/20231203072144/https://www.zeit.de/news/2023-12/01/schnee-und-glaette-zum-wochenendstart-in-thueringen,"Schnee und Glätte erwartet die Menschen in Thüringen am Freitag. Es kommt besonders am Vormittag zu leichtem Schneefall, wie der Deutsche Wetterdienst (DWD) mitteilte. Ab Nachmittag schneit es demnac… [+1409 chars]",,de,'Schnee'
https://www.zeit.de/news/2023-12/01/leichter-schnee-und-wolken-winterlich-zum-wochenende,https://www.zeit.de/news/2023-12/01/leichter-schnee-und-wolken-winterlich-zum-wochenende,0,www.zeit.de,Wetter: Leichter Schnee und Wolken - winterlich zum Wochenende,Hier finden Sie Informationen zu dem Thema „Wetter“. Lesen Sie jetzt „Leichter Schnee und Wolken - winterlich zum Wochenende“.,https://img.zeit.de/news/2023-12/01/leichter-schnee-und-wolken-winterlich-zum-wochenende-image-group/wide__1300x731,2023-12-01T07:08:48Z,https://web.archive.org/web/20231202124617/https://www.zeit.de/news/2023-12/01/leichter-schnee-und-wolken-winterlich-zum-wochenende,"Leichter Schneefall und Wolken erwarten die Menschen in Sachsen-Anhalt am Freitag. Vor allem in der Früh kommt es zu Frost, wie der Deutsche Wetterdienst (DWD) mitteilte. Am Vormittag schneit es südl… [+1465 chars]",,de,'Schnee'
https://www.zeit.de/news/2023-12/01/putin-gibt-flughafen-in-russische-verwaltung-fraport-raus,https://www.zeit.de/news/2023-12/01/putin-gibt-flughafen-in-russische-verwaltung-fraport-raus,0,www.zeit.de,Luftverkehr: Putin gibt Flughafen in russische Verwaltung - Fraport raus,Hier finden Sie Informationen zu dem Thema „Luftverkehr“. Lesen Sie jetzt „Putin gibt Flughafen in russische Verwaltung - Fraport raus“.,https://img.zeit.de/news/2023-12/01/putin-gibt-flughafen-in-russische-verwaltung-fraport-raus-image-group/wide__1300x731,2023-12-01T08:38:06Z,https://web.archive.org/web/20231202214108/https://www.zeit.de/news/2023-12/01/putin-gibt-flughafen-in-russische-verwaltung-fraport-raus,Der russische Präsident Wladimir Putin hat eine neue Betreiberstruktur des Flughafens Pulkowo in St. Petersburg angeordnet und damit den großen deutschen Anteilseigner Fraport aus dem Geschäft gedrän… [+2747 chars],,de,'Putin'
https://www.faz.net/aktuell/wirtschaft/wohnen/heizen-daemmen-sanieren-wie-sie-ihr-haus-auf-den-winter-vorbereiten-19276744.html,https://www.faz.net/aktuell/wirtschaft/wohnen/heizen-daemmen-sanieren-wie-sie-ihr-haus-auf-den-winter-vorbereiten-19276744.html,0,www.faz.net,"Heizen, dämmen, sanieren: Das Haus auf den Winter vorbereiten","Viele Wege führen zum Energiesparen. Oft sind die Investitionskosten hoch, aber es gibt auch Maßnahmen, die jeder ohne zusätzliche Kosten sofort umsetzen kann.",https://media1.faz.net/ppmedia/aktuell/wirtschaft/3150951040/1.9337885/facebook_teaser_fplus/heizung-aufdrehen-eine.jpg,2023-12-01T09:15:23Z,,"Der Tipp des Fachmanns ist einfach: Vorlauftemperaturen begrenzen, sagt Oliver Petri, Geschäftsführer des eigenen Betriebs Petri Heizung Sanitär in Mühlheim. Zu Hause kann jeder die Vorlauftemperatur… [+940 chars]",,de,'Heizen'
https://www.zeit.de/news/2023-12/01/bolschoi-chef-verlaesst-theater-nach-kritik-an-putins-krieg,https://www.zeit.de/news/2023-12/01/bolschoi-chef-verlaesst-theater-nach-kritik-an-putins-krieg,0,www.zeit.de,Russischer Angriffskrieg: Bolschoi-Chef verlässt Theater nach Kritik an Putins Krieg,Hier finden Sie Informationen zu dem Thema „Russischer Angriffskrieg“. Lesen Sie jetzt „Bolschoi-Chef verlässt Theater nach Kritik an Putins Krieg“.,https://img.zeit.de/news/2023-12/01/bolschoi-chef-verlaesst-theater-nach-kritik-an-putins-krieg-image-group/wide__1300x731,2023-12-01T10:04:38Z,,"Der Chef des weltberühmten Moskauer Bolschoi Theaters, Wladimir Urin, hat nach Kritik am russischen Angriffskrieg gegen die Ukraine das Staatstheater verlassen. «Ich verabschiede mich heute, weil heu… [+2491 chars]",,de,'Putin'
https://www.zeit.de/politik/ausland/2023-12/eu-beitritt-ukraine-viktor-orban-strategische-partnerschaft,https://www.zeit.de/politik/ausland/2023-12/eu-beitritt-ukraine-viktor-orban-strategische-partnerschaft,0,www.zeit.de,"Europäische Union: Viktor Orbán fordert ""strategische Partnerschaft"" für EU und Ukraine","Der ""Abstand"" zu groß, die Konsequenzen unklar: Ungarns Regierungschef ist skeptisch, was einen EU-Beitritt der Ukraine angeht. Er fordert ""schrittweise Annäherung"".",https://img.zeit.de/politik/2023-12/eu-beitritt-ukraine-viktor-orban-strategische-partnerschaft-bild/wide__1300x731,2023-12-01T13:08:47Z,https://web.archive.org/web/20231201145117/https://www.zeit.de/politik/ausland/2023-12/eu-beitritt-ukraine-viktor-orban-strategische-partnerschaft,"Der ungarische Ministerpräsident Viktor Orbán lehnt EU-Beitrittsverhandlungen mit der Ukraine weiterhin ab und schlägt stattdessen Gespräche über eine ""strategische Partnerschaft"" vor. Es lohne sich … [+1044 chars]",,de,'Ukraine'
https://www.faz.net/aktuell/wirtschaft/unternehmen/josef-demm-will-noch-bis-zur-rente-heizoel-verkaufen-19348502.html,https://www.faz.net/aktuell/wirtschaft/unternehmen/josef-demm-will-noch-bis-zur-rente-heizoel-verkaufen-19348502.html,0,www.faz.net,Der Ölprinz: Josef Demm will noch bis zur Rente Heizöl verkaufen,Heizen mit Öl ist ein Auslaufmodell – dessen Ende jedoch keiner vorhersagen kann. Für den Heizölhändler Josef Demm darf der Betrieb von Heizkesseln gern noch lange dauern.,https://media1.faz.net/ppmedia/aktuell/2721843261/1.9348495/facebook_teaser_fplus/josef-demm-will-noch-bis-zur.jpg,2023-12-01T13:47:09Z,https://web.archive.org/web/20231201140318/https://www.faz.net/aktuell/wirtschaft/unternehmen/josef-demm-will-noch-bis-zur-rente-heizoel-verkaufen-19348502.html,"In den Chefetagen von Politik und Wirtschaft ist spätestens seit dem Amtsantritt der Ampelkoalition pausenlos von Transformation die Rede. Ziel ist es, dass Deutschland bis zur Mitte des Jahrhunderts… [+1115 chars]",,de,'Heizen'
https://www.tagesschau.de/ausland/europa/bolschoi-theater-leitung-100.html,https://www.tagesschau.de/ausland/europa/bolschoi-theater-leitung-100.html,0,www.tagesschau.de,Putin-Freund Gergijew übernimmt Leitung des Bolschoi-Theaters,Der Dirigent Gergijew wird Chef des Moskauer Bolschoi Theaters. Er gilt als Vertrauter von Präsident Putin. Sein Vorgänger Urin hatte sich im vergangenen Jahr öffentlich gegen Putins Krieg gegen die Ukraine ausgesprochen.,https://images.tagesschau.de/image/09bd2200-acab-4a17-baa5-c6f65fb8be31/AAABjCWWQ5c/AAABibBxqrQ/16x9-1280/waleri-gergijew-100.jpg,2023-12-01T14:12:06Z,https://web.archive.org/web/20231201160659/https://www.tagesschau.de/ausland/europa/bolschoi-theater-leitung-100.html,"Stand: 01.12.2023 15:12 Uhr
Der Dirigent Gergijew wird Chef des Moskauer Bolschoi Theaters. Er gilt als Vertrauter von Präsident Putin. Sein Vorgänger Urin hatte sich im vergangenen Jahr öffentlich … [+2113 chars]",,de,'Putin'
https://www.zeit.de/news/2023-12/01/russlands-krieg-kein-fecht-weltcup-in-tauberbischofsheim,https://www.zeit.de/news/2023-12/01/russlands-krieg-kein-fecht-weltcup-in-tauberbischofsheim,0,www.zeit.de,Fechten: Russlands Krieg: Kein Fecht-Weltcup in Tauberbischofsheim,Hier finden Sie Informationen zu dem Thema „Fechten“. Lesen Sie jetzt „Russlands Krieg: Kein Fecht-Weltcup in Tauberbischofsheim“.,https://img.zeit.de/news/2023-12/01/russlands-krieg-kein-fecht-weltcup-in-tauberbischofsheim-image-group/wide__1300x731,2023-12-01T16:40:31Z,https://web.archive.org/web/20231202102615/https://www.zeit.de/news/2023-12/01/russlands-krieg-kein-fecht-weltcup-in-tauberbischofsheim,Auch im nächsten Jahr wird am Olympiastützpunkt Tauberbischofsheim wegen Russlands Angriffskrieg in der Ukraine kein Weltcup der Florettfechterinnen stattfinden. Der Landessportverband Baden-Württemb… [+2327 chars],,de,'Russland'
https://www.tagesspiegel.de/internationales/ukraine-invasion-tag-646-kiew-plant-abwehrbollwerk--selenskyj-reagiert-auf-die-realitat-an-der-front-10871281.html,https://www.tagesspiegel.de/internationales/ukraine-invasion-tag-646-kiew-plant-abwehrbollwerk--selenskyj-reagiert-auf-die-realitat-an-der-front-10871281.html,0,www.tagesspiegel.de,Ukraine-Invasion Tag 646: Kiew plant Abwehrbollwerk – Selenskyj reagiert auf die Realität an der Front,"Moskau will Krieg wie bisher fortsetzen, Anschlag auf Eisenbahn in Sibirien, neues Verfahren gegen Kreml-Kritiker Nawalny. Der Überblick am Abend.",https://www.tagesspiegel.de/images/ukraine-krieg-kupjansk7/alternates/BASE_16_9_W1400/ukraine-krieg---kupjansk.jpeg,2023-12-01T17:45:45Z,,"An den vielen hundert Kilometern Frontlinie in der Ukraine bewegt sich seit Wochen kaum etwas. Und das könnte für viele Monate so bleiben, glaubt man Experten und den Einschätzungen des ukrainischen … [+5818 chars]",,de,'Knappheit'
https://www.n-tv.de/newsletter/breakingnews/Putin-will-russische-Armee-um-170-000-Soldaten-vergroessern-article24573126.html,https://www.n-tv.de/newsletter/breakingnews/Putin-will-russische-Armee-um-170-000-Soldaten-vergroessern-article24573126.html,0,www.n-tv.de,Breaking News: Putin will russische Armee um 170.000 Soldaten vergrößern,"Russland will die Zahl seiner Soldaten um 15 Prozent erhöhen. Ein entsprechendes Dekret unterzeichnete Präsident Wladimir Putin, wie die Armee in Moskau mitteilt. Grund seien ""Bedrohungen"" in der Ukraine sowie ""die fortgesetzte Erweiterung der NATO"".",https://bilder3.n-tv.de/img/incoming/crop13918366/0701326640-cImg_16_9-w1200/BreakingNewsPush.jpg,2023-12-01T18:50:50Z,,"Russland will die Zahl seiner Soldaten um 15 Prozent erhöhen. Ein entsprechendes Dekret unterzeichnete Präsident Wladimir Putin, wie die Armee in Moskau mitteilt. Grund seien ""Bedrohungen"" in der Ukr… [+1466 chars]",,de,'Putin'
https://www.tagesspiegel.de/internationales/dekret-von-putin-russland-will-zahl-der-soldaten-um-15-prozent-erhohen-10871617.html,https://www.tagesspiegel.de/internationales/dekret-von-putin-russland-will-zahl-der-soldaten-um-15-prozent-erhohen-10871617.html,0,www.tagesspiegel.de,Dekret von Putin: Russland will Zahl der Soldaten um 15 Prozent erhöhen,Moskau will seine Armee durch Freiwillige und Wehrdienstleistenden um 170.000 Soldaten vergrößern. Das gab der Kreml am Freitag bekannt. Dadurch soll eine zweite Mobilisierungswelle vermieden werden.,https://www.tagesspiegel.de/images/imago0171107155hjpg/alternates/BASE_16_9_W1400/imago0171107155hjpg.jpeg,2023-12-01T18:55:34Z,,Mehr als anderthalb Jahre nach Beginn seines Angriffskriegs gegen die Ukraine hat Russlands Präsident Wladimir Putin eine erneute Vergrößerung seiner Armee angeordnet. Künftig soll die Zahl der bewaf… [+1654 chars],,de,'Putin'
https://www.stern.de/news/nach-aktionen-in-polen--auch-slowakische-lkw-fahrer-blockieren-grenze-zur-ukraine-34251148.html,https://www.stern.de/news/nach-aktionen-in-polen--auch-slowakische-lkw-fahrer-blockieren-grenze-zur-ukraine-34251148.html,0,www.stern.de,Nach Aktionen in Polen: Auch slowakische Lkw-Fahrer blockieren Grenze zur Ukraine,Nach polnischen Lastwagenfahrern haben nun auch slowakische Spediteure mit der Blockade eines Grenzübergangs zur Ukraine begonnen. In Vysne Nemecke ließen Mitglieder der Speditionsvereinigung Unas am Freitag nur noch vier Lastwagen pro Stunde über die Grenze …,https://image.stern.de/34251150/t/sz/v1/w1440/r1.7778/-/01--blockade-an-der-polnischukrainischen-grenze---90d6a2b0e724a836.jpg,2023-12-01T18:55:44Z,,Nach polnischen Lastwagenfahrern haben nun auch slowakische Spediteure mit der Blockade eines Grenzübergangs zur Ukraine begonnen. In Vysne Nemecke ließen Mitglieder der Speditionsvereinigung Unas am… [+1545 chars],,de,'Ukraine'
https://www.zeit.de/politik/ausland/2023-12/russland-soldaten-zahl-dekret-wladimir-putin,https://www.zeit.de/politik/ausland/2023-12/russland-soldaten-zahl-dekret-wladimir-putin,0,www.zeit.de,Ukraine-Krieg: Wladimir Putin ordnet Vergrößerung der Armee an,"Schon jetzt hat Russland eine der truppenstärksten Armeen der Welt. Eine geplante Aufstockung begründet Wladimir Putin mit der ""fortgesetzten Erweiterung der Nato"".",https://img.zeit.de/administratives/sharing/fallback-image/wide__1300x731,2023-12-01T19:02:17Z,,Mehr als anderthalb Jahre nach Beginn seines Angriffskriegs gegen die Ukraine will Russland die Zahl seiner Soldaten um 15 Prozent erhöhen. Präsident Wladimir Putin unterzeichnete ein entsprechendes … [+1189 chars],,de,'Russland'
https://www.stern.de/news/russland-will-zahl-der-soldaten-um-15-prozent-erhoehen-34251144.html,https://www.stern.de/news/russland-will-zahl-der-soldaten-um-15-prozent-erhoehen-34251144.html,0,www.stern.de,Russland will Zahl der Soldaten um 15 Prozent erhöhen,"Russland will die Zahl seiner Soldaten um 15 Prozent erhöhen. Ein entsprechendes Dekret unterzeichnete Präsident Wladimir Putin am Freitag, wie die Armee in Moskau mitteilte. Grund seien ""Bedrohungen"" im Zusammenhang mit der russischen Offensive in der Ukrain…",https://image.stern.de/34251146/t/Ss/v1/w1440/r1.7778/-/01--wladimir-putin---df3ce834acea10d9.jpg,2023-12-01T19:03:56Z,,"Russland will die Zahl seiner Soldaten um 15 Prozent erhöhen. Ein entsprechendes Dekret unterzeichnete Präsident Wladimir Putin am Freitag, wie die Armee in Moskau mitteilte. Grund seien ""Bedrohungen… [+398 chars]",,de,'Ukraine'
https://www.n-tv.de/mediathek/videos/ratgeber/Balkonkraftwerk-braucht-es-eine-Zustimmung-article24555829.html,https://www.n-tv.de/mediathek/videos/ratgeber/Balkonkraftwerk-braucht-es-eine-Zustimmung-article24555829.html,0,www.n-tv.de,Zuschauer fragen Experten: Balkonkraftwerk - braucht es eine Zustimmung?,"Der Energiepreis-Schock durch den Ukraine-Krieg macht klar: Der Umstieg auf Erneuerbare ist ebenso dringend, wie er aufwendig und teuer wird. Benjamin Weigl, Energieexperte von ""Finanztip"", beantwortet dazu drängende Fragen. Wenn auch Sie Anliegen haben, schi…",https://bilder1.n-tv.de/img/incoming/crop24560976/8941321463-cImg_16_9-w1200/428582629.jpg,2023-12-01T19:06:20Z,,,,de,'Ukraine'
https://www.welt.de/politik/ausland/article248842044/Russische-Armee-Putin-will-Zahl-der-Soldaten-um-15-Prozent-erhoehen.html,https://www.welt.de/politik/ausland/article248842044/Russische-Armee-Putin-will-Zahl-der-Soldaten-um-15-Prozent-erhoehen.html,0,www.welt.de,Putin will Zahl der Soldaten um 15 Prozent erhöhen,"Wladimir Putin will die russische Armee erneut vergrößern. 170.000 Soldaten sollen zusätzlich rekrutiert werden. Freiwillige, wie das Verteidigungsministerium beteuert. Doch die Bevölkerung sorgt sich vor einer weiteren Mobilisierung.",https://img.welt.de/img/regionales/hessen/mobile248820658/8191350377-ci16x9-w1200/Putin.jpg,2023-12-01T19:09:11Z,,Mehr als anderthalb Jahre nach Beginn seines Angriffskriegs gegen die Ukraine hat Russlands Präsident Wladimir Putin eine erneute Vergrößerung seiner Armee angeordnet. Künftig soll die Zahl der bewaf… [+1221 chars],,de,'Putin'
https://www.n-tv.de/politik/Kreml-wollte-wohl-an-geheime-Ostsee-Daten-der-NATO-article24573069.html,https://www.n-tv.de/politik/Kreml-wollte-wohl-an-geheime-Ostsee-Daten-der-NATO-article24573069.html,0,www.n-tv.de,Bei Planung von Nord Stream 2: Kreml wollte wohl an geheime Ostsee-Daten der NATO,"In Mecklenburg-Vorpommern soll ein Untersuchungsausschuss den Einfluss Russlands bei der Planung von Nord Stream 2 klären. Laut Mitgliedern des Gremiums versuchte Moskau während des Genehmigungsverfahrens, an U-Boot-Koordinaten der NATO zu gelangen. Das Vorha…",https://bilder1.n-tv.de/img/Bilder_dpa_Import/crop24441404/4561323909-cImg_16_9-w1200/Nicht-verbaute-Rohre-fur-die-Ostsee-Gaspipeline-Nord-Stream-2-von-Russland-nach-Deutschland-liegen-auf-dem-Gelande-des-Hafens-in-der-Gemeinde-Sassnitz.jpg,2023-12-01T19:12:13Z,https://web.archive.org/web/20231201222538/https://www.n-tv.de/politik/Kreml-wollte-wohl-an-geheime-Ostsee-Daten-der-NATO-article24573069.html,In Mecklenburg-Vorpommern soll ein Untersuchungsausschuss den Einfluss Russlands bei der Planung von Nord Stream 2 klären. Laut Mitgliedern des Gremiums versuchte Moskau während des Genehmigungsverfa… [+1973 chars],,de,'Russland'
https://www.dw.com/de/russland-stimmt-nur-minimalkompromiss-f%C3%BCr-osze-zu/a-67612802,https://www.dw.com/de/russland-stimmt-nur-minimalkompromiss-f%C3%BCr-osze-zu/a-67612802,0,www.dw.com,Russland stimmt nur Minimalkompromiss für OSZE zu,"Der russische Außenminister Sergej Lawrow behauptete, die auf Dialog ausgerichtete Organisation werde zu einem ""Anhängsel der NATO"" gemacht. Seine deutsche Kollegin hatte gewarnt, Moskau wolle die OSZE zerstören. Russland hat sich beim Außenministertreffen de…",https://static.dw.com/image/67612769_6.jpg,2023-12-01T19:13:00Z,,Russland hat sich beim Außenministertreffen der Organisation für Sicherheit und Zusammenarbeit in Europa (OSZE) mit seiner Blockadehaltung teilweise durchgesetzt. Am Ende des Treffens im nordmazedoni… [+2227 chars],,de,'Russland'
https://www.faz.net/aktuell/ukraine/putin-ordnet-erneut-vergroesserung-der-russischen-armee-an-19355566.html,https://www.faz.net/aktuell/ukraine/putin-ordnet-erneut-vergroesserung-der-russischen-armee-an-19355566.html,0,www.faz.net,Russische Armee: Putin vergrößert die Zahl der Soldaten um 15 Prozent,"Wladimir Putin will die Armee auf 1,32 Millionen bewaffnete Kräfte vergrößern. Zuletzt hatte er im Sommer 2022 eine Vergrößerung verordnet. Eine Mobilisierung sei nicht vorgesehen.",https://media1.faz.net/ppmedia/aktuell/politik/3494447180/1.9355577/facebook_teaser/russische-soldaten-gehen-eine.jpg,2023-12-01T19:34:37Z,https://web.archive.org/web/20231201202031/https://www.faz.net/aktuell/ukraine/putin-ordnet-erneut-vergroesserung-der-russischen-armee-an-19355566.html,Mehr als anderthalb Jahre nach Beginn seines Angriffskriegs gegen die Ukraine hat Russlands Präsident Wladimir Putin eine erneute Vergrößerung seiner Armee angeordnet. Künftig soll die Zahl der bewaf… [+1219 chars],,de,'Putin'
https://www.tagesschau.de/ausland/lkw-blockade-ukraine-100.html,https://www.tagesschau.de/ausland/lkw-blockade-ukraine-100.html,0,www.tagesschau.de,Slowakische Lkw-Fahrer blockieren Grenzübergang zur Ukraine,"Nach polnischen Lastwagenfahrern haben nun auch slowakische Spediteure mit der Blockade eines Grenzübergangs zur Ukraine begonnen. Sie fordern von der EU, dass Transportgenehmigungen für ukrainische Lkw wieder eingeführt werden.",https://images.tagesschau.de/image/4386090b-efcd-419d-bf8d-4eaa97625be6/AAABjCbl5wk/AAABibBxqrQ/16x9-1280/slowakei-ukraine-102.jpg,2023-12-01T19:47:49Z,https://web.archive.org/web/20231202003753/https://www.tagesschau.de/ausland/lkw-blockade-ukraine-100.html,"Stand: 01.12.2023 20:47 Uhr
Nach polnischen Lastwagenfahrern haben nun auch slowakische Spediteure mit der Blockade eines Grenzübergangs zur Ukraine begonnen. Sie fordern von der EU, dass Transportg… [+1626 chars]",,de,'Ukraine'
https://www.n-tv.de/wirtschaft/Erste-Panzer-aus-der-Ukraine-sollen-2024-fertig-sein-article24573169.html,https://www.n-tv.de/wirtschaft/Erste-Panzer-aus-der-Ukraine-sollen-2024-fertig-sein-article24573169.html,0,www.n-tv.de,Fuchs und Lynx von Rheinmetall: Erste Panzer aus der Ukraine sollen 2024 fertig sein,Innerhalb weniger Monate nach der Vertragsunterzeichnung will Rheinmetall die ersten Panzer in der Ukraine herstellen. Schon im Spätsommer sollen nach den Plänen des Konzernchefs die ersten Transportpanzer Fuchs fertig sein. Der Schützenpanzer Lynx soll folge…,https://bilder4.n-tv.de/img/incoming/crop23267851/9331325967-cImg_16_9-w1200/imago0115344354h.jpg,2023-12-01T19:47:50Z,,Innerhalb weniger Monate nach der Vertragsunterzeichnung will Rheinmetall die ersten Panzer in der Ukraine herstellen. Schon im Spätsommer sollen nach den Plänen des Konzernchefs die ersten Transport… [+1862 chars],,de,'Ukraine'
https://www.bild.de/lgbt/2023/lgbt/lgbt-bewegung-als-extremistisch-eingestuft-putins-kampf-gegen-schwule-86296108.bild.html,https://www.bild.de/lgbt/2023/lgbt/lgbt-bewegung-als-extremistisch-eingestuft-putins-kampf-gegen-schwule-86296108.bild.html,0,www.bild.de,LGBT-Bewegung sei „extremistisch“ - Russlands widerlicher Kampf gegen Homosexuelle,Jetzt erreicht der Homo-Hass eine neue Dimension: Ein beispielloser Schlag gegen die Rechte der LGBTQ-Gemeinschaft wurde am Donnerstag in Russland verkündet,"https://images.bild.de/656a292322b23177d4d8d51d/6356be7d358c0019f53122589ba5127b,559c28e2?w=1280",2023-12-01T19:50:29Z,https://web.archive.org/web/20231201230204/https://www.bild.de/lgbt/2023/lgbt/lgbt-bewegung-als-extremistisch-eingestuft-putins-kampf-gegen-schwule-86296108.bild.html,Moskau Ein beispielloser Schlag gegen die Rechte der LGBTQ-Gemeinschaft wurde am Donnerstag in Russland verkündet. Richter Oleg Nefedow vom Obersten Gerichtshof erklärte ein Verbot der internationale… [+6456 chars],,de,'Russland'
https://www.stern.de/news/russland-will-zahl-seiner-soldaten-um-15-prozent-erhoehen-34251144.html,https://www.stern.de/news/russland-will-zahl-seiner-soldaten-um-15-prozent-erhoehen-34251144.html,0,www.stern.de,Russland will Zahl seiner Soldaten um 15 Prozent erhöhen,"Russland will die Zahl seiner Soldaten um 15 Prozent erhöhen: Die Armee soll laut einem von Präsident Wladimir Putin am Freitag unterzeichneten Dekret künftig 2,2 Millionen Angehörige umfassen, darunter 1,32 Millionen Soldaten. Grund für die Aufstockung der S…",https://image.stern.de/34251242/t/6F/v1/w1440/r1.7778/-/01--wladimir-putin---4ef38f43e05815d3.jpg,2023-12-01T20:28:02Z,https://web.archive.org/web/20231202204414/https://www.stern.de/news/russland-will-zahl-seiner-soldaten-um-15-prozent-erhoehen-34251144.html,"Russland will die Zahl seiner Soldaten um 15 Prozent erhöhen: Die Armee soll laut einem von Präsident Wladimir Putin am Freitag unterzeichneten Dekret künftig 2,2 Millionen Angehörige umfassen, darun… [+1732 chars]",,de,'Russland'
https://www.welt.de/wirtschaft/article248843082/Haushaltsluecke-Lindner-will-bei-Sozialem-staatlichen-Subventionen-und-internationalen-Klimafinanzierung-sparen.html,https://www.welt.de/wirtschaft/article248843082/Haushaltsluecke-Lindner-will-bei-Sozialem-staatlichen-Subventionen-und-internationalen-Klimafinanzierung-sparen.html,0,www.welt.de,"Lindner will bei Sozialem, staatlichen Subventionen und internationalen Klimafinanzierung sparen",Die Ampel ist auf der Suche nach Einsparmöglichkeiten für den Bundeshaushalt. Der Finanzminister sagt nun: „Wir werden uns mit drei großen Kostenblöcken beschäftigen müssen“. Zudem kündigt er einen „Jobturbo“. Ein Teil-Haushalt ist für ihn aber heilig.,https://img.welt.de/img/wirtschaft/mobile248843108/3121359427-ci16x9-w1200/Das-Wirtschaftsjahr-2023-in-Zitaten.jpg,2023-12-02T00:29:08Z,https://web.archive.org/web/20231202073520/http://www.welt.de/wirtschaft/article248843082/Haushaltsluecke-Lindner-will-bei-Sozialem-staatlichen-Subventionen-und-internationalen-Klimafinanzierung-sparen.html,"Bundesfinanzminister Christian Lindner (FDP) hat Einsparungen in Bereichen wie Soziales und internationale Klimafinanzierung angekündigt, um die Lücken im Haushalt für 2024 zu schließen. Wir werden u… [+3411 chars]",,de,'Kosten'
https://www.n-tv.de/wirtschaft/Grossvermieter-fordern-neues-Mietrecht-article24573317.html,https://www.n-tv.de/wirtschaft/Grossvermieter-fordern-neues-Mietrecht-article24573317.html,0,www.n-tv.de,Reiche brauchen keinen Schutz: Großvermieter fordern neues Mietrecht,"Die deutschen Wohnungsriesen beklagen die Fesseln des Mietrechts. Nicht alle Mieter brauchen Schutz, erklären die Chefs von Vonovia und Saga. Besserverdiener sollten in Zeiten der Knappheit nicht günstige, staatlich geförderte Wohnungen blockieren dürfen.",https://bilder4.n-tv.de/img/incoming/crop24573319/220132264-cImg_16_9-w1200/413854693.jpg,2023-12-02T02:12:37Z,https://web.archive.org/web/20231202050113/https://www.n-tv.de/wirtschaft/Grossvermieter-fordern-neues-Mietrecht-article24573317.html,"Die deutschen Wohnungsriesen beklagen die Fesseln des Mietrechts. Nicht alle Mieter brauchen Schutz, erklären die Chefs von Vonovia und Saga. Besserverdiener sollten in Zeiten der Knappheit nicht gün… [+2193 chars]",,de,'Knappheit'
https://www.zeit.de/news/2023-12/02/schnee-und-eis-legen-bahnverkehr-im-sueden-bayerns-lahm,https://www.zeit.de/news/2023-12/02/schnee-und-eis-legen-bahnverkehr-im-sueden-bayerns-lahm,0,www.zeit.de,Verkehr: Schnee und Eis legen Bahnverkehr im Süden Bayerns lahm,Hier finden Sie Informationen zu dem Thema „Verkehr“. Lesen Sie jetzt „Schnee und Eis legen Bahnverkehr im Süden Bayerns lahm“.,https://img.zeit.de/news/2023-12/02/schnee-und-eis-legen-bahnverkehr-im-sueden-bayerns-lahm-image-group/wide__1300x731,2023-12-02T02:49:34Z,https://web.archive.org/web/20231203052549/https://www.zeit.de/news/2023-12/02/schnee-und-eis-legen-bahnverkehr-im-sueden-bayerns-lahm,"Schnee und Eis haben auf den Straßen und bei der Bahn im Süden Bayerns für Chaos gesorgt. Zahlreiche Bahnstrecken rund um die Landeshauptstadt München mussten in der Nacht gesperrt werden, wie die De… [+2568 chars]",,de,'Schnee'
