index,url,valid,domain,title,description,image,published,archive,content,quote,language,keyword
https://www.zeit.de/news/2025-07/01/mehr-als-30-tote-nach-explosion-in-chemieanlage-in-indien,https://www.zeit.de/news/2025-07/01/mehr-als-30-tote-nach-explosion-in-chemieanlage-in-indien,0,www.zeit.de,Unglück: Mehr als 30 Tote nach Explosion in Chemieanlage in Indien,Hier finden Sie Informationen zu dem Thema „Unglück“. Lesen Sie jetzt „Mehr als 30 Tote nach Explosion in Chemieanlage in Indien“.,https://img.zeit.de/news/2025-07/01/mehr-als-30-tote-nach-explosion-in-chemieanlage-in-indien-image-group/wide__1300x731,2025-07-01T06:43:37Z,,"Nach einer Explosion in einer Chemieanlage im Süden Indiens ist die Zahl der geborgenen Todesopfer über Nacht auf mindestens 34 gestiegen. Bisher seien 31 Leichen unter den Trümmern gefunden worden, … [+1259 chars]",,de,'Explosion'
https://www.zeit.de/news/2025-07/01/daimler-truck-keine-folgen-durch-russlands-sanktionen,https://www.zeit.de/news/2025-07/01/daimler-truck-keine-folgen-durch-russlands-sanktionen,0,www.zeit.de,Nutzfahrzeughersteller: Daimler Truck: Keine Folgen durch Russlands Sanktionen,Hier finden Sie Informationen zu dem Thema „Nutzfahrzeughersteller“. Lesen Sie jetzt „Daimler Truck: Keine Folgen durch Russlands Sanktionen“.,https://img.zeit.de/news/2025-07/01/daimler-truck-keine-folgen-durch-russlands-sanktionen-image-group/wide__1300x731,2025-07-01T09:46:47Z,,Russlands Sanktionen gegen den Nutzfahrzeughersteller Daimler Truck wirken sich nach Angaben eines Unternehmenssprechers nicht auf das laufende Geschäft aus. «Wir haben keinerlei Geschäftsaktivitäten… [+1421 chars],,de,'Russland'
https://netzpolitik.org/2025/ki-im-krieg-wir-brauchen-mehr-kritische-debatten-und-zivilgesellschaftliches-engagement/,https://netzpolitik.org/2025/ki-im-krieg-wir-brauchen-mehr-kritische-debatten-und-zivilgesellschaftliches-engagement/,0,netzpolitik.org,KI im Krieg: „Wir brauchen mehr kritische Debatten und zivilgesellschaftliches Engagement“,"Auch beim “ Cyber Innovation Hub“ der Bundeswehr geht es um KI, hier zur Drohnenabwehr. – Alle Rechte vorbehalten IMAGO / Mike Schmidt
Autonome Waffensysteme treffen zunehmend eigenständig Entscheidungen. Nicht zuletzt der Ukrainekrieg dient dabei als Experi…",https://cdn.netzpolitik.org/wp-upload/2025/06/drohnenabwehr_ki-1200x675.jpg,2025-07-01T13:13:06Z,,"Drohnen, die von sogenannter Künstlicher Intelligenz gesteuert werden, gewinnen an Bedeutung. Gerade der Ukrainekrieg dient als Testfeld für neue militärische KI-Anwendungen. Sie ermöglichen nicht nu… [+9344 chars]",,de,'Waffen'
https://www.sueddeutsche.de/wirtschaft/nachhaltigkeitsgipfel-rwe-sms-georgsmarienhuette-wasserstoff-li.3267690,https://www.sueddeutsche.de/wirtschaft/nachhaltigkeitsgipfel-rwe-sms-georgsmarienhuette-wasserstoff-li.3267690,0,www.sueddeutsche.de,SZ-Nachhaltigkeitsgipfel: Wo es beim Wasserstoff hakt,"Die Industrie benötigt das klimafreundliche Gas, doch es geht zu langsam voran und die Kosten sind zu hoch. Wirtschaftsvertreter hoffen nun auf die neue Bundesregierung.",https://www.sueddeutsche.de/2025/07/01/ccb0f6bb-ba54-4d36-8d9d-47554ac4722e.jpeg?q=60&fm=webp&width=1200&rect=0%2C210%2C4000%2C2250,2025-07-01T14:01:19Z,,"1. Juli 2025, 16:01 Uhr|Lesezeit: 3 Min.
|
Die Industrie benötigt das klimafreundliche Gas, doch es geht zu langsam voran und die Kosten sind zu hoch. Wirtschaftsvertreter hoffen nun auf die neue B… [+850 chars]",,de,'Teuer'
