index,url,valid,domain,title,description,image,published,archive,content,quote,language,keyword
https://www.zeit.de/politik/ausland/2024-11/russland-nordkorea-ukraine-krieg-einsatz-antony-blinken-warnung,https://www.zeit.de/politik/ausland/2024-11/russland-nordkorea-ukraine-krieg-einsatz-antony-blinken-warnung,0,www.zeit.de,Krieg in der Ukraine: Nordkoreaner nach US-Einschätzung kurz vor Ukraine-Einsatz,"Die USA erwarten, dass nordkoreanische Soldaten binnen Tagen in der Ukraine eingesetzt werden. Das mache sie zu legitimen Zielen im Krieg, warnt Außenminister Blinken.",https://img.zeit.de/politik/ausland/2024-11/russland-nordkorea-ukraine-krieg-einsatz-antony-blinken-warnung-bild/wide__1300x731,2024-11-01T04:47:42Z,http://archive.md/20241101055542/https://www.zeit.de/politik/ausland/2024-11/russland-nordkorea-ukraine-krieg-einsatz-antony-blinken-warnung,Nach Ansicht der USA stehen nordkoreanische Soldaten an der Seite Russlands kurz vor ihrem Einsatz im Krieg gegen die Ukraine. Bis zu 8.000 befinden sich demnach nahe der ukrainischen Grenze. US-Auße… [+4268 chars],,de,'Ukraine'
https://www.zeit.de/politik/ausland/2024-10/krieg-ukraine-diplomatie-verhandlungen-russland-5vor8,https://www.zeit.de/politik/ausland/2024-10/krieg-ukraine-diplomatie-verhandlungen-russland-5vor8,0,www.zeit.de,Krieg in der Ukraine: Es wird längst verhandelt,Die Forderung nach mehr Diplomatie statt Waffen führt in die Irre: In vielen Bereichen haben sich Russen und Ukrainer bereits diplomatisch geeinigt. Aber es gibt Grenzen.,https://img.zeit.de/politik/ausland/2024-10/krieg-ukraine-diplomatie-verhandlungen-2/wide__1300x731,2024-11-01T07:00:14Z,http://archive.md/20241101070452/https://www.zeit.de/politik/ausland/2024-10/krieg-ukraine-diplomatie-verhandlungen-russland-5vor8,"Auf eines können sich derzeit selbst die unterschiedlichsten Menschen einigen: Die Deutschen müssen auf Diplomatie setzen, damit der russische Angriffskrieg in der Ukraine endlich endet.  
Die Bunde… [+796 chars]",,de,'Waffen'
https://www.faz.net/aktuell/finanzen/so-gefaehrlich-sind-die-wetten-auf-harris-und-trump-110081833.html,https://www.faz.net/aktuell/finanzen/so-gefaehrlich-sind-die-wetten-auf-harris-und-trump-110081833.html,0,www.faz.net,US-Wahlkampf: So gefährlich sind die Wetten auf Harris und Trump,"Die Wettbüros sehen Trump klar vorn – doch das spiegelt nicht die Realität wider. Das liegt viel mehr an windigen Milliardären, Kryptowährungen – und mutmaßlich auch an Russland oder China.",https://media0.faz.net/ppmedia/aktuell/politik/3277534350/1.10081924/facebook_teaser_fplus/sie-essen-die-katzen-sie-essen.jpg,2024-11-01T07:26:43Z,http://archive.md/20241101100125/https://www.faz.net/aktuell/finanzen/so-gefaehrlich-sind-die-wetten-auf-harris-und-trump-110081833.html,"Die Wahlen in den Vereinigten Staaten elektrisieren die ganze Welt. Dort werden am 5. November das Repräsentantenhaus und ein Teil des Senats gewählt und es entscheidet sich, ob mit Kamala Harris ein… [+426 chars]",,de,'Russland'
https://www.tagesschau.de/wirtschaft/verbraucher/altervorsorgedepot-riester-steuer-foerderung-100.html,https://www.tagesschau.de/wirtschaft/verbraucher/altervorsorgedepot-riester-steuer-foerderung-100.html,0,www.tagesschau.de,Macht Sparen ins neue Altersvorsorgedepot Sinn?,"Die private Vorsorge ist für viele Sparer wichtiger denn je. Oft wird die gesetzliche Rente nicht ausreichen, um den Lebensstandard zu halten. Ein Altersvorsorgedepot soll helfen, die Rentenlücke zu schließen. Von Andreas Braun.",https://images.tagesschau.de/image/ac1c8393-e025-4ae8-a32a-9093c8662c16/AAABkt0AXQQ/AAABkZLhkrw/16x9-1280/sparschwein-114.jpg,2024-11-01T08:07:45Z,,"Stand: 01.11.2024 09:07 Uhr
Die private Vorsorge ist für viele Sparer wichtiger denn je. Oft wird die gesetzliche Rente nicht ausreichen, um den Lebensstandard zu halten. Ein Altersvorsorgedepot sol… [+6030 chars]",,de,'Sparen'
https://www.welt.de/geschichte/article254299052/Zuckersirup-Flut-in-Boston-Ihr-Zucken-zog-die-Menschen-in-die-toedliche-Sirupwelle.html,https://www.welt.de/geschichte/article254299052/Zuckersirup-Flut-in-Boston-Ihr-Zucken-zog-die-Menschen-in-die-toedliche-Sirupwelle.html,0,www.welt.de,Ihr Zucken zog die Menschen in die tödliche Sirupwelle,"Nach der Explosion eines Melasse-Tanks ergoss sich am 15. Januar 1919 eine klebrige Welle durch Boston. Menschen, die sie erfasste, schlugen um sich – und wurden damit endgültig in die Masse gezogen.",https://img.welt.de/img/geschichte/mobile187035908/2007938247-ci16x9-w1200/Boston-s-Great-Molasses-Flood.jpg,2024-11-01T09:18:50Z,,"Nach der Explosion eines Melasse-Tanks ergoss sich am 15. Januar 1919 eine klebrige Welle durch Boston. Menschen, die sie erfasste, schlugen um sich und wurden damit endgültig in die Masse gezogen.De… [+5234 chars]",,de,'Explosion'
https://www.zeit.de/politik/ausland/2024-11/nordkorea-russland-krieg-ukraine-unterstuetzung,https://www.zeit.de/politik/ausland/2024-11/nordkorea-russland-krieg-ukraine-unterstuetzung,0,www.zeit.de,Krieg in der Ukraine: Nordkoreas Außenministerin sichert Russland in Moskau Unterstützung zu,"Die nordkoreanische Außenministerin sagt in Moskau, sie glaube an einen ""großen Sieg"" Russlands in der Ukraine. Dafür werde ihr Land Russland weiterhin zur Seite stehen.",https://img.zeit.de/politik/ausland/2024-11/russland-nordkorea-ukraine-krieg-choe-son-hui-bild/wide__1300x731,2024-11-01T10:40:27Z,,"Nordkoreas Außenministerin Choe Son Hui hat ihren russischen
Amtskollegen Sergej Lawrow in Moskau getroffen. Dabei sicherte die Nordkoreanerin Russland die Unterstützung ihres Landes zu. Nordkorea w… [+2757 chars]",,de,'Ukraine'
https://www.focus.de/politik/ausland/trump-oder-harris-was-der-ausgang-der-us-wahl-fuer-deutschland-bedeutet_50d47722-6ad5-4b34-ae4d-874db4d8fbcb.html,https://www.focus.de/politik/ausland/trump-oder-harris-was-der-ausgang-der-us-wahl-fuer-deutschland-bedeutet_50d47722-6ad5-4b34-ae4d-874db4d8fbcb.html,0,www.focus.de,"Ukraine-Hilfen, Wirtschaft, Klima - Was der Ausgang der US-Wahl für Deutschland bedeuten könnte","Egal ob Kamala Harris oder Donald Trump die Präsidentschaftswahl in den USA gewinnt, das Ergebnis hat deutliche Auswirkungen auf Deutschland.",https://quadro.burda-forward.de/ctf/658c6cf7-9b11-45e7-95d5-9e29d43286fc.069a67e0-455e-4b8c-bd36-8b1902429dc6.jpeg?im=Resize%3D%281200%2C630%29&hash=ac6843e94dccabfaef581b5e7063792440a34f51af6f03a1f3a2728af3b77650,2024-11-01T16:20:00Z,,"Als Joe Biden 2020 die US-Präsidentschaftswahl gegen den Amtsinhaber Donald Trump gewann, ging in Berlin ein großes Aufatmen durch die Reihen: Im Gegensatz zu Trump galt Biden als Transatlantiker der… [+7951 chars]",,de,'Kohle'
https://www.zeit.de/news/2024-11/01/brandenburgs-spd-ukraine-auch-mit-waffen-unterstuetzen,https://www.zeit.de/news/2024-11/01/brandenburgs-spd-ukraine-auch-mit-waffen-unterstuetzen,0,www.zeit.de,Koalitionsbildung: Brandenburgs SPD: Ukraine auch mit Waffen unterstützen,Hier finden Sie Informationen zu dem Thema „Koalitionsbildung“. Lesen Sie jetzt „Brandenburgs SPD: Ukraine auch mit Waffen unterstützen“.,https://img.zeit.de/news/2024-11/01/brandenburgs-spd-ukraine-auch-mit-waffen-unterstuetzen-image-group/wide__1300x731,2024-11-01T17:13:07Z,,Ungeachtet ihrer Sondierungsvereinbarung mit dem potenziellen Regierungspartner BSW hält die brandenburgische SPD Waffenlieferungen an die Ukraine für richtig. Wegen des russischen Angriffskriegs auf… [+3641 chars],,de,'Waffen'
https://www.zeit.de/politik/deutschland/2024-11/brandenburg-spd-bsw-sondierung-waffenlieferung-ukraine,https://www.zeit.de/politik/deutschland/2024-11/brandenburg-spd-bsw-sondierung-waffenlieferung-ukraine,0,www.zeit.de,Brandenburg: SPD hält trotz Vereinbarung mit dem BSW Waffenlieferungen für richtig,In Brandenburg stehen die ersten Koalitionsgespräche zwischen SPD und BSW an. Der SPD-Landesverband macht nun klar: Die militärische Unterstützung für die Ukraine steht.,https://img.zeit.de/politik/deutschland/2024-11/brandenburg-spd-bsw-sondierung-waffenlieferung-ukraine-bild/wide__1300x731,2024-11-01T18:23:49Z,,Ungeachtet ihrer Sondierungsvereinbarung mit dem potenziellen Regierungspartner BSW hält die brandenburgische SPD Waffenlieferungen an die Ukraine für richtig. Wegen des russischen Angriffskriegs geg… [+3420 chars],,de,'Waffen'
https://www.zeit.de/news/2024-11/01/usa-sagen-ukraine-weitere-militaerhilfe-zu,https://www.zeit.de/news/2024-11/01/usa-sagen-ukraine-weitere-militaerhilfe-zu,0,www.zeit.de,Russlands Angriffskrieg: USA sagen Ukraine weitere Militärhilfe zu,Hier finden Sie Informationen zu dem Thema „Russlands Angriffskrieg“. Lesen Sie jetzt „USA sagen Ukraine weitere Militärhilfe zu“.,https://img.zeit.de/news/2024-11/01/usa-sagen-ukraine-weitere-militaerhilfe-zu-image-group/wide__1300x731,2024-11-01T19:38:40Z,,Die USA stellen der Ukraine zur Abwehr des russischen Angriffskriegs weitere Militärausrüstung zur Verfügung. Das neue Paket habe einen Umfang von rund 425 Millionen US-Dollar (rund 392 Millionen Eur… [+891 chars],,de,'Russland'
https://www.zeit.de/news/2024-11/02/gabriel-kritisiert-spd-und-cdu-fuer-zugestaendnisse-ans-bsw,https://www.zeit.de/news/2024-11/02/gabriel-kritisiert-spd-und-cdu-fuer-zugestaendnisse-ans-bsw,0,www.zeit.de,Ukraine-Krieg und Raketenpläne: Gabriel kritisiert SPD und CDU für Zugeständnisse ans BSW,Hier finden Sie Informationen zu dem Thema „Ukraine-Krieg und Raketenpläne“. Lesen Sie jetzt „Gabriel kritisiert SPD und CDU für Zugeständnisse ans BSW“.,https://img.zeit.de/news/2024-11/02/gabriel-kritisiert-spd-und-cdu-fuer-zugestaendnisse-ans-bsw-image-group/wide__1300x731,2024-11-02T00:10:35Z,,"Der frühere Außenminister Sigmar Gabriel hat SPD und CDU für ihre Zugeständnisse an das Bündnis Sahra Wagenknecht (BSW) in mehreren ostdeutschen Bundesländern scharf kritisiert. Er forderte, auf die … [+2880 chars]",,de,'Ukraine'
https://www.zeit.de/news/2024-11/02/selenskyj-brauchen-waffen-gegen-nordkoreanische-soldaten,https://www.zeit.de/news/2024-11/02/selenskyj-brauchen-waffen-gegen-nordkoreanische-soldaten,0,www.zeit.de,Die Lage im Überblick: Selenskyj: Brauchen Waffen gegen nordkoreanische Soldaten,Hier finden Sie Informationen zu dem Thema „Die Lage im Überblick“. Lesen Sie jetzt „Selenskyj: Brauchen Waffen gegen nordkoreanische Soldaten“.,https://img.zeit.de/news/2024-11/02/selenskyj-brauchen-waffen-gegen-nordkoreanische-soldaten-image-group/wide__1300x731,2024-11-02T03:58:36Z,,"Der ukrainische Präsident Wolodymyr Selenskyj hat das Fehlen von Waffen beklagt, um die an die Front heranrückenden nordkoreanischen Soldaten in den Diensten der russischen Arme zu bekämpfen. «Wir kö… [+6378 chars]",,de,'Putin'
https://www.faz.net/aktuell/gesellschaft/kriminalitaet/athen-festnahme-nach-toedlicher-explosion-in-wohnhaus-110086418.html,https://www.faz.net/aktuell/gesellschaft/kriminalitaet/athen-festnahme-nach-toedlicher-explosion-in-wohnhaus-110086418.html,0,www.faz.net,Athen: Festnahme nach tödlicher Explosion in Wohnhaus,"Ein Terrorverdächtiger hat sich der griechischen Polizei gestellt. Der Sprengsatz war seinen Komplizen wohl versehentlich detoniert, eine Spur hat mit Deutschland zu tun.",https://media1.faz.net/ppmedia/aktuell/gesellschaft/743742726/1.10086447/facebook_teaser/kriminaltechniker-untersuchen.jpg,2024-11-03T04:28:32Z,http://archive.md/20241110145407/https://www.faz.net/aktuell/gesellschaft/kriminalitaet/athen-festnahme-nach-toedlicher-explosion-in-wohnhaus-110086418.html,"Bei der Explosion in einer Wohnung war am Donnerstag ein Mann ums Leben gekommen, eine Frau wurde verletzt. Den Ermittlern zufolge detonierte offenbar versehentlich ein selbst gebauter Sprengsatz.
G… [+616 chars]",,de,'Explosion'
https://www.faz.net/aktuell/politik/us-wahl/liveticker-us-wahl-2024-harris-tritt-bei-saturday-night-live-auf-faz-19444916.html,https://www.faz.net/aktuell/politik/us-wahl/liveticker-us-wahl-2024-harris-tritt-bei-saturday-night-live-auf-faz-19444916.html,0,www.faz.net,Liveblog zur US-Wahl 2024: Harris tritt bei „Saturday Night Live“ auf,Russland weist Vorwurf der Videofälschung zurück +++ Supreme Court durchkreuzt Pläne der Republikaner in Pennsylvania +++ Wahlleiter von Georgia warnt vor russischer Einmischung +++ Alle Neuigkeiten im Liveblog.,https://media0.faz.net/ppmedia/aktuell/politik/1995110804/1.10086446/facebook_teaser/das-double-und-die-echte.jpg,2024-11-03T04:35:02Z,,"Der republikanische Präsidentschaftskandidat Donald Trump geht die Republikanerin Liz Cheney nach Kritik an seinen Aussagen über die parteiinterne Widersacherin weiterhin scharf an. Ich sage nur, das… [+1043 chars]",,de,'Russland'
https://www.zeit.de/politik/ausland/2024-11/kyjiw-drohnenangriff-russland-ukraine-braende,https://www.zeit.de/politik/ausland/2024-11/kyjiw-drohnenangriff-russland-ukraine-braende,0,www.zeit.de,Kyjiw: Explosionen und Brände nach Drohnenangriff auf Kyjiw,Das ukrainische Militär hat eigenen Angaben zufolge einen Drohnenangriff auf Kyjiw abwehren können. Es sei jedoch zu Schäden an Gebäuden und Infrastruktur gekommen.,https://img.zeit.de/politik/ausland/2024-11/drohnenagriff-ukraine-kiew-bild/wide__1300x731,2024-11-03T07:24:28Z,,"Russland hat die ukrainische Hauptstadt Kyjiw in der Nacht erneut mit Drohnen angegriffen. Die Ukraine schoss die Fluggeräte nach eigenen Angaben ab, doch herabfallende Wrackteile verursachten Brände… [+2570 chars]",,de,'Explosion'
https://www.tagesspiegel.de/berlin/obdachlose-kalte-gefahr-stadte-rufen-zu-erhohter-achtsamkeit-auf-12636653.html,https://www.tagesspiegel.de/berlin/obdachlose-kalte-gefahr-stadte-rufen-zu-erhohter-achtsamkeit-auf-12636653.html,0,www.tagesspiegel.de,Obdachlose: Kälte-Gefahr: Städte rufen zu erhöhter Achtsamkeit auf,Die Kälte im Winter ist für Obdachlose mitunter die größte Gefahr. In Ausnahmefällen kann sie sogar zum Tod führen. Die Städte bitten daher ihre Bürger um Unterstützung.,https://www.tagesspiegel.de/images/12636650/alternates/BASE_16_9_W1400/1730624499000/notunterkunften-fur-obdachlose.jpeg,2024-11-03T09:01:39Z,,Brandenburgs Städte rufen ihre Bewohner angesichts sinkender Temperaturen zu mehr Achtsamkeit im Umgang mit Obdachlosen auf. Für die bevorstehende Winterzeit werden die Potsdamerinnen und Potsdamer u… [+1375 chars],,de,'Kälte'
https://steiermark.orf.at/stories/3279727/,https://steiermark.orf.at/stories/3279727/,0,steiermark.orf.at,Tischherd explodierte: Mann schwer verletzt,In Leoben ist ein 61-jähriger Mann am Samstag bei der Explosion eines Tischherds schwer verletzt worden. Der Herd befand sich in der Küche einer Wohnung in Leoben-Donawitz. Zeugen verständigten die Rettungskräfte.,https://ibs.orf.at/stm?image=https%3A%2F%2Foekastatic.orf.at%2Fmims%2F2021%2F24%2F71%2Fcrops%2Fw%3D1200%2Ch%3D627%2Cq%3D75%2F966014_master_339371_nef_mzell_c_leodolter_8.jpg%3Fs%3D3210cf76dc701c0ae5cfa514b1b7f490f9ab079b,2024-11-03T10:25:22Z,,"Gegen 12:00 Uhr wurden Polizeistreifen nach Donawitz beordert, da es dort laut Anzeiger zu einer Explosion gekommen sei. Beim Eintreffen der Beamten waren die Rettungskräfte bereits vor Ort.
Sie ver… [+483 chars]",,de,'Explosion'
https://www.zeit.de/politik/ausland/2024-11/ukraine-russland-kriegsgefangene-streit,https://www.zeit.de/politik/ausland/2024-11/ukraine-russland-kriegsgefangene-streit,0,www.zeit.de,Ukraine-Krieg: Ukraine weist russische Vorwürfe zu Gefangenenaustausch zurück,"Russland wirft der Ukraine vor, Hunderte Kriegsgefangene nicht würdig für einen Austausch gehalten und abgelehnt zu haben. Das Land weist das zurück und fordert Belege.",https://img.zeit.de/politik/ausland/2024-11/gefangenenaustausch-ukraine-russland-bild/wide__1300x731,2024-11-03T10:43:45Z,,"Die Ukraine hat Behauptungen des russischen Außenministeriums zurückgewiesen, das Land habe Hunderte für einen Austausch vorgeschlagene Kriegsgefangene nicht zurückhaben wollen. ""Wir sind jederzeit b… [+2676 chars]",,de,'Russland'
https://www.bild.de/leben-wissen/studie-belegt-frauen-sind-keine-frostbeulen-6630a603ea3d1b6187eb9761,https://www.bild.de/leben-wissen/studie-belegt-frauen-sind-keine-frostbeulen-6630a603ea3d1b6187eb9761,0,www.bild.de,Neue Studie widerlegt Vorurteil - Frauen sind KEINE Frostbeulen,"„Schatz, machst du mal die Heizung an?“ Jeder kennt den Mythos der ständig frierenden Frau. Aber hat Sie wirklich immer kalte Hände und ein Kälte-Problem?","https://images.bild.de/6630a603ea3d1b6187eb9761/bc0c6b3be8cf5c1f0e66cb449c2e909d,bc4d9cce?w=1280",2024-11-03T11:55:35Z,https://web.archive.org/web/20240920155739/https://www.bild.de/leben-wissen/studie-belegt-frauen-sind-keine-frostbeulen-6630a603ea3d1b6187eb9761,"Schatz, machst du mal die Heizung an? 
Jeder kennt den Mythos der ständig frierenden Frau. Während echte Kerle ohne mit der Wimper zu zucken bei zehn Grad im November noch in Shorts herumlaufen, kla… [+1586 chars]",,de,'Frieren'
https://www.tagesschau.de/ausland/europa/ukraine-kiew-angriffe-102.html,https://www.tagesschau.de/ausland/europa/ukraine-kiew-angriffe-102.html,0,www.tagesschau.de,Ukraine: Erneut schwere russische Angriffe auf Kiew,Die Ukraine erlebt derzeit eine der heftigsten Angriffswellen seit Langem. In der Nacht attackierte Russland erneut mit Drohnen die Hauptstadt Kiew. Gleichzeitig meldet Moskau weitere Eroberungen im Osten des Landes.,https://images.tagesschau.de/image/0b76b0ed-6591-4f41-a826-b5f6b5a434b5/AAABkvHlvXI/AAABkZLhkrw/16x9-1280/kiew-340.jpg,2024-11-03T12:20:58Z,,"Stand: 03.11.2024 13:20 Uhr
Die Ukraine erlebt derzeit eine der heftigsten Angriffswellen seit Langem. In der Nacht attackierte Russland erneut mit Drohnen die Hauptstadt Kiew. Gleichzeitig meldet M… [+3106 chars]",,de,'Russland'
https://www.n-tv.de/politik/17-38-Ex-US-Botschafter-McFaul-Trump-bewundert-Putin-Demokratie-ist-ihm-egal--article25334269.html,https://www.n-tv.de/politik/17-38-Ex-US-Botschafter-McFaul-Trump-bewundert-Putin-Demokratie-ist-ihm-egal--article25334269.html,0,www.n-tv.de,"Ukraine-Krieg im Liveticker: +++ 17:38 Ex-US-Botschafter McFaul: Trump bewundert Putin, Demokratie ist ihm egal +++",Lesen Sie alle aktuellen Entwicklungen und Nachrichten über den russischen Angriffskrieg auf die Ukraine im Liveticker von ntv.de.,https://bilder3.n-tv.de/img/incoming/crop25117070/4231326595-cImg_16_9-w1200/Ukraine-Liveticker.jpg,2024-11-03T16:38:00Z,,"Der Politikwissenschaftler und ehemalige US-Botschafter in Russland, Michael McFaul, blickt mit Sorge auf eine mögliche zweite Amtszeit von Donald Trump als US-Präsident. Er fürchte, ""dass Trump die … [+18276 chars]",,de,'Explosion'
https://www.n-tv.de/politik/Uber-50-Laender-fordern-Waffenembargo-gegen-Israel-article25333975.html,https://www.n-tv.de/politik/Uber-50-Laender-fordern-Waffenembargo-gegen-Israel-article25333975.html,0,www.n-tv.de,Türkei-Schreiben an UN: Über 50 Länder fordern Waffenembargo gegen Israel,"Mehr als 50 Nationen und Organisationen fordern die Vereinten Nationen auf, ein Waffenembargo gegen Israel zu verhängen. Die Unterzeichner des Schreibens sehen in den Lieferungen dieser Ausrüstung und Munition ""eine Beteiligung an einem Völkermord"".",https://bilder4.n-tv.de/img/incoming/crop25333971/1501325383-cImg_16_9-w1200/448905403.jpg,2024-11-03T17:51:20Z,,"Mehr als 50 Nationen und Organisationen fordern die Vereinten Nationen auf, ein Waffenembargo gegen Israel zu verhängen. Die Unterzeichner des Schreibens sehen in den Lieferungen dieser Ausrüstung un… [+1276 chars]",,de,'Waffen'
https://www.tagesspiegel.de/internationales/sicherheitsberater-wirft-moskau-wahleinmischung-vor-moldau-ermittelt-wegen-transport-von-wahlern-aus-russland-ins-ausland-12638831.html,https://www.tagesspiegel.de/internationales/sicherheitsberater-wirft-moskau-wahleinmischung-vor-moldau-ermittelt-wegen-transport-von-wahlern-aus-russland-ins-ausland-12638831.html,0,www.tagesspiegel.de,Sicherheitsberater wirft Moskau Wahleinmischung vor: Moldau ermittelt wegen Transport von Wählern aus Russland ins Ausland,"Gewinnt die proeuropäische Amtsinhaberin oder ihr moskaufreundlicher Herausforderer die Stichwahl? Aufsehen erregen am Wahltag vor allem mutmaßlich organisierte Wählertransporte, die illegal sind.",https://www.tagesspiegel.de/images/12638888/alternates/BASE_16_9_W1400/1730657421000/chisinau-republik-moldau-03-november-2024-zeitgeschehen-republik-moldau-2024-im-bild-lange-schlangen-vor-den-wahll.jpeg,2024-11-03T18:24:01Z,,In der Republik Moldau hat der nationale Sicherheitsberater der prowestlichen Staatschefin Maia Sandu bei der laufenden Stichwahl um das Präsidentenamt Russland massive Einmischung vorgeworfen. Die W… [+3940 chars],,de,'Russland'
https://www.tagesspiegel.de/internationales/kritik-am-sieg-der-prasidentin-prowestliche-amtsinhaberin-sandu-gewinnt-stichwahl-in-moldau-12638831.html,https://www.tagesspiegel.de/internationales/kritik-am-sieg-der-prasidentin-prowestliche-amtsinhaberin-sandu-gewinnt-stichwahl-in-moldau-12638831.html,0,www.tagesspiegel.de,Kritik am Sieg der Präsidentin: Prowestliche Amtsinhaberin Sandu gewinnt Stichwahl in Moldau,Präsidentin Sandu entschied die Wahl in der Republik Moldau für sich – vor allem durch die Stimmen der Diaspora. In dem zwischen Russland und dem Westen hin- und hergerissenen Land gibt es nun Kritik.,https://www.tagesspiegel.de/images/12639563/alternates/BASE_16_9_W1400/1730695300000/moldova-holds-second-round-of-presidential-election.jpeg,2024-11-03T18:24:01Z,,Nach dem vorläufigen amtlichen Endergebnis bei der Stichwahl um das Präsidentenamt in Moldau hat Amtsinhaberin Maia Sandu mit deutlichem Abstand gewonnen. Die Präsidentin des verarmten Landes zwische… [+9077 chars],,de,'Russland'
https://www.tagesspiegel.de/internationales/erste-teilergebnisse-bekannt-russlandfreundlicher-kandidat-fuhrt-bei-prasidentenwahl-in-moldau-12638831.html,https://www.tagesspiegel.de/internationales/erste-teilergebnisse-bekannt-russlandfreundlicher-kandidat-fuhrt-bei-prasidentenwahl-in-moldau-12638831.html,0,www.tagesspiegel.de,Erste Teilergebnisse bekannt: Russlandfreundlicher Kandidat führt bei Präsidentenwahl in Moldau,"Gewinnt die proeuropäische Amtsinhaberin oder ihr moskaufreundlicher Herausforderer die Stichwahl? Noch werden Stimmen ausgezählt, aber es gibt erste Ergebnisse.",https://www.tagesspiegel.de/images/12639236/alternates/BASE_16_9_W1400/1730667885000/moldova-presidential-election-8796933-03-11-2024-moldova-s-presidential-candidate-alexandr-stoianoglo-talks-to-the-media.jpeg,2024-11-03T18:24:01Z,,Bei der Stichwahl um das Präsidentenamt in Moldau liegt der russlandfreundliche Kandidat Alexandr Stoianoglo Teilergebnissen zufolge knapp vor der proeuropäischen Amtsinhaberin Maia Sandu. Wie die Wa… [+4539 chars],,de,'Russland'
https://www.diepresse.com/19030719/die-totalitaeren-vier-im-kampf-gegen-den-westen,https://www.diepresse.com/19030719/die-totalitaeren-vier-im-kampf-gegen-den-westen,0,www.diepresse.com,Die totalitären vier im Kampf gegen den Westen [premium],"Russland kann in seinem Angriffskrieg gegen die Ukraine auf militärische Hilfe aus Nordkorea, Iran und China zählen.",https://www.diepresse.com/assets_v2/images/diepresse_meinung.png,2024-11-03T18:42:44Z,,"Russland kann in seinem Angriffskrieg gegen die Ukraine auf militärische Hilfe aus Nordkorea, Iran und China zählen.
Der russische Botschafter bei den Vereinten Nationen, Wassili Nebensja, tat das, … [+863 chars]",,de,'Ukraine'
https://www.faz.net/aktuell/politik/us-wahl/us-wahl-putin-ist-fast-egal-ob-trump-oder-harris-gewinnt-110087167.html,https://www.faz.net/aktuell/politik/us-wahl/us-wahl-putin-ist-fast-egal-ob-trump-oder-harris-gewinnt-110087167.html,0,www.faz.net,Moskau und die US-Wahl: Trump oder Harris – das ist Putin fast egal,Russland wirbt nicht für Donald Trump wie 2016. Denn der bleibt trotz Avancen auch für den Kreml schwer kalkulierbar.,https://media0.faz.net/ppmedia/aktuell/gesellschaft/1371913973/1.10087166/facebook_teaser/handschlag-trump-und-putin.jpg,2024-11-03T20:07:46Z,http://archive.md/20241103210845/https://www.faz.net/aktuell/politik/us-wahl/us-wahl-putin-ist-fast-egal-ob-trump-oder-harris-gewinnt-110087167.html,"Dieser Tage lohnt es sich, an einen anderen Auftritt Schirinowskijs zu erinnern: Im November 2016 stieß er im Kreise seiner Partei mit Sekt auf den Sieg Donald Trumps bei der amerikanischen Präsident… [+4508 chars]",,de,'Russland'
https://www.faz.net/aktuell/politik/ausland/moldau-praesidentschaftswahl-knappes-rennen-zeichnet-sich-ab-110087899.html,https://www.faz.net/aktuell/politik/ausland/moldau-praesidentschaftswahl-knappes-rennen-zeichnet-sich-ab-110087899.html,0,www.faz.net,Moldau-Präsidentschaftswahl: Knappes Rennen zeichnet sich ab,"Bei der Präsidentschaftswahl in Moldau geht es um den zukünftigen Kurs des Landes. Aufsehen erregen am Wahltag mutmaßlich organisierte Wählertransporte aus Russland. Noch werden Stimmen ausgezählt, aber es gibt erste Ergebnisse.",https://media1.faz.net/ppmedia/aktuell/politik/1681575891/1.10087901/facebook_teaser/maia-sandu-amtierende.jpg,2024-11-03T20:54:34Z,,"Der 57-Jährige trat für die Partei der Sozialisten des moskaufreundlichen Ex-Präsidenten Igor Dodon an. Sandu kam demnach auf rund 48 Prozent, nachdem rund 79 Prozent der Stimmen ausgezählt waren, wi… [+3916 chars]",,de,'Russland'
