index,url,valid,domain,title,description,image,published,archive,content,quote,language,keyword
https://www.zeit.de/wirtschaft/2023-02/inflation-europaeische-zentralbank-ezb-leitzins-erhoehung,https://www.zeit.de/wirtschaft/2023-02/inflation-europaeische-zentralbank-ezb-leitzins-erhoehung,0,www.zeit.de,"Inflation: EZB erhöht Leitzins um 0,5 Prozentpunkte",Zur Bekämpfung der Inflation hat die Europäische Zentralbank den Leitzins erneut angehoben. Für Mitte März wurde eine weitere Erhöhung in Aussicht gestellt.,,2023-02-02T13:32:15Z,https://web.archive.org/web/20230202135102/https://www.zeit.de/wirtschaft/2023-02/inflation-europaeische-zentralbank-ezb-leitzins-erhoehung,"When browsing with ads:
We collect personal data and also transmit it to third-party providers
 that help us improve and finance our digital content. Some of the information stored on your device, … [+732 chars]",,de,'Inflation'
https://www.zeit.de/news/2023-02/02/schnee-und-eis-verursachen-probleme-auf-strassen-in-der-rhoen,https://www.zeit.de/news/2023-02/02/schnee-und-eis-verursachen-probleme-auf-strassen-in-der-rhoen,0,www.zeit.de,Fulda: Schnee und Eis verursachen Probleme auf Straßen in der Rhön,,,2023-02-02T14:24:51Z,,"When browsing with ads:
We collect personal data and also transmit it to third-party providers
 that help us improve and finance our digital content. Some of the information stored on your device, … [+732 chars]",,de,'Schnee'
https://www.sueddeutsche.de/meinung/deutschland-ukraine-russland-waffen-krieg-kanzler-scholz-kommentar-1.5744043,https://www.sueddeutsche.de/meinung/deutschland-ukraine-russland-waffen-krieg-kanzler-scholz-kommentar-1.5744043,0,www.sueddeutsche.de,Waffen für die Ukraine: Lasst den Kanzler grübeln,"Munition, Haubitzen, Panzer - nun Kampfjets? Die Entscheidungen über Waffen für die Ukraine haben enorme Tragweite. Denn sie können Deutschland in einen Krieg mit Russland führen. Das sollten alle bedenken, die allzu leichtfertig mit Gewissheiten um sich werf…",https://www.sueddeutsche.de/image/sz.1.5744044/1200x675?v=1675353816,2023-02-02T16:03:42Z,https://web.archive.org/web/20230202161621/https://www.sueddeutsche.de/meinung/deutschland-ukraine-russland-waffen-krieg-kanzler-scholz-kommentar-1.5744043,"Munition, Haubitzen, Panzer - nun Kampfjets? Die Entscheidungen über Waffen für die Ukraine haben enorme Tragweite. Denn sie können Deutschland in einen Krieg mit Russland führen. Das sollten alle be… [+769 chars]",,de,'Waffen'
https://www.n-tv.de/politik/Putin-droht-Deutschland-in-Stalingrad-Rede-article23889151.html,https://www.n-tv.de/politik/Putin-droht-Deutschland-in-Stalingrad-Rede-article23889151.html,0,www.n-tv.de,"""Wieder sind es deutsche Panzer"": Putin droht Deutschland in Stalingrad-Rede","Die Schlacht um Stalingrad ist vielen Russen heilig. Zum 80. Jubiläum reist der russische Präsident dorthin, um die Gedenkfeier für seine Kriegspropaganda zu nutzen. Die deutschen Panzerlieferungen nennt er eine Bedrohung Russlands, auf die er ""antworten"" wer…",https://bilder2.n-tv.de/img/incoming/crop23889169/2681322170-cImg_16_9-w1200/393761417.jpg,2023-02-02T16:14:15Z,,"Die Schlacht um Stalingrad ist vielen Russen heilig. Zum 80. Jubiläum reist der russische Präsident dorthin, um die Gedenkfeier für seine Kriegspropaganda zu nutzen. Die deutschen Panzerlieferungen n… [+3258 chars]",,de,'Kälte'
https://www.faz.net/aktuell/wirtschaft/die-ezb-sendet-im-kampf-gegen-die-inflation-unklare-signale-18649306.html,https://www.faz.net/aktuell/wirtschaft/die-ezb-sendet-im-kampf-gegen-die-inflation-unklare-signale-18649306.html,0,www.faz.net,Kampf gegen die Inflation: Die EZB sendet unklare Signale,"Es ist gut, dass Europas Notenbank die Leitzinsen noch einmal erhöht hat. Wie sie im Frühjahr weitermacht, bleibt aber ungewiss. Bricht sie ihren Kampf gegen die Inflation zu früh ab, kann das teuer werden.",https://media1.faz.net/ppmedia/aktuell/1875217249/1.8649305/facebook_teaser/der-naechste-schritt-ist-getan.jpg,2023-02-02T19:45:14Z,https://web.archive.org/web/20230202194821/http://www.faz.net/aktuell/wirtschaft/die-ezb-sendet-im-kampf-gegen-die-inflation-unklare-signale-18649306.html,"Der nächste Schritt ist getan: Christine Lagarde erläutert die Strategie der von ihr geführten Europäischen Zentralbank Bild: Lucas Bäuml
Es ist gut, dass Europas Notenbank die Leitzinsen noch einma… [+2259 chars]",,de,'Inflation'
https://www.zeit.de/politik/ausland/2023-02/ukraine-ueberblick-cia-direktor-6-monate-bundesregierung-freigabe-leopard-1-kampfpanzer,https://www.zeit.de/politik/ausland/2023-02/ukraine-ueberblick-cia-direktor-6-monate-bundesregierung-freigabe-leopard-1-kampfpanzer,0,www.zeit.de,"Ukraine-Überblick: CIA setzt auf die kommenden sechs Monate, Leopard-Deal vor Durchbruch",Im Kampf gegen Russland zählt laut CIA vor allem das nächste halbe Jahr. Die Bundesregierung will offenbar die Weitergabe von Leopard-1-Kampfpanzern zulassen. Die Nacht,,2023-02-03T04:30:11Z,https://web.archive.org/web/20230203045433/https://www.zeit.de/politik/ausland/2023-02/ukraine-ueberblick-cia-direktor-6-monate-bundesregierung-freigabe-leopard-1-kampfpanzer,"When browsing with ads:
We collect personal data and also transmit it to third-party providers
 that help us improve and finance our digital content. Some of the information stored on your device, … [+732 chars]",,de,'Russland'
https://www.zeit.de/news/2023-02/03/kein-diesel-aus-russland-was-der-eu-boykott-bedeutet,https://www.zeit.de/news/2023-02/03/kein-diesel-aus-russland-was-der-eu-boykott-bedeutet,0,www.zeit.de,Kraftstoffe: Kein Diesel aus Russland: Was der EU-Boykott bedeutet,,,2023-02-03T06:47:26Z,https://web.archive.org/web/20230203072354/https://www.zeit.de/news/2023-02/03/kein-diesel-aus-russland-was-der-eu-boykott-bedeutet,"When browsing with ads:
We collect personal data and also transmit it to third-party providers
 that help us improve and finance our digital content. Some of the information stored on your device, … [+732 chars]",,de,'Russland'
https://www.zeit.de/wirtschaft/2023-02/tuerkei-inflation-verbraucherpreise-energieimporte,https://www.zeit.de/wirtschaft/2023-02/tuerkei-inflation-verbraucherpreise-energieimporte,0,www.zeit.de,Verbraucherpreise: Inflation in der Türkei verliert an Fahrt,Im vorigen Jahr waren die Preise für Waren und Dienstleistungen in der Türkei in Rekordtempo gestiegen. Nun geht die Inflation bereits den dritten Monat in Folge zurück.,,2023-02-03T09:43:21Z,https://web.archive.org/web/20230203102209/https://www.zeit.de/wirtschaft/2023-02/tuerkei-inflation-verbraucherpreise-energieimporte,"When browsing with ads:
We collect personal data and also transmit it to third-party providers
 that help us improve and finance our digital content. Some of the information stored on your device, … [+732 chars]",,de,'Inflation'
https://www.zeit.de/news/2023-02/03/nato-wirft-russland-bruch-von-atomwaffenvertrag-vor,https://www.zeit.de/news/2023-02/03/nato-wirft-russland-bruch-von-atomwaffenvertrag-vor,0,www.zeit.de,New Start: Nato wirft Russland Bruch von Atomwaffenvertrag vor,,,2023-02-03T11:29:05Z,https://web.archive.org/web/20230203115140/https://www.zeit.de/news/2023-02/03/nato-wirft-russland-bruch-von-atomwaffenvertrag-vor,"When browsing with ads:
We collect personal data and also transmit it to third-party providers
 that help us improve and finance our digital content. Some of the information stored on your device, … [+732 chars]",,de,'Russland'
https://www.handelsblatt.com/finanzen/banken-versicherungen/banken/finanzsanktionen-china-tuerkei-und-vae-wenden-sich-von-russlands-banken-ab-druck-auf-moskau-steigt/28959602.html,https://www.handelsblatt.com/finanzen/banken-versicherungen/banken/finanzsanktionen-china-tuerkei-und-vae-wenden-sich-von-russlands-banken-ab-druck-auf-moskau-steigt/28959602.html,0,www.handelsblatt.com,"Finanzsanktionen: China, Türkei und VAE wenden sich von Russlands Banken ab – Druck auf Moskau steigt",Bislang hatten Russlands Geldhäuser westliche Finanzsanktionen durch intensivere Geschäfte mit anderen Partnern ausgeglichen. Nun beugen auch diese sich den „Secondary Sanctions“.,https://www.handelsblatt.com/images/icbc-filiale-in-peking/28960248/2-format2003.jpg,2023-02-03T12:51:54Z,,"Przemysl Nur durch ein starkes letztes Quartal sind Russlands Banken 2022 an einem Verlustjahr vorbeigeschrammt. Und aktuell sieht es nicht so aus, also ob dieses Jahr besser wird. Denn auch Banken a… [+4135 chars]",,de,'Russland'
https://www.stern.de/politik/deutschland/kriegsdienstverweigerung--487-menschen-verzichten-2022-auf-anerkennung-33163286.html,https://www.stern.de/politik/deutschland/kriegsdienstverweigerung--487-menschen-verzichten-2022-auf-anerkennung-33163286.html,0,www.stern.de,Ukraine-Krieg ohne Auswirkung: Ein Gewissen kann sich wandeln: So viele Deutsche zogen 2022 ihre Kriegsdienstverweigerung zurück,Mehr als 400 Menschen haben seit Beginn des Krieges gegen die Ukraine ihre Kriegsdienstverweigerung widerrufen – deutlich mehr als im gesamten Vorjahr. Allerdings ist die Zahl im Langfrist-Vergleich auch kein Ausreißer.,https://image.stern.de/33163900/t/JI/v3/w1440/r1.7778/-/kriegsdienstverweigerung.jpg,2023-02-03T12:53:00Z,,"""Niemand darf gegen sein Gewissen zum Kriegsdienst mit der Waffe gezwungen werden."" Das regelt klipp und klar Artikel 4, Absatz 3 des Grundgesetzes. Und trotz der seit 2011 ausgesetzten Wehrpflicht m… [+3132 chars]",,de,'Ukraine'
https://www.wiwo.de/unternehmen/industrie/wachstums-strategie-bosch-will-chinageschaeft-vorantreiben/28962334.html,https://www.wiwo.de/unternehmen/industrie/wachstums-strategie-bosch-will-chinageschaeft-vorantreiben/28962334.html,0,www.wiwo.de,Wachstums-Strategie: Bosch will Chinageschäft vorantreiben,Sind deutsche Unternehmen zu abhängig von China? Seit dem Krieg in der Ukraine wird diese Frage immer wieder diskutiert. Der Technologieriese Bosch hat da eine klare Meinung.,https://www.wiwo.de/images/klimakammer-bei-bosch/28962332/1-format11240.jpg,2023-02-03T12:53:16Z,,"Der Technologiekonzern Bosch will sein Chinageschäft trotz der Diskussionen um die Abhängigkeiten von einzelnen Märkten vorantreiben. Der Markt muss bedient werden, das ist wichtig. Wer in dem Markt … [+2944 chars]",,de,'Ukraine'
https://www.stern.de/politik/ausland/ukraine--russischer-panzer-stoesst-kammeraden-mit-kanone-um-33163990.html,https://www.stern.de/politik/ausland/ukraine--russischer-panzer-stoesst-kammeraden-mit-kanone-um-33163990.html,0,www.stern.de,Drohnenvideo: Russischer Panzer wirft eigene Soldaten mit Kanone um – Ukraine-Ministerium spottet auf Twitter,"Dieser Clip soll ein Missgeschick eines russischen Panzerfahrers zeigen. Mit seiner Kanone wirft der Panzer mehrere Kammeraden um, die auf einem zweiten Fahrzeug sitzen. Das Verteidigungsministerium der Ukraine postet das Video auf Twitter.",https://image.stern.de/33163968/t/Zc/v2/w1440/r1.7778/-/russischer-panzer.jpg,2023-02-03T12:55:00Z,,"Sehen Sie im Video: Russischer Panzer stößt Kammeraden mit Kanone um Ukraine-Ministerium reagiert mit Spott auf Twitter.Dieser Clip soll ein Missgeschick eines russischen Panzerfahrers zeigen.
Mit s… [+1030 chars]",,de,'Ukraine'
https://www.telepolis.de/features/CIA-Chef-Burns-Ausgang-Ukraine-Krieg-entscheidet-sich-in-naechsten-sechs-Monaten-7483973.html,https://www.telepolis.de/features/CIA-Chef-Burns-Ausgang-Ukraine-Krieg-entscheidet-sich-in-naechsten-sechs-Monaten-7483973.html,0,www.telepolis.de,CIA-Chef Burns: Ausgang Ukraine-Krieg entscheidet sich in nächsten sechs Monaten,"Unterstützung der USA für einen langen Krieg ist nicht unbedingt garantiert. Angebliches Verhandlungsangebot an Moskau und Kiew. Gespaltene Lager in Washington, auch wenn es um die Krim geht.",https://heise.cloudimg.io/bound/1200x1200/q85.png-lossy-85.webp-lossy-85.foil1/_www-heise-de_/imgs/18/3/6/9/2/7/2/8/panzer-front_ho-7709aa66bc0a15ef.png,2023-02-03T13:15:00Z,,"Unterstützung der USA für einen langen Krieg ist nicht unbedingt garantiert. Angebliches Verhandlungsangebot an Moskau und Kiew. Gespaltene Lager in Washington, auch wenn es um die Krim geht.
Militä… [+6697 chars]",,de,'Ukraine'
https://www.dw.com/de/republik-moldau-neue-drohungen-aus-moskau/a-64603166,https://www.dw.com/de/republik-moldau-neue-drohungen-aus-moskau/a-64603166,0,www.dw.com,Republik Moldau: Neue Drohungen aus Moskau,"Der russische Außenminister Sergej Lawrow hat der Republik Moldau gedroht, sie würde als Nächstes das Schicksal der Ukraine ereilen. Das Außenministerium in Chisinau reagierte umgehend. Der russische Außenminister Sergej Lawrow hat die Republik Moldau als neu…",https://static.dw.com/image/64216719_6.jpg,2023-02-03T13:34:00Z,,"Der russische Außenminister Sergej Lawrow hat die Republik Moldau als neues ""anti-russisches Projekt"" des Westens ins Visier genommen. Der Westen habe ""sein Auge auf die Republik Moldau gerichtet"" un… [+5901 chars]",,de,'Ukraine'
https://www.welt.de/politik/ausland/plus243555853/Kuenstliche-Intelligenz-Wie-ukrainische-KI-Experten-Russlands-Raketen-abwehren.html,https://www.welt.de/politik/ausland/plus243555853/Kuenstliche-Intelligenz-Wie-ukrainische-KI-Experten-Russlands-Raketen-abwehren.html,0,www.welt.de,Mit „Zvook“ gegen den Raketenterror – die Geheimwaffe der ukrainischen Flugabwehr,"Russische Raketen, die die Infrastruktur zerstören und Zivilisten terrorisieren: Für die Ukraine sind sie eine ständige Bedrohung. Doch die Flugabwehr wird immer besser – auch dank eines Geheimprojekts, das ukrainische KI-Experten entwickelt haben. WELT hat e…",https://img.welt.de/img/politik/ausland/mobile243555843/6641357597-ci16x9-w1200-fnov-fpotl-fpi157750653/Ukrainian-military-fire-an-anti-aircraft-weapon-in-Bakhmut-7.jpg,2023-02-03T13:37:00Z,,"Geleeu peteneklel. Blu Beel pekenl plek pel elueO 6tep Bulvelu toeketup Pltpel uuu lkleu htelueu Pokueu eu. Bluel lpl lO Glupelveaeu uepeu pelueu Btlelu eluaepekteteu, pel eupele lupl tloktlek pnlek … [+5625 chars]",,de,'Ukraine'
https://www.tagesschau.de/ausland/mittelmeer-migranten-111.html,https://www.tagesschau.de/ausland/mittelmeer-migranten-111.html,0,www.tagesschau.de,Flucht über das Mittelmeer: Seenotretter bergen tote Migranten,Die italienische Küstenwache und private Seenotretter haben auf dem Mittelmeer mehr als 140 Geflüchtete in Sicherheit gebracht. Für mindestens zehn Menschen kam die Hilfe jedoch zu spät. Überlebende berichteten von zwei weiteren Toten.,https://www.tagesschau.de/multimedia/bilder/sea-eye-4-105~_v-original.jpg,2023-02-03T17:38:24Z,,Die italienische Küstenwache und private Seenotretter haben auf dem Mittelmeer mehr als 140 Geflüchtete in Sicherheit gebracht. Für mindestens zehn Menschen kam die Hilfe jedoch zu spät. Überlebende … [+2595 chars],,de,'Flucht'
https://www.faz.net/aktuell/politik/ausland/wagner-soelder-in-norwegen-zweifel-an-fluchtgeschichte-18652430.html,https://www.faz.net/aktuell/politik/ausland/wagner-soelder-in-norwegen-zweifel-an-fluchtgeschichte-18652430.html,0,www.faz.net,„Wagner“-Söldner in Norwegen: Eine Fluchtgeschichte wie aus einem Spionageroman,"An der Geschichte des „Wagner“-Söldners Andrej Medwedjew, der in Oslo Asyl beantragte, mehren sich Zweifel. Dabei geht es auch um die Frage, ob der russische Inlandsgeheimdienst FSB vorher von der Flucht gewusst hat.",https://media1.faz.net/ppmedia/aktuell/politik/ausland/3846208611/1.8652429/facebook_teaser/in-andrej-medwedjews-version.jpg,2023-02-03T17:45:16Z,http://archive.md/20230203203756/https://www.faz.net/aktuell/politik/ausland/wagner-soelder-in-norwegen-zweifel-an-fluchtgeschichte-18652430.html,"Andrej Medwedjew ist durch seine Flucht berühmt geworden. Weltweit berichteten Medien über den Russen, der in Norwegen Asyl beantragte und angibt, Kommandeur der russischen Söldnertruppe Wagner in de… [+4559 chars]",,de,'Flucht'
https://www.jungewelt.de/artikel/444241.sportpolitik-das-ioc-bewegt-sich-auf-dünnem-eis.html,https://www.jungewelt.de/artikel/444241.sportpolitik-das-ioc-bewegt-sich-auf-dünnem-eis.html,0,www.jungewelt.de,Sportpolitik: »Das IOC bewegt sich auf dünnem Eis«,Über Möglichkeiten und Grenzen des internationalen Sports anlässlich des Ukraine-Krieges. Ein Gespräch mit Jürgen Mittag • Foto: Rob Schumacher/USA TODAY Sports/imago,https://www.jungewelt.de/img/1100/176991.jpg,2023-02-03T18:39:49Z,,Bei den Biathlon-Weltmeisterschaften ab kommenden Mittwoch in Oberhof werden Athleten aus Russland und Belarus nicht starten dürfen wie schon Ende Januar beim Weltchampionat der Rodler am selben Ort.… [+17112 chars],,de,'Ukraine'
https://burgenland.orf.at/stories/3193263/,https://burgenland.orf.at/stories/3193263/,0,burgenland.orf.at,Pellets werden immer beliebter,Heizen mit Holzpellets gilt als umweltfreundliche Alternative zu Öl und Gas. Allein im Vorjahr wurden österreichweit mehr als 22.000 Pelletsöfen in Betrieb genommen. Enorm gestiegen ist wegen der großen Nachfrage allerdings auch der Preis.,https://ibs.orf.at/bgl?image=https%3A%2F%2Foekastatic.orf.at%2Fmims%2F2023%2F05%2F65%2Fcrops%2Fw%3D1200%2Ch%3D627%2Cq%3D75%2F1664591_master_612665_230203_bh_pelletslieferant_00_00_18_01-modified.jpg%3Fs%3D9f36a59b6c6a3db7019bd2b1a2513ad7347ceacc,2023-02-03T18:54:11Z,,Vom Gewerbegebiet Antau (Bezirk Mattersburg) aus werden Haushalte im Nordburgenland mit Pellets beliefert. 4.000 Tonnen können dort abgefüllt und gelagert werden. Eigentümer ist das Raiffeisenunterne… [+1670 chars],,de,'Heizen'
https://www.n-tv.de/politik/22-57-Selenskyj-EU-Betrittsverhandlungen-koennen-dieses-Jahr-beginnen--article23892561.html,https://www.n-tv.de/politik/22-57-Selenskyj-EU-Betrittsverhandlungen-koennen-dieses-Jahr-beginnen--article23892561.html,0,www.n-tv.de,Ukraine-Krieg im Liveticker: +++ 22:57 Selenskyj: EU-Betrittsverhandlungen können dieses Jahr beginnen +++,"Berlin, Washington, Br\u00fcssel - \u00fcberall. n-tv berichtet von allen wichtigen Schaupl\u00e4tzen der Innen- und Au\u00dfenpolitik.",https://bilder2.n-tv.de/img/incoming/crop23332537/9041326157-cImg_16_9-w1200/Liveticker1-grau-1-Kopie.jpg,2023-02-03T19:00:00Z,,"Der ukrainische Präsident Wolodymyr Selenskyj macht nach dem Gipfel mit der EU in Kiew weiter Druck für einen raschen Beitritt seines Landes zur Europäischen Union. ""Wir sprechen bereits als Mitglied… [+37175 chars]",,de,'Ukraine'
https://www.n-tv.de/politik/USA-liefern-Ukraine-jetzt-auch-GLSDB-Raketen-article23892371.html,https://www.n-tv.de/politik/USA-liefern-Ukraine-jetzt-auch-GLSDB-Raketen-article23892371.html,0,www.n-tv.de,Reichweite wird fast verdoppelt: USA liefern Ukraine jetzt auch GLSDB-Raketen,"Mit mehr als 29 Milliarden Dollar an zugesagten Militärhilfen sind die USA der wichtigste Verbündete der Ukraine. Nun schnüren sie ein neues Paket, das auch Präzisionsraketen enthält. Diese erweitern die Reichweite der ukrainischen Artillerie.",https://bilder1.n-tv.de/img/incoming/crop23715720/4001329411-cImg_16_9-w1200/309741599.jpg,2023-02-03T19:01:24Z,,"Mit mehr als 29 Milliarden Dollar an zugesagten Militärhilfen sind die USA der wichtigste Verbündete der Ukraine. Nun schnüren sie ein neues Paket, das auch Präzisionsraketen enthält. Diese erweitern… [+1915 chars]",,de,'Ukraine'
https://www.faz.net/aktuell/politik/ausland/ukraine-krieg-blogger-wolodymyr-solkin-interviewt-russische-gefangene-18647087.html,https://www.faz.net/aktuell/politik/ausland/ukraine-krieg-blogger-wolodymyr-solkin-interviewt-russische-gefangene-18647087.html,0,www.faz.net,Ein ukrainischer Blogger verhört russische Kriegsgefangene,Der Blogger Wolodymyr Solkin verhört auf seinem Youtube-Kanal russische Kriegsgefangene. Die Videos erreichen ein Millionenpublikum und sollen in Russland einen Wandel bewirken.,https://media0.faz.net/ppmedia/aktuell/704095240/1.8648750/facebook_teaser/eine-gruppe-freigelassener.jpg,2023-02-03T19:10:57Z,http://archive.md/20230203231841/https://www.faz.net/aktuell/politik/ausland/ukraine-krieg-blogger-wolodymyr-solkin-interviewt-russische-gefangene-18647087.html,"Eine Wand, davor ein Tisch, dazu die Aufnahmetechnik. Links am Tisch sitzt Wolodymyr Solkin, der Interviewer. Ihm gegenüber der Interviewte. Das Ungewöhnliche an Gesprächen wie diesem: Der Fragestell… [+3877 chars]",,de,'Ukraine'
https://www.focus.de/politik/ausland/bekaempft-die-ukraine-ihre-korruption-oder-ist-alles-nur-show_id_184830355.html,https://www.focus.de/politik/ausland/bekaempft-die-ukraine-ihre-korruption-oder-ist-alles-nur-show_id_184830355.html,0,www.focus.de,Durchsuchungen bei Oligarchen - Betreibt Kiew echte Korruptionsbekämpfung - oder ist alles nur Show?,"Der Februar begann in der Ukraine mit vielen Durchsuchungen bei Politikern, Staatsdienern und Oligarchen. Manche wurden entlassen, andere stehen nun unter Verdacht. Welches Ziel verfolgt die Führung in Kiew?",https://p6.focus.de/img/politik/ausland/id_184830337/einsatzkraefte-des-sicherheitsdienstes-der-ukraine-sbu-.jpg?im=Crop%3D%280%2C29%2C940%2C470%29%3BResize%3D%281200%2C627%29&hash=541458ef2de0230da75f6f4dfe5dd842797d7959fb502cf7cd1eab8144624922,2023-02-03T19:16:46Z,https://web.archive.org/web/20230204001826/https://www.focus.de/politik/ausland/bekaempft-die-ukraine-ihre-korruption-oder-ist-alles-nur-show_id_184830355.html,"Die ukrainischen Strafverfolgungsbehörden haben ihre Aktivitäten gegen Korruption merklich intensiviert. Anfang Februar gab es aufsehenerregende Durchsuchungen und Entlassungen.
So teilt der Sicherh… [+5732 chars]",,de,'Ukraine'
https://www.stern.de/news/eu-ratspraesident-sieht-zukunft-der-ukraine-bei-der-eu-33165438.html,https://www.stern.de/news/eu-ratspraesident-sieht-zukunft-der-ukraine-bei-der-eu-33165438.html,0,www.stern.de,EU-Ratspräsident sieht Zukunft der Ukraine bei der EU,"Bei einem Gipfeltreffen in Kiew hat die EU am Freitag die ""beträchtlichen Anstrengungen"" der Ukraine bei ihrer Bewerbung um die Mitgliedschaft in dem Bündnis gewürdigt. ""Die Zukunft der Ukraine ist bei der EU "", betonte EU-Ratspräsident Charles Michel am Frei…",https://image.stern.de/33165440/t/Z6/v1/w1440/r1.7778/-/03--euukrainegipfel-in-kiew---ba1b7d5d989988e0.jpg,2023-02-03T19:28:04Z,,"Bei einem Gipfeltreffen in Kiew hat die EU am Freitag die ""beträchtlichen Anstrengungen"" der Ukraine bei ihrer Bewerbung um die Mitgliedschaft in dem Bündnis gewürdigt. ""Die Zukunft der Ukraine ist b… [+3350 chars]",,de,'Ukraine'
https://www.focus.de/politik/ausland/militaerexperte-in-ukraine-kampfjets-entscheidung-zu-99-8-prozent-getroffen_id_184834103.html,https://www.focus.de/politik/ausland/militaerexperte-in-ukraine-kampfjets-entscheidung-zu-99-8-prozent-getroffen_id_184834103.html,0,www.focus.de,Ukraine - Kiew plant schon mit westlichen Kampfjets,"Die Entscheidung für westliche Kampfflugzeuge ist längst getroffen, sagen Analysten. Im Moment gehe es nur noch darum, welcher Flugzeug-Typ das sein soll.",https://p6.focus.de/img/politik/ausland/id_184834083/f-16-kampfflugzeuge-der-polnischen-luftwaffe-auf-patrouille-ueber-dem-baltikum.jpg?im=Crop%3D%280%2C29%2C940%2C470%29%3BResize%3D%281200%2C627%29&hash=964fa3b57e7468e380a962fe8d000e5385eae08cf8dce5b0e25484cffbdb9cf4,2023-02-03T19:41:01Z,https://web.archive.org/web/20230204002252/https://www.focus.de/politik/ausland/militaerexperte-in-ukraine-kampfjets-entscheidung-zu-99-8-prozent-getroffen_id_184834103.html,"In der Ukraine sind Militäranalysten überzeugt, dass das Land schon in wenigen Monaten über westliche Maschinen verfügen wird. Und es deutet viel darauf hin, dass diese Einschätzung weit mehr als Wun… [+6830 chars]",,de,'Ukraine'
https://www.tagesschau.de/inland/innenpolitik/meloni-scholz-antrittsbesuch-101.html,https://www.tagesschau.de/inland/innenpolitik/meloni-scholz-antrittsbesuch-101.html,0,www.tagesschau.de,Scholz empfängt Meloni: Höflich trotz aller Unterschiede,"Italiens Ministerpräsidentin Meloni ist zum Antrittsbesuch bei Kanzler Scholz gewesen. Gleichklang gab es beim Thema Ukraine, Dissonanzen in der Flüchtlingspolitik. Ein Eklat blieb aber aus - zu wichtig sind die Beziehungen beider Länder. <em>Von Martin Gansl…",https://www.tagesschau.de/multimedia/bilder/meloni-scholz-antrittsbesuch-103~_v-original.jpg,2023-02-03T19:51:26Z,,"Italiens Ministerpräsidentin Meloni ist zum Antrittsbesuch bei Kanzler Scholz gewesen. Gleichklang gab es beim Thema Ukraine, Dissonanzen in der Flüchtlingspolitik. Ein Eklat blieb aber aus - zu wich… [+3154 chars]",,de,'Ukraine'
https://www.tagesspiegel.de/internationales/sanktionen-gegen-moskau-eu-staaten-wollen-preis-fur-russische-dieselexporte-begrenzen-9292847.html,https://www.tagesspiegel.de/internationales/sanktionen-gegen-moskau-eu-staaten-wollen-preis-fur-russische-dieselexporte-begrenzen-9292847.html,0,www.tagesspiegel.de,Sanktionen gegen Moskau: EU-Staaten wollen Preis für russische Dieselexporte begrenzen,"Russland soll dazu gezwungen werden, Erdölprodukte unterm Marktpreis verkaufen zu müssen. Moskau solle nicht mehr von ihren Ölprodukten profitieren.",https://www.tagesspiegel.de/images/file-photo-a-russian-state-flag-flies-on-the-top-of-a-diesel-plant-in-the-irkutsk-oil-company-owned-yarakta-oil-field-in-irkutsk-region/alternates/BASE_16_9_W1400/file-photo-a-russian-state-flag-flies-on-the-top-of-a-diesel-plant-in-the-irkutsk-oil-company-owned-yarakta-oil-field-in-irkutsk-region.jpeg,2023-02-03T20:01:46Z,https://web.archive.org/web/20230203235107/https://www.tagesspiegel.de/internationales/sanktionen-gegen-moskau-eu-staaten-wollen-preis-fur-russische-dieselexporte-begrenzen-9292847.html,"Die EU will Russland gemeinsam mit internationalen Partnern dazu zwingen, Erdölprodukte wie Diesel künftig unter Marktpreis an Abnehmer in anderen Staaten zu verkaufen. 
Eine am Freitagabend von Reg… [+3789 chars]",,de,'Ukraine'
