index,url,valid,domain,title,description,image,published,archive,content,quote,language,keyword
https://www.zeit.de/video/2025-01/6366595869112/gasexport-nach-europa-russland-stoppt-nach-ende-von-transitabkommen-gasexport-durch-ukraine,https://www.zeit.de/video/2025-01/6366595869112/gasexport-nach-europa-russland-stoppt-nach-ende-von-transitabkommen-gasexport-durch-ukraine,0,www.zeit.de,"Gasexport nach Europa
: Russland stoppt nach Ende von Transitabkommen Gasexport durch Ukraine","Russland hat die Gaslieferungen durch die Ukraine gestoppt. Die Ukraine hatte sich zuvor geweigert, den Tansitvertrag zu verlängern. Nun ist er abgelaufen.",https://img.zeit.de/video/2025-01/6366595869112-still/wide__1300x731,2025-01-01T12:15:08Z,,"Schließen
Hier können Sie interessante Artikel speichern, um sie später zu lesen und wiederzufinden.
Sie haben bereits ein Konto?
 Hier anmelden.",,de,'Russland'
