index,url,valid,domain,title,description,image,published,archive,content,quote,language,keyword
https://www.morgenpost.de/politik/article239699389/afghanistan-taliban-flucht-betrug-angst-familie.html,https://www.morgenpost.de/politik/article239699389/afghanistan-taliban-flucht-betrug-angst-familie.html,0,www.morgenpost.de,Flucht aus Afghanistan: Die Angst vor den Taliban trieb Khaleqs Familie in den Ruin,"Angst vor den Taliban, dazu die große Not: Jeden Tag wollen Tausende Afghanen ihr Land verlassen. Für Betrüger sind sie leichte Opfer.",https://img.morgenpost.de/img/politik/crop239699383/2192605103-w820-cv16_9-q85/acd3c782-5edc-11ee-9135-fa51a2cebb14.jpg,2023-10-01T06:07:39Z,https://web.archive.org/web/20231002045928/https://www.morgenpost.de/politik/article239699389/afghanistan-taliban-flucht-betrug-angst-familie.html,"Kabul. Khaleq wirkt nervös und angespannt, als er über das spricht, was ihm vor rund einem Jahr widerfahren ist. Dass er Scham fühlt und auch Reue, kann er kaum verbergen. Damals erhielt der ehemalig… [+7544 chars]",,de,'Flucht'
https://www.zeit.de/news/2023-10/01/explosion-in-ankara-innenministerium-spricht-von-bombenanschlag,https://www.zeit.de/news/2023-10/01/explosion-in-ankara-innenministerium-spricht-von-bombenanschlag,0,www.zeit.de,Explosionen: Explosion in Ankara - Innenministerium spricht von Bombenanschlag,,,2023-10-01T07:29:00Z,,"When browsing with ads:
We collect personal data and also transmit it to third-party providers
 that help us improve and finance our digital content. Some of the information stored on your device, … [+821 chars]",,de,'Explosion'
https://www.faz.net/aktuell/politik/ausland/ankara-explosion-nahe-parlament-regierung-spricht-von-terroranschlag-19213403.html,https://www.faz.net/aktuell/politik/ausland/ankara-explosion-nahe-parlament-regierung-spricht-von-terroranschlag-19213403.html,0,www.faz.net,Ankara: Explosion nahe Parlament – Regierung spricht von „Terroranschlag“,Vor dem Innenministerium in der türkischen Hauptstadt Ankara hat es nach offiziellen Angaben einen Selbstmordanschlag gegeben. Es seien zwei Polizisten leicht verletzt worden. Über die Täter gibt es bislang keine weiteren Angaben.,https://www.faz.net/img/faznet_logo_facebook_share.jpg?fb=1,2023-10-01T07:30:25Z,,Vor dem Innenministerium in der türkischen Hauptstadt Ankara hat es nach offiziellen Angaben einen Selbstmordanschlag gegeben. Es seien zwei Polizisten leicht verletzt worden. Über die Täter gibt es … [+816 chars],,de,'Explosion'
https://www.tagesschau.de/ausland/europa/explosion-ankara-100.html,https://www.tagesschau.de/ausland/europa/explosion-ankara-100.html,0,www.tagesschau.de,Explosion nahe Parlament in Ankara - Innenminister spricht von Anschlag,In der Nähe des Parlamentsgebäudes in der türkischen Hauptstadt Ankara hat es Medienberichten zufolge eine laute Explosion gegeben. Das türkische Innenministerium spricht von einem Anschlag. Die Angreifer seien tot.,https://images.tagesschau.de/image/11fe2e17-b2fa-42ca-92d6-91fe2b028f66/AAABiuo1uI0/AAABibBxqrQ/16x9-1280/explosion-ankara-102.jpg,2023-10-01T07:48:43Z,,"Stand: 01.10.2023 09:48 Uhr
In der Nähe des Parlamentsgebäudes in der türkischen Hauptstadt Ankara hat es Medienberichten zufolge eine laute Explosion gegeben. Das türkische Innenministerium spricht… [+819 chars]",,de,'Explosion'
https://www.zeit.de/politik/2023-10/ankara-anschlag-explosion-parlament-tuerkei-nachrichtenpodcast,https://www.zeit.de/politik/2023-10/ankara-anschlag-explosion-parlament-tuerkei-nachrichtenpodcast,0,www.zeit.de,Anschlag in Ankara: Explosion und Schüsse in der türkischen Hauptstadt,War der Angriff auf das türkische Innenministerium eine Terrorattacke? Und: Die Erzfeinde Israel und Saudi-Arabien stehen kurz vor einer historischen Einigung.,,2023-10-02T04:54:08Z,,"When browsing with ads:
We collect personal data and also transmit it to third-party providers
 that help us improve and finance our digital content. Some of the information stored on your device, … [+821 chars]",,de,'Explosion'
