index,url,valid,domain,title,description,image,published,archive,content,quote,language,keyword
https://www.zeit.de/politik/ausland/2023-02/eu-ukraine-gipfel-kiew-beitritt-korruption-reformen,https://www.zeit.de/politik/ausland/2023-02/eu-ukraine-gipfel-kiew-beitritt-korruption-reformen,0,www.zeit.de,EU-Ukraine-Gipfel: In der Warteschleife der EU,"Beim EU-Gipfel in Kiew sprachen zwar alle von Unterstützung – aber nicht von einem schnellen EU-Beitritt. Auch weil der Westen unterschätzt, wie ernst es der Ukraine ist.",,2023-02-03T20:15:01Z,,"When browsing with ads:
We collect personal data and also transmit it to third-party providers
 that help us improve and finance our digital content. Some of the information stored on your device, … [+732 chars]",,de,'Ukraine'
https://www.zeit.de/video/2023-02/6319731223112/gipfeltreffen-in-kiew-die-ukraine-und-die-eu-sind-eine-familie,https://www.zeit.de/video/2023-02/6319731223112/gipfeltreffen-in-kiew-die-ukraine-und-die-eu-sind-eine-familie,0,www.zeit.de,"Gipfeltreffen in Kiew: ""Die Ukraine und die EU sind eine Familie""","Die EU hat der Ukraine beim EU-Ukraine-Gipfel Unterstützung zugesichert. Der EU-Beitritt habe aber keinen starren Zeitplan, sagte EU-Kommissionspräsidentin von der Leyen.",,2023-02-03T20:19:49Z,,"When browsing with ads:
We collect personal data and also transmit it to third-party providers
 that help us improve and finance our digital content. Some of the information stored on your device, … [+732 chars]",,de,'Ukraine'
https://www.n-tv.de/politik/Deutschland-wartet-auf-Zusagen-fuer-Leopard-2-Lieferung-article23892469.html,https://www.n-tv.de/politik/Deutschland-wartet-auf-Zusagen-fuer-Leopard-2-Lieferung-article23892469.html,0,www.n-tv.de,EU-Partner schweigen unerwartet: Deutschland wartet auf Zusagen für Leopard-2-Lieferung,"Nach langem Zögern stimmt Deutschland vor zwei Wochen der Lieferung von Leopard-2-Panzern an die Ukraine zu. Der Entscheidung geht nicht zuletzt der Druck europäischer Partner voraus. Nachdem nun die Bundesregierung ihrerseits auf Bestätigung wartet, hüllen s…",https://bilder3.n-tv.de/img/incoming/crop23892482/6941322561-cImg_16_9-w1200/imago201550052.jpg,2023-02-03T20:35:56Z,https://web.archive.org/web/20230203222839/https://www.n-tv.de/politik/Deutschland-wartet-auf-Zusagen-fuer-Leopard-2-Lieferung-article23892469.html,Nach langem Zögern stimmt Deutschland vor zwei Wochen der Lieferung von Leopard-2-Panzern an die Ukraine zu. Der Entscheidung geht nicht zuletzt der Druck europäischer Partner voraus. Nachdem nun die… [+2602 chars],,de,'Ukraine'
https://www.faz.net/aktuell/wirtschaft/ukraine-krieg-eu-einigt-sich-auf-preisdeckel-fuer-russische-oelprodukte-18653578.html,https://www.faz.net/aktuell/wirtschaft/ukraine-krieg-eu-einigt-sich-auf-preisdeckel-fuer-russische-oelprodukte-18653578.html,0,www.faz.net,EU einigt sich auf Preisdeckel für russische Ölprodukte,Der Export von Erdölprodukten wie Diesel ist für Russland ein Milliardengeschäft. Die EU hat sich nun auf eine Preisobergrenze festgelegt.,https://media0.faz.net/ppmedia/aktuell/politik/3598835299/1.8653580/facebook_teaser/dieses-von-dem-pressebuero-des.jpg,2023-02-03T21:20:58Z,,Die EU-Mitgliedsstaaten haben sich am Freitag auf Preisobergrenzen für russische Erdölprodukte geeinigt. Die EU-Botschafter haben heute die Preisobergrenzen für Erdölprodukte gebilligt vor einer endg… [+1759 chars],,de,'Ukraine'
https://www.zeit.de/politik/ausland/2023-02/ukraine-ueberblick-ereignisse-grossoffensive-g7-oel-preisdeckel,https://www.zeit.de/politik/ausland/2023-02/ukraine-ueberblick-ereignisse-grossoffensive-g7-oel-preisdeckel,0,www.zeit.de,"Ukraine-Überblick: Selenskyj warnt vor Großoffensive, G7 deckeln Preis für russisches Öl",Der ukrainische Geheimdienst sagt einen russischen Großangriff im Osten voraus. Große Industriestaaten wollen Russland gemeinsam über den Ölmarkt schwächen. Die Nacht,,2023-02-04T04:59:21Z,,"When browsing with ads:
We collect personal data and also transmit it to third-party providers
 that help us improve and finance our digital content. Some of the information stored on your device, … [+732 chars]",,de,'Russland'
… [+2929 chars],,de,'Knappheit',,,,,,,,,
