index,url,valid,domain,title,description,image,published,archive,content,quote,language,keyword
https://www.stern.de/news/usa--nordkoreas-soldaten-nahe-grenze-zur-ukraine-mit-russland-an--kampfhandlungen--beteiligt-35222976.html,https://www.stern.de/news/usa--nordkoreas-soldaten-nahe-grenze-zur-ukraine-mit-russland-an--kampfhandlungen--beteiligt-35222976.html,0,www.stern.de,"USA: Nordkoreas Soldaten nahe Grenze zur Ukraine mit Russland an ""Kampfhandlungen"" beteiligt","Nordkoreanische Soldaten sind nach Angaben des US-Außenministeriums inzwischen in der Nähe zur Grenze der Ukraine an der Seite russischer Soldaten an ""Kampfhandlungen"" beteiligt. Die meisten von insgesamt mehr als 10.000 nach Ostrussland gesendeten Soldaten a…",https://image.stern.de/35222978/t/Yf/v1/w1440/r1.7778/-/13--strassenszene-mit-soldat-auf-einem-plakat-in-kursk---73fd4e01b2d93347.jpg,2024-11-13T02:38:52Z,,"Kopiere den aktuellen Link
Nordkoreanische Soldaten sind nach Angaben des US-Außenministeriums inzwischen in der Nähe zur Grenze der Ukraine an der Seite russischer Soldaten an ""Kampfhandlungen"" bet… [+1130 chars]",,de,'Putin'
https://orf.at/stories/3375806/,https://orf.at/stories/3375806/,0,orf.at,USA: Nordkorea-Soldaten kämpfen nahe Ukraine-Grenze,,https://orf.at/mojo/1_4_1/storyserver//news/common/images/og-fallback-news.png,2024-11-13T02:43:13Z,,Nordkoreanische Soldaten sind nach Angaben des US-Außenministeriums nun in der Nähe zur Grenze der Ukraine an Kampfhandlungen beteiligt. Die meisten von insgesamt mehr als 10.000 nach Ostrussland ges… [+924 chars],,de,'Ukraine'
https://www.welt.de/politik/ausland/article254490008/Krieg-in-der-Ukraine-Nordkoreanische-Soldaten-offenbar-direkt-an-Kampfhandlungen-beteiligt.html,https://www.welt.de/politik/ausland/article254490008/Krieg-in-der-Ukraine-Nordkoreanische-Soldaten-offenbar-direkt-an-Kampfhandlungen-beteiligt.html,0,www.welt.de,Nordkoreanische Soldaten offenbar direkt an Kampfhandlungen beteiligt,Die auf russischer Seite in den Krieg eingetretenen nordkoreanischen Soldaten sind anscheinend direkt in Kampfhandlungen verwickelt. Das geht aus einem Bericht des State Departments hervor. Russland und Nordkorea hatten sich in einem Verteidigungsabkommen zu …,https://img.welt.de/img/politik/ausland/mobile254490010/1517933967-ci16x9-w1200/Nordkorea-Russland-Junge-Soldaten.jpg,2024-11-13T02:52:30Z,,Nordkoreanische Soldaten sind nach Angaben des US-Außenministeriums inzwischen in der Nähe zur Grenze der Ukraine an der Seite russischer Soldaten an Kampfhandlungen beteiligt. Die meisten von insges… [+1011 chars],,de,'Russland'
https://www.bild.de/politik/ausland-und-internationales/usa-melden-nordkorea-soldaten-kaempfen-in-der-ukraine-67340d67d39c7b0c2a08b7ea,https://www.bild.de/politik/ausland-und-internationales/usa-melden-nordkorea-soldaten-kaempfen-in-der-ukraine-67340d67d39c7b0c2a08b7ea,0,www.bild.de,USA melden - Nordkorea-Soldaten kämpfen in der Ukraine,Nordkoreanische Soldaten sind nach Angaben des US-Außenministeriums in der von der Ukraine besetzten russischen Region Kursk in der Nähe zur Grenze an „K...,"https://images.bild.de/67340d67d39c7b0c2a08b7ea/abf464cd5ee0c0db34ab3e12f7f7c949,b89f783b?w=1280",2024-11-13T03:04:57Z,,Nordkoreanische Soldaten sind nach Angaben des US-Außenministeriums in der von der Ukraine besetzten russischen Region Kursk in der Nähe zur Grenze an Kampfhandlungen gegen die Ukraine beteiligt an d… [+1443 chars],,de,'Ukraine'
https://www.stern.de/politik/ausland/die-lage-im-ueberblick--ukraine-unter-druck---nato-chef-fordert-mehr-hilfe-35222838.html,https://www.stern.de/politik/ausland/die-lage-im-ueberblick--ukraine-unter-druck---nato-chef-fordert-mehr-hilfe-35222838.html,0,www.stern.de,Die Lage im Überblick: Ukraine unter Druck - Nato-Chef fordert mehr Hilfe,"Der Druck auf die ukrainischen Truppen an der Ostfront wächst, der Winter naht. Nato-Generalsekretär Rutte fordert mehr Hilfe für die Ukraine. Darum geht es heute auch bei einem Treffen in Brüssel.",https://image.stern.de/35223102/t/Ig/v1/w1440/r1.7778/-/13--disl5ralhev3axs2048jpeg---4ae19457862507c2.jpg,2024-11-13T04:05:15Z,,"Kopiere den aktuellen Link
Der Druck auf die ukrainischen Truppen an der Ostfront wächst, der Winter naht. Nato-Generalsekretär Rutte fordert mehr Hilfe für die Ukraine. Darum geht es heute auch bei… [+5921 chars]",,de,'Ukraine'
https://www.sueddeutsche.de/politik/ukraine-krieg-newsblog-usa-nordkoreaner-kursk-kampfhandlungen-lux.DmJgjRdBoqmnzSLrkFN33e,https://www.sueddeutsche.de/politik/ukraine-krieg-newsblog-usa-nordkoreaner-kursk-kampfhandlungen-lux.DmJgjRdBoqmnzSLrkFN33e,0,www.sueddeutsche.de,Krieg in der Ukraine: USA: Nordkoreanische Soldaten an Kampfhandlungen beteiligt,"Die Amerikaner bestätigen, was der ukrainische Regierungschef Selenskij bereits vor Tagen sagte: Im russischen Grenzgebiet Kursk kämpfen nicht nur russische, sondern auch nordkoreanische Soldaten dafür, die Ukrainer wieder aus Russland zu drängen.",https://www.sueddeutsche.de/2024/11/13/cf448f78-7a1a-451b-b6b1-df3e09b7a5b8.jpeg?q=60&fm=webp&width=1200&rect=0%2C0%2C3000%2C1688,2024-11-13T04:20:15Z,,"Nato-Generalsekretär Mark Rutte hat angesichts des wachsenden russischen Drucks an der Ostfront der Ukraine mehr Unterstützung für das angegriffene Land gefordert. ""Wir müssen mehr tun, als nur die U… [+1041 chars]",,de,'Putin'
https://www.stern.de/politik/ausland/ukraine--warum-die-ersten-entscheidungen-von-trump-hoffnung-machen-35221740.html,https://www.stern.de/politik/ausland/ukraine--warum-die-ersten-entscheidungen-von-trump-hoffnung-machen-35221740.html,0,www.stern.de,Aufatmen in Kiew: Warum den Ukrainern die ersten Entscheidungen Trumps (etwas) Hoffnung machen,Wird Donald Trump die Ukraine Putin überlassen – oder ist der designierte US-Präsident am Ende für Überraschungen gut? Wie man in Kiew die Signale aus Washington deutet.,https://image.stern.de/35223298/t/8l/v1/w1440/r1.7778/-/wolodymyr-selenskyj-mit-donald-trump.jpg,2024-11-13T04:59:00Z,http://archive.md/20241113065725/https://www.stern.de/politik/ausland/ukraine--warum-die-ersten-entscheidungen-von-trump-hoffnung-machen-35221740.html,"Kopiere den aktuellen Link
Wird Donald Trump die Ukraine Putin überlassen oder ist der designierte US-Präsident am Ende für Überraschungen gut? Wie man in Kiew die Signale aus Washington deutet.
Ni… [+492 chars]",,de,'Ukraine'
https://www.welt.de/politik/ausland/article254490418/Klimawandel-Fossile-Emissionen-steigen-weltweit-weiter-an.html,https://www.welt.de/politik/ausland/article254490418/Klimawandel-Fossile-Emissionen-steigen-weltweit-weiter-an.html,0,www.welt.de,Fossile Emissionen steigen weltweit weiter an,"Einige Länder haben ihren fossilen CO₂-Ausstoß reduziert, von einer Trendwende kann aktuellen Zahlen nach aber nicht gesprochen werden. Nie zuvor wurden weltweit solche Mengen an Öl, Gas und Kohle verbrannt. In China könnte der Höhepunkt erreicht sein.",https://img.welt.de/img/politik/ausland/mobile254490910/0317935607-ci16x9-w1200/TOPSHOT-FILES-The-coal-fuelled.jpg,2024-11-13T08:56:26Z,https://web.archive.org/web/20241113085957/https://www.welt.de/politik/ausland/article254490418/Klimawandel-Fossile-Emissionen-steigen-weltweit-weiter-an.html,"Einige Länder haben ihren fossilen CO-Ausstoß reduziert, von einer Trendwende kann aktuellen Zahlen nach aber nicht gesprochen werden. Nie zuvor wurden weltweit solche Mengen an Öl, Gas und Kohle ver… [+4572 chars]",,de,'Kohle'
https://www.welt.de/vermischtes/article254509210/Brasilien-Ein-Toter-nach-Explosionen-vor-Oberstem-Gerichtshof.html,https://www.welt.de/vermischtes/article254509210/Brasilien-Ein-Toter-nach-Explosionen-vor-Oberstem-Gerichtshof.html,0,www.welt.de,Ein Toter nach Explosionen vor Oberstem Gerichtshof,In der Nähe des Obersten Gerichtshofs in der Hauptstadt Brasilia hat es zwei Explosionen gegeben. Mitarbeiter berichten von mindestens einer toten Person. Die Polizei will sich zu den Details bislang nicht äußern.,https://img.welt.de/img/bildergalerien/mobile254509208/5487934397-ci16x9-w1200/Brazil-Supreme-Court-Explosion.jpg,2024-11-14T00:19:43Z,,In der Nähe des Obersten Gerichtshofs in der Hauptstadt Brasilia hat es zwei Explosionen gegeben. Mitarbeiter berichten von mindestens einer toten Person. Die Polizei will sich zu den Details bislang… [+1654 chars],,de,'Explosion'
https://www.tagesschau.de/ausland/amerika/explosionen-brasilia-100.html,https://www.tagesschau.de/ausland/amerika/explosionen-brasilia-100.html,0,www.tagesschau.de,Brasiliens Oberstes Gericht nach Explosionen in der Nähe evakuiert,"In Brasilien ist der Oberste Gerichtshof nach zwei Explosionen in der Nähe des Gebäudes evakuiert worden. Die Polizei gab an, es sei ein Toter gefunden worden. Die Hintergründe sind noch unklar.",https://images.tagesschau.de/image/f6d5bbd5-a690-4be6-87c7-81454947cdc0/AAABkyhSBWo/AAABkZLhkrw/16x9-1280/explosionen-brasilia-102.jpg,2024-11-14T01:38:04Z,http://archive.md/20241114144245/https://www.tagesschau.de/ausland/amerika/explosionen-brasilia-100.html,"Stand: 14.11.2024 02:38 Uhr
In Brasilien ist der Oberste Gerichtshof nach zwei Explosionen in der Nähe des Gebäudes evakuiert worden. Die Polizei gab an, es sei ein Toter gefunden worden. Die Hinter… [+1323 chars]",,de,'Explosion'
https://www.zeit.de/politik/2024-11/us-wahl-donald-trump-ukraine-russland-podcast,https://www.zeit.de/politik/2024-11/us-wahl-donald-trump-ukraine-russland-podcast,0,www.zeit.de,US-Wahl: Donald Trump als Hoffnungsträger?,"Trumps Präsidentschaft könnte folgenschwer werden, vor allem für die Ukraine. Dennoch bemühen sich in Osteuropa viele, sich über den Wahlsieg zu freuen.",https://img.zeit.de/politik/ausland/2024-11/podcast-osteuropa-trump-ukraine-bild/wide__1300x731,2024-11-14T05:00:07Z,,"Donald Trump und Wolodymyr Selenskyj bei einem Treffen im September. Ihr Verhältnis wird auch über Osteuropa bestimmen.© Shannon Stapleton/Reuters
Was ging für ein Schock durch die Welt, als in den … [+2835 chars]",,de,'Ukraine'
https://www.n-tv.de/politik/US-Kongress-in-republikanischer-Hand-Donald-Trump-bekommt-alle-Macht-und-das-hat-er-damit-vor-article25346637.html,https://www.n-tv.de/politik/US-Kongress-in-republikanischer-Hand-Donald-Trump-bekommt-alle-Macht-und-das-hat-er-damit-vor-article25346637.html,0,www.n-tv.de,Schockwellen für die Welt: Trump bekommt alle Macht - das hat er damit vor,"Ja, es ist wahr, der nächste US-Staatschef wird der vorherige. Trump wird in seiner Amtszeit so viel Macht auf sich vereinen wie niemand im Land vor ihm. Seine Vorhaben reichen von Abschiebungen über Zölle auf ganzer Front bis zur Befriedung der Ukraine. Eine…",https://bilder3.n-tv.de/img/incoming/crop25346666/967132678-cImg_16_9-w1200/0f693d1c7ea12e1ff100d428fb6224e1.jpg,2024-11-14T05:14:00Z,,"Ja, es ist wahr, der nächste US-Staatschef wird der vorherige. Trump wird in seiner Amtszeit so viel Macht auf sich vereinen wie niemand im Land vor ihm. Seine Vorhaben reichen von Abschiebungen über… [+9961 chars]",,de,'Ukraine'
https://www.focus.de/politik/ausland/experte-warnt-putins-kursk-plan-mit-kims-soldaten-wird-aufgehen-dem-westen-bleibt-nur-eine-option_63b4e06f-a7bc-4396-96ee-7dceefe22d7b.html,https://www.focus.de/politik/ausland/experte-warnt-putins-kursk-plan-mit-kims-soldaten-wird-aufgehen-dem-westen-bleibt-nur-eine-option_63b4e06f-a7bc-4396-96ee-7dceefe22d7b.html,0,www.focus.de,Experte warnt - Putins Plan mit Kims Soldaten wird aufgehen – dem Westen bleibt nur eine Option,"Nordkorea hat laut Berichten 10.000 Kämpfer nach Russland geschickt. Sie sollen nun offenbar in der Region Kursk gegen die Ukraine eingesetzt werden. Ob Putins Plan aufgehen kann, erklären drei Experten.",https://quadro.burda-forward.de/ctf/d2dec96b-030c-4cea-879e-f8aed911478c.a0534019-cc60-4a25-9a6c-fdad2e2fb212.jpeg?im=RegionOfInterestCrop%3D%281200%2C630%29%2CregionOfInterest%3D%28320%2C180%29&hash=43456c0a5893deacf7264ae47047bfe9089afae0748ca7bd65319c77776fce81,2024-11-14T13:54:00Z,,"Was längst gilt, ist nun auch offiziell beschlossen: Am Dienstag ratifizierte Nordkorea sein neues Militärabkommen mit Russland eine reine Formalie, da die Zusammenarbeit bereits begonnen hat.
Minde… [+4823 chars]",,de,'Russland'
https://www.sueddeutsche.de/politik/ukraine-krieg-newsblog-scholz-selenskij-soldaten-entschaedigung-lux.DmJgjRdBoqmnzSLrkFN33e,https://www.sueddeutsche.de/politik/ukraine-krieg-newsblog-scholz-selenskij-soldaten-entschaedigung-lux.DmJgjRdBoqmnzSLrkFN33e,0,www.sueddeutsche.de,Krieg in der Ukraine: Russland kürzt Geld für verwundete Soldaten,Die Entschädigung des Kreml für im Krieg verletzte Soldaten hängt neuerdings vom Grad der Verletzung ab. Kanzler Scholz spricht erstmals seit Trumps Wahlsieg mit dem ukrainischen Präsidenten.,https://www.sueddeutsche.de/2024/11/14/f83f26d6-4fdf-469a-b111-7efcbbbc27c3.jpeg?q=60&fm=webp&width=1200&rect=0%2C0%2C3500%2C1969,2024-11-14T14:17:37Z,,"Wer in Russland den Angriffskrieg gegen die Ukraine in sozialen Netzwerken kritisiert, riskiert hohe Haftstrafen. Diesmal trifft  es eine Theaterregisseurin: Die 43-jährige wurde von einem Militärger… [+1540 chars]",,de,'Putin'
https://www.tagesspiegel.de/internationales/sparen-im-krieg-gegen-die-ukraine-putin-kurzt-entschadigungen-fur-verletzte-russische-soldaten-deutlich-12706241.html,https://www.tagesspiegel.de/internationales/sparen-im-krieg-gegen-die-ukraine-putin-kurzt-entschadigungen-fur-verletzte-russische-soldaten-deutlich-12706241.html,0,www.tagesspiegel.de,Sparen im Krieg gegen die Ukraine: Putin kürzt Entschädigungen für verletzte russische Soldaten deutlich,"Wenn Soldaten in der russischen Invasionsarmee verwundet werden, zahlt ihnen der Staat Geld. Medienberichten zufolge hat der Kremlherrscher genau hier nun den Rotstift angesetzt.",https://www.tagesspiegel.de/images/12706778/alternates/BASE_16_9_W1400/1731592013000/imago0159885423h.jpeg,2024-11-14T14:23:19Z,,"Es gibt zwar keine offiziellen Angaben, aber westliche Geheimdienste gingen im September davon aus, dass im Angriffskrieg des russischen Machthabers Wladimir Putin seit Ende Februar 2022 bereits rund… [+4162 chars]",,de,'Ukraine'
https://www.stern.de/politik/ausland/kriegskritik--gericht-in-moskau-verurteilt-kriegsgegnerin-zu-straflager-35228830.html,https://www.stern.de/politik/ausland/kriegskritik--gericht-in-moskau-verurteilt-kriegsgegnerin-zu-straflager-35228830.html,0,www.stern.de,Kriegskritik: Gericht in Moskau verurteilt Kriegsgegnerin zu Straflager,"Russen, die Moskaus Angriffskrieg gegen die Ukraine in sozialen Netzwerken kritisieren, riskieren hohe Haftstrafen. Diesmal hat es eine Theaterregisseurin getroffen.",https://image.stern.de/35228832/t/2Q/v1/w1440/r1.7778/-/14--jtqs36sbn5v17axs2048jpeg---9558ad176c65a2f8.jpg,2024-11-14T14:57:09Z,,"Kopiere den aktuellen Link
Russen, die Moskaus Angriffskrieg gegen die Ukraine in sozialen Netzwerken kritisieren, riskieren hohe Haftstrafen. Diesmal hat es eine Theaterregisseurin getroffen.
Weil… [+1771 chars]",,de,'Ukraine'
https://www.tagesspiegel.de/internationales/kriegskritik-gericht-in-moskau-verurteilt-kriegsgegnerin-zu-straflager-12708014.html,https://www.tagesspiegel.de/internationales/kriegskritik-gericht-in-moskau-verurteilt-kriegsgegnerin-zu-straflager-12708014.html,0,www.tagesspiegel.de,Kriegskritik: Gericht in Moskau verurteilt Kriegsgegnerin zu Straflager,"Russen, die Moskaus Angriffskrieg gegen die Ukraine in sozialen Netzwerken kritisieren, riskieren hohe Haftstrafen. Diesmal hat es eine Theaterregisseurin getroffen.",https://www.tagesspiegel.de/images/12708011/alternates/BASE_16_9_W1400/1731596300000/gefangnis-in-russland.jpeg,2024-11-14T14:58:20Z,,"Weil sie den Krieg von Kremlchef Wladimir Putin gegen die Ukraine in einem sozialen Netzwerk kritisierte, hat ein Militärgericht in Moskau eine Theaterregisseurin zu acht Jahren Straflager verurteilt… [+1664 chars]",,de,'Ukraine'
https://www.tagesspiegel.de/internationales/bsw-hat-nachgefragt-bundesregierung-geht-von-zehn-getoteten-deutschen-in-ukraine-krieg-aus-12707825.html,https://www.tagesspiegel.de/internationales/bsw-hat-nachgefragt-bundesregierung-geht-von-zehn-getoteten-deutschen-in-ukraine-krieg-aus-12707825.html,0,www.tagesspiegel.de,BSW hat nachgefragt: Bundesregierung geht von zehn getöteten Deutschen in Ukraine-Krieg aus,Ein Abgeordneter der Partei Bündnis Sahra Wagenknecht brachte die Todeszahl in Erfahrung. Er sieht darin ein Argument für Verhandlungen über eine Waffenruhe.,https://www.tagesspiegel.de/images/12707897/alternates/BASE_16_9_W1400/1731595788000/news-bilder-des-tages-anti-weapon-delivery-demonstration-in-duesseldorf-andrej-hunko-member-of-parliamentary-assembly-o.jpeg,2024-11-14T15:05:00Z,,"Durch den russischen Angriffskrieg in der Ukraine sind nach Erkenntnissen der Bundesregierung seit Beginn im Februar 2022 zehn deutsche Staatsbürger getötet worden. 
Die Tagesspiegel-App Aktuelle Na… [+1261 chars]",,de,'Ukraine'
https://www.focus.de/politik/meinung/analyse-von-ulrich-reitz-scholz-der-sichere-verlierer-achtung-ukraine-frage-birgt-politischen-sprengstoff_id_260481079.html,https://www.focus.de/politik/meinung/analyse-von-ulrich-reitz-scholz-der-sichere-verlierer-achtung-ukraine-frage-birgt-politischen-sprengstoff_id_260481079.html,0,www.focus.de,"Analyse von Ulrich Reitz - Scholz, der sichere Verlierer? Achtung, Ukraine-Frage birgt politischen Sprengstoff","Dichtung und Wahrheit, Krieg und Frieden und eine große Portion Sozialneid – die ersten Erkenntnisse zum heraufziehenden Wahlkampf. Es droht zwar Schmutz, aber es gibt es auch eine versöhnliche Botschaft. Von FOCUS-online-Korrespondent Ulrich Reitz",https://p6.focus.de/img/panorama/welt/id_260475329/kanzler-scholz-und-unions-kanzlerkandidat-treten-am-mittwoch-im-bundestag-zum-inoffiziellen-wahlkampf-auftakt-gegeneinander-an..jpg?im=Crop%3D%280%2C0%2C2048%2C1024%29%3BResize%3D%281200%2C627%29&impolicy=perceptual&quality=mediumHigh&hash=28a40e0f5a07dd8d8d2cfb1a3883ce9d3c8494ebe84f3e93442fa6c1486add54,2024-11-14T15:17:14Z,,"Dichtung und Wahrheit, Krieg und Frieden und eine große Portion Sozialneid die ersten Erkenntnisse zum heraufziehenden Wahlkampf. Es droht zwar Schmutz, aber es gibt es auch eine versöhnliche Botscha… [+7866 chars]",,de,'Putin'
https://www.focus.de/politik/ausland/fuer-selenskyj-sind-die-aussichten-in-der-ukraine-jetzt-so-schlecht-wie-noch-nie_218f207e-9d4f-44f4-bb03-1ce22919f379.html,https://www.focus.de/politik/ausland/fuer-selenskyj-sind-die-aussichten-in-der-ukraine-jetzt-so-schlecht-wie-noch-nie_218f207e-9d4f-44f4-bb03-1ce22919f379.html,0,www.focus.de,Machtwechsel in Kriegszeiten? - Für Selenskyj sind die Aussichten in der Ukraine jetzt so schlecht wie noch nie,"Während die Stimmung in der Ukraine sinkt, wird über einen Wechsel an der Spitze gesprochen. Für den Präsidenten des durch den Einfalls der russischen Truppen gebeutelten Landes sind die Aussichten äußerst düster.",https://quadro.burda-forward.de/ctf/6579bef0-7125-4b49-98e4-8782dfb1529f.4a1e4881-a7b1-4021-affc-2b82ecfe17f7.png?im=RegionOfInterestCrop%3D%281200%2C630%29%2CregionOfInterest%3D%281043%2C551%29&hash=464a8d4e948d15782e5e2dbe7568c2d7bcfb14f933d28a6ff2d4912f56bb52b9,2024-11-14T16:24:00Z,,"Beinahe jeden Tag gibt es in Kiew einen Moment, in dem der Krieg lautstark in die Stadt einzieht. Das ist der Moment, in dem die Leichenzüge auftauchen, die sich über die Hauptverkehrsadern nach Chre… [+6780 chars]",,de,'Ukraine'
https://www.sueddeutsche.de/projekte/artikel/politik/ukraine-russland-krieg-szenarien-analyse-experte-e105444/,https://www.sueddeutsche.de/projekte/artikel/politik/ukraine-russland-krieg-szenarien-analyse-experte-e105444/,0,www.sueddeutsche.de,"Krieg in der Ukraine: „Putin glaubt, er habe den Sieg vor Augen“","Die russische Offensive in der Ukraine läuft mit großer Wucht, jetzt sogar unterstützt von Soldaten aus Nordkorea. Mit welchen Szenarien müssen die Verteidiger rechnen – und gibt es noch Hoffnung?","https://www.sueddeutsche.de/projekte/artikel/politik/ukraine-russland-krieg-szenarien-analyse-experte-e105444/00cc69fe5af67939133ae8fd54e6ad452554253c853b5114e15139f591844928_w2400_h1256_r40,0,2079,1088_oszplus_q70.jpg",2024-11-14T16:32:00Z,http://archive.md/20241114173502/https://www.sueddeutsche.de/projekte/artikel/politik/ukraine-russland-krieg-szenarien-analyse-experte-e105444/,"Die Front in der Ukraine ist mehr als 1200 Kilometer lang – und fast überall hat der russische Aggressor aktuell die Initiative inne. An einigen Stellen verliert die Ukraine an Boden, rücken die Angr… [+229 chars]",,de,'Putin'
https://www.tagesspiegel.de/internationales/ukraine-invasion-tag-995-investoren-lassen-ukrainische-staatsanleihen-steigen--weil-sie-auf-trump-hoffen-12709118.html,https://www.tagesspiegel.de/internationales/ukraine-invasion-tag-995-investoren-lassen-ukrainische-staatsanleihen-steigen--weil-sie-auf-trump-hoffen-12709118.html,0,www.tagesspiegel.de,"Ukraine-Invasion, Tag 995: Investoren lassen ukrainische Staatsanleihen steigen – weil sie auf Trump hoffen","Zehn Deutsche im Ukraine-Krieg getötet, Selenskyj hofft auf Fortsetzung der deutschen Hilfen, Putin kürzt Entschädigungen für verletzte Soldaten. Der Überblick am Abend.",https://www.tagesspiegel.de/images/12709127/alternates/BASE_16_9_W1400/1731603106000/treffen-von-trump-und-selenskyj-in-new-york.jpeg,2024-11-14T16:56:04Z,,"Donald Trump hatte bereits vor seiner Wiederwahl zum US-Präsidenten erklärt, dass er den Ukraine-Krieg innerhalb von 24 Stunden beenden würde. Auch wenn die zeitliche Frist zu optimistisch sein dürft… [+4302 chars]",,de,'Putin'
https://www.tagesschau.de/ausland/amerika/explosionen-brasilia-terror-motiv-100.html,https://www.tagesschau.de/ausland/amerika/explosionen-brasilia-terror-motiv-100.html,0,www.tagesschau.de,Explosionen in Brasilia: Brasilianische Behörden gehen von Terrorakt aus,Einen Tag nach den Explosionen vor Brasiliens Oberstem Gericht geht die Polizei von einem terroristischen Motiv aus. Der Täter war laut Medienberichten ein Lokalpolitiker. Von Anne Herrberg.,https://images.tagesschau.de/image/6e15ea80-e935-44d3-9035-7e816a7743ae/AAABkyvBGTw/AAABkZLhkrw/16x9-1280/brasilia-anschlag-100.jpg,2024-11-14T17:38:16Z,http://archive.md/20241115115017/https://www.tagesschau.de/ausland/amerika/explosionen-brasilia-terror-motiv-100.html,"Stand: 14.11.2024 18:38 Uhr
Einen Tag nach den Explosionen vor Brasiliens Oberstem Gericht geht die Polizei von einem terroristischen Motiv aus. Der Täter war laut Medienberichten ein Lokalpolitiker… [+3797 chars]",,de,'Explosion'
https://www.jungewelt.de/artikel/487903.nukleare-bewaffnung-der-ukraine.html,https://www.jungewelt.de/artikel/487903.nukleare-bewaffnung-der-ukraine.html,0,www.jungewelt.de,Nukleare Bewaffnung der Ukraine?,"Die Ukraine könnte innerhalb weniger Monate eine vorläufige Atombombe entwickeln, heißt es in einem Informationspapier, das für das ukrainische Verteidigungsministerium erstellt wurde.",https://www.jungewelt.de/img/1100/202091.jpg,2024-11-14T18:38:55Z,,"Die in London erscheinende Times berichtete am Donnerstag exklusiv über die Möglichkeiten der Ukraine, rasch eine vorläufige Atombombe zu entwickeln.
Die Ukraine könnte innerhalb weniger Monate eine… [+2899 chars]",,de,'Putin'
https://www.bild.de/politik/ausland-und-internationales/trumps-verrueckteste-personalie-diese-putin-freundin-soll-die-us-geheimdienste-leiten-6735c4edb0ce946580dff539,https://www.bild.de/politik/ausland-und-internationales/trumps-verrueckteste-personalie-diese-putin-freundin-soll-die-us-geheimdienste-leiten-6735c4edb0ce946580dff539,0,www.bild.de,Trumps verrückteste Personalie - Putin-Freundin soll US-Geheimdienste leiten,In Wahrheit ist Tusli Gabbard selbst eine Gefahr für die nationale Sicherheit der USA.,"https://images.bild.de/6735c4edb0ce946580dff539/1bc3b554a0e7eab9233a35fbba6f3142,4962e0e6?w=1280",2024-11-14T19:23:26Z,,"Während manche Nominierungen fürs Trump-Team für Erleichterungen sorgten, löst dieses Job-Versprechen vor allem eins aus: Alarm! 
Tulsi Gabbard (43) soll in Trumps Regierung als Director of National… [+4082 chars]",,de,'Putin'
https://www.n-tv.de/politik/21-42-Von-Kadyrow-Sohn-einst-verpruegelt-Russen-droht-noch-groesserer-Arger--article25363386.html,https://www.n-tv.de/politik/21-42-Von-Kadyrow-Sohn-einst-verpruegelt-Russen-droht-noch-groesserer-Arger--article25363386.html,0,www.n-tv.de,Ukraine-Krieg im Liveticker: +++ 21:42 Von Kadyrow-Sohn einst verprügelt: Russen droht noch größerer Ärger +++,Lesen Sie alle aktuellen Entwicklungen und Nachrichten über den russischen Angriffskrieg auf die Ukraine im Liveticker von ntv.de.,https://bilder3.n-tv.de/img/incoming/crop25117070/4231326595-cImg_16_9-w1200/Ukraine-Liveticker.jpg,2024-11-14T21:00:00Z,,"Ein Mann muss sich in Russland wegen der mutmaßlichen Weitergabe von Filmmaterial an die Ukraine vor Gericht verantworten. Dem Mann wird vom Bezirksgericht von Wolgograd vorgeworfen, 2023 Militärausr… [+37057 chars]",,de,'Ukraine'
https://www.morgenpost.de/politik/article407681487/mosfilm-zieht-in-den-krieg-putin-auf-filmrequisiten-angewiesen.html,https://www.morgenpost.de/politik/article407681487/mosfilm-zieht-in-den-krieg-putin-auf-filmrequisiten-angewiesen.html,0,www.morgenpost.de,Ukraine-Krieg: Jetzt holt Putin Panzer aus dem Filmstudio,Russland mobilisiert alle Reserven. Das größte Filmstudio lässt sich nicht lumpen und spendiert Vintage-Panzer für den Ukraine-Krieg.,https://img.sparknews.funkemedien.de/407682041/407682041_1731577902_v16_9_1600.jpeg,2024-11-14T21:00:00Z,,"San Francisco. Russland mobilisiert alle Reserven. Das größte Filmstudio lässt sich nicht lumpen und spendiert Vintage-Panzer für den Ukraine-Krieg.
Es klingt wie Satire. Aber wir versichern: Die Qu… [+3529 chars]",,de,'Russland'
