index,url,valid,domain,title,description,image,published,archive,content,quote,language,keyword
https://www.faz.net/aktuell/politik/ausland/ukraine-krieg-selenskyj-fordert-infos-ueber-us-gespraeche-mit-russland-110798380.html,https://www.faz.net/aktuell/politik/ausland/ukraine-krieg-selenskyj-fordert-infos-ueber-us-gespraeche-mit-russland-110798380.html,0,www.faz.net,Ukraineverhandlungen: Selenskyj fordert Informationen über Gespräche in Moskau,"Die Ukraine fürchtet, dass die USA und Russland hinter ihrem Rücken einen Deal machen. Auch europäische Staats- und Regierungschefs treibt diese Sorge um.",https://media0.faz.net/image/w1200h627/1c3ad43296b6/w2479h1295x52y407o/112025/1.10798379/aussenminister-marco-rubio-und.webp,2025-12-05T14:32:12Z,,"Die Ukraine ist bisher eigenen Angaben zufolge nicht darüber informiert worden, was die amerikanische Delegation bei ihrem jüngsten Besuch im Kreml besprochen hat. Unsere Aufgabe ist es nun, umfassen… [+2856 chars]",,de,'Putin'
https://www.nzz.ch/international/putin-zu-gast-bei-modi-politische-symbolik-statt-substanz-ld.1915182,https://www.nzz.ch/international/putin-zu-gast-bei-modi-politische-symbolik-statt-substanz-ld.1915182,0,www.nzz.ch,Modi und Putin zelebrieren in Delhi ihre Freundschaft – den Beziehungen fehlt es aber an Substanz,"Der Handel beschränkt sich weitgehend auf die indischen Ölimporte aus Russland, bei der Rüstungskooperation gab es nichts Neues zu verkünden. Aber immerhin konnte Putin in Delhi ein neues Büro des Propagandasenders RT einweihen.","https://img.nzz.ch/2025/12/05/8b3da569-0447-4e11-a551-650f2c0d401b.jpg?width=1200&height=675&fit=bounds&quality=75&auto=webp&crop=7852,4417,x0,y269&wmark=nzz",2025-12-05T14:55:26Z,,"Der Handel beschränkt sich weitgehend auf die indischen Ölimporte aus Russland, bei der Rüstungskooperation gab es nichts Neues zu verkünden. Aber immerhin konnte Putin in Delhi ein neues Büro des Pr… [+5433 chars]",,de,'Putin'
https://orf.at/stories/3413581/,https://orf.at/stories/3413581/,0,orf.at,Putin und Modi wollen Handelsbeziehungen ausbauen,,https://orf.at/mojo/1_4_1/storyserver//news/common/images/og-fallback-news.png,2025-12-05T15:26:37Z,,"Indien und Russland wollen ihre Handelsbeziehungen über Öl- und Rüstungsgeschäfte hinaus deutlich ausbauen. Beide Seiten hätten sich auf ein wirtschaftliches Kooperationsprogramm bis 2030 geeinigt, s… [+1013 chars]",,de,'Putin'
https://www.tagesschau.de/ausland/europa/dmitrijew-spott-merz-100.html,https://www.tagesschau.de/ausland/europa/dmitrijew-spott-merz-100.html,0,www.tagesschau.de,Moskaus Chefunterhändler verspottet Merz nach geleaktem Gespräch,"Einem Medienbericht zufolge sollen mehrere europäische Spitzenpolitiker vor den US-Verhandlern im Ukraine-Krieg gewarnt haben. Putins Chefunterhändler Dmitrijew reagierte mit Spott und sagte, Merz sei ""nicht einmal im Spiel"".",https://images.tagesschau.de/image/9dc5e84f-d858-4f17-b7ad-979eedb81fa7/AAABmu7nwnA/AAABmt42H9g/16x9-big/dmitrijew-104.jpg?width=1280,2025-12-05T15:35:17Z,,"Stand: 05.12.2025 16:35 Uhr
Einem Medienbericht zufolge sollen mehrere europäische Spitzenpolitiker vor den US-Verhandlern im Ukraine-Krieg gewarnt haben. Putins Chefunterhändler Dmitrijew reagierte… [+3488 chars]",,de,'Ukraine'
