index,url,valid,domain,title,description,image,published,archive,content,quote,language,keyword
https://www.stern.de/panorama/katastrophen---stimmen-unter-den-truemmern----kampf-gegen-die-zeit-33175294.html,https://www.stern.de/panorama/katastrophen---stimmen-unter-den-truemmern----kampf-gegen-die-zeit-33175294.html,0,www.stern.de,"Katastrophen: ""Stimmen unter den Trümmern"" - Kampf gegen die Zeit","Kälte, Regen, Schnee und große Zerstörung - die Retter in der Türkei und Syrien kämpfen mit widrigen Bedingungen. Ihnen läuft die Zeit davon. Die Menschen sind verzweifelt - und wütend.",https://image.stern.de/33175296/t/dA/v1/w1440/r1.7778/-/07--urnnewsmldpacom2009010123020799508190v4w800h600l640t425r1920b1278jpeg---1111069ae5beef5d.jpg,2023-02-07T17:33:18Z,,"Kälte, Regen, Schnee und große Zerstörung - die Retter in der Türkei und Syrien kämpfen mit widrigen Bedingungen. Ihnen läuft die Zeit davon. Die Menschen sind verzweifelt - und wütend.
Selbst das G… [+5365 chars]",,de,'Kälte'
https://www.jungewelt.de/artikel/444459.kundgebung-gegen-krieg-wir-zeigen-regierung-und-rheinmetall-die-rote-karte.html,https://www.jungewelt.de/artikel/444459.kundgebung-gegen-krieg-wir-zeigen-regierung-und-rheinmetall-die-rote-karte.html,0,www.jungewelt.de,Kundgebung gegen Krieg: »Wir zeigen Regierung und Rheinmetall die rote Karte«,Migrantische und Friedensgruppen protestieren am Sonnabend vor Firmensitz der Waffenschmiede. Ein Gespräch mit Süleyman Gürcan • Foto: Federico Gambarini/dpa,https://www.jungewelt.de/img/1100/177178.jpg,2023-02-07T18:50:23Z,https://web.archive.org/web/20230207195031/https://www.jungewelt.de/artikel/444459.kundgebung-gegen-krieg-wir-zeigen-regierung-und-rheinmetall-die-rote-karte.html,"An diesem Sonnabend planen Sieeine Protestkundgebung vor dem Firmensitz des Waffenherstellers Rheinmetallin Düsseldorf. Was ist der konkrete Anlass?
Das war die Zusage der Bundesregierung über die L… [+3732 chars]",,de,'Waffen'
https://www.faz.net/aktuell/politik/inland/sicherheitsreport-2023-was-bereitet-den-deutschen-die-groessten-sorgen-18661599.html,https://www.faz.net/aktuell/politik/inland/sicherheitsreport-2023-was-bereitet-den-deutschen-die-groessten-sorgen-18661599.html,0,www.faz.net,Was bereitet den Deutschen die größten Sorgen?,Laut der Umfrage des Meinungsforschungsinstituts Allensbach machen den Deutschen vor allem der Ukrainekrieg und die Inflation zu schaffen. Bei einigen Themen zeigen sich deutliche Unterschiede zwischen Ost und West.,https://media1.faz.net/ppmedia/aktuell/politik/2496799233/1.8661669/facebook_teaser/in-der-slowakei-stationierte.jpg,2023-02-07T18:52:08Z,https://web.archive.org/web/20230207190343/https://www.faz.net/aktuell/politik/inland/sicherheitsreport-2023-was-bereitet-den-deutschen-die-groessten-sorgen-18661599.html,"Der Krieg in der Ukraine und die Preissteigerungen machen der deutschen Bevölkerung im Moment mehr zu schaffen als alles andere. Der Klimawandel und die Sorge, dass die Energieversorgung nicht mehr g… [+4215 chars]",,de,'Inflation'
https://www.faz.net/aktuell/politik/ausland/erdbeben-in-der-tuerkei-mit-der-kaelte-kommt-der-tod-18660924.html,https://www.faz.net/aktuell/politik/ausland/erdbeben-in-der-tuerkei-mit-der-kaelte-kommt-der-tod-18660924.html,0,www.faz.net,Erdbeben in der Türkei: Mit der Kälte kommt der Tod,Die Rettungsmannschaften in der Türkei kämpfen nach dem verheerenden Erdbeben gegen die Zeit. Unter den Trümmern werden noch knapp 200.000 Menschen vermutet.,https://media0.faz.net/ppmedia/aktuell/politik/2104819076/1.8660922/facebook_teaser_fplus/suche-nach-ueberlebenden-unter.jpg,2023-02-07T19:32:27Z,,"Den Rettungsmannschaften rennt die Zeit davon. Realistische Chancen, Opfer lebend aus den Trümmern zu bergen, bestehen auch bei normalen Witterungsverhältnissen nur in den 72 Stunden nach einem Beben… [+1511 chars]",,de,'Kälte'
https://www.welt.de/politik/ausland/article243655633/Ukraine-News-Bartsch-kritisiert-Panzer-Harakiri-der-Regierung.html,https://www.welt.de/politik/ausland/article243655633/Ukraine-News-Bartsch-kritisiert-Panzer-Harakiri-der-Regierung.html,0,www.welt.de,Bartsch sieht Deutschland nach „Panzer-Harakiri“ als Kriegspartei,"Deutschland hat die Lieferung von bis zu 178 Leopard-1-Panzern an die Ukraine genehmigt. Linken-Fraktionschef Bartsch findet das „brandgefährlich“. Wirtschaftsminister Habeck hingegen hofft, dass die Panzer dem Land im Frühjahr helfen. Mehr im Liveticker.",https://img.welt.de/img/politik/ausland/mobile243655635/4771352727-ci16x9-w1200/Fraktionssitzungen-der-Bundestags-Parteien.jpg,2023-02-08T04:50:38Z,https://web.archive.org/web/20230208050403/https://www.welt.de/politik/ausland/article243655633/Ukraine-News-Bartsch-kritisiert-Panzer-Harakiri-der-Regierung.html,"Der Linken-Fraktionschef Dietmar Bartsch hat die Entscheidung der Bundesregierung kritisiert, die Ausfuhr von bis zu 178 Kampfpanzern des Typs Leopard 1A5 in die Ukraine zu genehmigen. Die Ampel-Regi… [+3168 chars]",,de,'Russland'
https://www.handelsblatt.com/politik/international/sanktionen-eu-nimmt-russlands-atomindustrie-ins-visier/28964826.html,https://www.handelsblatt.com/politik/international/sanktionen-eu-nimmt-russlands-atomindustrie-ins-visier/28964826.html,0,www.handelsblatt.com,Ukraine-Krieg: Schlag gegen Russlands mächtige Atomindustrie: EU nimmt Rosatom ins Visier,Der Atomkonzern ist für Russlands Wirtschaft und Militär von zentraler Bedeutung. Von Sanktionen gilt es aber noch Ungarns Premier Viktor Orban zu überzeugen.,https://www.handelsblatt.com/images/steuerungszentrale-des-atomkraftwerks-saporischschja-/28966156/4-format2003.jpg,2023-02-08T05:06:20Z,,"Steuerungszentrale des Atomkraftwerks Saporischschja Russland koppelte das größte europäische Kernkraftwerk vom ukrainischen Netz ab und nutzt es für seine Belange. 
(Foto: IMAGO/NurPhoto) 
Kiew De… [+1399 chars]",,de,'Russland'
https://www.faz.net/aktuell/politik/ukraine-liveticker-hofreiter-scholz-muss-in-panzerfrage-vertrauen-zurueckgewinnen-faz-18495964.html,https://www.faz.net/aktuell/politik/ukraine-liveticker-hofreiter-scholz-muss-in-panzerfrage-vertrauen-zurueckgewinnen-faz-18495964.html,0,www.faz.net,Ukraine-Liveblog: Hofreiter: Scholz muss in Panzerfrage Vertrauen zurückgewinnen,Selenskyj: Panzerlieferungen können Parität auf Schlachtfeld verschaffen +++ Merz kritisiert schlechte Vorbereitung von Kampfpanzer-Ausbildung +++ Russland verstärkt Truppen in der Ostukraine +++ alle Entwicklungen im Liveblog.,https://media0.faz.net/ppmedia/aktuell/politik/3140750892/1.8662086/facebook_teaser/der-gruenen-abgeordnete-anton.jpg,2023-02-08T05:17:55Z,,Das Parlament der Ukraine hat am Dienstag die Ernennungen von Wasyl Maljuk zum Chef des Inlandsgeheimdienstes SBU und von Ihor Klymenko zum Innenminister mit großer Mehrheit bestätigt. Neben der vom … [+1466 chars],,de,'Russland'
https://www.stern.de/politik/ausland/ivan-krastev---putin-inszeniert-sich-als-neuer-stalin--33173424.html,https://www.stern.de/politik/ausland/ivan-krastev---putin-inszeniert-sich-als-neuer-stalin--33173424.html,0,www.stern.de,"Frieden oder Waffenstillstand? : Wie kann der Krieg in der Ukraine enden? Philosophen Ivan Krastev glaubt an das Szenario ""der beiden Koreas""","Der bulgarische Philosoph und Politologe Ivan Krastev gilt als einer der aufregendsten Denker Europas. Im stern-Inteview spricht er über Putins Drohungen, Selenskyjs Strahlkraft, Europas Zukunft und ein Szenario für ein Ende des Krieges.",https://image.stern.de/33173422/t/ss/v3/w1440/r1.7778/-/ivan-krastev.jpg,2023-02-08T05:19:00Z,http://archive.md/20230208083156/https://www.stern.de/politik/ausland/ivan-krastev---putin-inszeniert-sich-als-neuer-stalin--33173424.html,"Der bulgarische Philosoph und Politologe Ivan Krastev gilt als einer der aufregendsten Denker Europas. Im stern-Inteview spricht er über Putins Drohungen, Selenskyjs Strahlkraft, Europas Zukunft und … [+600 chars]",,de,'Putin'
https://www.stern.de/gesellschaft/regional/thueringen/biathlon--olympiasieger-peiffer-gegen-rueckkehr-russischer-sportler-33176302.html,https://www.stern.de/gesellschaft/regional/thueringen/biathlon--olympiasieger-peiffer-gegen-rueckkehr-russischer-sportler-33176302.html,0,www.stern.de,Biathlon: Olympiasieger Peiffer gegen Rückkehr russischer Sportler,"Bei der Biathlon-WM in Oberhof fehlen Russland und Belarus. Für Olympiasieger Peiffer sollte der Ausschluss so lange anhalten, bis der Krieg in der Ukraine beendet ist. Wilhelm sieht es anders.",https://image.stern.de/33176304/t/9A/v1/w1440/r1.7778/-/08--urnnewsmldpacom2009010123020899514515v2w800h600l895t228r2018b1369jpeg---806362457a7f9959.jpg,2023-02-08T05:26:01Z,,"Bei der Biathlon-WM in Oberhof fehlen Russland und Belarus. Für Olympiasieger Peiffer sollte der Ausschluss so lange anhalten, bis der Krieg in der Ukraine beendet ist. Wilhelm sieht es anders.
Biat… [+2584 chars]",,de,'Russland'
https://www.focus.de/politik/ausland/ukraine-krieg-biden-sagt-ukraine-anhaltende-unterstuetzung-zu_id_57275780.html,https://www.focus.de/politik/ausland/ukraine-krieg-biden-sagt-ukraine-anhaltende-unterstuetzung-zu_id_57275780.html,0,www.focus.de,Ukraine-Krieg - Stimmen und Entwicklungen - Verteidigungsminister Boris Pistorius überraschend nach Kiew gereist,Der ukrainische Präsident Selenskyj ernennt neue „Führungskräfte“ an der Front. Die russischen Truppen verstärken offenbar bereits ihre Angriffe im Donbass. Alle aktuellen News zum Ukraine-Krieg finden Sie im Newsticker.,https://p6.focus.de/img/id_185191586/borispistorius.jpg?im=Crop%3D%280%2C0%2C1066%2C532%29%3BResize%3D%281200%2C627%29&hash=27538226bb80bc3520672ac5c2e2421ca4593b54e0ed5932e15a6f295e01c199,2023-02-08T05:35:10Z,http://archive.md/20230208101644/https://www.focus.de/politik/ausland/ukraine-krieg-biden-sagt-ukraine-anhaltende-unterstuetzung-zu_id_57275780.html,Der ukrainische Präsident Selenskyj ernennt neue Führungskräfte an der Front. Die russischen Truppen verstärken offenbar bereits ihre Angriffe im Donbass. Alle aktuellen News zum Ukraine-Krieg finden… [+9680 chars],,de,'Ukraine'
https://www.faz.net/aktuell/sport/mehr-sport/ukraine-krieg-schach-weltverband-fide-abhaengig-von-russland-18660718.html,https://www.faz.net/aktuell/sport/mehr-sport/ukraine-krieg-schach-weltverband-fide-abhaengig-von-russland-18660718.html,0,www.faz.net,Schach-Weltverband FIDE weiter abhängig von Russland,Der Weltverband FIDE hat sich nach dem Überfall auf die Ukraine offiziell von den Geldgebern aus Putins Reich getrennt. Dennoch ist die Abhängigkeit ungebrochen. Der Deutsche Schachbund aber wehrt sich.,https://media1.faz.net/ppmedia/aktuell/972639197/1.8660785/facebook_teaser_fplus/in-abwesenheit-von-magnus.jpg,2023-02-08T05:41:19Z,https://web.archive.org/web/20230208062641/https://www.faz.net/aktuell/sport/mehr-sport/ukraine-krieg-schach-weltverband-fide-abhaengig-von-russland-18660718.html,"Nach dem russischen Überfall auf die Ukraine beendete die Weltschachföderation FIDE zwar binnen fünf Tagen ihre Verträge mit russischen Geldgebern, doch die bewährten Quellen werden immer noch angeza… [+568 chars]",,de,'Putin'
https://www.telepolis.de/features/Altersarmut-Rund-18-Prozent-der-Rentner-rutschen-unter-die-Armutsgrenze-7488415.html,https://www.telepolis.de/features/Altersarmut-Rund-18-Prozent-der-Rentner-rutschen-unter-die-Armutsgrenze-7488415.html,0,www.telepolis.de,Altersarmut: Rund 18 Prozent der Rentner rutschen unter die Armutsgrenze,Der Trend setzt sich fort: Immer mehr alte Menschen rutschen in die Armut. Zwei Gruppen sind besonders betroffen. Vor allem in den Großstädten entstehen für sie erhebliche Probleme.,https://heise.cloudimg.io/bound/1200x1200/q85.png-lossy-85.webp-lossy-85.foil1/_www-heise-de_/imgs/18/3/6/9/5/0/6/9/alterssarmut_ho-19d0a916462b6eb7.png,2023-02-08T06:00:00Z,https://web.archive.org/web/20230208074445/https://www.telepolis.de/features/Altersarmut-Rund-18-Prozent-der-Rentner-rutschen-unter-die-Armutsgrenze-7488415.html,"Der Trend setzt sich fort: Immer mehr alte Menschen rutschen in die Armut. Zwei Gruppen sind besonders betroffen. Vor allem in den Großstädten entstehen für sie erhebliche Probleme.
Altersarmut ist … [+3474 chars]",,de,'Armut'
https://www.morgenpost.de/kultur/tv/article237580145/markus-lanz-ukraine-krieg-waffen-panzer-leopard-2-tv-talk-zdf.html,https://www.morgenpost.de/kultur/tv/article237580145/markus-lanz-ukraine-krieg-waffen-panzer-leopard-2-tv-talk-zdf.html,0,www.morgenpost.de,"ZDF-Talk: Experte bei Lanz: ""Putin glaubt, dass wir Weicheier sind""",Ein Experte spricht sich bei Markus Lanz erneut gegen Waffenlieferungen an die Ukraine aus. Ein Diplomat widerspricht deutlich - und bekommt Rückendeckung aus der SPD.,https://img.morgenpost.de/img/frontpage/crop237166097/0762607073-w820-cv16_9-q85/Markus-Lanz.jpg,2023-02-08T06:07:46Z,,Berlin. Können Waffen Frieden schaffen? Diese Frage spaltete ein Jahr nach Beginn des Angriffskriegs auf die Ukraine die lebendige Diskussionsrunde bei Markus Lanz. Auslöser war die fortlaufende Deba… [+4698 chars],,de,'Putin'
https://www.focus.de/klima/der-welt-klima-ticker-von-focus-online-nur-verzicht-auf-private-elektroautos-kann-lithium-knappheit-verhindern_id_184475707.html,https://www.focus.de/klima/der-welt-klima-ticker-von-focus-online-nur-verzicht-auf-private-elektroautos-kann-lithium-knappheit-verhindern_id_184475707.html,0,www.focus.de,Der Welt-Klima-Ticker von FOCUS online - Nur Verzicht auf private Elektroautos kann Lithium-Knappheit verhindern,"Das sind die wichtigsten globalen Nachrichten des Tages zum Thema Klima und Nachhaltigkeit - kompakt, schnell und konstruktiv.",https://p6.focus.de/img/fotos/id_185165359/elektroautos.jpg?im=Crop%3D%280%2C288%2C3464%2C1732%29%3BResize%3D%281200%2C627%29&hash=ff5d4686e5633fae7e3f50c77f5a4c15a3b9b4d1a9bb8b951c395887cbd8acca,2023-02-08T06:58:45Z,,"Das sind die wichtigsten globalen Nachrichten des Tages zum Thema Klima und Nachhaltigkeit - kompakt, schnell und konstruktiv.
+++ Der Welt-Klima-Ticker +++
Nur Verzicht auf private Elektroautos ka… [+25853 chars]",,de,'Russland'
https://www.focus.de/kultur/kino_tv/lanz-gast-verzweifelt-an-waffen-lieferung-putin-kann-mehr-tote-hinnehmen_id_185239864.html,https://www.focus.de/kultur/kino_tv/lanz-gast-verzweifelt-an-waffen-lieferung-putin-kann-mehr-tote-hinnehmen_id_185239864.html,0,www.focus.de,Hitzige Debatte im ZDF - Lanz-Gast verzweifelt an Waffen-Lieferung: „Putin kann mehr Tote hinnehmen“,"Nach der Zusage der Kampfpanzer-Lieferungen stellt sich die Frage, ob auch Kampfjets in die Ukraine geschickt werden könnten. Bei „Markus Lanz“ kam es darüber am Dienstag zu lautstarkem Streit. SPD-Chefin Saskia Esken wurde zudem zu ihren Ambitionen befragt, …",https://p6.focus.de/img/fotos/id_185246393/markus-lanz-hoert-zu-als-wolfgang-merkel-vorne-rechts-ueber-waffen-lieferungen-in-die-ukraine-redet.png?im=Crop%3D%280%2C45%2C3024%2C1512%29%3BResize%3D%281200%2C627%29&impolicy=perceptual&quality=medium&hash=5ebdac084a88de9ea425278379919f868d0b30d5abc9eea0c4d8ce1943aafff1,2023-02-08T07:14:24Z,,"Die geplanten Panzerlieferungen aus westlichen Ländern wie Deutschland und den USA lösten zuletzt neue Erklärungen seitens des Kremls aus. Es scheint, als habe Russlands Präsident Wladimir Putin noch… [+5577 chars]",,de,'Russland'
https://www.welt.de/wirtschaft/article243655951/Internationalen-Energieagentur-Stromversorgung-wird-zunehmend-wetterabhaengig.html,https://www.welt.de/wirtschaft/article243655951/Internationalen-Energieagentur-Stromversorgung-wird-zunehmend-wetterabhaengig.html,0,www.welt.de,Stromversorgung wird laut IEA zunehmend wetterabhängig,Laut der Internationalen Energieagentur werden Stromversorgung und -nachfrage in Zukunft nicht mehr vom Wetter zu trennen sein. Hitzewellen hätten zu einer verstärkten Nutzung von Klimaanlagen geführt – Kälteeinbrüche zu Stromausfällen.,https://img.welt.de/img/debatte/kommentare/mobile243165485/5911354607-ci16x9-w1200/390250553.jpg,2023-02-08T07:18:21Z,https://web.archive.org/web/20230209065311/https://www.welt.de/wirtschaft/article243655951/Internationalen-Energieagentur-Stromversorgung-wird-zunehmend-wetterabhaengig.html,"Die Stromversorgung sowie die Stromnachfrage werden in Zukunft nach Einschätzung der Internationalen Energieagentur (IEA) zunehmend vom Wetter abhängen. Dürre und Hitzewellen in Europa, Indien und Ch… [+2029 chars]",,de,'Kälte'
https://www.faz.net/aktuell/politik/ausland/scholz-trifft-lula-russlands-einfluss-in-lateinamerika-18657753.html,https://www.faz.net/aktuell/politik/ausland/scholz-trifft-lula-russlands-einfluss-in-lateinamerika-18657753.html,0,www.faz.net,Russische Propaganda in Lateinamerika: Alles Putin-Versteher?,"In Lateinamerika ist Moskau weniger ins Abseits geraten als anderswo. Das hat historische Gründe, ist aber auch auf den Erfolg der russischen Propaganda zurückzuführen. Hilfe für die Ukraine ist aus der Region nicht zu erwarten.",https://media0.faz.net/ppmedia/aktuell/politik/903094683/1.8657752/facebook_teaser_fplus/untergehakt-uneinig-scholz-und.jpg,2023-02-08T07:22:17Z,,"Es brauche immer zwei für einen Krieg, hat Brasiliens Präsident Luiz Inácio Lula da Silva vor einer Woche bei der Pressekonferenz mit Bundeskanzler Olaf Scholz gesagt. Lula da Silva will sich nicht k… [+640 chars]",,de,'Putin'
https://www.welt.de/politik/ausland/article243655633/Ukraine-News-Wehrbeauftragte-Leopard-2-Lieferung-reisst-gewaltige-Luecke-bei-Bundeswehr.html,https://www.welt.de/politik/ausland/article243655633/Ukraine-News-Wehrbeauftragte-Leopard-2-Lieferung-reisst-gewaltige-Luecke-bei-Bundeswehr.html,0,www.welt.de,"Leopard-2-Lieferung reißt „gewaltige Lücke“, sagt die Wehrbeauftragte","Die Bundeswehr brauche schnell Ersatz für die Kampfpanzer, die an die Ukraine geliefert werden sollen, fordert Eva Högl, Wehrbeauftragte des Bundestags. Sie mahnt, die eigene Einsatzbereitschaft müsse bei der Militärhilfe im Blick behalten werden. Mehr im Liv…",https://img.welt.de/img/politik/ausland/mobile243656471/8571350917-ci16x9-w1200/Wehrbeauftragte-Hoegl.jpg,2023-02-08T07:48:00Z,,"Die Wehrbeauftragte des Bundestags, Eva Högl (SPD), dringt auf schnellen Ersatz für die Leopard-2-Kampfpanzer, die von der Bundeswehr an die Ukraine geliefert werden sollen. Die Soldatinnen und Solda… [+4589 chars]",,de,'Russland'
https://www.welt.de/politik/ausland/plus243646591/Russland-plant-Offensive-Auf-eine-blutige-Weise-ist-es-eine-Chance-fuer-die-Ukraine.html,https://www.welt.de/politik/ausland/plus243646591/Russland-plant-Offensive-Auf-eine-blutige-Weise-ist-es-eine-Chance-fuer-die-Ukraine.html,0,www.welt.de,„Auf eine blutige Weise ist es eine Chance für die Ukraine“,Russland sammelt Truppen im Osten der Ukraine. Offenbar steht eine Großoffensive unmittelbar bevor. Laut Geheimdiensten hat Putin die Einnahme von Gebieten um jeden Preis eingefordert. Dabei könnten die russischen Soldaten erneut in eine taktische Falle laufe…,https://img.welt.de/img/politik/ausland/mobile243646823/7431358397-ci16x9-w1200-fnov-fpotl-fpi157750653/DWO-AP-Teaser-Sterben-Ukraine-cw-jpg.jpg,2023-02-08T07:51:00Z,http://archive.md/20230208075619/https://www.welt.de/politik/ausland/plus243646591/Russland-plant-Offensive-Auf-eine-blutige-Weise-ist-es-eine-Chance-fuer-die-Ukraine.html,"Ble Pueelekeu Oekleu plek, pepp elue lnpplpeke Gtteuplue lu pel Gplnhlelue nuOllletpel peuulplekl. Pu peale pel nhlelulpeke UellelplanuapOlulplel Gtevll Bepulhuv eO Puuulea, pepp pelu Ueup nO peu 02.… [+7932 chars]",,de,'Ukraine'
https://www.faz.net/aktuell/politik/ukraine-liveticker-selenskyj-besucht-grossbritannien-faz-18495964.html,https://www.faz.net/aktuell/politik/ukraine-liveticker-selenskyj-besucht-grossbritannien-faz-18495964.html,0,www.faz.net,Ukraine-Liveblog: Selenskyj besucht Großbritannien,Selenskyj wird in London erwartet +++ Selenskyj: Panzerlieferungen können Parität auf Schlachtfeld verschaffen +++ Merz kritisiert schlechte Vorbereitung von Kampfpanzer-Ausbildung +++ alle Entwicklungen im Liveblog.,https://media0.faz.net/ppmedia/aktuell/politik/3859210504/1.8662376/facebook_teaser/der-ukrainische-praesident.jpg,2023-02-08T08:44:55Z,https://web.archive.org/web/20230208100125/https://www.faz.net/aktuell/politik/ukraine-liveticker-selenskyj-besucht-grossbritannien-faz-18495964.html,"Biathlon-Olympiasieger Arnd Peiffer hat sich deutlich gegen eine Rückkehr russischer Athletinnen und Athleten in den Weltsport ausgesprochen. ""Ich würde es nicht gutheißen und finde es schwer vorstel… [+1092 chars]",,de,'Ukraine'
https://www.tagesschau.de/ausland/tuerkei-griechenland-flucht-evros-obduktion-101.html,https://www.tagesschau.de/ausland/tuerkei-griechenland-flucht-evros-obduktion-101.html,0,www.tagesschau.de,Griechisch-türkische Grenze: Protokollant der Toten vom Evros,"Nicht nur auf dem Mittelmeer, auch am Grenzfluss Evros sterben Menschen bei ihrer Flucht in die EU. Tote ohne Papiere landen bei Rechtsmediziner Pavlidis. Er ermittelt die Identitäten - und gibt den Gestorbenen etwas Würde zurück<strong>.</strong> <em>Von R. …",https://www.tagesschau.de/multimedia/bilder/fluss100~_v-original.jpg,2023-02-08T09:27:14Z,https://web.archive.org/web/20230208105426/https://www.tagesschau.de/ausland/tuerkei-griechenland-flucht-evros-obduktion-101.html,"Nicht nur auf dem Mittelmeer, auch am Grenzfluss Evros sterben Menschen bei ihrer Flucht in die EU. Tote ohne Papiere landen bei Rechtsmediziner Pavlidis. Er ermittelt die Identitäten - und gibt den … [+3121 chars]",,de,'Flucht'
https://www.faz.net/aktuell/sport/wintersport/biathlon-wm-in-oberhof-deutsche-biathleten-wollen-top-platzierungen-18661096.html,https://www.faz.net/aktuell/sport/wintersport/biathlon-wm-in-oberhof-deutsche-biathleten-wollen-top-platzierungen-18661096.html,0,www.faz.net,Biathlon-WM in Oberhof: Die Deutschen jagen die Blumen,"Sonne, Schnee und viele Zuschauer: Der Rahmen für die Biathlon-WM in Oberhof passt. Jetzt müssen Vanessa Voigt und Kollegen nur noch erfolgreich sein – am liebsten schon beim Auftakt.",https://media0.faz.net/ppmedia/aktuell/sport/163898577/1.8661094/facebook_teaser/wm-vor-der-haustuer-vanessa.jpg,2023-02-08T10:14:56Z,https://web.archive.org/web/20230208111727/https://www.faz.net/aktuell/sport/wintersport/biathlon-wm-in-oberhof-deutsche-biathleten-wollen-top-platzierungen-18661096.html,"Es ist in Zeiten des Klimawandels keine Option, bei Sportwettbewerben im Winter nicht über das Wetter zu sprechen. Denn die Frage, ob Schnee liegt und wenn ja, wie viel, ist zum ständigen Begleiter d… [+4852 chars]",,de,'Schnee'
https://www.zeit.de/news/2023-02/08/afrika-russland-china-und-usa-buhlen-um-einfluss,https://www.zeit.de/news/2023-02/08/afrika-russland-china-und-usa-buhlen-um-einfluss,0,www.zeit.de,"Machtkampf: Afrika: Russland, China und USA buhlen um Einfluss",,,2023-02-08T11:09:37Z,https://web.archive.org/web/20230208113405/https://www.zeit.de/news/2023-02/08/afrika-russland-china-und-usa-buhlen-um-einfluss,"When browsing with ads:
We collect personal data and also transmit it to third-party providers
 that help us improve and finance our digital content. Some of the information stored on your device, … [+732 chars]",,de,'Russland'
https://www.faz.net/aktuell/politik/inland/olaf-scholz-fordert-usa-zu-entgegenkommen-bei-inflationsbekaempfung-auf-18662826.html,https://www.faz.net/aktuell/politik/inland/olaf-scholz-fordert-usa-zu-entgegenkommen-bei-inflationsbekaempfung-auf-18662826.html,0,www.faz.net,Wegen Inflation Reduction Act: Scholz fordert die USA zu Entgegenkommen auf,In seiner Regierungserklärung geht Olaf Scholz auf Europas Sorgen im Hinblick auf das umstrittene amerikanische Investitionsprogramm ein. Außerdem unterstützt er den geplanten Flüchtlingsgipfel von Nancy Faeser.,https://media0.faz.net/ppmedia/aktuell/1092730512/1.8663072/facebook_teaser/bundeskanzler-olaf-scholz-und.jpg,2023-02-08T13:07:21Z,https://web.archive.org/web/20230208172522/https://www.faz.net/aktuell/politik/inland/olaf-scholz-fordert-usa-zu-entgegenkommen-bei-inflationsbekaempfung-auf-18662826.html,"Bundeskanzler Olaf Scholz hat die USA wegen des umstrittenen milliardenschweren US-Investitionsprogramms zu Entgegenkommen aufgefordert. Scholz sagte am Mittwoch im Bundestag, die Wirtschaftsbeziehun… [+4206 chars]",,de,'Inflation'
https://www.zeit.de/gesellschaft/zeitgeschehen/2023-02/ostukraine-abschuss-flug-mh17-wladimir-putin,https://www.zeit.de/gesellschaft/zeitgeschehen/2023-02/ostukraine-abschuss-flug-mh17-wladimir-putin,0,www.zeit.de,Flug MH17: Wladimir Putin laut Ermittlern in Abschuss von Flug MH17 involviert,298 Menschen starben 2014 beim Abschuss eines Passagierflugzeugs über der Ostukraine. Laut Ermittlern gab Wladimir Putin sein Einverständnis für die Raketenlieferung.,,2023-02-08T13:14:40Z,https://web.archive.org/web/20230208134053/https://www.zeit.de/gesellschaft/zeitgeschehen/2023-02/ostukraine-abschuss-flug-mh17-wladimir-putin,"When browsing with ads:
We collect personal data and also transmit it to third-party providers
 that help us improve and finance our digital content. Some of the information stored on your device, … [+732 chars]",,de,'Putin'
