index,url,valid,domain,title,description,image,published,archive,content,quote,language,keyword
https://www.focus.de/politik/ausland/ukraine-krise/noworossijsk-stuetzpunkt-russen-wehren-angriff-der-ukrainer-mit-seedrohnen-ab_id_200881925.html,https://www.focus.de/politik/ausland/ukraine-krise/noworossijsk-stuetzpunkt-russen-wehren-angriff-der-ukrainer-mit-seedrohnen-ab_id_200881925.html,0,www.focus.de,Noworossijsk-Stützpunkt - Russen wehren Angriff der Ukrainer mit Seedrohnen ab,"Russland behauptet, einen nächtlichen ukrainischen Angriff auf den Marinestützpunkt in Noworossijsk abgewehrt zu haben. Zwei Seedrohnen wurden laut Moskau durch Wachboote zerstört, aber unabhängige Bestätigung fehlt.",https://p6.focus.de/img/fotos/id_174289842/schwimmdrohe-ukraine.png?im=Crop%3D%280%2C31%2C2038%2C1019%29%3BResize%3D%281200%2C627%29&impolicy=perceptual&quality=mediumHigh&hash=82c34a2f8f58a80ae154507977cc2a730e9f0deb1b935e80183ca479a1857c44,2023-08-04T05:23:15Z,,"Russland behauptet, einen nächtlichen ukrainischen Angriff auf den Marinestützpunkt in Noworossijsk abgewehrt zu haben. Zwei Seedrohnen wurden laut Moskau durch Wachboote zerstört, aber unabhängige B… [+1049 chars]",,de,'Ukraine'
https://www.focus.de/politik/ausland/ukraine-krise/231-000-wollen-in-den-krieg-russland-lockt-mit-besseren-bedingungen_id_200882549.html,https://www.focus.de/politik/ausland/ukraine-krise/231-000-wollen-in-den-krieg-russland-lockt-mit-besseren-bedingungen_id_200882549.html,0,www.focus.de,Russland ruft und sie kommen - 231.000 neue Soldaten - angelockt von besseren Bedingungen,"Über 231.000 Russen haben sich seit Januar bereit erklärt, gegen die Ukraine zu dienen, und Verträge mit dem Verteidigungsministerium abgeschlossen. Laut Dmitri Medwedew wurden bedeutende Anstrengungen unternommen, um den Dienst attraktiver zu machen.",https://p6.focus.de/img/politik/ausland/id_200021059/russische-rekruten-an-einem-bahnhof-in-der-russischen-region-wolgograd.-wehrpflichtige-russen-duerfen-das-land-nach-der-zustellung-des-einberufungsbescheids-nicht-mehr-verlassen..jpg?im=Crop%3D%280%2C170%2C2048%2C1024%29%3BResize%3D%281200%2C627%29&impolicy=perceptual&quality=mediumHigh&hash=951e4b7e3233e0d9c9c9009f88858f475accf33adc6aefc725b11f74ea4d6bf2,2023-08-04T05:33:28Z,,"Über 231.000 Russen haben sich seit Januar bereit erklärt, gegen die Ukraine zu dienen, und Verträge mit dem Verteidigungsministerium abgeschlossen. Laut Dmitri Medwedew wurden bedeutende Anstrengung… [+1158 chars]",,de,'Ukraine'
https://www.handelsblatt.com/politik/international/russland-experte-putin-sucht-keinen-ausweg-er-plant-fuer-einen-noch-groesseren-krieg-/29295396.html,https://www.handelsblatt.com/politik/international/russland-experte-putin-sucht-keinen-ausweg-er-plant-fuer-einen-noch-groesseren-krieg-/29295396.html,0,www.handelsblatt.com,"Russland-Experte: „Putin sucht keinen Ausweg, er plant für einen noch größeren Krieg“","Dafür, dass Russland in absehbarer Zeit kriegsmüde werden könnte, gibt es keine Anhaltspunkte – im Gegenteil. Was aber bedeutet das für die westlichen Unterstützer der Ukraine?",https://www.handelsblatt.com/images/wladimir-putin/29295476/3-format2003.jpg,2023-08-04T05:35:00Z,http://archive.md/20230804093137/https://www.handelsblatt.com/politik/international/russland-experte-putin-sucht-keinen-ausweg-er-plant-fuer-einen-noch-groesseren-krieg-/29295396.html,Wladimir PutinWladimir Putin (links) kann den Krieg gegen die Ukraine wegen neuer Staatsschulden und alternativen Absatzkanälen wie China mittelfristig weiter finanzieren. Rechts neben dem russischen… [+1149 chars],,de,'Putin'
https://www.zeit.de/news/2023-08/04/toter-bei-kaiserslautern-tatverdaechtiger-auf-der-flucht,https://www.zeit.de/news/2023-08/04/toter-bei-kaiserslautern-tatverdaechtiger-auf-der-flucht,0,www.zeit.de,Untersuchungshaftbefehl: Toter bei Kaiserslautern: Tatverdächtiger auf der Flucht,,,2023-08-04T11:10:32Z,,"When browsing with ads:
We collect personal data and also transmit it to third-party providers
 that help us improve and finance our digital content. Some of the information stored on your device, … [+821 chars]",,de,'Flucht'
https://www.faz.net/aktuell/politik/ukraine-liveticker-bundesregierung-liefert-weiteres-militaergeraet-faz-19030454.html,https://www.faz.net/aktuell/politik/ukraine-liveticker-bundesregierung-liefert-weiteres-militaergeraet-faz-19030454.html,0,www.faz.net,Ukraine-Liveblog: Bundesregierung liefert weiteres Militärgerät an Ukraine,Darunter Minenräumpanzer und Drohnen +++ Litauen will wegen Wagner-Söldnern in Belarus Grenzübergänge schließen +++ Ukraine: Russisches Schiff bei Angriff auf Schwarzmeer-Hafen beschädigt +++ alle Entwicklungen im Liveblog,https://media1.faz.net/ppmedia/aktuell/1814753513/1.9082551/facebook_teaser/soldat-vor-einem.jpg,2023-08-04T20:36:02Z,,"Ukraine-Liveblog: Bundesregierung liefert weiteres Militärgerät an Ukraine
Ukraine-Liveblog
Bundesregierung liefert weiteres Militärgerät an Ukraine
Von Darunter Minenräumpanzer und Drohnen +++ Li… [+244 chars]",,de,'Ukraine'
https://consent.google.com/ml?continue=https://news.google.com/rss/articles/CBMiVmh0dHBzOi8vd3d3Lm4tdHYuZGUvcG9saXRpay9FeHBlcnRlLVVrcmFpbmUtdGVzdGV0LWRhcy1Wb3JydWVja2VuLWFydGljbGUyNDMwNzI4MC5odG1s0gEA?oc%3D5&gl=FR&hl=en-US&cm=2&pc=n&src=1,https://consent.google.com/ml?continue=https://news.google.com/rss/articles/CBMiVmh0dHBzOi8vd3d3Lm4tdHYuZGUvcG9saXRpay9FeHBlcnRlLVVrcmFpbmUtdGVzdGV0LWRhcy1Wb3JydWVja2VuLWFydGljbGUyNDMwNzI4MC5odG1s0gEA?oc%3D5&gl=FR&hl=en-US&cm=2&pc=n&src=1,0,consent.google.com,"Erfolgsaussichten steigen: Experte: ""Ukraine testet das Vorrücken"" - n-tv NACHRICHTEN","<ol><li>Erfolgsaussichten steigen: Experte: ""Ukraine testet das Vorrücken""  n-tv NACHRICHTEN
</li><li>Ukraine-Krieg: Das ist der aktuelle Stand von Kiews Gegenoffensive  WEB.DE News
</li><li>Putins Angriffskrieg: Militärexperte sieht Chancen für Erfolg der …",,2023-08-05T06:08:00Z,,"We use cookies and data to<ul><li>Deliver and maintain Google services</li><li>Track outages and protect against spam, fraud, and abuse</li><li>Measure audience engagement and site statistics to unde… [+1131 chars]",,de,'Ukraine'
https://www.n-tv.de/politik/Experte-Ukraine-testet-das-Vorruecken-article24307280.html,https://www.n-tv.de/politik/Experte-Ukraine-testet-das-Vorruecken-article24307280.html,0,www.n-tv.de,"Erfolgsaussichten steigen: Experte: ""Ukraine testet das Vorrücken""","Seit zwei Monaten läuft die Offensive der Ukraine gegen die russische Invasion. Inzwischen sei die erste russische Verteidigungslinie im Süden durchbrochen worden, so Vize-Verteidigungsministerin Maliar. Militärexperte Mölling macht genau das zur Bedingung fü…",https://bilder3.n-tv.de/img/incoming/crop24307290/6981322866-cImg_16_9-w1200/7e8e16283c642a492b4a04133987699d.jpg,2023-08-05T06:08:39Z,,"Seit zwei Monaten läuft die Offensive der Ukraine gegen die russische Invasion. Inzwischen sei die erste russische Verteidigungslinie im Süden durchbrochen worden, so Vize-Verteidigungsministerin Mal… [+2662 chars]",,de,'Ukraine'
https://www.faz.net/aktuell/politik/ukraine-krieg-russischer-tanker-nahe-krim-bruecke-beschaedigt-19082632.html,https://www.faz.net/aktuell/politik/ukraine-krieg-russischer-tanker-nahe-krim-bruecke-beschaedigt-19082632.html,0,www.faz.net,Russischer Tanker in Kertsch-Meerenge beschädigt,Russische Medien sprechen von einer ukrainischen Drohnenattacke auf ein Schiff in der Nähe der Halbinsel Krim. Ein Experte bescheinigt der Ukraine gute Chancen bei der Gegenoffensive. Der Überblick.,https://media0.faz.net/ppmedia/aktuell/526378666/1.9082634/facebook_teaser/ein-russisches-kriegsschiff-in.jpg,2023-08-05T06:23:31Z,,"Bei einem Angriff in der Straße von Kertsch, die das Schwarze Meer und das Asowsche Meer miteinander verbindet, ist in der Nacht zum Samstag ein russischer Tanker beschädigt worden. Medienberichten z… [+5434 chars]",,de,'Ukraine'
https://www.nzz.ch/international/ukraine-krieg-marinedrohnen-greifen-oeltanker-des-russischen-militaers-an-ld.1750288,https://www.nzz.ch/international/ukraine-krieg-marinedrohnen-greifen-oeltanker-des-russischen-militaers-an-ld.1750288,0,www.nzz.ch,"Die Ukrainer attackieren einen Öltanker, der für Russlands Militär «spezielle Ladungen» transportierte",Seit dem Ende des Getreide-Abkommens nehmen die Angriffe im Schwarzen Meer stark zu. Dabei setzen die Ukrainer zum wiederholten Mal erfolgreich Marinedrohnen ein.,"https://img.nzz.ch/2023/08/05/a7434fe0-c655-4201-9901-268cdf46f0e7.jpeg?width=1200&height=675&fit=bound&quality=75&auto=webp&crop=5500,3094,x0,y442&wmark=nzz",2023-08-05T06:35:34Z,,"Die Strasse von Kertsch mit der Krim-Brücke ist zunehmend umkämpft.
Nur einen halben Tag nach dem Angriff auf die russische Schwarzmeerflotte im Hafen von Noworossisk haben ukrainische Drohnen ein z… [+3680 chars]",,de,'Russland'
https://orf.at/stories/3326449/,https://orf.at/stories/3326449/,0,orf.at,Berichte über Explosionen nahe Krim-Brücke,Laut Angaben russischer und ukrainischer Medien hat es in der Nacht auf Samstag mehrere Explosionen nahe der Krim-Brücke gegeben. Ukrainische Medien berichteten von drei Explosionen bei der Brücke zwischen der von Moskau besetzten Schwarzmeer-Halbinsel Krim u…,https://ibs.orf.at/news?image=https%3A%2F%2Fassets.orf.at%2Fmims%2F2023%2F31%2F04%2Fcrops%2Fw%3D1200%2Ch%3D630%2Cq%3D75%2F1891537_master_709104_ukraine_tanker_angriff_r.jpg%3Fs%3Db5742a2c1b2a7745dbe5555c4459e12a470d913c,2023-08-05T06:40:36Z,https://web.archive.org/web/20230805105617/https://orf.at/stories/3326449/,"Die staatliche russische Nachrichtenagentur TASS meldete, dass ein russischer Tanker bei einem Angriff in der Meerenge beschädigt wurde. Der Maschinenraum des Tankers habe Schaden genommen. Es sei ab… [+5355 chars]",,de,'Ukraine'
https://www.stern.de/politik/ausland/krim-region--russland-meldet-ukrainischen-drohnenangriff-auf-tanker-33711630.html,https://www.stern.de/politik/ausland/krim-region--russland-meldet-ukrainischen-drohnenangriff-auf-tanker-33711630.html,0,www.stern.de,Krim-Region: Russland meldet ukrainischen Drohnenangriff auf Tanker in Straße von Kertsch – mehrere Verletzte,Immer wieder greifen sich Russland und die Ukraine in der Schwarzmeer-Region um die Krim an. Zuletzt soll eine ukrainische Drohnenattacke einen russischen Tanker beschädigt haben. Gegen das Schiff hatten die USA Sanktionen verhängt.,https://image.stern.de/33711642/t/pL/v3/w1440/r1.7778/-/krim-bru-cke.jpg,2023-08-05T06:41:08Z,,Immer wieder greifen sich Russland und die Ukraine in der Schwarzmeer-Region um die Krim an. Zuletzt soll eine ukrainische Drohnenattacke einen russischen Tanker beschädigt haben. Gegen das Schiff ha… [+1874 chars],,de,'Ukraine'
https://www.perlentaucher.de/9punkt/2023-08-05.html,https://www.perlentaucher.de/9punkt/2023-08-05.html,0,www.perlentaucher.de,9PUNKT - DIE DEBATTENRUNDSCHAU: Dann begann der Abstieg,"Pazifismus muss man sich leisten können, sagt Herta Müller im Welt-Interview, in dem sie Merkels Entspannungspolitik kritisiert: ""Putin hat sich nie versteckt"". Im Perlentaucher warnt Richard Herzinger westliche Regierungen vor einem faulen Kompromiss. Die Af…",https://www.perlentaucher.de/static/img/perlentaucher-logo-512x.png,2023-08-05T07:00:00Z,,"""Putin hat sich nie versteckt. Er hat immer das getan, was er tut. Er hat Kriege geführt, ständig, und das wusste man, alles"", sagt Herta Müller im Gespräch, das Marc Reichwein (Literarische Welt) an… [+4892 chars]",,de,'Ukraine'
https://www.handelsblatt.com/politik/international/ukraine-krieg-lage-am-morgen-ukrainische-drohne-beschaedigt-russischen-tanker/29301696.html,https://www.handelsblatt.com/politik/international/ukraine-krieg-lage-am-morgen-ukrainische-drohne-beschaedigt-russischen-tanker/29301696.html,0,www.handelsblatt.com,Ukraine-Krieg – Lage am Morgen: Ukraine beschädigt russischen Tanker – Krim-Verwaltung spricht von „aktiver Gefahrenlage“,"Der Maschinenraum des Schiffes wurde beschädigt, die Besatzung soll in Sicherheit sein. Der ukrainische Präsident Selenski lobte den Angriff in einer Videoansprache.",https://www.handelsblatt.com/images/der-ukrainische-praesident-wolodimir-selenski/29301712/2-format2003.jpg,2023-08-05T07:04:18Z,,"Der ukrainische Präsident Wolodimir SelenskiSelenski lobte den Geheimdienst für den Angriff auf das Schiff.
(Foto: IMAGO/ZUMA Wire)
Kiew, Kertsch, Berlin Bei einem Angriff in der Straße von Kertsch… [+6234 chars]",,de,'Ukraine'
https://www.stern.de/politik/ausland/ukraine-krieg--die-gegenoffensive-koennte-erfolgreich-werden-33711502.html,https://www.stern.de/politik/ausland/ukraine-krieg--die-gegenoffensive-koennte-erfolgreich-werden-33711502.html,0,www.stern.de,Die Nach im Überblick: Militärexperte glaubt an eine erfolgreiche ukrainische Gegenoffensive,"Die Chancen für eine erfolgreiche ukrainische Gegenoffensive stehen gut, glaubt ein Experte. Ukraines Präsident Wolodymyr Selenskyj dankt dem Geheimdienst – und Deutschland schickt Waffen an die Ukraine. Die Nacht im Überblick.",https://image.stern.de/33711608/t/LE/v2/w1440/r1.7778/-/gegenoffensive-ukraine.jpg,2023-08-05T07:11:00Z,,"Die Chancen für eine erfolgreiche ukrainische Gegenoffensive stehen gut, glaubt ein Experte. Ukraines Präsident Wolodymyr Selenskyj dankt dem Geheimdienst und Deutschland schickt Waffen an die Ukrain… [+5144 chars]",,de,'Waffen'
https://www.focus.de/politik/ausland/ukraine-krise/zeitung-titelt-zerbrechende-freundschaft-jetzt-entzweit-ein-streit-die-ukraine-und-einen-ihrer-wichtigsten-verbuendeten_id_200979249.html,https://www.focus.de/politik/ausland/ukraine-krise/zeitung-titelt-zerbrechende-freundschaft-jetzt-entzweit-ein-streit-die-ukraine-und-einen-ihrer-wichtigsten-verbuendeten_id_200979249.html,0,www.focus.de,Zeitung titelt „Zerbrechende Freundschaft“ - Jetzt entzweit ein Streit die Ukraine und einen ihrer wichtigsten Verbündeten,Die von Russland angegriffene Ukraine überlebt mit Hilfe von außen - militärisch und finanziell. Ist das Land dafür dankbar oder undankbar? Die Frage entzweit Kiew und einen seiner wichtigsten Unterstützer.,https://p6.focus.de/img/fotos/id_200979248/ukrainischer-praesident-selenskyj-und-polens-praesident-duda.jpg?im=Crop%3D%280%2C264%2C3200%2C1600%29%3BResize%3D%281200%2C627%29&impolicy=perceptual&quality=mediumHigh&hash=1c3b08311a7f9de01a2e03a2ad31e6fadfa2fd29c1404e5d45edb165c7f60ca3,2023-08-05T07:19:05Z,,Die von Russland angegriffene Ukraine überlebt mit Hilfe von außen - militärisch und finanziell. Ist das Land dafür dankbar oder undankbar? Die Frage entzweit Kiew und einen seiner wichtigsten Unters… [+5454 chars],,de,'Russland'
https://www.diepresse.com/13928593/netrebko-verklagt-die-new-yorker-metropolitan-opera,https://www.diepresse.com/13928593/netrebko-verklagt-die-new-yorker-metropolitan-opera,0,www.diepresse.com,Netrebko verklagt die New Yorker Metropolitan Opera,"Da die New Yorker Metropolitan Opera die Zusammenarbeit mit der Sängerin aufgrund des Russland-Krieges einstellt, fordert Netrebko 360.000 Dollar. Die Klage habe „keinen Wert“, heißt es im Statement der Met.",https://img.diepresse.com/public/incoming/6ll973-FILES-AUSTRIA-OPERA-NETREBKO/alternates/DPR_SOCIAL_NACHRICHTEN/FILES-AUSTRIA-OPERA-NETREBKO,2023-08-05T07:19:25Z,,"Da die New Yorker Metropolitan Opera die Zusammenarbeit mit der Sängerin aufgrund des Russland-Krieges einstellt, fordert Netrebko 360.000 Dollar. Die Klage habe keinen Wert, heißt es im Statement de… [+2067 chars]",,de,'Ukraine'
https://consent.google.com/ml?continue=https://news.google.com/rss/articles/CBMiQ2h0dHBzOi8vd3d3LnRhZ2Vzc2NoYXUuZGUvYXVzbGFuZC91a3JhaW5lLXRyZWZmZW4tZHNjaGlkZGEtMTAwLmh0bWzSAQA?oc%3D5&gl=FR&hl=en-US&cm=2&pc=n&src=1,https://consent.google.com/ml?continue=https://news.google.com/rss/articles/CBMiQ2h0dHBzOi8vd3d3LnRhZ2Vzc2NoYXUuZGUvYXVzbGFuZC91a3JhaW5lLXRyZWZmZW4tZHNjaGlkZGEtMTAwLmh0bWzSAQA?oc%3D5&gl=FR&hl=en-US&cm=2&pc=n&src=1,0,consent.google.com,Was Kiew vom Ukraine-Gipfel in Dschidda erwartet - tagesschau.de,"<ol><li>Was Kiew vom Ukraine-Gipfel in Dschidda erwartet  tagesschau.de
</li><li>Krieg in Osteuropa: China will an Ukraine-Gipfel in Saudi-Arabien teilnehmen  DER SPIEGEL
</li><li>UKRAINE-FRIEDENSGIPFEL IN SAUDI-ARABIEN: ""Besorgnisse in der arabischen Welt …",,2023-08-05T07:20:04Z,,"We use cookies and data to<ul><li>Deliver and maintain Google services</li><li>Track outages and protect against spam, fraud, and abuse</li><li>Measure audience engagement and site statistics to unde… [+1131 chars]",,de,'Ukraine'
https://www.handelsblatt.com/politik/international/ukraine-krieg-lage-am-morgen-ukrainische-drohne-beschaedigt-russischen-tanker/28144208.html,https://www.handelsblatt.com/politik/international/ukraine-krieg-lage-am-morgen-ukrainische-drohne-beschaedigt-russischen-tanker/28144208.html,0,www.handelsblatt.com,Ukraine-Krieg – Lage am Morgen: Russland rekrutiert neue Soldaten – EU weitet Sanktionen gegen Belarus aus,"Der Maschinenraum des Schiffes wurde beschädigt, die Besatzung soll in Sicherheit sein. Der ukrainische Präsident Selenski lobte den Angriff in einer Videoansprache.",https://www.handelsblatt.com/images/der-ukrainische-praesident-wolodimir-selenski/29301712/2-format2003.jpg,2023-08-05T07:29:38Z,,"Der ukrainische Präsident Wolodimir SelenskiSelenski lobte den Geheimdienst für den Angriff auf das Schiff.
(Foto: IMAGO/ZUMA Wire)
Kiew, Kertsch, Berlin Bei einem Angriff in der Straße von Kertsch… [+6234 chars]",,de,'Ukraine'
https://www.tagesschau.de/ausland/asien/ukraine-treffen-dschidda-100.html,https://www.tagesschau.de/ausland/asien/ukraine-treffen-dschidda-100.html,0,www.tagesschau.de,Was Kiew vom Ukraine-Gipfel in Dschidda erwartet,"Sicherheitsberater aus aller Welt sprechen in Dschidda über Schritte zum Frieden in der Ukraine. China sitzt mit am Tisch, Russland ist nicht eingeladen. Die Ukrainer nennen klare Bedingungen für Friedensgespräche. Von S. Matthay.",https://images.tagesschau.de/image/9084baab-fc94-4fa3-b2f2-e9dbe5b43e40/AAABicTIPA4/AAABibBxqrQ/16x9-1280/wolodymyr-selenskyj-142.jpg,2023-08-05T08:46:42Z,,"Stand: 05.08.2023 10:46 Uhr
Sicherheitsberater aus aller Welt sprechen in Dschidda über Schritte zum Frieden in der Ukraine. China sitzt mit am Tisch, Russland ist nicht eingeladen. Die Ukrainer nen… [+2798 chars]",,de,'Ukraine'
https://consent.google.com/ml?continue=https://news.google.com/rss/articles/CBMiSWh0dHBzOi8vd3d3LnRhZ2Vzc2NoYXUuZGUvYXVzbGFuZC9hc2llbi91a3JhaW5lLXRyZWZmZW4tZHNjaGlkZGEtMTAwLmh0bWzSAQA?oc%3D5%26hl%3Den-CA%26gl%3DCA%26ceid%3DCA:en&gl=FR&hl=en-CA&cm=2&pc=n&src=1,https://consent.google.com/ml?continue=https://news.google.com/rss/articles/CBMiSWh0dHBzOi8vd3d3LnRhZ2Vzc2NoYXUuZGUvYXVzbGFuZC9hc2llbi91a3JhaW5lLXRyZWZmZW4tZHNjaGlkZGEtMTAwLmh0bWzSAQA?oc%3D5%26hl%3Den-CA%26gl%3DCA%26ceid%3DCA:en&gl=FR&hl=en-CA&cm=2&pc=n&src=1,0,consent.google.com,Was Kiew vom Ukraine-Gipfel in Dschidda erwartet - tagesschau.de,"<ol><li>Was Kiew vom Ukraine-Gipfel in Dschidda erwartet  tagesschau.de
</li><li>Ukraine-Konferenz in Saudi-Arabien: Dem Thronfolger geht es nicht vorrangig um ein Ende des Kriegs  Tagesspiegel
</li><li>Ukraine-Krieg im Liveticker: +++ 11:33 Sicherheitsexpe…",,2023-08-05T08:47:36Z,,"We use cookies and data to<ul><li>Deliver and maintain Google services</li><li>Track outages and protect against spam, fraud, and abuse</li><li>Measure audience engagement and site statistics to unde… [+1131 chars]",,de,'Ukraine'
https://www.dw.com/de/ukraine-russland-meldet-drohnenangriff-auf-tanker/a-66446644,https://www.dw.com/de/ukraine-russland-meldet-drohnenangriff-auf-tanker/a-66446644,0,www.dw.com,Ukraine: Russland meldet Drohnenangriff auf Tanker,In der Straße von Kertsch ist ein russischer Tanker von einer ukrainischen Drohne getroffen worden. In Dschiddah sollen Wege zum Frieden ausgelotet werden. Ein Überblick.,https://static.dw.com/image/66446658_6.jpg,2023-08-05T09:04:00Z,,"Das Wichtigste in Kürze:
<ul><li>Drohnenangriff nahe der Krimbrücke</li><li>Internationale Ukraine-Friedenskonferenz in Saudi-Arabien gestartet</li><li>Britische Regierung: G7-Preisdeckel zeigt weit… [+7003 chars]",,de,'Russland'
https://www.welt.de/politik/ausland/video246753884/Livestream-Selenskyj-beklagt-Raketenterror-gegen-Ukraine.html,https://www.welt.de/politik/ausland/video246753884/Livestream-Selenskyj-beklagt-Raketenterror-gegen-Ukraine.html,0,www.welt.de,Selenskyj beklagt Raketenterror gegen Ukraine,Russland hat nach Angaben des ukrainischen Präsidenten Wolodymyr Selenskyj das Land erneut mit Raketenangriffen überzogen. Im Gebiet Charkiw im Osten der Ukraine sei ein Zentrum für Bluttransfusionen bombardiert worden. Verfolgen Sie diese und weitere Nachric…,https://img.welt.de/img/politik/ausland/mobile246761948/9181358017-ci16x9-w1200/Zelenskiy-says-Russian-bomb-hits-blood-transfusion-center.jpg,2023-08-05T09:30:29Z,,"Die WELT als ePaper: Die vollständige Ausgabe steht Ihnen bereits am Vorabend zur Verfügung so sind Sie immer hochaktuell informiert. Weitere Informationen: http://epaper.welt.de 
 Der Kurz-Link die… [+49 chars]",,de,'Ukraine'
https://www.welt.de/politik/ausland/plus246745760/Entfuehrte-ukrainische-Kinder-Manchmal-kamen-sie-zu-uns-in-die-Dusche-und-riefen-dass-die-Ukraine-fallen-werde.html,https://www.welt.de/politik/ausland/plus246745760/Entfuehrte-ukrainische-Kinder-Manchmal-kamen-sie-zu-uns-in-die-Dusche-und-riefen-dass-die-Ukraine-fallen-werde.html,0,www.welt.de,"„Manchmal kamen sie zu uns in die Dusche und riefen, dass die Ukraine fallen werde“","Mehr als 19.500 ukrainische Kinder hat Russland nach Angaben Kiews entführt. Sie leben in Lagern und werden später zur Adoption freigegeben. Nur wenige können sich retten. Unser Reporter hat ein Mädchen getroffen, das der Deportation knapp entging. Was sie be…",https://img.welt.de/img/incoming/mobile246747100/0331358427-ci16x9-w1200-fnov-fpotl-fpi157750653/Nastia-5.jpg,2023-08-05T09:37:48Z,,"Nastia wusste, dass die Russen es ernst meinen. Sie gaben mir sechs Monate Zeit, meine Mutter zu finden, sagt die 16-Jährige, ansonsten würden sie ihr das Sorgerecht entziehen und mich zur Adoption f… [+99 chars]",,de,'Russland'
https://www.welt.de/politik/ausland/plus246745760/Manchmal-kamen-sie-zu-uns-in-die-Dusche-und-riefen-dass-die-Ukraine-fallen-werde.html,https://www.welt.de/politik/ausland/plus246745760/Manchmal-kamen-sie-zu-uns-in-die-Dusche-und-riefen-dass-die-Ukraine-fallen-werde.html,0,www.welt.de,"Dass die Kinder nie zurückkommen, erfahren die Eltern erst, wenn es zu spät ist","Mehr als 19.500 ukrainische Kinder hat Russland nach Angaben Kiews entführt. Sie leben in Lagern und werden später zur Adoption freigegeben. Nur wenige können sich retten. Unser Reporter hat ein Mädchen getroffen, das der Deportation knapp entging. Was sie be…",https://img.welt.de/img/incoming/mobile246747100/0331358427-ci16x9-w1200-fnov-fpotl-fpi157750653/Nastia-5.jpg,2023-08-05T09:37:48Z,,"Nastia wusste, dass die Russen es ernst meinen. Sie gaben mir sechs Monate Zeit, meine Mutter zu finden, sagt die 16-Jährige, ansonsten würden sie ihr das Sorgerecht entziehen und mich zur Adoption f… [+99 chars]",,de,'Ukraine'
https://www.n-tv.de/politik/Russen-versuchen-beschaedigten-Oltanker-zu-sichern-article24307525.html,https://www.n-tv.de/politik/Russen-versuchen-beschaedigten-Oltanker-zu-sichern-article24307525.html,0,www.n-tv.de,Nach Angriff mit Drohnenboot: Russen versuchen beschädigten Öltanker zu sichern,"Erneut attackieren Ukrainer ein russisches Schiff und beschädigen es. Offenbar dringt Wasser in den Tanker ein, was derzeit abgepumpt werden soll. Kiew kündigt bereits an: Es wird weitere Angriffe auf russische Schiffe geben. Der Geheimdienst SBU spricht von …",https://bilder3.n-tv.de/img/incoming/crop24307582/3371322058-cImg_16_9-w1200/6cd04ebe02123646cc4aee63d8d174af.jpg,2023-08-05T09:41:31Z,,"Erneut attackieren Ukrainer ein russisches Schiff und beschädigen es. Offenbar dringt Wasser in den Tanker ein, was derzeit abgepumpt werden soll. Kiew kündigt bereits an: Es wird weitere Angriffe au… [+3910 chars]",,de,'Ukraine'
https://consent.google.com/ml?continue=https://news.google.com/rss/articles/CBMihwFodHRwczovL3d3dy53ZWx0LmRlL3BvbGl0aWsvYXVzbGFuZC9wbHVzMjQ2NzQ1NzYwL01hbmNobWFsLWthbWVuLXNpZS16dS11bnMtaW4tZGllLUR1c2NoZS11bmQtcmllZmVuLWRhc3MtZGllLVVrcmFpbmUtZmFsbGVuLXdlcmRlLmh0bWzSAQA?oc%3D5&gl=FR&hl=en-US&cm=2&pc=n&src=1,https://consent.google.com/ml?continue=https://news.google.com/rss/articles/CBMihwFodHRwczovL3d3dy53ZWx0LmRlL3BvbGl0aWsvYXVzbGFuZC9wbHVzMjQ2NzQ1NzYwL01hbmNobWFsLWthbWVuLXNpZS16dS11bnMtaW4tZGllLUR1c2NoZS11bmQtcmllZmVuLWRhc3MtZGllLVVrcmFpbmUtZmFsbGVuLXdlcmRlLmh0bWzSAQA?oc%3D5&gl=FR&hl=en-US&cm=2&pc=n&src=1,0,consent.google.com,"„Manchmal kamen sie zu uns in die Dusche und riefen, dass die Ukraine fallen werde“ - WELT","„Manchmal kamen sie zu uns in die Dusche und riefen, dass die Ukraine fallen werde“  WELT",,2023-08-05T09:55:58Z,,"We use cookies and data to<ul><li>Deliver and maintain Google services</li><li>Track outages and protect against spam, fraud, and abuse</li><li>Measure audience engagement and site statistics to unde… [+1131 chars]",,de,'Ukraine'
