index,url,valid,domain,title,description,image,published,archive,content,quote,language,keyword
https://www.zeit.de/politik/ausland/2023-07/evan-gershkovich-russland-haft-besuch-botschafter,https://www.zeit.de/politik/ausland/2023-07/evan-gershkovich-russland-haft-besuch-botschafter,0,www.zeit.de,Russland: Evan Gershkovich bekommt wieder Besuch von US-Botschafterin,Im April hatte Russland der US-Botschaft in Moskau das Besuchsrecht bei dem inhaftierten Reporter Gershkovich entzogen. Nun kam es zum zweiten Treffen seit der Festnahme.,,2023-07-03T15:50:19Z,http://archive.md/20230704214539/https://www.zeit.de/politik/ausland/2023-07/evan-gershkovich-russland-haft-besuch-botschafter,"When browsing with ads:
We collect personal data and also transmit it to third-party providers
 that help us improve and finance our digital content. Some of the information stored on your device, … [+821 chars]",,de,'Russland'
https://www.zeit.de/news/2023-07/04/explosion-in-wohnhaus-keine-verletzten,https://www.zeit.de/news/2023-07/04/explosion-in-wohnhaus-keine-verletzten,0,www.zeit.de,Bremen: Explosion in Wohnhaus: Keine Verletzten,,,2023-07-04T06:28:00Z,,"When browsing with ads:
We collect personal data and also transmit it to third-party providers
 that help us improve and finance our digital content. Some of the information stored on your device, … [+821 chars]",,de,'Explosion'
https://www.zeit.de/politik/ausland/2023-07/tschetschenien-investigativjournalistin-elena-milaschena-angriff,https://www.zeit.de/politik/ausland/2023-07/tschetschenien-investigativjournalistin-elena-milaschena-angriff,0,www.zeit.de,Russland: Journalistin Elena Milaschina in Tschetschenien zusammengeschlagen,"Während einer Recherchereise in Tschetschenien ist eine ""Nowaja-Gaseta""-Reporterin attackiert worden. Schon früher erhielt Elena Milaschina Morddrohungen.",,2023-07-04T07:30:37Z,http://archive.md/20230705021219/https://www.zeit.de/politik/ausland/2023-07/tschetschenien-investigativjournalistin-elena-milaschena-angriff,"When browsing with ads:
We collect personal data and also transmit it to third-party providers
 that help us improve and finance our digital content. Some of the information stored on your device, … [+821 chars]",,de,'Russland'
https://www.bild.de/sport/fussball/bayern-muenchen/gerrard-klub-lockt-bayern-star-zahlen-die-saudis-die-letzte-kane-kohle-84562434.bild.html,https://www.bild.de/sport/fussball/bayern-muenchen/gerrard-klub-lockt-bayern-star-zahlen-die-saudis-die-letzte-kane-kohle-84562434.bild.html,0,www.bild.de,Gerrard-Klub lockt Bayern-Star - Zahlen die Saudis die letzte Kane-Kohle?,"Bayern will Harry Kane (29), der England-Star will zu Bayern. Das Problem aber heißt Tottenham und dessen Knallhart-Präsident Daniel...Foto: ADRIAN DENNIS/AFP","https://images.bild.de/64a4025e4c6baf600df59909/9bf08b6a7ffab418533b2cb00bcf30b9,b4b1e465?w=1280",2023-07-04T11:45:43Z,,"Bayern will Harry Kane (29), der England-Star will zu Bayern. Das Problem aber heißt Tottenham und dessen Knallhart-Präsident Daniel Levy (61). Das erste 70-Mio-Angebot lehnte er sofort ab, aus Engla… [+2141 chars]",,de,'Kohle'
https://www.zeit.de/news/2023-07/04/russische-journalistin-in-tschetschenien-zusammengeschlagen,https://www.zeit.de/news/2023-07/04/russische-journalistin-in-tschetschenien-zusammengeschlagen,0,www.zeit.de,Russland: Russische Journalistin in Tschetschenien zusammengeschlagen,,,2023-07-04T11:50:56Z,,"When browsing with ads:
We collect personal data and also transmit it to third-party providers
 that help us improve and finance our digital content. Some of the information stored on your device, … [+821 chars]",,de,'Russland'
https://www.zeit.de/politik/2023-07/ukraine-ueberblick-wladimir-putin-charkiw,https://www.zeit.de/politik/2023-07/ukraine-ueberblick-wladimir-putin-charkiw,0,www.zeit.de,"Ukraine-Überblick: Putin sieht Russland ""geeint wie nie zuvor"", Drohnen über Moskau",Der russischen Luftabwehr zufolge wurden Drohnen über Moskau abgeschossen. Die Ukraine meldet einen Angriff auf Charkiw – vermutlich mit Sprengbrandmunition. Der Tag,,2023-07-04T16:47:15Z,http://archive.md/20230705021049/https://www.zeit.de/politik/2023-07/ukraine-ueberblick-wladimir-putin-charkiw,"When browsing with ads:
We collect personal data and also transmit it to third-party providers
 that help us improve and finance our digital content. Some of the information stored on your device, … [+821 chars]",,de,'Putin'
https://www.n-tv.de/politik/23-59-Scholz-und-Biden-wollen-sich-bei-Ukraine-Hilfen-eng-abstimmen--article24237810.html,https://www.n-tv.de/politik/23-59-Scholz-und-Biden-wollen-sich-bei-Ukraine-Hilfen-eng-abstimmen--article24237810.html,0,www.n-tv.de,Ukraine-Krieg im Liveticker: +++ 23:59 Scholz und Biden wollen sich bei Ukraine-Hilfen eng abstimmen +++,"Berlin, Washington, Br\u00fcssel - \u00fcberall. n-tv berichtet von allen wichtigen Schaupl\u00e4tzen der Innen- und Au\u00dfenpolitik.",https://bilder2.n-tv.de/img/incoming/crop23332537/9041326157-cImg_16_9-w1200/Liveticker1-grau-1-Kopie.jpg,2023-07-04T20:00:00Z,,"Bundeskanzler Scholz und US-Präsident Biden sichern sich eine enge Absprache bei der Unterstützung der Ukraine zu. In einem Telefonat Abend seien sich beide einig gewesen, dass ""die Unterstützung der… [+30256 chars]",,de,'Ukraine'
https://www.n-tv.de/politik/14-25-Kreml-Noch-ist-Zeit-fuer-Verlaengerung-von-Getreideabkommen--article23143824.html,https://www.n-tv.de/politik/14-25-Kreml-Noch-ist-Zeit-fuer-Verlaengerung-von-Getreideabkommen--article23143824.html,0,www.n-tv.de,Ukraine-Krieg im Liveticker: +++ 14:25 Kreml: Noch ist Zeit für Verlängerung von Getreideabkommen +++,"Berlin, Washington, Br\u00fcssel - \u00fcberall. n-tv berichtet von allen wichtigen Schaupl\u00e4tzen der Innen- und Au\u00dfenpolitik.",https://bilder2.n-tv.de/img/incoming/crop23332537/9041326157-cImg_16_9-w1200/Liveticker1-grau-1-Kopie.jpg,2023-07-04T22:15:00Z,,"Der Kreml sieht noch Zeit für die Erfüllung russischer Forderungen, um das Abkommen zur Verschiffung von ukrainischem Getreide über das Schwarze Meer doch noch verlängern zu können. ""Es ist noch Zeit… [+23522 chars]",,de,'Putin'
https://www.n-tv.de/politik/08-46-Moskau-koennte-Saporischschja-als-Druckmittel-nutzen--article23143824.html,https://www.n-tv.de/politik/08-46-Moskau-koennte-Saporischschja-als-Druckmittel-nutzen--article23143824.html,0,www.n-tv.de,"Ukraine-Krieg im Liveticker: +++ 08:46 Moskau könnte Saporischschja ""als Druckmittel"" nutzen +++","Berlin, Washington, Br\u00fcssel - \u00fcberall. n-tv berichtet von allen wichtigen Schaupl\u00e4tzen der Innen- und Au\u00dfenpolitik.",https://bilder2.n-tv.de/img/incoming/crop23332537/9041326157-cImg_16_9-w1200/Liveticker1-grau-1-Kopie.jpg,2023-07-04T22:15:00Z,,Moskau und Kiew werfen sich gegenseitig einen unmittelbar bevorstehenden Anschlag auf das AKW Saporischschja im Süden der Ukraine vor. Zudem gibt es Kritik am Chef der Internationalen Atomenergiebehö… [+13266 chars],,de,'Putin'
https://www.n-tv.de/politik/10-50-Belarussischer-Verkehrsminister-ist-im-Alter-von-47-Jahren-ploetzlich-gestorben--article23143824.html,https://www.n-tv.de/politik/10-50-Belarussischer-Verkehrsminister-ist-im-Alter-von-47-Jahren-ploetzlich-gestorben--article23143824.html,0,www.n-tv.de,Ukraine-Krieg im Liveticker: +++ 10:50 Belarussischer Verkehrsminister ist im Alter von 47 Jahren plötzlich gestorben +++,"Berlin, Washington, Br\u00fcssel - \u00fcberall. n-tv berichtet von allen wichtigen Schaupl\u00e4tzen der Innen- und Au\u00dfenpolitik.",https://bilder2.n-tv.de/img/incoming/crop23332537/9041326157-cImg_16_9-w1200/Liveticker1-grau-1-Kopie.jpg,2023-07-04T22:15:00Z,,"Der belarussische Minister für Verkehr und Kommunikation, Aleksey Avramenko, ist laut staatlicher Nachrichtenagentur Belta mit Berufung auf das Ministerium am 4. Juli plötzlich gestorben. Zur Todesur… [+17520 chars]",,de,'Putin'
https://www.n-tv.de/politik/13-43-Kreml-Bestaetigen-Bericht-ueber-Xi-Warnung-an-Putin-wegen-Atomwaffen-nicht--article23143824.html,https://www.n-tv.de/politik/13-43-Kreml-Bestaetigen-Bericht-ueber-Xi-Warnung-an-Putin-wegen-Atomwaffen-nicht--article23143824.html,0,www.n-tv.de,Ukraine-Krieg im Liveticker: +++ 13:43 Kreml: Bestätigen Bericht über Xi-Warnung an Putin wegen Atomwaffen nicht +++,"Berlin, Washington, Br\u00fcssel - \u00fcberall. n-tv berichtet von allen wichtigen Schaupl\u00e4tzen der Innen- und Au\u00dfenpolitik.",https://bilder2.n-tv.de/img/incoming/crop23332537/9041326157-cImg_16_9-w1200/Liveticker1-grau-1-Kopie.jpg,2023-07-04T22:15:00Z,,"Die ""Fiancial Times"" schreibt in einem Bericht, dass Chinas Staatschef Xi Jinping den russischen Präsidenten Wladimir Putin bei seinem Moskau-Besuch im März persönlich vor dem Einsatz von Atomwaffen … [+22357 chars]",,de,'Putin'
https://www.n-tv.de/politik/06-15-Britischer-Verteidigungsminister-Moskau-hat-fast-die-Haelfte-seiner-Kampfkraft-verloren--article23143824.html,https://www.n-tv.de/politik/06-15-Britischer-Verteidigungsminister-Moskau-hat-fast-die-Haelfte-seiner-Kampfkraft-verloren--article23143824.html,0,www.n-tv.de,Ukraine-Krieg im Liveticker: +++ 06:15 Britischer Verteidigungsminister: Moskau hat fast die Hälfte seiner Kampfkraft verloren +++,"Berlin, Washington, Br\u00fcssel - \u00fcberall. n-tv berichtet von allen wichtigen Schaupl\u00e4tzen der Innen- und Au\u00dfenpolitik.",https://bilder2.n-tv.de/img/incoming/crop23332537/9041326157-cImg_16_9-w1200/Liveticker1-grau-1-Kopie.jpg,2023-07-04T22:15:00Z,,"Während eines Treffens am 4. Juli im Parlament sagte der britische Verteidigungsminister Tony Radakin, Russland habe in der Ukraine deutlich an Kampffähigkeit eingebüßt. ""Russland hat fast die Hälfte… [+8628 chars]",,de,'Putin'
https://www.n-tv.de/politik/13-17-Heftige-Explosion-erschuettert-besetztes-Makijiwk-Moskau-spricht-von-einem-Toten--article23143824.html,https://www.n-tv.de/politik/13-17-Heftige-Explosion-erschuettert-besetztes-Makijiwk-Moskau-spricht-von-einem-Toten--article23143824.html,0,www.n-tv.de,Ukraine-Krieg im Liveticker: +++ 13:17 Heftige Explosion erschüttert besetztes Makijiwk - Moskau spricht von einem Toten +++,"Berlin, Washington, Br\u00fcssel - \u00fcberall. n-tv berichtet von allen wichtigen Schaupl\u00e4tzen der Innen- und Au\u00dfenpolitik.",https://bilder2.n-tv.de/img/incoming/crop23332537/9041326157-cImg_16_9-w1200/Liveticker1-grau-1-Kopie.jpg,2023-07-04T22:15:00Z,,"Die Ukraine hat laut eigenen Angaben eine ""Formation russischer Streitkräfte"" im russisch besetzten Makijiwka zerstört. Ein Drohnen-Video zeigt eine minutenlange Explosion in der Stadt. Nach russisch… [+21447 chars]",,de,'Ukraine'
https://www.n-tv.de/politik/17-10-Gericht-schickt-Sohn-von-belarussischem-Oppositionellen-Babariko-ins-Straflager--article23143824.html,https://www.n-tv.de/politik/17-10-Gericht-schickt-Sohn-von-belarussischem-Oppositionellen-Babariko-ins-Straflager--article23143824.html,0,www.n-tv.de,Ukraine-Krieg im Liveticker: +++ 17:10 Gericht schickt Sohn von belarussischem Oppositionellen Babariko ins Straflager +++,"Berlin, Washington, Br\u00fcssel - \u00fcberall. n-tv berichtet von allen wichtigen Schaupl\u00e4tzen der Innen- und Au\u00dfenpolitik.",https://bilder2.n-tv.de/img/incoming/crop23332537/9041326157-cImg_16_9-w1200/Liveticker1-grau-1-Kopie.jpg,2023-07-04T22:15:00Z,https://web.archive.org/web/20230706054854/https://www.n-tv.de/politik/17-10-Gericht-schickt-Sohn-von-belarussischem-Oppositionellen-Babariko-ins-Straflager--article23143824.html,Zwei Jahre nach der Verurteilung des belarussischen Oppositionspolitikers Viktor Babariko zu langer Lagerhaft hat ein Gericht in Minsk auch gegen dessen Sohn eine hohe Strafe verhängt. Eduard Babarik… [+28739 chars],,de,'Putin'
https://www.n-tv.de/politik/10-18-Bericht-Russland-will-Tschetschenen-und-Straeflinge-verpflichten-um-kompletter-Mobilisierung-zu-entgehen--article23143824.html,https://www.n-tv.de/politik/10-18-Bericht-Russland-will-Tschetschenen-und-Straeflinge-verpflichten-um-kompletter-Mobilisierung-zu-entgehen--article23143824.html,0,www.n-tv.de,"Ukraine-Krieg im Liveticker: +++ 10:18 Bericht: Russland will Tschetschenen und Sträflinge verpflichten, um kompletter Mobilisierung zu entgehen +++","Berlin, Washington, Br\u00fcssel - \u00fcberall. n-tv berichtet von allen wichtigen Schaupl\u00e4tzen der Innen- und Au\u00dfenpolitik.",https://bilder2.n-tv.de/img/incoming/crop23332537/9041326157-cImg_16_9-w1200/Liveticker1-grau-1-Kopie.jpg,2023-07-04T22:15:00Z,,"Russland plant, mehr tschetschenische Kämpfer und Sträflinge an die Front zu schicken, um einer vollständigen Mobilisierung zu entgehen. Das geht aus einem Bericht von ""Bloomberg"" hervor, die sich au… [+16518 chars]",,de,'Russland'
https://www.n-tv.de/politik/05-54-Putin-Russische-Wirtschaft-entwickelt-sich-besser-als-erwartet--article23143824.html,https://www.n-tv.de/politik/05-54-Putin-Russische-Wirtschaft-entwickelt-sich-besser-als-erwartet--article23143824.html,0,www.n-tv.de,Ukraine-Krieg im Liveticker: +++ 05:54 Putin: Russische Wirtschaft entwickelt sich besser als erwartet +++,"Berlin, Washington, Br\u00fcssel - \u00fcberall. n-tv berichtet von allen wichtigen Schaupl\u00e4tzen der Innen- und Au\u00dfenpolitik.",https://bilder2.n-tv.de/img/incoming/crop23332537/9041326157-cImg_16_9-w1200/Liveticker1-grau-1-Kopie.jpg,2023-07-04T22:15:00Z,,Die russische Wirtschaft entwickelt sich besser als erwartet. Dies teilt Präsident Wladimir Putin auf der Internetseite des russischen Präsidialamtes mit. Der Bericht von Ministerpräsident Mischustin… [+7781 chars],,de,'Putin'
https://www.n-tv.de/politik/11-59-IAEA-Chef-absolut-unwirksam-Kiew-aeussert-scharfe-Kritik--article23143824.html,https://www.n-tv.de/politik/11-59-IAEA-Chef-absolut-unwirksam-Kiew-aeussert-scharfe-Kritik--article23143824.html,0,www.n-tv.de,"Ukraine-Krieg im Liveticker: +++ 11:59 ""IAEA-Chef absolut unwirksam"" - Kiew äußert scharfe Kritik +++","Berlin, Washington, Br\u00fcssel - \u00fcberall. n-tv berichtet von allen wichtigen Schaupl\u00e4tzen der Innen- und Au\u00dfenpolitik.",https://bilder2.n-tv.de/img/incoming/crop23332537/9041326157-cImg_16_9-w1200/Liveticker1-grau-1-Kopie.jpg,2023-07-04T22:15:00Z,,Die Ukraine hat die Internationale Atomenergiebehörde (IAEA) wegen ihres Umgangs mit dem russisch besetzten Atomkraftwerk Saporischschja kritisiert. Mit Blick auf IAEA-Chef Rafael Grossi sagte der Be… [+19504 chars],,de,'Ukraine'
https://www.n-tv.de/politik/14-45-Putin-ruft-mit-Achtjaehriger-bei-Kreml-Politikern-an--article23143824.html,https://www.n-tv.de/politik/14-45-Putin-ruft-mit-Achtjaehriger-bei-Kreml-Politikern-an--article23143824.html,0,www.n-tv.de,Ukraine-Krieg im Liveticker: +++ 14:45 Putin ruft mit Achtjähriger bei Kreml-Politikern an +++,"Berlin, Washington, Br\u00fcssel - \u00fcberall. n-tv berichtet von allen wichtigen Schaupl\u00e4tzen der Innen- und Au\u00dfenpolitik.",https://bilder2.n-tv.de/img/incoming/crop23332537/9041326157-cImg_16_9-w1200/Liveticker1-grau-1-Kopie.jpg,2023-07-04T22:15:00Z,https://web.archive.org/web/20230706204628/https://www.n-tv.de/politik/14-45-Putin-ruft-mit-Achtjaehriger-bei-Kreml-Politikern-an--article23143824.html,"Seit der Wagner-Revolte zeigt sich Wladimir Putin verstärkt in den Medien, lässt sich dabei vor allem sehr volksnah mit seinen Unterstützern abbilden. Jetzt empfängt Russlands Präsident ein achtjähri… [+23868 chars]",,de,'Ukraine'
https://www.n-tv.de/politik/16-13-Ausschuesse-bewilligen-Kauf-von-60-Chinook-Helikoptern--article23143824.html,https://www.n-tv.de/politik/16-13-Ausschuesse-bewilligen-Kauf-von-60-Chinook-Helikoptern--article23143824.html,0,www.n-tv.de,Ukraine-Krieg im Liveticker: +++ 16:13 Ausschüsse bewilligen Kauf von 60 Chinook-Helikoptern +++,"Berlin, Washington, Br\u00fcssel - \u00fcberall. n-tv berichtet von allen wichtigen Schaupl\u00e4tzen der Innen- und Au\u00dfenpolitik.",https://bilder2.n-tv.de/img/incoming/crop23332537/9041326157-cImg_16_9-w1200/Liveticker1-grau-1-Kopie.jpg,2023-07-04T22:15:00Z,https://web.archive.org/web/20230706054709/https://www.n-tv.de/politik/16-13-Ausschuesse-bewilligen-Kauf-von-60-Chinook-Helikoptern--article23143824.html,Der Verteidigungs- und der Haushaltsausschuss des Bundestages geben grünes Licht für den milliardenschweren Kauf von 60 schweren Transporthubschraubern für die Bundeswehr. Eine Mehrheit der Fachpolit… [+27153 chars],,de,'Putin'
https://www.n-tv.de/politik/07-20-Militaerverwaltung-Russland-beschiesst-Oblast-Sumy-268-Mal--article23143824.html,https://www.n-tv.de/politik/07-20-Militaerverwaltung-Russland-beschiesst-Oblast-Sumy-268-Mal--article23143824.html,0,www.n-tv.de,Ukraine-Krieg im Liveticker: +++ 07:20 Militärverwaltung: Russland beschießt Oblast Sumy 268 Mal +++,"Berlin, Washington, Br\u00fcssel - \u00fcberall. n-tv berichtet von allen wichtigen Schaupl\u00e4tzen der Innen- und Au\u00dfenpolitik.",https://bilder2.n-tv.de/img/incoming/crop23332537/9041326157-cImg_16_9-w1200/Liveticker1-grau-1-Kopie.jpg,2023-07-04T22:15:00Z,,"Am 4. Juli haben russische Streitkräfte zehn Gemeinden im Oblast Sumy 268 Mal beschossen. Das berichtet die Militärverwaltung auf Facebook. Die Grenzgemeinden Bilopillja, Myropillja, Welyka Pyssariwk… [+11274 chars]",,de,'Ukraine'
https://www.n-tv.de/politik/15-05-Masala-Russland-koennte-mit-Sprengung-an-AKW-Chaos-stiften--article23143824.html,https://www.n-tv.de/politik/15-05-Masala-Russland-koennte-mit-Sprengung-an-AKW-Chaos-stiften--article23143824.html,0,www.n-tv.de,"Ukraine-Krieg im Liveticker: +++ 15:05 Masala: Russland könnte mit Sprengung an AKW ""Chaos stiften"" +++","Berlin, Washington, Br\u00fcssel - \u00fcberall. n-tv berichtet von allen wichtigen Schaupl\u00e4tzen der Innen- und Au\u00dfenpolitik.",https://bilder2.n-tv.de/img/incoming/crop23332537/9041326157-cImg_16_9-w1200/Liveticker1-grau-1-Kopie.jpg,2023-07-04T22:15:00Z,,"Die Ukraine hat einem deutschen Experten zufolge nicht die militärischen Fähigkeiten, das russisch besetzte Atomkraftwerk Saporischschja von außen zu sprengen. Angesichts gegenseitiger Anschuldigunge… [+24763 chars]",,de,'Russland'
https://www.n-tv.de/politik/15-34-Deutschland-lehnt-Bundeswehr-Stationierung-in-Rumaenien-ab--article23143824.html,https://www.n-tv.de/politik/15-34-Deutschland-lehnt-Bundeswehr-Stationierung-in-Rumaenien-ab--article23143824.html,0,www.n-tv.de,Ukraine-Krieg im Liveticker: +++ 15:34 Deutschland lehnt Bundeswehr-Stationierung in Rumänien ab +++,"Berlin, Washington, Br\u00fcssel - \u00fcberall. n-tv berichtet von allen wichtigen Schaupl\u00e4tzen der Innen- und Au\u00dfenpolitik.",https://bilder2.n-tv.de/img/incoming/crop23332537/9041326157-cImg_16_9-w1200/Liveticker1-grau-1-Kopie.jpg,2023-07-04T22:15:00Z,https://web.archive.org/web/20230706054531/https://www.n-tv.de/politik/15-34-Deutschland-lehnt-Bundeswehr-Stationierung-in-Rumaenien-ab--article23143824.html,"Die Bundesregierung plant keine Stationierung deutscher Soldaten in Rumänien. Deutschland sehe sich ""nicht verpflichtet"", eine feste Brigade in das Land zu entsenden, sagt ein Sprecher des Verteidigu… [+25475 chars]",,de,'Ukraine'
https://www.n-tv.de/politik/16-38-Russischer-und-ungarischer-Minister-loben-Ausweitung-des-Handels-zwischen-beiden-Laendern--article23143824.html,https://www.n-tv.de/politik/16-38-Russischer-und-ungarischer-Minister-loben-Ausweitung-des-Handels-zwischen-beiden-Laendern--article23143824.html,0,www.n-tv.de,Ukraine-Krieg im Liveticker: +++ 16:38 Russischer und ungarischer Minister loben Ausweitung des Handels zwischen beiden Ländern +++,"Berlin, Washington, Br\u00fcssel - \u00fcberall. n-tv berichtet von allen wichtigen Schaupl\u00e4tzen der Innen- und Au\u00dfenpolitik.",https://bilder2.n-tv.de/img/incoming/crop23332537/9041326157-cImg_16_9-w1200/Liveticker1-grau-1-Kopie.jpg,2023-07-04T22:15:00Z,https://web.archive.org/web/20230706054813/https://www.n-tv.de/politik/16-38-Russischer-und-ungarischer-Minister-loben-Ausweitung-des-Handels-zwischen-beiden-Laendern--article23143824.html,"Der ungarische Außenminister Peter Szijjarto hat den russischen Gesundheitsminister Michail Muraschko zu einem Treffen in seinem Budapester Ministerium empfangen. ""Die Sanktionspolitik begrenzt ganz … [+27952 chars]",,de,'Putin'
https://www.n-tv.de/politik/12-29-Prorussischer-Journalist-behauptet-Moskauer-Truppen-haetten-Bachmut-nahes-Dorf-verlassen--article23143824.html,https://www.n-tv.de/politik/12-29-Prorussischer-Journalist-behauptet-Moskauer-Truppen-haetten-Bachmut-nahes-Dorf-verlassen--article23143824.html,0,www.n-tv.de,"Ukraine-Krieg im Liveticker: +++ 12:29 Prorussischer Journalist behauptet, Moskauer-Truppen hätten Bachmut nahes Dorf verlassen +++","Berlin, Washington, Br\u00fcssel - \u00fcberall. n-tv berichtet von allen wichtigen Schaupl\u00e4tzen der Innen- und Au\u00dfenpolitik.",https://bilder2.n-tv.de/img/incoming/crop23332537/9041326157-cImg_16_9-w1200/Liveticker1-grau-1-Kopie.jpg,2023-07-04T22:15:00Z,https://web.archive.org/web/20230705103641/https://www.n-tv.de/politik/12-29-Prorussischer-Journalist-behauptet-Moskauer-Truppen-haetten-Bachmut-nahes-Dorf-verlassen--article23143824.html,"Der prorussische Kriegsberichterstatter Aleksandr Sladkow behauptet auf Telegram, dass die russischen Truppen aus einem Dorf ganz in der Nähe von Bachmut abgezogen sind. Sladkow, der auch als Sprachr… [+20235 chars]",,de,'Ukraine'
https://www.n-tv.de/politik/09-10-London-Strafe-gegen-russischen-General-Surowikin-waere-riskant--article23143824.html,https://www.n-tv.de/politik/09-10-London-Strafe-gegen-russischen-General-Surowikin-waere-riskant--article23143824.html,0,www.n-tv.de,Ukraine-Krieg im Liveticker: +++ 09:10 London: Strafe gegen russischen General Surowikin wäre riskant +++,"Berlin, Washington, Br\u00fcssel - \u00fcberall. n-tv berichtet von allen wichtigen Schaupl\u00e4tzen der Innen- und Au\u00dfenpolitik.",https://bilder2.n-tv.de/img/incoming/crop23332537/9041326157-cImg_16_9-w1200/Liveticker1-grau-1-Kopie.jpg,2023-07-04T22:15:00Z,,"Eine Bestrafung des prominenten russischen Generals Sergej Surowikin wegen seiner Verwicklung in die Meuterei der Privatarmee Wagner wäre nach britischer Ansicht für die russische Führung riskant. ""O… [+14328 chars]",,de,'Putin'
https://www.n-tv.de/politik/12-29-Prorussischer-Journalist-behauptet-Moskaus-Truppen-haetten-Dorf-nahe-Bachmut-verlassen--article23143824.html,https://www.n-tv.de/politik/12-29-Prorussischer-Journalist-behauptet-Moskaus-Truppen-haetten-Dorf-nahe-Bachmut-verlassen--article23143824.html,0,www.n-tv.de,"Ukraine-Krieg im Liveticker: +++ 12:29 Prorussischer Journalist behauptet, Moskaus Truppen hätten Dorf nahe Bachmut verlassen +++","Berlin, Washington, Br\u00fcssel - \u00fcberall. n-tv berichtet von allen wichtigen Schaupl\u00e4tzen der Innen- und Au\u00dfenpolitik.",https://bilder2.n-tv.de/img/incoming/crop23332537/9041326157-cImg_16_9-w1200/Liveticker1-grau-1-Kopie.jpg,2023-07-04T22:15:00Z,https://web.archive.org/web/20230705104138/https://www.n-tv.de/politik/12-29-Prorussischer-Journalist-behauptet-Moskaus-Truppen-haetten-Dorf-nahe-Bachmut-verlassen--article23143824.html,"Der prorussische Kriegsberichterstatter Aleksandr Sladkow behauptet auf Telegram, dass die russischen Truppen aus einem Dorf ganz in der Nähe von Bachmut abgezogen sind. Sladkow, der auch als Sprachr… [+20235 chars]",,de,'Ukraine'
https://www.n-tv.de/politik/15-55-Tschetschenische-Journalistin-Milaschina-nach-Attacke-in-schwierigem-Zustand--article23143824.html,https://www.n-tv.de/politik/15-55-Tschetschenische-Journalistin-Milaschina-nach-Attacke-in-schwierigem-Zustand--article23143824.html,0,www.n-tv.de,"Ukraine-Krieg im Liveticker: +++ 15:55 Tschetschenische Journalistin Milaschina nach Attacke in ""schwierigem Zustand"" +++","Berlin, Washington, Br\u00fcssel - \u00fcberall. n-tv berichtet von allen wichtigen Schaupl\u00e4tzen der Innen- und Au\u00dfenpolitik.",https://bilder2.n-tv.de/img/incoming/crop23332537/9041326157-cImg_16_9-w1200/Liveticker1-grau-1-Kopie.jpg,2023-07-04T22:15:00Z,https://web.archive.org/web/20230706054436/https://www.n-tv.de/politik/15-55-Tschetschenische-Journalistin-Milaschina-nach-Attacke-in-schwierigem-Zustand--article23143824.html,"Nach dem Angriff auf die russische ""Nowaja Gaseta""-Journalistin Elena Milaschina in Tschetschenien ist ihr Zustand weiterhin besorgniserregend. ""Ihr Zustand ist, offen gesagt, schwierig"", sagt ""Nowaj… [+26357 chars]",,de,'Ukraine'
https://www.n-tv.de/politik/14-01-Munz-AKW-Sprengung-wuerde-fuer-keine-Seite-Sinn-machen--article23143824.html,https://www.n-tv.de/politik/14-01-Munz-AKW-Sprengung-wuerde-fuer-keine-Seite-Sinn-machen--article23143824.html,0,www.n-tv.de,"Ukraine-Krieg im Liveticker: +++ 14:01 Munz: ""AKW-Sprengung würde für keine Seite Sinn machen"" +++","Berlin, Washington, Br\u00fcssel - \u00fcberall. n-tv berichtet von allen wichtigen Schaupl\u00e4tzen der Innen- und Au\u00dfenpolitik.",https://bilder2.n-tv.de/img/incoming/crop23332537/9041326157-cImg_16_9-w1200/Liveticker1-grau-1-Kopie.jpg,2023-07-04T22:15:00Z,,"Selenskyj warnt, Russland bereite einen Anschlag auf das AKW Saporischschja vor. Eine Explosion an einem der Reaktoren würde eine Katastrophe ungeahnten Ausmaßes nach sich ziehen. ntv-Korrespondent R… [+22748 chars]",,de,'Ukraine'
