index,url,valid,domain,title,description,image,published,archive,content,quote,language,keyword
https://www.stern.de/politik/ausland/wiederaufbaufonds-vereinbart--usa-und-ukraine-schliessen-rohstoffabkommen-35683914.html,https://www.stern.de/politik/ausland/wiederaufbaufonds-vereinbart--usa-und-ukraine-schliessen-rohstoffabkommen-35683914.html,0,www.stern.de,Wiederaufbaufonds vereinbart: USA und Ukraine schließen Rohstoffabkommen,Präsident Donald Trump will den USA Zugriff auf ukrainische Bodenschätze sichern. Wochenlang wurde um ein Abkommen gerungen. Ein erster Versuch scheiterte - jetzt steht der Deal.,https://image.stern.de/35683930/t/5E/v1/w1440/r1.7778/-/01--pxkz2mvrygv7axs2048jpeg---26691703dd094e09.jpg,2025-05-01T00:54:10Z,,"Kopiere den aktuellen Link
Zur Merkliste hinzufügen
Präsident Donald Trump will den USA Zugriff auf ukrainische Bodenschätze sichern. Wochenlang wurde um ein Abkommen gerungen. Ein erster Versuch s… [+5112 chars]",,de,'Ukraine'
https://www.nzz.ch/international/zwei-monate-nach-dem-eklat-im-weissen-haus-ukraine-und-die-usa-unterzeichnen-ein-rohstoffabkommen-ld.1882356,https://www.nzz.ch/international/zwei-monate-nach-dem-eklat-im-weissen-haus-ukraine-und-die-usa-unterzeichnen-ein-rohstoffabkommen-ld.1882356,0,www.nzz.ch,Zwei Monate nach dem Eklat im Weissen Haus: Ukraine und die USA unterzeichnen ein Rohstoffabkommen,"In Washington haben sich der amerikanische Finanzminister Scott Bessent und die ukrainische Wirtschaftsministerin Julia Swiridenko auf die Gründung eines Wiederaufbaufonds zwischen den beiden Staaten verständigt. Kiew scheint es dabei gelungen zu sein, ein vo…","https://img.nzz.ch/2025/05/01/337a9c44-08fb-49b4-b6f4-915aaec21c5e.jpeg?width=1200&height=675&fit=bounds&quality=75&auto=webp&crop=8192,4608,x0,y428&wmark=nzz",2025-05-01T00:56:42Z,https://web.archive.org/web/20250501061036/https://www.nzz.ch/international/zwei-monate-nach-dem-eklat-im-weissen-haus-ukraine-und-die-usa-unterzeichnen-ein-rohstoffabkommen-ld.1882356,"Demonstranten fordern im Februar 2025 vor dem Weissen Haus in Washington mehr Unterstützung für die Ukraine.
Die USA und die Ukraine haben am Mittwoch, mit zwei Monaten Verspätung, ein Rohstoffabkom… [+4695 chars]",,de,'Ukraine'
https://www.freitag.de/autoren/gerd-meissner/in-moskau-regt-sich-unbehagen-ueber-den-guten-polizisten-donald-trump,https://www.freitag.de/autoren/gerd-meissner/in-moskau-regt-sich-unbehagen-ueber-den-guten-polizisten-donald-trump,0,www.freitag.de,In Moskau regt sich Unbehagen über den „guten Polizisten“ Donald Trump,"Was bisher zwischen US-Unterhändler Steve Witkoff und der russischen Regierung ausgehandelt wurde, um den Ukraine-Krieg zu beenden, stößt in Moskau auf Zustimmung, aber auch auf Unbehagen und auffallend skeptische Urteile Man könnte meinen, dass Außenminister…",https://www.freitag.de/autoren/gerd-meissner/in-moskau-regt-sich-unbehagen-ueber-den-guten-polizisten-donald-trump/@@images/image/great,2025-05-01T02:00:00Z,http://archive.md/20250501050519/https://www.freitag.de/autoren/gerd-meissner/in-moskau-regt-sich-unbehagen-ueber-den-guten-polizisten-donald-trump,"Man könnte meinen, dass Außenminister Sergej Lawrow den Ton vorgibt. In einem Interview mit dem US-Kanal CBS schien er alles in allem zufrieden mit dem, was bisher mit den USA ausgehandelt wurde. Es … [+535 chars]",,de,'Ukraine'
https://www.freitag.de/autoren/lutz-herden/wenn-die-wuerfel-fallen,https://www.freitag.de/autoren/lutz-herden/wenn-die-wuerfel-fallen,0,www.freitag.de,Ukraine | Wenn die Würfel fallen,"Russland und die USA sind sich in vielen Punkten einig. Jedoch müssen Kiew und Moskau ebenfalls verhandeln Bei Friedensverträgen gibt es häufig Sieger und Verlierer, Überlegene und Unterlegene, Konzessionen und Kompromisse, nie aber einen solchen Interessenau…",https://www.freitag.de/autoren/lutz-herden/wenn-die-wuerfel-fallen/@@images/image/great,2025-05-01T02:00:00Z,https://web.archive.org/web/20250429171830/https://www.freitag.de/autoren/lutz-herden/wenn-die-wuerfel-fallen,"Russland und die USA sind sich in vielen Punkten einig. Jedoch müssen Kiew und Moskau ebenfalls verhandeln
Das war Rom. Donald Trump gönnte Wolodymyr Selenskyj 15 Minuten
 Foto: Imago Images
Bei F… [+5504 chars]",,de,'Ukraine'
https://www.zeit.de/news/2025-05/01/mehrheit-befuerwortet-kuerzungen-fuer-neue-ukraine-fluechtlinge,https://www.zeit.de/news/2025-05/01/mehrheit-befuerwortet-kuerzungen-fuer-neue-ukraine-fluechtlinge,0,www.zeit.de,Kein Bürgergeld mehr: Mehrheit befürwortet Kürzungen für neue Ukraine-Flüchtlinge,Hier finden Sie Informationen zu dem Thema „Kein Bürgergeld mehr“. Lesen Sie jetzt „Mehrheit befürwortet Kürzungen für neue Ukraine-Flüchtlinge“.,https://img.zeit.de/news/2025-05/01/mehrheit-befuerwortet-kuerzungen-fuer-neue-ukraine-fluechtlinge-image-group/wide__1300x731,2025-05-01T03:00:44Z,https://web.archive.org/web/20250502013042/https://www.zeit.de/news/2025-05/01/mehrheit-befuerwortet-kuerzungen-fuer-neue-ukraine-fluechtlinge,Die geplante Reduzierung staatlicher Leistungen für Neuankömmlinge aus der Ukraine findet in der Bevölkerung großen Anklang. Das hat eine repräsentative Umfrage des Meinungsforschungsinstituts YouGov… [+2480 chars],,de,'Ukraine'
https://www.faz.net/aktuell/politik/ukraine/usa-und-ukraine-einigen-sich-auf-rohstoffabkommen-110449234.html,https://www.faz.net/aktuell/politik/ukraine/usa-und-ukraine-einigen-sich-auf-rohstoffabkommen-110449234.html,0,www.faz.net,Rohstoffdeal USA-Ukraine: Erfolg nach dem Eklat,Die Einigung auf ein Rohstoffabkommen zwischen den USA und der Ukraine kommt zwei Monate später als geplant. Washington nutzt das Abkommen für ein Signal an Moskau. Kiew hebt die „gleichberechtige Zusammenarbeit“ hervor.,https://media0.faz.net/ppmedia/aktuell/feuilleton/336104605/1.10449240/facebook_teaser/der-ukrainische-praesident.jpg,2025-05-01T03:33:53Z,http://archive.md/20250501042407/https://www.faz.net/aktuell/politik/ukraine/usa-und-ukraine-einigen-sich-auf-rohstoffabkommen-110449234.html,"Die Mitteilung kam zwei Monate und viele Unstimmigkeiten später als geplant. Am Mittwochabend gab der amerikanische Finanzminister Scott Bessent schließlich bekannt, Washington und Kiew hätten sich a… [+4837 chars]",,de,'Ukraine'
https://www.faz.net/aktuell/wirtschaft/mehr-wirtschaft/birmingham-der-muell-und-die-gleichberechtigung-110438276.html,https://www.faz.net/aktuell/wirtschaft/mehr-wirtschaft/birmingham-der-muell-und-die-gleichberechtigung-110438276.html,0,www.faz.net,Warum Birmingham im Müll versinkt,In Großbritanniens zweitgrößter Stadt streikt seit Wochen die Müllabfuhr. Das hat auch mit hohen Kosten für mehr Gleichberechtigung zu tun.,https://media0.faz.net/ppmedia/aktuell/wirtschaft/3732592896/1.10441628/facebook_teaser_fplus/seit-sechs-wochen-wird-in.jpg,2025-05-01T09:52:40Z,https://web.archive.org/web/20250501101204/https://www.faz.net/aktuell/wirtschaft/mehr-wirtschaft/birmingham-der-muell-und-die-gleichberechtigung-110438276.html,"Teile von Birmingham, der zweitgrößten Stadt Großbritanniens, versinken in stinkenden Abfallbergen. Schwarze Müllsäcke stapeln sich an den Straßenrändern, vor allem in den ärmeren Vierteln. Zwischen … [+442 chars]",,de,'Kosten'
https://www.zeit.de/politik/ausland/2025-05/ukraine-usa-ressourcen-abkommen-krieg-russland,https://www.zeit.de/politik/ausland/2025-05/ukraine-usa-ressourcen-abkommen-krieg-russland,0,www.zeit.de,Ukraine und USA: Dieser Deal setzt Putin unter Zugzwang,Beim Rohstoffabkommen zwischen der Ukraine und den USA geht es nur vordergründig um Wirtschaft. Die politischen und militärischen Folgen dürften weitaus wichtiger sein.,https://img.zeit.de/politik/ausland/2025-05/ukraine-usa-ressourcen-abkommen-krieg-russland-bild/wide__1300x731,2025-05-01T10:32:45Z,http://archive.md/20250501103401/https://www.zeit.de/politik/ausland/2025-05/ukraine-usa-ressourcen-abkommen-krieg-russland,"Schließen
Artikelzusammenfassung
Nach 100 Tagen im Amt konnte Donald Trump einen symbolischen Sieg verbuchen, als er mit dem ukrainischen Präsidenten Selenskyj ein Ressourcenabkommen unterzeichnete… [+643 chars]",,de,'Putin'
https://www.zeit.de/news/2025-05/01/verletzte-bei-explosion-in-timmendorfer-strand,https://www.zeit.de/news/2025-05/01/verletzte-bei-explosion-in-timmendorfer-strand,0,www.zeit.de,Unfall: Verletzte bei Explosion in Timmendorfer Strand,Hier finden Sie Informationen zu dem Thema „Unfall“. Lesen Sie jetzt „Verletzte bei Explosion in Timmendorfer Strand“.,https://img.zeit.de/news/2025-05/01/verletzte-bei-explosion-in-timmendorfer-strand-image-group/wide__1300x731,2025-05-01T13:07:09Z,https://web.archive.org/web/20250502014353/https://www.zeit.de/news/2025-05/01/verletzte-bei-explosion-in-timmendorfer-strand,"Bei einer Explosion im Niendorfer Hafen von Timmendorfer Strand an der Ostsee sind mehrere Menschen verletzt worden. Jedoch sei niemand davon schwer verletzt worden, sagte ein Polizeisprecher der Deu… [+301 chars]",,de,'Explosion'
https://www.welt.de/regionales/hamburg/article256048744/Luebecker-Bucht-Verletzte-nach-Explosion-in-Timmendorfer-Strand.html,https://www.welt.de/regionales/hamburg/article256048744/Luebecker-Bucht-Verletzte-nach-Explosion-in-Timmendorfer-Strand.html,0,www.welt.de,Verletzte nach Explosion in Timmendorfer Strand,"Aus bislang ungeklärter Ursache ist im Niendorfer Hafen von Timmendorfer Strand eine Gasflasche explodiert. Mehrere Menschen wurden verletzt, Der Hafen war zum Zeitpunkt der Explosion mit vielen Menschen bevölkert.",https://img.welt.de/img/regionales/hamburg/mobile256048742/4457939807-ci16x9-w1200/Niendorfer-Hafen-Timmendorfer-Strand-Schleswig-Holstein-Deutschland.jpg,2025-05-01T16:55:53Z,https://web.archive.org/web/20250501174104/https://www.welt.de/regionales/hamburg/article256048744/Luebecker-Bucht-Verletzte-nach-Explosion-in-Timmendorfer-Strand.html,"Bei einer Explosion im Niendorfer Hafen von Timmendorfer Strand an der Ostsee sind mehrere Menschen verletzt worden. Jedoch sei niemand davon schwer verletzt worden, sagte ein Polizeisprecher. 
Insg… [+1503 chars]",,de,'Explosion'
https://www.zeit.de/news/2025-05/01/ostsee-ort-timmendorfer-strand-knalltraumata-nach-explosion,https://www.zeit.de/news/2025-05/01/ostsee-ort-timmendorfer-strand-knalltraumata-nach-explosion,0,www.zeit.de,Notfall: Ostsee-Ort Timmendorfer Strand: Knalltraumata nach Explosion,Hier finden Sie Informationen zu dem Thema „Notfall“. Lesen Sie jetzt „Ostsee-Ort Timmendorfer Strand: Knalltraumata nach Explosion“.,https://img.zeit.de/news/2025-05/01/ostsee-ort-timmendorfer-strand-knalltraumata-nach-explosion-image-group/wide__1300x731,2025-05-01T17:59:33Z,https://web.archive.org/web/20250502051050/https://www.zeit.de/news/2025-05/01/ostsee-ort-timmendorfer-strand-knalltraumata-nach-explosion,Bei einer Explosion in der Gemeinde Timmendorfer Strand an der Ostsee in Schleswig-Holstein sind mehrere Menschen verletzt worden. Nach derzeitigem Sachstand explodierte eine auf dem Gelände des Nien… [+1844 chars],,de,'Explosion'
https://www.tagesschau.de/wirtschaft/verbraucher/gasspeicher-erdgas-energiebranche-100.html,https://www.tagesschau.de/wirtschaft/verbraucher/gasspeicher-erdgas-energiebranche-100.html,0,www.tagesschau.de,"Erdgas: Teures Gas, leere Speicher","Die Gasspeicher sind so leer wie selten. Staatliche Auflagen schreiben vor, dass die Speicher im Sommer wieder befüllt werden. Doch ausgerechnet dann ist Erdgas inzwischen besonders teuer. Von Ingo Nathusius.",https://images.tagesschau.de/image/02090288-7cb9-4290-a09a-9527fec758c6/AAABld-Y7YQ/AAABkZLhkrw/16x9-1280/gas-172.jpg,2025-05-02T07:13:45Z,https://web.archive.org/web/20250502074140/https://www.tagesschau.de/wirtschaft/verbraucher/gasspeicher-erdgas-energiebranche-100.html,"Stand: 02.05.2025 09:13 Uhr
Die Gasspeicher sind so leer wie selten. Staatliche Auflagen schreiben vor, dass die Speicher im Sommer wieder befüllt werden. Doch ausgerechnet dann ist Erdgas inzwische… [+5058 chars]",,de,'Knappheit'
https://www.faz.net/aktuell/finanzen/inflation-im-euroraum-verharrt-bei-2-2-prozent-110450527.html,https://www.faz.net/aktuell/finanzen/inflation-im-euroraum-verharrt-bei-2-2-prozent-110450527.html,0,www.faz.net,"Inflation im Euroraum verharrt bei 2,2 Prozent",Je nach Euroland fällt die Teuerung etwas unterschiedlich aus. In Frankreich ist sie deutlich niedriger als in Deutschland. Was heißt die Entwicklung für die weitere Zinspolitik der EZB?,https://media0.faz.net/ppmedia/aktuell/finanzen/4139731226/1.10450528/facebook_teaser/ezb.jpg,2025-05-02T09:02:12Z,https://web.archive.org/web/20250503024222/https://www.faz.net/aktuell/finanzen/inflation-im-euroraum-verharrt-bei-2-2-prozent-110450527.html,"Die Inflation im Euroraum lag im April wie im März bei 2,2 Prozent. Das hat das europäische Statistikamt Eurostat in Luxemburg am Freitag aufgrund einer ersten Schätzung mitgeteilt.
Insbesondere die… [+4640 chars]",,de,'Teuer'
https://www.zeit.de/news/2025-05/02/inflationsrate-in-der-eurozone-verharrt-bei-2-2-prozent,https://www.zeit.de/news/2025-05/02/inflationsrate-in-der-eurozone-verharrt-bei-2-2-prozent,0,www.zeit.de,"Teuerung: Inflationsrate in der Eurozone verharrt bei 2,2 Prozent","Hier finden Sie Informationen zu dem Thema „Teuerung“. Lesen Sie jetzt „Inflationsrate in der Eurozone verharrt bei 2,2 Prozent“.",https://img.zeit.de/news/2025-05/02/inflationsrate-in-der-eurozone-verharrt-bei-2-2-prozent-image-group/wide__1300x731,2025-05-02T09:39:23Z,https://web.archive.org/web/20250502095038/https://www.zeit.de/news/2025-05/02/inflationsrate-in-der-eurozone-verharrt-bei-2-2-prozent,"Die Inflation in der Eurozone sinkt entgegen der Erwartung von Ökonomen nicht weiter. Die Teuerungsrate verharrte im April bei 2,2 Prozent, wie das Statistikamt Eurostat in Luxemburg nach einer erste… [+1872 chars]",,de,'Teuer'
https://www.tagesschau.de/wirtschaft/verbraucher/inflation-eurozone-april-100.html,https://www.tagesschau.de/wirtschaft/verbraucher/inflation-eurozone-april-100.html,0,www.tagesschau.de,"Inflation in Eurozone verharrt bei 2,2 Prozent",Im April sind die Verbraucherpreise in der Eurozone im Schnitt nach ersten Zahlen gleich geblieben. Besonders deutlich zogen die Preise bei Dienstleistungen wie Essengehen oder dem Friseurbesuch an.,https://images.tagesschau.de/image/4a36c2b8-ca57-4b70-af70-74aba5a4a5cf/AAABlpD2QWg/AAABkZLhkrw/16x9-1280/frisoer-112.jpg,2025-05-02T13:18:54Z,https://web.archive.org/web/20250502134753/https://www.tagesschau.de/wirtschaft/verbraucher/inflation-eurozone-april-100.html,"Stand: 02.05.2025 15:18 Uhr
Im April sind die Verbraucherpreise in der Eurozone im Schnitt nach ersten Zahlen gleich geblieben. Besonders deutlich zogen die Preise bei Dienstleistungen wie Essengehe… [+3492 chars]",,de,'Inflation'
https://www.zeit.de/news/2025-05/02/grund-fuer-explosion-in-tourismusort-weiter-unklar,https://www.zeit.de/news/2025-05/02/grund-fuer-explosion-in-tourismusort-weiter-unklar,0,www.zeit.de,Notfälle: Grund für Explosion in Tourismusort weiter unklar,Hier finden Sie Informationen zu dem Thema „Notfälle“. Lesen Sie jetzt „Grund für Explosion in Tourismusort weiter unklar“.,https://img.zeit.de/news/2025-05/02/grund-fuer-explosion-in-tourismusort-weiter-unklar-image-group/wide__1300x731,2025-05-02T13:56:05Z,https://web.archive.org/web/20250503052047/https://www.zeit.de/news/2025-05/02/grund-fuer-explosion-in-tourismusort-weiter-unklar,Einen Tag nach der Explosion einer Gasflasche im Hafen von Niendorf im Kreis Ostholstein ist der Grund dafür weiter unklar. Die Polizei ermittele jetzt wegen des Verdachts der fahrlässigen Herbeiführ… [+1179 chars],,de,'Explosion'
https://www.zeit.de/news/2025-05/02/gutachten-gasleck-verursachte-explosion-in-memmingen,https://www.zeit.de/news/2025-05/02/gutachten-gasleck-verursachte-explosion-in-memmingen,0,www.zeit.de,Tödliche Explosion: Gutachten: Gasleck verursachte Explosion in Memmingen,Hier finden Sie Informationen zu dem Thema „Tödliche Explosion“. Lesen Sie jetzt „Gutachten: Gasleck verursachte Explosion in Memmingen“.,https://img.zeit.de/news/2025-05/02/gutachten-gasleck-verursachte-explosion-in-memmingen-image-group/wide__1300x731,2025-05-02T15:50:57Z,https://web.archive.org/web/20250503060538/https://www.zeit.de/news/2025-05/02/gutachten-gasleck-verursachte-explosion-in-memmingen,"Ein Gasleck hat nach Polizeiangaben die Explosion in einem Reihenhaus in Memmingen ausgelöst, bei der im vergangenen Sommer ein 17-Jähriger ums Leben kam. «Das der Kriminalpolizeiinspektion Memmingen… [+1075 chars]",,de,'Explosion'
https://www.telepolis.de/features/Klimawandel-laesst-Wasserspeicher-der-Alpen-verdunsten-10369827.html,https://www.telepolis.de/features/Klimawandel-laesst-Wasserspeicher-der-Alpen-verdunsten-10369827.html,0,www.telepolis.de,Klimawandel lässt Wasserspeicher der Alpen verdunsten,Die Alpen verlieren ihre Rolle als Europas Wasserspeicher. Immer weniger Schnee bleibt im Winter liegen. Wird das Alpenvorland zur Steppe?,https://heise.cloudimg.io/bound/1200x1200/q85.png-lossy-85.webp-lossy-85.foil1/_www-heise-de_/imgs/18/4/8/4/6/7/9/9/Scheefall-223b1dabd207bd6c.jpeg,2025-05-03T10:00:00Z,https://web.archive.org/web/20250503104934/https://www.telepolis.de/features/Klimawandel-laesst-Wasserspeicher-der-Alpen-verdunsten-10369827.html,"Die Alpen verlieren ihre Rolle als Europas Wasserspeicher. Immer weniger Schnee bleibt im Winter liegen. Wird das Alpenvorland zur Steppe?
Der Klimawandel sorgt für beachtliche Entwicklungen im mitt… [+5443 chars]",,de,'Schnee'
