index,url,valid,domain,title,description,image,published,archive,content,quote,language,keyword
https://www.faz.net/aktuell/politik/ukraine-liveticker-russland-bewaffnet-milizen-im-grenzgebiet-zur-ukraine-faz-19030454.html,https://www.faz.net/aktuell/politik/ukraine-liveticker-russland-bewaffnet-milizen-im-grenzgebiet-zur-ukraine-faz-19030454.html,0,www.faz.net,Ukraine-Liveblog: Russland bewaffnet Milizen im Grenzgebiet zur Ukraine,Russland zerstört durch Drohnenangriff 40.000 Tonnen Getreide +++ Russland beschießt Donau-Hafen an der Grenze zu Rumänien +++ Belarussische Hubschrauber haben Grenze nach Polen überflogen +++ alle Entwicklungen im Liveblog,https://media0.faz.net/ppmedia/aktuell/2845219399/1.9077050/facebook_teaser/eine-frau-laeuft-vor-einem.jpg,2023-08-02T17:38:59Z,,"Eine Frau läuft vor einem beschädigten Gebäude in der Stadt Shebekino, in der Nähe der ukrainischen Grenze in der Region Belgorod. Bild: AFP
Russland zerstört durch Drohnenangriff 40.000 Tonnen Getr… [+165 chars]",,de,'Russland'
https://www.zeit.de/wissen/2023-08/suedkorea-supraleiter-forschung-durchbruch,https://www.zeit.de/wissen/2023-08/suedkorea-supraleiter-forschung-durchbruch,0,www.zeit.de,"Supraleiter: ""Ein Zufallstreffer ist nie auszuschließen""","Forschende wollen einen Supraleiter entdeckt haben, der riesige Mengen Strom und Kosten sparen könnte. Ein Durchbruch? Der Physiker Bernhard Keimer ist skeptisch.",,2023-08-02T18:04:12Z,http://archive.md/20230802180804/https://www.zeit.de/wissen/2023-08/suedkorea-supraleiter-forschung-durchbruch,"When browsing with ads:
We collect personal data and also transmit it to third-party providers
 that help us improve and finance our digital content. Some of the information stored on your device, … [+821 chars]",,de,'Kosten'
https://orf.at/stories/3325842/,https://orf.at/stories/3325842/,0,orf.at,Immokäufer gefangen im Zinsdilemma,"Rund um den heimischen Immobilienmarkt tobt derzeit ein harter Kampf: Während Mieter und Mieterinnen hohe Preise beklagen, werden Immobilienkredite aufgrund der steigenden Kosten für Kaufinteressenten zunehmend zur Hürde. Banken verweisen auf schärfere Kredit…",https://ibs.orf.at/news?image=https%3A%2F%2Fassets.orf.at%2Fmims%2F2023%2F31%2F36%2Fcrops%2Fw%3D1200%2Ch%3D630%2Cq%3D75%2F1887043_master_707336_immokredite_banken_schuldnerberatung_coe.jpg%3Fs%3D177548b4aede76502c3949a68c42545b5f7c3a6e,2023-08-03T04:03:43Z,,"Wer derzeit auf Wohnungssuche ist, hat es unter der Annahme endlicher finanzieller Mittel nicht leicht. In den Ballungsgebieten und den umliegenden Speckgürteln sind die Mietpreise derart gestiegen, … [+8981 chars]",,de,'Kosten'
https://www.faz.net/aktuell/politik/ukraine-liveticker-ukraine-meldet-abwehr-von-15-drohnen-ueber-kiew-faz-19030454.html,https://www.faz.net/aktuell/politik/ukraine-liveticker-ukraine-meldet-abwehr-von-15-drohnen-ueber-kiew-faz-19030454.html,0,www.faz.net,Ukraine-Liveblog: Ukraine meldet Abwehr von 15 Drohnen über Kiew,Russland bewaffnet Milizen im Grenzgebiet zur Ukraine +++ Donau-Hafen an der Grenze zu Rumänien beschossen +++ Belarussische Hubschrauber haben Grenze nach Polen überflogen +++ alle Entwicklungen im Liveblog,https://media1.faz.net/ppmedia/aktuell/politik/1982492063/1.9077405/facebook_teaser/ein-wartungsarbeiter-steht.jpg,2023-08-03T05:08:15Z,,"Russland übt einer US-Studie zufolge massiven Druck auf Ukrainer in den besetzten Gebieten aus, um sie zur Annahme der russischen Staatsbürgerschaft zu bewegen. In einem Bericht der Yale-Universität … [+578 chars]",,de,'Russland'
https://www.dealdoktor.de/user-deals/kostenloser-versan-bei-ebay-kleinanzeigen-vom-03-10-08-2023/,https://www.dealdoktor.de/user-deals/kostenloser-versan-bei-ebay-kleinanzeigen-vom-03-10-08-2023/,0,www.dealdoktor.de,[Userdeal] Kostenloser DHL-Versand bei (ebay) Kleinanzeigen vom 03.-10.08.2023,"User Deal von krofisch:Dealpreis: 0€Bei (ebay) Kleinanzeigen könnt ihr jetzt auch noch die Versandkosten sparen.
Denn vom 03.-10.08.2023 sind alle Artikel mit DHL Versand versandkostenfrei!
Nutzt dafür den Aktionscode ""WG"".
Dafür am Besten die Suchergebnisse …",https://www.dealdoktor.de/app/uploads/user_deals/Unbenannt-4520.jpg,2023-08-03T05:40:30Z,,"Bei (ebay) Kleinanzeigen könnt ihr jetzt auch noch die Versandkosten sparen.
Denn vom 03.-10.08.2023 sind alle Artikel mit DHL Versand versandkostenfrei!
Nutzt dafür den Aktionscode „WG“.
Dafür am… [+1129 chars]",,de,'Sparen'
https://www.zeit.de/news/2023-08/03/verurteilter-straftaeter-weiter-auf-der-flucht,https://www.zeit.de/news/2023-08/03/verurteilter-straftaeter-weiter-auf-der-flucht,0,www.zeit.de,Justizministerium: Verurteilter Straftäter weiter auf der Flucht,,,2023-08-03T08:20:30Z,,"When browsing with ads:
We collect personal data and also transmit it to third-party providers
 that help us improve and finance our digital content. Some of the information stored on your device, … [+821 chars]",,de,'Flucht'
https://www.zeit.de/news/2023-08/03/maennergruppe-schlaegt-opfer-in-wohnung-schuesse-bei-flucht,https://www.zeit.de/news/2023-08/03/maennergruppe-schlaegt-opfer-in-wohnung-schuesse-bei-flucht,0,www.zeit.de,Südwestpfalz: Männergruppe schlägt Opfer in Wohnung: Schüsse bei Flucht,,,2023-08-03T10:07:17Z,,"When browsing with ads:
We collect personal data and also transmit it to third-party providers
 that help us improve and finance our digital content. Some of the information stored on your device, … [+821 chars]",,de,'Flucht'
https://www.zeit.de/news/2023-08/03/pistorius-weiter-keine-marschflugkoerper-fuer-ukraine,https://www.zeit.de/news/2023-08/03/pistorius-weiter-keine-marschflugkoerper-fuer-ukraine,0,www.zeit.de,Verteidigungsminister: Pistorius: weiter keine Marschflugkörper für Ukraine,,,2023-08-03T11:32:48Z,,"When browsing with ads:
We collect personal data and also transmit it to third-party providers
 that help us improve and finance our digital content. Some of the information stored on your device, … [+821 chars]",,de,'Ukraine'
https://consent.google.com/ml?continue=https://news.google.com/rss/articles/CBMijQFodHRwczovL3d3dy5mci5kZS9wb2xpdGlrL2VyZG9nYW4tdWtyYWluZS1rcmllZy1sZWJlbnNtaXR0ZWxwcmVpc2UtcHV0aW4tcnVzc2xhbmQtc3RyYXRlZ2llLWFuZ3JpZmZlLWhhZWZlbi1nZXRyZWlkZWFia29tbWVuLXpyLTkyNDM5OTcxLmh0bWzSAQA?oc%3D5&gl=FR&hl=en-US&cm=2&pc=n&src=1,https://consent.google.com/ml?continue=https://news.google.com/rss/articles/CBMijQFodHRwczovL3d3dy5mci5kZS9wb2xpdGlrL2VyZG9nYW4tdWtyYWluZS1rcmllZy1sZWJlbnNtaXR0ZWxwcmVpc2UtcHV0aW4tcnVzc2xhbmQtc3RyYXRlZ2llLWFuZ3JpZmZlLWhhZWZlbi1nZXRyZWlkZWFia29tbWVuLXpyLTkyNDM5OTcxLmh0bWzSAQA?oc%3D5&gl=FR&hl=en-US&cm=2&pc=n&src=1,0,consent.google.com,40.000 Tonnen Getreide vernichtet – Frankreich tobt wegen Putin - fr.de,"<ol><li>40.000 Tonnen Getreide vernichtet – Frankreich tobt wegen Putin  fr.de
</li><li>Ukraine-Newsblog | Experten: Russland will Lebensmittelpreise in die Höhe treiben  t-online
</li><li>AUSWEICHHAFEN FÜR GETREIDE UNTER BESCHUSS: Russland begeht weiter vö…",,2023-08-04T03:11:00Z,,"We use cookies and data to<ul><li>Deliver and maintain Google services</li><li>Track outages and protect against spam, fraud, and abuse</li><li>Measure audience engagement and site statistics to unde… [+1131 chars]",,de,'Russland'
https://www.zeit.de/politik/ausland/2023-08/ukraine-ueberblick-ereignisse-gegenoffensive-militaerhaushalt,https://www.zeit.de/politik/ausland/2023-08/ukraine-ueberblick-ereignisse-gegenoffensive-militaerhaushalt,0,www.zeit.de,"Ukraine-Überblick: Selenskyj beklagt brutale Angriffe, Milliardensummen für das Militär","Der ukrainische Präsident spricht von ""harten Kämpfen"" bei der Gegegnoffensive. Für den Staatshaushalt benötigt die Regierung in Kiew weitere Finanzhilfen. Die Nacht",,2023-08-04T03:17:25Z,,"When browsing with ads:
We collect personal data and also transmit it to third-party providers
 that help us improve and finance our digital content. Some of the information stored on your device, … [+821 chars]",,de,'Ukraine'
https://www.sueddeutsche.de/politik/ukraine-krieg-newsblog-verteidigung-militaerausgaben-1.5995108,https://www.sueddeutsche.de/politik/ukraine-krieg-newsblog-verteidigung-militaerausgaben-1.5995108,0,www.sueddeutsche.de,Liveblog zum Krieg in der Ukraine: Ukraine plant knapp 50 Milliarden Dollar an Militärausgaben,Zusätzlich hofft die Regierung auf ausländische Unterstützung für humanitäre und soziale Leistungen. Russlands Armee lockt Kasachen mit einer 5000 Euro Sofort-Prämie. Die EU verschärft Sanktionen gegen Belarus.,https://www.sueddeutsche.de/image/sz.1.6095036/1200x675?v=1691119269,2023-08-04T03:21:09Z,,Viele Angaben über den Kriegsverlauf wie Opferzahlen oder Details zu Kämpfen stammen von ukrainischen oder russischen Behörden und lassen sich oft nicht unabhängig überprüfen. Für unseren Liveblog ve… [+107 chars],,de,'Russland'
https://www.morgenpost.de/politik/ausland/article239103185/Krieg-gegen-die-Ukraine-So-ist-die-Lage.html,https://www.morgenpost.de/politik/ausland/article239103185/Krieg-gegen-die-Ukraine-So-ist-die-Lage.html,0,www.morgenpost.de,Russische Invasion: Krieg gegen die Ukraine: So ist die Lage,Laut Medwedew kann die russische Armee auf mehr als 231.000 neue Soldaten zurückgreifen. 90 Staaten verpflichten sich zu Maßnahmen gegen den Einsatz von Nahrungsmitteln als Kriegswaffe. Die News im Überblick.,https://img.morgenpost.de/img/ausland/crop239103183/1202609849-w820-cv16_9-q85/Ukraine-Krieg-Kiew.jpg,2023-08-04T03:27:08Z,,"Moskau. Nach Angaben des Vizechefs des russischen nationalen Sicherheitsrates, Dmitri Medwedew, haben seit Januar mehr als 231.000 Russen ihre Dienste im Krieg gegen die Ukraine angeboten und einen V… [+4580 chars]",,de,'Ukraine'
https://www.nzz.ch/international/polen-ruestet-sich-gegen-wagner-drohungen-und-streitet-mit-der-ukraine-ld.1749809,https://www.nzz.ch/international/polen-ruestet-sich-gegen-wagner-drohungen-und-streitet-mit-der-ukraine-ld.1749809,0,www.nzz.ch,"«Beten Sie, dass wir sie aufhalten»: Polen rüstet sich gegen Lukaschenkos Wagner-Drohungen und streitet mit der Ukraine",An der Ostgrenze von Kiews wichtigstem europäischen Unterstützer herrscht Nervosität. Grund ist der Krieg – aber auch der Wahlkampf.,"https://img.nzz.ch/2023/08/03/4c27c299-4e19-4ebf-adea-2e32644c12de.jpeg?width=1200&height=674&fit=bound&quality=75&auto=webp&crop=6029,3387,x0,y312&wmark=nzz",2023-08-04T03:30:00Z,http://archive.md/20230804064116/https://www.nzz.ch/international/polen-ruestet-sich-gegen-wagner-drohungen-und-streitet-mit-der-ukraine-ld.1749809,"JUROWLANY, POLAND - JULY 09: A view of the border wall at the Polish Belarusian border on July 09, 2023 in Jurowlany, Poland. Last week, the Polish government announced it was sending 500 counterterr… [+10075 chars]",,de,'Ukraine'
https://www.nzz.ch/podcast/als-korrespondent-in-russland-im-krieg-nzz-akzent-ld.1747399,https://www.nzz.ch/podcast/als-korrespondent-in-russland-im-krieg-nzz-akzent-ld.1747399,0,www.nzz.ch,PODCAST - Sommer-Special: warum Russland-Korrespondent Markus Ackeret das Wort «Krieg» in seinen Artikeln weiterhin verwendet,"Im «NZZ-Akzent-Sommer-Special» berichten unsere Korrespondenten von ihrem Alltag. Es geht etwa um die Überwachung in China oder die Bürokratie in Indien. In dieser Folge erzählt unser Russland-Korrespondent, wie sich seine Arbeit seit Kriegsbeginn verändert h…","https://img.nzz.ch/2023/07/14/68b93708-989c-4886-b572-0f995a0b6ac7.jpeg?width=1200&height=674&fit=bound&quality=75&auto=webp&crop=2644,1486,x0,y3&wmark=nzz",2023-08-04T03:30:00Z,,"Hören und abonnieren Sie den Podcast «NZZ Akzent» auch auf Spotify,Apple Podcasts oder Castbox.
Haben Sie ein Feedback zum Podcast? Sagen Sie uns Ihre Meinung.
In dieser Podcast-Episode:
Ohne Korr… [+1008 chars]",,de,'Ukraine'
https://www.welt.de/politik/ausland/video246728086/Livestream-Ukraine-News-Explosionen-nahe-russischem-Schwarzmeer-Marinehafen-Noworossijsk.html,https://www.welt.de/politik/ausland/video246728086/Livestream-Ukraine-News-Explosionen-nahe-russischem-Schwarzmeer-Marinehafen-Noworossijsk.html,0,www.welt.de,Explosionen nahe russischem Schwarzmeerhafen – alle Entwicklungen im Ukraine-Krieg,Die Ukraine soll nach Moskaus Angaben einen russischen Marinestützpunkt nahe der Hafenstadt Noworossijsk am Schwarzen Meer mit Seedrohnen angegriffen haben. Außerdem: Verfolgen Sie die Anklage gegen Ex-US-Präsident Trump und weitere Nachrichten bei WELT im TV.,https://img.welt.de/img/politik/ausland/mobile246729390/6971351217-ci16x9-w1200/Tag-der-Marine-in-Russland.jpg,2023-08-04T04:00:34Z,http://archive.md/20230804070047/https://www.welt.de/politik/ausland/video246728086/Livestream-Ukraine-News-Explosionen-nahe-russischem-Schwarzmeer-Marinehafen-Noworossijsk.html,"Die WELT als ePaper: Die vollständige Ausgabe steht Ihnen bereits am Vorabend zur Verfügung so sind Sie immer hochaktuell informiert. Weitere Informationen: http://epaper.welt.de 
 Der Kurz-Link die… [+49 chars]",,de,'Ukraine'
https://www.sueddeutsche.de/politik/ukraine-krieg-newsblog-noworossijsk-schwarzes-meer-angriffe-hafen-1.5995108,https://www.sueddeutsche.de/politik/ukraine-krieg-newsblog-noworossijsk-schwarzes-meer-angriffe-hafen-1.5995108,0,www.sueddeutsche.de,Liveblog zum Krieg in der Ukraine: Explosionen im russischen Hafen Noworossijsk,"Die Stadt hat einen der größten Häfen am Schwarzen Meer, das Verteidigungsministerium berichtete von zwei unbemannte ukrainische Marinebooten. Auch Schüsse sollen gefallen sein. Die Ukraine plant für das laufende Jahr knapp 50 Milliarden Dollar für Verteidigu…",https://www.sueddeutsche.de/image/sz.1.6095113/1200x675?v=1691122281,2023-08-04T04:01:18Z,,(Viele Angaben über den Kriegsverlauf wie Opferzahlen oder Details zu Kämpfen stammen von ukrainischen oder russischen Behörden und lassen sich oft nicht unabhängig überprüfen. Für unseren Liveblog v… [+108 chars],,de,'Ukraine'
https://www.faz.net/aktuell/politik/ausland/nacht-in-ukraine-im-ueberblick-russland-rekrutiert-neue-soldaten-19079950.html,https://www.faz.net/aktuell/politik/ausland/nacht-in-ukraine-im-ueberblick-russland-rekrutiert-neue-soldaten-19079950.html,0,www.faz.net,Russland rekrutiert neue Soldaten,Nach Angaben aus dem Kreml haben seit Januar 231.000 Russen ihre Dienste im Krieg gegen die Ukraine angeboten. US-Außenminister Blinken spricht derweil eine Warnung Richtung Moskau aus. Der Überblick.,https://media0.faz.net/ppmedia/aktuell/politik/718429908/1.9079958/facebook_teaser/ein-rekrutierungsplakat-der.jpg,2023-08-04T04:15:43Z,,"Nach Angaben des Vizechefs des russischen nationalen Sicherheitsrates, Dmitri Medwedew, haben seit Januar mehr als 231.000 Russen ihre Dienste im Krieg gegen die Ukraine angeboten und einen Vertrag m… [+4307 chars]",,de,'Ukraine'
https://www.faz.net/podcasts/f-a-z-podcast-fruehdenker/faz-fruehdenker-gipfeltreffen-in-saudi-arabien-neuer-anlauf-fuer-frieden-im-ukrainekrieg-19079798.html,https://www.faz.net/podcasts/f-a-z-podcast-fruehdenker/faz-fruehdenker-gipfeltreffen-in-saudi-arabien-neuer-anlauf-fuer-frieden-im-ukrainekrieg-19079798.html,0,www.faz.net,F.A.Z. Frühdenker: Gipfeltreffen in Saudi-Arabien: Neuer Anlauf für Frieden im Ukrainekrieg?,Der ehemalige amerikanische Präsident Trump ist vor Gericht erschienen. Kremlkritiker Nawalnyj drohen weitere 20 Jahre Haft. Und: Es regnet immer weiter. Der F.A.Z. Newsletter,https://media1.faz.net/ppmedia/aktuell/politik/3810141552/1.9079839/facebook_teaser_fplus/selenskyj-wird-nicht-zum.jpg,2023-08-04T04:18:57Z,,"Das Wichtigste für Sie an diesem Freitag: 
1. Trump plädiert auf nicht schuldig2. Neues Urteil gegen Nawalnyj3. Ukraine-Treffen in Saudi-Arabien4. Vor einem halben Jahr: Tausende Tote nach Erdbeben5… [+864 chars]",,de,'Ukraine'
https://www.focus.de/politik/ausland/ukraine-krise/ukraine-update-am-abend-grosse-versuchung-fuer-putin-polen-fuerchtet-uebergriffe-auf-suwalki-luecke_id_200878523.html,https://www.focus.de/politik/ausland/ukraine-krise/ukraine-update-am-abend-grosse-versuchung-fuer-putin-polen-fuerchtet-uebergriffe-auf-suwalki-luecke_id_200878523.html,0,www.focus.de,Ukraine-Update am Abend - „Große Versuchung“ für Putin: Polen fürchtet Übergriffe auf Suwalki-Lücke,"Pistorius will keine Marschflugkörper an die Ukraine liefern. Polen und Litauen rechnen mit Übergriffen aus Belarus und Russland. In Kiew stellte ein Beamter gefälschte Dokumente an Wehrpflichtige aus, mit denen sie sich der Mobilisierung entzogen. Was am Tag…",https://p6.focus.de/img/fotos/id_96610019/putinsuwalki.png?im=Crop%3D%2869%2C0%2C831%2C415%29%3BResize%3D%281200%2C627%29&impolicy=perceptual&quality=mediumHigh&hash=e3ecff4445ddf155ee5642ffd5466d8213a3dc4c9514395fe5428fe338adbfcf,2023-08-04T04:21:19Z,,Pistorius will keine Marschflugkörper an die Ukraine liefern. Polen und Litauen rechnen mit Übergriffen aus Belarus und Russland. In Kiew stellte ein Beamter gefälschte Dokumente an Wehrpflichtige au… [+7370 chars],,de,'Russland'
https://orf.at/stories/3326303/,https://orf.at/stories/3326303/,0,orf.at,Explosionen in russischer Hafenstadt Noworossijsk,,https://orf.at/mojo/1_4_1/storyserver//news/common/images/og-fallback-news.png,2023-08-04T04:29:24Z,,Die Rettungsdienste der russischen Hafenstadt Noworossijsk am Schwarzen Meer haben Berichte in den sozialen Medien über Explosionen und Schüsse in der Nähe des Hafens bestätigt. Dies berichtet die ru… [+1107 chars],,de,'Ukraine'
https://www.faz.net/aktuell/politik/ukraine-liveticker-moskau-hat-wohl-angriff-auf-noworossijsk-abgewehrt-faz-19030454.html,https://www.faz.net/aktuell/politik/ukraine-liveticker-moskau-hat-wohl-angriff-auf-noworossijsk-abgewehrt-faz-19030454.html,0,www.faz.net,Ukraine-Liveblog: Russland will Angriff auf eigenen Marinestützpunkt abgewehrt haben,Selenskyj: „Widerwärtige“ Praktiken in Rekrutierungszentren +++ EU weitet Sanktionen gegen Belarus aus +++ Morawiecki: Wagner-Söldner in Belarus sollen NATO-Ostflanke destabilisieren +++ alle Entwicklungen im Liveblog,https://media0.faz.net/ppmedia/aktuell/politik/3112648375/1.9080014/facebook_teaser/der-hafen-von-noworossijsk.jpg,2023-08-04T04:42:07Z,,Russland hat eigenen Angaben zufolge einen ukrainischen Angriff auf den Marinestützpunkt in Noworossijsk an der Schwarzmeer-Küste abgewehrt. In der Nacht seien zwei Seedrohnen auf die Hafenstadt am s… [+1555 chars],,de,'Ukraine'
https://www.focus.de/politik/ausland/ukraine-krieg-im-ticker-russland-rekrutiert-neue-soldaten_id_57275780.html,https://www.focus.de/politik/ausland/ukraine-krieg-im-ticker-russland-rekrutiert-neue-soldaten_id_57275780.html,0,www.focus.de,Ukraine-Krieg - Stimmen und Entwicklungen - Kiew: Ukrainischer Geheimdienst in Angriffe auf Krim-Brücke verwickelt,Nachwachsendes Unterholz erschwert die Kämpfe im Süden der Ukraine. Der Widerstand auf der Krim wächst. Die Ukraine bestätigt eine Beteiligung an den Anschlägen auf die Krim-Brücke. Jetzt rekrutiert Russland neue Soldaten. Alle News zum Krieg gegen die Ukrain…,https://p6.focus.de/img/fotos/id_199325207/ukraine-krieg-krim-b-78715644.jpg?im=Crop%3D%280%2C157%2C2543%2C1271%29%3BResize%3D%281200%2C627%29&impolicy=perceptual&quality=mediumHigh&hash=44212bf1f70f9655589c22d91ee4f2ce6d3a2270c76e2c470733934e7167878e,2023-08-04T04:56:43Z,,Nachwachsendes Unterholz erschwert die Kämpfe im Süden der Ukraine. Der Widerstand auf der Krim wächst. Die Ukraine bestätigt eine Beteiligung an den Anschlägen auf die Krim-Brücke. Alle News zum Kri… [+8038 chars],,de,'Russland'
https://www.focus.de/politik/ausland/ukraine-krieg-im-ticker-polens-praesident-sicher-wagner-kaempfer-werden-weiter-aus-russland-gelenkt_id_57275780.html,https://www.focus.de/politik/ausland/ukraine-krieg-im-ticker-polens-praesident-sicher-wagner-kaempfer-werden-weiter-aus-russland-gelenkt_id_57275780.html,0,www.focus.de,Ukraine-Krieg - Stimmen und Entwicklungen - Polens Präsident sicher: Wagner-Kämpfer werden weiter aus Russland gelenkt,Nachwachsendes Unterholz erschwert die Kämpfe im Süden der Ukraine. Der Widerstand auf der Krim wächst. Die Ukraine bestätigt eine Beteiligung an den Anschlägen auf die Krim-Brücke. Jetzt rekrutiert Russland neue Soldaten. Alle News zum Krieg gegen die Ukrain…,https://p6.focus.de/img/fotos/id_200937245/polens-praesident-andrzej-duda-.jpg?im=Crop%3D%280%2C36%2C3463%2C1733%29%3BResize%3D%281200%2C627%29&impolicy=perceptual&quality=mediumHigh&hash=837b66c9a9dfa789ef009f16ce4db1eac31bad502d78663f4e1c5dda77ae72b3,2023-08-04T04:56:43Z,,Nachwachsendes Unterholz erschwert die Kämpfe im Süden der Ukraine. Der Widerstand auf der Krim wächst. Die Ukraine bestätigt eine Beteiligung an den Anschlägen auf die Krim-Brücke. Alle News zum Kri… [+9875 chars],,de,'Ukraine'
https://www.handelsblatt.com/politik/international/ukraine-krieg-lage-am-morgen-russland-rekrutiert-neue-soldaten/28144208.html,https://www.handelsblatt.com/politik/international/ukraine-krieg-lage-am-morgen-russland-rekrutiert-neue-soldaten/28144208.html,0,www.handelsblatt.com,Ukraine-Krieg – Lage am Morgen: Russland rekrutiert neue Soldaten – EU weitet Sanktionen gegen Belarus aus,Die russische Armee kann offenbar auf mehr als 231.000 neue Vertragssoldaten zurückgreifen. 90 Staaten wollen den Einsatz von Nahrungsmitteln als Kriegswaffe verhindern.,https://www.handelsblatt.com/images/russische-soldaten/29298160/2-format2003.jpg,2023-08-04T05:09:40Z,,"Russische SoldatenLaut russischen Angaben melden sich rund doppelt so viele Freiwillige zum Kriegsdienst als noch im Mai.
(Foto: dpa)
Kiew Nach Angaben des Vizechefs des russischen nationalen Siche… [+4888 chars]",,de,'Ukraine'
https://www.welt.de/videos/video246728426/Ukraine-Krieg-Selenskyj-spricht-von-schweren-Kaempfen.html,https://www.welt.de/videos/video246728426/Ukraine-Krieg-Selenskyj-spricht-von-schweren-Kaempfen.html,0,www.welt.de,Selenskyj spricht von schweren Kämpfen,"An der Front im Osten und Süden der Ukraine habe das Militär laut Kiew mit Schwierigkeiten zu kämpfen, sei aber in der Offensive dominant: „Es gibt schwere Kämpfe“, sagte der ukrainische Präsident. Unterdessen weitet die Europäische Union ihre Sanktionen gege…",https://img.welt.de/img/politik/ausland/mobile246622998/1431354337-ci16x9-w1200/415842097-1-jpg.jpg,2023-08-04T05:12:20Z,http://archive.md/20230804070133/https://www.welt.de/videos/video246728426/Ukraine-Krieg-Selenskyj-spricht-von-schweren-Kaempfen.html,"Die WELT als ePaper: Die vollständige Ausgabe steht Ihnen bereits am Vorabend zur Verfügung so sind Sie immer hochaktuell informiert. Weitere Informationen: http://epaper.welt.de 
 Der Kurz-Link die… [+49 chars]",,de,'Ukraine'
https://www.stern.de/politik/ausland/ukraine-news--kreml--seit-januar-mehr-als-230-000-neue-soldaten-33708734.html,https://www.stern.de/politik/ausland/ukraine-news--kreml--seit-januar-mehr-als-230-000-neue-soldaten-33708734.html,0,www.stern.de,Russlands Krieg: Kreml: seit Januar mehr als 230.000 neue Soldaten rekrutiert,Mehr Kriegsdienstverweigerer in Deutschland +++ Kreml: Drohnenangriff auf Marinestützpunkt abgewehrt +++ Die Meldungen zum Krieg in der Ukraine im stern-Newsblog.,https://image.stern.de/33708790/t/pG/v3/w1440/r1.7778/-/russland-ukraine-soldaten.jpg,2023-08-04T05:13:00Z,,"Guten Morgen, liebe Leserinnen und Leser,im Süden und Osten der Ukraine gehen die schweren Kämpfe auch 527. Kriegstag weiter. Unterdessen will der Kreml an diesem Freitag en Text einer gemeinsamen Er… [+852 chars]",,de,'Ukraine'
https://consent.google.com/ml?continue=https://news.google.com/rss/articles/CBMiXmh0dHBzOi8vd3d3Lm4tdHYuZGUvcG9saXRpay9SdXNzaXNjaGUtSGFmZW5zdGFkdC1Ob3dvcm9zc2lqc2stYW5nZWdyaWZmZW4tYXJ0aWNsZTI0MzA0NzkwLmh0bWzSAQA?oc%3D5&gl=FR&hl=en-US&cm=2&pc=n&src=1,https://consent.google.com/ml?continue=https://news.google.com/rss/articles/CBMiXmh0dHBzOi8vd3d3Lm4tdHYuZGUvcG9saXRpay9SdXNzaXNjaGUtSGFmZW5zdGFkdC1Ob3dvcm9zc2lqc2stYW5nZWdyaWZmZW4tYXJ0aWNsZTI0MzA0NzkwLmh0bWzSAQA?oc%3D5&gl=FR&hl=en-US&cm=2&pc=n&src=1,0,consent.google.com,Explosionen und Schüsse: Russische Hafenstadt Noworossijsk angegriffen - n-tv NACHRICHTEN,"<ol><li>Explosionen und Schüsse: Russische Hafenstadt Noworossijsk angegriffen  n-tv NACHRICHTEN
</li><li>Liveblog: ++ Russland meldet Angriff auf Marinestützpunkt ++  tagesschau.de
</li><li>Ukraine-Newsblog | Offenbar Angriffe auf die Krim  t-online
</li>…",,2023-08-04T05:20:00Z,,"We use cookies and data to<ul><li>Deliver and maintain Google services</li><li>Track outages and protect against spam, fraud, and abuse</li><li>Measure audience engagement and site statistics to unde… [+1131 chars]",,de,'Ukraine'
https://www.n-tv.de/politik/Russische-Hafenstadt-Noworossijsk-angegriffen-article24304790.html,https://www.n-tv.de/politik/Russische-Hafenstadt-Noworossijsk-angegriffen-article24304790.html,0,www.n-tv.de,Explosionen und Schüsse: Russische Hafenstadt Noworossijsk angegriffen,"Der Krieg erreicht mal wieder eine russische Stadt. In Noworossijsk, einem Stützpunkt der russischen Schwarzmeerflotte, kommt es zu Explosionen und Schüssen. Der ukrainische Präsident Selenskyj beklagt indes ""sehr brutale"" Angriffe von Seiten Russlands.",https://bilder1.n-tv.de/img/incoming/crop24304804/4381323625-cImg_16_9-w1200/1bb216c5417e60c2acbceac9fe974d31.jpg,2023-08-04T05:20:18Z,,"Der Krieg erreicht mal wieder eine russische Stadt. In Noworossijsk, einem Stützpunkt der russischen Schwarzmeerflotte, kommt es zu Explosionen und Schüssen. Der ukrainische Präsident Selenskyj bekla… [+2922 chars]",,de,'Explosion'
