index,url,valid,domain,title,description,image,published,archive,content,quote,language,keyword
https://www.handelsblatt.com/politik/international/gastkommentar-warum-das-israel-modell-als-sicherheitsgarantie-fuer-die-ukraine-nicht-reicht/29238856.html,https://www.handelsblatt.com/politik/international/gastkommentar-warum-das-israel-modell-als-sicherheitsgarantie-fuer-die-ukraine-nicht-reicht/29238856.html,0,www.handelsblatt.com,Gastkommentar: Warum das „Israel-Modell“ als Sicherheitsgarantie für die Ukraine nicht reicht,"Auf dem Gipfel in Vilnius geht es um Sicherheitsgarantien für die Ukraine. Das Land braucht eine konkrete Nato-Perspektive, meint Liana Fix.",https://www.handelsblatt.com/images/die-autorin/29242602/2-format2003.jpg,2023-07-06T06:40:02Z,https://web.archive.org/web/20230707104524/https://www.handelsblatt.com/politik/international/gastkommentar-warum-das-israel-modell-als-sicherheitsgarantie-fuer-die-ukraine-nicht-reicht/29238856.html,"Der Nato-Gipfel, der am 11. Juli in Vilnius beginnt, wird einer der wichtigsten Gipfel in der Geschichte der nordatlantischen Allianz sein. Im Mittelpunkt steht die Frage: Wie halten wir es mit der U… [+5022 chars]",,de,'Waffen'
https://www.faz.net/aktuell/politik/inland/polizei-nimmt-sieben-mutmassliche-terroristen-fest-19014149.html,https://www.faz.net/aktuell/politik/inland/polizei-nimmt-sieben-mutmassliche-terroristen-fest-19014149.html,0,www.faz.net,Polizei nimmt sieben mutmaßliche Terroristen fest,Bei einer Anti-Terror-Razzia sind in Nordrhein-Westfalen sieben mutmaßliche Mitglieder einer islamistischen terroristischen Vereinigung festgenommen worden. Die Männer sollen kurz nach Beginn des russischen Angriffskriegs gegen die Ukraine eingereist sein.,https://media1.faz.net/ppmedia/aktuell/gesellschaft/2615650813/1.9014165/facebook_teaser/polizeibeamte-fuehren-eine.jpg,2023-07-06T06:45:05Z,https://web.archive.org/web/20230706071252/https://www.faz.net/aktuell/politik/inland/polizei-nimmt-sieben-mutmassliche-terroristen-fest-19014149.html,"Polizisten des Bundeskriminalamts und des Landeskriminalamts Nordrhein-Westfalen haben am frühen Morgen sieben Männer festgenommen, die im Verdacht stehen, einen islamistischen Terroranschlag in Deut… [+1449 chars]",,de,'Ukraine'
https://www.faz.net/aktuell/politik/inland/razzien-in-nrw-polizei-nimmt-sieben-mutmassliche-terroristen-fest-19014149.html,https://www.faz.net/aktuell/politik/inland/razzien-in-nrw-polizei-nimmt-sieben-mutmassliche-terroristen-fest-19014149.html,0,www.faz.net,Mutmaßliche islamistische Terrorzelle in NRW zerschlagen,"Bei Razzien in NRW sind sieben mutmaßliche Terroristen festgenommen worden, die Anschläge geplant haben sollen. Laut Generalbundesanwalt waren die Männer nach Beginn des russischen Angriffskriegs aus der Ukraine eingereist.",https://media1.faz.net/ppmedia/aktuell/gesellschaft/2615650813/1.9014165/facebook_teaser/polizeibeamte-fuehren-eine.jpg,2023-07-06T06:45:05Z,,"Polizisten des Bundeskriminalamts und des Landeskriminalamts Nordrhein-Westfalen haben am frühen Morgen sieben Männer festgenommen, die im Verdacht stehen, einen islamistischen Terroranschlag in Deut… [+1600 chars]",,de,'Ukraine'
https://www.welt.de/politik/ausland/article246243490/Ukraine-News-Wagner-Chef-Prigoschin-nach-St-Petersburg-gereist.html,https://www.welt.de/politik/ausland/article246243490/Ukraine-News-Wagner-Chef-Prigoschin-nach-St-Petersburg-gereist.html,0,www.welt.de,Wagner-Chef Prigoschin nach Lukaschenko-Angaben nach St. Petersburg gereist,"Jewgeni Prigoschin soll sich wieder in Russland aufhalten: Weißrusslands Machthaber Alexander Lukaschenko erklärte, der Wagner-Chef halte sich in seiner Heimatstadt St. Petersburg auf. Seine Söldner seinen in ihren Lagern. Mehr im Liveticker.",https://img.welt.de/img/politik/ausland/mobile246246294/1281359577-ci16x9-w1200/Ukraine-Krieg-Wagner-Chef-Prigoschin.jpg,2023-07-06T08:20:00Z,https://web.archive.org/web/20230706085210/https://www.welt.de/politik/ausland/article246243490/Ukraine-News-Wagner-Chef-Prigoschin-nach-St-Petersburg-gereist.html,"Der Chef der Wagner-Söldner, Jewgeni Prigoschin, hält sich nach Angaben des belarussischen Präsidenten Alexander Lukaschenko im russischen St. Petersburg auf und nicht mehr in Belarus. Die Kämpfer de… [+8715 chars]",,de,'Russland'
https://www.zeit.de/news/2023-07/06/lukaschenko-soeldnerchef-prigoschin-ist-in-russland,https://www.zeit.de/news/2023-07/06/lukaschenko-soeldnerchef-prigoschin-ist-in-russland,0,www.zeit.de,Privatarmee Wagner: Lukaschenko: Söldnerchef Prigoschin ist in Russland,,,2023-07-06T08:56:45Z,,"When browsing with ads:
We collect personal data and also transmit it to third-party providers
 that help us improve and finance our digital content. Some of the information stored on your device, … [+821 chars]",,de,'Russland'
https://www.stern.de/gesellschaft/regional/thueringen/eichsfeld--zigarettenautomat-in-sonnenstein-gesprengt-33625198.html,https://www.stern.de/gesellschaft/regional/thueringen/eichsfeld--zigarettenautomat-in-sonnenstein-gesprengt-33625198.html,0,www.stern.de,Eichsfeld: Zigarettenautomat in Sonnenstein gesprengt,"Ein Zigarettenautomat ist im thüringischen Sonnenstein (Landkreises Eichsfeld) gesprengt worden. Der Automat an der Hauptstraße wurde dabei komplett zerstört, wie die Polizei am Donnerstag mitteilte. Bei der Explosion in der Nacht zum Donnerstag wurde demzufo…",https://image.stern.de/33625200/t/4o/v1/w1440/r1.7778/-/06--urnnewsmldpacom2009010123070699304223v3w800h600l230t58r1387b1461jpeg---1d7349e36c2e7e74.jpg,2023-07-06T09:00:56Z,,"Ein Zigarettenautomat ist im thüringischen Sonnenstein (Landkreises Eichsfeld) gesprengt worden. Der Automat an der Hauptstraße wurde dabei komplett zerstört, wie die Polizei am Donnerstag mitteilte.… [+791 chars]",,de,'Explosion'
https://www.bild.de/digital/2023/digital/threads-startet-mit-nutzer-rekord-user-explosion-beim-twitter-killer-84586718.bild.html,https://www.bild.de/digital/2023/digital/threads-startet-mit-nutzer-rekord-user-explosion-beim-twitter-killer-84586718.bild.html,0,www.bild.de,„Threads“ startet mit Nutzer-Rekord - User-Explosion beim „Twitter-Killer,"Das dürfte Elon Musk ziemlich nerven ... Kaum gestartet, hat die Twitter-Kopie des Facebook-Konzerns Meta schon mehr als zehn Millionen Nutzer.","https://images.bild.de/64a683781dcc6276fb680150/72789299cb59bb2fc550dcef4c596145,e3b1469f?w=1280",2023-07-06T09:27:54Z,,"Das dürfte Elon Musk ziemlich nerven ...
Kaum gestartet, hat die Twitter-Kopie des Facebook-Konzerns Meta schon mehr als zehn Millionen Nutzer. Die App Threads habe die Marke sieben Stunden nach dem… [+2002 chars]",,de,'Explosion'
https://www.faz.net/aktuell/politik/ukraine-liveticker-russland-akzeptiert-risiken-in-anderen-regionen-faz-18495964.html,https://www.faz.net/aktuell/politik/ukraine-liveticker-russland-akzeptiert-risiken-in-anderen-regionen-faz-18495964.html,0,www.faz.net,Ukraine-Liveblog: London: Russland akzeptiert wegen Ukrainekrieg Risiken in anderen Regionen,Vier Tote bei Raketenangriff auf Lemberg +++ Britische Botschaft in Moskau rät zur Ausreise aus Russland +++ Explosion in einem Gericht in Kiew +++ alle Entwicklungen im Liveblog,https://media0.faz.net/ppmedia/aktuell/1774112252/1.9014536/facebook_teaser/ukrainische-soldaten-feuern-in.jpg,2023-07-06T10:01:59Z,,"Ukraine-Liveblog: London: Russland akzeptiert wegen Ukrainekrieg Risiken in anderen Regionen
Ukraine-Liveblog
London: Russland akzeptiert wegen Ukrainekrieg Risiken in anderen Regionen
Von Vier To… [+236 chars]",,de,'Russland'
https://www.zeit.de/video/2023-07/6330631314112/kiew-mann-stirbt-bei-explosion-in-gerichtsgebaeude,https://www.zeit.de/video/2023-07/6330631314112/kiew-mann-stirbt-bei-explosion-in-gerichtsgebaeude,0,www.zeit.de,Kiew: Mann stirbt bei Explosion in Gerichtsgebäude,"Ein wegen eines Terroranschlags Angeklagter hat sich am Gerichtshof im Zentrum Kiews offenbar versehentlich selbst gesprengt. Zuvor soll er versucht haben, zu fliehen.",,2023-07-06T10:43:37Z,,"When browsing with ads:
We collect personal data and also transmit it to third-party providers
 that help us improve and finance our digital content. Some of the information stored on your device, … [+821 chars]",,de,'Explosion'
https://www.bild.de/video/clip/news-ausland/bild-lagezentrum-praezisionsangriff-zerstoert-russisches-raketenlager-84589082.bild.html,https://www.bild.de/video/clip/news-ausland/bild-lagezentrum-praezisionsangriff-zerstoert-russisches-raketenlager-84589082.bild.html,0,www.bild.de,Mega-Explosion schockt Putin - Präzisionsangriff zerstört russisches Raketenlager,Ein ukrainischer Präzisionsangriff auf in riesiges Raketen-Depot in der russisch besetzte Stadt Makijiwka hat am Mittwochmorgen zu einer Mega-Explosion i...,"https://images.bild.de/64a69c8f58107c32b00980b2/3ec88501bf2593a5d145b827baca22c4,e5a46fbb?w=1280",2023-07-06T10:57:00Z,,"Mehr zum Video anzeigen
Ein ukrainischer Präzisionsangriff auf in riesiges Raketen-Depot in der russisch besetzte Stadt Makijiwka hat am Mittwochmorgen zu einer Mega-Explosion in der 345.000-Einwohn… [+150 chars]",,de,'Explosion'
https://www.bild.de/bild-plus/video/clip/news-ausland/bild-lagezentrum-praezisionsangriff-zerstoert-russisches-raketenlager-84589082.bild.html,https://www.bild.de/bild-plus/video/clip/news-ausland/bild-lagezentrum-praezisionsangriff-zerstoert-russisches-raketenlager-84589082.bild.html,0,www.bild.de,*** BILDplus Inhalt *** BILD-Lagezentrum - Präzisionsangriff zerstört russisches Raketenlager,Ein ukrainischer Präzisionsangriff auf in riesiges Raketen-Depot in der russisch besetzte Stadt Makijiwka hat am Mittwochmorgen zu einer Mega-Explosion i...,"https://images.bild.de/64a69c8f58107c32b00980b2/294a99d8a4571d2c5949cb0be02a9008-landscape,e5a46fbb?w=1280",2023-07-06T10:57:00Z,,"Weiter zum Hauptinhalt
 Um mit Inhalten von Drittanbietern zu interagieren oder diese darzustellen, brauchen wir deine Zustimmung. 
 externen Inhalt aktivieren Ich bin damit einverstanden, dass mir… [+265 chars]",,de,'Explosion'
https://www.zeit.de/news/2023-07/06/explosion-in-wohnhaus-technischer-defekt-wohl-ursache,https://www.zeit.de/news/2023-07/06/explosion-in-wohnhaus-technischer-defekt-wohl-ursache,0,www.zeit.de,Polizei: Explosion in Wohnhaus: technischer Defekt wohl Ursache,,,2023-07-06T11:11:29Z,,"When browsing with ads:
We collect personal data and also transmit it to third-party providers
 that help us improve and finance our digital content. Some of the information stored on your device, … [+821 chars]",,de,'Explosion'
https://www.stern.de/gesellschaft/regional/niedersachsen-bremen/polizei--explosion-in-wohnhaus--technischer-defekt-wohl-ursache--33625728.html,https://www.stern.de/gesellschaft/regional/niedersachsen-bremen/polizei--explosion-in-wohnhaus--technischer-defekt-wohl-ursache--33625728.html,0,www.stern.de,Polizei: Explosion in Wohnhaus: technischer Defekt wohl Ursache,"Ein technischer Defekt hat die Explosion in einem Reihenendhaus im Bremer Norden ausgelöst. Es habe ein Problem mit der Gasleitung oder der Heizungsanlage gegeben, sagte ein Polizeisprecher am Donnerstag. ""Wir gehen nicht davon aus, dass jemand absichtlich di…",https://image.stern.de/33625730/t/Az/v1/w1440/r1.7778/-/06--urnnewsmldpacom2009010123070699306209v2w800h600l1347t692r3798b3274jpeg---e275feb97d0876ae.jpg,2023-07-06T11:11:29Z,,"Ein technischer Defekt hat die Explosion in einem Reihenendhaus im Bremer Norden ausgelöst. Es habe ein Problem mit der Gasleitung oder der Heizungsanlage gegeben, sagte ein Polizeisprecher am Donner… [+622 chars]",,de,'Explosion'
https://www.faz.net/aktuell/feuilleton/debatten/putins-macho-politik-der-maennlichkeit-kommt-an-ihre-grenzen-19012409.html,https://www.faz.net/aktuell/feuilleton/debatten/putins-macho-politik-der-maennlichkeit-kommt-an-ihre-grenzen-19012409.html,0,www.faz.net,Putins Macho-Politik: Die Sehnsucht nach dem besseren Mann,In der Krise gewaltbereit: Der russische Präsident Putin verkörperte lange Zeit zugleich Zuverlässigkeit und Strenge. Doch im Konflikt mit dem Söldnerführer Prigoschin stieß seine Politik der Maskulinität an ihre Grenzen. Ein Gastbeitrag.,https://media1.faz.net/ppmedia/aktuell/277505426/1.9014353/facebook_teaser_fplus/inszenierte-maskulinitaet.jpg,2023-07-06T11:45:03Z,http://archive.md/20230706123035/https://www.faz.net/aktuell/feuilleton/debatten/putins-macho-politik-der-maennlichkeit-kommt-an-ihre-grenzen-19012409.html,"Er soll nicht trinken, nicht rauchen und seiner Frau immer Blumen schenken, den Lohn nach Hause bringen und die Schwiegermutter Mama nennen. Der sowjetische Schlager Meine Freundinnen sind längst unt… [+1006 chars]",,de,'Putin'
https://www.faz.net/aktuell/politik/ukraine-liveticker-deutschland-zweitgroesster-geber-von-ukraine-militaerhilfe-faz-18495964.html,https://www.faz.net/aktuell/politik/ukraine-liveticker-deutschland-zweitgroesster-geber-von-ukraine-militaerhilfe-faz-18495964.html,0,www.faz.net,Ukraine-Liveblog: IfW: Deutschland zweitgrößter Geber von Ukraine-Militärhilfe,London: Russland akzeptiert wegen Ukrainekrieg Risiken in anderen Regionen +++ Vier Tote bei Raketenangriff auf Lemberg +++ Britische Botschaft in Moskau rät zur Ausreise aus Russland +++ alle Entwicklungen im Liveblog,https://media1.faz.net/ppmedia/aktuell/3346354852/1.9015011/facebook_teaser/ein-ukrainer-steht-am-2-juli.jpg,2023-07-06T12:49:17Z,,"Ukraine-Liveblog: IfW: Deutschland zweitgrößter Geber von Ukraine-Militärhilfe
Ukraine-Liveblog
IfW: Deutschland zweitgrößter Geber von Ukraine-Militärhilfe
Von London: Russland akzeptiert wegen U… [+248 chars]",,de,'Ukraine'
https://www.welt.de/politik/ausland/video246256978/Ukraine-Krieg-CDU-Aussenpolitiker-Juergen-Hardt-im-WELT-Gespraech.html,https://www.welt.de/politik/ausland/video246256978/Ukraine-Krieg-CDU-Aussenpolitiker-Juergen-Hardt-im-WELT-Gespraech.html,0,www.welt.de,CDU-Außenpolitiker Jürgen Hardt im WELT-Gespräch,Nach dem Ende des Aufstands der Söldnertruppe Wagner sollte ihr Chef nach Belarus ins Exil gehen. Jetzt taucht er scheinbar in St. Petersburg wieder auf und bekommt auch Geld und Waffen zurück. Darüber und über die aktuelle Lage im Ukraine-Krieg spricht CDU-A…,https://img.welt.de/img/videos/mobile246257098/5361359597-ci16x9-w1200/Start-Hardt-jpg.jpg,2023-07-06T14:15:11Z,,"Die WELT als ePaper: Die vollständige Ausgabe steht Ihnen bereits am Vorabend zur Verfügung so sind Sie immer hochaktuell informiert. Weitere Informationen: http://epaper.welt.de 
 Der Kurz-Link die… [+49 chars]",,de,'Ukraine'
https://www.focus.de/politik/ausland/die-folgen-einer-sprengung-des-kritischen-akw-in-der-ukraine_id_198296397.html,https://www.focus.de/politik/ausland/die-folgen-einer-sprengung-des-kritischen-akw-in-der-ukraine_id_198296397.html,0,www.focus.de,"Ukraine - Was, wenn das AKW Saporischschja gesprengt wird?","Kiew warnt, russische Soldaten könnten auf zwei Kraftwerksblöcken im AKW Saporischschja Sprengstoff platziert haben. Die IAEA will dem Verdacht nachgehen. Eine Explosion könnte radioaktive Strahlung freisetzen.",https://p6.focus.de/img/politik/ausland/id_198296388/hat-die-russische-armee-das-akw-saporischschja-vermint-.jpg?im=Crop%3D%280%2C29%2C940%2C470%29%3BResize%3D%281200%2C627%29&impolicy=perceptual&quality=mediumHigh&hash=980f7cea73f38acc94c54ce77a4cdec29cab5168745252f62842bc8928196df8,2023-07-06T14:27:50Z,,"Bereits in den ersten Monaten der russischen Besetzung des Atomkraftwerks Saporischschja im Frühjahr 2022 meldete der ukrainische Betreiber Energoatom, die russische Armee habe das Gelände wahrschein… [+4939 chars]",,de,'Ukraine'
https://www.stern.de/politik/ausland/ukraine--wie-russische-kriegsgefangene-den-eigenen-krieg-erleben-33625188.html,https://www.stern.de/politik/ausland/ukraine--wie-russische-kriegsgefangene-den-eigenen-krieg-erleben-33625188.html,0,www.stern.de,"Invasion in der Ukraine: ""Ich dachte, ich erschieße mich jetzt"": Wie russische Soldaten den eigenen Krieg erleben","Suizidgedanken, unsinnige Befehle, schlechte Moral: Russische Kriegsgefangene in der Ukraine haben dem US-Sender CNN von Führungschaos in der Kremltruppe und den Schrecken des Grabenkrieges berichtet.",https://image.stern.de/33626436/t/xA/v2/w1440/r1.7778/-/ukraine-schu-tzengraben-maschinengewehr.jpg,2023-07-06T15:03:00Z,,"Suizidgedanken, unsinnige Befehle, schlechte Moral: Russische Kriegsgefangene in der Ukraine haben dem US-Sender CNN von Führungschaos in der Kremltruppe und den Schrecken des Grabenkrieges berichtet… [+7687 chars]",,de,'Ukraine'
https://www.zeit.de/2023/29/nato-gipfel-ukraine-krieg-aufnahme,https://www.zeit.de/2023/29/nato-gipfel-ukraine-krieg-aufnahme,0,www.zeit.de,Ukraine und Nato: Tür auf für die Ukraine?,Was soll die Nato Kiew versprechen? Ex-Nato-Mitarbeiterin Stefanie Babst fordert eine schnelle Aufnahme des Landes. SPD-Politiker Michael Roth hat eine andere Idee.,,2023-07-06T16:33:43Z,http://archive.md/20230705160356/https://www.zeit.de/2023/29/nato-gipfel-ukraine-krieg-aufnahme,"When browsing with ads:
We collect personal data and also transmit it to third-party providers
 that help us improve and finance our digital content. Some of the information stored on your device, … [+821 chars]",,de,'Ukraine'
https://www.faz.net/aktuell/politik/ukraine-liveticker-usa-prueft-lieferung-von-streumunition-faz-18495964.html,https://www.faz.net/aktuell/politik/ukraine-liveticker-usa-prueft-lieferung-von-streumunition-faz-18495964.html,0,www.faz.net,Ukraine-Liveblog: US-Regierung prüft Lieferung von Streumunition an Ukraine,Deutschland zweitgrößter Geber von Ukraine-Militärhilfe +++ Fünf Tote bei Raketenangriff auf Lemberg +++ Britische Botschaft in Moskau rät zur Ausreise aus Russland +++ alle Entwicklungen im Liveblog,https://media0.faz.net/ppmedia/aktuell/1226710182/1.9016242/facebook_teaser/bei-einem-raketenangriff-auf.jpg,2023-07-06T17:04:05Z,,"Ukraine-Liveblog: US-Regierung prüft Lieferung von Streumunition an Ukraine
Ukraine-Liveblog
USA prüfen Lieferung von Streumunition an Ukraine
Von Deutschland zweitgrößter Geber von Ukraine-Militä… [+215 chars]",,de,'Russland'
https://www.zeit.de/politik/ausland/2023-07/ukraine-ueberblick-jewgeni-prigoschin-alexander-lukaschenko-belarus-russland-atomwaffen,https://www.zeit.de/politik/ausland/2023-07/ukraine-ueberblick-jewgeni-prigoschin-alexander-lukaschenko-belarus-russland-atomwaffen,0,www.zeit.de,"Ukraine-Überblick: Prigoschin angeblich in Russland, russische Atomwaffen in Belarus",Laut Alexander Lukaschenko hält sich der Chef der Wagner-Söldner nicht in seinem Land auf. Erste Atomsprengköpfe aus Russland sollen in Belarus eingetroffen sein. Der Tag,,2023-07-06T17:05:21Z,,"When browsing with ads:
We collect personal data and also transmit it to third-party providers
 that help us improve and finance our digital content. Some of the information stored on your device, … [+821 chars]",,de,'Russland'
https://www.n-tv.de/politik/09-57-Bericht-Russische-Sicherheitskraefte-nehmen-angeblichen-Saboteur-der-Eisenbahn-fest--article23143824.html,https://www.n-tv.de/politik/09-57-Bericht-Russische-Sicherheitskraefte-nehmen-angeblichen-Saboteur-der-Eisenbahn-fest--article23143824.html,0,www.n-tv.de,Ukraine-Krieg im Liveticker: +++ 09:57 Bericht: Russische Sicherheitskräfte nehmen angeblichen Saboteur der Eisenbahn fest +++,"Berlin, Washington, Br\u00fcssel - \u00fcberall. n-tv berichtet von allen wichtigen Schaupl\u00e4tzen der Innen- und Au\u00dfenpolitik.",https://bilder2.n-tv.de/img/incoming/crop23332537/9041326157-cImg_16_9-w1200/Liveticker1-grau-1-Kopie.jpg,2023-07-06T22:15:00Z,https://web.archive.org/web/20230708054921/https://www.n-tv.de/politik/09-57-Bericht-Russische-Sicherheitskraefte-nehmen-angeblichen-Saboteur-der-Eisenbahn-fest--article23143824.html,"Russlands Sicherheitskräfte haben einen Mann auf der besetzten Krim festgenommen, der beschuldigt wird, im Auftrag der ukrainischen Streitkräfte die Eisenbahnen in der Region sabotiert zu haben. Das … [+10799 chars]",,de,'Russland'
https://www.n-tv.de/politik/07-38-Zahl-der-Toten-nach-Raketenangriff-auf-Lwiw-steigt-auf-zehn--article23143824.html,https://www.n-tv.de/politik/07-38-Zahl-der-Toten-nach-Raketenangriff-auf-Lwiw-steigt-auf-zehn--article23143824.html,0,www.n-tv.de,Ukraine-Krieg im Liveticker: +++ 07:38 Zahl der Toten nach Raketenangriff auf Lwiw steigt auf zehn +++,"Berlin, Washington, Br\u00fcssel - \u00fcberall. n-tv berichtet von allen wichtigen Schaupl\u00e4tzen der Innen- und Au\u00dfenpolitik.",https://bilder2.n-tv.de/img/incoming/crop23332537/9041326157-cImg_16_9-w1200/Liveticker1-grau-1-Kopie.jpg,2023-07-06T22:15:00Z,https://web.archive.org/web/20230708053145/https://www.n-tv.de/politik/07-38-Zahl-der-Toten-nach-Raketenangriff-auf-Lwiw-steigt-auf-zehn--article23143824.html,Die Zahl der Toten nach dem Raketenangriff auf die westukrainische Stadt Lwiw ist auf zehn gestiegen. Das zehnte Todesopfer - die Leiche einer Frau - sei am Morgen aus den Trümmern eines Wohnhauses g… [+8561 chars],,de,'Russland'
https://www.n-tv.de/politik/15-36-ISW-Ukraine-mit-Gegenoffensiven-an-drei-Abschnitten--article23143824.html,https://www.n-tv.de/politik/15-36-ISW-Ukraine-mit-Gegenoffensiven-an-drei-Abschnitten--article23143824.html,0,www.n-tv.de,Ukraine-Krieg im Liveticker: +++ 15:36 ISW: Ukraine mit Gegenoffensiven an drei Abschnitten +++,"Berlin, Washington, Br\u00fcssel - \u00fcberall. n-tv berichtet von allen wichtigen Schaupl\u00e4tzen der Innen- und Au\u00dfenpolitik.",https://bilder2.n-tv.de/img/incoming/crop23332537/9041326157-cImg_16_9-w1200/Liveticker1-grau-1-Kopie.jpg,2023-07-06T22:15:00Z,https://web.archive.org/web/20230708053233/https://www.n-tv.de/politik/15-36-ISW-Ukraine-mit-Gegenoffensiven-an-drei-Abschnitten--article23143824.html,"Die ukrainische Armee führt nach Einschätzung von US-Experten an mindestens drei Abschnitten Gegenoffensiven durch und versucht, russische Soldaten und Logistikressourcen schrittweise zu schwächen. D… [+20357 chars]",,de,'Russland'
https://www.n-tv.de/politik/12-13-London-Russland-verstaerkt-Marine-im-Asowschen-Meer--article23143824.html,https://www.n-tv.de/politik/12-13-London-Russland-verstaerkt-Marine-im-Asowschen-Meer--article23143824.html,0,www.n-tv.de,Ukraine-Krieg im Liveticker: +++ 12:13 London: Russland verstärkt Marine im Asowschen Meer +++,"Berlin, Washington, Br\u00fcssel - \u00fcberall. n-tv berichtet von allen wichtigen Schaupl\u00e4tzen der Innen- und Au\u00dfenpolitik.",https://bilder2.n-tv.de/img/incoming/crop23332537/9041326157-cImg_16_9-w1200/Liveticker1-grau-1-Kopie.jpg,2023-07-06T22:15:00Z,https://web.archive.org/web/20230708055242/https://www.n-tv.de/politik/12-13-London-Russland-verstaerkt-Marine-im-Asowschen-Meer--article23143824.html,Die russische Marine will nach Angaben britischer Militärexperten ihre Fähigkeiten im Asowschen Meer ausbauen. Dazu sei bereits ein neuer Marine-Distrikt mit Hauptquartier in der besetzten ukrainisch… [+14079 chars],,de,'Ukraine'
https://www.n-tv.de/politik/08-48-Russische-Behoerden-zaehlen-inzwischen-55-Tote-nach-Zerstoerung-des-Kachowka-Damms--article23143824.html,https://www.n-tv.de/politik/08-48-Russische-Behoerden-zaehlen-inzwischen-55-Tote-nach-Zerstoerung-des-Kachowka-Damms--article23143824.html,0,www.n-tv.de,Ukraine-Krieg im Liveticker: +++ 08:48 Russische Behörden zählen inzwischen 55 Tote nach Zerstörung des Kachowka-Damms +++,"Berlin, Washington, Br\u00fcssel - \u00fcberall. n-tv berichtet von allen wichtigen Schaupl\u00e4tzen der Innen- und Au\u00dfenpolitik.",https://bilder2.n-tv.de/img/incoming/crop23332537/9041326157-cImg_16_9-w1200/Liveticker1-grau-1-Kopie.jpg,2023-07-06T22:15:00Z,,"Die Zahl der Todesopfer bei der Zerstörung des Kachowka-Damms steigt auf 55, wie die russische Nachrichtenagentur Tass unter Berufung auf die von Russland eingesetzten Behörden im besetzten Cherson b… [+9778 chars]",,de,'Ukraine'
https://www.n-tv.de/politik/16-03-Selenskyj-besucht-auf-dem-Weg-nach-Istanbul-weiteres-EU-Land--article23143824.html,https://www.n-tv.de/politik/16-03-Selenskyj-besucht-auf-dem-Weg-nach-Istanbul-weiteres-EU-Land--article23143824.html,0,www.n-tv.de,Ukraine-Krieg im Liveticker: +++ 16:03 Selenskyj besucht auf dem Weg nach Istanbul weiteres EU-Land +++,"Berlin, Washington, Br\u00fcssel - \u00fcberall. n-tv berichtet von allen wichtigen Schaupl\u00e4tzen der Innen- und Au\u00dfenpolitik.",https://bilder2.n-tv.de/img/incoming/crop23332537/9041326157-cImg_16_9-w1200/Liveticker1-grau-1-Kopie.jpg,2023-07-06T22:15:00Z,https://web.archive.org/web/20230708055200/https://www.n-tv.de/politik/16-03-Selenskyj-besucht-auf-dem-Weg-nach-Istanbul-weiteres-EU-Land--article23143824.html,Nach seinem Besuch in Prag ist Selenskyj in der slowakischen Hauptstadt Bratislava eingetroffen. Er kündigte Gespräche mit seiner Amtskollegin Zuzana Caputova und Regierungsvertretern an. Es werde um… [+21097 chars],,de,'Russland'
https://www.n-tv.de/politik/10-23-UN-zaehlt-mehr-als-9000-zivile-Todesopfer-in-der-Ukraine--article23143824.html,https://www.n-tv.de/politik/10-23-UN-zaehlt-mehr-als-9000-zivile-Todesopfer-in-der-Ukraine--article23143824.html,0,www.n-tv.de,Ukraine-Krieg im Liveticker: +++ 10:23 UN zählt mehr als 9000 zivile Todesopfer in der Ukraine +++,"Berlin, Washington, Br\u00fcssel - \u00fcberall. n-tv berichtet von allen wichtigen Schaupl\u00e4tzen der Innen- und Au\u00dfenpolitik.",https://bilder2.n-tv.de/img/incoming/crop23332537/9041326157-cImg_16_9-w1200/Liveticker1-grau-1-Kopie.jpg,2023-07-06T22:15:00Z,https://web.archive.org/web/20230708055003/https://www.n-tv.de/politik/10-23-UN-zaehlt-mehr-als-9000-zivile-Todesopfer-in-der-Ukraine--article23143824.html,"500 Tage Krieg: Die UN-Menschenrechtsexperten beklagen die hohe Zahl ziviler Opfer. 500 Tage des russischen Angriffskrieges gegen das Nachbarland seien ein düsterer Meilenstein, teilt die Menschenrec… [+11554 chars]",,de,'Ukraine'
