index,url,valid,domain,title,description,image,published,archive,content,quote,language,keyword
https://www.n-tv.de/politik/17-45-Russisches-Militaer-greift-Ziele-in-neun-Regionen-an--article23143824.html,https://www.n-tv.de/politik/17-45-Russisches-Militaer-greift-Ziele-in-neun-Regionen-an--article23143824.html,0,www.n-tv.de,Ukraine-Krieg im Liveticker: +++ 17:45 Russisches Militär greift Ziele in neun Regionen an +++,"Berlin, Washington, Br\u00fcssel - \u00fcberall. n-tv berichtet von allen wichtigen Schaupl\u00e4tzen der Innen- und Au\u00dfenpolitik.",https://bilder2.n-tv.de/img/incoming/crop23332537/9041326157-cImg_16_9-w1200/Liveticker1-grau-1-Kopie.jpg,2023-02-04T11:19:00Z,,"Das russische Militär hat nach ukrainischen Angaben Ziele in neun Regionen im Süden, Norden und Osten der Ukraine angegriffen. Dabei wurden innerhalb der letzten 24 Stunden mindestens drei Zivilisten… [+22243 chars]",,de,'Nordstream'
https://www.n-tv.de/politik/15-03-Moskau-meldet-Vertreibung-Kiewer-Militaers-aus-Ort-im-Gebiet-Charkiw--article23143824.html,https://www.n-tv.de/politik/15-03-Moskau-meldet-Vertreibung-Kiewer-Militaers-aus-Ort-im-Gebiet-Charkiw--article23143824.html,0,www.n-tv.de,Ukraine-Krieg im Liveticker: +++ 15:03 Moskau meldet Vertreibung Kiewer Militärs aus Ort im Gebiet Charkiw +++,"Berlin, Washington, Br\u00fcssel - \u00fcberall. n-tv berichtet von allen wichtigen Schaupl\u00e4tzen der Innen- und Au\u00dfenpolitik.",https://bilder2.n-tv.de/img/incoming/crop23332537/9041326157-cImg_16_9-w1200/Liveticker1-grau-1-Kopie.jpg,2023-02-04T11:19:00Z,,"Das russische Militär hat nach eigenen Angaben ukrainische Kräfte aus der Ortschaft Dworitschne im Gebiet Charkiw im Nordosten der Ukraine vertrieben. ""In Richtung Kupjansk wurde der Gegner durch Ang… [+18027 chars]",,de,'Nordstream'
https://www.n-tv.de/politik/16-37-Sunak-will-sich-einsetzen-dass-gestellte-Militaerausruestung-schnell-an-der-Front-ist--article23143824.html,https://www.n-tv.de/politik/16-37-Sunak-will-sich-einsetzen-dass-gestellte-Militaerausruestung-schnell-an-der-Front-ist--article23143824.html,0,www.n-tv.de,"Ukraine-Krieg im Liveticker: +++ 16:37 Sunak will sich einsetzen, dass gestellte Militärausrüstung schnell an der Front ist +++","Berlin, Washington, Br\u00fcssel - \u00fcberall. n-tv berichtet von allen wichtigen Schaupl\u00e4tzen der Innen- und Au\u00dfenpolitik.",https://bilder2.n-tv.de/img/incoming/crop23332537/9041326157-cImg_16_9-w1200/Liveticker1-grau-1-Kopie.jpg,2023-02-04T11:19:00Z,https://web.archive.org/web/20230204154550/https://www.n-tv.de/politik/16-37-Sunak-will-sich-einsetzen-dass-gestellte-Militaerausruestung-schnell-an-der-Front-ist--article23143824.html,"Der britische Premierminister Rishi Sunak und der ukrainische Präsident Wolodymyr Selenskyj haben über eine raschere Hilfe für die Ukraine beraten. Sunaks Büro teilt mit, beide Politiker seien sich e… [+20573 chars]",,de,'Nordstream'
https://www.n-tv.de/politik/21-40-Generalstab-Russland-hat-weibliche-Haeftlinge-in-Donezk-rekrutiert--article23143824.html,https://www.n-tv.de/politik/21-40-Generalstab-Russland-hat-weibliche-Haeftlinge-in-Donezk-rekrutiert--article23143824.html,0,www.n-tv.de,Ukraine-Krieg im Liveticker: +++ 21:40 Generalstab: Russland hat weibliche Häftlinge in Donezk rekrutiert +++,"Berlin, Washington, Br\u00fcssel - \u00fcberall. n-tv berichtet von allen wichtigen Schaupl\u00e4tzen der Innen- und Au\u00dfenpolitik.",https://bilder2.n-tv.de/img/incoming/crop23332537/9041326157-cImg_16_9-w1200/Liveticker1-grau-1-Kopie.jpg,2023-02-04T11:19:00Z,,"Russische Streitkräfte haben dem Generalstab der ukrainischen Streitkräfte zufolge 50 Frauen aus einer Strafkolonie rekrutiert. ""Um seine Verluste wieder aufzufüllen, versucht der Gegner, verurteilte… [+27773 chars]",,de,'Nordstream'
https://www.n-tv.de/politik/14-32-Pompeo-Mit-Trump-als-US-Praesident-waere-Putin-nicht-in-die-Ukraine-einmarschiert--article23143824.html,https://www.n-tv.de/politik/14-32-Pompeo-Mit-Trump-als-US-Praesident-waere-Putin-nicht-in-die-Ukraine-einmarschiert--article23143824.html,0,www.n-tv.de,Ukraine-Krieg im Liveticker: +++ 14:32 Pompeo: Unter Trump wäre Putin nicht in die Ukraine einmarschiert +++,"Berlin, Washington, Br\u00fcssel - \u00fcberall. n-tv berichtet von allen wichtigen Schaupl\u00e4tzen der Innen- und Au\u00dfenpolitik.",https://bilder2.n-tv.de/img/incoming/crop23332537/9041326157-cImg_16_9-w1200/Liveticker1-grau-1-Kopie.jpg,2023-02-04T11:19:00Z,,"Der frühere US-Außenminister Mike Pompeo ist sich sicher, Wladimir Putin wäre nicht in die Ukraine einmarschiert, wenn Donald Trump noch Präsident gewesen wäre. In einem Interview mit der Sendung Tod… [+17306 chars]",,de,'Ukraine'
https://www.n-tv.de/politik/17-10-Bericht-Handelsdaten-zeigen-dass-China-Russlands-Krieg-unterstuetzt-trotz-Sanktionen--article23143824.html,https://www.n-tv.de/politik/17-10-Bericht-Handelsdaten-zeigen-dass-China-Russlands-Krieg-unterstuetzt-trotz-Sanktionen--article23143824.html,0,www.n-tv.de,"Ukraine-Krieg im Liveticker: +++ 17:10 Bericht: Handelsdaten zeigen, dass China Russlands Krieg unterstützt - trotz Sanktionen +++","Berlin, Washington, Br\u00fcssel - \u00fcberall. n-tv berichtet von allen wichtigen Schaupl\u00e4tzen der Innen- und Au\u00dfenpolitik.",https://bilder2.n-tv.de/img/incoming/crop23332537/9041326157-cImg_16_9-w1200/Liveticker1-grau-1-Kopie.jpg,2023-02-04T11:19:00Z,https://web.archive.org/web/20230204161522/https://www.n-tv.de/politik/17-10-Bericht-Handelsdaten-zeigen-dass-China-Russlands-Krieg-unterstuetzt-trotz-Sanktionen--article23143824.html,"Laut einem Bericht des Wall Street Journal (WSJ) hat China die russische Armee unter Verstoß gegen US-Sanktionen mit militärischen Mitteln unterstützt. Das Blatt bezieht sich auf russische Zolldaten,… [+21328 chars]",,de,'Ukraine'
https://www.n-tv.de/politik/21-18-Ukrainisches-Verteidigungsministerium-Moskau-nutzt-seine-ganze-Kraft-um-Bachmut-zu-umzingeln--article23143824.html,https://www.n-tv.de/politik/21-18-Ukrainisches-Verteidigungsministerium-Moskau-nutzt-seine-ganze-Kraft-um-Bachmut-zu-umzingeln--article23143824.html,0,www.n-tv.de,"Ukraine-Krieg im Liveticker: +++ 21:18 Ukrainisches Verteidigungsministerium: Moskau nutzt seine ganze Kraft, um Bachmut zu umzingeln +++","Berlin, Washington, Br\u00fcssel - \u00fcberall. n-tv berichtet von allen wichtigen Schaupl\u00e4tzen der Innen- und Au\u00dfenpolitik.",https://bilder2.n-tv.de/img/incoming/crop23332537/9041326157-cImg_16_9-w1200/Liveticker1-grau-1-Kopie.jpg,2023-02-04T11:19:00Z,,"Die stellvertretende Verteidigungsministerin Hanna Maliar betont, dass die russischen Streitkräfte in der vergangenen Woche ihre ganze Kraft darauf verwendet hätten, ""unsere Verteidigung zu durchbrec… [+27118 chars]",,de,'Nordstream'
https://www.n-tv.de/politik/12-54-Medwedew-Weitere-US-Waffenlieferungen-bedeuten-Brennen-der-Ukraine--article23143824.html,https://www.n-tv.de/politik/12-54-Medwedew-Weitere-US-Waffenlieferungen-bedeuten-Brennen-der-Ukraine--article23143824.html,0,www.n-tv.de,"Ukraine-Krieg im Liveticker: +++ 12:54 Medwedew: Weitere US-Waffenlieferungen bedeuten ""Brennen der Ukraine"" +++","Berlin, Washington, Br\u00fcssel - \u00fcberall. n-tv berichtet von allen wichtigen Schaupl\u00e4tzen der Innen- und Au\u00dfenpolitik.",https://bilder2.n-tv.de/img/incoming/crop23332537/9041326157-cImg_16_9-w1200/Liveticker1-grau-1-Kopie.jpg,2023-02-04T11:19:00Z,,Die Lieferung moderner Waffen aus den USA an die Ukraine lösen nach Darstellung des russischen Spitzenpolitikers Dmitri Medwedew nur weitere Vergeltungsschläge des russischen Militärs aus. Das gelte … [+14391 chars],,de,'Waffen'
https://www.n-tv.de/politik/13-58-Deutschland-wartet-auf-Beteiligung-von-Partnern-an-Panzerlieferungen--article23143824.html,https://www.n-tv.de/politik/13-58-Deutschland-wartet-auf-Beteiligung-von-Partnern-an-Panzerlieferungen--article23143824.html,0,www.n-tv.de,Ukraine-Krieg im Liveticker: +++ 13:58 Deutschland wartet auf Beteiligung von Partnern an Panzerlieferungen +++,"Berlin, Washington, Br\u00fcssel - \u00fcberall. n-tv berichtet von allen wichtigen Schaupl\u00e4tzen der Innen- und Au\u00dfenpolitik.",https://bilder2.n-tv.de/img/incoming/crop23332537/9041326157-cImg_16_9-w1200/Liveticker1-grau-1-Kopie.jpg,2023-02-04T11:19:00Z,,Die Bundesregierung wartet nach ihrer Entscheidung zur Lieferung von modernen Kampfpanzern des Typs Leopard 2A6 an die Ukraine noch auf konkrete Beteiligungen von Partnerstaaten. Während es für das ä… [+16331 chars],,de,'Nordstream'
https://www.zeit.de/news/2023-02/04/erst-regen-und-schnee-dann-sonnig-und-trocken,https://www.zeit.de/news/2023-02/04/erst-regen-und-schnee-dann-sonnig-und-trocken,0,www.zeit.de,"Vorhersage : Erst Regen und Schnee, dann sonnig und trocken",,,2023-02-04T11:38:13Z,https://web.archive.org/web/20230204115045/https://www.zeit.de/news/2023-02/04/erst-regen-und-schnee-dann-sonnig-und-trocken,"When browsing with ads:
We collect personal data and also transmit it to third-party providers
 that help us improve and finance our digital content. Some of the information stored on your device, … [+732 chars]",,de,'Schnee'
https://www.zeit.de/politik/ausland/2023-02/chinesischer-spionage-ballon-usa-reaktionen-deutschland,https://www.zeit.de/politik/ausland/2023-02/chinesischer-spionage-ballon-usa-reaktionen-deutschland,0,www.zeit.de,Spionage: Politiker zeigen sich alarmiert über mutmaßlichen Spionageballon,Auch wegen Chinas Nähe zu Russland äußern Politiker in Deutschland Besorgnis über verdächtige chinesische Ballons. Einige fordern einen nationalen Sicherheitsrat.,,2023-02-04T11:58:56Z,https://web.archive.org/web/20230204120613/https://www.zeit.de/politik/ausland/2023-02/chinesischer-spionage-ballon-usa-reaktionen-deutschland,"When browsing with ads:
We collect personal data and also transmit it to third-party providers
 that help us improve and finance our digital content. Some of the information stored on your device, … [+732 chars]",,de,'Russland'
https://www.stern.de/gesellschaft/regional/rheinland-pfalz-saarland/fahndung--geldautomat-im-saarland-gesprengt--taetern-gelingt-die-flucht-33166638.html,https://www.stern.de/gesellschaft/regional/rheinland-pfalz-saarland/fahndung--geldautomat-im-saarland-gesprengt--taetern-gelingt-die-flucht-33166638.html,0,www.stern.de,Fahndung: Geldautomat im Saarland gesprengt: Tätern gelingt die Flucht,"Nach der Sprengung eines Geldautomaten im saarländischen Eppelborn sind die Täter nach Polizeiangaben geflüchtet. Ob die Unbekannten Beute machten, war zunächst unklar. Wie die Polizei am Samstag mitteilte, waren die Täter mit mehreren Autos unterwegs. In der…",https://image.stern.de/33166640/t/sm/v2/w1440/r1.7778/-/04--urnnewsmldpacom2009010123020499472042v3w800h600l347t260r1977b1389jpeg---6e579d0da1415942.jpg,2023-02-04T12:28:18Z,https://web.archive.org/web/20230204130455/https://www.stern.de/gesellschaft/regional/rheinland-pfalz-saarland/fahndung--geldautomat-im-saarland-gesprengt--taetern-gelingt-die-flucht-33166638.html,"Nach der Sprengung eines Geldautomaten im saarländischen Eppelborn sind die Täter nach Polizeiangaben geflüchtet. Ob die Unbekannten Beute machten, war zunächst unklar. Wie die Polizei am Samstag mit… [+1301 chars]",,de,'Flucht'
https://www.stern.de/reise/europa/sonne-satt-statt-eisige-kaelte--neun-sonnige-reiseziele-in-europa-fuer-die-winterzeit-33147424.html,https://www.stern.de/reise/europa/sonne-satt-statt-eisige-kaelte--neun-sonnige-reiseziele-in-europa-fuer-die-winterzeit-33147424.html,0,www.stern.de,Raus aus dem Winterblues: Sonne satt statt eisige Kälte: Sonnige Reiseziele in Europa für die Winterzeit,"Es ist kalt, nass und dunkel draußen. Höchste Zeit also für eine Auszeit in der Sonne. Dafür brauchen Sie nicht einmal weit reisen – auch in Europa gibt es sonnenreiche Reiseziele für die Wintermonate.",https://image.stern.de/33147450/t/nL/v6/w1440/r1.7778/-/thodos.jpg,2023-02-04T12:34:00Z,,"Keine Lust mehr auf Regen, Wind und Temperaturen weit unter 10 Grad Celsius? Dann Koffer packen und ab in den Süden! So richtig weit müssen wir für die Winterflucht nicht einmal reisen. Auch in Europ… [+951 chars]",,de,'Kälte'
https://www.zeit.de/news/2023-02/04/gespraeche-ueber-panzerlieferung-erste-zusagen,https://www.zeit.de/news/2023-02/04/gespraeche-ueber-panzerlieferung-erste-zusagen,0,www.zeit.de,Ukraine-Krieg: Gespräche über Panzerlieferung - Erste Zusagen,,,2023-02-04T13:20:42Z,https://web.archive.org/web/20230204140610/https://www.zeit.de/news/2023-02/04/gespraeche-ueber-panzerlieferung-erste-zusagen,"When browsing with ads:
We collect personal data and also transmit it to third-party providers
 that help us improve and finance our digital content. Some of the information stored on your device, … [+732 chars]",,de,'Ukraine'
https://www.faz.net/aktuell/feuilleton/debatten/atomkraft-nein-danke-18652804.html,https://www.faz.net/aktuell/feuilleton/debatten/atomkraft-nein-danke-18652804.html,0,www.faz.net,"Atomkraft? Nein, danke!","Risiken, Kosten, Totgeburten: Die Nukleardebatte nützt dem Klima nicht – und bremst die Energiewende unnötig aus.",https://media1.faz.net/ppmedia/aktuell/politik/372095834/1.8654377/facebook_teaser/der-kuehlturm-des.jpg,2023-02-04T14:22:29Z,https://web.archive.org/web/20230204142435/http://www.faz.net/aktuell/feuilleton/debatten/atomkraft-nein-danke-18652804.html,"Wer heute auf die Karte Atomkraft setzt, um die globale Klimakatastrophe einzudämmen, setzt nicht auf Fortschritt, Freiheit oder Markteffizienz, sondern plädiert für das genaue Gegenteil. Atomenergie… [+4018 chars]",,de,'Atomenergie'
https://www.focus.de/reisen/urlaubs-check/baden-im-februar-das-sind-die-schoensten-strandziele-um-dem-winter-adieu-zu-sagen_id_183911972.html,https://www.focus.de/reisen/urlaubs-check/baden-im-februar-das-sind-die-schoensten-strandziele-um-dem-winter-adieu-zu-sagen_id_183911972.html,0,www.focus.de,"Baden im Februar - Die fünf besten Reiseziele, um dem Winter zu entfliehen","Keine Lust mehr auf Schnee, Eis und Kälte? Dann ganz schnell ab in wärmere Gefilde! Wir stellen fünf Urlaubsziele vor, an denen das Thermometer mindestens 30 Grad anzeigt und Sie Sonne, Strand und Meer in vollen Zügen genießen können. So können Sie dem Winter…",https://p6.focus.de/img/fotos/id_183913289/gettyimages-83629122.jpg?im=Crop%3D%280%2C0%2C2148%2C1073%29%3BResize%3D%281200%2C627%29&impolicy=perceptual&quality=medium&hash=2c0321c47261e4e41b9686cc034d178ada5179f1b893de086cb4519eba7ad96f,2023-02-04T15:00:37Z,https://web.archive.org/web/20230204160047/https://www.focus.de/reisen/urlaubs-check/baden-im-februar-das-sind-die-schoensten-strandziele-um-dem-winter-adieu-zu-sagen_id_183911972.html,"Keine Lust mehr auf Schnee, Eis und Kälte? Dann ganz schnell ab in wärmere Gefilde! Wir stellen fünf Urlaubsziele vor, an denen das Thermometer mindestens 30 Grad anzeigt und Sie Sonne, Strand und Me… [+7270 chars]",,de,'Kälte'
https://www.faz.net/aktuell/politik/ausland/wie-putins-angriffskrieg-die-ukraine-stark-gemacht-hat-18651865.html,https://www.faz.net/aktuell/politik/ausland/wie-putins-angriffskrieg-die-ukraine-stark-gemacht-hat-18651865.html,0,www.faz.net,Wie Putins Angriffskrieg die Ukraine stark gemacht hat,"Die Widerstandskraft der Ukraine ist erstaunlich und bewundernswert. Das Land besinnt sich auf seine alten, starken Werte. Und der Aggressor Putin schweißt es zusammen.",https://media1.faz.net/ppmedia/aktuell/422174272/1.8637779/facebook_teaser/franz-roubauds-kosaken-zu.jpg,2023-02-04T15:41:56Z,https://web.archive.org/web/20230204154425/http://www.faz.net/aktuell/politik/ausland/wie-putins-angriffskrieg-die-ukraine-stark-gemacht-hat-18651865.html,"Seit Beginn des Krieges ist die Stärkung und letztlich Rettung der Ukraine zu einer riesigen Gemeinschaftsaufgabe geworden. Die Europäische Union, die am Freitag mit dem Land ein Gipfeltreffen abhiel… [+4480 chars]",,de,'Putin'
https://www.faz.net/aktuell/politik/ukraine-liveticker-polen-bildet-ukrainische-soldaten-an-leopard-panzern-aus-18495964.html,https://www.faz.net/aktuell/politik/ukraine-liveticker-polen-bildet-ukrainische-soldaten-an-leopard-panzern-aus-18495964.html,0,www.faz.net,Ukraine-Liveblog: Polen bildet ukrainische Soldaten an Leopard-Panzern aus,Millionenstadt Odessa ohne Strom +++ USA überweisen Ukraine russische Gelder +++ Dutzende Kriegsgefangene ausgetauscht +++ alle Entwicklungen im Liveblog.,https://media1.faz.net/ppmedia/aktuell/781334040/1.8654587/facebook_teaser/der-polnische.jpg,2023-02-04T16:45:33Z,,"Die deutschen Ermittler haben zum jetzigen Zeitpunkt keine Belege dafür, dass Russland hinter den Explosionen an den Gas-Pipelines Nord Stream 1 und 2 steckt. Das ist derzeit nicht belegbar, die Ermi… [+1306 chars]",,de,'Ukraine'
https://www.stern.de/politik/deutschland/ukraine-krieg--wuest-warnt-vor-ueberlastung-durch-fluechtlinge-33167322.html,https://www.stern.de/politik/deutschland/ukraine-krieg--wuest-warnt-vor-ueberlastung-durch-fluechtlinge-33167322.html,0,www.stern.de,Ukraine-Krieg: Wüst warnt vor Überlastung durch Flüchtlinge,"Menschen, die vor dem Krieg in der Ukraine fliehen, seien in NRW ""herzlich willkommen"", sagt der Ministerpräsident. Doch das Land stoße an seine Grenzen - und benötige weitere Hilfe vom Bund.",https://image.stern.de/33167324/t/hB/v1/w1440/r1.7778/-/04--urnnewsmldpacom2009010123020499474232v3w800h600l230t443r1510b1163jpeg---fba7eb7c02f01c7d.jpg,2023-02-04T16:56:17Z,,"Menschen, die vor dem Krieg in der Ukraine fliehen, seien in NRW ""herzlich willkommen"", sagt der Ministerpräsident. Doch das Land stoße an seine Grenzen - und benötige weitere Hilfe vom Bund.
Nordrh… [+1729 chars]",,de,'Ukraine'
https://www.bild.de/politik/ausland/politik-ausland/hat-kim-waffen-an-putin-soeldner-geliefert-nordkorea-droht-usa-mit-reaktion-82735830.bild.html,https://www.bild.de/politik/ausland/politik-ausland/hat-kim-waffen-an-putin-soeldner-geliefert-nordkorea-droht-usa-mit-reaktion-82735830.bild.html,0,www.bild.de,Hat Kim Waffen an Putin geliefert? - Nordkorea droht USA mit „Reaktion“,Nordkorea hat erneut Vorwürfe aus den USA über Waffenlieferungen an Putins Söldnergrupppe Wagner zurückgewiesen.,https://bilder.bild.de/fotos/nordkorea-diktator-kim-jong-un-erfreut-sich-an-einem-seiner-zahlreichen-waffentests-390fc3bb25bd4b13b228870cadcc2359-82741480/Bild/12.bild.jpg?1675530341000,2023-02-04T16:57:54Z,,"Unterstützt Kim Jong-un (39) die Russen beim Krieg gegen die Ukraine?
Nordkorea hat erneut Vorwürfe aus den USA über Waffenlieferungen an Putins Söldnergruppe Wagner zurückgewiesen. Die Diktatur dro… [+2465 chars]",,de,'Waffen'
https://www.faz.net/aktuell/politik/ausland/new-start-nukleare-ruestungskontrolle-in-russischer-geiselhaft-18651470.html,https://www.faz.net/aktuell/politik/ausland/new-start-nukleare-ruestungskontrolle-in-russischer-geiselhaft-18651470.html,0,www.faz.net,Gastbeitrag zu New-START-Abkommen: Rüstungskontrolle in russischer Geiselhaft,"Die Abkehr Russlands von der nuklearen Rüstungskontrolle ist auch aus deutscher Sicht beunruhigend. Da der Ukrainekrieg alle Aufmerksamkeit bündelt, findet sie zu wenig Beachtung. Ein Gastbeitrag.",https://media1.faz.net/ppmedia/aktuell/politik/1339968855/1.8651469/facebook_teaser_fplus/militaerparade-in-moskau.jpg,2023-02-04T17:15:02Z,http://archive.md/20230204204658/http://www.faz.net/aktuell/politik/ausland/new-start-nukleare-ruestungskontrolle-in-russischer-geiselhaft-18651470.html,New START feiert am 5. Februar einen seiner letzten Geburtstage. Der Vertrag begrenzt noch bis Februar 2026 die Nuklear-Arsenale der USA und Russlands. Für Verhandlungen eines Nachfolgeabkommens blei… [+552 chars],,de,'Russland'
https://www.zeit.de/politik/ausland/2023-02/ukraine-ueberblick-russland-gefangenenaustausch-odessa-strom,https://www.zeit.de/politik/ausland/2023-02/ukraine-ueberblick-russland-gefangenenaustausch-odessa-strom,0,www.zeit.de,"Ukraine-Überblick: Russland und Ukraine tauschen Gefangene aus, Stromausfall in Odessa",Rund 180 Kriegsgefangene können in ihre Heimat zurückkehren. In der Hafenstadt Odessa legt ein beschädigtes Umspannwerk die Energieversorgung lahm. Das war der Tag,,2023-02-04T17:23:24Z,,"When browsing with ads:
We collect personal data and also transmit it to third-party providers
 that help us improve and finance our digital content. Some of the information stored on your device, … [+732 chars]",,de,'Ukraine'
https://www.n-tv.de/wirtschaft/Wir-sollten-ueber-aktive-Preisbeobachtung-nachdenken-article23891143.html,https://www.n-tv.de/wirtschaft/Wir-sollten-ueber-aktive-Preisbeobachtung-nachdenken-article23891143.html,0,www.n-tv.de,"Frühwarnsystem für Inflation: ""Wir sollten über aktive Preisbeobachtung nachdenken""","Die Volkswirtin Isabella Weber gilt als Erfinderin des Gaspreisdeckels. Sie sucht aber auch nach Lösungen im Kampf gegen steigende Preise. Der Staat sollte die ""systemisch relevanten"" Preistreiber am Markt finden, plädiert sie. Dann könne er ""zielgenau interv…",https://bilder1.n-tv.de/img/incoming/crop23891220/0981324884-cImg_16_9-w1200/382134380.jpg,2023-02-04T17:35:07Z,,Die Volkswirtin Isabella Weber gilt als Erfinderin des Gaspreisdeckels. Darüber hinaus sucht sie aber auch nach Lösungen im Kampf gegen steigende Preise. Bei der aktuellen Inflation handelt es sich i… [+9997 chars],,de,'Ukraine'
https://www.diepresse.com/6247387/taiwanischer-diplomat-xi-hat-putins-fehler-gesehen-und-muesste-sehr-grausam-vorgehen,https://www.diepresse.com/6247387/taiwanischer-diplomat-xi-hat-putins-fehler-gesehen-und-muesste-sehr-grausam-vorgehen,0,www.diepresse.com,"Taiwanischer Diplomat: ""Xi hat Putins Fehler gesehen und müsste sehr grausam vorgehen""","Der Vertreter Taiwans in Deutschland, Shieh Jhy-Wey, erwartet bei einem möglichen Angriff Chinas einen „echten Blitzkrieg“. Der Diplomat fordert von Deutschland mehr Distanz zu China.",https://media.diepresse.com/social_diepresse_nachrichten/images/uploads_1200/3/d/b/6247387/B1C8A72B-D767-45BC-9A66-5BBA3613C31E_v0_l.jpg,2023-02-04T18:05:00Z,,"Der Vertreter Taiwans in Deutschland, Shieh Jhy-Wey, erwartet bei einem möglichen Angriff Chinas einen echten Blitzkrieg. Der Diplomat fordert von Deutschland mehr Distanz zu China.
China zieht nach… [+565 chars]",,de,'Ukraine'
https://www.welt.de/politik/ausland/article243595721/Ukraine-News-Rund-eine-halbe-Million-Haushalte-in-Odessa-ohne-Strom.html,https://www.welt.de/politik/ausland/article243595721/Ukraine-News-Rund-eine-halbe-Million-Haushalte-in-Odessa-ohne-Strom.html,0,www.welt.de,„Ausmaß ist beträchtlich“ – Rund eine halbe Million Haushalte in Odessa ohne Strom,Infolge der russischen Angriffe kam es in der Südukraine zu einer Havarie in einem Umspannwerk. Eine schnelle Wiederherstellung der Stromversorgung sei nicht möglich. Dmitri Medwedjew droht derweil nach den Waffenlieferungen an die Ukraine mit Vergeltungsschl…,https://img.welt.de/img/politik/ausland/mobile243603153/7701353177-ci16x9-w1200/UKRAINE-RUSSIA-CONFILCT-WAR.jpg,2023-02-04T18:20:00Z,https://web.archive.org/web/20230204192151/https://www.welt.de/politik/ausland/article243595721/Ukraine-News-Rund-eine-halbe-Million-Haushalte-in-Odessa-ohne-Strom.html,"In der südukrainischen Hafenstadt Odessa sind nach einer Havarie in einem Umspannwerk rund 500.000 Haushalte ohne Strom. Die Situation ist komplex, das Ausmaß des Unfalls ist beträchtlich, schrieb Mi… [+20864 chars]",,de,'Ukraine'
https://www.sueddeutsche.de/politik/ukraine-leopard-panzer-partner-1.5745134,https://www.sueddeutsche.de/politik/ukraine-leopard-panzer-partner-1.5745134,0,www.sueddeutsche.de,"Probleme bei Panzer-Allianz: Ukraine sorgt sich um ""Leopard""-Unterstützung","Erst wurde Kanzler Scholz Zögern vorgeworfen, dann entschied er sich für die Lieferung von ""Leopard""-Kampfpanzern - und jetzt? Zögern andere tatsächlich.",https://www.sueddeutsche.de/image/sz.1.5745135/1200x675?v=1675536557,2023-02-04T18:45:20Z,http://archive.md/20230204185633/https://www.sueddeutsche.de/politik/ukraine-leopard-panzer-partner-1.5745134,"Erst wurde Kanzler Scholz Zögern vorgeworfen, dann entschied er sich für die Lieferung von ""Leopard""-Kampfpanzern - und jetzt? Zögern andere tatsächlich.Die Ukraine ist besorgt, dass nach der Grundsa… [+720 chars]",,de,'Ukraine'
https://www.dw.com/de/waffen-f%C3%BCr-die-ukraine-stresstest-f%C3%BCr-transatlantische-beziehungen/a-64602276,https://www.dw.com/de/waffen-f%C3%BCr-die-ukraine-stresstest-f%C3%BCr-transatlantische-beziehungen/a-64602276,0,www.dw.com,Waffen für die Ukraine: Stresstest für transatlantische Beziehungen,"Deutschland liefert Leopard-Panzer, die USA Abrams-Kampfpanzer in die Ukraine. Ergebnis eines harten Ringens zwischen den beiden Partnern.",https://static.dw.com/image/63466921_6.jpg,2023-02-04T19:20:00Z,,Am 2. Februar grüßte in den USA wieder einmal das Murmeltier - in einigen Orten wurde das Tier traditionell zum weiteren Winterwetter befragt. Weltweit bekannt wurde diese Tradition 1993 durch die Fi… [+5258 chars],,de,'Waffen'
https://www.zeit.de/2023/06/international-board-books-young-people-vizepraesident-russe,https://www.zeit.de/2023/06/international-board-books-young-people-vizepraesident-russe,0,www.zeit.de,International Board on Books for Young People: Russen raus?,Das International Board on Books for Young People vereint Kinderbuchschaffende aus 80 Ländern. Doch nun spaltet der Ukraine-Krieg auch die Jugendliteratur-Gemeinschaft.,,2023-02-04T19:45:47Z,https://web.archive.org/web/20230203052613/https://www.zeit.de/2023/06/international-board-books-young-people-vizepraesident-russe,"When browsing with ads:
We collect personal data and also transmit it to third-party providers
 that help us improve and finance our digital content. Some of the information stored on your device, … [+732 chars]",,de,'Ukraine'
