index,url,valid,domain,title,description,image,published,archive,content,quote,language,keyword
https://www.focus.de/politik/gastbeitrag-von-gabor-steingart-deutschland-im-abwaertssog-wer-jetzt-wohlstandsverluste-hinnehmen-muss_id_195301570.html,https://www.focus.de/politik/gastbeitrag-von-gabor-steingart-deutschland-im-abwaertssog-wer-jetzt-wohlstandsverluste-hinnehmen-muss_id_195301570.html,0,www.focus.de,Gastbeitrag von Gabor Steingart - Der deutsche Abwärtssog reißt nicht nur Geringverdiener in die Tiefe,"In den stürmischen Gewässern von Rezession und Inflation schreibt Deutschland sein jüngstes Kapitel wirtschaftlicher Turbulenzen. Wie von unsichtbaren Fäden gezogen, treibt das Land in einen Strudel, der niemanden unberührt lässt.Von Gastautor Gabor Steingart…",https://p6.focus.de/img/fotos/id_195301900/st2.jpg?im=Crop%3D%280%2C117%2C780%2C389%29%3BResize%3D%281200%2C627%29&impolicy=perceptual&quality=mediumHigh&hash=241b1f097778ac17e746567c6829b9118736e4439cbf2828a06104f9c357fac2,2023-06-02T07:40:44Z,https://web.archive.org/web/20230602094223/https://www.focus.de/politik/gastbeitrag-von-gabor-steingart-deutschland-im-abwaertssog-wer-jetzt-wohlstandsverluste-hinnehmen-muss_id_195301570.html,"In den stürmischen Gewässern von Rezession und Inflation schreibt Deutschland sein jüngstes Kapitel wirtschaftlicher Turbulenzen. Wie von unsichtbaren Fäden gezogen, treibt das Land in einen Strudel,… [+5093 chars]",,de,'Inflation'
"https://www.cio.de/a/intel-verhandelt-mit-der-bundesregierung,3712769?utm_source=Seiten_3932&utm_medium=RSS&utm_campaign=RSS-Feeds","https://www.cio.de/a/intel-verhandelt-mit-der-bundesregierung,3712769?utm_source=Seiten_3932&utm_medium=RSS&utm_campaign=RSS-Feeds",0,www.cio.de,Ruf nach Finanzhilfen: Intel will mehr Geld von der Bundesregierung,Angesichts steigender Kosten verhandelt der US-Chiphersteller Intel nach eigenen Angaben mit der Bundesregierung über den Umfang von Finanzhilfen.,https://images.cio.de/bdb/3374898/640x360.jpg,2023-06-02T08:02:00Z,,"Intel rechnet mit höheren Kosten für sein geplantes Werk in Magdeburg.Foto: Intel
""Wir arbeiten eng mit der deutschen Bundesregierung zusammen, um die bestehende Kostenlücke zu schließen"", teilte ei… [+1356 chars]",,de,'Inflation'
https://taz.de/Armut-in-Ostdeutschland/!5937059/,https://taz.de/Armut-in-Ostdeutschland/!5937059/,0,taz.de,Armut in Ostdeutschland: „Ich muss jeden Cent umdrehen“,"Seit Monaten leiden Menschen mit wenig Einkommen unter den hohen Preisen. Besonders hart trifft es Ostdeutschland, wo Löhne und Renten niedriger sind.",https://taz.de/picture/6298457/948/32950247-1.jpeg,2023-06-02T08:13:00Z,https://web.archive.org/web/20230602103615/https://taz.de/Armut-in-Ostdeutschland/!5937059/,"Seit Monaten leiden Menschen mit wenig Einkommen unter den hohen Preisen. Besonders hart trifft es Ostdeutschland, wo Löhne und Renten niedriger sind.
Hilfe bei der Tafel: Wenn das Geld nicht mehr f… [+5835 chars]",,de,'Armut'
https://www.wiwo.de/politik/ausland/tuerkei-urlaub-hohe-inflation-fallende-lira-worauf-sich-tuerkei-urlauber-jetzt-einstellen-muessen-/29182224.html,https://www.wiwo.de/politik/ausland/tuerkei-urlaub-hohe-inflation-fallende-lira-worauf-sich-tuerkei-urlauber-jetzt-einstellen-muessen-/29182224.html,0,www.wiwo.de,"Türkei-Urlaub: Hohe Inflation, fallende Lira: Worauf sich Türkei-Urlauber jetzt einstellen müssen","Im Tourismus verzeichnet die Türkei Rekorde. Doch das Land ist längst nicht mehr so billig wie einst. Nun stehen wichtige wirtschaftspolitische Entscheidungen an, die Folgen haben dürften für Urlauber aus dem Ausland.",https://www.wiwo.de/images/230995280-dpa-3/29182454/3-format11240.jpg,2023-06-02T08:31:10Z,https://web.archive.org/web/20230602060822/https://www.wiwo.de/politik/ausland/tuerkei-urlaub-hohe-inflation-fallende-lira-worauf-sich-tuerkei-urlauber-jetzt-einstellen-muessen-/29182224.html,Der Galata-Turm im Herzen Istanbuls ist einer der Touristen-Hotspots der Metropole und wird von der Stadtregierung dementsprechend vermarktet. Noch in den Nullerjahren war die Gegend um den im 14. Ja… [+6382 chars],,de,'Inflation'
https://www.handelsblatt.com/politik/international/liveblog-zum-ukraine-krieg-kiew-mit-dutzenden-drohnen-und-marschflugkoerpern-angegriffen-kaempfe-in-russischer-grenzregion/27982126.html,https://www.handelsblatt.com/politik/international/liveblog-zum-ukraine-krieg-kiew-mit-dutzenden-drohnen-und-marschflugkoerpern-angegriffen-kaempfe-in-russischer-grenzregion/27982126.html,0,www.handelsblatt.com,+++ Ukraine-Krieg +++: Kiew mit Dutzenden Drohnen und Marschflugkörpern angegriffen – Kämpfe in russischer Grenzregion,"London: Russland muss entscheiden, ob mehr Schutz der Grenzregion nötig ist +++ Selenski: Russlands Niederlage rückt näher +++ Schweizer Parlament stimmt gegen indirekte Rüstungsexporte an Ukraine +++ Der Newsblog.",https://www.handelsblatt.com/images/kiew/29183932/2-format2003.jpg,2023-06-02T09:07:17Z,https://web.archive.org/web/20230602095341/https://www.handelsblatt.com/politik/international/liveblog-zum-ukraine-krieg-kiew-mit-dutzenden-drohnen-und-marschflugkoerpern-angegriffen-kaempfe-in-russischer-grenzregion/27982126.html,"<li>Herr Klaus Thiele01.06.2023, 14:02 Uhr
Welche Idioten kaufen denn auch Waffen in der Schweiz, wenn man damit nicht machen kann was man will. Die Weitergabe dieser Waffen zu untersagen an ein Lan… [+4807 chars]",,de,'Russland'
https://www.tagesspiegel.de/wirtschaft/preiskampf-in-supermarkten-hersteller-wollen-lebensmittelpreise-weiter-erhohen-9910577.html,https://www.tagesspiegel.de/wirtschaft/preiskampf-in-supermarkten-hersteller-wollen-lebensmittelpreise-weiter-erhohen-9910577.html,0,www.tagesspiegel.de,Preiskampf in Supermärkten : Hersteller wollen Lebensmittelpreise weiter erhöhen,Die Inflation sinkt. Erste Produkte in Supermärkten sind wieder günstiger. Gleichzeitig wollen Hersteller Erhöhungen durchsetzen. Mit welchen Preisen müssen Verbraucher nun rechnen?,https://www.tagesspiegel.de/images/symbolbild-lebensmittelpreise-nahaufnahme-von-einem-kassenbeleg-vor-einem-einkaufwagen-mit-lebensmitteln-composing/alternates/BASE_16_9_W1400/symbolbild-lebensmittelpreise-nahaufnahme-von-einem-kassenbeleg-vor-einem-einkaufwagen-mit-lebensmitteln-composing-.jpeg,2023-06-02T09:13:09Z,http://archive.md/20230602095539/https://www.tagesspiegel.de/wirtschaft/preiskampf-in-supermarkten-hersteller-wollen-lebensmittelpreise-weiter-erhohen-9910577.html,"Der Preiskampf in den Supermärkten geht in die nächste Runde: Während Händler Preissenkungen in Aussicht stellen, wehren sich die Hersteller von Waren des täglichen Bedarfs dagegen. Wir müssen in bes… [+162 chars]",,de,'Inflation'
https://www.stern.de/wirtschaft/news/umfrage--mehrheit-in-deutschland-rechnet-mit-weiter-steigenden-preisen-33523586.html,https://www.stern.de/wirtschaft/news/umfrage--mehrheit-in-deutschland-rechnet-mit-weiter-steigenden-preisen-33523586.html,0,www.stern.de,Umfrage: Mehrheit in Deutschland rechnet mit weiter steigenden Preisen,"Die Inflation ist in den letzten Monaten etwas zurückgegangen, doch die meisten Menschen in Deutschland glauben nicht an eine dauerhafte Entspannung.",https://image.stern.de/33523588/t/Fd/v1/w1440/r1.7778/-/02--urnnewsmldpacom2009010123060299916648v3w800h600l852t120r1952b1283jpeg---8a6af60895f6f1fa.jpg,2023-06-02T10:06:52Z,https://web.archive.org/web/20230602102802/https://www.stern.de/wirtschaft/news/umfrage--mehrheit-in-deutschland-rechnet-mit-weiter-steigenden-preisen-33523586.html,"Die Inflation ist in den letzten Monaten etwas zurückgegangen, doch die meisten Menschen in Deutschland glauben nicht an eine dauerhafte Entspannung.
Die Mehrheit der Menschen in Deutschland traut d… [+1964 chars]",,de,'Inflation'
https://www.morgenpost.de/wirtschaft/article238566353/Mehrheit-rechnet-mit-weiter-steigenden-Preisen.html,https://www.morgenpost.de/wirtschaft/article238566353/Mehrheit-rechnet-mit-weiter-steigenden-Preisen.html,0,www.morgenpost.de,Umfrage: Mehrheit rechnet mit weiter steigenden Preisen,"Die Inflation ist in den letzten Monaten etwas zurückgegangen, doch die meisten Menschen in Deutschland glauben nicht an eine dauerhafte Entspannung.",https://img.morgenpost.de/img/wirtschaft/crop238566351/5432605985-w820-cv16_9-q85/Shoppen.jpg,2023-06-02T10:07:46Z,https://web.archive.org/web/20230602120549/https://www.morgenpost.de/wirtschaft/article238566353/Mehrheit-rechnet-mit-weiter-steigenden-Preisen.html,"Frankfurt/Main. Die Mehrheit der Menschen in Deutschland traut der jüngsten Entspannung bei der Teuerungsrate nicht und rechnet mit weiteren Preissteigerungen.
Zwar habe die Zahl der Konsumenten abg… [+1818 chars]",,de,'Inflation'
https://www.pcgames.de/The-Legend-of-Zelda-Tears-of-the-Kingdom-Spiel-67721/Tipps/Ruestung-Fundort-Aero-Hitze-Kaelte-1421073/,https://www.pcgames.de/The-Legend-of-Zelda-Tears-of-the-Kingdom-Spiel-67721/Tipps/Ruestung-Fundort-Aero-Hitze-Kaelte-1421073/,0,www.pcgames.de,Zelda: Tears of the Kingdom - Wichtige Rüstungen und Outfits - Tipps zu Fundorten,"In Zelda: Tears of the Kingdom wichtige Outfits und Rüstungen finden - Wir bieten euch Tipps zu den Fundorten für Schutz vor Hitze, Kälte und mehr. Die Locations der wichtigsten Rüstungen findet ihr in diesem Guide.",https://www.pcgames.de/screenshots/medium/2023/02/Zelda_Tears_of_the_Kingdom_Analyse-17--pc-games.jpg,2023-06-02T10:13:00Z,https://web.archive.org/web/20230602122209/https://www.pcgames.de/The-Legend-of-Zelda-Tears-of-the-Kingdom-Spiel-67721/Tipps/Ruestung-Fundort-Aero-Hitze-Kaelte-1421073/,"Schutz gegen Hitze, Kälte und Feuer? Hilfe beim Klettern, auch bei Regen? Wir bieten euch Tipps zu den Fundorten der wichtigsten Rüstungen und Outfits in Zelda: Tears of the Kingdom. Einige der Outfi… [+9437 chars]",,de,'Kälte'
https://www.diepresse.com/6295270/schwache-hasen-am-maisfeld-und-gruene-kohle-in-niederoesterreich,https://www.diepresse.com/6295270/schwache-hasen-am-maisfeld-und-gruene-kohle-in-niederoesterreich,0,www.diepresse.com,Schwache Hasen am Maisfeld und Grüne Kohle in Niederösterreich,"Die Klimanews diese Woche außerdem mit Geldsegen für Klimaforschung und neuen Grenzwerten, die unsere Erde fit halten.",https://www.diepresse.com/assets_v2/images/diepresse_nachrichten.png,2023-06-02T12:30:00Z,https://web.archive.org/web/20230602143741/https://www.diepresse.com/6295270/schwache-hasen-am-maisfeld-und-gruene-kohle-in-niederoesterreich,"Die Klimanews diese Woche außerdem mit Geldsegen für Klimaforschung und neuen Grenzwerten, die unsere Erde fit halten.
Neues Labor in NÖ: Es grünt so grün im Kohlewerk
Zwei Reaktoren zur Gewinnung … [+3600 chars]",,de,'Kohle'
https://www.faz.net/aktuell/politik/ukraine-liveticker-wagner-chef-truppen-zu-99-prozent-aus-bachmut-abgezogen-faz-18495964.html,https://www.faz.net/aktuell/politik/ukraine-liveticker-wagner-chef-truppen-zu-99-prozent-aus-bachmut-abgezogen-faz-18495964.html,0,www.faz.net,Ukraine-Liveblog: Wagner-Chef: Truppen zu 99 Prozent aus Bachmut abgezogen,Bleiben jedoch weiter im Gebiet Donezk stationiert +++ Berlin beschafft 66 Truppentransporter für Kiew +++ Amerika kauft Gepard-Luftabwehrsysteme für die Ukraine +++ alle Entwicklungen im Liveblog,https://media1.faz.net/ppmedia/aktuell/politik/513266099/1.8938737/facebook_teaser/jewgeni-prigoschin-chef-der.jpg,2023-06-02T18:59:56Z,https://web.archive.org/web/20230602191549/https://www.faz.net/aktuell/politik/ukraine-liveticker-wagner-chef-truppen-zu-99-prozent-aus-bachmut-abgezogen-faz-18495964.html,"Die Ukraine und Russland schließen nach Einschätzung Chinas die Möglichkeit von Friedensverhandlungen nicht aus. Er glaube, dass keine der beiden Konfliktparteien die Tür für Verhandlungen fest versc… [+995 chars]",,de,'Ukraine'
https://www.wiwo.de/technologie/wirtschaft-von-oben/wirtschaft-von-oben-212-britische-atomkraft-hier-manifestieren-sich-die-spannungen-zwischen-china-und-dem-westen-in-der-britischen-kernenergie/29183042.html,https://www.wiwo.de/technologie/wirtschaft-von-oben/wirtschaft-von-oben-212-britische-atomkraft-hier-manifestieren-sich-die-spannungen-zwischen-china-und-dem-westen-in-der-britischen-kernenergie/29183042.html,0,www.wiwo.de,Wirtschaft von oben: Hier manifestieren sich die Spannungen zwischen China und dem Westen in der britischen Kernenergie,"Der Bau von Hinkley Point C, einer der größten Atomreaktoren Europas, schreitet mit chinesischer Beteiligung voran, wie exklusive Satellitenbilder zeigen. Schon jetzt aber ist er ein Mahnmal für ausufernde Kosten. Und es kracht gewaltig zwischen Chinesen, Fra…",https://www.wiwo.de/images/teaserbild-hinkleypoint_c_2023_04_03_liveeo_spot-jpg/29183064/2-format11240.jpg,2023-06-03T06:35:38Z,https://web.archive.org/web/20230603093210/https://www.wiwo.de/technologie/wirtschaft-von-oben/wirtschaft-von-oben-212-britische-atomkraft-hier-manifestieren-sich-die-spannungen-zwischen-china-und-dem-westen-in-der-britischen-kernenergie/29183042.html,"Der Lärm von Baumaschinen und Generatoren mischt sich in die kalte Meeresluft, es riecht nach Diesel. Dutzende Baukräne ragen über dem gigantischen Areal in die Höhe. Seit dem Baubeginn im März 2017 … [+9508 chars]",,de,'Kosten'
https://www.wiwo.de/technologie/wirtschaft-von-oben/wirtschaft-von-oben-212-britische-atomkraft-hier-steht-ein-mahnmal-fuer-die-ausufernden-kosten-der-kernenergie/29183042.html,https://www.wiwo.de/technologie/wirtschaft-von-oben/wirtschaft-von-oben-212-britische-atomkraft-hier-steht-ein-mahnmal-fuer-die-ausufernden-kosten-der-kernenergie/29183042.html,0,www.wiwo.de,Wirtschaft von oben: Hier steht ein Mahnmal für die ausufernden Kosten der Kernenergie,"Der Bau von Hinkley Point C, einer der größten Atomreaktoren Europas, schreitet mit chinesischer Beteiligung voran, wie exklusive Satellitenbilder zeigen. Schon jetzt aber ist er ein Mahnmal für ausufernde Kosten. Und es kracht gewaltig zwischen Chinesen, Fra…",https://www.wiwo.de/images/teaserbild-hinkleypoint_c_2023_04_03_liveeo_spot-jpg/29183064/2-format11240.jpg,2023-06-03T06:35:38Z,https://web.archive.org/web/20230603083856/https://www.wiwo.de/technologie/wirtschaft-von-oben/wirtschaft-von-oben-212-britische-atomkraft-hier-steht-ein-mahnmal-fuer-die-ausufernden-kosten-der-kernenergie/29183042.html,"Der Lärm von Baumaschinen und Generatoren mischt sich in die kalte Meeresluft, es riecht nach Diesel. Dutzende Baukräne ragen über dem gigantischen Areal in die Höhe. Seit dem Baubeginn im März 2017 … [+9479 chars]",,de,'Teuer'
https://www.bild.de/politik/ausland/politik-ausland/kampfname-walkuere-diese-drohne-soll-der-ukraine-zum-sieg-verhelfen-84160994.bild.html,https://www.bild.de/politik/ausland/politik-ausland/kampfname-walkuere-diese-drohne-soll-der-ukraine-zum-sieg-verhelfen-84160994.bild.html,0,www.bild.de,Kampfname „Walküre“ - Diese Drohne soll der Ukraine zum Sieg verhelfen,"Es sind kleine, aber sehr effektive Helfer: unbemannte Fluggeräte.Foto: Michael Brochstein/dpa","https://images.bild.de/6479edf7fc1c627d0842f0c6/523acbafdb957d6d5eb647ed8b9e33a7,1ab6ffa2?w=1280",2023-06-03T08:49:12Z,https://web.archive.org/web/20230603101657/https://www.bild.de/politik/ausland/politik-ausland/kampfname-walkuere-diese-drohne-soll-der-ukraine-zum-sieg-verhelfen-84160994.bild.html,"Es sind kleine, aber sehr effektive Helfer: unbemannte Fluggeräte, also Drohnen. Sie werden sowohl von den ukrainischen als auch den russischen Streitkräften massiv eingesetzt.
Neben großen und teur… [+2043 chars]",,de,'Teuer'
https://www.faz.net/aktuell/wirtschaft/unternehmen/lebensmittelpreise-streit-um-den-richtigen-preis-18937425.html,https://www.faz.net/aktuell/wirtschaft/unternehmen/lebensmittelpreise-streit-um-den-richtigen-preis-18937425.html,0,www.faz.net,Lebensmittel und Inflation: Streit um den richtigen Preis,"Rabatte sollten nicht über die hohen Lebensmittelpreise hinwegtäuschen: Während Händler versuchen, sich mit ihren Angeboten zu unterbieten, wollen viele Hersteller weiter die Preise erhöhen.",https://media0.faz.net/ppmedia/aktuell/1676752981/1.8937440/facebook_teaser/frankfurt-eine-rentnerin-kauft.jpg,2023-06-03T11:03:02Z,http://archive.md/20230603111159/https://www.faz.net/aktuell/wirtschaft/unternehmen/lebensmittelpreise-streit-um-den-richtigen-preis-18937425.html,"Der aktuelle Lidl -Prospekt wirbt mit hohen Rabatten. Zum 50. Jubiläum senkt der Discounter den Preis einzelner Produkte deutlich, manche werden sogar um bis zur Hälfte im Preis reduziert. Mehr als g… [+2840 chars]",,de,'Inflation'
https://www.focus.de/finanzen/finanznachrichten/persil-schwarzkopf-bref-preiserhoehungen-bei-henkel-verteuern-haarpflege-und-waeschewaschen_id_195585950.html,https://www.focus.de/finanzen/finanznachrichten/persil-schwarzkopf-bref-preiserhoehungen-bei-henkel-verteuern-haarpflege-und-waeschewaschen_id_195585950.html,0,www.focus.de,"Persil, Schwarzkopf, Bref - Preiserhöhungen bei Henkel verteuern Haarpflege und Wäschewaschen","Der Konzern Henkel hat angekündigt, die Preise seiner Konsumgüter weiter zu erhöhen. Nach deutlichen Teuerungen im Jahr 2022 dürften die Preise beliebter Henkel-Marken wie Persil, Schwarzkopf und Bref also weiter steigen.Von FOCUS-online-Redakteur Christian M…",https://p6.focus.de/img/fotos/id_195585957/persil-hersteller-he-78245754.jpg?im=Crop%3D%280%2C288%2C3464%2C1732%29%3BResize%3D%281200%2C627%29&impolicy=perceptual&quality=mediumHigh&hash=b552292576dcd8d71fe0c5d0aec5636e73d8015ccc32e63a17a20183447c8bb8,2023-06-05T12:28:53Z,,"<ul><li>
Kommentare</li><li>
E-Mail</li><li>
Teilen</li><li>
Mehr</li><li>
Twitter</li><li>
Drucken</li><li>
Feedback</li><li>
Fehler meldenSie haben einen Fehler gefunden?
Bitte markieren S… [+4250 chars]",,de,'Teuer'
