index,url,valid,domain,title,description,image,published,archive,content,quote,language,keyword
https://www.stern.de/news/usa-liefern-der-ukraine-umstrittene-streumunition-33630180.html,https://www.stern.de/news/usa-liefern-der-ukraine-umstrittene-streumunition-33630180.html,0,www.stern.de,USA liefern der Ukraine umstrittene Streumunition,"Die USA liefern der Ukraine im Krieg gegen Russland umstrittene Streumunition. Die Streumunition ist Teil eines neuen Rüstungspakets für die Ukraine, wie das US-Verteidigungsministerium am Freitag in Washington mitteilte. Der Nationale Sicherheitsberater von …",https://image.stern.de/33630182/t/8E/v1/w1440/r1.7778/-/07--streubombe-in-der-ukraine---115baf667992f712.jpg,2023-07-07T18:57:01Z,https://web.archive.org/web/20230707191329/https://www.stern.de/news/usa-liefern-der-ukraine-umstrittene-streumunition-33630180.html,"Die USA liefern der Ukraine im Krieg gegen Russland umstrittene Streumunition. Die Streumunition ist Teil eines neuen Rüstungspakets für die Ukraine, wie das US-Verteidigungsministerium am Freitag in… [+1450 chars]",,de,'Russland'
https://www.bild.de/politik/ausland/politik-ausland/umstrittene-waffe-usa-wollen-ukraine-streumunition-liefern-84602884.bild.html,https://www.bild.de/politik/ausland/politik-ausland/umstrittene-waffe-usa-wollen-ukraine-streumunition-liefern-84602884.bild.html,0,www.bild.de,Umstrittene Waffe - USA liefern Ukraine Streumunition,Die US-Regierung hat entschieden: Die ukrainischen Streitkräfte sollen mit Streumunition beliefert werden. BILD erklärt die kontroverse Waffe.,"https://images.bild.de/64a7fa38b3deec2d263e1d38/8c4820a3b1b56103fd5842de0e7efa3d,9ee35421?w=1280",2023-07-07T18:58:54Z,,"Die US-Regierung hat entschieden: Die ukrainischen Streitkräfte sollen mit Streumunition beliefert werden.
Bereits im Februar hatten ukrainische Regierungsvertreter mehrfach um Streumunition gebeten… [+3743 chars]",,de,'Ukraine'
https://www.n-tv.de/politik/USA-liefern-der-Ukraine-Streumunition-article24245923.html,https://www.n-tv.de/politik/USA-liefern-der-Ukraine-Streumunition-article24245923.html,0,www.n-tv.de,"""Entscheidung lang aufgeschoben"": USA wollen der Ukraine Streumunition liefern","Russland setzt sie in seinem Angriffskrieg bereits ein, doch sie ist international geächtet: Streumunition. US-Präsident Biden entschließt sich trotz der ihm bekannten Risiken, Kiew die umstrittenen Raketen und Bomben zu liefern.",https://bilder3.n-tv.de/img/incoming/crop24245934/1381324456-cImg_16_9-w1200/415897834.jpg,2023-07-07T19:12:00Z,,"Russland setzt sie in seinem Angriffskrieg bereits ein, doch sie ist international geächtet: Streumunition. US-Präsident Biden entschließt sich trotz der ihm bekannten Risiken, Kiew die umstrittenen … [+4174 chars]",,de,'Ukraine'
https://www.stern.de/politik/ausland/usa-liefern-der-ukraine-streumunition---schwierige-entscheidung--33630204.html,https://www.stern.de/politik/ausland/usa-liefern-der-ukraine-streumunition---schwierige-entscheidung--33630204.html,0,www.stern.de,"""Schwierige Entscheidung"": USA liefern der Ukraine umstrittene Streumunition","Die USA liefern der Ukraine im Krieg gegen Russland umstrittene Streumunition. Das teilt das US-Verteidigungsministerium in Washington mit. Biden-Berater sprechen von einer ""schwierigen"", aber notwendigen Entscheidung.",https://image.stern.de/33630206/t/y0/v1/w1440/r1.7778/-/usa-lieferung-ukraine-streumunition.jpg,2023-07-07T19:13:35Z,https://web.archive.org/web/20230707225519/https://www.stern.de/politik/ausland/usa-liefern-der-ukraine-streumunition---schwierige-entscheidung--33630204.html,"Die USA liefern der Ukraine im Krieg gegen Russland umstrittene Streumunition. Das teilt das US-Verteidigungsministerium in Washington mit. Biden-Berater sprechen von einer ""schwierigen"", aber notwen… [+3176 chars]",,de,'Ukraine'
https://www.stern.de/politik/ausland/waffen--gefaehrlich-und-geaechtet--streubomben-fuer-die-ukraine--33630296.html,https://www.stern.de/politik/ausland/waffen--gefaehrlich-und-geaechtet--streubomben-fuer-die-ukraine--33630296.html,0,www.stern.de,Waffen: Gefährlich und geächtet: Streubomben für die Ukraine?,"Abgerissene Hände, verstümmelte Beine: Fotos von Streubomben-Opfern zeigen das Leid, das diese Waffen anrichten. Jetzt soll die ukrainische Armee von den USA damit versorgt werden.",https://image.stern.de/33630298/t/6U/v1/w1440/r1.7778/-/07--urnnewsmldpacom2009010123070799321772v3w800h600l638t425r1918b1276jpeg---c8c33cd96a228c67.jpg,2023-07-07T19:15:11Z,,"Abgerissene Hände, verstümmelte Beine: Fotos von Streubomben-Opfern zeigen das Leid, das diese Waffen anrichten. Jetzt soll die ukrainische Armee von den USA damit versorgt werden.
Die Aufregung war… [+5774 chars]",,de,'Ukraine'
https://www.stern.de/politik/ausland/russischer-angriffskrieg--us-regierung-verteidigt-lieferung-von-streumunition--33628864.html,https://www.stern.de/politik/ausland/russischer-angriffskrieg--us-regierung-verteidigt-lieferung-von-streumunition--33628864.html,0,www.stern.de,Russischer Angriffskrieg: US-Regierung verteidigt Lieferung von Streumunition,Die Ukraine versucht Partner seit Monaten zur Lieferung von umstrittener Streumunition zu bewegen. Nun hat Washington entschieden. Viele Länder ächten allerdings den Einsatz dieser Munition.,https://image.stern.de/33630242/t/H0/v2/w1440/r1.7778/-/07--urnnewsmldpacom2009010123070799324648v2w800h600l632t440r1896b1324jpeg---ccc96b55b36c0b55.jpg,2023-07-07T19:41:40Z,,"Die Ukraine versucht Partner seit Monaten zur Lieferung von umstrittener Streumunition zu bewegen. Nun hat Washington entschieden. Viele Länder ächten allerdings den Einsatz dieser Munition.
Die US-… [+3942 chars]",,de,'Russland'
https://www.focus.de/politik/ausland/ukraine-update-am-morgen-sollten-uns-nicht-wundern-wenn-kadyrow-auf-den-kreml-marschiert_id_198485791.html,https://www.focus.de/politik/ausland/ukraine-update-am-morgen-sollten-uns-nicht-wundern-wenn-kadyrow-auf-den-kreml-marschiert_id_198485791.html,0,www.focus.de,"Ukraine-Update am Morgen - „Sollten uns nicht wundern, wenn Kadyrow auf den Kreml marschiert“","Berichten zufolge soll Russlands Außenminister Sergei Lawrow zwei Monate nach dem russischen Überfall auf die Ukraine mit US-Beamten über ein mögliches Kriegsende gesprochen haben. Wolodymyr Selenskyj sagt, dass ihn ein Kreml-Sturm von Ramsan Kadyrow nicht wu…",https://p6.focus.de/img/fotos/id_197317891/machtkampf-in-russland.jpg?im=Crop%3D%280%2C577%2C3464%2C1732%29%3BResize%3D%281200%2C627%29&impolicy=perceptual&quality=mediumHigh&hash=5993c47db416f4e4c846fd63d474f86d490fa5d4d11fa3771f2af65b2e0d22e0,2023-07-07T20:00:10Z,,Berichten zufolge soll Russlands Außenminister Sergei Lawrow zwei Monate nach dem russischen Überfall auf die Ukraine mit US-Beamten über ein mögliches Kriegsende gesprochen haben. Wolodymyr Selensky… [+12083 chars],,de,'Russland'
https://www.dw.com/de/nato-schn%C3%BCrt-gipfelpaket-f%C3%BCr-die-ukraine/a-66146143,https://www.dw.com/de/nato-schn%C3%BCrt-gipfelpaket-f%C3%BCr-die-ukraine/a-66146143,0,www.dw.com,NATO schnürt Gipfelpaket für die Ukraine,"Beim bevorstehenden Spitzentreffen in Vilnius soll ein mehrjähriges Programm vereinbart werden, das eine bessere Zusammenarbeit zwischen den Streitkräften der Ukraine und des Bündnisses ermöglicht. Ein Überblick.",https://static.dw.com/image/66132524_6.jpg,2023-07-07T20:04:00Z,,"Das Wichtigste in Kürze:
<ul><li>NATO will mehr Unterstützung für die Ukraine</li><li>Medien: USA werden Ukraine mit Streumunition ausrüsten</li><li>Selenskyj: Gegenoffensive geht ""nicht schnell"" vo… [+6405 chars]",,de,'Russland'
https://www.welt.de/politik/ausland/article246282282/Ukraine-Krieg-Biden-bezeichnet-Lieferung-von-Streumunition-an-Ukraine-als-Uebergangsloesung.html,https://www.welt.de/politik/ausland/article246282282/Ukraine-Krieg-Biden-bezeichnet-Lieferung-von-Streumunition-an-Ukraine-als-Uebergangsloesung.html,0,www.welt.de,Biden bezeichnet Lieferung von Streumunition an Ukraine als „Übergangslösung“,"Die USA haben eingewilligt, der Ukraine umstrittene Streumunition im Kampf gegen Russland zu liefern. US-Präsident Joe Biden hat den Entschluss verteidigt und nannte die Maßnahme „nicht dauerhaft, sondern für eine Übergangszeit“.",https://img.welt.de/img/newsticker/dpa_nt/infoline_nt/politik_ausland_nt/mobile246163060/7091352527-ci16x9-w1200/US-Praesident-Biden.jpg,2023-07-07T21:03:00Z,http://archive.md/20230708065218/https://www.welt.de/politik/ausland/article246282282/Ukraine-Krieg-Biden-bezeichnet-Lieferung-von-Streumunition-an-Ukraine-als-Uebergangsloesung.html,"Die US-Regierung will der Ukraine Streumunition zur Verteidigung gegen Russland liefern. US-Präsident Joe Biden sagte, dass ihm die Entscheidung sehr schwer gefallen sei. Dennoch hat er den Entschlus… [+3125 chars]",,de,'Russland'
https://www.handelsblatt.com/politik/international/waffen-senator-usa-vernichten-letzte-chemiewaffen-bestaende/29247632.html,https://www.handelsblatt.com/politik/international/waffen-senator-usa-vernichten-letzte-chemiewaffen-bestaende/29247632.html,0,www.handelsblatt.com,Waffen: Senator: USA vernichten letzte Chemiewaffen-Bestände,Mit Chemiewaffen wurden einige schwerwiegende Angriffe der Geschichte ausgeführt. Die USA vermelden nun einen Meilenstein bei deren Vernichtung.,https://www.handelsblatt.com/images/chemische-waffen/29247634/2-format2003.jpg,2023-07-07T21:13:00Z,,"Chemische WaffenIn den USA warteten zuletzt noch rund 127 Tonnen auf ihre Vernichtung.
(Foto: dpa)
Washington Die Vereinigten Staaten haben nach Angaben eines führenden US-Senators die letzten Best… [+2005 chars]",,de,'Russland'
https://www.zeit.de/news/2023-07/08/russland-usa-bringen-menschheit-neuem-weltkrieg-naeher,https://www.zeit.de/news/2023-07/08/russland-usa-bringen-menschheit-neuem-weltkrieg-naeher,0,www.zeit.de,Russische Invasion: Russland: USA bringen Menschheit neuem Weltkrieg näher,,,2023-07-07T23:25:49Z,,"When browsing with ads:
We collect personal data and also transmit it to third-party providers
 that help us improve and finance our digital content. Some of the information stored on your device, … [+821 chars]",,de,'Russland'
https://www.wiwo.de/technologie/wirtschaft-von-oben/wirtschaft-von-oben-218-ira-und-neue-fabriken-in-den-usa-hier-profitieren-firmen-vom-inflation-reduction-act-und-investieren-milliarden-in-die-us-wirtschaft/29246678.html,https://www.wiwo.de/technologie/wirtschaft-von-oben/wirtschaft-von-oben-218-ira-und-neue-fabriken-in-den-usa-hier-profitieren-firmen-vom-inflation-reduction-act-und-investieren-milliarden-in-die-us-wirtschaft/29246678.html,0,www.wiwo.de,Wirtschaft von oben: Hier profitieren Firmen vom Inflation Reduction Act – und investieren Milliarden in die US-Wirtschaft,Ohne moderne Batterien wird der grüne Umbau der US-Wirtschaft nicht gelingen. Panasonic baut dafür in Kansas ein riesiges Werk. Und ein Ölmulti zieht mitten in Texas die weltgrößte DAC-Anlage hoch.,https://www.wiwo.de/images/teaserbild-panasonickansas_2023_06_09_liveeo_spot-jpg/29246734/3-format11240.jpg,2023-07-08T09:16:56Z,,"Odessa im Westen des US-Bundesstaats Texas ist das, was man eine Öl-Metropole nennt. Die Stadt liegt auf dem Permischen Becken, dem größten Reservoir für Öl und Gas in den Vereinigten Staaten. Außerh… [+9673 chars]",,de,'Knappheit'
https://www.faz.net/aktuell/politik/ukraine-liveticker-asow-offiziere-kehren-in-die-ukraine-zurueck-faz-18495964.html,https://www.faz.net/aktuell/politik/ukraine-liveticker-asow-offiziere-kehren-in-die-ukraine-zurueck-faz-18495964.html,0,www.faz.net,Ukraine-Liveblog: Asow-Offiziere kehren in die Ukraine zurück,NATO-Länder zurückhaltend nach Streumunition-Zusage der USA +++ London: Russland hat wohl kaum Reserven für Kampf um Bachmut +++ Moskau: USA bringen Menschheit neuem Weltkrieg näher +++ alle Entwicklungen im Liveblog,https://media1.faz.net/ppmedia/aktuell/4269077544/1.9020799/facebook_teaser/selenskyj-umarmt-svyatoslav.jpg,2023-07-08T19:20:05Z,https://web.archive.org/web/20230708214747/https://www.faz.net/aktuell/politik/ukraine-liveticker-asow-offiziere-kehren-in-die-ukraine-zurueck-faz-18495964.html,Russland beantragt eine Sitzung des UN-Sicherheitsrats zu den Hintergründen der Explosionen an den Nord-Stream-Gaspipelines. Man werde zu dem Treffen am kommenden Dienstag einige interessante unparte… [+636 chars],,de,'Ukraine'
https://www.n-tv.de/politik/12-30-Sharma-zur-Lage-in-der-Ukraine-Selenskyj-fuer-Rueckkehr-von-Asow-Kommandeuren-gefeiert--article23143824.html,https://www.n-tv.de/politik/12-30-Sharma-zur-Lage-in-der-Ukraine-Selenskyj-fuer-Rueckkehr-von-Asow-Kommandeuren-gefeiert--article23143824.html,0,www.n-tv.de,"Ukraine-Krieg im Liveticker: +++ 12:30 Sharma zur Lage in der Ukraine: ""Selenskyj für Rückkehr von Asow-Kommandeuren gefeiert"" +++","Berlin, Washington, Br\u00fcssel - \u00fcberall. n-tv berichtet von allen wichtigen Schaupl\u00e4tzen der Innen- und Au\u00dfenpolitik.",https://bilder2.n-tv.de/img/incoming/crop23332537/9041326157-cImg_16_9-w1200/Liveticker1-grau-1-Kopie.jpg,2023-07-08T22:15:00Z,,"Erneut meldet die Ukraine Beschuss durch Drohnen, im Osten des Landes gehen die heftigen Gefechte weiter, Selenskyj bringt Asow-Kommandeure heim und Kiew sorgt sich über angebliche Geheimgespräche zw… [+16656 chars]",,de,'Ukraine'
https://www.n-tv.de/politik/13-41-Kambodscha-warnt-Ukraine-vor-Einsatz-von-Streumunition--article23143824.html,https://www.n-tv.de/politik/13-41-Kambodscha-warnt-Ukraine-vor-Einsatz-von-Streumunition--article23143824.html,0,www.n-tv.de,Ukraine-Krieg im Liveticker: +++ 13:41 Kambodscha warnt Ukraine vor Einsatz von Streumunition +++,"Berlin, Washington, Br\u00fcssel - \u00fcberall. n-tv berichtet von allen wichtigen Schaupl\u00e4tzen der Innen- und Au\u00dfenpolitik.",https://bilder2.n-tv.de/img/incoming/crop23332537/9041326157-cImg_16_9-w1200/Liveticker1-grau-1-Kopie.jpg,2023-07-08T22:15:00Z,,"Aus eigener leidvoller Erfahrung warnt Kambodscha die Ukraine vor dem Einsatz von Streumunition. ""Es wäre für die Ukrainer die größte Gefahr für viele Jahre oder für bis zu hundert Jahre, wenn Streub… [+18868 chars]",,de,'Ukraine'
https://www.n-tv.de/politik/06-28-Wagner-Kommandeur-Soeldner-gehen-erst-Anfang-August-nach-Belarus--article23143824.html,https://www.n-tv.de/politik/06-28-Wagner-Kommandeur-Soeldner-gehen-erst-Anfang-August-nach-Belarus--article23143824.html,0,www.n-tv.de,Ukraine-Krieg im Liveticker: +++ 06:28 Wagner-Kommandeur: Söldner gehen erst Anfang August nach Belarus +++,"Berlin, Washington, Br\u00fcssel - \u00fcberall. n-tv berichtet von allen wichtigen Schaupl\u00e4tzen der Innen- und Au\u00dfenpolitik.",https://bilder2.n-tv.de/img/incoming/crop23332537/9041326157-cImg_16_9-w1200/Liveticker1-grau-1-Kopie.jpg,2023-07-08T22:15:00Z,,"Der belarussische Machthaber Alexander Lukaschenko überraschte zuletzt mit der Aussage, dass sich Wagner-Chef Jewgeni Prigoschin und seine Söldner nicht in seinem Land befinden - wie es nach Abbruch … [+8603 chars]",,de,'Russland'
https://www.n-tv.de/politik/11-33-Experte-zu-Selenskyj-Besuch-Erdogans-Verhalten-ist-nicht-plausibel-aber-hochinteressant--article23143824.html,https://www.n-tv.de/politik/11-33-Experte-zu-Selenskyj-Besuch-Erdogans-Verhalten-ist-nicht-plausibel-aber-hochinteressant--article23143824.html,0,www.n-tv.de,"Ukraine-Krieg im Liveticker: +++ 11:33 Experte zu Selenskyj-Besuch: Erdogans Verhalten ist ""nicht plausibel, aber hochinteressant"" +++","Berlin, Washington, Br\u00fcssel - \u00fcberall. n-tv berichtet von allen wichtigen Schaupl\u00e4tzen der Innen- und Au\u00dfenpolitik.",https://bilder2.n-tv.de/img/incoming/crop23332537/9041326157-cImg_16_9-w1200/Liveticker1-grau-1-Kopie.jpg,2023-07-08T22:15:00Z,,"Zurückkehrende Asow-Kämpfer und verbale Unterstützung von Erdogan in Sachen NATO-Beitritt der Ukraine: Selenskyjs Staatsbesuch in der Türkei sei ""voller Überraschungen"", meint Sicherheitsexperte Joac… [+15289 chars]",,de,'Ukraine'
https://www.n-tv.de/politik/14-02-Bundeswehr-schuetzt-mit-Grossaufgebot-NATO-Gipfel-in-Vilnius--article23143824.html,https://www.n-tv.de/politik/14-02-Bundeswehr-schuetzt-mit-Grossaufgebot-NATO-Gipfel-in-Vilnius--article23143824.html,0,www.n-tv.de,Ukraine-Krieg im Liveticker: +++ 14:02 Bundeswehr schützt mit Großaufgebot NATO-Gipfel in Vilnius +++,"Berlin, Washington, Br\u00fcssel - \u00fcberall. n-tv berichtet von allen wichtigen Schaupl\u00e4tzen der Innen- und Au\u00dfenpolitik.",https://bilder2.n-tv.de/img/incoming/crop23332537/9041326157-cImg_16_9-w1200/Liveticker1-grau-1-Kopie.jpg,2023-07-08T22:15:00Z,,Am Dienstag beginnt der NATO-Gipfel in der litauischen Hauptstadt Vilnius. Zum Schutz der Teilnehmer vor Zwischenfällen zeigt die Bundeswehr Präsenz. Dazu gehören drei Patriot-Kampfstaffeln auf dem g… [+19768 chars],,de,'Ukraine'
https://www.n-tv.de/politik/08-49-London-Russische-Medien-waren-von-Wagner-Meuterei-fast-sicher-zunaechst-ueberrascht--article23143824.html,https://www.n-tv.de/politik/08-49-London-Russische-Medien-waren-von-Wagner-Meuterei-fast-sicher-zunaechst-ueberrascht--article23143824.html,0,www.n-tv.de,"Ukraine-Krieg im Liveticker: +++ 08:49 London: Russische Medien waren von Wagner-Meuterei ""fast sicher zunächst überrascht"" +++","Berlin, Washington, Br\u00fcssel - \u00fcberall. n-tv berichtet von allen wichtigen Schaupl\u00e4tzen der Innen- und Au\u00dfenpolitik.",https://bilder2.n-tv.de/img/incoming/crop23332537/9041326157-cImg_16_9-w1200/Liveticker1-grau-1-Kopie.jpg,2023-07-08T22:15:00Z,,"Laut britischen Geheimdiensten waren russische Medien von der eintägigen Meuterei der Wagner-Gruppe vor zwei Wochen ""fast sicher zunächst überrascht"". Die Medien hätten in drei Phasen auf den Aufstan… [+11695 chars]",,de,'Ukraine'
https://www.n-tv.de/politik/19-09-Klitschko-Russische-Attacken-haben-in-Kiew-seit-Kriegsbeginn-170-Zivilisten-getoetet--article23143824.html,https://www.n-tv.de/politik/19-09-Klitschko-Russische-Attacken-haben-in-Kiew-seit-Kriegsbeginn-170-Zivilisten-getoetet--article23143824.html,0,www.n-tv.de,Ukraine-Krieg im Liveticker: +++ 19:09 Klitschko: Russische Attacken haben in Kiew seit Kriegsbeginn 170 Zivilisten getötet +++,"Berlin, Washington, Br\u00fcssel - \u00fcberall. n-tv berichtet von allen wichtigen Schaupl\u00e4tzen der Innen- und Au\u00dfenpolitik.",https://bilder2.n-tv.de/img/incoming/crop23332537/9041326157-cImg_16_9-w1200/Liveticker1-grau-1-Kopie.jpg,2023-07-08T22:15:00Z,https://web.archive.org/web/20230709173817/https://www.n-tv.de/politik/19-09-Klitschko-Russische-Attacken-haben-in-Kiew-seit-Kriegsbeginn-170-Zivilisten-getoetet--article23143824.html,"Bei russischen Angriffen sind seit Beginn der russischen Invasion über 170 Zivilisten getötet und mehr als 400 Wohnhäuser in Kiew zerstört worden, sagt Vitali Klitschko, Bürgermeister von Kiew, in ei… [+27202 chars]",,de,'Ukraine'
https://www.n-tv.de/politik/05-22-Ukraine-fordert-von-NATO-eindeutige-Beitrittszusage--article23143824.html,https://www.n-tv.de/politik/05-22-Ukraine-fordert-von-NATO-eindeutige-Beitrittszusage--article23143824.html,0,www.n-tv.de,Ukraine-Krieg im Liveticker: +++ 05:22 Ukraine fordert von NATO eindeutige Beitrittszusage +++,"Berlin, Washington, Br\u00fcssel - \u00fcberall. n-tv berichtet von allen wichtigen Schaupl\u00e4tzen der Innen- und Au\u00dfenpolitik.",https://bilder2.n-tv.de/img/incoming/crop23332537/9041326157-cImg_16_9-w1200/Liveticker1-grau-1-Kopie.jpg,2023-07-08T22:15:00Z,,"Kurz vor dem NATO-Gipfel dringt die Ukraine weiter auf eine eindeutige Zusage, dass sie in das Bündnis aufgenommen wird. ""Auf dem Gipfel in Vilnius erwarten wir eine klare und deutliche Einladung und… [+7511 chars]",,de,'Ukraine'
https://www.n-tv.de/politik/16-15-Ukrainischer-General-Russische-Truppen-nahe-Bachmut-eingeschlossen--article23143824.html,https://www.n-tv.de/politik/16-15-Ukrainischer-General-Russische-Truppen-nahe-Bachmut-eingeschlossen--article23143824.html,0,www.n-tv.de,"Ukraine-Krieg im Liveticker: +++ 16:15 Ukrainischer General: Russische Truppen nahe Bachmut ""eingeschlossen"" +++","Berlin, Washington, Br\u00fcssel - \u00fcberall. n-tv berichtet von allen wichtigen Schaupl\u00e4tzen der Innen- und Au\u00dfenpolitik.",https://bilder2.n-tv.de/img/incoming/crop23332537/9041326157-cImg_16_9-w1200/Liveticker1-grau-1-Kopie.jpg,2023-07-08T22:15:00Z,,"Die ukrainischen Streitkräfte machen in der Nähe von Bachmut ""Fortschritte"", während die russischen Truppen in einigen Gebieten ""eingeschlossen"" sind, schreibt General Oleksandr Syrskyi, der Kommande… [+23079 chars]",,de,'Ukraine'
https://www.n-tv.de/politik/10-14-Ukrainischer-Generalstab-meldet-600-tote-russische-Soldaten-in-vergangenen-Tagen--article23143824.html,https://www.n-tv.de/politik/10-14-Ukrainischer-Generalstab-meldet-600-tote-russische-Soldaten-in-vergangenen-Tagen--article23143824.html,0,www.n-tv.de,Ukraine-Krieg im Liveticker: +++ 10:14 Ukrainischer Generalstab meldet 600 tote russische Soldaten in vergangenen Tagen +++,"Berlin, Washington, Br\u00fcssel - \u00fcberall. n-tv berichtet von allen wichtigen Schaupl\u00e4tzen der Innen- und Au\u00dfenpolitik.",https://bilder2.n-tv.de/img/incoming/crop23332537/9041326157-cImg_16_9-w1200/Liveticker1-grau-1-Kopie.jpg,2023-07-08T22:15:00Z,,Der Generalstab der ukrainischen Streitkräfte veröffentlicht neue Zahlen zu russischen Verlusten in der Ukraine. Seit Beginn der groß angelegten Invasion am 24. Februar vergangenen Jahres hat Russlan… [+13782 chars],,de,'Ukraine'
https://www.n-tv.de/politik/18-09-Lawrow-telefoniert-mit-tuerkischem-Amtskollegen-ueber-Getreideabkommen--article23143824.html,https://www.n-tv.de/politik/18-09-Lawrow-telefoniert-mit-tuerkischem-Amtskollegen-ueber-Getreideabkommen--article23143824.html,0,www.n-tv.de,Ukraine-Krieg im Liveticker: +++ 18:09 Lawrow telefoniert mit türkischem Amtskollegen über Getreideabkommen +++,"Berlin, Washington, Br\u00fcssel - \u00fcberall. n-tv berichtet von allen wichtigen Schaupl\u00e4tzen der Innen- und Au\u00dfenpolitik.",https://bilder2.n-tv.de/img/incoming/crop23332537/9041326157-cImg_16_9-w1200/Liveticker1-grau-1-Kopie.jpg,2023-07-08T22:15:00Z,,Russlands Außenminister Sergej Lawrow und sein türkischer Kollege Hakan Fidan tauschen sich eine Woche vor Auslaufen des Abkommens zur Verschiffung von ukrainischem Getreide über das Schwarze Meer zu… [+25757 chars],,de,'Russland'
https://www.n-tv.de/politik/09-57-Selenskyj-trifft-polnischen-Praesidenten-Duda--article23143824.html,https://www.n-tv.de/politik/09-57-Selenskyj-trifft-polnischen-Praesidenten-Duda--article23143824.html,0,www.n-tv.de,Ukraine-Krieg im Liveticker: +++ 09:57 Selenskyj trifft polnischen Präsidenten Duda +++,"Berlin, Washington, Br\u00fcssel - \u00fcberall. n-tv berichtet von allen wichtigen Schaupl\u00e4tzen der Innen- und Au\u00dfenpolitik.",https://bilder2.n-tv.de/img/incoming/crop23332537/9041326157-cImg_16_9-w1200/Liveticker1-grau-1-Kopie.jpg,2023-07-08T22:15:00Z,,Kurz vor dem NATO-Gipfel in Vilnius trifft der ukrainische Präsident Selenskyj seinen polnischen Amtskollegen Andrzej Duda. Von ukrainischen Medien verbreitete Bilder zeigen beide bei einem Gottesdie… [+13023 chars],,de,'Ukraine'
https://www.n-tv.de/politik/12-06-US-Experten-Wagner-ist-weiterhin-eine-potenzielle-Gefahr-fuer-Putin--article23143824.html,https://www.n-tv.de/politik/12-06-US-Experten-Wagner-ist-weiterhin-eine-potenzielle-Gefahr-fuer-Putin--article23143824.html,0,www.n-tv.de,Ukraine-Krieg im Liveticker: +++ 12:06 US-Experten: Wagner ist weiterhin eine potenzielle Gefahr für Putin +++,"Berlin, Washington, Br\u00fcssel - \u00fcberall. n-tv berichtet von allen wichtigen Schaupl\u00e4tzen der Innen- und Au\u00dfenpolitik.",https://bilder2.n-tv.de/img/incoming/crop23332537/9041326157-cImg_16_9-w1200/Liveticker1-grau-1-Kopie.jpg,2023-07-08T22:15:00Z,,"Die Wagner-Armee des russischen Söldnerchefs Prigoschin stellt aus Sicht von US-Experten weiter eine potenzielle Gefahr für Kremlchef Putin und seinen Machtapparat dar. ""Putin erlaubt Wagner und Prig… [+16225 chars]",,de,'Ukraine'
https://www.n-tv.de/politik/08-20-Moskau-kritisiert-Rueckholung-von-Asow-Kommandeuren--article23143824.html,https://www.n-tv.de/politik/08-20-Moskau-kritisiert-Rueckholung-von-Asow-Kommandeuren--article23143824.html,0,www.n-tv.de,Ukraine-Krieg im Liveticker: +++ 08:20 Moskau kritisiert Rückholung von Asow-Kommandeuren +++,"Berlin, Washington, Br\u00fcssel - \u00fcberall. n-tv berichtet von allen wichtigen Schaupl\u00e4tzen der Innen- und Au\u00dfenpolitik.",https://bilder2.n-tv.de/img/incoming/crop23332537/9041326157-cImg_16_9-w1200/Liveticker1-grau-1-Kopie.jpg,2023-07-08T22:15:00Z,,"Am 500. Tag des großangelegten russischen Überfalls auf die Ukraine bringt Präsident Selenskyj mehrere Kommandeure, die das Asowstal-Werk in Mariupol verteidigt haben, aus der Türkei nach Hause. Krem… [+10891 chars]",,de,'Ukraine'
https://www.n-tv.de/politik/00-23-Selenskyj-will-Grenze-zu-Belarus-besser-schuetzen--article23143824.html,https://www.n-tv.de/politik/00-23-Selenskyj-will-Grenze-zu-Belarus-besser-schuetzen--article23143824.html,0,www.n-tv.de,Ukraine-Krieg im Liveticker: +++ 00:23 Selenskyj will Grenze zu Belarus besser schützen +++,"Berlin, Washington, Br\u00fcssel - \u00fcberall. n-tv berichtet von allen wichtigen Schaupl\u00e4tzen der Innen- und Au\u00dfenpolitik.",https://bilder2.n-tv.de/img/incoming/crop23332537/9041326157-cImg_16_9-w1200/Liveticker1-grau-1-Kopie.jpg,2023-07-08T22:15:00Z,,"Selenskyj spricht sich bei einem Besuch in Luzk im Nordwesten des Landes in der Nähe von Belarus erneut für einen besseren Schutz der Staatsgrenze ausgesprochen. Priorität sei es, die ganze nördliche… [+32944 chars]",,de,'Russland'
