index,url,valid,domain,title,description,image,published,archive,content,quote,language,keyword
https://consent.google.com/ml?continue=https://news.google.com/rss/articles/CBMif2h0dHBzOi8vd3d3LmJlcmxpbmVyLXplaXR1bmcuZGUvbmV3cy91a3JhaW5lLWFuZ3JpZmZlLWF1Zi1ydXNzaXNjaGUtZmxvdHRlLWtyaW0tYnJ1ZWNrZS1sb2dpc2NoLXdpcmtzYW0tdm9lbGxpZy1sZWdhbC1saS4zNzYwOTTSAQA?oc%3D5&gl=FR&hl=en-US&cm=2&pc=n&src=1,https://consent.google.com/ml?continue=https://news.google.com/rss/articles/CBMif2h0dHBzOi8vd3d3LmJlcmxpbmVyLXplaXR1bmcuZGUvbmV3cy91a3JhaW5lLWFuZ3JpZmZlLWF1Zi1ydXNzaXNjaGUtZmxvdHRlLWtyaW0tYnJ1ZWNrZS1sb2dpc2NoLXdpcmtzYW0tdm9lbGxpZy1sZWdhbC1saS4zNzYwOTTSAQA?oc%3D5&gl=FR&hl=en-US&cm=2&pc=n&src=1,0,consent.google.com,"Ukraine-Krieg: Angriffe auf russische Schiffe, Krim-Brücke „logisch, wirksam, völlig legal“ - Sicherheitsdiens - Berliner Zeitung","<ol><li>Ukraine-Krieg: Angriffe auf russische Schiffe, Krim-Brücke „logisch, wirksam, völlig legal“ - Sicherheitsdiens  Berliner Zeitung
</li><li>UKRAINE-KRIEG: Blamage für Russen - Marine hat kaum Mittel gegen Kamikaze-Seedrohnen | WELT Stream  WELT Nachric…",,2023-08-05T10:26:23Z,,"We use cookies and data to<ul><li>Deliver and maintain Google services</li><li>Track outages and protect against spam, fraud, and abuse</li><li>Measure audience engagement and site statistics to unde… [+1131 chars]",,de,'Ukraine'
https://www.zeit.de/news/2023-08/05/zwischen-den-verbuendeten-ukraine-und-polen-knirscht-es,https://www.zeit.de/news/2023-08/05/zwischen-den-verbuendeten-ukraine-und-polen-knirscht-es,0,www.zeit.de,Russische Invasion: Zwischen den Verbündeten Ukraine und Polen knirscht es,,,2023-08-05T10:29:00Z,,"When browsing with ads:
We collect personal data and also transmit it to third-party providers
 that help us improve and finance our digital content. Some of the information stored on your device, … [+821 chars]",,de,'Ukraine'
https://www.stern.de/politik/ausland/russische-invasion--zwischen-den-verbuendeten-ukraine-und-polen-knirscht-es-33712146.html,https://www.stern.de/politik/ausland/russische-invasion--zwischen-den-verbuendeten-ukraine-und-polen-knirscht-es-33712146.html,0,www.stern.de,Russische Invasion: Zwischen den Verbündeten Ukraine und Polen knirscht es,Die von Russland angegriffene Ukraine überlebt mit Hilfe von außen - militärisch und finanziell. Ist das Land dafür dankbar oder undankbar? Die Frage entzweit Kiew und einen seiner wichtigsten Unterstützer.,https://image.stern.de/33712148/t/bR/v1/w1440/r1.7778/-/05--urnnewsmldpacom2009010123080599714552v4w800h600l627t64r1907b914jpeg---ffc37be235d3b9d8.jpg,2023-08-05T10:29:00Z,,Die von Russland angegriffene Ukraine überlebt mit Hilfe von außen - militärisch und finanziell. Ist das Land dafür dankbar oder undankbar? Die Frage entzweit Kiew und einen seiner wichtigsten Unters… [+5258 chars],,de,'Russland'
https://www.faz.net/aktuell/wirtschaft/ukraine-krieg-wirken-die-sanktionen-gegen-russland-19065658.html,https://www.faz.net/aktuell/wirtschaft/ukraine-krieg-wirken-die-sanktionen-gegen-russland-19065658.html,0,www.faz.net,Angriff auf die Ukraine: Wirken die Sanktionen gegen Russland?,Wirtschaftlich hält sich Russland trotz der Sanktionen wegen des Ukrainekriegs besser als erwartet. Unternehmen sind in einer Zwickmühle.,https://media0.faz.net/ppmedia/aktuell/3518021529/1.9065650/facebook_teaser_fplus/unilever-eure-praesenz-in.jpg,2023-08-05T10:31:47Z,,Fast anderthalb Jahre ist der russische Angriff auf die Ukraine nun her. Das Land leidet seitdem schwer unter den Folgen des Krieges. Die ukrainische Gegenoffensive seit dem Frühjahr kommt offenbar n… [+768 chars],,de,'Russland'
https://orf.at/stories/3326473/,https://orf.at/stories/3326473/,0,orf.at,Internationale Ukraine-Friedenskonferenz in Saudi-Arabien,,https://orf.at/mojo/1_4_1/storyserver//news/common/images/og-fallback-news.png,2023-08-05T10:37:39Z,,"In Saudi-Arabien beginnt heute eine zweitägige Ukraine-Friedenskonferenz. Das Königreich hat dafür die Ukraine, ihre westlichen Verbündeten sowie Entwicklungs- und Schwellenländer aus dem Globalen Sü… [+401 chars]",,de,'Ukraine'
https://www.tagesschau.de/ausland/europa/explosionen-krim-bruecke-ukraine-102.html,https://www.tagesschau.de/ausland/europa/explosionen-krim-bruecke-ukraine-102.html,0,www.tagesschau.de,Ukraine bestätigt Angriff auf russischen Tanker,"Ukrainische Sicherheitskreise haben einen Angriff auf den russischen Tanker ""SIG"" bestätigt. Demnach wurde das Schiff per Drohne nahe der Krim-Brücke attackiert. Russischen Angaben zufolge entstanden keine größeren Schäden.",https://images.tagesschau.de/image/de24afd9-7b5d-441c-a058-f29f0d5e5aba/AAABicVLATY/AAABibBxqrQ/16x9-1280/russland-tanker-sig-100.jpg,2023-08-05T10:42:54Z,,"Stand: 05.08.2023 12:42 Uhr
Ukrainische Sicherheitskreise haben einen Angriff auf den russischen Tanker ""SIG"" bestätigt. Demnach wurde das Schiff per Drohne nahe der Krim-Brücke attackiert. Russisch… [+3068 chars]",,de,'Ukraine'
https://www.welt.de/wirtschaft/article246744836/Getreide-Volle-Solidaritaet-mit-Kiew-Dieser-Streit-entzweit-die-EU.html,https://www.welt.de/wirtschaft/article246744836/Getreide-Volle-Solidaritaet-mit-Kiew-Dieser-Streit-entzweit-die-EU.html,0,www.welt.de,Volle Solidarität mit der Ukraine? Wie der Getreide-Streit die EU entzweit,"Erst das Aus beim Getreide-Abkommen, dann der Beschuss von Silos: Putin scheint die Ukraine vom globalen Nahrungsmittelmarkt isolieren zu wollen. Die EU möchte helfen, doch einige Mitglieder wollen lieber ihre Heimatmärkte schützen. Eine Lösung könnte für Brü…",https://img.welt.de/img/wirtschaft/mobile246760504/3631358227-ci16x9-w1200/GettyImages-129215813.jpg,2023-08-06T05:13:28Z,,Die Raketen schlugen in den frühen Morgenstunden ein. Ihr Ziel: Silos voller Getreide. Am Mittwoch beschoss Russland einen wichtigen Donau-Hafen der Ukraine. 40.000 Tonnen Weizen wurden dabei vernich… [+5850 chars],,de,'Putin'
