index,url,valid,domain,title,description,image,published,archive,content,quote,language,keyword
https://www.welt.de/politik/ausland/article244765274/Ukraine-News-Russischer-Geheimdienst-sucht-Ukrainer-nach-Mord-an-Blogger-Wladlen-Tatarski.html,https://www.welt.de/politik/ausland/article244765274/Ukraine-News-Russischer-Geheimdienst-sucht-Ukrainer-nach-Mord-an-Blogger-Wladlen-Tatarski.html,0,www.welt.de,Russischer Geheimdienst sucht Ukrainer nach Mord an Blogger Wladlen Tatarski,"Im Fall um den getöteten Militärblogger Wladen Tatarski, will Russland den Täter identifiziert haben. Ein Ukrainer soll demnach den Sprengsatz installiert haben und anschließend in die Türkei geflohen sein. Mehr im Liveticker.",https://img.welt.de/img/politik/ausland/mobile244665348/2511359307-ci16x9-w1200/The-consequences-of-the-destruction-of-the-building-after-a-2.jpg,2023-04-13T14:08:00Z,https://web.archive.org/web/20230413164817/https://www.welt.de/politik/ausland/article244765274/Ukraine-News-Russischer-Geheimdienst-sucht-Ukrainer-nach-Mord-an-Blogger-Wladlen-Tatarski.html,Nach dem Mord an einem russischen Militärblogger in St. Petersburg hat der Moskauer Geheimdienst FSB eigenen Angaben zufolge einen Ukrainer als Urheber des Sprengstoffanschlags identifiziert. Der 35-… [+23506 chars],,de,'Ukraine'
https://www.wiwo.de/unternehmen/dienstleister/disney-plus-kosten-2023-was-kostet-ein-disney-plus-abo-aktuell/28911584.html,https://www.wiwo.de/unternehmen/dienstleister/disney-plus-kosten-2023-was-kostet-ein-disney-plus-abo-aktuell/28911584.html,0,www.wiwo.de,Disney Plus Kosten 2023: Was kostet ein Disney-Plus-Abo aktuell?,Der Streaminganbieter Disney Plus freut sich über steigende Nutzerzahlen. Doch was bekommen die Kunden eigentlich für ihr Geld? Das Disney-Plus-Abo im Überblick.,https://www.wiwo.de/images/disney-plus/28917088/2-format11240.jpg,2023-04-13T14:13:00Z,,Ähnlich wie bei anderen Anbietern hat die Coronapandemie auch beim Streamingdienst Disney Plus für einen enormen Kundenansturm gesorgt. Der Streamingdienst ist am 12. November 2019 in Deutschland ges… [+3233 chars],,de,'Kosten'
https://www.morgenpost.de/politik/article238135671/markus-soeder-kernfusion-reaktor-atomkraft-atomausstieg.html,https://www.morgenpost.de/politik/article238135671/markus-soeder-kernfusion-reaktor-atomkraft-atomausstieg.html,0,www.morgenpost.de,CSU-Chef: Kernkraft in Bayern? Markus Söder will Reaktor bauen lassen,"Der CSU-Chef hat große Pläne für die Atomenergie in Bayern, den Atomausstieg hält er für einen Fehler. Warum er einen neuen Reaktor bauen will.",https://img.morgenpost.de/img/frontpage/crop238135613/7542605183-w820-cv16_9-q85/Markus-Soeder-CSU.jpg,2023-04-13T14:16:06Z,https://web.archive.org/web/20230414134443/https://www.morgenpost.de/politik/article238135671/markus-soeder-kernfusion-reaktor-atomkraft-atomausstieg.html,"2011 trieb Markus Söder (CSU) den Ausstieg aus der Kernenergie selbst voran. Jetzt, kurz vor der Abschaltung der letzten Atomkraftwerke in Deutschland, fordert Bayerns Ministerpräsident, noch viele J… [+1868 chars]",,de,'Explosion'
https://www.faz.net/aktuell/politik/ausland/baerbock-betont-einigkeit-der-eu-zu-taiwan-waehrend-ihres-chinabesuchs-18818242.html,https://www.faz.net/aktuell/politik/ausland/baerbock-betont-einigkeit-der-eu-zu-taiwan-waehrend-ihres-chinabesuchs-18818242.html,0,www.faz.net,Nach Äußerungen von Macron: Baerbock betont Einigkeit der EU zu Taiwan,"Frankreichs Präsident hat mit Äußerungen über das Verhältnis zu den USA irritiert. Während ihres Chinabesuchs will Außenministerin Baerbock den Eindruck zerstreuen, es gebe Unstimmigkeiten. Und sie appelliert an China, auf Russland einzuwirken.",https://media0.faz.net/ppmedia/aktuell/politik/2105997636/1.8818256/facebook_teaser/aussenministerin-annalena.jpg,2023-04-13T14:23:21Z,https://web.archive.org/web/20230413211518/https://www.faz.net/aktuell/politik/ausland/baerbock-betont-einigkeit-der-eu-zu-taiwan-waehrend-ihres-chinabesuchs-18818242.html,"Außenministerin Annalena Baerbock hat China aufgefordert, seinen Einfluss auf Russland geltend zu machen, um den Krieg in der Ukraine zu einem Ende zu führen. Ein Einziger kann diesen Krieg beenden, … [+3006 chars]",,de,'Putin'
https://www.n-tv.de/politik/Russland-will-weiteren-Verdaechtigen-identifiziert-haben-article24051264.html,https://www.n-tv.de/politik/Russland-will-weiteren-Verdaechtigen-identifiziert-haben-article24051264.html,0,www.n-tv.de,Blogger-Tötung in St. Petersburg: Russland will weiteren Verdächtigen identifiziert haben,"Der russische Geheimdienst FSB beschuldigt einen Ukrainer, zusammen mit einer bereits festgenommenen Russin den Mordanschlag auf den Militärblogger Tatarski geplant zu haben. Auch Alexej Nawalnys Antikorruptionsstiftung wirft der FSB Mitverantwortung vor. Die…",https://bilder2.n-tv.de/img/incoming/crop24051429/4641325598-cImg_16_9-w1200/photo-2023-04-13-09-08-16.jpg,2023-04-13T15:47:49Z,https://web.archive.org/web/20230414011356/https://www.n-tv.de/politik/Russland-will-weiteren-Verdaechtigen-identifiziert-haben-article24051264.html,"Der russische Geheimdienst FSB beschuldigt einen Ukrainer, zusammen mit einer bereits festgenommenen Russin den Mordanschlag auf den Militärblogger Tatarski geplant zu haben. Auch Alexej Nawalnys Ant… [+4162 chars]",,de,'Ukraine'
https://www.faz.net/aktuell/politik/ukraine-liveticker-fsb-sucht-ukrainer-nach-mord-an-blogger-tatarski-faz-18495964.html,https://www.faz.net/aktuell/politik/ukraine-liveticker-fsb-sucht-ukrainer-nach-mord-an-blogger-tatarski-faz-18495964.html,0,www.faz.net,Ukraine-Liveblog: FSB sucht Ukrainer nach Mord an Blogger Tatarski,Oslo weist 15 mutmaßliche russische Geheimdienstmitarbeiter aus +++ Ukrainischer Außenminister fordert schnellen NATO-Beitritt der Ukraine und Georgiens +++ alle Entwicklungen im Liveblog,https://media1.faz.net/ppmedia/aktuell/politik/1565482005/1.8818985/facebook_teaser/ein-portraet-des-russischen.jpg,2023-04-13T15:50:38Z,https://web.archive.org/web/20230413211652/https://www.faz.net/aktuell/politik/ukraine-liveticker-fsb-sucht-ukrainer-nach-mord-an-blogger-tatarski-faz-18495964.html,"Ein Porträt des russischen Militärbloggers Tatarski (eigentlich Maxim Fomin), der bei einer Explosion in einem Café ums Leben kam. Bild: Reuters
Oslo weist 15 mutmaßliche russische Geheimdienstmitar… [+133 chars]",,de,'Ukraine'
https://www.tagesspiegel.de/internationales/nach-mord-an-russischem-blogger-russischer-geheimdienst-will-ukrainer-als-urheber-des-sprengstoffanschlags-identifiziert-haben-9654467.html,https://www.tagesspiegel.de/internationales/nach-mord-an-russischem-blogger-russischer-geheimdienst-will-ukrainer-als-urheber-des-sprengstoffanschlags-identifiziert-haben-9654467.html,0,www.tagesspiegel.de,Nach Mord an russischem Blogger: Russischer Geheimdienst will Ukrainer als Urheber des Sprengstoffanschlags identifiziert haben,Am 02.04.2023 ist der kremlnahen Militärblogger Wladlen Tatarski bei einer Explosion in einem Café in St. Petersburg ums Leben gekommen. Nun sucht der FSB nach einem 35-jährigen Ukrainer.,https://www.tagesspiegel.de/images/fsb-sucht-ukrainer-nach-mord-an-russischem-militarblogger/alternates/BASE_16_9_W1400/fsb-sucht-ukrainer-nach-mord-an-russischem-militaerblogger.jpeg,2023-04-13T15:59:56Z,,Nach dem Mord an einem russischen Militärblogger in St. Petersburg hat der Moskauer Geheimdienst FSB eigenen Angaben zufolge einen Ukrainer als Urheber des Sprengstoffanschlags identifiziert. Der 35-… [+2720 chars],,de,'Ukraine'
https://orf.at/stories/3312517/,https://orf.at/stories/3312517/,0,orf.at,Bachmut weiter schwer umkämpft,"Das ostukrainische Bachmut ist weiter schwer umkämpft. Russland meldete Donnerstagnachmittag, seine Truppen hätten die Stadt eingekesselt. Kiew dementierte umgehend. Auch die an den Kampfhandlungen beteiligte russische Söldnertruppe Wagner erklärte die Meldun…",https://ibs.orf.at/news?image=https%3A%2F%2Fassets.orf.at%2Fmims%2F2023%2F15%2F04%2Fcrops%2Fw%3D1200%2Ch%3D630%2Cq%3D75%2F1750764_master_649204_ukraine_krieg_bachmut_doab_r.jpg%3Fs%3Dff521ac34f0614513d0e939f652c8a3a5e9986cf,2023-04-13T16:12:27Z,https://web.archive.org/web/20230413202903/https://orf.at/stories/3312517/,"Luftgestützte Truppen verstärkten derzeit die vorstoßenden Kampfeinheiten der Söldnertruppe Wagner, erklärte das russische Verteidigungsministerium in einem Donnerstag veröffentlichten Lagebericht. D… [+3492 chars]",,de,'Explosion'
https://www.n-tv.de/incoming/Wie-Wollhaarmammuts-extreme-Kaelte-ueberstanden-article24050132.html,https://www.n-tv.de/incoming/Wie-Wollhaarmammuts-extreme-Kaelte-ueberstanden-article24050132.html,0,www.n-tv.de,In den Genen abgelesen: Wie Wollhaarmammuts extreme Kälte überstanden,"In den Genen von Wollhaarmammuts findet ein Forschungsteam Hinweise darauf, wie sich die Giganten, die vor 700.000 Jahren auf der Erde lebten, vor extremer Kälte schützten. Dabei fallen gewisse genetische Parallelen zu Rentieren und Eisbären auf.",https://bilder2.n-tv.de/img/incoming/crop24050149/5911326765-cImg_16_9-w1200/nicht-weiterverwenden.jpg,2023-04-13T16:35:40Z,,"In den Genen von Wollhaarmammuts findet ein Forschungsteam Hinweise darauf, wie sich die Giganten, die vor 700.000 Jahren auf der Erde lebten, vor extremer Kälte schützten. Dabei fallen gewisse genet… [+3631 chars]",,de,'Kälte'
https://www.zeit.de/video/2023-04/6324963811112/russland-befuerchtungen-um-erneute-vergiftung-alexej-nawalnys,https://www.zeit.de/video/2023-04/6324963811112/russland-befuerchtungen-um-erneute-vergiftung-alexej-nawalnys,0,www.zeit.de,Russland: Befürchtungen um erneute Vergiftung Alexej Nawalnys,Der russische Oppositionspolitiker Alexej Nawalny leidet in seiner Haft an mysteriösen Symptomen. Diese könnten laut seiner Sprecherin durch Gift ausgelöst sein.,,2023-04-13T16:42:34Z,,"When browsing with ads:
We collect personal data and also transmit it to third-party providers
 that help us improve and finance our digital content. Some of the information stored on your device, … [+732 chars]",,de,'Russland'
https://www.sueddeutsche.de/politik/anschlag-auf-blogger-russischer-geheimdienst-sucht-ukrainer-1.5796690,https://www.sueddeutsche.de/politik/anschlag-auf-blogger-russischer-geheimdienst-sucht-ukrainer-1.5796690,0,www.sueddeutsche.de,Anschlag auf Blogger: Russischer Geheimdienst sucht Ukrainer,Nach dem Mord an einem russischen Militärblogger in St. Petersburg hat der Moskauer Geheimdienst FSB eigenen Angaben zufolge einen Ukrainer als Urheber des...,https://www.sueddeutsche.de/assets/png/sz-ecb090256670a577bd629a9718686332.png,2023-04-13T16:49:29Z,,Nach dem Mord an einem russischen Militärblogger in St. Petersburg hat der Moskauer Geheimdienst FSB eigenen Angaben zufolge einen Ukrainer als Urheber des Sprengstoffanschlags identifiziert. Der 35-… [+1075 chars],,de,'Explosion'
https://www.focus.de/kultur/kino_tv/mit-palmen-eis-zur-dinner-hoechstbewertung-karsten-liefert-explosion-an-aromen_id_191018590.html,https://www.focus.de/kultur/kino_tv/mit-palmen-eis-zur-dinner-hoechstbewertung-karsten-liefert-explosion-an-aromen_id_191018590.html,0,www.focus.de,TV-Kolumne „Das perfekte Dinner“ - Karsten gelingt mit seiner „Explosion an Aromen“ die Höchstbewertung,"Gastgeber Karsten kocht am dritten Tag der Allgäu-Woche im wahrsten Sinne „Das perfekte Dinner“. Zuvor sorgte schon Alex für Begeisterung, aber der 40-Jährige macht die drei Damen mit seinen indonesischen Köstlichkeiten sprachlos. Seine Konkurrenz ist so bege…",https://p6.focus.de/img/kultur/kino_tv/id_191018501/mit-palmen-eis-zur-dinner-hoechstbewertung-karsten-liefert-explosion-an-aromen-.jpg?im=Crop%3D%280%2C42%2C1360%2C680%29%3BResize%3D%281200%2C627%29&hash=72e448beeb999179f9a7745834abd2bceffadddd2982c6ab8d0dbc5d17e087d4,2023-04-13T17:30:17Z,,"Ich koche etwas außergewöhnlich für diese Woche, was Indonesisches, verrät Karsten seine Herkunft. Meine Mutter kommt aus Indonesien. Deshalb kennt er die asiatische Küche von klein auf. Akribisch ma… [+2994 chars]",,de,'Explosion'
https://www.zeit.de/politik/ausland/2023-04/ukraine-ueberblick-kampfjets-polen-kaempfe-bachmut,https://www.zeit.de/politik/ausland/2023-04/ukraine-ueberblick-kampfjets-polen-kaempfe-bachmut,0,www.zeit.de,"Ukraine-Überblick: Polen darf MiG-29-Kampfjets an Ukraine liefern, Kämpfe in Bachmut",Die Bundesregierung hat Polen die Weitergabe von fünf Kampfjets aus ehemaligen DDR-Beständen erlaubt. Russische Soldaten dringen in Zentrum von Bachmut ein. Der Tag,,2023-04-13T17:54:26Z,,"When browsing with ads:
We collect personal data and also transmit it to third-party providers
 that help us improve and finance our digital content. Some of the information stored on your device, … [+732 chars]",,de,'Ukraine'
https://www.zeit.de/news/2023-04/13/explosion-in-wohnhaus-fenster-und-tueren-herausgerissen,https://www.zeit.de/news/2023-04/13/explosion-in-wohnhaus-fenster-und-tueren-herausgerissen,0,www.zeit.de,Freiburg im Breisgau: Explosion in Wohnhaus: Fenster und Türen herausgerissen,,,2023-04-13T19:51:20Z,,"When browsing with ads:
We collect personal data and also transmit it to third-party providers
 that help us improve and finance our digital content. Some of the information stored on your device, … [+732 chars]",,de,'Explosion'
https://www.stern.de/gesellschaft/regional/baden-wuerttemberg/freiburg-im-breisgau--explosion-in-wohnhaus--fenster-und-tueren-herausgerissen-33373176.html,https://www.stern.de/gesellschaft/regional/baden-wuerttemberg/freiburg-im-breisgau--explosion-in-wohnhaus--fenster-und-tueren-herausgerissen-33373176.html,0,www.stern.de,Freiburg im Breisgau: Explosion in Wohnhaus: Fenster und Türen herausgerissen,"Bei einer Explosion in einem Wohnhaus in Freiburg sind alle Fenster und Türen aus den Verankerungen gerissen worden. Zwei Personen seien am Donnerstagabend leicht verletzt worden, teilte die Polizei mit. Sie kamen in Krankenhäuser. Weitere Menschen wurden dem…",https://image.stern.de/33373178/t/Hw/v1/w1440/r1.7778/-/13--urnnewsmldpacom2009010123041399306971v2w800h600l1584t844r3341b2878jpeg---fe9121c4c7343ef8.jpg,2023-04-13T19:51:20Z,https://web.archive.org/web/20230413233109/https://www.stern.de/gesellschaft/regional/baden-wuerttemberg/freiburg-im-breisgau--explosion-in-wohnhaus--fenster-und-tueren-herausgerissen-33373176.html,"Bei einer Explosion in einem Wohnhaus in Freiburg sind alle Fenster und Türen aus den Verankerungen gerissen worden. Zwei Personen seien am Donnerstagabend leicht verletzt worden, teilte die Polizei … [+1057 chars]",,de,'Explosion'
https://www.n-tv.de/politik/03-40-Schwere-Kaempfe-an-der-Ostfront--article23143824.html,https://www.n-tv.de/politik/03-40-Schwere-Kaempfe-an-der-Ostfront--article23143824.html,0,www.n-tv.de,Ukraine-Krieg im Liveticker: +++ 03:40 Schwere Kämpfe an der Ostfront +++,"Berlin, Washington, Br\u00fcssel - \u00fcberall. n-tv berichtet von allen wichtigen Schaupl\u00e4tzen der Innen- und Au\u00dfenpolitik.",https://bilder2.n-tv.de/img/incoming/crop23332537/9041326157-cImg_16_9-w1200/Liveticker1-grau-1-Kopie.jpg,2023-04-13T22:15:00Z,,"Die stellvertretende ukrainische Verteidigungsministerin Hannah Malyar berichtet über schwere Kämpfe an allen Teilen der Ostfront. ""Die meisten feindlichen Angriffe finden im Sektor Bachmut statt"", s… [+5221 chars]",,de,'Ukraine'
https://www.stern.de/politik/ausland/ukraine-krieg--pentagon-leck--fbi-nimmt-21-jaehrigen-militaerangehoerigen-fest-33369700.html,https://www.stern.de/politik/ausland/ukraine-krieg--pentagon-leck--fbi-nimmt-21-jaehrigen-militaerangehoerigen-fest-33369700.html,0,www.stern.de,Ukraine-Krieg: Pentagon-Leck: FBI nimmt 21-jährigen Militärangehörigen fest,Das Phantom hinter der Datenleck-Affäre hat ein Gesicht. Nach langem Rätseln überschlagen sich die Ereignisse: Erst legen US-Medien Details zu dem mutmaßlichen Maulwurf offen. Dann rücken FBI-Agenten an.,https://image.stern.de/33373124/t/gB/v2/w1440/r1.7778/-/14--urnnewsmldpacom2009010123041399306385v2w800h600l250t321r1054b819jpeg---6b037d60d7474074.jpg,2023-04-13T23:43:13Z,,Das Phantom hinter der Datenleck-Affäre hat ein Gesicht. Nach langem Rätseln überschlagen sich die Ereignisse: Erst legen US-Medien Details zu dem mutmaßlichen Maulwurf offen. Dann rücken FBI-Agenten… [+5434 chars],,de,'Ukraine'
https://www.stern.de/politik/deutschland/verteidigung--reservistenverband--bundeswehr-reserve-in-desolatem-zustand--33373518.html,https://www.stern.de/politik/deutschland/verteidigung--reservistenverband--bundeswehr-reserve-in-desolatem-zustand--33373518.html,0,www.stern.de,Verteidigung: Reservistenverband: Bundeswehr-Reserve in desolatem Zustand,Bedingt einsatzbereit? Der Angriffskrieg Russlands gegen die Ukraine hat in Deutschland eine Debatte über die Wehrpflicht ausgelöst. Dabei rückt auch die Rolle von Reservisten in den Fokus.,https://image.stern.de/33373520/t/xP/v1/w1440/r1.7778/-/14--urnnewsmldpacom2009010123041499308227v2w800h600l965t1260r3326b2686jpeg---f5fa0410165a4f5f.jpg,2023-04-14T00:27:32Z,,"Bedingt einsatzbereit? Der Angriffskrieg Russlands gegen die Ukraine hat in Deutschland eine Debatte über die Wehrpflicht ausgelöst. Dabei rückt auch die Rolle von Reservisten in den Fokus.
Der Rese… [+1166 chars]",,de,'Ukraine'
https://www.morgenpost.de/politik/inland/article238138623/Reservistenverband-Bundeswehr-Reserve-in-desolatem-Zustand.html,https://www.morgenpost.de/politik/inland/article238138623/Reservistenverband-Bundeswehr-Reserve-in-desolatem-Zustand.html,0,www.morgenpost.de,Verteidigung: Reservistenverband: Bundeswehr-Reserve in desolatem Zustand,Bedingt einsatzbereit? Der Angriffskrieg Russlands gegen die Ukraine hat in Deutschland eine Debatte über die Wehrpflicht ausgelöst. Dabei rückt auch die Rolle von Reservisten in den Fokus.,https://img.morgenpost.de/img/inland/crop238138621/2302608677-w820-cv16_9-q85/Bundeswehr.jpg,2023-04-14T00:27:32Z,,"Berlin. Der Reservistenverband sieht die Reserve der Bundeswehr in einem desolaten Zustand. Sie ist eine Truppe, die noch weitgehend auf dem Papier existiert, sagte Verbandspräsident Patrick Sensburg… [+1108 chars]",,de,'Ukraine'
https://www.morgenpost.de/politik/ausland/article238138627/Baerbock-in-China-Gespraeche-ueber-Russland-und-Taiwan.html,https://www.morgenpost.de/politik/ausland/article238138627/Baerbock-in-China-Gespraeche-ueber-Russland-und-Taiwan.html,0,www.morgenpost.de,Diplomatie: Baerbock in China: Gespräche über Russland und Taiwan,Es ist der wohl heikelste Teil des Besuches von Außenministerin Baerbock in der Volksrepublik: Bei politischen Gesprächen in Peking dürfte es auch um Menschenrechte gehen - und um globale Konflikte.,https://img.morgenpost.de/img/ausland/crop238138625/3602602330-w820-cv16_9-q85/Aussenministerin-Baerbock.jpg,2023-04-14T00:47:58Z,,Tianjin. Außenministerin Annalena Baerbock hat an diesem Freitag mit Gesprächen in einem deutschen Unternehmen für Elektromobilität in der Hafenstadt Tianjin ihren Besuch in China fortgesetzt. Der au… [+1583 chars],,de,'Russland'
https://www.zeit.de/news/2023-04/14/baerbock-in-china-gespraeche-ueber-russland-und-taiwan,https://www.zeit.de/news/2023-04/14/baerbock-in-china-gespraeche-ueber-russland-und-taiwan,0,www.zeit.de,Diplomatie: Baerbock in China: Gespräche über Russland und Taiwan,,,2023-04-14T00:47:58Z,,"When browsing with ads:
We collect personal data and also transmit it to third-party providers
 that help us improve and finance our digital content. Some of the information stored on your device, … [+732 chars]",,de,'Russland'
https://www.stern.de/politik/ausland/diplomatie--baerbock-in-china--gespraeche-ueber-russland-und-taiwan-33373552.html,https://www.stern.de/politik/ausland/diplomatie--baerbock-in-china--gespraeche-ueber-russland-und-taiwan-33373552.html,0,www.stern.de,Diplomatie: Baerbock in China: Gespräche über Russland und Taiwan,Es ist der wohl heikelste Teil des Besuches von Außenministerin Baerbock in der Volksrepublik: Bei politischen Gesprächen in Peking dürfte es auch um Menschenrechte gehen - und um globale Konflikte.,https://image.stern.de/33373554/t/ke/v1/w1440/r1.7778/-/14--urnnewsmldpacom2009010123041499308305v3w800h600l108t307r1388b1235jpeg---565c9d48014a4990.jpg,2023-04-14T00:47:58Z,,Es ist der wohl heikelste Teil des Besuches von Außenministerin Baerbock in der Volksrepublik: Bei politischen Gesprächen in Peking dürfte es auch um Menschenrechte gehen - und um globale Konflikte.,,,
https://www.tagesschau.de/newsticker/liveblog-ukraine-freitag-249.html,https://www.tagesschau.de/newsticker/liveblog-ukraine-freitag-249.html,0,www.tagesschau.de,Liveblog: ++ EU belegt Wagner-Gruppe mit Sanktionen ++,Die EU hat die Söldnergruppe Wagner wegen der Teilnahme am russischen Angriffskrieg mit Sanktionen belegt. Die Ukraine berichtet über schwere Kämpfe an allen Teilen der Ostfront. Die Entwicklungen im Liveblog.,https://www.tagesschau.de/multimedia/bilder/wagner-gruppe-103~_v-original.jpg,2023-04-14T01:46:02Z,https://web.archive.org/web/20230414025558/http://www.tagesschau.de/newsticker/liveblog-ukraine-freitag-249.html,Die EU hat die Söldnergruppe Wagner wegen der Teilnahme am russischen Angriffskrieg mit Sanktionen belegt. Die Ukraine berichtet über schwere Kämpfe an allen Teilen der Ostfront. Die Entwicklungen im… [+2491 chars],,de,'Waffen'
https://www.zeit.de/wirtschaft/geldanlage/2023-04/inflation-reduction-act-joe-biden-money-matters,https://www.zeit.de/wirtschaft/geldanlage/2023-04/inflation-reduction-act-joe-biden-money-matters,0,www.zeit.de,"Inflation Reduction Act: Danke, Mr. President!","Die USA stecken viel Geld in die Energiewende. Wer davon etwas abhaben will, muss verstehen, welche Firmen von der US-Industriepolitik profitieren – und welche nicht.",,2023-04-14T03:26:10Z,,"When browsing with ads:
We collect personal data and also transmit it to third-party providers
 that help us improve and finance our digital content. Some of the information stored on your device, … [+732 chars]",,de,'Inflation'
https://www.focus.de/politik/ausland/ukraine-krieg-eu-sanktionen-gegen-russische-soeldnertruppe-wagner_id_57275780.html,https://www.focus.de/politik/ausland/ukraine-krieg-eu-sanktionen-gegen-russische-soeldnertruppe-wagner_id_57275780.html,0,www.focus.de,Ukraine-Krieg - Stimmen und Entwicklungen - Bundesregierung genehmigt Polen die Lieferung von Kampfjets,EU erhebt Sanktionen gegen die russische Söldnertruppe Wagner. Berlin genehmigt Polen die Lieferung von MiG-29 an die Ukraine. Russische Söldner wurden offenbar auf einem Enthauptungsvideo identifiziert. Alle News zum Krieg in der Ukraine im Newsticker.,https://p6.focus.de/img/politik/ausland/id_181422031/kampfflugzeugefuerdieukraine.jpg?im=Crop%3D%280%2C171%2C2048%2C1024%29%3BResize%3D%281200%2C627%29&hash=b4dedb0cb5e6795c2ff052dba824ed93492e2b69502f055a7ae6b23601647b86,2023-04-14T04:28:33Z,https://web.archive.org/web/20230414043824/https://www.focus.de/politik/ausland/ukraine-krieg-eu-sanktionen-gegen-russische-soeldnertruppe-wagner_id_57275780.html,EU erhebt Sanktionen gegen die russische Söldnertruppe Wagner. Berlin genehmigt Polen die Lieferung von MiG-29 an die Ukraine. Russische Söldner wurden offenbar auf einem Enthauptungsvideo identifizi… [+10174 chars],,de,'Explosion'
https://www.welt.de/politik/ausland/article244765274/Ukraine-Russischer-Geheimdienst-sucht-Ukrainer-nach-Mord-an-Blogger-Wladlen-Tatarski.html,https://www.welt.de/politik/ausland/article244765274/Ukraine-Russischer-Geheimdienst-sucht-Ukrainer-nach-Mord-an-Blogger-Wladlen-Tatarski.html,0,www.welt.de,Russischer Geheimdienst sucht Ukrainer nach Mord an Blogger Wladlen Tatarski,"Im Fall um den getöteten Militärblogger Wladen Tatarski, will Russland den Täter identifiziert haben. Ein Ukrainer soll demnach den Sprengsatz installiert haben und in die Türkei geflohen sein. Die Bundesregierung gibt Polen derweil grünes Licht für die Liefe…",https://img.welt.de/img/politik/ausland/mobile244665348/2511359307-ci16x9-w1200/The-consequences-of-the-destruction-of-the-building-after-a-2.jpg,2023-04-14T05:36:00Z,https://web.archive.org/web/20230414100000/http://www.welt.de/politik/ausland/article244765274/Ukraine-Russischer-Geheimdienst-sucht-Ukrainer-nach-Mord-an-Blogger-Wladlen-Tatarski.html,Nach dem Mord an einem russischen Militärblogger in St. Petersburg hat der Moskauer Geheimdienst FSB eigenen Angaben zufolge einen Ukrainer als Urheber des Sprengstoffanschlags identifiziert. Der 35-… [+28640 chars],,de,'Ukraine'
https://orf.at/stories/3312561/,https://orf.at/stories/3312561/,0,orf.at,18.000 Rinder nach Explosion in Texas getötet,,https://orf.at/mojo/1_4_1/storyserver//news/common/images/og-fallback-news.png,2023-04-14T05:59:22Z,https://web.archive.org/web/20230414074214/https://orf.at/stories/3312561/,Bei einer mutmaßlichen Methanexplosion und einem Brand in einem Milchviehbetrieb im US-Bundesstaat Texas sind rund 18.000 Rinder verendet. Ein Mitarbeiter des Betriebs konnte aus dem Inneren eines Ge… [+693 chars],,de,'Explosion'
https://www.zeit.de/news/2023-04/14/einbrecher-von-wachmann-in-bankfiliale-ueberrascht-flucht,https://www.zeit.de/news/2023-04/14/einbrecher-von-wachmann-in-bankfiliale-ueberrascht-flucht,0,www.zeit.de,Kriminalität: Einbrecher von Wachmann in Bankfiliale überrascht: Flucht,,,2023-04-14T06:15:54Z,,"When browsing with ads:
We collect personal data and also transmit it to third-party providers
 that help us improve and finance our digital content. Some of the information stored on your device, … [+732 chars]",,de,'Flucht'
