index,url,valid,domain,title,description,image,published,archive,content,quote,language,keyword
https://www.faz.net/aktuell/politik/ukraine-liveticker-baerbock-bekraeftigt-skepsis-gegenueber-nato-fonds-fuer-die-ukraine-i-faz-19030454.html,https://www.faz.net/aktuell/politik/ukraine-liveticker-baerbock-bekraeftigt-skepsis-gegenueber-nato-fonds-fuer-die-ukraine-i-faz-19030454.html,0,www.faz.net,Ukraine-Liveblog: Baerbock bekräftigt Skepsis gegenüber NATO-Fonds für die Ukraine,Ukraine meldet Tote nach russischen Luftangriffen auf Charkiw +++ Französischer und russischer Verteidigungsminister telefonieren erstmals seit 2022 +++ AfD verlangt von Bystron Erklärung über mögliche russische Finanzierung +++ alle Entwicklungen im Liveblog.,https://media0.faz.net/ppmedia/aktuell/politik/3627864396/1.9630022/facebook_teaser/annalena-baerbock-und-jens-stoltenberg-beim-nato-aussenministertreffen-in-bruessel-am-mittwoch.jpg,2024-04-04T07:34:14Z,,"Der AfD-Bundestagsabgeordnete Petr Bystron soll seiner Partei Auskunft über Vorwürfe geben, die in der tschechischen Zeitung Deník N gegen ihn im Zusammenhang mit einer möglichen verdeckten russische… [+1314 chars]",,de,'Ukraine'
https://www.zeit.de/news/2024-04/04/telefonate-ueber-brief-an-putin-und-abschaltung-der-brd,https://www.zeit.de/news/2024-04/04/telefonate-ueber-brief-an-putin-und-abschaltung-der-brd,0,www.zeit.de,Terrorprozess: Telefonate über Brief an Putin und Abschaltung der BRD,Hier finden Sie Informationen zu dem Thema „Terrorprozess“. Lesen Sie jetzt „Telefonate über Brief an Putin und Abschaltung der BRD“.,https://img.zeit.de/news/2024-04/04/telefonate-ueber-brief-an-putin-und-abschaltung-der-brd-image-group/wide__1300x731,2024-04-04T10:07:21Z,,Im Prozess gegen mutmaßliche Mitglieder einer Terrorgruppe mit Umsturzplänen sind bei der Verhandlung vor dem Oberlandesgericht Koblenz am Donnerstag mehrere aufgezeichnete Telefonate abgespielt word… [+2580 chars],,de,'Putin'
https://taz.de/Die-Heizung-bleibt-aus/!5999989/,https://taz.de/Die-Heizung-bleibt-aus/!5999989/,0,taz.de,Die Heizung bleibt aus: Meine Winter im Skianzug,"Vor zwei Jahren, als durch Russlands Angriffskrieg eine Gasknappheit drohte, kaufte sich unsere Autorin einen Skianzug. Sie wollte gewappnet sein.",https://taz.de/picture/6905249/948/35022843-1.jpeg,2024-04-04T10:24:00Z,,"Vor zwei Jahren, als durch Russlands Angriffskrieg eine Gasknappheit drohte, kaufte sich unsere Autorin einen Skianzug. Sie wollte gewappnet sein.
Skianzüge sind nicht nur warm, sondern auch ganz sc… [+5552 chars]",,de,'Russland'
https://www.zeit.de/politik/ausland/2024-04/oesterreich-justiz-ministerin-alma-zadic-spionage-skandal-jan-marsalek,https://www.zeit.de/politik/ausland/2024-04/oesterreich-justiz-ministerin-alma-zadic-spionage-skandal-jan-marsalek,0,www.zeit.de,Österreich: Österreichs Justizministerin will nach Spionagefall Gesetz verschärfen,Nach der Festnahme eines mutmaßlichen Spions will Alma Zadić das Strafrecht ausweiten. Ein österreichischer Ex-Verfassungsschützer soll für Russland spioniert haben.,https://img.zeit.de/politik/ausland/2024-04/spionageskandal-oesterreich-justizministerin-alma-zadic/wide__1300x731,2024-04-04T12:59:49Z,,"Österreichs Justizministerin Alma Zadi (Grüne) will vor dem Hintergrund eines mutmaßlichen Spionageskandals das Strafrecht nachschärfen. Derzeit sind Agententätigkeiten nur zum Nachteil Österreichs
… [+2755 chars]",,de,'Russland'
https://www.sueddeutsche.de/bayern/wenzenbach-regensburg-fernwaerme-waermenetz-insolvenz-1.6519553,https://www.sueddeutsche.de/bayern/wenzenbach-regensburg-fernwaerme-waermenetz-insolvenz-1.6519553,0,www.sueddeutsche.de,"Ärger um Heizung: ""Die am wenigsten haben, zahlen den höchsten Preis""","Kein heißes Wasser, keine Heizung - in Wenzenbach bei Regensburg sitzen immer noch rund 35 Familien in der Kälte. Sie sind zwar an ein Fernwärmenetz angeschlossen, doch der Anbieter ging pleite. Nicht nur in Wenzenbach fragen sie sich: Wie hätte das verhinder…",https://www.sueddeutsche.de/image/sz.1.6519783/1200x675?v=1712240509,2024-04-04T14:21:52Z,https://web.archive.org/web/20240404152406/https://www.sueddeutsche.de/bayern/wenzenbach-regensburg-fernwaerme-waermenetz-insolvenz-1.6519553,"Das Heizungs-Drama in der Gemeinde Wenzenbach bei Regensburg geht in die nächste Runde. Seit mehr als einem Monat frieren sie im Ortsteil Roither Berg, weil ihr Fernwärme-Anbieter EVW Heizung und War… [+3589 chars]",,de,'Frieren'
https://www.faz.net/aktuell/politik/ukraine-liveticker-ukraine-fordert-mehr-luftabwehrsysteme-von-der-nato-i-faz-19030454.html,https://www.faz.net/aktuell/politik/ukraine-liveticker-ukraine-fordert-mehr-luftabwehrsysteme-von-der-nato-i-faz-19030454.html,0,www.faz.net,Ukraine-Liveblog: Ukraine fordert mehr Luftabwehrsysteme von der NATO,Ampel sendet gemischte Signale zu NATO-Fonds für die Ukraine +++ Ukraine meldet Tote nach russischen Luftangriffen auf Charkiw +++ Französischer und russischer Verteidigungsminister telefonieren erstmals seit 2022 +++ alle Entwicklungen im Liveblog.,https://media1.faz.net/ppmedia/aktuell/politik/907756103/1.9631551/facebook_teaser/dmytro-kuleba-links-aussenminister-der-ukraine-mit-nato-generalsekretaer-jens-stoltenberg-vor-einer-sitzung-des-nato-ukraine-rates-im-nato-hauptquartier-am-donnerstag.jpg,2024-04-04T14:40:27Z,,"Der ukrainische Außenminister Dmytro Kuleba hat die NATO-Staaten eindringlich aufgefordert, seinem Land mehr Luftabwehrsysteme zu liefern. Das berichtet unser Korrespondent in Brüssel, Thomas Gutschk… [+1436 chars]",,de,'Ukraine'
https://www.bild.de/politik/inland/politik-inland/emotionaler-bosbach-bei-illner-setzt-sich-putin-durch-ist-die-ukraine-am-ende-87763382.bild.html,https://www.bild.de/politik/inland/politik-inland/emotionaler-bosbach-bei-illner-setzt-sich-putin-durch-ist-die-ukraine-am-ende-87763382.bild.html,0,www.bild.de,"Bosbach emotional bei Illner  - „Setzt sich Putin durch, ist die Ukraine am Ende!“",Im mörderischen Bombenhagel der Russen droht der Ukraine jetzt die völlige Vernichtung. CDU-Urgestein Wolfgang Bosbach hat jetzt bei Maybrit Illner emotional wie selten reagiert.,"https://images.bild.de/660f382d574997460e15db1a/0bacd970ba8739ef98f50d4c4dbbfbd1,f8cd2398?w=1280",2024-04-05T00:09:33Z,,"Alarmstufe Rot! Im mörderischen Bombenhagel der Russen droht der Ukraine jetzt die völlige Vernichtung. Doch der Kanzler setzt seine stärkste Waffe, die Taurus, trotzdem nicht ein.
Jetzt hat CDU-Urg… [+3168 chars]",,de,'Nordstream'
https://www.sueddeutsche.de/bayern/ukrainer-arbeitsmarkt-bayern-jobsuche-verschenktes-potenzial-1.6522142,https://www.sueddeutsche.de/bayern/ukrainer-arbeitsmarkt-bayern-jobsuche-verschenktes-potenzial-1.6522142,0,www.sueddeutsche.de,Flucht nach Bayern: Das verschenkte Potenzial aus der Ukraine,"Zwei Jahre nach dem Überfall auf das Land hat knapp jeder dritte Ukrainer in Bayern einen Job gefunden. Das heißt aber auch: Zwei Drittel von denen, die theoretisch arbeiten können, tun es nicht. Dabei verfügen viele über ein gutes Ausbildungsniveau.",https://www.sueddeutsche.de/image/sz.1.6522145/1200x675?v=1712334115,2024-04-05T11:31:22Z,,"Zwei Jahre nach dem Überfall auf das Land hat knapp jeder dritte Ukrainer in Bayern einen Job gefunden. Das heißt aber auch: Zwei Drittel von denen, die theoretisch arbeiten können, tun es nicht. Dab… [+1169 chars]",,de,'Flucht'
https://www.bild.de/sport/fussball/werder-bremen/werder-bremen-flucht-alarm-auf-diese-talente-muss-werder-jetzt-aufpassen-87766810.bild.html,https://www.bild.de/sport/fussball/werder-bremen/werder-bremen-flucht-alarm-auf-diese-talente-muss-werder-jetzt-aufpassen-87766810.bild.html,0,www.bild.de,Flucht-Alarm! - Auf diese Talente muss Werder aufpassen!,Wie sieht Werders Zukunft aus? Mit Nick Woltemade und Eren Dinkci haben gleich zwei Bremer Jung-Stars innerhalb von zwei Tagen ihren Abschied erklärt.,"https://images.bild.de/660fc28f7131b3703ec15378/7b6f3f629b8a21cc8c0da044eb393e07,abf7fda1?w=1280",2024-04-05T12:22:30Z,,"Wie sieht Werders Zukunft aus?
Mit Nick Woltemade und Eren Dinkci (beide 22) haben gleich zwei Bremer Jung-Stars in nicht mal 48 Stunden ihren Abschied bekannt gegeben.
Die Bemühungen, beide Eigeng… [+2209 chars]",,de,'Flucht'
https://www.welt.de/vermischtes/kriminalitaet/article250886712/Dortmund-13-Jaehriger-soll-Obdachlosen-erstochen-haben.html,https://www.welt.de/vermischtes/kriminalitaet/article250886712/Dortmund-13-Jaehriger-soll-Obdachlosen-erstochen-haben.html,0,www.welt.de,Obdachloser stirbt nach Streit mit Jugendlichen – 13-Jähriger soll ihn erstochen haben,"Am Donnerstagabend ist ein 31-jähriger obdachloser Mann am Dortmunder Hafen offenbar mit vier Minderjährigen in einen Streit geraten, der tödlich endete. Die Jugendlichen wurden nach kurzer Flucht festgenommen. Ein 13-Jähriger soll den Mann erstochen haben.",https://img.welt.de/img/vermischtes/kriminalitaet/mobile250886764/8831353187-ci16x9-w1200/Toter-bei-Streit-am-Hafen-Dortmund.jpg,2024-04-05T12:24:00Z,,"Ein 13-jähriger Junge soll einen Obdachlosen am Dortmunder Hafen getötet haben. Das teilten Polizei und Staatsanwaltschaft am Freitag mit. Ein Handyvideo zeige, wie das Kind am Donnerstagabend mit ei… [+1836 chars]",,de,'Flucht'
https://www.golem.de/sonstiges/zustimmung/auswahl.html?from=https://www.golem.de/news/minister-warnt-russland-attackiert-vermehrt-europaeische-eisenbahnen-2404-183872.html&referer=https://t.co/902de2855c,https://www.golem.de/sonstiges/zustimmung/auswahl.html?from=https://www.golem.de/news/minister-warnt-russland-attackiert-vermehrt-europaeische-eisenbahnen-2404-183872.html&referer=https://t.co/902de2855c,0,www.golem.de,Minister warnt: Russland attackiert vermehrt europäische Eisenbahnen,"Den Angaben zufolge werden nicht nur Signalsysteme und Netzwerke der Eisenbahngesellschaften gestört, es finden auch Angriffe auf Fahrkartensysteme und andere Dienste statt. (Kritis, Cyberwar)",,2024-04-05T12:27:01Z,,"Besuchen Sie Golem.de wie gewohnt mit Werbung und Tracking,
 indem Sie der Nutzung aller Cookies zustimmen.
 Details zum Tracking finden Sie im Privacy Center.
Skript wurde nicht geladen. Informat… [+607 chars]",,de,'Russland'
https://www.tagesspiegel.de/die-besten-streaming-serien-und-filme-der-woche-frederick-lau-auf-der-flucht-colin-farrell-auf-der-suche-und-diverse-rauberpistolen-11458937.html,https://www.tagesspiegel.de/die-besten-streaming-serien-und-filme-der-woche-frederick-lau-auf-der-flucht-colin-farrell-auf-der-suche-und-diverse-rauberpistolen-11458937.html,0,www.tagesspiegel.de,"Die besten Streaming-Serien und Filme der Woche: Frederick Lau auf der Flucht, Colin Farrell auf der Suche und diverse Räuberpistolen","Was Sie in diesen Tagen in den Mediatheken nicht verpassen sollten, haben wir für Sie zusammengetragen.",https://www.tagesspiegel.de/images/colin-farrell-als-john-sugar/alternates/BASE_16_9_W1400/colin-farrell-als-john-sugar.jpeg,2024-04-05T13:05:55Z,,"Stark werbereduziertin der Tagesspiegel App 
 Exklusive Inhalte fürTagesspiegel Plus-Leser 
 Ohne Risiko:Jederzeit kündbar",,de,'Flucht'
https://www.n-tv.de/wirtschaft/Russland-hat-die-Raiffeisen-Bank-als-Geisel-genommen-article24848191.html,https://www.n-tv.de/wirtschaft/Russland-hat-die-Raiffeisen-Bank-als-Geisel-genommen-article24848191.html,0,www.n-tv.de,"Sanktionen oder kreative Flucht?: ""Russland hat die Raiffeisen Bank als Geisel genommen""","Die Raiffeisen Bank hat es sich mit allen verscherzt. Mit der Ukraine. Mit den USA. Mit der EU. Denn gut zwei Jahre nach Kriegsbeginn verdienen die Österreicher noch immer prächtig in Russland und versuchen das Unmögliche: Das Land zu verlassen, ohne das Geld…",https://bilder2.n-tv.de/img/incoming/crop24851797/4291322026-cImg_16_9-w1200/452237323.jpg,2024-04-05T13:08:04Z,,Die Raiffeisen Bank hat es sich mit allen verscherzt. Mit der Ukraine. Mit den USA. Mit der EU. Denn gut zwei Jahre nach Kriegsbeginn verdienen die Österreicher noch immer prächtig in Russland und ve… [+8418 chars],,de,'Russland'
https://www.tagesspiegel.de/politik/lieber-nicht-regieren-warum-die-fdp-mit-sich-selbst-unzufrieden-ist-11472395.html,https://www.tagesspiegel.de/politik/lieber-nicht-regieren-warum-die-fdp-mit-sich-selbst-unzufrieden-ist-11472395.html,0,www.tagesspiegel.de,Lieber nicht regieren?: Warum die FDP mit sich selbst unzufrieden ist,Die Freien Demokraten fühlen sich in der Ampel eingesperrt. Aber die Flucht in die Opposition ist auch keine Lebensversicherung.,https://www.tagesspiegel.de/images/abschluss-fdp-bundesparteitag/alternates/BASE_16_9_W1400/abschluss-fdp-bundesparteitag.jpeg,2024-04-05T13:22:00Z,,Christian Lindner ist derzeit auf allen Kanälen unterwegs. Kein Tag vergeht ohne eine Neuigkeit vom Bundesfinanzminister. Oder eine Nettigkeit gegenüber SPD und Grünen. Lindner fordert weniger Bürger… [+241 chars],,de,'Flucht'
https://www.n-tv.de/panorama/JVA-schottet-Klette-weiter-von-Mitgefangenen-ab-article24853244.html,https://www.n-tv.de/panorama/JVA-schottet-Klette-weiter-von-Mitgefangenen-ab-article24853244.html,0,www.n-tv.de,Erhöhte Fluchtgefahr bestätigt: JVA schottet Klette weiter von Mitgefangenen ab,"Kaum Kontakt zu anderen Häftlingen, Videoüberwachung in der Zelle: Die Haftbedingungen der ehemaligen RAF-Terroristin Daniela Klette bleiben streng. Auch eine erhöhte Fluchtgefahr besteht nach Auffassung der Behörden aus gleich mehreren Gründen weiterhin.",https://bilder1.n-tv.de/img/incoming/crop24853256/1261329574-cImg_16_9-w1200/451304950.jpg,2024-04-05T13:53:25Z,,"Kaum Kontakt zu anderen Häftlingen, Videoüberwachung in der Zelle: Die Haftbedingungen der ehemaligen RAF-Terroristin Daniela Klette bleiben streng. Auch eine erhöhte Fluchtgefahr besteht nach Auffas… [+2686 chars]",,de,'Flucht'
https://www.diepresse.com/18339154/norwegens-historische-explosion-der-streitkraefte,https://www.diepresse.com/18339154/norwegens-historische-explosion-der-streitkraefte,0,www.diepresse.com,Norwegens historische Explosion der Streitkräfte,Die Mitte-Links-Regierung leitet eine annähernde Verdoppelung des Militärbudgets und des Streitkräfteumfangs über die kommenden zwölf Jahre ein. Hintergrund sind der Ukraine-Krieg und mögliche Bedrohungen durch den Nachbarn Russland.,https://img.diepresse.com/public/incoming/u2bqzz-20191030J%C3%98_8031.jpg/alternates/DPR_SOCIAL_NACHRICHTEN/20191030J%C3%98_8031.jpg,2024-04-05T14:23:43Z,,Die Mitte-Links-Regierung leitet eine annähernde Verdoppelung des Militärbudgets und des Streitkräfteumfangs über die kommenden zwölf Jahre ein. Hintergrund sind der Ukraine-Krieg und mögliche Bedroh… [+4397 chars],,de,'Ukraine'
https://www.zeit.de/politik/2024-04/hilfslieferungen-gaza-grenzoeffnung-israel-rechtsextremismus-nachrichtenpodcast,https://www.zeit.de/politik/2024-04/hilfslieferungen-gaza-grenzoeffnung-israel-rechtsextremismus-nachrichtenpodcast,0,www.zeit.de,Nachrichtenpodcast: Benjamin Netanjahu gibt nach,Israels Ministerpräsident will einen Grenzübergang und einen Hafen für Hilfslieferungen nach Gaza öffnen. Und: Warum noch immer 1.000 Rechtsextreme legal Waffen besitzen.,https://img.zeit.de/politik/2017-09/illu-podcast-news/wide__8ed8a6__1300x731,2024-04-05T15:19:07Z,,Seit Wochen weisen Hilfsorganisationen auf die humanitäre Katastrophe im Gazastreifen hin. Am Freitagmorgen hat der israelische Ministerpräsident Benjamin Netanjahu nach einem Telefonat mit US-Präsid… [+2462 chars],,de,'Waffen'
https://www.faz.net/aktuell/politik/ukraine-liveticker-zwei-tote-und-sechs-verletzte-nach-angriff-auf-saporischschja-faz-19030454.html,https://www.faz.net/aktuell/politik/ukraine-liveticker-zwei-tote-und-sechs-verletzte-nach-angriff-auf-saporischschja-faz-19030454.html,0,www.faz.net,Ukraine-Liveblog: Zwei Tote und sechs Verletzte nach Angriff auf Saporischschja,Angriffe auf russische Militärflugplätze +++ Ukraine fordert mehr Luftabwehrsysteme von der NATO +++ Ampel sendet gemischte Signale zu NATO-Fonds für die Ukraine +++ Ukraine meldet Tote nach russischen Luftangriffen auf Charkiw +++ alle Entwicklungen im Liveb…,https://media1.faz.net/ppmedia/aktuell/politik/1120167990/1.9634669/facebook_teaser/saporischschja-anwohner.jpg,2024-04-05T15:51:31Z,,In der Nähe der ostukrainischen Stadt Tschassiw Jar toben nach Angaben des ukrainischen Militärs erbitterte Kämpfe mit den russischen Invasionstruppen. Die gegnerischen Einheiten hätten aber noch nic… [+968 chars],,de,'Ukraine'
https://www.tagesspiegel.de/politik/erhohte-fluchtgefahr-ex-raf-terroristin-klette-bleibt-unter-strengen-bedingungen-in-haft-11474492.html,https://www.tagesspiegel.de/politik/erhohte-fluchtgefahr-ex-raf-terroristin-klette-bleibt-unter-strengen-bedingungen-in-haft-11474492.html,0,www.tagesspiegel.de,Erhöhte Fluchtgefahr: Ex-RAF-Terroristin Klette bleibt unter strengen Bedingungen in Haft,"Die ehemalige RAF-Terroristin sitzt in Untersuchungshaft - streng abgeschieden von anderen Gefangenen. Auch dass ihr Haftraum videoüberwacht wird, sei dem Amtsgericht zufolge zulässig.",https://www.tagesspiegel.de/images/fahndung-nach-ex-raf-terroristen-haftprufung4/alternates/BASE_16_9_W1400/fahndung-nach-ex-raf-terroristen---haftpruefung.jpeg,2024-04-05T17:08:32Z,,"Die frühere RAF-Terroristin Daniela Klette bleibt im Gefängnis streng abgeschieden von anderen Gefangenen. Auch die Videoaufzeichnung im Haftraum sei zulässig, sagte ein Sprecher des Amtsgerichts Ver… [+3122 chars]",,de,'Flucht'
https://www.jungewelt.de/artikel/472789.karibik-hunderttausende-haitianer-auf-der-flucht.html,https://www.jungewelt.de/artikel/472789.karibik-hunderttausende-haitianer-auf-der-flucht.html,0,www.jungewelt.de,Karibik: Hunderttausende Haitianer auf der Flucht [Online-Abo],Organisationen wie die IOM und Amnesty International prangern die dramatische Situation in dem von Gewalt gezeichneten Land an. Der Dominikanischen Republik wird eine rassistische Abschiebepolitik vorgeworfen.,https://www.jungewelt.de/img/1100/193353.jpg,2024-04-05T17:41:09Z,,"Uneingeschränkter Zugriff auf alle Inhalte: Erleben Sie die Tageszeitung junge Welt in gedruckter oder digitaler Form oder beides kombiniert.
Nachrichtenauswahl und -aufbereitung erfordern finanziel… [+458 chars]",,de,'Flucht'
https://www.zeit.de/politik/deutschland/2024-04/gerhard-schroeder-altkanzler-chinapolitik-peking,https://www.zeit.de/politik/deutschland/2024-04/gerhard-schroeder-altkanzler-chinapolitik-peking,0,www.zeit.de,Gerhard Schröder: Der Altkanzler kann auch gut mit China,"Gerhard Schröder ist bekannt für seine Beziehungen zum Putin-Regime. Eher unterbelichtet ist dagegen, dass er auch unter Chinas Machthabern ein gern gesehener Gast ist.",https://img.zeit.de/politik/ausland/2024-04/altkanzler-gerhard-schroeder/wide__1300x731,2024-04-06T07:25:58Z,,"Inhalt
Auf einer Seite lesen
 Inhalt
<ol><li>Seite 1Der Altkanzler kann auch gut mit China
</li><li>Seite 2Schröder ist kein Einzelfall</li></ol>
Die Netzwerke des Pro-China-Lobbyismus bedürfen … [+6437 chars]",,de,'Putin'
https://www.zeit.de/news/2024-04/06/tausende-nach-ueberschwemmungen-in-russland-evakuiert,https://www.zeit.de/news/2024-04/06/tausende-nach-ueberschwemmungen-in-russland-evakuiert,0,www.zeit.de,Unwetter: Tausende nach Überschwemmungen in Russland evakuiert,Hier finden Sie Informationen zu dem Thema „Unwetter“. Lesen Sie jetzt „Tausende nach Überschwemmungen in Russland evakuiert“.,https://img.zeit.de/news/2024-04/06/tausende-nach-ueberschwemmungen-in-russland-evakuiert-image-group/wide__1300x731,2024-04-06T13:18:51Z,,Wegen schweren Hochwassers und eines Dammbruchs müssen in der Region Orenburg südwestlich des Uralgebirges Tausende Menschen evakuiert werden. «Die Situation entwickelt sich schnell zum schlechteren»… [+2065 chars],,de,'Russland'
https://www.faz.net/aktuell/politik/ukraine-liveticker-ukraine-dementiert-russischen-durchbruch-im-osten-19030454.html,https://www.faz.net/aktuell/politik/ukraine-liveticker-ukraine-dementiert-russischen-durchbruch-im-osten-19030454.html,0,www.faz.net,Ukraine-Liveblog: Ukraine dementiert russischen Durchbruch im Osten,Sechs Tote und zehn Verletzte bei Drohnenangriff auf Charkiw +++ Gouverneur: Russen haben in Saporischschja gezielt anrückende Rettungskräfte angegriffen +++ Selenskyj gedenkt der Rückeroberung von Tschernihiw +++  alle Entwicklungen im Liveblog.,https://media1.faz.net/ppmedia/aktuell/politik/1392189636/1.9635797/facebook_teaser/ein-ukrainischer-panzer-in.jpg,2024-04-06T13:52:24Z,,"Nach dem einem nächtlichen russischen Drohnenangriff auf die Millionenstadt Charkiw im Nordosten der Ukraine ist die Opferzahl auf sechs gestiegen. Zehn weitere Menschen hätten Verletzungen erlitten,… [+1112 chars]",,de,'Ukraine'
https://www.zeit.de/gesellschaft/zeitgeschehen/2024-04/dammbruch-hochwasser-russland-tausende-evakuiert,https://www.zeit.de/gesellschaft/zeitgeschehen/2024-04/dammbruch-hochwasser-russland-tausende-evakuiert,0,www.zeit.de,Hochwasser: Tausende Menschen nach Dammbruch in Russland in Sicherheit gebracht,"In Südrussland sorgt das Frühjahrshochwasser des Flusses Ural für schwere Überflutungen. Ein Damm ist gebrochen, die Staatsanwaltschaft ermittelt wegen Fahrlässigkeit.",https://img.zeit.de/gesellschaft/zeitgeschehen/2024-04/ueberschwemmung-russland-bild/wide__1300x731,2024-04-06T14:33:02Z,,Aufgrund eines schweren Hochwassers und eines Dammbruchs in der russischen Region Orenburg werden Tausende Menschen in Sicherheit gebracht. Nach Behördenangaben sind mehrere Städte und Ortschaften vo… [+2250 chars],,de,'Russland'
https://www.bild.de/politik/inland/politik/gerhard-schroeder-wird-80-scholz-gratuliert-dem-alt-kanzler-mit-geheim-brief-87779892.bild.html,https://www.bild.de/politik/inland/politik/gerhard-schroeder-wird-80-scholz-gratuliert-dem-alt-kanzler-mit-geheim-brief-87779892.bild.html,0,www.bild.de,Den 60. und 70. feierte er mit Putin - Schröder heute 80! Scholz gratuliert in Geheimbrief,"Das kennen viele Familien: Was macht man mit dem Onkel, der hässliche Dinge sagt, schlimme Freunde hat und unappetitliche Geschäfte betreibt? Vor diesem Problem standen auch Frank-Walter Steinmeier, Olaf Scholz und die SPD. Denn ihr Genosse, Alt-Kanzler Gerha…","https://images.bild.de/66113142d6309272985f4846/0fde97ebd238e0ee10b9d36e63411b5c,7d9682f5?w=1280",2024-04-06T22:19:36Z,,"Das kennen viele Familien: Was macht man mit dem Onkel, der hässliche Dinge sagt, schlimme Freunde hat und unappetitliche Geschäfte betreibt?
Vor diesem Problem standen auch Bundespräsident Frank-Wa… [+3946 chars]",,de,'Putin'
https://www.faz.net/aktuell/politik/ukraine-liveticker-ukraine-braucht-fuer-vollstaendigen-schutz-25-patriot-abwehrsysteme-19030454.html,https://www.faz.net/aktuell/politik/ukraine-liveticker-ukraine-braucht-fuer-vollstaendigen-schutz-25-patriot-abwehrsysteme-19030454.html,0,www.faz.net,Ukraine-Liveblog: Ukraine braucht für vollständigen Schutz 25 Patriot-Abwehrsysteme,Selenskyj hofft auf baldigen Friedensgipfel in der Schweiz +++ Luftwaffe fängt über Ostsee russisches Aufklärungsflugzeug ab +++ Ukraine dementiert russischen Durchbruch im Osten +++ alle Entwicklungen im Liveblog.,https://media0.faz.net/ppmedia/aktuell/politik/2610988572/1.9636206/facebook_teaser/ein-patriot-startgeraet-steht.jpg,2024-04-07T03:52:31Z,,Der vor wenigen Wochen ums Leben gekommene Kreml-Kritiker Alexej Nawalny und seine Frau Julia erhalten in diesem Jahr den Freiheitspreis der Medien. Die Preisverleihung soll nach Angaben der Weimer M… [+1349 chars],,de,'Ukraine'
https://www.telepolis.de/features/Solare-Zukunft-gegen-fossile-Vergangenheit-9677189.html,https://www.telepolis.de/features/Solare-Zukunft-gegen-fossile-Vergangenheit-9677189.html,0,www.telepolis.de,Solare Zukunft gegen fossile Vergangenheit,"Alles Leben verdankt sich der Sonne – auch die Energie, die wir aus Kohle, Gas oder Erdöl gewinnen, ist in Jahrmillionen gespeicherte Sonnenenergie.",https://heise.cloudimg.io/bound/1200x1200/q85.png-lossy-85.webp-lossy-85.foil1/_www-heise-de_/imgs/18/4/5/6/8/4/7/0/shutterstock_2299614357-26cde0a3b7f52b01.jpeg,2024-04-07T05:00:00Z,,"Alte und neue Energiequellen im Hafen von Eemshaven. Bild: Make more Aerials, Shutterstock.com
Alles Leben verdankt sich der Sonne auch die Energie, die wir aus Kohle, Gas oder Erdöl gewinnen, ist i… [+6076 chars]",,de,'Erneuerbare Energien'
https://www.faz.net/aktuell/politik/ukraine-liveticker-ukrainischer-geheimdienst-erwartet-russische-offensive-im-fruehjahr-19030454.html,https://www.faz.net/aktuell/politik/ukraine-liveticker-ukrainischer-geheimdienst-erwartet-russische-offensive-im-fruehjahr-19030454.html,0,www.faz.net,Ukraine-Liveblog: Ukrainischer Geheimdienst erwartet russische Offensive im Frühjahr,Ukraine braucht für vollständigen Schutz 25 Patriot-Abwehrsysteme +++ Ukraine: 17 russischen Drohnen in der Nacht zerstört +++ Selenskyj hofft auf baldigen Friedensgipfel in der Schweiz +++ alle Entwicklungen im Liveblog.,https://media1.faz.net/ppmedia/aktuell/3767247666/1.9636643/facebook_teaser/kyrylo-budanow-chef-des.jpg,2024-04-07T10:01:41Z,,Der vor wenigen Wochen ums Leben gekommene Kreml-Kritiker Alexej Nawalny und seine Frau Julia erhalten in diesem Jahr den Freiheitspreis der Medien. Die Preisverleihung soll nach Angaben der Weimer M… [+1349 chars],,de,'Ukraine'
