index,url,valid,domain,title,description,image,published,archive,content,quote,language,keyword
https://www.morgenpost.de/vermischtes/article242061076/Fast-100-Tote-nach-Schiffsunglueck-in-Mosambik.html,https://www.morgenpost.de/vermischtes/article242061076/Fast-100-Tote-nach-Schiffsunglueck-in-Mosambik.html,0,www.morgenpost.de,Fast 100 Tote nach Schiffsunglück in Mosambik,"Im afrikanischen Mosambik ist die Cholera ausgebrochen. Auf der Flucht vor der bakteriellen Krankheit, die vor allem durch Trinkwasser übertragen wird, sterben viele Menschen.",https://img.sparknews.funkemedien.de/242061074/242061074_1712667863_v16_9_1600.jpeg,2024-04-09T13:02:42Z,,"Maputo. Im afrikanischen Mosambik ist die Cholera ausgebrochen. Auf der Flucht vor der bakteriellen Krankheit, die vor allem durch Trinkwasser übertragen wird, sterben viele Menschen.
Nach dem Unter… [+1321 chars]",,de,'Flucht'
https://www.stern.de/panorama/notfaelle--fast-100-tote-nach-schiffsunglueck-in-mosambik--34613168.html,https://www.stern.de/panorama/notfaelle--fast-100-tote-nach-schiffsunglueck-in-mosambik--34613168.html,0,www.stern.de,Notfälle: Fast 100 Tote nach Schiffsunglück in Mosambik,"Im afrikanischen Mosambik ist die Cholera ausgebrochen. Auf der Flucht vor der bakteriellen Krankheit, die vor allem durch Trinkwasser übertragen wird, sterben viele Menschen.",https://image.stern.de/34613170/t/3M/v1/w1440/r1.7778/-/09--urnnewsmldpacom2009010124040999613116v2w800h600l348t18r1846b1047jpeg---5995d88c47e0e9d8.jpg,2024-04-09T13:02:42Z,,"Im afrikanischen Mosambik ist die Cholera ausgebrochen. Auf der Flucht vor der bakteriellen Krankheit, die vor allem durch Trinkwasser übertragen wird, sterben viele Menschen.
Nach dem Untergang ein… [+1276 chars]",,de,'Flucht'
https://www.faz.net/aktuell/politik/ukraine-liveticker-usa-ausruestung-fuer-hawk-system-fuer-ukraine-faz-19030454.html,https://www.faz.net/aktuell/politik/ukraine-liveticker-usa-ausruestung-fuer-hawk-system-fuer-ukraine-faz-19030454.html,0,www.faz.net,Washington erwägt Hawk-Hilfe für Kiew,Ukraine: Russland hat mehr als 50 Kriegsgefangene erschossen +++ Baerbock fordert weltweite Übersicht über Patriot-Systeme +++ Rheinmetall liefert weitere 20 Schützenpanzer an Ukraine +++ alle Entwicklungen im Liveblog.,https://media0.faz.net/ppmedia/aktuell/sport/289380842/1.9642816/facebook_teaser/italienische-soldaten-neben.jpg,2024-04-09T13:11:07Z,,"Außenministerin Annalena Baerbock hofft, dass es bis zum G-7-Außenministertreffen Klarheit gibt, wer der Ukraine zusätzliche Luftabwehrkapazitäten liefern kann. Russland wolle die Stadt Charkiw ""in G… [+464 chars]",,de,'Russland'
https://www.diepresse.com/18351824/gruppenvergewaltigung-auf-mallorca-vier-italiener-festgenommen,https://www.diepresse.com/18351824/gruppenvergewaltigung-auf-mallorca-vier-italiener-festgenommen,0,www.diepresse.com,Gruppenvergewaltigung auf Mallorca: Vier Italiener festgenommen,Die brasilianische Touristin nahm auf ihrer Flucht einen der Ausweise der Verdächtigen mit. Die Polizei auf Mallorca machte vier Verdächtige ausfindig.,https://img.diepresse.com/public/incoming/ii6r5v-imago-images-0262874810/alternates/DPR_SOCIAL_NACHRICHTEN/imago%20images%200262874810,2024-04-09T14:24:17Z,,"Die brasilianische Touristin nahm auf ihrer Flucht einen der Ausweise der Verdächtigen mit. Die Polizei auf Mallorca machte vier Verdächtige ausfindig.
Auf Mallorca ist erneut eine Frau mutmaßlich v… [+1415 chars]",,de,'Flucht'
https://orf.at/stories/3353992/,https://orf.at/stories/3353992/,0,orf.at,Verletzte bei Explosion in Wasserkraftwerk in Italien,,https://orf.at/mojo/1_4_1/storyserver//news/common/images/og-fallback-news.png,2024-04-09T15:57:39Z,,Bei einer Explosion in einem Wasserkraftwerk an einem Stausee im Norden Italiens sind heute mindestens drei Menschen schwer verletzt worden. Mehrere Arbeiter werden in der Anlage am Stausee von Suvia… [+620 chars],,de,'Explosion'
https://www.zeit.de/news/2024-04/09/strafe-fuer-nawalny-mitarbeiterin-erhoeht,https://www.zeit.de/news/2024-04/09/strafe-fuer-nawalny-mitarbeiterin-erhoeht,0,www.zeit.de,Russland: Strafe für Nawalny-Mitarbeiterin erhöht,Hier finden Sie Informationen zu dem Thema „Russland“. Lesen Sie jetzt „Strafe für Nawalny-Mitarbeiterin erhöht“.,https://img.zeit.de/news/2024-04/09/strafe-fuer-nawalny-mitarbeiterin-erhoeht-image-group/wide__1300x731,2024-04-09T16:06:38Z,,In Russland ist das Urteil gegen eine ehemalige Mitarbeiterin des gestorbenen Kremlgegners Alexej Nawalny um zwei Jahre auf neuneinhalb Jahre Haft im Straflager erhöht worden. Ein Gericht in der Stad… [+1600 chars],,de,'Russland'
https://www.n-tv.de/politik/13-34-Hubschrauberabsturz-auf-der-Krim-Moskau-spricht-von-Technik-Problem--article23143824.html,https://www.n-tv.de/politik/13-34-Hubschrauberabsturz-auf-der-Krim-Moskau-spricht-von-Technik-Problem--article23143824.html,0,www.n-tv.de,Ukraine-Krieg im Liveticker: +++ 13:34 Hubschrauberabsturz auf der Krim: Moskau spricht von Technik-Problem +++,Lesen Sie alle aktuellen Entwicklungen und Nachrichten über den russischen Angriffskrieg auf die Ukraine im Liveticker von ntv.de.,https://bilder2.n-tv.de/img/incoming/crop23332537/9041326157-cImg_16_9-w1200/Liveticker1-grau-1-Kopie.jpg,2024-04-09T22:26:49Z,,Nach Angaben des russischen Verteidigungsministerium soll ein russischer Mi-24-Hubschrauber vor der Küste der Krim ins Schwarze Meer abgestürzt. Das berichtet die staatliche russische Nachrichtenagen… [+18277 chars],,de,'Explosion'
https://www.faz.net/aktuell/politik/ausland/usa-schicken-ukraine-tausende-beschlagnahmte-waffen-19642857.html,https://www.faz.net/aktuell/politik/ausland/usa-schicken-ukraine-tausende-beschlagnahmte-waffen-19642857.html,0,www.faz.net,Die Lage in der Ukraine: USA schicken Tausende beschlagnahmte Waffen in die Ukraine,"Ein milliardenschweres Hilfspaket für die Ukraine steckt derzeit im US-Kongress fest. Doch die Biden-Regierung findet abermals einen anderen Weg, Waffen in das von Russland angegriffene Land zu schicken. Der Überblick.",https://media1.faz.net/ppmedia/aktuell/politik/2796190527/1.9642859/facebook_teaser/soldaten-der-ukrainischen.jpg,2024-04-10T03:18:31Z,,Die US-Regierung hat der von Russland angegriffenen Ukraine eigenen Angaben nach Tausende beschlagnahmte Maschinengewehre aus Iran geschickt. Die Waffen seien vom US-Militär und den Streitkräften von… [+3179 chars],,de,'Waffen'
https://www.faz.net/aktuell/politik/ukraine-liveticker-selenskyj-trump-will-ukraine-besuchen-faz-19030454.html,https://www.faz.net/aktuell/politik/ukraine-liveticker-selenskyj-trump-will-ukraine-besuchen-faz-19030454.html,0,www.faz.net,Selenskyj: Trump will Ukraine besuchen,Washington erwägt Hawk-Hilfe für Kiew +++ Ukraine: Russland hat mehr als 50 Kriegsgefangene erschossen +++ Baerbock fordert weltweite Übersicht über Patriot-Systeme +++ alle Entwicklungen im Liveblog.,https://media1.faz.net/ppmedia/aktuell/2844310609/1.9643025/facebook_teaser/selenskyj-und-trump-bei-einem.jpg,2024-04-10T04:37:30Z,,"Außenministerin Annalena Baerbock hofft, dass es bis zum G-7-Außenministertreffen Klarheit gibt, wer der Ukraine zusätzliche Luftabwehrkapazitäten liefern kann. Russland wolle die Stadt Charkiw ""in G… [+464 chars]",,de,'Ukraine'
https://www.zeit.de/politik/ausland/2024-04/ukraine-krieg-russland-usa-waffen-iran-unterstuetzung,https://www.zeit.de/politik/ausland/2024-04/ukraine-krieg-russland-usa-waffen-iran-unterstuetzung,0,www.zeit.de,Krieg in der Ukraine: USA schicken beschlagnahmte Waffen aus dem Iran in die Ukraine,"5.000 Sturmgewehre, 500.000 Schuss Munition: Die US-Regierung hat der Ukraine beschlagnahmte Waffen überlassen. Der Iran soll sie für die Huthi-Rebellen verschickt haben.",https://img.zeit.de/politik/ausland/2024-04/usa-schicken-tausende-beschlagnahmte-waffen-in-ukraine-bild/wide__1300x731,2024-04-10T06:27:51Z,,"Die US-Regierung hat der Ukraine
 eigenen Angaben zufolge Tausende beschlagnahmte Maschinengewehre aus dem 
Iran geschickt. Das US-Militär und Verbündete hatten die Waffen auf vier Schiffen ohne Fl… [+2265 chars]",,de,'Ukraine'
https://www.zeit.de/wirtschaft/2024-04/regierung-deutschland-ruestung-exporte-milliarden-ukraine-israel,https://www.zeit.de/wirtschaft/2024-04/regierung-deutschland-ruestung-exporte-milliarden-ukraine-israel,0,www.zeit.de,"Quartalsbilanz: Deutschland genehmigt Rüstungsexporte für 4,9 Milliarden Euro","Rekordquartal für Rüstungsexporte: 4,9 Milliarden Euro an Rüstungsgütern fürs Ausland hat die Regierung im ersten Quartal zugestimmt. Der Großteil ging an die Ukraine.",https://img.zeit.de/politik/deutschland/2024-04/regierung-genehmigt-im-ersten-quartal-ruestungsexporte-bild/wide__1300x731,2024-04-10T09:53:55Z,,"Die Bundesregierung hat im ersten Quartal 2024 Rüstungsexporte
 im Wert von knapp 4,9 Milliarden Euro genehmigt und damit noch mehr als im Jahr zuvor. Das geht aus einer Antwort des Wirtschaftsminis… [+2831 chars]",,de,'Ukraine'
https://www.golem.de/sonstiges/zustimmung/auswahl.html?from=https://www.golem.de/news/undurchsichtige-lieferkette-wie-kommt-russland-an-starlink-terminals-2404-184003.html&referer=https://t.co/a3f78673d4,https://www.golem.de/sonstiges/zustimmung/auswahl.html?from=https://www.golem.de/news/undurchsichtige-lieferkette-wie-kommt-russland-an-starlink-terminals-2404-184003.html&referer=https://t.co/a3f78673d4,0,www.golem.de,Undurchsichtige Lieferkette: Wie kommt Russland an Starlink-Terminals?,"Starlink-Terminals sind in die Hände der Russen in der Ukraine und paramilitärischer Kräfte im Sudan gelangt. Das Wall Street Journal hat nachgeforscht, wie das trotz Verkaufsverbot sein kann. (Starlink, Politik)",,2024-04-10T09:58:01Z,,"Besuchen Sie Golem.de wie gewohnt mit Werbung und Tracking,
 indem Sie der Nutzung aller Cookies zustimmen.
 Details zum Tracking finden Sie im Privacy Center.
Skript wurde nicht geladen. Informat… [+607 chars]",,de,'Ukraine'
https://www.focus.de/finanzen/news/olivenoel-kaffee-o-saft-fuer-bestimmte-lebensmittel-muessen-sie-weiter-tief-in-die-tasche-greifen_id_259839188.html,https://www.focus.de/finanzen/news/olivenoel-kaffee-o-saft-fuer-bestimmte-lebensmittel-muessen-sie-weiter-tief-in-die-tasche-greifen_id_259839188.html,0,www.focus.de,"Olivenöl, Kaffee, O-Saft - Für bestimmte Lebensmittel müssen Sie weiter tief in die Tasche greifen","Während die Inflationsraten zuletzt sanken, verharren manche Lebensmittelpreise auf besonders hohem Niveau. Verbraucher müssen sich wohl auf weiterhin hohe Preise bei beliebten Produkten einstellen.",https://p6.focus.de/img/digital/id_259839187/lebensmittelpreise-steigen-weiter-deshalb-werden-bestimmte-produkte-noch-teurer.jpg?im=Crop%3D%280%2C60%2C1920%2C960%29%3BResize%3D%281200%2C627%29&impolicy=perceptual&quality=mediumHigh&hash=e2143739643c1dd14bf8fb9f8da1d02489645f34dd35c585f92d16b0a31790f6,2024-04-10T10:25:11Z,,"Während die Inflationsraten zuletzt sanken, verharren manche Lebensmittelpreise auf besonders hohem Niveau. Verbraucher müssen sich wohl auf weiterhin hohe Preise bei beliebten Produkten einstellen.D… [+1839 chars]",,de,'Ukraine'
https://www.stern.de/news/bundeskabinett-beschliesst-15-punkte-plan-zum-wiederaufbau-der-ukraine-34615434.html,https://www.stern.de/news/bundeskabinett-beschliesst-15-punkte-plan-zum-wiederaufbau-der-ukraine-34615434.html,0,www.stern.de,Bundeskabinett beschließt 15-Punkte-Plan zum Wiederaufbau der Ukraine,"Das Bundeskabinett hat einen 15-Punkte-Plan zum wirtschaftlichen Wiederaufbau der Ukraine beschlossen. Perspektivisch gehe es um eine Förderinstitution nach dem Vorbild der deutschen KfW, teilten das Entwicklungsministerium und das Bundeswirtschaftsministeriu…",https://image.stern.de/34615436/t/Xj/v1/w1440/r1.7778/-/10--ein-zerstoertes-wohngebiet-in-kiew---41005bc4b6f7953b.jpg,2024-04-10T10:31:01Z,,"Das Bundeskabinett hat einen 15-Punkte-Plan zum wirtschaftlichen Wiederaufbau der Ukraine beschlossen. Perspektivisch gehe es um eine Förderinstitution nach dem Vorbild der deutschen KfW, teilten das… [+2355 chars]",,de,'Ukraine'
https://www.tagesspiegel.de/internationales/beschlagnahmte-waffen-aus-dem-iran-usa-liefern-der-ukraine-fur-kampf-gegen-russland-tausende-gewehre-11492099.html,https://www.tagesspiegel.de/internationales/beschlagnahmte-waffen-aus-dem-iran-usa-liefern-der-ukraine-fur-kampf-gegen-russland-tausende-gewehre-11492099.html,0,www.tagesspiegel.de,Beschlagnahmte Waffen aus dem Iran: USA liefern der Ukraine für Kampf gegen Russland Tausende Gewehre,Washington hat der von Russland angegriffenen Ukraine eigenen Angaben zufolge Waffen und Munition geschickt. Diese seien im Arabischen Meer zwischen Iran und Jemen beschlagnahmt worden.,https://www.tagesspiegel.de/images/usa-schicken-tausende-beschlagnahmte-waffen-in-die-ukraine/alternates/BASE_16_9_W1400/usa-schicken-tausende-beschlagnahmte-waffen-in-die-ukraine.jpeg,2024-04-10T10:47:11Z,,"Wichtige Militärhilfen für Kiew sind in den USA in der Schwebe, Washington liefert aber dennoch Waffen: Die US-Regierung hat der Ukraine nach eigenen Angaben tausende Gewehre geschickt. Die Waffen se… [+1900 chars]",,de,'Ukraine'
https://www.diepresse.com/18353988/usa-billigen-kriegsmaterialverkauf-an-kiew,https://www.diepresse.com/18353988/usa-billigen-kriegsmaterialverkauf-an-kiew,0,www.diepresse.com,USA billigen Kriegsmaterialverkauf an Kiew,Die USA verkaufen Militärausrüstung im Wert von 138 Millionen Dollar an die Ukraine. Das Material sei wichtig für den Schutz von Bevölkerung und Infrastruktur.,https://img.diepresse.com/public/incoming/3g66cu-TOPSHOT-UKRAINE-RUSSIA-CONFLICT-WAR/alternates/DPR_SOCIAL_NACHRICHTEN/TOPSHOT-UKRAINE-RUSSIA-CONFLICT-WAR,2024-04-10T11:00:09Z,,"Die USA verkaufen Militärausrüstung im Wert von 138 Millionen Dollar an die Ukraine. Das Material sei wichtig für den Schutz von Bevölkerung und Infrastruktur.
Die US-Regierung hat den Verkauf dring… [+1569 chars]",,de,'Ukraine'
https://orf.at/stories/3354063/,https://orf.at/stories/3354063/,0,orf.at,FPÖ relativiert Freundschaftsvertrag mit Putin-Partei,,https://orf.at/mojo/1_4_1/storyserver//news/common/images/og-fallback-news.png,2024-04-10T11:08:07Z,,Die FPÖ hat heute den 2016 mit der Putin-Partei Geeintes Russland geschlossenen Freundschaftsvertrag relativiert. Man wolle angesichts der Anschuldigungen gegenüber der FPÖ (im Rahmen der Spionageaff… [+2649 chars],,de,'Ukraine'
https://www.diepresse.com/18354025/rot-weiss-rot-karte-plus-steht-kuenftig-ukraine-fluechtlingen-offen,https://www.diepresse.com/18354025/rot-weiss-rot-karte-plus-steht-kuenftig-ukraine-fluechtlingen-offen,0,www.diepresse.com,Rot-Weiß-Rot-Karte plus steht künftig Ukraine-Flüchtlingen offen,Auch nach Auslaufen der aktuellen EU-Regelung soll für Vertriebenen aus der Ukraine ein freier Arbeitsmarktzugang bestehen.,https://img.diepresse.com/public/incoming/48wjgf-20230426-Ministerrat-WIEN-OESTERREICH-26.-APRIL-Minister-fuer-Digitalisierung-und-Wirtschaftsstandort-Martin-Kocher/alternates/DPR_SOCIAL_NACHRICHTEN/20230426%20Ministerrat%20WIEN%2C%20OESTERREICH%20-%2026.%20APRIL%3A%20Minister%20fuer%20Digitalisierung%20und%20Wirtschaftsstandort%20Martin%20Kocher%20,2024-04-10T11:14:00Z,,"Auch nach Auslaufen der aktuellen EU-Regelung soll für Vertriebenen aus der Ukraine ein freier Arbeitsmarktzugang bestehen.
Die so genannte Rot-Weiß-Rot-Karte plus wird für Vertriebene aus der Ukrai… [+2771 chars]",,de,'Ukraine'
https://www.welt.de/politik/deutschland/video250961416/Annalena-Baerbock-Jeder-Sack-Mehl-jeder-Liter-Wasser-jede-einzelne-befreite-Geisel-zaehlt.html,https://www.welt.de/politik/deutschland/video250961416/Annalena-Baerbock-Jeder-Sack-Mehl-jeder-Liter-Wasser-jede-einzelne-befreite-Geisel-zaehlt.html,0,www.welt.de,"„Jeder Sack Mehl, jeder Liter Wasser, jede einzelne befreite Geisel zählt“",Im Bundestag stellte sich Außenministerin Annalena Baerbock (Grüne) den Fragen der Abgeordneten. Dabei ging vor allem um die Unterstützung der Ukraine gegen den russischen Angriffskrieg sowie die Lage in Israel und im Gazastreifen.,https://img.welt.de/img/politik/deutschland/mobile250961506/1001351657-ci16x9-w1200/dpa-5FB114003B69A0DF-jpg.jpg,2024-04-10T11:33:51Z,,"Die WELT als ePaper: Die vollständige Ausgabe steht Ihnen bereits am Vorabend zur Verfügung so sind Sie immer hochaktuell informiert. Weitere Informationen: http://epaper.welt.de 
 Der Kurz-Link die… [+49 chars]",,de,'Ukraine'
https://www.bild.de/bild-plus/politik/ausland/politik-ausland/im-ukraine-einsatz-putins-panzer-schildkroete-schockt-experten-87819616.bild.html,https://www.bild.de/bild-plus/politik/ausland/politik-ausland/im-ukraine-einsatz-putins-panzer-schildkroete-schockt-experten-87819616.bild.html,0,www.bild.de,*** BILDplus Inhalt *** Verrückte Ingenieurskunst - Putins „Panzer-Schildkröte“ schockt Experten,Was ist denn das für ein Ungetüm? Für ihre Eroberung der Ukraine haben russische Armee-Ingenieure ein wahres Monstrum von Panzer geschaffen.,"https://images.bild.de/6614f992a6af202345f000e1/ccb4a516190eb83aab9aa6124354f138,37f1d2f0?w=1280",2024-04-10T11:53:54Z,,"Was ist denn das für ein Ungetüm? Für ihre Eroberung der Ukraine haben russische Armee-Ingenieure ihr Bestes gegeben und ein wahres Monstrum von Panzer geschaffen.
Auf ukrainischen und russischen Vi… [+279 chars]",,de,'Ukraine'
https://futurezone.at/digital-life/ukraine-russland-panzer-t-72-zar-signal-jamming-drohnen-ukraine-krieg/402852007,https://futurezone.at/digital-life/ukraine-russland-panzer-t-72-zar-signal-jamming-drohnen-ukraine-krieg/402852007,0,futurezone.at,Ukraine erbeutet Russlands Antidrohnen-Panzer T-72 “Zar”,"Russland setzt alles daran, ukrainische Drohnen zu stören. Dazu werden auch T-72 Kampfpanzer mit Jammern ""gekrönt"".",https://image.futurezone.at/images/facebook/8649634/gkjxosdxiaajl8a.png,2024-04-10T12:00:09Z,,"10.04.2024
Russland setzt alles daran, ukrainische Drohnen zu stören. Dazu werden auch T-72 Kampfpanzer mit Jammern ""gekrönt"".
In Kriegszeiten ist Improvisation gefragt.
© Telegram",,de,'Ukraine'
https://www.faz.net/aktuell/politik/ukraine-liveticker-bundesregierung-beschliesst-15-punkte-plan-fuer-ukraine-faz-19030454.html,https://www.faz.net/aktuell/politik/ukraine-liveticker-bundesregierung-beschliesst-15-punkte-plan-fuer-ukraine-faz-19030454.html,0,www.faz.net,Bundesregierung beschließt 15-Punkte-Plan für Ukraine,EU-Gericht kippt Sanktionen gegen russische Oligarchen  +++ Selenskyj: Trump will Ukraine besuchen +++ Washington erwägt Hawk-Hilfe für Kiew +++  alle Entwicklungen im Liveblog.,https://media0.faz.net/ppmedia/aktuell/politik/220658568/1.9643868/facebook_teaser/entwicklungsministerin-svenja.jpg,2024-04-10T12:06:24Z,,"Außenministerin Annalena Baerbock hofft, dass es bis zum G-7-Außenministertreffen Klarheit gibt, wer der Ukraine zusätzliche Luftabwehrkapazitäten liefern kann. Russland wolle die Stadt Charkiw ""in G… [+464 chars]",,de,'Ukraine'
https://www.faz.net/aktuell/politik/ukraine-liveticker-ukraine-meldet-raketenangriffe-auf-infrastruktur-in-charkiw-faz-19030454.html,https://www.faz.net/aktuell/politik/ukraine-liveticker-ukraine-meldet-raketenangriffe-auf-infrastruktur-in-charkiw-faz-19030454.html,0,www.faz.net,Ukraine meldet Raketenangriffe auf Infrastruktur in Charkiw,Bundesregierung beschließt 15-Punkte-Plan für Ukraine +++ EU-Gericht kippt Sanktionen gegen russische Oligarchen +++ Selenskyj: Trump will Ukraine besuchen +++ alle Entwicklungen im Liveblog.,https://media0.faz.net/ppmedia/aktuell/politik/3595346615/1.9645494/facebook_teaser/feuer-nach-einem-russischen.jpg,2024-04-10T12:06:24Z,,"In der Ukraine dürfen womöglich bald verurteilte Straftäter im Militär dienen. Das Parlament hat in erster Lesung einer entsprechenden Gesetzesvorlage zugestimmt. Diese sieht vor, dass für Gefängnisi… [+444 chars]",,de,'Ukraine'
https://www.zeit.de/hamburg/2024-04/claudia-bauer-regisseurin-theater-komoedie-donald-trump-wladimir-putin,https://www.zeit.de/hamburg/2024-04/claudia-bauer-regisseurin-theater-komoedie-donald-trump-wladimir-putin,0,www.zeit.de,"Regisseurin Claudia Bauer: ""Wir können die Welt nicht ganz retten, sondern nur Teile davon""","Kann man über die Gegenwart noch lachen? Unbedingt, sagt die Regisseurin Claudia Bauer – und inszeniert in Hamburg eine Komödie über Trump und Putin.",https://img.zeit.de/hamburg/2024-04/claudia-bauer-regisseurin-theater-komoedie-donald-trump-wladimir-putin-portrait/wide__1300x731,2024-04-10T14:52:44Z,,"Die Regisseurin Claudia Bauer, geboren 1966 in Landshut, leitete schon das Theaterhaus in Jena und inszeniert regelmäßig am Schauspiel Frankfurt, am Münchner Residenztheater und am Volkstheater Wien.… [+333 chars]",,de,'Putin'
https://www.bild.de/politik/inland/politik-inland/abgeordnete-aus-sachsen-anhalt-abgesagte-politiker-reise-kostet-28-000-euro-87830188.bild.html,https://www.bild.de/politik/inland/politik-inland/abgeordnete-aus-sachsen-anhalt-abgesagte-politiker-reise-kostet-28-000-euro-87830188.bild.html,0,www.bild.de,Abgeordnete aus Sachsen-Anhalt - Abgesagte Politiker-Reise kostet 28 000 Euro,"28 000 Euro Storno-Kosten, weil Abgeordnete aus dem Landtag von Sachsen-Anhalt nicht nach Spanien flogen.","https://images.bild.de/66167891c3c53579e18b4d69/44d78a4030b26c03b74792dfe566cb87,50db37d0?w=1280",2024-04-10T15:01:12Z,,"Auch eine abgesagte Reise kann teuer werden. Schätzungsweise 28 000 Euro kostet ein kurzfristig stornierter Trip von Landtagsabgeordneten aus Sachsen-Anhalt. 
Die 15 Mitglieder des Ausschusses für L… [+2353 chars]",,de,'Kosten'
https://www.tagesspiegel.de/internationales/ukraine-invasion-tag-777-warum-drohnen-von-us-start-ups-keine-grosse-hilfe-fur-kiew-sind-11496389.html,https://www.tagesspiegel.de/internationales/ukraine-invasion-tag-777-warum-drohnen-von-us-start-ups-keine-grosse-hilfe-fur-kiew-sind-11496389.html,0,www.tagesspiegel.de,Ukraine-Invasion Tag 777: Warum Drohnen von US-Start-Ups keine große Hilfe für Kiew sind,"USA liefern der Ukraine beschlagnahmte Waffen aus Iran, Ukraine will wohl verurteilte Straftäter in die Armee aufnehmen. Der Nachrichtenüberblick am Abend.",https://www.tagesspiegel.de/images/imago0441262197hjpg/alternates/BASE_16_9_W1400/imago0441262197hjpg.jpeg,2024-04-10T16:12:17Z,,"Dass Drohnen im russischen Angriffskrieg gegen die Ukraine auf beiden Seiten eine wichtige Rolle spielen, darüber haben wir an dieser Stelle schon oft geschrieben. Unterstützung auf diesem Feld gibt … [+5776 chars]",,de,'Teuer'
https://www.n-tv.de/politik/Russland-hat-seine-Strategie-veraendert-article24864018.html,https://www.n-tv.de/politik/Russland-hat-seine-Strategie-veraendert-article24864018.html,0,www.n-tv.de,Angriffe auf Kraftwerke: Russland hat seine Strategie verändert,"Die Russen beschießen in der Ukraine nicht mehr Umspannwerke und Transformatoren im ganzen Land, sondern Kraftwerke in Regionen, die schlechter mit Flugabwehrsystemen ausgestattet sind. Das Vorgehen könnte gefährlicher sein als die Bombenoffensive im ersten K…",https://bilder4.n-tv.de/img/incoming/crop24864023/1481323522-cImg_16_9-w1200/d716cf77e63f77321840370489afa8b0.jpg,2024-04-10T16:47:31Z,,"Die Russen beschießen in der Ukraine nicht mehr Umspannwerke und Transformatoren im ganzen Land, sondern Kraftwerke in Regionen, die schlechter mit Flugabwehrsystemen ausgestattet sind. Das Vorgehen … [+6950 chars]",,de,'Ukraine'
https://www.golem.de/sonstiges/zustimmung/auswahl.html?from=https://www.golem.de/news/elektronische-kriegsfuehrung-us-drohnen-enttaeuschen-in-der-ukraine-2404-184044.html&referer=https://t.co/97e8744e3d,https://www.golem.de/sonstiges/zustimmung/auswahl.html?from=https://www.golem.de/news/elektronische-kriegsfuehrung-us-drohnen-enttaeuschen-in-der-ukraine-2404-184044.html&referer=https://t.co/97e8744e3d,0,www.golem.de,Elektronische Kriegsführung: US-Drohnen enttäuschen in der Ukraine,"Amerikanische Drohnen scheitern in der Ukraine: Die Hersteller haben Mühe, die elektronische Kriegsführung der Russen zu kontern. (Drohne, Politik)",,2024-04-11T07:55:02Z,,"Besuchen Sie Golem.de wie gewohnt mit Werbung und Tracking,
 indem Sie der Nutzung aller Cookies zustimmen.
 Details zum Tracking finden Sie im Privacy Center.
Skript wurde nicht geladen. Informat… [+607 chars]",,de,'Ukraine'
https://www.stern.de/news/ukraine--parlament-stimmt-fuer-umstrittenes-gesetz-zur-mobilisierung-von-soldaten-34619690.html,https://www.stern.de/news/ukraine--parlament-stimmt-fuer-umstrittenes-gesetz-zur-mobilisierung-von-soldaten-34619690.html,0,www.stern.de,Ukraine: Parlament stimmt für umstrittenes Gesetz zur Mobilisierung von Soldaten,"Inmitten anhaltender russischer Angriffe auf die ukrainische Energie-Infrastruktur hat das Parlament in Kiew ein umstrittenes Gesetz zur Mobilisierung von Soldaten verabschiedet. ""Der Gesetzentwurf zur Mobilisierung wurde als Ganzes angenommen"", erklärte der …",https://image.stern.de/34619692/t/m4/v1/w1440/r1.7778/-/11--ukrainische-soldaten-bei-einer-uebung-in-polen---936683a37aa142d1.jpg,2024-04-11T12:46:40Z,,"Inmitten anhaltender russischer Angriffe auf die ukrainische Energie-Infrastruktur hat das Parlament in Kiew ein umstrittenes Gesetz zur Mobilisierung von Soldaten verabschiedet. ""Der Gesetzentwurf z… [+3743 chars]",,de,'Ukraine'
